title,intro,order,votes,comensales,duración,para,dificultad,coste,types,ingredientes,url
SALCHICHAS a la CERVEZA,"Salchichas en salsa de cerveza, un plato sencillo y muy rico. Este es uno de esos platos que podemos preparar con antelación e incluso de un día para otro, puesto que pasadas unas horas está todavía más bueno. Se trata de una receta sencilla con ingredientes muy básicos, que vale tanto como plato principal como acompañamiento de arroz, verduras, un puré de patatas o patatas fritas. También para una cena es ideal acompañado con una ensalada.Las salchichas las podemos encontrar de cerdo o de pollo, las dos son buenas y nos valen para esta receta. Por otro lado, la salsita hecha con cerveza queda deliciosa y perfecta para mojar pan. Es importante aclarar que, aunque lleva cerveza la salsa, al cocinarse se evapora el alcohol, por lo que también pueden comerla los niños. No obstante, siempre puedes usar cerveza sin alcohol. Sin más preámbulos, vamos con el paso a paso que compartimos en RecetasGratis para saber cómo hacer salchichas a la cerveza.","['1\nDeja listos los ingredientes que vas a utilizar. Puedes hacer las salchichas a la cerveza negra o rubia, con o sin alcohol.', '2\nPon una sartén a fuego fuerte con un buen chorro de aceite. Cuando esté caliente, dora las salchichas por fuera y retíralas. De esta forma, quedarán selladas por fuera y jugosas por dentro.Lo ideal es hacer salchichas frescas a la cerveza porque quedan mucho más jugosas y crujientes por fuera, pero si solo tienes congeladas, puedes seguir las mismas instrucciones siempre y cuando las hayas descongelado por completo antes.', '3\nPela y pica la cebolla en juliana o en cubos pequeños si te gusta más.', '4\nEn la misma sartén donde has dorado las salchichas, añade un poco más de aceite y cocina la cebolla. Póchala a fuego medio hasta que quede bien transparente y coja un poquito de color. Cuando veas que está la cebolla doradita, añade una cucharada de harina y remueve para que se cocine.', '5\nVierte la cerveza en la cazuela y deja la preparación al fuego durante un par de minutos para que se evapore el alcohol. Aunque uses cerveza sin alcohol, deja la salsa esos 2 minutos para que espese.', '6\nAñade una hoja de laurel, un poco de pimienta, sal y un vaso pequeño de agua o caldo de pollo o verduras. También puedes añadir simplemente una pastilla de caldo de pollo o de verduras si quieres potenciar el sabor de las salchichas a la cerveza pero no tienes tiempo de preparar un caldo más elaborado. Remueve.', '7\nAñade a la salsa las salchichas y deja que se cocine todo junto durante 15 minutos. Si ves que la salsa necesita un poco de agua ve añadiendo poco a poco. También se le puede añadir un poco de caldo.', '8\nUna vez que estén las salchichas hechas y la salsa en su punto, prueba de sal y pimienta y rectifica si lo consideras oportuno. La salsa queda muy buena, pero si no te gusta encontrar la cebolla en trozos, o a los niños, se puede triturar. No lo dudes, anímate a preparar esta receta de salchichas a la cerveza y cuéntanos qué te ha parecido. Puede servir este plato con un poco de arroz hervido o patatas paja, especialmente a los niños les encantará esta segunda opción.']",,4 comensales,45m,Plato principal,Dificultad baja,,[],"['12 salchichas', '2 cebollas', '150 mililitros de cerveza negra o rubia', '1 vaso de agua', '1 hoja de laurel', '1 puñado de tomillo o romero fresco o seco', '1 pizca de pimienta', '1 cucharada sopera de harina de trigo', '1 chorro de aceite de oliva', '1 pizca de sal']",https://www.recetasgratis.net/receta-de-salchichas-a-la-cerveza-74149.html
¡Riquísima Receta Costarricense!,"El chifrijo es un platillo costarricense creado en los años noventa. Su origen se da en los bares y cantinas de la capital San José de Costa Rica, mientras que su nombre proviene de la combinación de sus principales ingredientes: chicharrones y frijoles. Este plato tradicional es un producto del mestizaje de los productos originarios de la América Central con los traídos por los europeos.Además, la mezcla de los frijoles con chicharrones tiene muchas variantes de salsas y acompañamientos que puedes encontrar de acuerdo a la región donde se prepare. Sea que lo consumas como plato principal o como aperitivo para picar, esta receta de chifrijo te encantará, así que sigue leyendo y descubre cómo hacer chifrijo en RecetasGratis.","['1\nRemoja los frijoles por 12 horas. Escúrrelos y colócalos en una olla a presión (o con tapa bien firme que no deje salir el vapor). Cúbrelos con agua y agrega 2 cucharadas de aceite de oliva, cilantro, 1 cebolleta picada, los dientes de ajo enteros sin pelar y la mitad del pimiento rojo.\nTruco: En este caso hemos utilizado frijoles negros, pero puedes utilizar rojos o blancos.', '2\nCalienta a fuego lento y mezcla los ingredientes por 5 minutos. Coloca la tapa de la olla y cocina a fuego medio por 45 minutos. Ve revisando la cocción de los frijoles. Si ves que los frijoles aún no están tiernos, continúa cocinándolos por 15 minutos más con la olla tapada.', '3\nMientras tanto, realiza el sofrito del chifrijo en una sartén con el aceite de oliva restante, el ajo triturado, el cebollín restante y el resto del pimiento. Añade sal y pimienta al gusto.', '4\nAgrega el sofrito a la olla cuando los frijoles estén cocidos y cocina a fuego lento durante 15 minutos más.', '5\nPara preparar el cerdo, mezcla sal, pimienta, pimentón, tomillo y orégano. Cubre los trozos de cerdo con la mezcla.', '6\nDora en aceite los trozos de cerdo sin que la cocción llegue a secarlos. Al quitarlos de la cocción colócalos en un plato con toallas de papel para que absorba el exceso de aceite. \nTruco: Si notas que el cerdo se está secando, agrégale agua de a poquito para hidratarlo, pero sin pasarte.', '7\nSirve los frijoles junto con los chicharrones de cerdo en un plato de sopa. Puedes agregarle arroz y pico de gallo para saborear lo mejor de este gustoso chifrijo costarricense.']",Valoración: 5 (1 voto),8 comensales,3h,,Dificultad baja,,[],"['500 gramos de frijoles cubaces', '2 tallos de cilantro', '2 cebolletas picadas', '1 pimiento rojo picado finamente', '4 dientes de ajo con piel', '2 dientes de ajo triturado', '5 cucharadas soperas de aceite de oliva', 'Sal al gusto', 'Pimienta al gusto', '500 gramos de chicharrones de cerdo', '1 cucharada sopera de pimentón', '1 cucharada sopera de chile en polvo', '1 cucharadita de tomillo', '1 cucharada sopera de orégano', '2 cucharadas soperas de agua', '5 cucharadas soperas de aceite', 'Sal al gusto', 'Pimienta al gusto']",https://www.recetasgratis.net/receta-de-chifrijo-74123.html
Mollejas de Cordero en Salsa,"Las mollejas de cordero, con su suave y característico sabor, son una de las joyas de la cocina. Son muy versátiles al cocinar, pues se pueden preparar de muchas formas y acompañarlas con un sinfín de guarniciones. En este caso, en RecetasGratis te compartimos esta receta de mollejas de cordero en salsa. Podrás servirlas como acompañante de otros platos o como comida principal. Al preparar las mollejas, lo importante es que queden bien tiernas por dentro y crocantes por fuera. De esta forma, podrás conquistar los paladares más complejos y exigentes con un corte de la carne que no se utiliza frecuentemente. Descubre cómo hacer mollejas de cordero en salsa exquisita y cuéntanos cómo te queda.","['1\nLimpia la mollejas de cordero. Quítales toda la grasa o la tela que tengan, ya que de lo contrario endurecerán la cocción.', '2\nEn una olla con abundante agua hirviendo, blanquea las mollejas por aproximadamente 5 minutos. Sácalas y resérvalas.', '3\nCorta los pimientos rojos y el tomate en cubos pequeños. Corta la cebolla en fina juliana.', '4\nEn una sartén caliente con un poco de aceite, sella las mollejas.', '5\nCuando las mollejas estén doradas de ambos lados, retíralas del fuego y resérvalas en un plato. La idea es que queden tiernas por dentro y crujientes por fuera.', '6\nEn la misma sartén y aprovechando los jugos del sellado de las mollejas, agrega los vegetales cortados. Salpimienta.', '7\nCuando los vegetales estén tiernos, agrega el vaso de vino blanco y deja evaporar el alcohol y reducir los líquidos.', '8\nAñade una vez más las mollejas e integra los distintos ingredientes. Agrega el pimiento en polvo de último, para no cocinarlo tanto y evitar que se queme.', '9\nEmplata las mollejas de cordero en salsa y báñalas con los vegetales y la salsa. ¡Disfruta!']",,4 comensales,30m,,Dificultad baja,,[],"['800 gramos de mollejas de cordero', '2 pimientos rojos', '1 cebolla', '2 tomates', '50 gramos de pimiento rojo o paprika', '1 vaso de vino blanco', 'Aceite', 'Sal al gusto', 'Pimienta al gusto']",https://www.recetasgratis.net/receta-de-mollejas-de-cordero-en-salsa-74099.html
arroz con carne Molida,"Existen comidas simples que, a pesar de que podemos preparar sin muchas complicaciones, gozan de ese cálido sabor de hogar que nos encanta. Esta receta de arroz con carne molida que compartimos en RecetasGratis es un ejemplo perfecto. Con pocos ingredientes y con mucho amor, lograrás un guiso con arroz que encantará a todos en casa. Le hemos agregado frijoles como ingrediente extra, pero realmente puedes prescindir de ellos y añadir, en cambio, otras verduras que te gusten como las papas y las zanahorias.Para aprender cómo hacer arroz con carne molida, solo necesitará seguir nuestros simples pasos y voilà, ¡tendrás una deliciosa comida que nunca te fallará o dejará mal!","['1\nPica la cebolla en pedacitos pequeños y haz lo mismo con el pimentón y el ajo.', '2\nCondimenta la carne con sal y pimienta al gusto. Pon aceite en una sartén y, cuando esté caliente, agrega la cebolla, el ajo y el pimentón, deja sofreír unos 5 minutos.', '3\nAñade la carne molida a la sartén y déjala cocinar por unos 5 minutos más.\nTruco: Puedes usar carne mixta de cerdo y ternera, pues tiene más sabor.', '4\nAñade el tomate triturado, los frijoles y el perejil. Mezcla todos los ingredientes y deja cocinando por unos 20 minutos más a fuego medio-bajo.\nTruco: Si gustas, también puedes añadir un vaso de vinotinto.', '5\nCuando esté listo, sirve junto al arroz cocido y disfruta de un delicioso plato de arroz con carne molida.']","Valoración: 4,7 (3 votos)",4 comensales,45m,,Dificultad baja,,[],"['1 taza de arroz cocido (175 gramos)', '250 gramos de carne molida o picada', '250 gramos de tomate triturado', '200 gramos de frijoles precocidos', '1 cebolla', '1 pimentón', 'Aceite vegetal', '1 rama de perejil', 'Sal y pimienta al gusto', '1 ajo']",https://www.recetasgratis.net/receta-de-arroz-con-carne-molida-74041.html
CHINCHULINES al Horno,"Esta receta de chinchulines al horno que compartimos en RecetasGratis es una forma muy sencilla y deliciosa de cocinar chinchulines. Los chinchulines, conocidos en otros países como chunchullo, chinchurria o chunchule, corresponden al intestino delgado de la res. Se pueden hacer fritos, a la parrilla, a la plancha, rellenos o al horno. Cocinados de esta última manera quedan exquisitos, crocantes por fuera y bien dorados, pero jugosos por dentro. Esta achura (víscera) es muy económica y posee un sabor muy característico y sabroso, por ello es tan habitual encontrarla en los recetarios de los hogares, siendo uno de esos platos argentinos de mucha tradición.Si bien es cierto que limpiar los chinchulines es un proceso laborioso, el resultado es excelente y, por ello, vale la pena elaborar esta receta. Como guarnición, proponemos cocinar unas verduras y patatas, materias primas que todos podemos tener en casa y son de fácil acceso. Sigue leyendo y descubre con nosotros cómo hacer chinchulines al horno para disfrutar de este increíble plato.","['1\nDesgrasa los chinchulines y colócalos en un recipiente. Vierte leche hasta cubrirlos por completo y resérvalos en el frigorífico durante 2 horas aproximadamente.\nTruco: En caso de de no tener leche, se puede usar agua con unas gotas de vinagre.', '2\nPasadas las horas de reposo, enjuaga los chinchulines bajo el grifo y ponlos sobre una bandeja de horno con un poco de aceite. Salpimienta al gusto y hornea los chinchulines con el horno ya caliente a 180 ºC.', '3\nPasados unos 20 minutos de cocción, saca la bandeja del horno y dales la vuelta para logra un dorado parejo. Vuelve a introducir los chinchulines al horno para cocinarlos por este otro lado otros 20 minutos.', '4\nMientras se cocinan los chinchulines asados, pela y corta las zanahorias a lo largo y pica los puerros.', '5\nEn una sartén caliente con un poco de aceite, saltea las zanahorias. Pasados unos minutos, vierte agua o caldo de verduras hasta cubrirlas por completo. Deja que se cocinen hasta que el líquido reduzca.', '6\nCuando se haya reducido el liquido, las zanahorias estén tiernas y comiencen a dorarse, agrega los puerros y satléalos durante un par de minutos. Pasados estos minutos, vierte el vino blanco, mezcla y deja que se evapore el alcohol.', '7\nIncorpora la crema y sigue cocinando durante unos minutos más la guarnición que acompañará a los chinchulines.', '8\nCuando los chinchulines asados estén listos, retíralos del horno y rocía por encima el jugo del limón.', '9\nSirve los chinchulines al horno con la guarnición de verduras preparada anteriormente y la salsa que ha quedado en la sartén. Como ves, hacer chinchulines es sencillo, lo más complicado reside en la limpieza de la carne antes de cocinarla.']",,4 comensales,2h 30m,Plato principal,Dificultad media,,"['Recetas al horno', 'Recetas argentinas']","['1,4 kilogramos de chinchulines', 'Leche (cantidad necesaria)', '4 zanahorias', '2 puerros', '100 gramos de crema', '1 vaso de vino blanco', '1 limón', '1 pizca de sal', '1 pizca de pimienta']",https://www.recetasgratis.net/receta-de-chinchulines-al-horno-74038.html
Callos a la Madrileña,"Callos a la madrileña, el plato tradicional más conocido de la comunidad de Madrid. No obstante, es tal su popularidad que, hoy en día, se trata de uno de los platos más cocinados en muchas zonas del país, cada una con su toque particular. Los callos a la madrileña se pueden preparar como un guiso acompañado de unos garbanzos, pies de cerdo, morro, trocitos de bacon, jamón, tocino...Se suelen hacer picantes, de manera que puedes añadir unas cayenas o poner pimentón picante o un chorizo picante, como más guste. La textura de los callos es gelatinosa, por este motivo es habitual que no guste a todo el mundo. Sin embargo, nadie puede negar que la salsa que queda es todo un manjar. Para conseguirlo, en RecetasGratis compartimos los callos a la madrileña de la abuela, la receta de toda la vida, con un proceso más bien largo pero un resultado increíble. Para ahorrar tiempo, recomendamos comprar los callos ya cocidos. Sigue leyendo y descubre cómo hacer callos a la madrileña.","['1\nLava los callos aunque estén ya cocidos. También lava y corta el morro. Pon una cazuela con agua e introduce los callo y el morro para cocerlos con las hojas de laurel y los clavos durante 30 minutos. Si compras los callos sin cocer los tendrás que lavar bien y cocerlos durante 2-3 horas o hasta que estén tiernos.', '2\nMientras se cuecen los callos, prepara el resto de los ingredientes. Para ello, pica la cebolla, el jamón y el chorizo.', '3\nPon una cazuela con un chorro de aceite, añade la cebolla y deja que se poche durante unos minutos. Luego, agrega el tomate frito y removemos. Incorpora el jamón y el chorizo, remueve y deja que se mezclen los sabores. Cuando esté el sofrito bien mezclado, añade la cayena, el pimiento choricero y la cucharada de pimentón y mezcla bien.\nTruco: Recuerda que los callos a la madrileña destacan por ese toque picante, de manera que regúlalo a tu gusto.', '4\nVierte un vaso de vino blanco y deja reducir el alcohol unos minutos.', '5\nSi ya están los callos cocidos, añádelos al sofrito y cúbrelos con el agua de la cocción. Sin duda, este es uno de los trucos de la receta de la abuela, utilizar el agua de la cocción para realzar el sabor de los callos madrileños.', '6\nAgrega un poco de sal y pimienta y cocina los callos a fuego medio durante 30-40 minutos o hasta que veas que la salsa queda un poco espesa y hecha. Si te queda muy ligera la salsa, puedes espesarla con harina de maíz.', '7\nPrueba de sal y de picante, rectifica si es necesario y listos para comer. Los callos a la madrileña de la abuela están deliciosos, ¡una de las mejores formas de cocinarlos!']","Valoración: 4,3 (3 votos)",6 comensales,1h 30m,Plato principal,Dificultad media,,['Recetas españolas'],"['1 kilogramo de callos ya cocidos (cerdo)', '1 kilogramo de morro ya cocido', '1 trozo de cebolla', '100 gramos de tomate frito', '1 cucharada sopera de pimiento choricero', '1 cucharada sopera de pimentón dulce o picante', '1 cayena', '100 gramos de tacos de jamón', '150 gramos de chorizo', '2 hojas de laurel', '4 clavos', '1 pizca de pimienta', '1 chorro de aceite', '1 pizca de sal', '1 vaso pequeño de vino blanco']",https://www.recetasgratis.net/receta-de-callos-a-la-madrilena-de-la-abuela-74012.html
¡Receta con Salsa Criolla!,"El churrasco no es más que un bife o filete de ternera o de cerdo sin hueso. Por lo general, se prepara en la plancha caliente, aunque también puede hacerse a la parrilla y sobre las brasas. No es un bistec muy ancho, pues debe cortarse de aproximadamente 2 centímetros y cocinarse ""vuelta y vuelta"". En RecetasGratis, esta vez preparamos una deliciosa receta de churrasco argentino con la típica salsa criolla que lo acompaña. En su totalidad, es una receta muy fácil, pero con un sabor muy característico de las pampas argentinas. En pocos pasos descubrirás cómo hacer churrasco argentino y disfrutar de una comida irrepetible.","['1\nEn una tabla corta la cebolla, el tomate, el pimiento rojo y la cebolla de verdeo en pequeños cubos.', '2\nDispón todos los vegetales ya cortados en un bol y agrega el aceite, el vinagre, la sal y la pimienta. Mezcla bien y reserva la salsa criolla argentina hasta el momento de servir. \nTruco: Si gustas, puedes añadir pimiento, ají picante o personalizar la salsa criolla con alguna hierba de tu agrado.', '3\nPara hacer la guarnición de papines, pon a hervir los papines en abundante agua con un puñado de sal hasta que estén en su punto, aproximadamente unos 20 minutos. No querrás que se pasen porque la piel podría romperse y la presentación del plato se estropearía.', '4\nUna vez cocidos los papines, cuélalos y córtalos a la mitad.', '5\nColoca un poco de aceite de oliva, manteca y tomillo en una sartén. Saltea los papines en ella hasta que estén dorados. Salpimienta y reserva hasta que el churrasco a la plancha esté listo. También puedes hacer los papines al horno siguiendo nuestra receta de papas criollas al horno.', '6\nEn un grill o plancha bien caliente y con aceite, coloca el filete de res y no lo muevas hasta que esté dorado de un lado.', '7\nUna vez pasados unos minutos y dependiendo del punto de la carne deseado, da la vuelta al churrasco de res y salpimiéntalo al gusto.', '8\nUna vez listo el churrasco argentino, calienta las papas nuevamente y sirve. Vierte la salsa criolla sobre el churrasco y disfruta.']",,4 comensales,30m,,Dificultad baja,,"['Receta sin lactosa', 'Receta sin azúcar', 'Receta sin gluten', 'Recetas argentinas']","['1 kilogramo de ternera cortada en filetes', '1 cebolla', '1 pimiento rojo', '1 cebolla de verdeo', '1 tomate maduro', '600 gramos de papines o patatas pequeñas', '30 gramos de manteca', 'Tomillo', '6 cucharadas de postre de aceite', '2 cucharadas de postre de vinagre', 'Sal', 'Pimienta']",https://www.recetasgratis.net/receta-de-churrasco-argentino-73998.html
Estofado de Carne con Patatas,"El estofado de carne con patatas es un plato de cuchara buenísimo que no puede faltar en ningún recetario de comidas caseras. Puedes prepararlo con la carne que gustes y además puedes añadirle las verduras que prefieras, ¡es muy versátil y lo puedes personalizar como más te guste! En este caso, hemos hecho esta receta con carne de ternera y, aunque tarda un poquito más en cocinarse con este tipo de carne, el resultado será increíble. Si bien puedes añadir otros ingredientes como guisantes o garbanzos, en RecetasGratis hemos preparado una receta fácil y rápida con ingredientes que seguro tendrás disponibles. ¡Sigue leyendo y descubre cómo hacer estofado de carne con patatas!","['1\nCorta la carne en tacos, aunque ya en la carnicería puedes pedirla preparada para guisar. Condimenta con un poco de sal y pimienta. Reboza los trozos en un poco de harina.', '2\nPon una cazuela con un buen chorro de aceite a fuego fuerte, añade la carne y dórala.', '3\nCuando empiece a dorarse, puedes sacarla de la cazuela o dejarla para agregarla luego. Corta la cebolla en trozos pequeños y añádela junto a la carne. Deja pochar la cebolla junto con la carne.', '4\nCuando ya esté casi pochada, añade el tomate frito. Remueve todo junto y deja cocinar unos minutos.', '5\nAñade el vino blanco y deja evaporar.', '6\nAñade las zanahorias cortadas en rodajas, la hoja de laurel y un vaso grande de agua. Deja cocinar 30 minutos.', '7\nPela y corta las patatas, cubre con más agua si hace falta. Deja cocinar carne de ternera guisada unos 20-30 minutos más.', '8\nCuando estén listas las patatas y la carne, prueba de sal y déjalas en su punto. ¡Tu estofado de carne con patatas estará listo para comer!']",Valoración: 5 (1 voto),4 comensales,1h 30m,,Dificultad media,,[],"['500 gramos de ternera para guisar', '1 cebolla', '2 zanahorias', '4 patatas', '100 gramos de tomate frito', '1 hoja de laurel', '100 mililitros de vino blanco', '2 cucharadas soperas de harina', '1 chorro de aceite de oliva', '1 pizca de sal', '1 pizca de pimienta']",https://www.recetasgratis.net/receta-de-estofado-de-carne-con-patatas-73925.html
Solomillo de Cerdo a la Plancha JUGOSO,"El solomillo es una parte tierna y exquisita del animal que se encuentra en la zona lumbar y contiene un porcentaje mínimo de grasa, por eso puede ser consumida para adelgazar o mantener la línea. Para estos propósitos, y para seguir una dieta saludable en general, lo más recomendable es utilizar métodos de cocción que incluyan muy poca cantidad de aceite, como en este plato sencillo preparado a la plancha, rico y rápido. En un par de pasos podrás degustar un delicioso corte de carne con cualquier guarnición de patatas cocidas y aliñadas o una suculenta parrillada de verduras variadas.En RecetasGratis te explicamos cómo hacer solomillo de cerdo a la plancha para que quede jugoso, cuál es el tiempo de cocción recomendado y qué calorías tiene el plato.","['1\n¿Te preguntas cómo preparar solomillo de cerdo? ¡Vamos allá! Para empezar con la receta de solomillo de cerdo a la plancha, primero toma una pieza de solomillo de cerdo y córtala en rodajas de un dedo de grosor. Salpimienta al gusto.\nTruco: se recomienda que las rodajas sean gruesas para que se cocinen ligeramente por fuera y queden jugosas por dentro.', '2\nPrecalienta la plancha con unas gotas de aceite. Debe de estar bien caliente para que la carne se ase sin recocerse y sin pegarse.', '3\nCocinar el solomillo de cerdo a la plancha durante tres minutos por cada lado es lo ideal si quieres que quede al punto. Esta carne está más sabrosa si queda rosada por dentro y dorada por fuera, pero siempre puedes dejarla un poco más al fuego si quieres que quede más pasada. Partiendo del tiempo de cocción indicado, déjala un minuto y comprueba el interior para valorar si está a gusto o no. Sirve la carne con guarnición de patatas cocidas, por ejemplo, y aliñadas con unas gotas de aceite, sal y perejil. Te encantará.']","Valoración: 4,8 (4 votos)",2 comensales,15m,Plato principal,Dificultad baja,,"['Recomendada para perder peso', 'Receta sin lactosa', 'Receta sin azúcar', 'Receta sin gluten']","['1 pieza de solomillo de cerdo', '2 pellizcos de sal y pimienta', '1 gota de aceite de oliva virgen extra', '2 patata pequeñas', '3 ramas de perejil fresco']",https://www.recetasgratis.net/receta-de-solomillo-de-cerdo-a-la-plancha-73905.html
