title,intro,order,votes,comensales,duración,para,dificultad,coste,types,ingredientes,url
¡Receta fácil con verduras y tomate!,"El ragú de cerdo, o ragout de cerdo, es como un guiso que incluye verduras en su elaboración y nos permite disfrutar de un plato con múltiples sabores y texturas. Es una receta tradicional de la gastronomía francesa que puede cocinarse con distintos tipos de carne, como pavo, pollo o ternera. Sin embargo, en esta ocasión utilizaremos cerdo y hablaremos de sus tiempos de cocción y recomendaciones para que quede tierno y jugoso.El ragú consiste en estofar trozos de carne con una salsa sencilla pero con mucho sabor. En función de la zona, puede variar algún ingrediente, como por ejemplo el vino, que puede ser tinto o blanco, algunas verduras, etc. Es un plato que podemos preparar con antelación, puesto que de un día para otro aún está más bueno. También se puede hacer más cantidad y congelar lo que sobre. Aunque no es complicado de hacer, el ragú necesita su tiempo de cocción para que quede una carne que casi se deshaga. Para ello, se puede hacer en olla normal y dejar que se cocine durante unos 90 minutos o en olla rápida, que en 20 minutos lo tenemos listo. En cualquier caso, te animamos a seguir en RecetasGratis para saber cómo hacer ragú de cerdo.","['1\nCorta la carne en trozos, quita la grasa y salpimienta al gusto. Intenta que la carne quede en trozos del mismo tamaño para que se cocinen por igual.', '2\nReboza la carne pasándola por la harina, así quedará más jugosa por dentro.', '3\nPica la cebolla y los dientes de ajo previamente pelados. Dado que el ragú de cerdo se presta a variaciones, puedes sumar otros ingredientes que te gusten, como puerro.', '4\nPon una cazuela al fuego con un buen chorro de aceite de oliva, añade la carne y deja que se dore. A medio dorar, agrega la cebolla y los ajos picados.', '5\nMientras se dora un poco la cebolla con la carne, corta el resto de verduras, es decir, la zanahoria y el pimiento verde. Nuevamente, puedes sumar otros ingredientes al ragú de cerdo, como pimiento rojo o patata.', '6\nIncorpora la zanahoria y el pimiento, remueve y deja que se cocine todo junto unos minutos, teniendo cuidado de que no se queme la cebolla.', '7\nAñade el tomate frito, remueve y sigue cocinando. Si lo prefieres, puedes triturar un par de tomates naturales y usarlos en lugar del tomate frito.', '8\nVierte el vaso de vino blanco, deja que hierva y se evapore el alcohol. Al tratarse de una receta de ragú de cerdo, el vino blanco combina mejor. Ahora bien, si por ejemplo hicieras ragú de ternera, podrías utilizar vino tinto para realizar su sabor.', '9\nCubre la carne con agua o caldo de verduras y deja que se cocine a fuego lento alrededor de una hora. Pasado el tiempo, prueba de sal y pimienta y rectifica si es necesario. Deja cocinar unos 30 minutos más para que todos los sabores acaben de integrarse y la carne quede bien tierna. Si hiciera falta, puedes añadir más agua o caldo.\nTruco: Comprueba cómo está la carne de tierna para valorar los minutos exactos que añades.', '10\nCuando veas que la carne está tierna y la salsa bien consistente, apaga el fuego. Si tienes tiempo suficiente, deja reposar la carne para que coja todos los sabores y quede más buena. Como hemos dicho al principio, lo ideal sería hacer este plato de un día para otro para que se asiente y quede mucho más sabroso. No obstante, servido inmediatamente también está delicioso. Disfruta de tu receta de ragú de cerdo y no olvides contarnos qué te ha parecido. Recuerda que también puedes hacer ragú de cerdo con patatas añadiendo este ingrediente al guiso o cocinándolo aparte.']",,4 comensales,1h 30m,Plato principal,Dificultad baja,,[],"['1 kilogramo de carne de cerdo para guisar', '2 zanahorias', '1 cebolla', '2 dientes de ajo', '1 trozo de pimiento verde', '300 mililitros de vino blanco', '100 gramos de tomate frito', '4 cucharadas soperas de harina de trigo', '1 chorro de aceite', '1 pizca de pimienta', '1 pizca de sal']",https://www.recetasgratis.net/receta-de-ragu-de-cerdo-74396.html
Cómo hacer torreznos de Soria,"Torreznos de Soria, ricos y crujientes. Los torreznos más conocidos son los de Soria, aunque hoy en día es un plato que encontramos por toda España, sobre todo en bares de tapas. Su elaboración es sencilla, pero hay que tener paciencia porque necesita un cocinado un poco lento para que quede bien la corteza, ya que han de quedar crujientes.Para hacer los torreznos caseros solo necesitamos una buena panceta adobada y aceite, si es de Soria tenemos la garantía de que es un buen producto, pero si no podemos conseguirla de aquí, servirá cualquier otra de calidad. Podemos encontrar panceta de calidad tanto en carnicerías como en grandes almacenes, ya adoba y sin adobar, cortada en la medida que ha de tener y lista para cocinarla. Una vez conseguida la materia prima, sigue leyendo y descubre en RecetasGratis cómo hacer torreznos de Soria.","['1\nPara hacer los torreznos de Soria caseros lo primero que debes hacer cuando compras la panceta es dejarla secar durante 24 horas en un lugar seco y fuera del plástico. Si se puede colgar mejor, así quedará bien seca la corteza. Luego, corta la panceta en tiras de 2 cm de grosor en caso de haberla comprado entera.', '2\nPon una sartén al fuego con un poco de aceite, lo justo para que cubra la base. Coloca las tiras de panceta con la piel tocando la base, una al lado de la otra, y cocínalas con el fuego muy bajo. Deja que se vayan cocinando muy despacio, así se irán haciendo las burbujas en la corteza. Pueden tardar en hacerse entre 20 y 30 minutos, según lo seca que esté la corteza. Vigila que se cocinen todas las tiras por igual.', '3\nDeja la panceta al fuego hasta que todas las tiras estén hechas por la parte de la corteza, que debe quedar llena de burbujas.', '4\nCuando estén todas las tiras de panceta con la corteza llena de burbujas, sácalas. En la misma sartén y con el aceite que ha soltado la panceta, fríe las tiras en tandas de 2 o 3. Para que queden bien, sube el fuego y deja que se cocinen durante 4-5 minutos por cada lado, siempre vigilando que no se quemen.', '5\nSaca las tiras y colócalas en un plato con papel absorbente para retirar el exceso de aceite. Sigue haciendo todas las tiras de panceta siguiendo las recomendaciones anteriores. Puedes servir la receta de torreznos de Soria así o cortar las tiras en trozos más pequeños. Espolvorea sal gorda por encima y listo.']",,4 comensales,45m,Entrante,Dificultad media,,['Recetas españolas'],"['1 panceta adobada', '1 chorro de aceite de girasol']",https://www.recetasgratis.net/receta-de-torreznos-de-soria-74393.html
Receta fácil (con trucos),"La receta de riñones a la provenzal tiene como principal objetivo resaltar las características organolépticas del producto o materia prima principal. Se trata de un plato cuya cocción es muy típica del sureste francés, aunque hoy en día podemos encontrarla en muchos otros países.Esta receta es más sencilla de lo que parece y nos aporta una gran cantidad de proteína. Si el sabor fuerte de los riñones no acaba de gustarte, no te preocupes, en RecetasGratis compartiremos nuestros secretos para conseguir un plato delicioso y más suave. Sigue leyendo y descubre con nosotros cómo hacer riñones a la provenzal.","['1\nPon los riñones en una cacerola con abundante agua fría y caliéntala a fuego fuerte. Es importante que el agua esté fría y sin sal, ya que esta técnica es extractora de sabores, de manera que los sabores y aromas fuertes pasan al agua, al igual que las impurezas. En caso de que te gusten los sabores fuertes, evita este paso.\nTruco: Puedes usar riñones de cerdo, de res, de pollo..., solo debes ajustar la cantidad en función del tamaño. Nosotros hemos usado de ternera.', '2\nUna vez que el agua esté hirviendo, deja los riñones durante 2 minutos. Pasado el tiempo, cuela y lava los riñones.', '3\nCorta los riñones en rodajas de aproximadamente 1 centímetro y medio de grosor y resérvalas.', '4\nPela y pica finamente los dientes de ajo y el perejil. Puedes hacer los riñones a la provenzal ajustando a tu gusto las cantidades de estos ingredientes. Nuevamente, también dependerá del tamaño de los órganos.', '5\nCalienta un chorro de aceite de oliva en una sartén, el suficiente como para cubrir toda la superficie. Cuando esté caliente, sella los riñones.\nTruco: No muevas mucho los riñones una vez colocados en la sartén, ya que expulsarían sus jugos y no se sellarían.', '6\nPasados unos minutos, dales la vuelta y séllalos por el otro lado. Los riñones deben quedar bien crocantes de ambos lados.', '7\nUna vez sellados por ambos lados, agrega el ajo y perejil finamente picados para seguir con la receta de riñones a la provenzal.', '8\nCuando el perejil y el ajo se hayan incorporado, vierte el vino blanco y deja reducir el alcohol durante unos minutos.', '9\nCuando el vino se haya reducido casi por completo, los riñones estarán listos. Sirve tu receta de riñones a la provenzal inmediatamente para disfrutar de este plato caliente. \nTruco: En caso de que te gusten los riñones más cocidos, podes agregar un poco de agua o caldo y seguir cocinando unos minutos más.']","Valoración: 4,2 (5 votos)",4 comensales,30m,Plato principal,Dificultad muy baja,,[],"['3 riñones', '3 dientes de ajo', '1 puñado de perejil', '200 mililitros de vino blanco seco', '1 chorro de aceite de oliva', '1 pizca de sal', '1 pizca de pimienta']",https://www.recetasgratis.net/receta-de-rinones-a-la-provenzal-74290.html
¡Receta italiana original!,"Lomo al pepe, una receta riquísima y muy completa. En RecetasGratis te enseñamos a preparar uno de los platos más populares de la cocina italiana, que cuenta con diferentes elaboraciones y nos permite disfrutar de una receta deliciosa. Este plato de lomo al pepe es muy completo, ya que se compone de carne de cerdo una salsa de nata y pasta, que suele ser macarrones o rigatoni.Tanto si tienes invitados como si simplemente te apetece preparar algo diferente, esta receta te encantará por su sabor, textura y fácil elaboración. Descubre cómo hacer lomo al pepe y disfruta de la gastronomía italiana.","['1\nPon una cazuela con agua a fuego medio y, cuando esté hirviendo, añade los macarrones y cocínalos hasta que estén un poco al dente, ya que luego se calentarán con la carne. Cuando estén cocidos escúrrelos y resérvalos.', '2\nCorta la carne en rodajas de 1 cm de grosor y salpimienta al gusto. Puedes hacer esta receta de lomo al pepe con lomo o con solomillo si lo prefieres.', '3\nPon una sartén amplia al fuego con las cuatro cucharadas de aceite de oliva. Cuando esté caliente, añade los trozos de carne, dóralos a fuego fuerte, sácalos y resérvalos.', '4\nPica la cebolla en trozos pequeños. Añade un poco más de aceite en la misma sartén donde has dorado la carne y, cuando esté caliente, sofríe la cebolla. Deja que se vaya cocinando hasta que se empiece a dorarse.', '5\nCuando la cebolla tenga, incorpora la nata, remueve y deja que la salsa coja los sabores de la sartén.', '6\nAñade las dos cucharaditas de bovril. El bovril es un concentrado de carne que da muy buen sabor a esta receta de lomo al pepe y a otras que lleven carne. Podrás encontrarlo en supermercados.\nTruco: Puedes sustituir el bovril por caldo de carne.', '7\nAgrega un poquito de sal y pimienta. De forma opcional, se puede añadir un chorrito de brandy. Mezcla hasta que estén todos los ingredientes bien integrados. Prueba de sal y rectifica si es necesario.', '8\nIncorpora los trozos de carne y deja que se cocine todo durante 15 minutos o hasta que la carne esté tierna. Dependerá del tipo de carne que hayas usado y del grosor. En este paso verás que reducirá un poco la salsa, de manera que si ves que se queda muy seca se puede añadir un poco más de nata o si queda muy espesa un poco de leche.', '9\nEn el último minuto agrega los macarrones a la cazuela con la carne.', '10\nDeja cocinar todo junto un par de minutos para que la pasta coja todo el sabor de la salsa. Prueba nuevamente de sal.', '11\nY ya estará listo este estupendo plato. Puedes servir la receta de lomo al pepe con un poco de pan para mojar en la salsa. Verás que se trata de un plato muy sencillo y muy sabroso al mismo tiempo, perfecto para cualquier ocasión.']",Valoración: 3 (2 votos),4 comensales,45m,Plato principal,Dificultad baja,,['Recetas italianas'],"['500 gramos de lomo de cerdo o solomillo', '1 cebolla', '400 mililitros de nata para cocinar (crema de leche)', '2 cucharadas de postre de bovril', '1 pizca de sal', '1 pizca de pimienta (molida o en grano)', '4 cucharadas soperas de aceite de oliva', '300 gramos de macarrones']",https://www.recetasgratis.net/receta-de-lomo-al-pepe-74363.html
10 recetas fáciles para niños y adultos,"Una botana es una comida ligera que se consume para estimular el apetito, antes de la comida principal del mediodía o para degustar en días festivos y celebraciones especiales. La botana se conoce también con otros nombres, según el país: aperitivo, boquilla, pasapalo, tentempié, entremés, canapé, pasaboca y boquitas.Entre los alimentos más apreciados para un buen picoteo, las salchichas gozan de mucha popularidad. Es razonable porque este embutido es versátil, de cocción fácil y rápida, súper sabroso y combina con casi todo, es decir, ¡es el aperitivo ideal! Por esta razón, en RecetaGratis no podíamos dejar de lado estas 10 botanas con salchichas, una selección de recetas originales, sabrosas y facilísimas que no puedes perderte.",[],Valoración: 4 (1 voto),,,,,,,,https://www.recetasgratis.net/articulo-10-botanas-con-salchichas-74314.html
Chanfaina extremeña,"Este rico plato típico de Extremadura, concretamente de Fuente de Cantos, tiene una humilde y rápida preparación, con un resultado final único y antiguo. De hecho, siguen preparando esta receta en sus festejos como gran tradición de la Chanfaina, como cuando nuestros antepasados hacían estas preparaciones con dedicación y mucho cariño.En RecetasGratis queremos compartir la receta tradicional de chanfaina para disfrutar de un plato tal y como lo hacían nuestros abuelos. Sigue leyendo, descubre cómo hacer chanfaina extremeña hecha a base de asadurrillas y variantes del cordero.","['1\nLo primero que debes preparar es el puré de tomate natural, que siempre le aportará un estupendo sabor a la chanfaina extremeña. Si en este momento no tienes este tipo de tomates, puedes utilizar tomate triturado de lata, que con unas tres cucharadas soperas bastará.', '2\nCorta la cebolla en trozos medianos y saltéala en una sartén con un chorro de aceite caliente. Añade una guindilla, láminas gruesas de ajo y la hoja de laurel para que vaya desprendiendo su aroma, después la retirarás. Sofríe todo esto a fuego medio y remueve para que se haga bien durante 4 minutos.', '3\nUna vez que esté la cebolla pochada con el ajo y la guindilla, tritura estos ingredientes hasta convertirlos en puré. Recuerda que no debes triturar el laurel, por lo que retira la hoja antes. Cuando tengas el puré listo, resérvalo para seguir con la receta de chanfaina extremeña.', '4\nEn una cazuela honda añade de nuevo otro chorrito de aceite de oliva y rehoga las asaduras de cordero y la falda de cordero, todo ello troceado. Espolvorea unos pellizcos de pimienta blanca y un poco de sal, remueve bien y deja que se vaya sellando a fuego medio durante aproximadamente 5 minutos sin tapar.', '5\nA los 5 minutos, agrega el resto de ingredientes. Primero vierte el vino blanco, remueve durante 1 minuto, añade el tomate y mezcla durante otro minuto. Después, incorpora el puré de pimiento choricero si lo tienes, si no lo consigues, puedes prescindir de él sin problema. Añade la cebolla triturada, remueve, vierte el agua, tapa la cazuela y cuece durante 30 minutos a fuego medio-bajo.', '6\nUna vez que tengas tu guiso de chanfaina listo, sírvelo caliente. La receta de chanfaina de cordero extremeña es bastante sencilla y muy nutritiva, ya que está cargada de proteína. También hay quien hace la chanfaina extremeña de cerdo siguiendo estos mismos pasos, de manera que podrías reemplazar el cordero por cerdo si lo prefieres.']",,4 comensales,1h 30m,Plato principal,Dificultad baja,,['Recetas españolas'],"['300 gramos de asadura de cordero (incluye hígado, corazón y riñón)', '150 gramos de carne de falda de cordero', '50 gramos de aceite de oliva', '1 cebolla mediana', '2 dientes de ajo', '1 hoja de laurel', '1 guindilla picante', '2 tomates pera maduros', '1 vaso pequeño de vino blanco', '2 pellizcos de sal', '1 cucharada sopera de pimiento choricero en puré', '1 vaso pequeño de agua', '2 pellizcos de pimienta blanca']",https://www.recetasgratis.net/receta-de-chanfaina-extremena-74339.html
¡Receta fácil y más ligera!,"Los filetes rusos son una rica combinación de carne de vaca picada y carne de cerdo, además de otros ingredientes como cebolla y especias, que siempre pueden ser modificados para amoldarlos a nuestro gusto. El resultado siempre es una especie de filete con un delicioso aroma y aspecto. Los filetes rusos se pueden hacer de forma tradicional, empanados y fritos en aceite, o al horno con el fin de rebajar sus calorías. En esta ocasión, te enseñaremos a cocinarlos de esta segunda manera.Quédate en RecetasGratis y descubre con nosotros cómo hacer filetes rusos al horno, verás que es muy fácil y que el resultado es igual de delicioso.","['1\nMezcla los ingredientes para que la carne coja los aromas y sabores que la transformarán en unos filetes rusos tan irresistibles. También puedes mezclar todos los ingredientes excepto el huevo y el pan rallado para, así, rebozar los filetes al final.', '2\nAmasa para integrar los ingredientes entre sí y forma una bola cuando ya esté bien mezclado todo. Tapa con un paño y deja macerar durante 15 minutos para que sus sabores se mezclen.', '3\nPasado el tiempo de maceración y antes de formar los filetes rusos, enciende el horno a 180 ºC arriba y abajo. A continuación, forma pequeñas bolas y aplástalas con las manos, pero no demasiado, ya que el filete no ha de quedar muy fino. Si has decidido no añadir el huevo y el pan rallado, bate el huevo, pasa cada filete por él y después por el pan rallado para rebozarlo. Coloca los filetes rusos en la bandeja del horno forrada con papel vegetal. Puedes añadir un poco de aceite de oliva.', '4\nCocina los filetes rusos al horno durante 10 minutos, después dales la vuelta para cocinarlos otros 10 minutos. Es preferible colocar la bandeja a media altura y activar el calor arriba y abajo. Tanto si has hecho los filetes rebozados como si has integrado el pan y el huevo en la masa, el resultado será delicioso.\nTruco: Si te gusta que queden más crujientes por fuera, sube la bandeja y deja que se terminen de hacer los últimos minutos al grill.', '5\n¡Listos! Ya puedes servir la receta de filetes rusos al horno con la salsa que más te guste. Como no los has cocinado fritos, el resultado es un plato mucho más ligero, perfecto para niños y adultos.']",,6 comensales,1h 30m,Plato principal,Dificultad baja,,['Recetas al horno'],"['300 gramos de carne de ternera o vaca picada', '200 gramos de carne de cerdo', '1 huevo', '1 rama de perejil picado', '1 pellizco de pimienta negra molida', '1 trozo de cebolla dulce', '1 vaso pequeño de pan rallado', '1 pellizco de comino']",https://www.recetasgratis.net/receta-de-filetes-rusos-al-horno-74335.html
¡Receta argentina fácil!,"Los bifes a la riojana es uno de esos platillos clásicos de bodegones porteños en Argentina, creados a partir de la reelaboración de la comida de los inmigrantes españoles. No se conoce exactamente su origen, pero seguramente algún inmigrante riojano debe haber participado en los primeros pasos de esta preparación.La receta de bifes a la riojana se sirve con una gran variedad de verduras que se acompañan con huevo y papas fritas, dando como resultado un platillo contundente. La carne queda tierna y jugosa, gracias a la forma de cocción y al jugo de todas las verduras.En RecetasGratis te mostramos el paso a paso para que sepas cómo hacer bifes a la riojana de la forma más deliciosa.","['1\nSala los bifes y cocínalos de ambos lados en una plancha con aceite de oliva a fuego fuerte. Cocínalos al punto de cocción de tu preferencia.\nTruco: Puedes utilizar bife angosto, bife de chorizo u ojo de bife.', '2\nCorta las verduras en juliana. Rehoga las cebollas y los pimientos en la plancha con un poco de aceite de oliva. Salpimienta. Revuelve de vez en cuando hasta que las verduras se doren.', '3\nCuando las verduras estén cocidas, haz un hueco en el medio y coloca las arvejas y los dientes de ajo.', '4\nUna vez que se doren las verduras, agrega el jamón cortado en juliana. Mezcla toda la preparación.', '5\nFríe los huevos en una plancha con aceite, colócales sal y pimienta.\nTruco: Si no quieres hacerlos fritos, puedes agregar los huevos sobre las verduras y, una vez que comiencen a cocinarse, mezclar todo haciendo una especie de revuelto.', '6\nPor último, sirve en un plato los bifes a la riojana. Arriba va la preparación de verduras y, por último, el huevo frito. Este platillo se acompaña con papas fritas.\nTruco: Para realizar las papas fritas, pélalas y córtalas redondas. Fríelas en aceite hasta dorar.']",,4 comensales,45m,Plato principal,Dificultad baja,,['Recetas argentinas'],"['4 bifes de ternera', '1 cebolla', '1 cebolla morada', '1 pimiento rojo', '1 pimiento verde', '200 gramos de jamón cocido', '3 dientes de ajo', '4 huevos', '1 lata de arvejas', 'Aceite de oliva', 'Sal', 'Pimienta']",https://www.recetasgratis.net/receta-de-bifes-a-la-riojana-74315.html
Cómo hacer san Jacobos caseros,"Vamos a preparar San Jacobos, un plato muy sencillo que va a gustar mucho a toda la familia, ya que la combinación de jamón york y queso es deliciosa. Los san Jacobos caseros, o sanjacobos, se componen de dos lonchas de jamón y una loncha de queso fácil de fundir. Se comercializan ya preparados, pero hacerlos en casa siempre es mucho más recomendable porque nos aseguramos de utilizar ingredientes de calidad.Al hacer esta receta en casa, no solo disfrutaremos de un alimento más sano, sino que ahorraremos dinero porque podemos hacer más cantidad y congelar los que no vayamos a comer. De esta forma, podremos cocinarlos en otra ocasión. Quédate con nosotros y aprende en RecetasGratis cómo hacer san Jacobos caseros.","['1\nColoca sobre la mesa de trabajo las lonchas de jamón york y las lonchas de queso.', '2\nCoge una loncha de jamón york y pon encima una loncha de queso. Es importante que la loncha de queso sea más pequeña que la de jamón, de manera que corta los bordes si es necesario. Este truco te permitirá que el queso no se salga al momento de cocinar los san Jacobos.', '3\nEncima del queso pon otra loncha de jamón york. Puedes hacer tus san Jacobos caseros con este tamaño, cortarlos por la mitad o en 4 trozos.', '4\nPrepara el rebozado poniendo en un plato un poco de pan rallado y en otro el huevo batido.', '5\nCoge los cuadrados de jamón y queso, pásalos primero por el huevo batido de manera que queden bien impregnados y, luego, por el pan rallado. Sella bien los bordes con el pan para evitar que el queso se salga durante la cocción. Si te preguntabas cómo empanar jamón york, ya has visto que es muy sencillo.\nTruco: Para que queden más crujientes, puedes hacer un segundo rebozado repitiendo estos pasos.', '6\nDeja los san Jacobos en un plato y resérvalos en la nevera un buen rato para que se quede el rebozado más firme. Como mínimo, deben estar 30 minutos.', '7\nCalienta el aceite en una sartén a fuego medio y, cuando esté caliente, fríe los san Jacobos uno a uno. Dóralos con mucho cuidado, ya que se queman enseguida.', '8\nCuando esté un lado dorado, dale la vuelta y permite que se cocine por el otro lado. En general, con 2 minutos por lado suele ser suficiente.', '9\nConforme los vayas sacando de la sartén, déjalos sobre un plato con papel de cocina para que suelten el aceite que sobra.', '10\nSírvelos enseguida para disfrutarlos calientes. ¡Así de fácil es la receta de sanjacobos caseros! Aunque muchas personas confunden a los san Jacobos con los libritos, lo cierto es que no son iguales, ya que los segundos se elaboran con lomo. Si quieres aprender a prepararlos, no te pierdas la Receta de libritos de lomo.']",,2 comensales,15m,Plato principal,Dificultad muy baja,,[],"['8 lonchas de jamón york', '4 lonchas de queso tierno', '1 huevo', '150 gramos de pan rallado', '1 vaso de aceite de oliva']",https://www.recetasgratis.net/receta-de-san-jacobos-caseros-74320.html
