title,intro,order,votes,comensales,duración,para,dificultad,coste,types,ingredientes,url
"¡Receta Fácil, Rápida y Riquísima!","Esta vez te traemos un plato muy fácil y delicioso que rápidamente entrará en la lista de tus desayunos o almuerzos favoritos, pues es muy versátil y puedes disfrutarlo a cualquier hora del día. Si eres amante de los embutidos, esta receta de revuelto de morcilla es perfecta para ti. Los huevos revueltos son uno de los platos más rápidos y básicos que podemos hacer, pero con el sabor extra de la morcilla y los demás ingredientes de esta preparación, verás cómo toma una nueva dimensión. Hay morcillas muy variadas hechas con diferentes componentes. Las morcillas pueden hacerse de sangre y cebolla, tocino y carne, arroz, e incalculables estilos más. Puedes elegir tu presentación favorita y no quedarás desencantado con este plato. ¡Pruébala cuanto antes y descubre cómo hacer revuelto de morcilla en RecetasGratis!","['1\nEn una sartén honda, vierte un chorro de aceite de oliva, deja que se caliente, y sofríe los ajos cortados en trocitos menudos.', '2\nAñade las almendras fileteadas y rehoga 2 minutos a fuego bajo mientras vas removiendo. No dejes que se hagan más de la cuenta, pues el sabor debe quedar jugoso e intenso.', '3\nPela y corta a rodajas la morcilla de arroz. Solo debes hacerle un corte trasversal a la pieza de morcilla y la tira de tripa saldrá fácilmente.Añade al sofrito y rehoga un par de minutos.', '4\nBate los huevos ligeramente, añade un pequeño pellizco de sal y viértelos en la sartén donde estás rehogando todos los ingredientes. Deja que cuajen un poco y remuévelos desde abajo hacia arriba sin deshacer demasiado el huevo.\nTruco: Te recomendamos que no dejes que la textura del huevo y la morcilla lleguen a unificarse. Intenta siempre que los ingredientes se vean vean diferenciados.', '5\nCuando esté listo, sirve tu revuelto de morcilla acompañado de unas tostadas o solo. ¡Te sorprenderás con lo espectacular de su sabor!']",Valoración: 5 (1 voto),2 comensales,15m,Entrante,Dificultad baja,,[],"['1 morcilla de Burgos o de arroz', '3 huevos', '1 puñado de almendras laminadas', '3 dientes de ajo', '1 chorro de aceite de oliva virgen extra', '2 rodajas de pan casero integral']",https://www.recetasgratis.net/receta-de-revuelto-de-morcilla-73784.html
Receta Casera MUY FÁCIL,"En esta ocasión, desde RecetasGratis, te enseñaremos a preparar este delicioso plato de carne, muy sencillo de preparar, rápido y con cuatro ingredientes que nunca faltan en una alacena o nevera. Se trata del popular bistec a lo pobre, conocido también como bife a lo pobre, una receta tradicional de la cocina chilena y peruana, ideal para toda la familia y perfecta para darnos un capricho por la combinación de elaboraciones.El origen de la receta de bistec a lo pobre es incierto, aunque todo apunta a que nació con el objetivo de preparar un plato rápido y completo, pensado para alimentar a familias enteras. A pesar de que su nombre deja entrever que se trata de un plato económico, lo cierto es que no en todas partes la carne que se debe utilizar para su elaboración es de bajo coste. No obstante, es cierto que es una receta más económica que otras. Al margen de su historia, hoy en día se sigue preparando para disfrutar de un plato realmente delicioso, y si tú también quieres aprender a cocinarlo, sigue leyendo para descubrir cómo hacer bistec a lo pobre peruano y chileno.","['1\nPela las cebollas y córtalas en juliana fina. Pela también las papas y córtalas en bastones para freír. Luego, sécalas con un paño limpio.', '2\nEn una olla, pon a calentar abundante aceite para freír la papas. Cuando el aceite llegue a los 170 grados, incorpora las patatas y cocínalas hasta que estén doradas, durante aproximadamente unos 10 minutos. Una vez doradas, retíralas y colócalas sobre papel absorbente, salpimienta al gusto y resérvalas caliente.', '3\nEn una sartén con poco del aceite que has usado para freír las papas, sofríe la cebolla con una pizca de sal hasta que estén a tu gusto. Resérvalas y en esa misma sartén fríe los huevos uno a uno, dejando jugosa la yema. Aunque el bistec a lo pobre se caracteriza por presentar todos los ingredientes fritos, siempre puedes reducir un poco las calorías del plato cocinando los huevos fritos al microondas o sin aceite.', '4\nCocina los dos bistecs a la plancha con un poco de aceite caliente. Para que queden jugosos, recomendamos sellarlos por fuera, dándoles la vuelta para cocinarlos unos minutos por cada lado. No obstante, puedes cocinar el bistec a lo pobre con el punto de cocción que más te guste.', '5\nCuando la carne esté lista, ya solo queda montar el plato. Para ello, coloca en el fondo las piezas de carne, encima la cebolla y los huevos fritos y a un lado las papas. ¡Así de fácil es preparar la receta de bistec a lo pobre chilena y peruana! Como ves, tiene sus trucos pero no se trata de un plato complicado, de manera que ponte manos a la obra y no olvides dejar tus comentarios.Un dato curiosos es que en Chile este plato tiene su día y se festeja cada 24 de abril, se conoce como el Dáa Nacional del Bisctec a lo Pobre.']","Valoración: 4,3 (3 votos)",4 comensales,45m,Plato principal,Dificultad baja,,[],"['4 bistecs de ternera', '1 kilogramo de papas medianas', '2 cebollas grandes', '4 huevos', 'Aceite', 'Sal', 'Pimienta']",https://www.recetasgratis.net/receta-de-bistec-a-lo-pobre-73737.html
Cinta de Lomo en Salsa,"Cinta de lomo en salsa, una receta sencilla, rápida y que gustará a todos. El lomo es la parte del cerdo que más se utiliza, tanto para hacerlo a la plancha como para cocinarlo en salsa. Es un corte más bien seco, así que si lo hacemos en salsa quedará mucho más jugoso y sabroso.Para hacer esta receta de cinta de lomo en salsa podemos cocinar la pieza de carne entera y rebanarla después o al revés, es decir, cortar primero los filetes y cocinarlos así. Mediante esta segunda forma conseguimos acortar muchísimo el tiempo de preparación, de manera que la recomendamos si no dispones de mucho tiempo. De todas formas, en RecetasGratis explicaremos los detalles de ambos métodos para que sepas cómo hacer cinta de lomo en salsa en cualquiera de los casos.","['1\nPon una cazuela con el aceite de oliva a calentar a fuego medio. Pela los ajos y añádelos. Coge los filetes de cinta de lomo, espolvorea sal y pimienta y dóralos en la cazuela por ambos lados. Si optas por cocinar la pieza entera, séllala y retírala.\nTruco: Para cocinar la cinta de lomo entera recomendamos utilizar una olla, ya sea normal o exprés.', '2\nCuando estén dorados los filetes, vierte el vaso de vino blanco y deja que se reduzca durante 2-3 minutos. Para la cinta entera, vierte igualmente el vino y deja reducir.\nTruco: Puedes añadir otros ingredientes a la salsa, como cebolla picada o zanahoria.', '3\nUna vez ha reducido el alcohol del vino, agrega el vaso de agua o caldo de carne. Si usas agua, puedes añadir una pastilla de caldo para potenciar el sabor de la cinta de lomo en salsa. En caso de optar por cocinar la cinta entera, introduce de nuevo la carne en la olla y añade dos vasos de agua o caldo. También puedes incorporar una hoja de laurel.', '4\nDeja cocinar unos 10 minutos a fuego medio. Si ves que hace falta, añade más agua. Deberás ir moviendo la cazuela para que se vaya espesando la salsa, pero si queda muy clara, puedes disolver un poco de harina de trigo o harina de maíz en un poco de agua y añadir esto a la cazuela. Echando un poco de perejil picado para potenciar el sabor.Para la pieza entera, tapa la olla y deja que se cocine durante 15 minutos en olla rápida o 30 en olla convencional, a fuego medio-bajo. Pasado este tiempo, abre la olla, dale la vuelta a la carne y vuelve a cocinar el mismo tiempo.', '5\nY listo, queda un plato muy bueno con una salsita muy rica. Tanto si haces la receta de cinta de lomo en salsa con la pieza entera o fileteada, el resultado será espectacular. Como has podido comprobar, los tiempos de cocción varían considerablemente dependiendo de la presentación de la carne. Y si te apetece conocer otra salsa, aunque implique cocinar la carne en el horno, no te pierdas esta Receta de cinta de lomo a la naranja.']","Valoración: 3,8 (4 votos)",4 comensales,30m,Plato principal,Dificultad baja,,[],"['12 filetes de cinta de lomo o la pieza entera', '4 dientes de ajos', '150 mililitros de vino blanco', '1 vaso pequeño de agua', '1 pastilla de caldo ( opcional)', '5 cucharadas soperas de aceite de oliva', '1 pizca de pimienta', '1 pizca de sal', '1 puñado de perejil picado']",https://www.recetasgratis.net/receta-de-cinta-de-lomo-en-salsa-73721.html
Redondo de Ternera en Olla (Express y Lenta),"En esta ocasión preparamos un redondo de ternera en olla express y normal, ya que no todo el mundo dispone de los dos tipos de olla. El redondo es una pieza de carne que se puede cocinar de múltiples formas, siendo al horno y guisada las más populares. Centrándonos en la segunda opción, tenemos la posibilidad de cocinarlo a fuego lento (en olla convencional) o de una manera mucho más rápida (en olla express). De las dos manera queda delicioso, de manera que tendremos que escoger una u otra en función de nuestras necesidades y tiempo.Aunque nos decantemos por la versión en olla rápida, es necesario aclarar que el proceso de ambas recetas es largo, ya que la ternera necesita bastante cocción para que nos quede tierna. En olla express tardaremos unos 45 minutos, mientras que en olla normal unas 2 horas. Sin duda, esta es una receta ideal para cualquier celebración, como la Navidad, puesto que queda un plato delicioso y espectacular. Sigue leyendo para descubrir en RecetasGratis cómo hacer redondo de ternera en olla.","['1\nAta el redondo de ternera para que coja forma. Esto te lo pueden hacer en la carnicería, incluso en algunos establecimientos ya lo venden listo para cocinar. Luego, sala la carne al gusto, añade pimienta y pásala por harina.', '2\nAñade un poco de aceite a la olla y dora el redondo de ternera a fuego fuerte por todos lados. Retíralo y reserva.\nTruco: Este método de cocción se conoce como ""sellar"" y permite cocinar la carne por fuera para mantener todo su jugo por dentro.', '3\nAgrega un poco más de aceite e incorpora la cebolla picada para saltearla durante un par de minutos. Después, añade las setas variadas, limpias y cortadas en trozos. Saltea todo junto hasta que los ingredientes empiecen a coger un poco de color. Si quieres que tu redondo de ternera en olla quede con una salsa espesa, en este momento añade un par de cucharadas de harina y remueve.', '4\nAñade las cucharas de tomate frito, remueve y vierte el vino blanco. Deja que reduzca el alcohol unos 3-4 minutos.\nTruco: Puedes sustituir el vino blanco por vino tinto si quieres que la salsa quede con un sabor más intenso.', '5\nIntroduce la carne, cubre con un par de vasos de agua o caldo de carne. Si cocinas el redondo de ternera en olla express, ciérrala y cuando empiece a salir el vapor cuenta unos 40 minutos de cocción. Si, por el contrario, haces el redondo de ternera en olla lenta, deberás dejar que se cocine a fuego medio-bajo durante 2 horas, vigilando constantemente para comprobar el punto.\nTruco: Si usas agua, puedes añadir una pastilla de caldo para potenciar el sabor.', '6\nCuando este lista la carne retírala y deja que se enfríe. Cabe destacar que esta pieza suele encogerse más si la cocinamos en olla rápida que si la guisamos en olla normal.', '7\nCuando la carne esté fría, córtala en rodajas, calienta la salsa, rectifica de sal si es necesario, agrega los trozos de carne a la salsa y caliéntalos. Ya puedes servir la receta de redondo de ternera en olla acompañada de setas al ajillo, o el acompañamiento que más te guste.']",Valoración: 4 (1 voto),6 comensales,1h 30m,Plato principal,Dificultad baja,,['Recetas para Navidad'],"['1 redondo de ternera 1,5 kilos', '200 gramos de setas variadas', '1 cebolla grande', '4 cucharadas soperas de tomate frito', '200 mililitros de vino blanco', '2 cucharadas soperas de harina', '1 chorro de aceite de oliva', '1 vaso de agua o caldo (pastilla de caldo)', '1 pizca de sal', '1 pizca de pimienta']",https://www.recetasgratis.net/receta-de-redondo-de-ternera-en-olla-73710.html
¡Receta Fácil Paso a Paso!,"Esta receta de riñones al jerez es uno de los platos de casquería más suculentos que podemos encontrar. Puede prepararse con riñones de cerdo, cordero o ternera. En RecetasGratis hemos hecho la receta de riñones de cerdo, pero lo más importante es que sepamos limpiarlos bien para eliminar el olor característico del riñón y convertirlo en un bocado mucho más sabroso y suave.Aunque la casquería no tiene muchos adeptos, te aseguramos que esta receta es una delicia gastronómica a la que puedes darle una oportunidad con los ojos cerrados. De origen árabe, este plato ahora forma parte de la cocina española y nos encantará mostrarte el paso a paso para prepararlo. ¡Sigue leyendo y descubre cómo hacer riñones al jerez!","['1\nLos riñones deben tener un proceso importante de depuración y limpieza antes de preparar la receta. Si no fuese así, el plato se volvería desagradable por su olor. Para limpiarlo, pon a calentar suficiente agua para sumergir los riñones por completo. Pon sal, vinagre y laurel e introduce los riñones cortados en rodajas anchas.', '2\nNo dejes que el agua hierva nunca, solamente calienta sin remover. Cuando veas que empiezan a salir burbujas y espuma, sabrás que los riñones están comenzando a soltar la suciedad. En este paso, retira los riñones, remuévelos y enjuaga con agua fría 2 veces.\nTruco: Este proceso es uno de los métodos más efectivos para limpiarlo, puesto que existen otros con vinagre, pero hay que dejar los riñones durante uno o dos días y adquieren un sabor ácido y una textura diferente.', '3\nPela y corta una cebolla grande en taquitos. Introdúcelos en una cazuela con aceite de oliva previamente caliente. Remueve a fuego suave durante 2 minutos.', '4\nMuele la almendra ya tostada, esta ayudará a espesar la salsa y a darle un toque muy delicioso. Si no puedes consumir frutos secos, también puedes utilizar otros ingredientes como la harina de maíz o la harina de avena.', '5\nPela y corta el ajo a tu gusto. Sofríe junto con la cebolla durante 1 minuto, no dejes de remover para que no se queme.', '6\nEs el momento de poner los riñones al jerez. Agrega los riñones al sofrito de cebolla y ajo, remueve. Añade ahora el jerez. Cocina por 2 minutos para que el alcohol se evapore.\nTruco: Te recomendamos que escojas un jerez de muy buena calidad.', '7\nAñade la almendra picada, las especias y el laurel. Remueve suavemente.', '8\nVierte el caldo de carne. Si no tiene suficiente sal, añade un poco más al gusto. Tapa la preparación y déjala cocer a fuego medio durante 30 minutos. Destapa de vez en cuando y remueve. Si la salsa se consume demasiado, baja el fuego.', '9\nSirve inmediatamente después, con un poco de vino fino y tostones, todo muy típico de Andalucía. ¡Decora con perejil y disfruta de tus riñones al jerez! Esta receta también quedará muy bien si la acompañas con arroz hervido o unas patatas a lo pobre.']","Valoración: 4,7 (3 votos)",4 comensales,1h 30m,,Dificultad media,,"['Receta sin lactosa', 'Receta sin azúcar', 'Receta sin gluten', 'Recetas españolas', 'Recetas andaluzas']","['4 riñones de cerdo', '1 cucharada sopera de almendra molida', '1 cebolla', '2 dientes de ajo', '3 cucharadas soperas de aceite de oliva', '1 copa de jerez o fino', '1 cucharadita de orégano o romero y tomillo', '2 hojas de laurel', '2 pellizcos de sal', '1 vaso de caldo de carne', '1 cucharada sopera de sal', '2 cucharadas soperas de vinagre', '1 hoja de laurel', 'Agua']",https://www.recetasgratis.net/receta-de-rinones-al-jerez-73691.html
¡Receta Gallega Tradicional y Fácil!,"Nada tan famoso y exquisito como esta receta de lacón con grelos, un plato típico de Galicia que suele acompañarse con un buen vino txakoli. En RecetasGratis, vamos a mostrarte, paso a paso, la preparación de este rico plato. Es una receta muy sencilla, pues se realiza a base de cocer sus ingredientes y nada más. A pesar del embutido, es un plato suave que se podrá comer con cualquier ingrediente que quieras agregar o con cualquier acompañante de tu preferencia. ¿Te animas a prepararla? Hora de aprender cómo hacer lacón con grelo, ¡vamos!","['1\nComienza cociendo el lacón en una olla express por media hora, intenta que el agua lo cubra completamente. Añade solo un pellizco de sal al agua.', '2\nUna vez terminada la cocción, reserva el lacón y cuela el caldo. Viértelo en una olla aparte donde cocerás las patatas y los chorizos. Déjalos cocinar aproximadamente 20 minutos. \nTruco: Si puedes conseguir patatas cachelo será perfecto para preparar una auténtica receta gallega de lacón con grelos.', '3\nAñade los grelos a la cocción y deja cocinar por 5 minutos a temperatura alta. Añade más sal al gusto.', '4\nSirve tu lacón con grelos en una fuente, báñalo con un chorrito de aceite de oliva y añade pimentón de la vera si gustas. Prueba poniendo en tu plato un pedacito de cada elemento de la receta y aplástalo todo junto, ¡verás qué delicia! \nTruco: Si te quedó jugo de la cocción, guárdalo en la nevera para hacer sopas y salsas, pues la riqueza de este caldo es oro líquido.']","Valoración: 3,5 (2 votos)",4 comensales,1h 30m,Plato principal,Dificultad baja,,"['Receta sin lactosa', 'Receta sin azúcar', 'Recetas españolas', 'Recetas gallegas']","['1 kilogramo de lacón', '450 gramos de grelos al natural', '2 chorizos frescos', '3 patatas', '1 cucharada postre de sal', '2 pellizcos de pimentón de la vera']",https://www.recetasgratis.net/receta-de-lacon-con-grelos-73689.html
¡Receta Fácil de Guiso!,"El ragú, de la palabra francesa ragoût, es una receta de guiso muy famosa proveniente de Francia. En pocas palabras, está hecha de carne estofada con verduras y salsa. Aunque la receta más común se prepara con carne de ternera, puedes también hacerla con carnes de ave o pescados. En este caso, te traemos una receta de ragú de ternera muy fácil y deliciosa.Este plato de cuchara se suele preparar mucho en estaciones frías, pues nos hace entrar rápido en calor. Puedes usar piezas de carne ideales para guisos como la babilla, la falda o la aguja. Nos ponemos ya a cocinar, así que toma nota y aprende cómo hacer ragú de ternera en RecetasGratis.","['1\nCorta pequeños pedazos de carne con tamaño de bocado.\nTruco: Dependiendo de la parte de la ternera que utilices, obtendrás diferentes resultados. En este caso, te aconsejamos utilizar babilla de ternera, ¡no fallarás!', '2\nEnharina los pedacitos de carne y añádeles un pellizco de sal. Revuelve para que se distribuya bien por todos lados.', '3\nSella la carne en una sartén con aceite de oliva. Sácala y resérvala. Añade un poco más de aceite en la misma olla porque vas a seguir sofriendo el resto de ingredientes.', '4\nCorta y pica la cebolla y el ajo, cuartea la patata, corta rodajas anchas de zanahoria y así con todas las verduras.\nTruco: Intenta que el vino sea de buena calidad.', '5\nIntroduce el ajo picado y, cuando chisporrotee, añade la cebolla y remueve para dejar dorar ambos. La cebolla estará lista cuando veas que se vuelve transparente.', '6\nAñade la zanahoria, remueve y agrega los pedazos de carne que tenias reservados. Deja cocinar por 2 minutos.', '7\nAgrega el vino tinto y deja que evapore su alcohol por, aproximadamente, otro par de minutos.', '8\nSofríe el tomate junto con todo lo que hay en la olla. Si el tomate es frito, déjalo menos de 1 minuto. Si no es así, déjalo sofreír por al menos 2 minutos.', '9\nVe añadiendo el laurel y las especias, los guisantes y las patatas, puedes darle un punto de sal al gusto. Añade el agua, tapa y cuece al menos durante media hora.', '10\n¡Sirve la carne estofada y disfruta! Si te animas a preparar este ragú de ternera, cuéntanos qué tal te fue o si tienes dudas. Si prefieres preparar una salsa ragú vegana, visita nuestra receta.']","Valoración: 4,3 (3 votos)",4 comensales,1h 30m,,Dificultad media,,[],"['500 gramos de carne de ternera', '2 patatas', '1 taza de guisantes', '1 cebolla grande', '4 dientes de ajo', '1 cucharada sopera de tomillo y romero', '2 zanahorias', '2 hojas de laurel', '1 decilitro de agua', '1 vaso de vino tinto de buena calidad', '1 taza de harina (140 gramos)', '1 taza de tomate frito']",https://www.recetasgratis.net/receta-de-ragu-de-ternera-73676.html
Receta MUY FÁCIL (Con y Sin Horno),"El pastel de carne y patata es todo un clásico de la mayoría de gastronomías del mundo. Aunque son muchas las recetas que existen, en RecetasGratis vamos a aprender a elaborar una sencilla receta hecha a base de carne picada y puré de patata a la que, además, podremos incorporar más ingredientes si lo deseamos. Este plato es perfecto para los niños, ya que suele gustarles mucho el contraste de texturas y sabores que ofrece.Este pastel se prepara desde hace siglos. Se sospecha que su origen reside en el cottage pie, un plato tradicional de la gastronomía británica, y que existe desde el siglo XVIII. De esta forma, estamos ante una receta muy antigua y humilde, puesto que nació porque la patata era uno de los alimentos más económicos y accesibles para la clase pobre. Si tú también quieres aprender a cocinar este plato lleno de historia, sigue leyendo y descubre con nosotros cómo hacer pastel de carne picada y patata, ¡verás que es más fácil de lo que parece!","['1\nPela y pica la zanahoria y la cebolla. Pon una sartén a calentar con un chorro de aceite de oliva y sofríe la zanahoria y la cebolla picadas. Si lo prefieres, puedes sustituir la zanahoria por pimiento verde y añadir un poco de puerro picado. El sofrito de verduras permite potenciar el sabor del pastel de patata y carne picada, de manera que puedes variarlas sin problema.', '2\nIncorpora la carne picada y cocínala durante 10 minutos a fuego medio. Puedes utilizar una mezcla de carne molida de cerdo y ternera o decantarte por una de ellas.', '3\nVierte la salsa de tomate, mezcla y deja que se cocine todo junto durante 5 minutos más. En este punto, salpimienta al gusto.\nTruco: Nosotros hemos usado salsa de tomate troceado ya hecha, pero también puedes hacerla en casa picando finamente tomates frescos o triturándolos.', '4\nMientras preparas el sofrito, pela, trocea las patatas y cocínalas en una olla con agua hirviendo. Cuando estén listas, escúrrelas y tritúralas añadiendo poco a poco el caldo de carne. De esta forma podrás controlar la consistencia y textura que quieres que tenga tu puré.\nTruco: Si prefieres hacer el pastel de carne picada y patatas panaderas en lugar de puré, deberás cortarlas muy finas y freírlas.', '5\nPara montar el pastel de carne molida y patata, coge un molde apto para horno y coloca una primera capa de puré de papa. Encontrarás todo tipo de moldes y utensilios de cocina profesional en Dimoba suministros. El uso de utensilios adecuados siempre permite cocinar de una forma más cómoda y rápida, así como obtener platos mejores.', '6\nDistribuye el sofrito de carne y verduras sobre la capa de puré de manera uniforme.', '7\nColoca encima el resto de puré y espolvorea queso rallado al gusto. Hornea el pastel de carne picada y patata a 170 ºC durante 15-20 minutos, o hasta que el queso esté totalmente gratinado.\nTruco: Si no quieres hacer el pastel con queso, puedes servirlo así mismo.', '8\nPuedes disfrutar de esta deliciosa receta de pastel de carne molida y patata al horno fría o caliente. Este es un plato muy completo que, además, se presta a múltiples acompañamientos, como veremos a continuación.']",Valoración: 5 (4 votos),6 comensales,45m,,Dificultad baja,,[],"['350 gramos de carne picada', '400 gramos de salsa de tomate', '1 zanahoria', '8 patatas', '1 cebolla pequeña', '1 vaso de caldo de carne', '1 pizca de sal', '1 pizca de pimienta negra', 'Queso rallado al gusto']",https://www.recetasgratis.net/receta-de-pastel-de-carne-picada-y-patata-73681.html
