url,title,date,ingredients,steps
https://www.recetas.com/receta-de-Colada-morada-Will-8481.html,Colada morada Will,,"1 libra de mora 1 libra de frtutilla 1 babaco 1 piña 4 naranjillas Especias como son clavo de olor, canela , hispingo, anís estrellado 1/2 libra de mortiño 1 redondo de panela Hierbas aromaticas como hoja de naranja, cedrón, yerba luisa, hoja de mandarina 1 libra de harina negra

"," Colada morada Will

Poner en una recipiente a hervir las hierbas y las especies, añadir la piña en trozos pequeños y la panela; dejar hervir hasta que estén bien cocidas las piñas. Añadir entonces el babaco en trozos pequeños, luego la frutilla y continuar la cocción hasta que todo este suave y dulce,

Licuar la mora y el mortiño, pasar por un tamiz y poner el zumo en la olla de preparación. Continuar la cocción removiendo, para que no se asiente.

Poner la harina en un recipiente junto con un poco de agua, pasarlo por un colador y añadir esta mezcla a la preparación anterior, en cantidad deseada según se desee una textura liviana o más espesa."
https://www.recetas.com/receta-de-Adobo-para-sazonar-pavo-o-cerdo-5691.html,Adobo para sazonar pavo o cerdo,,"1 lt. de vinagre 1 lb. de ajo peladoSal Orégano en polvoSalsa de soyaNuez moscadaHojas de laurel1 lt. de jugo de fruta (naranja, piña, mandarina)1/2 lt. de aceite de oliva o mantequilla clarificada

"," Adobo para sazonar pavo o cerdo

Licuar todo y formar un aliño. Agregar luego 1 litro de jugo de naranja, piña o mandarina.

Dejar reposar la mezcla 1 hora en la nevera, y luego colar con la ayuda de un lienzo, estrujando bien para obtener un suero muy limpio.

Reservar el líquido obtenido en un tazón."
https://www.recetas.com/receta-de-Relleno-para-Nochebuena-y-Fin-de-ano-5692.html,Relleno para Nochebuena y Fin de año,,"Cantidades iguales de:Carne de pollo previamente cocida y desmenuzadaCarne de cerdo molidaCarne de res molidaChorizo español picado en cubitosAceitunas rellenas Nueces peladas u trituradasCiruelas pasas Cebolla picada en cuadritosPimientos picados en cuadritos1/2 cantidad de panAjo picado o machacadoPasta de tomateVino moscatel blanco o tinto o vino semisecoNuez moscada en polvo Pimienta , sal, orégano a gustoLecheAceite de achiote

"," Relleno para Nochebuena y Fin de año

Refreír la cebolla, el pimiento y el ajo en aceite de achiote y mantequilla; cuando esté un poquito dorado, adicionar las carnes y refreír hasta que estén bien cocidas. Condimentar un poco esta primera preparación.

En un bol, desmenuzar el pan y remojarlo con la leche y el vino, agregar a la cocción, cocinando a fuego lento y sin dejar de remover; ésto evitará que se pegue la mezcla.

Cuando haya espesado y la mezcla esté de color marrón oscuro, añadir las pasas, nueces, aceitunas, y la pasta de tomate; continuar la cocción y condimentar a gusto. No cocinar mas de 15 minutos después del último ingrediente adicionado."
https://www.recetas.com/receta-de-Patacones-5290.html,Patacones,,,
https://www.recetas.com/receta-de-Sazonado-de-mote-4933.html,Sazonado de mote,,"2 tazas de mote (maíz) cocido1 taza de leche 1 rama de cebolla blanca, finamente picada1 tableta de caldo concentrado4 cdas. de aceite con achiote1 cda. de culantro, finamente picadoSal y pimienta

"," Sazonado de mote

Poner un recipiente al fuego con el aceite, agregar la cebolla, el caldo concentrado, el culantro y la leche.

Dejar hervir unos 5 minutos y agregar el mote; enseguida, adicionar el huevo batido. Cuando la salsa empiece a espesar, sazonar con la sal y pimienta"
https://www.recetas.com/receta-de-Brownies-3691.html,Brownies,,," Brownies

Preparación:

Precalentar el horno a 180ºC y enmantequillar un molde apto para brownies (cuadrado o rectangular y más bien bajo)

Batir la mantequilla junto con el azúcar, luego agregar la vainilla y los huevos y seguir batiendo. Añadir el agua. Remover y agregar en 3 partes los polvos y batir hasta que quede una mezcla homogénea.



Colocar en el molde y llevar al horno por 30 minutos a 170ºC."
https://www.recetas.com/receta-de-Ensalada-Johana-3387.html,Ensalada Johana,,"5 ramas de yerbita ( culantro )

"," Ensalada Johana

Pelar el tomate, lavarlo, y luego cortarlo en cuadritos ponerlos en el recipiente para la ensalada

Lavar la cebolla cortarla en rodajas finas,luego ponerla en un plato con sal y limom por 1 minuto despues enjuagarla

Pelar en pepino de sal y cortelo en cuadritos

Mezclar la cebolla con el pepino de sal junto con el tomate , ponerle sal, aceite, y limon al gusto"
https://www.recetas.com/receta-de-Mangos-al-queso-gorgonzola-2906.html,Mangos al queso gorgonzola,,"Ingredientes 6 mangos

750 centilitros de vino blanco dulce

1 yema de huevo

150 gramos de mantequilla

300 gramos de queso gorgonzola

1 cucharada de maicena.

"," Mangos al queso gorgonzola

Cortar cada uno de los mangos por la mitad a ras del hueso, desechar éste y realizar unos cortes en la pulpa en forma de rombos bastantes profundos llegando prácticamente a la piel.



Luego, colocar en una cazuela bastante amplia con la piel en contacto con el fondo y cubrirlos con el vino, tapar parcialmente y dejar cocer a fuego medio durante 20 minutos aproximadamente.



Posteriormente, pasar la salsa de vino a un cacito, calentarla a fuego moderado y añadir la maicena, previamente diluida en un poco de agua fría, seguimos la cocción sin dejar de remover con una cuchara de madera hasta que la salsa espese.

Luego retirar del fuego y añadir la mantequilla y la yema de huevo y batir bien hasta conseguir una salsa emulsionada.

El siguiente paso es cortar el queso gorgonzola en trocitos muy pequeños, colocarlos encima de los mangos y gratinarlos muy poco, justo el tiempo necesario para que el queso empiece a ablandarse, cuando así servir los mangos inmediatamente, con la salsa en una salsera aparte."
https://www.recetas.com/receta-de-Pastel-de-pina-2909.html,Pastel de piña,,"½ vaso de leche200 gramos de harina½ vaso de aceite4 huevos yogur de piña200 gramos de azúcar4 rodajas de piña en almíbar1 sobrecito de levadura15 gramos de caramelo líquido20 gramos de mantequilla

"," Pastel de piña

Batir los huevos en un bol grande hasta que empiecen a espumar, añadir entonces la leche, el yogur y el aceite y batir bien hasta que veas que la preparación se ha homogenizado.Luego, añadeirel azúcar y mezclar nuevamente, incorporar la harina previamente mezclada con la levadura poco a poco sin dejar de batir a la preparación de los huevos.

Por otra parte, untar el fondo y las paredes de un molde para pasteles con la mantequilla y repartir un poco de caramelo por todo el molde. Colocar las rodajas de piña en el fondo y verter seguidamente la masa que preparaste.

Cocinar en el horno previamente precalentado a 180º C durante 40 minutos o hasta que veas que el pastel ya está en su punto. Retirar del horno y dejar enfriar antes de servir."
https://www.recetas.com/receta-de-Fresas-con-Leche-2873.html,Fresas con Leche,,," Fresas con Leche

Tomar 5 fresas, picarlas en trozos no muy pequeños, luego colocar 300 cc de leche fría en la licuadora. Agregarle 3 cucharadas de azúcar y unas 4 gotas de esencia de vainilla.

Nuevamente, colocar a batir por un rato hasta que se mezcle bien. Luego, colocar en una taza y añadirle frutillas."
https://www.recetas.com/receta-de-Sopa-de-acelgas-2409.html,Sopa de acelgas,,"3 atados de acelga 3 papas hervidas 2 huevos 3/4 lt. de caldo de verduras Sal Pimienta Nuez moscada a gusto 6 cdas. de queso rallado

"," Sopa de acelgas

Prepara un caldo de verduras, poniendo en una cacerola con agua todo tipo de verduritas (apio, perejil, albahaca, choclos, zanahorias, zapallo), luego estas verduritas pueden usarse para puré. Dejar hervir 20 minutos.

Separar las verduritas y usar el agua como caldo. Ahí mismo cocinar las papas y las acelgas. Retirar sin tirar el agua, pisar las papas y picar finamente la acelga, haciendo un puré con ambos elementos.

Condimentar con sal, pimienta, nuez moscada y queso rallado."
https://www.recetas.com/receta-de-Filete-de-Pescado-en-chile-ancho-2033.html,Filete de Pescado en chile ancho,,"Harina 3/4 kg. de filete de pescado Aceite 1 frasco de salsa para guisados de chile ancho 3 hojas de laurel Sal

"," Filete de Pescado en chile ancho

Enharinar los filetes y feírlos en aceite. Escurrir.

En otro recipiente, calentar la salsa de chile ancho y sazonar con laurel y sal.

Agregar los filetes y dejar hervir por 3 minutos.

Acompañar con timbal de arroz.

"
https://www.recetas.com/receta-de-Pequenos-budines-de-verdura-1702.html,Pequeños budines de verdura,,"240 gr. de queso crema1 cda. grande de almidón de maíz3 huevos2 cdas. de queso ralladoSalPimienta600 gr. de espinacas o zapallitosManteca (para enmantecar los moldecitos)2/3 de taza de aceite de oliva1/3 de taza de vinagre al estragón tomates perita

"," Pequeños budines de verdura

Preparación:



Batir el queso crema con el almidón de maíz, los huevos y el queso rallado, salpimentar.



Agregar las espinacas o zapallitos picados, distribuir en los moldecitos y espolvorear con más queso rallado. Hornear a baño maría por 40 minutos.

Mezclar el aceite de oliva con vinagre al estragón, salpimentar y añadir los tomates perita cubeteados.

Desmoldar y servir con la vinagreta."
https://www.recetas.com/receta-de-Locro-de-queso-1643.html,Locro de queso,,"3 lb. de papas cortadas en cuadritos3 tazas de agua2 cebollas blancas picadas1/2 cda. de mantequilla 1 cdta. de manteca rojaSal y pimienta al gusto1/2 taza de leche 5 oz. de queso rallado

"," Locro de queso

Colocar en una sartñen la manteca de color junto con la papa y la cebolla y freír por unos minutos.

Agregar agua y dejar que hierva hasta que se cocine la papa.

Salpimentar y echar la leche y el queso rallado.

Antes de finalizar la cocción, agregarle la crema de leche, remover y dejar unos minutos para que se integre bien."
https://www.recetas.com/receta-de-Crema-de-papas-y-cebolla-1644.html,Crema de papas y cebolla,,," Crema de papas y cebolla

Pelar y cortar las papas en cubitos. Colocarlas en una olla con agua y sal y hervir hasta que estén hechas.



En una sartén con mantequilla, dore la cebolla junto con el ajo.

Vuelque en la procesadora las papas y la preparación de ajo y cebolla. Agregue la leche y la crema de leche y licúe hasta obtener una crema homogénea.



Vuelva la crema a la olla, rectifique la sazón y caliente.

Sirva espolvoreada con queso rallado."
https://www.recetas.com/receta-de-Ensalada-fresca-de-camarones-1645.html,Ensalada fresca de camarones,,"2 lb. de camarones1/2 kg. de tomate1/2 kg. de cebolla (roja)1 cda. de salsa de tomate (ketchup)1 cda. de mostaza Jugo de limón c/nSal y pimienta

"," Ensalada fresca de camarones

Preparación:



Limpiar los camarones y hervirlos durante 5 minutos. Retirar, colar y colocarlos en un bol con jugo de limón.



Picar el tomate y la cebolla, y condimentar con jugo de limón, cilantro picado, sal y pimienta a gusto.

Escurrir los camarones y agregarlos a esta ensalada. Rectificar la sazón.

"
https://www.recetas.com/receta-de-Mousse-de-zapote-1647.html,Mousse de zapote,,," Mousse de zapote

Preparación:



Batir la crema de leche con el azúcar y la pulpa del zapotes.



Llevar las claras a punto nieve y disolver la gelatina en media taza de agua tibia.



Mezclar la crema junto con las claras a nieve y la gelatina hasta integrar bien todos los ingredientes.

Colocar en un molde (o moldes individuales) y llevar a la heladera hasta que la mousse esté bien firme y fría."
https://www.recetas.com/receta-de-Chucula-1649.html,Chucula,,"3 plátanos maduros Azúcar a gusto3 palitos de canela 4 clavos de olor1 lt. de leche

"," Chucula

Preparación:

Cocer los platanos con cáscara en agua por 10 minutos. Retirar, escurrir y pelar.

Licuar los plátanos trozados con 1 taza de leche.

Hervir la leche restante junto con la canela y el clavo, y agregar la preparación anterior a la olla. Agregar azúcar a gusto. Remover bien y apagar el fuego.

Llevar a la nevera hasta el momento de servir.

"
https://www.recetas.com/receta-de-Quesadillas-Quitenas-1651.html,Quesadillas Quiteñas,,"1 huevo1 cdta. de mantequilla o margarina1 taza de harina1/2 cdta. de sal disuelta con 2 cdas. de agua4 yemas de huevo1 taza de queso fresco rallado1 taza de azúcar impalpable1 cda. de maicena

"," Quesadillas Quiteñas

Preparación:



Batir el huevo junto con la margarina y al agua con sal. Formar una masa homogénea.

Aparte, mezclar las yemas con el azúcar y agregar luego la maicena. Revolver.

Agregar el queso.



Estirar la masa hasta unos 3 mm. de espesor y cortar círculos de unos 10 cm. de diámetro. Colocar en el centro de cada una un poco de relleno y cerrarlas haciendo 4 pellizcos, de manera que el relleno quede a la vista pero contenido por la masa.

Llevar al horno hasta que estén bien doradas.

"
https://www.recetas.com/receta-de-Ensalada-de-cangrejos-1653.html,Ensalada de cangrejos,,," Ensalada de cangrejos

Hervir las zanahorias y las patatas. Luego cortarlas.

Cortar la cebolla en aros y a remojarlos en jugo de limón.

Mezclar estas verduras y añadirle la pulpa de cangrejo y la mayonesa.

Salpimentar, remover bien, y llevar al frío hasta el momento de servir."
https://www.recetas.com/receta-de-Bolon-de-verde-1657.html,Bolon de verde,,," Bolon de verde

Preparación:



Hornear los plátanos por unos 15 minutos hasta que se ablanden.

Machacarlos bien y agregarles el queso rallado, la cebolla picada, la manteca y una pizca de sal. Amasar hasta que todo quede bien integrado.



Formar bollos con la masa y colocarlos en una placa. Llevar al horno hasta que se doren, unos 20 minutos aproximadamente."
https://www.recetas.com/receta-de-Mandioca-Frita-1658.html,Mandioca Frita,,," Mandioca Frita

Preparación:

Pelar y hervir la mandioca en agua con sal hasta que esté tierna. Retirar y escurrir.



Cortar la mandioca en trozos pequeños y freír en abundante aceite caliente hasta que quede bien dorada.

Condimentar con sal y pimienta a gusto."
https://www.recetas.com/receta-de-Llapingachos-1659.html,Llapingachos,,"4 lb. de papas cebolla blanca finamente picada4 cdas. de aceite con achioteQueso rallado2 yemas de huevoSal

"," Llapingachos

Pelar y hervir las papas en abundante agua con sal. Una vez listas, escurrir y hacerlas puré

En una sartén con aceite, dore las cebollas.



Agregar el sofrito de cebollas al puré de papas, condimentar con sal y pimienta y mezclar bien, hasta hacer una pasta.

Formar bolitas con el puré y agregar en el centro de las mismas un poco de queso rallado. Cerrar bien.

Freír las bolitas de papa en abundante aceite. Colocar en papel absorvente."
