url,title,date,ingredients,steps
https://www.recetas.com/receta-de-Potaje-2068.html,Potaje,,"1/2 kg. de alubias blancas1 tomate2 pimietos1 zanahoria Tocino de papada2 chorizos2 morcillas serranas1 trozo de costilla fresca de cerdo 1 trozo de carne de cerdo sin hueso1 taza pequeña de arroz por persona

"," Potaje

En una olla amplia, colocar las alubias con una pizca de sal, el pimentón, las verduras, morcillas, chorizos y carnes. Cocinar una hora.

Separar las verduras tiernas y triturar.

Colocar en un recipiente las carnes.



Echar el arroz en el caldo y esperar que se enternezca.

Servir como primer plato el arroz y como segundo las carnes junto con las verduras."
https://www.recetas.com/receta-de-Gurullos-con-conejo-2069.html,Gurullos con conejo,,"1/2 conejo 1/4 kg. de gurullos u otra psta corta1 tomate1 ajoSalAceite

"," Gurullos con conejo

Preparación:

Condimentar el conejo a gusto y saltearlo.

Aparte, asar el pimiento.

Agregar al conejo, el tomate cortado, el pimiento asado, la cebolla picada y el ajo a la preparación de conejo.

Agregar agua y dejar hervir suavemente hasta que el conejo esté casi a punto.

Echar entonces la pasta. Cocinar diez minuto más y servir todo junto."
https://www.recetas.com/receta-de-Cazuela-de-fideos-a-la-malaguena-2070.html,Cazuela de fideos a la malagueña,,"1/4 kg. de boquerones o bacalao salado1/4 kg. de almejas1/4 kg. de fideos medianos1 tomate125 gr. de habas frescas125 gr. de guisantes 2 zanahorias1 patataAceite de oliva1 lt. de aguaSal

"," Cazuela de fideos a la malagueña

Rebanar el pimiento, picar la cebolla y cortar el tomate.

Cortar las zanahorias y las patatas.

Cortar en cuatro la alcachofa.

Hacer un sofrito con el tomate, pimiento y cebolla.

Cuando esté cocido, agregar el resto de las verduras y el pescado.



Agregar el agua, una pizca de sal y de azafrán.

Cocinar media hora y agregar los fideos; seguir la cocción unos 10 minutos más.

Servir los fideos junto con el pescado y las verduras."
https://www.recetas.com/receta-de-Pastel-de-gelatina-2071.html,Pastel de gelatina,,"1 pote de queso tipo philadelphia1 envase de gelatina frutal a gusto Nata líquidaAgua

"," Pastel de gelatina

Batir en un recipiente la nata junto con el queso.



Preparar la gelatina como indique el paquete.



Agregar a la preparación anterior y mezclar, endulzando a gusto.



Volcar en un molde y refrigerar hasta que tome consistencia.



Desmoldar y servir."
https://www.recetas.com/receta-de-Setas-salteadas-2037.html,Setas salteadas,,"1/2 kg. setas1 o 2 guindillas2 dientes de ajo1/2 vaso de vino blanco Perejil picado a gustoSal

"," Setas salteadas

Poner en un una sartén u olla un fondo de aceite, poner las guindillas y los ajos cortados en láminas a dorar.

Mientras tanto, cortar la setas en tiras, y cuando esté dorado el ajo, agregarlas y dorar sin tapa hasta que se vaya consumiendo el líquido.

Agregar luego el vino y dejar que se consuma todo y se cocinen las setas.

Retirar del fuego, agregar el perejil, mezclar bien y servir.

"
https://www.recetas.com/receta-de-Truchas-escabechadas-1911.html,Truchas escabechadas,,"6 truchas 1 cebolla 3 dientes de ajo Pimienta negra 2 zanahorias cocidas 1 ají morrón rojo cortado en cubitos 2 dl. de aceite 2 dl. de vinagre 2 dl. de vino blanco 2 dl. de agua Harina Laurel Sal Tomillo

"," Truchas escabechadas

Prepaaración:

Salar las truchas y enharinarlas. En una sartén, poner el aceite, y cuando esté caliente, freír las truchas. Pasarlas, ya fritas, a una cazuela.

En la misma sartén donde se frieron las truchas, dorar una cebolla cortada en juliana, los dientes de ajo en rodajas y los cubitos de morrón.

Cuando estén dorados, añadir el vino blanco con el agua y el vinagre, la pimienta en grano, las hojas de laurel, el tomillo y la sal.

Dar un hervor y volcar en caliente sobre las truchas, llevar la cazuela con las truchas al fuego, hervir un par de minutos, probar de sal y añadir las zanahorias en rodajas.

Retirar del fuego y dejar enfriar."
https://www.recetas.com/receta-de-Perdices-estofadas-1897.html,Perdices estofadas,,," Perdices estofadas

Poner las perdices enteras en una cazuela, salar y agregar todo en crudo y picado, la cebolla, la zanahoria y los ajos. Incorporar el vino aceite, vinagre y la hoja de laurel. Llevar a cocinar a fuego suave, hasta que estén tiernas





Cuando estan listas, sacar las perdices, y pasar la salsa por el pasapuré, o procesadora.

"
https://www.recetas.com/receta-de-Albondigas-con-tomate-1793.html,Albondigas con tomate,,"1 kg. de carne de ternera picada2 huevos3 cdas. de pan ralladoHierbabuenaMejoranaPerejil1 cebolla pimiento rojo1 zanahoria1 pastilla de caldo de pollo o vegetal tomates maduros grandes1 ajo pequeño1/2 vaso de vino blancoSal

"," Albondigas con tomate

Preparación:



Mezclar en un bol la carne picada junto con el pan rallado, la hierbabuena, la mejorana, el perejil, los huevos, sal y pimienta. Mezclar bien durante unos minutos y formar albóndigas.



Saltear en una sartén con un poquito de aceite la cebolla. Agregar luego el pimiento, la zanahoria y el tomate (todos cubeteados), y dejar rehogar unos momentos.

Agregar el vino blanco y dejar que se evapore el alcohol. Añadir entonces el caldo (disuelto en 250 ml. de agua) y 1/2 cdta. de azúcar.Dejar cocer a fuego bajo hasta obtener la consistencia deseada en la salsa.

Pasar las albóndigas por harina y freírlas en abundante aceite caliente. Retirar y agregarlas a la sartén con la salsa.Dejar unos minutos para que tomen sabor."
https://www.recetas.com/receta-de-Crema-de-almejas-1745.html,Crema de almejas,,"500 gr. de almejas150 gr. de tomates2 cdas. de cebolla picada2 caldo1 cdta. de pimentón1 diente de ajo1 ramito de perejil2 cdas. de aceite

"," Crema de almejas

Poner a cocer las almejas, después de lavadas, en una cacerola con medio litro de agua hirviendo.

Cuando están abiertas, retirar del fuego, reservar las almejas y pasar el caldo por un tamiz para que no pase la arena; reservar el caldo.

Retirar las almejas de las conchas, echándolas en el caldo reservado.

En una cacerola con aceite, dorar la cebolla, luego incorporar el tomate picado y el pimentón, dejar freír despacio y añadir un poco de agua para que cueza bien.

A la media hora, pasar por el chino, apretando para que pase todo. Volver a la cacerola agregar el caldo con las almejas, los cubitos de caldo, el perejil y ajo bien machacados.

Completar con agua fría o caliente hasta el litro y medio de líquido, sazonar con sal, pimienta y llevar al fuego. Cuando rompe el hervor dejar cocer unos cinco minutos, retirar del fuego y dejar reposar cinco minutos antes de servir.

"
https://www.recetas.com/receta-de-Sopa-de-Pescado-1747.html,Sopa de Pescado,,," Sopa de Pescado

Sofreír los tomates, la cebolla, la zanahoria, el ajo y el perejil.

Añadir el pescado cortado entrozos no muy pequeños, el pan, la pimienta, la nuez moscada rallada y un poco de agua; dejar cocer unos 10 minutos.

Añadir por último las gambas, dejar cocinar 5 minutos más y servir caliente."
https://www.recetas.com/receta-de-Sopa-de-tomate-con-gambas-1748.html,Sopa de tomate con gambas,,"1 kg. de tomates3 filetes de merluza congelada2 rodajas de pan1 cebolleta1 trozo de pimiento rojo2 dientes de ajoSalPimientaNuez moscadaGambasCaldo de pescado

"," Sopa de tomate con gambas

Sofreír el pimiento, la cebolleta y los ajos; cuando estén transparentes, añadir el tomate pelado y picado.



Cocer unos minutos y agregar el pan, la pimienta, la nuez moscada rallada, sal y el caldo de pescado.

Dejar que siga cociéndose todo junto. Añadir las gambas peladas, dejar hervir un par de minutos más y servir."
https://www.recetas.com/receta-de-Spaghetti-con-camarones-1725.html,Spaghetti con camarones,,"500 gr. de spaguettis300 gr. de camarones2 cebollasAjo300 gr. de tomate Perejil fresco morrón rojo1 copa de vino blanco seco3 cdas. de aceite de olivaSal Pimienta negra

"," Spaghetti con camarones

Preparación:

Triturar el tomate, picar las cebollas, el ajo y el morrón; colocar el aceite en una sartén y saltear las verduras por unos minutos. Agregar luego el tomate, salpimentar y cocinar 10 minutos más.

Agregar los camarones (previamente limpiados) y el vino blanco. Cocinar unos 5 minutos más, corregir la sazón y apagar el fuego.

Hervir la pasta en abundante agua salada hasta que esté al dente. Colar y mezclar con la salsa.



Servir espolvoreado con perejil picado.

"
https://www.recetas.com/receta-de-Spaghetti-con-mejillones-y-berberechos-1726.html,Spaghetti con mejillones y berberechos,,"500 gr. de spaguettis 750 gr. de mejillones frescos con concha 250 gr. de berberechos 2 cdas. de aceite de oliva 1 cebolla 1 diente de ajo 450 gr. de tomate triturado 250 cc. de vino blanco 1 cda. de albahaca fresca 1 cda. de perejil

"," Spaghetti con mejillones y berberechos

Preparación:

Pelar los berberechos, cortar la cebolla en finas rodajas, picar la albahaca y el perejil.



Colocar la cebolla y el ajo en una cacerola a fuego suave con aceite caliente y saltear por 5 minutos, agregar el tomate y el vino; llevar a ebullición y después bajar el fuego y dejar cocer por 15 minutos más.

Cocinar en una olla los mejillones y los berberechos; retirar cuando los mejillones se abran y separar los que no se hallan abiertos. Agregue la albahaca y el perejil.

Cocinar los spaghuettis en agua hirviendo con sal hasta que estén al dente. Escurrir.



Mezclar los fideos con la salsa y por último, agregar los mejillones y los berberechos. Servir espolvoreado con perejil y albahaca."
https://www.recetas.com/receta-de-Calamares-rellenos-a-la-bretona-1728.html,Calamares rellenos a la bretona,,," Calamares rellenos a la bretona

Preparación:



Sudar la cebolla junto con el ajo y las echalotes en aceite. Una vez listas, mezclar con el pan rallado hasta obtener una pasta. Rellenar los calamares con esta preparación y cerrarlos con un palillo.

Picar las aletas y tentáculos y saltearlas en una sartén con un chorrito de aceite.

Agregar el tomate, el perejil y la cayena, salpimentar.

Colocar los calamares con el vino en esta preparación y dejar hasta que se cocinen, agregando chorritos de agua si fuera necesario.

Una vez que estén hechos los calamares, retirarlos y reducir el fondo de cocción, corregir la sazón si fuera necesario y agregar al final la manteca.



Servir los calamares con esta salsa."
https://www.recetas.com/receta-de-Langostinos-asados-1729.html,Langostinos asados,,"250 gr. de langostinos crudos1/4 de taza de perejil 1/4 de taza de aceite2 cdas. de salsa barbacoa2 cdas. de zumo de limón 1 cda. de miel 2 dientes de ajo2 cdas. de cebollino

"," Langostinos asados

Pelar los langostinos dejando la cola intacta.

Picar el cebollino, el perejil y mezclar con aceite, la salsa barbacoa, el zumo de limón, la miel y el ajo picado.



Agregar los langostinos, mezclar bien y dejar reposar 4 hrs.

Cocer los langostinos en una plancha bien caliente durante 3 minutos, vuelta y vuelta.



Servir acompañados con la marinada y unas papas hervidas o ensalada a gusto."
https://www.recetas.com/receta-de-Paella-de-arroz-a-banda-1704.html,Paella de arroz a banda,,"400 gr. arroz 2 cebollas250 gr. de chipirones200 gr. de rape 250 gr. de cigalas cocidas200 gr. de gambas200 gr. de mero 1/2 kg. de patata pequeña150 gr. de tomate natural triturado2 dientes de ajo10 cdas. de ceite de oliva1/2 lt. de agua Azafrán en hebrasSal2 cdtas. de pimentón dulce

"," Paella de arroz a banda

Pelar y trozar la cebolla y colocarla en una cazuela junto con 3 cucharadas de aceite, rehogar; añadir las patatas peladas y 1 cucharadita de pimentón.

Incorporar el agua y la sal, cocer por 20 min., e incorporar los pescados, (excepto los chipirones); cocer 10 min. y apartar.

Poner el aceite restante en una paella y freír los ajos picados, añadir los chipirones apartados anteriormente, rehogar unos minutos. Agregar el tomate, dejando freír a fuego lento, por 10 min. más.

Agregar el pimentón restante y el azafrán, rehogar unos segundos y añadir el arroz. Incorporar el caldo de los pescados, (el doble de volumen de caldo que de arroz). Dejar cocer 20 min., retirar y dejar reposar 5 minutos antes de servir."
https://www.recetas.com/receta-de-Pato-saltado-con-pure-de-manzanas-y-peras-1709.html,Pato saltado con puré de manzanas y peras,,"Ingredientes 4 supremas de pato

4 manzanas

4 peras

1 cebolla

1 cda. de azúcar

Canela

Jengibre

Vainilla

Salsa inglesa

"," Pato saltado con puré de manzanas y peras

Colocar las manzanas, la cebolla y las peras en el horno, cuando ya estén cocidas, pelarlas y procesarlas, condimentar con un poco de canela, jengibre y unas gotitas de vainilla.

Con ayuda de un cuchillo, hacer cortes transversales en la piel del pato, sin llegar a la cortar la carne, sólo la piel, el resultado final de estos cortes se debe asemejar a una celosía.

Agregar un poco de sal y de pimienta y marcarlo a fuego fuerte durante 2 minutos por cada lado. Luego llevarlo al horno a 180ºC entre 6 y 10 minutos, dependiendo del punto de cocción deseado.

Dejar reposar 1 min, cortar en rodajas y servir junto con el puré caliente; rociar con unas gotitas de salsa inglesa."
https://www.recetas.com/receta-de-Polenta-especial-1700.html,Polenta especial,,"Ingredientes 2 tazas de polenta instantánea

2 taza de leche

1 taza de agua

1 cubito de caldo de verdura o pollo

1 cda. de manteca

Sal y pimienta

1 taza de queso parmesano rallado grueso

Un pocillo de aceite de oliva

"," Polenta especial

En una olla combinar el agua, la leche, el caldito, la sal, pimienta y la manteca hasta que rompa el hervor. Bajar inmediatamente el fuego.



Agregar la polenta en forma de lluvia, revolviendo constantemente con cuchara de madera o batidor de alambre. Cocinar un minuto o dos, hasta que haga burbujas, y retirar del fuego.



Volcar en una fuente de horno o budinera grande untada con aceite de oliva. Dejar enfriar. (En este último paso puede ser dejada toda la noche).



Precalentar el horno bien caliente.

Cortar la polenta con un cuchillo mojado o un cortapastas, en rebanadas, cuadrados, triángulos, etc.



Poner en una placa para horno aceitada y espolvorear con queso rallado grueso.

Cocinar en horno bien caliente hasta que estén crocantes, más o menos 20 minutos. Servir calientes."
https://www.recetas.com/receta-de-Bacalao-al-estilo-de-Jacogo-1691.html,Bacalao al estilo de Jacogo,,"1 kg. de bacalao seco (si son lomos de altura uniforme, mejor)1 kg. de tomates para salsa cebolla grande4 pimientos (ajíes, chiles) choriceros (secos, algo picantillos) o “carne de pimientos choriceros” en conserva50 gr. de avellanas peladas y tostadas50 gr. de almendras tostadas y peladas (o fritas)

"," Bacalao al estilo de Jacogo

Desalar el bacalao convenientemente, pero sin dejarlo demasiado “soso”. (Desalarlo cambiando el agua frecuentemente y mantenerlo en sitio fresco (incluso en el frigorífico). Para una altura inicial de 2 cm, con dos días cambiando 3 o 4 veces al día el agua, será suficiente.



Escurrir y pasar los trozos de bacalao por la sartén con aceite de oliva bien caliente, por la parte de la piel solamente, sin que se llegue a freír del todo; e ir colocando los trozos en una cazuela de barro (o apta para el horno).

En el aceite de freír el bacalao, saltear la cebolla hasta que esté transparente. Añadir el tomate pelado y sin pepitas, revolviendo hasta que esté frito.

Limpiar los ""pimientos choriceros” quitarles los rabos y las semillas, picarlos y pasarlos por la procesadora (o usar directamente la “pasta de choriceros” en conserva), añadir las avellanas, las almendras y triturar.

Añadir esta pasta al sofrito de tomate y verter sobre el bacalao.

Meter al horno, precalentado, a 170ºC durante 20 minutos. Procurar que no se queme la superficie, protegiéndolo con un papel aluminio.

Los últimos cinco minutos, quitar el aluminio para que se gratine ligeramente."
https://www.recetas.com/receta-de-Judias-pintas-con-codornices-1692.html,Judias pintas con codornices,,"4 codornices pimiento morrón rojo1 pimiento morrón verde100 gr. de zanahorias2 dientes de ajo300 gr. de judías pintas (o 2 frascos de judías precocidas)1 pastilla de caldo de jamón (o de carne)

"," Judias pintas con codornices

Poner a remojar las judías (si no son las precocidas) la noche anterior y cocerlas.

Limpiar las codornices y abrirlas al medio, secarlas y enharinarlas.

Freírlas con aceite de oliva por ambos lados ligeramente.

En la misma grasa, pochar la zanahoria rallada y los demás los vegetales cortados en juliana.

Añadir las judías cocidas y las codornices, espolvorear con la pastilla de caldo y cocer suavemente por 15 min."
https://www.recetas.com/receta-de-Pulpo-con-cachelos-1680.html,Pulpo con cachelos,,"Ingredientes 2 kg. de pulpo

2 kg. de patatas

100 gr. de pimentón picante

100 gr. de sal semigruesa

Aceite

"," Pulpo con cachelos

Es preferible congelar el pulpo antes de utilizarlo. Así se ablandará sin tener que golpearlo.

Una vez bien descongelado y lavado, llevar el pulpo a una olla con agua hirviendo, (metiéndolo y sacándolo tres veces) para evitar que se despelleje.



Dejar cocer a fuego medio durante 35 minutos aproximadamente. Apagar el fuego y dejar unos 25 minutos más en el agua.

Servir con patatas cocidas ""cachelos"".

Para esto, poner a cocer en el agua del pulpo, unas patatas cortadas en rodajas gruesas.

Una vez cocidas, disponer en un plato, bien escurridas. Agregar el pulpo por encima yespolvorer con pimentón, regar con el aceite y sal gruesa al final."
https://www.recetas.com/receta-de-Sopa-de-lentejas-amarillas-peladas-1684.html,Sopa de lentejas amarillas peladas,,," Sopa de lentejas amarillas peladas

Poner las lentejas en agua con la cebolla, el tomate, la zanahoria, el calabacin y dejar hervir 1 hora.

Colar y añadir la sal, el comino y la cayena. Calentar el aceite y freír la cebolla previamente rallada.

Echar las lentejas y removerlas a fuego lento durante solamente 10 min. Freír el pan en aceite y servirlo aparte."
https://www.recetas.com/receta-de-Frangollo-1671.html,Frangollo,,," Frangollo

Preparación



Colocar 1/2 kg. de frangollo -harina de millo (maíz) sin refinar- en 1 lt. de agua y llevar al fuego con una rama de canela y cáscara de limón.



Revolver hasta que espese y llevar a la nevera.



"
https://www.recetas.com/receta-de-Cerdo-con-verduras-1633.html,Cerdo con verduras,,"600 gr. de solomillo o lomo de cerdo500 gr. de hongos frescos zanahoria pequeña cocida150 gr. de arvejas cocidas al dente1 vaso de vino blanco1 vaso de salsa española1 cda. de harina Sal gruesa

"," Cerdo con verduras

Poner en una sartén 3 cucharadas de aceite, dejar calentar y dorar la carne de cerdo vuelta y vuelta. Retirar, y en el aceite que quedó, saltear las setas.

Añadir la harina, luego el vino blanco y la salsa española.

Reducir a consistencia de napa y salar. Añadir a último momento las verduras, previamente cortadas en cubitos, y dejar cocinar unos minutos más.



Servir la carne fileteada junto con la salsa de verduras.

"
https://www.recetas.com/receta-de-Champinones-rellenos-1600.html,Champiñones rellenos,,"Ingredientes 1 kg. de champiñones

1 limón

2 puerros

1 diente de ajo

1/2 vaso de vino blanco

Queso rallado

Perejil

Aceite

Sal

"," Champiñones rellenos

Limpiar los champiñones con un paño limpio, sin mojarlos para que no se ablanden. Rociarlos con un poco de zumo de limón. Quitarles el pedúnculo o rabito y reservarlo.

En una sartén, saltear los puerros muy picados junto con los pedúnculos y el diente de ajo, regarlo con el vino blanco y dejar unos minutos al fuego.

Colocar los champiñones en una fuente de horno untada con aceite, rellenarlos con la preparación anterior, cubrirlos con el queso rallado y un poco de perejil picado y llevaral horno previamente calentado a unos 190ºC durante unos 15 minutos.

Servir enseguida para comerlos calientes."
https://www.recetas.com/receta-de-Cocido-de-frijoles-y-garbanzos-1482.html,Cocido de frijoles y garbanzos,,"1/4 kg. de garbanzos1/8 kg. de frijoles1/8 kg. de judías verdes1/4 kg. de patatas1 tomate1 pimiento1/2 vaso de aceite de olivaLonganiza1 chorizo1 trozo de carne de cerdo1/2 kg. de calabaza3 dientes de ajoPimentón y sal

"," Cocido de frijoles y garbanzos

Poner a hervir los frijoles. A los pocos minutos, agregar la longaniza, el chorizo, la carne en cubos, los garbanzos, el tomate picado y la calabaza.

Aparte, picar el ajo y mezclarlo con el pimentón y añadirlo a la cocción.

Agregar un poco mas de agua y dejar cocinar a fuego suave, durante una hora aproximadamente.

Incorporar las judías y las papas y seguir la cocción unos 15 minutos más, hasta que todo se tiernice y la salsa se espese."
https://www.recetas.com/receta-de-Tortilla-de-papas-y-panceta-1455.html,Tortilla de papas y panceta,,," Tortilla de papas y panceta

Cortar las papas y freírlas.

Aparte, freír el morrón, también cortado.



En un recipiente, echar los huevos salpimentados y añadir las papas, el morrón y la panceta.

Volcar la preparación en una sartén con poco aceite caliente y dejar cocinar removiendo al principio. Cuando se note que ha cuajado en su base, dar vuelta con ayuda de un plato y terminar la cocción del otro lado."
https://www.recetas.com/receta-de-Patatas-con-Bacalao-1225.html,Patatas con Bacalao,,," Patatas con Bacalao

Colocar 24 horas antes el bacalao en agua, cambiándola unas 3 veces.

En una cazuela de barro con aceite, dorar el diente de ajo, la cebolla en tiras y el bacalao enharinado.



Agregar las patatas cortadas pequeñas, la hoja de laurel, el condimento amarillo y una cucharadita de harina.

Rehogar a fuego lento 10 minutos y añadir un vaso de agua.

Dejar cocinar a fuego suave hasta que estén cocidas las patatas."
https://www.recetas.com/receta-de-Pollo-al-Ajillo-1229.html,Pollo al Ajillo,,"Ingredientes 2 trozos de pollo

1 diente de ajo

Perejil

Aceite

Sal

"," Pollo al Ajillo

Sazonar el pollo y rehogarlo en un poco de aceite.

Pasarlo a una cazuela de barro. Agregar 1 taza de caldo y continuar la cocción hasta que el pollo esté listo.

Freír hasta dorar el ajo cortado en rodajas junto con una rama de perejil.

Echar esta preparación por encima del pollo, para que tome el sabor, y dejar un par de minutos en el fuego."
https://www.recetas.com/receta-de-Potaje-de-Garbanzos-1231.html,Potaje de Garbanzos,,," Potaje de Garbanzos

Poner los garbanzos en una olla cubiertos con agua caliente, junto a dos dientes de ajo y una hoja de laurel. Llevar a hervir por 3 horas en fuego suave.

Limpiar las espinacas y trocearlas. Cuando los garbanzos estén listos, añadir las espinacas picadas y cocinar por unos minutos más.

Picar la cebolla y freírla, añadir un poco de pimentón y una cucharada de harina, mezclar bien e incorporar a la sopa."
https://www.recetas.com/receta-de-Puerro-y-Tomate-al-azafran-1232.html,Puerro y Tomate al azafrán,,"Ingredientes 2 puerros

1 tomate

1 vaso de caldo de carne

Perejil

Laurel

Tomillo

Sal

Azafrán



"," Puerro y Tomate al azafrán

Engrasar ligeramente una fuente, colocar en ella los puerros y cubrirlos con el caldo. Agregar el tomate cortado (sin semilla) y el azafrán.

Sazonar, agregar una rama de tomillo y una hoja de laurel.

Cocer a fuego suave, hasta que el caldo se haya evaporado.

"
https://www.recetas.com/receta-de-Pure-de-Lentejas-y-Pollo-1233.html,Puré de Lentejas y Pollo,,"50 gr. de lentejas cocidas2 cdas. soperas de pollo picado1/2 tomate pequeño picado1 cdta. de almidón de maíz1 cdta. de aceite de oliva

"," Puré de Lentejas y Pollo

Pisar las lentejas para hacer un puré (o procesarlas).

Deshacer el almidón de maíz en el caldo, calentando hasta que espese.

Retirar del fuego y agregar el puré de lentejas, el pollo picado y el tomate también picado.

Aliñar con el aceite, mezclar bien y llevar al fuego un par de minutos.

"
https://www.recetas.com/receta-de-Revuelto-de-calabacin-1236.html,Revuelto de calabacín,,"Ingredientes 1 calabacín mediano

1/2 cebolla

1 huevo

Aceite

Sal

"," Revuelto de calabacín

Preparación:

Pelar, cortar la cebolla y saltear en una sartén a fuego suave con un poco de aceite.

Cuando se haya dorado, añadir el calabacín lavado y cortado en rodajas finas. Saltear hasta que esté tierno.

Escurrir el aceite que queda y añadir un huevo, removiéndolo hasta que cuaje."
https://www.recetas.com/receta-de-Rollitos-de-Ternera-1237.html,Rollitos de Ternera,,"2 escalopes de ternera 30 gr. de carne picada 1 loncha de jamón cocido (sin conservantes) 3 cebollitas pequeñas Aceite Limón Harina Almidón de maíz 1 cda. sopera de mantequilla

"," Rollitos de Ternera

Rellenar los escalopes con la carne picada y el jamón. Enrollarlos y atarlos.

Pasarlos por harina y dorar lentamente en un poco de mantequila o aceite.



Agregar las cebollitas. Cuando estén cocidas (pero no deshechas), agregar el jugo de cocción de los rollitos y el jugo del limón.

Cocinar suavemente por 5 minutos e incorporar una cucharadita de almidón de maíz, disuelta previamente en agua, para espesar la salsa."
https://www.recetas.com/receta-de-Tomates-rellenos-1238.html,Tomates rellenos,,"1 tomate grande maduro 1 gajo de cebolla 30 gr. de carne asada 25 gr. de arroz cocido 20 gr. de mantequilla 1 cdta. de nata 1 cda. de queso rallado 1 cda. de pan rallado Perejil Sal

"," Tomates rellenos

Cortar una rodaja en la parte superior del tomate y vaciar el relleno.

Sofreír la cebolla picada con la manteca, y cuando esté blanda, agregar la carne picada, el arroz, la nata y el perejil picado.

Condimentar con pimienta y una pizca de sal, cocinar durante tres minutos.

Rellenar el tomate con esta mezcla y llevar al horno durante diez minutos."
