url,title,date,ingredients,steps
https://www.recetas.com/receta-de-Torrijas-1239.html,Torrijas,,"1 barra de pan del día anterior 1 lt. de leche 3 huevos 1/4 kg. de azúcar 1 cda. de canela en polvo Ralladura de 1 limón Aceite para freír las torrijas

"," Torrijas

Preparación:

Cortar el pan en rebanadas y colocarlas en una fuente cubierta con la leche y las raspaduras de limón para que se empapen bien.

Pasarlas por huevo batido y sofreírlas en aceite.

Servir en bandeja, espolvoreadas con el azúcar mezclado con canela."
https://www.recetas.com/receta-de-Sopa-Primavera-1242.html,Sopa Primavera,,"100 gr. de jamón picado2 zanahorias tiernas cebolla tierna100 gr. de judías verdes finas2 cdas. de guisantes3 hojas de lechuga3 cdas. de aceite4 cdas. de fideos para sopa

"," Sopa Primavera

Cocinar el jamón junto con la cebolla picada y añadirle la zanahoria cortada. Rehogar unos minutos.



Añadir agua y dejar que hierva; a los 10 minutos, agregar las judías verdes troceadas, los guisantes y las hojas de lechuga picadas.



Deja cocinar lentamente media hora a fuego suave.

10 minutos antes de servir, añadir los fideos."
https://www.recetas.com/receta-de-Cazuelita-de-verduras-1202.html,Cazuelita de verduras,,"250 gr. de judías verdes250 gr. de champiñón250 gr. de zanahorias tiernas250 gr. de guisantes250 gr. de cebollitas pequeñas y tiernas250 gr. de setas de cardo1 manojo de espárragos rábano redondo50 gr. de manteca de cerdo 1 cortada de tocino 1 trozo de codillo de jamón1 trozo de espinazo de cerdo250 gr. de cebollaSal

"," Cazuelita de verduras

Cocinar por separado las verduras ya cortadas.

En una cazuela, poner la manteca de cerdo, agregar el tocino e incorporar el codillo y el espinazo. Enseguida, añadir la cebolla.

Dejar cocinar suavemente con la cazuela tapada, agregando caldo.

Una vez cocido, verificar la sazón y pasar la salsa por el chino.

Llevar a fuego suave durante unos minutos y bañar la verdura con esta salsa."
https://www.recetas.com/receta-de-Crema-de-Jamon-1207.html,Crema de Jamón,,"1 taza de puré de verduras 1 loncha de Jamón cocido 1 cda. de caldo de ave

"," Crema de Jamón

Triturar el jamón, y agregar al picadillo el caldo de ave y la taza de caldo de verduras.

Mezclar bien y llevar al fuego a calentar."
https://www.recetas.com/receta-de-Empanadillas-de-queso-triangulares-1209.html,Empanadillas de queso triangulares,,"250 gr. de queso feta (queso blanco griego) 1 taza de queso gruyere rallado 1/2 taza de leche 2 huevos 1 taza de mantequilla derretida 10 hojas de masa hojaldrada 1 pizca de nuez moscada rallada

"," Empanadillas de queso triangulares

Aplastar el queso feta y colocar en un bol. Agregar los huevos junto con el queso gruyere (rallado previamente). Mezclar todos los ingredientes y añadir la leche y la nuez moscada.

Cortar las hojas de masa de hojaldre, untarlas con manteca.

Colocar una cucharada de la mezcla en una punta y doblar formando un triángulo.

Colocar en una fuente apta para horno, untada con mantequilla, y por último cocinar en horno moderado, hasta que la masa esté dorada."
https://www.recetas.com/receta-de-Ensalada-de-Arroz-1211.html,Ensalada de Arroz,,"1 taza de arroz largo50 gr. de atún en aceite30 gr. de guisantes cocidos1 cda. de cebolla picada1 cda. de aceite1/2 limónSal

"," Ensalada de Arroz

En una cacerola con agua salada, cocer el arroz.

Escurrirlo y pasarlo por agua fría.



Condimentar el arroz con el aceite, sal, limón, perejil y agregar la cebolla muy picada, el atún y los guisantes. Integrar todo muy bien.

Untar con mantequilla un molde y pone el arroz presionándolo con firmeza. Llevar unos minutos al frío y desmoldar."
https://www.recetas.com/receta-de-Ensalada-de-remolacha-y-huevo-1213.html,Ensalada de remolacha y huevo,,," Ensalada de remolacha y huevo

Preparación:

En un bol, incorporar lechuga picada a gusto junto con las remolachas peladas y cortadas en cubitos y los huevos duros picados."
https://www.recetas.com/receta-de-Espinacas-a-la-Catalana-1214.html,Espinacas a la Catalana,,"Ingredientes 2 manojos de espinacas

1 cda. de piñones

2 cdas. de pasas de Corinto

2 cdas. de aceite

"," Espinacas a la Catalana

Preparación:

Limpiar las espinacas y hervirlas. Escurrir.

En una sartén, echar unas cucharadas de aceite, las pasas, y después los piñones; incorporar las espinacas escurridas.



Dar unas vueltas a todo hasta que se mezcle y los piñones estén a punto."
https://www.recetas.com/receta-de-Flan-de-huevo-y-tomate-1217.html,Flan de huevo y tomate,,"1 huevo 1 cda. de salsa de tomate 1 cda. (de café) de almidón de maíz 1 cda. de mantequilla 1 cda. de aceite 1 taza (de café) de leche Sal

"," Flan de huevo y tomate

Preparación:

Calentar la mitad de la manteca y el aceite en una sartén. Agregar a leche (en la que previamente habremos disuelto el almidón de maíz). Sazonar.



Revolver con cuchara de madera hasta que esté lista la salsa bechamel, retirar del fuego y dejar reposar hasta que se entibie.

Añadir la yema del huevo (siempre mezclándolo bien), la salsa de tomate y la clara batida a punto de nieve, mezclándola de a poco.

Con la otra mitad de la manteca, untar un molde de flan.

Verter el preparado y cocinar a baño María en el horno hasta que cuaje."
https://www.recetas.com/receta-de-Mousse-de-Platano-1222.html,Mousse de Plátano,,,
https://www.recetas.com/receta-de-Muslos-de-pollo-al-champinon-1223.html,Muslos de pollo al champiñon,,"6 muslos de pollo cebolla pequeña1 cda. de harina1 vaso de vino blancoAgua200 gr. de champiñonesAceiteSal

"," Muslos de pollo al champiñon

Preparación:

En una cacerola, poner 5 cucharadas soperas de aceite y dorar los muslos. Retirar y reservar.

En la misma cacerola (retirando gran parte de la grasa que haya soltado el pollo) freír la cebolla picada, añadir la harina y remover con una cuchara de madera, echar el vino, mezclar y volver los muslos a la cacerola.



Cubrir con agua, tapar la cacerola y cocinar a fuego suave por 25 minutos.

A los 15 minutos, sacar los muslos, y pasar la salsa por la procesadora.

Volver la salsa a la cacerola junto con los muslos y los champiñones cortados, para que se terminen de cocinar."
https://www.recetas.com/receta-de-Acelgas-con-Patata-1191.html,Acelgas con Patata,,"Ingredientes 1 manojo de acelgas

1 patata mediana

Sal

150 gr. de aceite



"," Acelgas con Patata

Lavar y cortar la acelga. Pelar la patata y poner a cocinar junto con la acelga y un poquito de sal.

Cuando la patata esté cocida, poner en un plato y pisarla.

En una sartén poner el aceite y dorar la patata hasta que quede crujiente. Agregar la acelga cortada y mezclar, dándole un par de vueltas.

Rectificar de sal y servir."
https://www.recetas.com/receta-de-Acelgas-Rebozadas-1192.html,Acelgas Rebozadas,,," Acelgas Rebozadas

Para esta receta utilizar sólo las pencas de las acelgas, reservando la hoja para otros usos.

Cortar en trozos largos las pencas, retirándoles los hilos; hervir con agua ligeramente salada y cuando estén tiernas, escurrir.

Preparar una pasta con el huevo batido, harina y un poco de sal, tiene que estar espesa para que cubra las pencas.

En el momento en que vayan a servirse, rebozar y se freír en aceite caliente, hasta que queden bien doradas."
https://www.recetas.com/receta-de-Arroz-a-la-marinera-1193.html,Arroz a la marinera,,"1 taza de arroz (tamaño café) 1 hueso de rape 1 sepia pequeña 4 almejas 1 tomate 1 diente de ajo 1 rama de perejil 1 cda. de aceite Azafrán

"," Arroz a la marinera

Preparación:



Preparar un caldo con las almejas, el hueso de rape y medio litro de agua.

Limpiar la sepia y cortarla en trozos, sofreír en una sartén con aceite y agregar al recipiente donde se vaya a hacer el arroz.

En ese mismo aceite, poner el tomate picado con el ajo y el perejil, añadir el arroz y dar unas vueltas rápidas, vertiendo despues en el recipiente donde este la sepia.

Añadir tres tazas del caldo y llevar al fuego, agregar las almejas, las mollas que tenga el hueso de rape, y el azafrán.

Sazonar a gusto y dejar hervir hasta que el arroz esté cocido.

"
https://www.recetas.com/receta-de-Sopa-Parmentier-1179.html,Sopa Parmentier,,"1 lt. de agua400 gr. de papas30 gr. de mantequilla 2 yemas de huevo 70 gr. de nata líquidaTrozos de pan tostadoSal

"," Sopa Parmentier

Limpie el puerro, guardando solo la parte blanca y corte en rodajas finas.

Pele las papas, lávelas y córtelas en trozos.

Ponga el puerro y las papas en una olla con el agua y sal al gusto, y cocine durante 40 minutos.

Pase por el prensapapas y pongalo al fuego junto con la mantequilla.

Aparte, mezcle las yemas con la nata, retire la olla del fuego y, sin dejar de batir con una batidora manual, añada la mezcla a la crema hirviendo. Sazone al gusto.

Sirva acompañado de pan tostado."
https://www.recetas.com/receta-de-Fruta-frita-1135.html,Fruta frita,,"1 manzana pelada y cortada en gajos pera pelada y cortada en gajos1 banana cortada en rebanadasMantequilla2 o 3 cdas. de miel o mermelada de fresa

"," Fruta frita

En una sartén, poner la mantequilla y freír la fruta hasta que esté un poco blanda.

Añadir la mermelada o la miel y remover para que se impregnen.

Retirar cuando la fruta este blanda.

Servir con pancakes y acompañar con helado de crema."
https://www.recetas.com/receta-de-Frutas-con-yogurt-1136.html,Frutas con yogurt,,"1 mango1 manzanaAlgunas frutillas1 taza de yogurt sabor manzana u otro a gusto azúcar al gusto

"," Frutas con yogurt

Pelar el mango y sacar la pulpa, retirar el corazón y semillas de la manzana (sin pelar). Cocinar las frutas en 1/4 de taza de agua con poca azúcar a fuego medio.

Al momento de servir, lavar y cortar las frutillas, mezclarlas con la fruta y acompañar con el yogurt."
https://www.recetas.com/receta-de-Pastel-de-compota-de-frutas-1138.html,Pastel de compota de frutas,,," Pastel de compota de frutas

En un molde o fuente, colocar una capa de galletas María mojadas en jugo de naranja, y una capa de compota de frutas.

Repetir tantas veces como alcance la compota.



Intentar que la compota no esté muy líquida para que quede lo mas compacta posible y no moje mucho tiempo las galletas.

Bañar con la crema chantilly y espolvorear con canela molida."
https://www.recetas.com/receta-de-Bocaditos-de-pollo-1139.html,Bocaditos de pollo,,"1 taza de pollo cocido y deshebrado2 tazas de harina1 cda. de polvo para hornear1/2 cda. de sal1/2 taza de queso cheddar rallado6 cdas. de manteca vegetal2/3 de taza de leche aceite para freír

"," Bocaditos de pollo

Cernir la harina con el polvo para hornear y la sal, poner la mezcla en una superficie limpia y hacer una fuente en el centro.

Añadir al pollo, el queso y la manteca cortada en trozos.

Agregar la leche, poco a poco, y amasar hasta lograr una pasta firme (si es necesario, poner un poco mas de leche).

Tomar porciones y formar bolitas, freírlas en aceite caliente y escurrirlas sobre papel absorbente."
https://www.recetas.com/receta-de-Tortilla-de-espinacas-1156.html,Tortilla de espinacas,,," Tortilla de espinacas

Dorar la cebolla picada en un poquito de aceite, luego agregarle las espinacas bien escurridas y cocinar por 1 minuto.

Aparte, batir muy bien los huevos y agregar las espinacas: condimentar a gusto, revolver, y volcar la mezcla en la sartén.

Cocinar a fuego lento y con una tapa, dar vuelta la tortilla para que se cocine del otro lado."
https://www.recetas.com/receta-de-Formitas-de-pollo-1162.html,Formitas de pollo,,"1/2 kg. de supremas de pollo deshuesadasSal y pimienta a gusto1 yema2 cdas. de almidón de maíz Pan rallado c/n2 huevosAceite

"," Formitas de pollo

Cortar el pollo en cubos y luego procesarlo.

Colocar la pasta de pollo en un bol, salpimentar y agregar la yema, el almidón de maíz y 1 cucharada de pan rallado.

Mezclar con cuchara de madera hasta integrar bien.

Modelar la masa con las manos formando cualquier otra figura (a gusto) y reservar.

En otro bol, batir los huevos y salpimentar. Reservar.

En una fuente, colocar pan suficiente como para rebozar.

Pasar las formitas por la mezcla de huevo y, luego, por el pan rallado.

Colocarlas en una fuente de horno previamente pincelada con aceite.

Con la ayuda del pincel, aceitar un poco la superficie de cada formita.

Cocinarlas en horno moderado, de ambos lados, hasta que estén bien doradas y crujientes.



Pueden también freírse en aceite, aproximadamente 4 minutos por lado, hasta que estén bien doradas. Servirlas solas o con papas fritas."
https://www.recetas.com/receta-de-Crema-de-calabacines-1164.html,Crema de calabacines,,," Crema de calabacines

Rehogar en una cazuela con un chorro de aceite la cebolla, la papa y los calabacines, cubrirlo de agua, salpimentar agusto y añadir las porciones de queso.

Cuando la patata esté blanda, pasar todo por la batidora, y el puré resultante por un chino para quitarle cualquier trozo que haya quedado.

Servir con un hilo de crema o cubos de pan frito."
https://www.recetas.com/receta-de-Pure-de-calabaza-y-manzana-1165.html,Puré de calabaza y manzana,,," Puré de calabaza y manzana

Pelar la calabaza y la manzana, cortar en cubos y disponer en una fuente para horno.

Agregar 1/2 taza de agua y hornear aproximadamente media hora, removiendo de tanto en tanto, hasta que la calbaza esté tierna.

Retirar del horno, escurrir el líquido y procesar."
https://www.recetas.com/receta-de-Pure-de-pera-y-espinaca-1169.html,Puré de pera y espinaca,,," Puré de pera y espinaca

Lavar muy bien las espinacas.

En una cazuela, calentar la mantequilla y las espinacas hasta que estén tiernas.

Mientras tanto, en otra cazuela, poner a hervir la pera hasta que esté tierna.

Escurrirla y machacarla junto con las espinacas."
https://www.recetas.com/receta-de-Arroz-verde-1133.html,Arroz verde,,," Arroz verde

En una cazuela, rehogue el arroz con la manteca, a fuego lento, durante unos 10 min, revolviendo continuamente con la cuchara de madera hasta que esté dorado.

Agregue el caldo, salpimente a gusto, suba a fuego medio/alto y siga revolviendo hasta que hierva.

Baje a fuego lento, tape, y cueza durante unos 20 min.

Retire y reserve tapado.

Mientras tanto, en una sartén, rehogue a fuego medio la cebolla con el aceite por unos 5 min, mezclando continuamente.

Agregue la espinaca, baje la llama a lenta, tape y cocine 10 min.

Agregue las cebollas de verdeo y cocine revolviendo por 1 minuto más.



Incorpore la mezcla al arroz, junto con el perejil y el cilantro picados; mezcle y sirva."
https://www.recetas.com/receta-de-Arroz-con-carne-1131.html,Arroz con carne,,"350 gr. de arroz 1/2 kg. de carne picada de buey10 hojas menta (picadas)2 cebollas (picadas)1 cda. de albahaca 2 dientes ajo machacados1/2 lt. de salsa de tomate5 cl. aceite60 gr. de pasas corinto150 gr. de queso parmesanoSal

"," Arroz con carne

Rehogar la cebolla y el ajo, añadir la carne y luego la menta, la albahaca, la salsa de tomate, las pasas y los condimentos. Cocer todo junto por media hora.

Cocer el arroz en agua salada, escurrir y añadir a la carne. Agregar el queso rallado, remover unos minutos para integrar y servir."
https://www.recetas.com/receta-de-Fresas-con-requeson-gratinadas-1127.html,Fresas con requesón gratinadas,,"90 gr. de fresas (por persona)2 claras de huevo50 gr. de azúcar 250 gr. de requesón 40%25 gr. de azúcar lustre2 yemas y huevo Un poco de piel de limón rallada

"," Fresas con requesón gratinadas

Lavar las fresas y ponerlas en un recipiente enmantecado, que pueda ir al horno.

Mezclar los ingredientes de la masa de requesón en una fuente.

Batir a punto de nieve las 2 claras de huevo con 50 gr. de azúcar y unir a la masa de requesón.

Poner esta mezcla encima de las fresas y cocerlo unos 10 min en el horno a 220º C.

"
https://www.recetas.com/receta-de-Ensalada-de-tomate-y-manzanas-1125.html,Ensalada de tomate y manzanas,,"500 gr. de tomate 100 gr. de manzanas Hojas de albahaca 3 o 4 filetes de anchoas

"," Ensalada de tomate y manzanas

Cortar los tomates en gajos.

Pelar y cortar las manzanas en gajos.

Cortar los filetes de anchoas en 2 o 3 trozos.

Preparar el aliño aligerando la mayonesa con jugo de limón y sazonando con sal y pimienta.

Mezclar todos los ingredientes y colocar en una fuente."
https://www.recetas.com/receta-de-Pan-de-carne-1121.html,Pan de carne,,"750 gr. de carne de ternera picada250 gr. de carne de cerdo picada1/2 taza de cebolla picada en trocitos finos1 taza de migas de pan3 cdas.de ketchup1 cdta. de sal1/4 de cdta. de pimienta negraPepinitos en vinagre picados

"," Pan de carne

Calentar el horno a 200ºC.

Untar con aceite un molde.



Mezclar los ingredientes muy bien y poner la mezcla en el molde.



Llevar al horno caliente por 1 y 1/2 hora aprox., dejar enfriar unos 20 minutos, sacar del molde y cortar en rodajas."
