title,intro,order,votes,url,comensales,duración,para,dificultad,coste,types,ingredientes
Smothie de naranja y plátano,"En esta oportunidad RecetasGratis.net te enseña con esta vídeo receta cómo hacer un delicioso batido para empezar el día con energía de forma natural y saludable. El smoothie de naranja y plátano, además es ideal para los más pequeños de casa, pues la combinación de frutas hacen que tenga un sabor increíble sin necesidad de añadir azúcares extra.",[],,https://www.recetasgratis.net/video-receta-de-smothie-de-naranja-y-platano-56143.html,,,,,,,
Lassi de mango,"El lassi es una bebida tradicional india que está hecha a base de yogur y leche. El lassi es famoso por su poder refrescante y se puede hacer salado, dulce o picante, todos ellos ideales para acompañar cualquier tipo de comida, en especial las de sabores fuertes. Hoy te enseñamos cómo preparar lassi de mango, uno de los más populares en occidente y que además puedes servir como postre.","['1\nHacer lassi de mango es muy fácil, lo importante es que los ingredientes sean de calidad. En cuanto al mango, te recomendamos usar mango dulce, necesitarás unos 3. Si deseas. también puedes usar pulpa de mango.', '2\nTritura el mango por completo, procura no dejar grumos. Luego mezcla con el yogur y la leche.', '3\nCon la mezcla base lista sólo te queda añadir azúcar al gusto y una pizca de cardamomo. Éste último le aportara un toque de sabor y además múltiples beneficios saludables a tu organismo.', '4\nDeja reposar en la nevera para que el lassi de mango este frío y a disfrutar. En India esta bebida se usa para acompañar comidas como la tradicional samosa o pakora vegetal, pero también la puedes servir como postre. Y recuerda que que si estás en Barcelona y quieres disfrutar de auténtica comida India puedes venir a visitarnos en Mayura restaurante & lounge.']",,https://www.recetasgratis.net/receta-de-lassi-de-mango-56103.html,4 comensales,15m,,Dificultad baja,,"['Recomendada para vegetarianos', 'Recetas indias']","['250 mililitros de Yogur natural', '130 mililitros de Leche', '200 gramos de Mango', '2 cucharadas de postre de Azúcar', '1 pizca de Cardamomo en polvo']"
Merengada de Oreo con helado,"Ahora en RecetasGratis.net podrás seguir el tutorial de tus recetas favorita, en este caso te enseñamos a preparar una deliciosa merengada para consentir a los más golosos de casa. Aprende cómo hacer un batido de Oreo con helado de vainilla, una receta fácil y divertida con la que seguro sorprenderás a todos.Échale un vistazo a esta video receta y comparte con todos una tarde desenfada con esta estupenda merengada de Oreo y helado. ¡Un postre que podrás comer y beber!",[],,https://www.recetasgratis.net/video-receta-de-merengada-de-oreo-con-helado-56047.html,,,,,,,
Batido de piña y coco,Se te gustan las bebidas naturales pero no estás seguro de qué mezclas hacer toma nota. Aprende cómo hacer un batido de piña con leche de coco y disfruta de una deliciosa piña colada sin alcohol a cualquier hora del día. Un batido refrescante y nutritivo que seguro te encantará.,"['1\nEl primer paso para preparar este delicioso batido será cortar la rodaja de piña. Conserva un par de hojas de la piña para decorar los vasos al final.', '2\nCorta la piña en cuadros y desecha el círculo central de la fruta, que aunque se puede comer, puede amargar mucho el batido.', '3\nLa leche de coco la puedes encontrar en tu supermercado habitual. También puedes utilizar pulpa de coco o coco natural mezclado con un poco de leche.', '4\nLleva todo a la licuadora y procesa por unos cuantos minutos hasta que se triture por completo la fruta. Puedes prescindir del azúcar ya que si la piña está madura será lo suficientemente dulce para que el batido tengo un sabor estupendo.', '5\nSirve el batido de piña y coco y decora con unas hojas secas de piña, quedará muy elegante. Este cremoso zumo lo puedes beber en el desayuno con un sándwich de huevo o a media tarde con la merienda y si prefieres puedes añadirle unas gotas de ron y hacer una piña colada.']",Valoración: 5 (5 votos),https://www.recetasgratis.net/receta-de-batido-de-pina-y-coco-55853.html,2 comensales,15m,,Dificultad baja,,[],"['1 rodaja de Piña natural', '1 vaso de Leche de coco', '1 cucharada postre de Azúcar']"
Cóctel de frutas naturales,"Un sencillo y sano cóctel natural, acompañado de una ligera tapa de melón con jamón. Si tienes invitados en casa o, simplemente, quieres sorprender a tu pareja con recetas diferentes y especiales, toma nota del paso a paso y prepara con RecetasGratis.net este delicioso cóctel de frutas.","['1\nEmpezaremos la receta por la elaboración de la tapa de melón con jamón. Para ello, cortamos rodajas de melón de 2 cm de grosor, aproximadamente. Luego, con la ayuda de uno o varios cortapastas, damos formas diferentes, pueden ser flores, corazones, etc. Hecho esto, colocamos pequeños trozos de jamón serrano encima y reservamos.', '2\nAhora vamos a por el cóctel de frutas. Exprimimos las naranjas y vertemos el zumo en una coctelera o cualquier otro recipiente. Añadimos unos cubitos de hielo, zumo de piña (la misma cantidad que de naranja) y removemos. Si no tienes zumo de piña, puedes licuar algunos trozos de esta fruta. Yo, normalmente, suelo tener piña cortada en la nevera y ella sola va soltando su jugo. Ten en cuenta que la piña con un poco de azúcar suelta mucho zumo y, si exprimimos con las manos la cáscara, esta también expulsa mucho líquido.', '3\nAñadimos la casera, también la misma cantidad que de zumos. Removemos un poco y añadimos un chorro de granadina, volvemos a mover.', '4\nPonemos un trozos de cáscara de naranja y lo servimos en copa o vaso, como más nos guste.', '5\nUn aperitivo ligero y muy refrescante. Este cóctel de frutas naturales acompañado de una tapa de jamón es ideal para aquellos días de más calor o que nos apetece darnos un pequeño capricho. Más recetas como esta en mi blog La Cocina de Adita. Espero que os guste, besos. Adita']","Valoración: 4,5 (2 votos)",https://www.recetasgratis.net/receta-de-coctel-de-frutas-naturales-55523.html,2 comensales,30m,,Dificultad baja,,[],"['Melón', 'Jamón serrano cortado muy fino', 'Zumo de piña natural', 'Zumo de naranja natural', 'Gaseosa', 'Granadina', 'Cubitos de hielo y piel de naranja']"
Batido de plátano y galletas,"Esta receta me recordó cuando era niña y mi abuela me preparaba batidos con los plátanos que ya estaban muy maduros. Con esta receta fácil aprenderás cómo hacer un batido de plátano y galletas, una merienda completa, deliciosa y perfecta para tomar en cualquier momento. Estoy segura que este batido con leche lo disfrutarán todos en casa, así que manos a la obra.","['1\nPara hacer este delicioso batido de plátano lo primero que debes hacer es alistar los ingredientes. Esta batido nutritivo no lleva azúcar porque tanto las galletas como la fruta ya contienen la suficiente.', '2\nEl siguiente paso será partir un poco las galletas y echarlas en la licuadora. Si no tienes licuadora puedes utilizar cualquier batidora o pica todo que tengas en casa. Yo he utilizado galletas tipo digestive pero puedes usar galletas María o cualquiera de tu preferencia.', '3\nA continuación trocea el plátano y agrégalo a la licuadora junto con las galletas. Mientras más maduro esté el plátano el batido quedará más dulce.', '4\nAhora le toca el turno a la leche. Añade la leche junto con los demás ingredientes. Yo he utilizado leche desnatada para que esta deliciosa merengada de plátano tenga menos grasa, pero puedes utilizar la leche que desees.', '5\nProcesa todo durante unos 5 minutos o hasta que veas que se han triturados e integrado todos los ingredientes. Puedes probar la mezcla y corregir el sabor añadiendo azúcar, vainilla, canela o lo que desees. Yo no he añadido ningún ingrediente extra y el batido de plátano ha quedado perfecto.', '6\nEl batido de plátano y galletas es la merienda perfecta, una bebida completa y nutritiva para tomar a media tarde o para empezar el día. Y si has pensado en merienda, también puedes preparar unas galletas de mantequilla. A disfrutar!!']",Valoración: 5 (5 votos),https://www.recetasgratis.net/receta-de-batido-de-platano-y-galletas-55714.html,2 comensales,15m,Merienda,Dificultad baja,,[],"['4 unidades de Galletas digestive', '1½ unidades de Plátano', '1½ vasos de Leche desnatada']"
Clericó argentino,"El clericó es una bebida típica argentina que se prepara en la época de verano, especialmente para las fiestas de Navidad y Año Nuevo. Es un cóctel o ponche (como lo llaman también) elaborado a base de frutas de estación y vino blanco, que se prepara en grandes jarras y se consume bien frío. Sigue leyendo y aprende con RecetasGratis.net a preparar este delicioso clericó argentino.","['1\nLo primero que hacemos antes de empezar con la receta es alistar todos los ingredientes para el clericó.', '2\nPelar y cortar en cubos todas las frutas, fíjate en la fotografía para hacerlo de la misma manera.', '3\nColocar la fruta cortada en una jarra de vidrio. Le incorporamos el azúcar y dejamos reposar durante 30 minutos para que las frutas despidan su jugo y el clericó argentino quede perfecto.', '4\nVertemos el vaso de vino blanco y completamos el clericó, muévelo un poco para que las frutas se impregnen de los líquidos. Lo llevamos a la heladera y lo dejamos durante 1 o 2 horas aproximadamente.', '5\nPara darle un toque de glamour al clericó argentino, humedecemos con el limón el borde superior de los vasos y los sumergimos en un tazón de azúcar para que este quede impregnado, como vemos en la imagen. Servimos y decoramos con unas rodajas de limón.']",Valoración: 4 (1 voto),https://www.recetasgratis.net/receta-de-clerico-argentino-55499.html,2 comensales,30m,,Dificultad baja,,"['Recetas para Navidad', 'Recetas argentinas']","['2 unidades de Naranjas', '1 unidad de Manzana', '1 unidad de Banana', '1 unidad de Durazno', '1 unidad de Pera', '2 unidades de Kiwi', '2 unidades de Ciruelas', '10 unidades de Frutillas', '1 manojo de Uvas', '1 unidad de Limón para exprimir', '1 taza de Azúcar (200 gramos)', '1 vaso de Vino blanco']"
Batido de chirimoya y naranja,"La chirimoya es un fruto rico en calcio, fósforo, potasio y hierro. Todo esto unido con la vitamina C de la naranja da como resultado un batido saludable y muy aromático, útil para el corazón debido a las propiedades cardioprotectoras de estos dos alimentos. Toma nota de los pasos, prepara este batido de chirimoya y naranja con RecetasGratis.net y empieza a aprovecharte de sus múltiples beneficios.","['1\nAntes de realizar esta receta saludable, el primer paso es alistar todos los ingredientes.', '2\nPartir la chirimoya por la mitad, extraer la pulpa con una cuchara y retirar las semillas, añadir la chirimoya a la licuadora con el zumo de naranja.', '3\nProcesar hasta obtener un batido totalmente homogéneo, fíjate en la fotografía para tenerla como referencia.', '4\nColar el batido de chirimoya y naranja, así obtendremos una bebida más suave, aunque también se puede consumir sin necesidad de colar.', '5\nTe recomiendo consumir el batido de chirimoya y naranja muy frío, ya que así es mucho más refrescante, tomarlo a la hora del desayuno o en la merienda. Si te ha gustado esta bebida, tienes algún comentario o inquietud, danos tu opinión.']",,https://www.recetasgratis.net/receta-de-batido-de-chirimoya-y-naranja-55459.html,2 comensales,15m,Desayuno,Dificultad baja,,[],"['2 unidades de Chirimoya', '2 unidades de Naranja']"
Sorbete de melón y cava,"Un sorbete está compuesto por zumo de frutas, azúcar y agua, principalmente. En esta ocasión vamos a hacer un sorbete de melón y cava, un cóctel con frutas que te encantará. El cava es un vino espumoso elaborado en la región del Cava en España, y su método de elaboración es el mismo que el que se emplea para la preparación del champán adaptado a las variedades autóctonas o de las zonas españolas de producción. Sigue leyendo y aprende con RecetasGratis.net a hacer sorbete de melón y cava, ideal para ocasiones especiales.","['1\nEl primer paso para la elaboración de la receta es prealistar los ingredientes de nuestro sorbete casero.', '2\nCorta el melón en trozos y llévalo a un bol para la elaboración de este sorbete tan refrescante.', '3\nAdiciona el azúcar y la taza de agua y procesa muy bien hasta integrar los ingredientes.', '4\nLleva esta mezcla a un molde de silicona, en esta ocasión quise realizar moldes de estrella, congela durante una hora aproximadamente.', '5\nUna vez congelados los cubos de melón, agrega el cava a cada una de las copas de vino.', '6\nPara hacer el sorbete de melón y cava, agrega los cubos congelados a las copas y todos los ingredientes se integren e impregnen de cada uno de sus aromas. Esta bebida es muy refrescante para el verano y deliciosa, ya que el melón combina muy bien con la cava. Asimismo, el cava es una de las bebidas más afrodisíacas, por lo que este sorbete es ideal para la cena de San Valentín. Si deseas más recetas de cócteles y bebidas y tienes algún comentario o inquietud, escríbenos. ¡Disfruta!']","Valoración: 3,5 (4 votos)",https://www.recetasgratis.net/receta-de-sorbete-de-melon-y-cava-55438.html,4 comensales,1h 30m,,Dificultad baja,,[],"['1 botella de Cava', '1 unidad de Melón fresco', '2 cucharadas soperas de Azúcar', '3 unidades de Limón', '1 taza de Agua (240 mililitros)', '4 unidades de Copas de vino']"
Cosmopolitan,"El Cosmopolitan es un cóctel a base de vodka con algunos toques a frutales, es conocido por ser un cóctel afrodisíaco y muy colorido y se volvió famoso por el ser la bebida de las chicas de la serie Sexo en Nueva York. Hoy te traemos esta receta de cosmopolitan para que lo aprendas a hacer en y le des un toque especial a tus cenas románticas, especialmente para estas fechas de San Valentín.","['1\nPara preparar el cosmopolitan lo primero que debes hacer es alistar todos los ingredientes, yo utilice hielo con arándanos pero puedes usar hielo solo.', '2\nColoca en una copa grande el vodka y los hielos, revuelve un poco para integrar los sabores.', '3\nLuego agrega el triple sec y el jugo de un limón, mezcla. El triple sec es un licor de naranja y también puedes utilizar el conocido cointreau.', '4\nPor ultimo, para terminar este delicioso cóctel afrodisíaco agrega el jugo de arándano y mezcla muy bien, si tienes una coctelera te recomiendo que prepares este cóctel en esta.', '5\nSirve y degusta esta delicia afrodisíaca en tus cenas románticas y en especial para san Valentín, sorprende a tu pareja con un buen cosmopolitan.', '6\nY para tu cena romántica te proponemos:Ensalada templada de langostinosPollo en salsa de curryFresas de chocolate']",Valoración: 5 (2 votos),https://www.recetasgratis.net/receta-de-cosmopolitan-55437.html,2 comensales,15m,,Dificultad baja,,['Recetas para San Valentín'],"['100 gramos de Jugo de arándano', '5 cucharadas soperas de Triple sec', '7 cucharadas soperas de Vodka', '1 unidad de Limon', '6 unidades de Hielo']"
Canelazo colombiano,"El canezalo es una bebida alcohólica que se toma mucho en regiones frías de Colombia, especialmente en las montañosas donde el clima es más frío que en el resto de las regiones. Está elaborada con aguardiente, panela, azúcar y canela. Dependiendo de la región donde se elabore se puede variar la receta, ya que en Perú y Ecuador también se consume. Es muy común que al visitar el cerro de Monserrate, en la ciudad de Bogotá, se ofrezca esta bebida especialmente en las épocas navideñas en el país. Sigue leyendo y aprende a preparar este canelazo al estilo bogotano con RecetasGratis.net","['1\nNuestro primer paso es prealistar los ingredientes del canelazo colombiano.', '2\nLleva una olla con agua a fuego medio hasta que esté medio tibia.', '3\nUna vez observes que el agua está tibia, añade la panela o piloncillo y el azúcar, deja que esta se deshaga en el agua.', '4\nUna vez observes que el agua está hirviendo añade las astillas de canela y deja que se infusione la panela con la canela. Si no tienes canela en rama puedes usar su versión en polvo. Deja hervir durante unos 10 a 15 minutos. Pasado el tiempo, apaga el fuego y añade el zumo de los limones.', '5\nSirve la infusión de agua de panela con canela en cada una de las copas, la idea es que esta bebida se sirva caliente. Añade a cada una de las bebidas una copa de aguardiente y mezcla muy bien.', '6\nSirve el canelazo colombiano caliente, si deseas puedes agregar clavos o estrellas de anís, o cambiar el limón por el zumo de naranja. Puedes acompañarlo con un queque casero o galletas fáciles. Si deseas más recetas de cócteles o bebidas y tienes algún comentario o inquietud, escríbenos.']","Valoración: 4,5 (4 votos)",https://www.recetasgratis.net/receta-de-canelazo-colombiano-55432.html,5 comensales,30m,,Dificultad baja,,"['Recetas colombianas', 'Recetas bogotanas']","['5 copas de Aguardiente', '2 cucharadas soperas de Azúcar blanco', '4 ramas de Canela o canela en polvo', '80 gramos de Panela o piloncillo', '4 unidades de Copa de vino', '2 unidades de Limón', '2 tazas de Agua (480 mililitros)']"
Leche de coco casera,"La leche de coco es una leche vegetal muy utilizada en las cocinas de Asia y el Caribe, en especial de ciertos países como Colombia, Panamá y Venezuela. Es importante entender la diferencia entre la leche y el agua de coco, pues esta última proviene del centro del fruto, mientras que la leche se exprime directamente de la pulpa.Son muchas las recetas que llevan leche de coco, algunas saladas como este pollo al curry, y otras dulces como este arroz con leche. No obstante, puede que a veces dudes en prepararlas porque no tienes leche de coco en casa, pero puedes preparar leche de coco con coco rallado. Es muy fácil, así que en RecetasGratis te contaremos todos los pasos para que sepas cómo hacer leche de coco casera y descubras todos sus beneficios y usos.","['1\nParte el coco con fuerza con ayuda de un martillo, reserva el agua que está en el centro y, con un cuchillo sin punta, retira toda la pulpa. Ralla la pulpa del coco y agrégalo a la licuadora con el agua caliente.Si no tienes coco fresco, puedes usar el coco rallado seco que venden en los supermercados. Para hacer leche de coco con coco rallado seco, solo mezcla el coco con agua caliente sin que llegue a hervir y revuelve por unos minutos para que se hidrate bien. Continúa con los demás pasos.\nTruco: Puedes beber el agua de coco, pues es una bebida muy refrescante e hidratante.', '2\nLicua durante unos 5 minutos aproximadamente, o hasta obtener una mezcla homogénea.', '3\nCuela la leche de coco casera, utiliza una cuchara para exprimirla muy bien. Si se desea, se puede volver a licuar lo que queda del coco con más agua,aunque se obtendría una leche menos concentrada.', '4\nEs momento de servir y utilizar la leche de coco casera con coco rallado en una deliciosa receta, como un arroz con coco o pescado en leche de coco y curry.']","Valoración: 4,8 (4 votos)",https://www.recetasgratis.net/receta-de-leche-de-coco-casera-55405.html,1 comensal,15m,,Dificultad baja,,"['Recomendada para veganos', 'Receta sin lactosa', 'Receta sin azúcar']","['200 gramos de coco rallado (2 tazas)', '200 mililitros de agua']"
Tinto de verano con vino blanco,"El tinto de verano es una combinación de vino tinto acompañado de cualquier tipo de gaseosa o refresco, especialmente en esas épocas de verano intenso. En este caso quise realizar una versión con vino blanco en el cual si utilizó un vino claro y gaseosa oscura y cuando la realizo de vino tinto añado una gaseosa o refresco claro agregando unos pedazos de fruta para dar un toque especial a nuestro cóctel con frutas.","['1\nNuestro primer paso para realizar esta bebida refrescante de verano es prealistar los ingredientes.', '2\nEsta receta da para 5 porciones, así que dispón 5 copas y adiciona en cada una de ellas un poco de hielo como se observa en la fotografía. Lo que vamos hacer es refrescar las copas, es decir que se enfríen para poder servir nuestro cóctel.', '3\nAgrega las manzanas cortadas en cubos a cada uno de las copas donde vamos a servir el tinto de verano.', '4\nAgrega el vino blanco a cada una de las copas, la cantidad depende de que tan fuerte se desee el cóctel. Añade el zumo de medio limón y mezcla muy bien hasta que se integren los ingredientes.', '5\nAñade el refresco de cola y mezcla con los ingredientes anteriores de nuestra receta de tinto de verano.', '6\nSirve nuestro cóctel decorando cada una de las copas con hojas de menta encima como se observa en la fotografía. El tinto de verano con vino blanco es una bebida refrescante pero con alcohol, si quieres una bebida que no tenga alcohol y sea igual de refrescante te recomendamos revisar el mojito sin alcohol.']","Valoración: 3,3 (3 votos)",https://www.recetasgratis.net/receta-de-tinto-de-verano-con-vino-blanco-55388.html,5 comensales,30m,,Dificultad baja,,['Recetas españolas'],"['1 litro de Vino blanco', '3 unidades de Manzana', '500 mililitros de Refresco o gaseosa de cola', '3 unidades de Limón', '100 gramos de Hielo', '1 manojo de Menta', '3 unidades de Manzanas']"
Jugo de melón y naranja,"Este jugo combina, las propiedades anti infecciosas de la naranja, con el efecto depurativo del melón y las vitaminas que aportan las manzanas, entres los muchos beneficios de estas frutas los mas importantes son que ayudan a mejorar la circulación sanguínea y ayudan a la prevención del cáncer.","['1\nAntes de realizar este zumo de melón, naranja y manzana, el primer paso es alistar todos los ingredientes.', '2\nAgregar a la licuadora el melón y la manzana, pelados y cortados en cubos medianos, junto con el zumo de naranja, procesar.', '3\nDurante el licuado, ayudar con una espátula a bajar las frutas, para que se pueda obtener una mezcla completamente homogénea.', '4\nServir y disfrutar inmediatamente del jugo de melon y naranja, si se desea se puede colar, pero eso es mucho más beneficioso para el organismo consumirlo de está manera. Te recomiendo tomar el jugo 1 hora antes de cualquier comida del día ya que se digieren mejor los alimentos y se facilita la absorción de esta bebida. Si te ha gustado este jugo, tienes algún comentario o inquietud, danos tu opinión.']",,https://www.recetasgratis.net/receta-de-jugo-de-melon-y-naranja-55375.html,1 comensal,15m,Desayuno,Dificultad baja,,['Recomendada para perder peso'],"['1 unidad de Melón', '100 mililitros de Naranja', '1 unidad de Manzana verde']"
Mojito de fruta de la pasión,"El mojito es un cóctel originario de Cuba y sus ingredientes básicos son ron, azúcar, limón o lima y menta. Este cóctel con ron se ha hecho muy famoso en todo el mundo por su dulce y refrescante sabor y en la actualidad, los mojitos se pueden elaborar con cualquier fruta. Con esta receta de cóctel de frutas aprenderás a preparar un mojito bien tropical, utilizando maracuyá, también conocida como fruta de la pasión entre sus ingredientes.","['1\nEl primer paso para la elaboración de nuestros cócteles afrodisíacos es prealistar los ingredientes de la receta.', '2\nCorta los limones por la mitad y añade a cada vaso una de las mitades cortada en trozos pequeños, como se observa en la fotografía. La otra mitad lo reservamos para utilizar luego con los mojitos de San Valentín.', '3\nAñade una cucharada de azúcar blanca, o morena si lo prefiere, a cada uno de los vasos donde tenemos el limón en cuadros pequeños y añade algunas hojas de hierbabuena, unas 15 por vaso.', '4\nCon la ayuda de una cucharada de madera macera el azúcar con los limones y las hojas de hierbabuena como se observa en la fotografía. De esta forma se hace la base de esta bebida especial para San Valentín.', '5\nUna vez macerados los ingredientes añade el maracuyá o la fruta de la pasión como se observa en la foto, es importante que se mezcle muy bien todos los ingredientes. Si no tienes la fruta natural puedes utilizar un poco de pulpa.', '6\nAñade hielo para que se refresque nuestro trago y podamos servir frío nuestro cóctel afrodisíaco. Agrega el zumo del medio limón restante a cada vaso y mezcla muy bien.', '7\nAñade el agua tónica y mezcla muy bien con todos los ingredientes que encontramos en los vasos. Al agua tónica o aguaquina le dará un sabor fuerte al cóctel, si quieres destacar más el sabor de la fruta puedes utilizar soda.', '8\nPor último añade una copa de ron (blanco u oscuro, el que desees) y mezcla muy bien hasta integrar los ingredientes de nuestro mojito afrodisíaco.', '9\nSirve este deliciosos cóctel de San Valentín adicionando un mezclador a cada uno de los vasos. Recuerda que esta bebida debe realizarse al momento para evitar que se deshaga el hielo en exceso y deje aguado nuestro mojito afrodisíaco.', '10\nSi te gustó esta receta también puedes revisar la del cóctel rojo también ideal para sorprender a tu pareja en San Valentín.']","Valoración: 4,5 (2 votos)",https://www.recetasgratis.net/receta-de-mojito-de-fruta-de-la-pasion-55326.html,5 comensales,30m,,Dificultad media,,['Recetas para San Valentín'],"['250 mililitros de Ron (blanco o negro)', '5 unidades de Agua tónica', '200 gramos de Hielo', '5 unidades de Limón', '1 manojo de Menta o hierbabuena', '100 gramos de Azúcar (½ taza)', '3 unidades de Maracuyá o fruta de la pasión']"
