title,intro,order,votes,url,comensales,duración,para,dificultad,coste,types,ingredientes
Cóctel rojo para San Valentín,"Cuando hablamos de Gin Tonics, hablamos de una copa muy popular que se hace con tónica y ginebra. En este caso quise realizar un cóctel con frutas muy sencillo, para celebrar San Valentín, hecho a base de sandía o patilla y este exquisito aguardiente. Aprende a preparar un Gin Tonic rojo para San Valentín y sorprende a tu pareja con este increíble cóctel con ginebra.","['1\nEl primer paso para realizar nuestra receta de cóctel rojo pasión, es prealistar los ingredientes.', '2\nCorta la sandía en cuadros medianos y reparte en 4 vasos para Gin Tonics como se observa en la foto para elaborar nuestra bebida de San Valentín.', '3\nAdiciona dos tajadas de limón como se observa en la foto para que realicemos nuestro cóctel rojo pasión.', '4\nAgrega dos o tres clavos para aromatizar un poco nuestra receta y dar un toque particular y exquisito, si deseas puedes cambiar los clavos por pimienta roja o anís. Añade la ginebra a cada uno de los vaso con el zumo de medio limón y mezcla muy bien todos los ingredientes.', '5\nPor último añade el agua tónica a nuestro cóctel de sandía y mezcla muy bien con el mezclador cada uno de los vasos. Ya esta listo nuestro cóctel rojo pasión de San Valentín y para consumir debemos tener en cuenta realizarlo al momento y servirlo para que no se vaya el gas del agua tónica.\nTruco: Si quieres darle un toque gourmet a tu Gin Tonic, raspa con cáscara de limón toda la boca y la parte de afuera del vaso, esto dará una explosión de aroma en cada trago', '6\nSi deseas más recetas de cócteles o para San Valentin puedes revisar la receta de Mojito afrodisíaco y no olvides que si tienes algún comentario o inquietud puedes escribirnos. A disfrutar esta deliciosa receta!']",Valoración: 5 (2 votos),https://www.recetasgratis.net/receta-de-coctel-rojo-para-san-valentin-55325.html,4 comensales,15m,,Dificultad baja,,['Recetas para San Valentín'],"['1 unidad de Sandía o patilla', '3 unidades de Agua tónica', '8 unidades de Clavos de olor', '3 unidades de Limones', '200 mililitros de Ginebra', '4 unidades de Mezcladores']"
Champurrado,"El champurrado es una bebida muy típica de la gastronomía tradicional mexicana, siendo la harina de maíz uno de sus ingredientes más importantes, pues es el que nos ayuda a lograr esa deliciosa consistencia. Derivado del atole, cuyo origen recae en la cultura azteca, el champurrado mexicano es un fiel acompañante de un rico tamalito. En RecetasGratis.net te invitamos a seguir el paso a paso de esta sencilla, pero deliciosa, receta de la cocina mexicana.","['1\nEn un bowl, pon la harina de maíz y el agua fría y mezcla con ayuda de un batidor globo hasta tener una mezcla homogénea y sin grumos. Reserva.', '2\nPara la elaboración de nuestro champurrado pon en una olla la leche, la rama de canela, la tablilla de chocolate, el piloncillo y lleva a hervor a fuego alto. Una vez que empiece a hervir baja a fuego medio y cerciórate de que el chocolate y el piloncillo se hayan disuelto por completo.', '3\nIncorpora en la olla la mezcla que preparaste previamente y mueve constantemente para evitar que se nos pegue nuestro champurrado mexicano.', '4\nMueve constantemente el champurrado por unos 5 minutos para lograr que la masa esté bien cocida y logremos una consistencia espesa. Cuando acabe la cocción podemos retirar la rama de canela.', '5\n¡Listo! Y con este rico champurrado mexicano no puede faltar la compañía de un delicioso tamal.\nTruco: Al final puede batir el champurrado con un molinillo para obtener una bebida más espumosa']",Valoración: 4 (14 votos),https://www.recetasgratis.net/receta-de-champurrado-55303.html,4 comensales,15m,Desayuno,Dificultad baja,,['Recetas mexicanas'],"['1 litro de Leche', '1 rama de Canela', '45 gramos de Tablilla de Chocolate', '90 gramos de Piloncillo', '½ taza de Harina de Maíz (60 gramos)', '1 taza de Agua Fría']"
Batido con piña y semillas de chía para adelgazar,Los batidos son una manera sana y deliciosa de empezar una dieta y sobretodo son una herramienta para desintoxicar el cuerpo ya que muchas veces se sobrecarga por el exceso de comida. Es importante limpiar nuestro organismo de forma natural y sin duda este jugo diurético de piña y chía que en RecetasGratis.net te mostramos te ayudará a conseguirlo.,"['1\nEl primer paso que debemos realizar es prealistar los ingredientes de nuestro batido para perder peso.', '2\nLleva a un bol el jugo de naranja y la piña sin el corazón en cuadros y licua muy bien hasta integrar los ingredientes.', '3\nLava las manzanas y agrégalas en cuadros medianos donde tenemos la preparación del paso anterior para seguir realizando nuestro batido de piña y chía. Licua o procesa hasta que se integren todos los ingredientes.', '4\nPor último, adiciona stevia en polvo (una pizca) para darle un toque dulce a nuestro batido para perder peso. Este paso no es obligatorio, la fruta ya tiene azúcares naturales y no hace falta agregar extra, pero si crees que el sabor es muy fuerte te recomendamos usar edulcorantes o miel.', '5\nUna vez licuados todos los ingredientes, agrega las semillas de chía a cada uno de los vasos donde vamos a servir los batidos.', '6\nSirve el jugo de piña y chía para adelgazar decorando con semillas. Es ideal que se tome este jugo en las mañanas, teniendo en cuenta las frutas que contiene sirve como diurético y para personas que tengan problemas con su sistema digestivo.']","Valoración: 4,4 (12 votos)",https://www.recetasgratis.net/receta-de-batido-con-pina-y-semillas-de-chia-para-adelgazar-55218.html,5 comensales,15m,Desayuno,Dificultad baja,,['Recomendada para perder peso'],"['1 unidad de Piña', '5 cucharadas de postre de Semillas de chía', '3 unidades de Manzana verde', '300 mililitros de Jugo de naranja', '1 pizca de Stevia o edulcorante']"
"Licuado de avena, miel y amaranto","Los licuados son una excelente bebida para disfrutar en el desayuno o merienda incluso sirven como fuente natural de energía para poder comenzar el día. Los licuados nacen en Sudamérica y en México y también se le conoce con diferentes nombres, desde licuado o batido hasta zumo o jugo. El licuado de avena, miel y amaranto es especial para tratar anemias gracias a que ayudan a fortalecer el hierro en sangre.","['1\nEl primer paso para realizar nuestra receta del jugo nutritivo y natural es prealistar los ingredientes.', '2\nLleva una sartén a fuego medio y tuesta las semillas de amaranto hasta que tomen un color café oscuro, una vez estén tostadas, resérvalas para usarlas mas adelante en la receta. Debemos tener en cuenta que las semillas de amaranto contienen varias propiedades de origen vegetal como calcio el cual ayuda a prevenir la osteoporosis.', '3\nLleva aun bol las hojuelas de avena y la leche de almendras, procesa estos dos ingredientes hasta que se integren bien.', '4\nPara dar un toque adicional a nuestro batido agrega la mantequilla de maní. Si no tienes mantequilla de maní puedes adicionarle mantequilla de almendras, esto dará un toque especial.', '5\nPor último adiciona las semillas de amaranto y la miel, que servirá para endulzar nuestro batido.', '6\nSirve el licuado de amaranto y miel con bastante hielo para refrescar. Este jugo saludable es ideal para tomarlo en las mañanas o si deseas a la hora de merendar, podemos incluir a nuestros niños en esta receta ya que es delicioso. Si deseas más recetas de batidos o licuados, tienes algún comentario o inquietud, escríbenos.']",Valoración: 4 (1 voto),https://www.recetasgratis.net/receta-de-licuado-de-avena-miel-y-amaranto-55182.html,5 comensales,15m,,Dificultad baja,,[],"['1 litro de Leche de almendras', '150 gramos de Avena en hojuelas', '2 cucharadas soperas de Mantequilla de mani', '40 mililitros de Miel', '60 gramos de Semillas de amaranto']"
Licuado de amaranto y papaya,Se le conoce como licuado a toda aquella preparación de frutas o verduras que son procesadas y batidas con algún líquido hasta obtener un batido o jugo. Este licuado en particular ayuda aquellas personas con estreñimiento y que tienen problemas gastrointestinales gracias a los múltiples beneficios de la papaya y las semillas de amaranto.,"['1\nNuestro primer paso para realizar nuestro licuado es prealistar los ingredientes.', '2\nPela la papaya y córtala en cuadros medianos, lleva esto aun bol. La papaya es conocida en otros países como lechoza.', '3\nAdiciona la leche de almendras y la stevia. Procesa hasta que se integren por completo los ingredientes.', '4\nLleva una sartén a fuego medio y una vez caliente adiciona las semillas de amaranto para tostarlas. Una vez estén tostadas observarás que toman un color café más oscuro, retíralas del fuego.', '5\nAdiciona las hojuelas de avena junto con la papaya ya procesada y tritura todo junto hasta conseguir un licuado uniforme y homogéneo.', '6\nPor último añade las semillas de amaranto y mezcla con la ayuda de una cuchara para que se integren los ingredientes de nuestro batido con amaranto.', '7\nSirve el licuado de amaranto decorando con un poco de semillas cada uno de los vasos encima al servirlos, es ideal tomar este batido en las mañanas preferiblemente en ayunas. Si deseas más recetas de diferentes batidos y tienes algún comentario o inquietud, escríbenos y si te interesan los zumos verdes y jugos detox échale un vistazo a esta lista:Jugo diurético de PomeloJugo depurativo de zanahoriaJugo detox de espinaca']",,https://www.recetasgratis.net/receta-de-licuado-de-amaranto-y-papaya-55181.html,5 comensales,15m,,Dificultad baja,,['Receta sin lactosa'],"['500 mililitros de Leche de almendras', '300 gramos de Papaya', '1 pizca de Stevia en polvo o edulcorante', '120 gramos de Avena en hojuelas', '60 gramos de Semillas de amaranto']"
Zumo de kiwi y fresas,,"['1\nColocamos en una cazuela las fresas, el zumo de medio limón y 6 cucharadas de azúcar.', '2\nPonemos a cocer la mezcla a fuego lento durante 5 minutos.', '3\nDejamos enfriar, pasamos por la batidora y por el colador chino y reservamos en el frigorífico.', '4\nEn una sartén ponemos el zumo de granadina a reducir hasta que se forme un caramelo.', '5\nPelamos los kiwis y ya troceados los introducimos en el vaso de la batidora junto 6 cucharadas de azúcar, el vaso de agua y el zumo de medio limón.', '6\nPasamos por la batidora y colamos el zumo resultante.', '7\nIntroducimos en el congelador y de vez en cuando removemos el kiwi para que no se solidifique, sino que nos quede escarchado.', '8\nColocamos en un platillo el zumo de granadina reducido y en otro una cucharada de azúcar.', '9\nPasamos el borde de las copas por el zumo de granadina y seguidamente por el azúcar.', '10\nServimos en cada copa una buena ración de puré de kiwis escarchado y salseamos con la salsa de fresas.', '11\nServimos acompañando las copas con unas pajitas y con una rodaja de kiwi y de fresa pinchada en cada pajita.']","Valoración: 3,8 (6 votos)",https://www.recetasgratis.net/receta-de-zumo-de-kiwi-y-fresas-27782.html,4 comensales,30m,,Dificultad baja,,[],"['6 unidades de Kiwis', '12 cucharadas soperas de Azúcar', '1 unidad de Limón', '1 vaso de Agua', '300 gramos de Fresas', '½ vaso de Granadina']"
"Capuchino de café, plátano y leche de almendras",,"['1\nPara la crema de café: Para hacer la crema de café, poner al baño María las 5 yemas, 1/2 l de leche, los tres cafés y los 100 grs de azúcar.', '2\nCuando coja una temperatura de 80ºC, retirar del fuego y enfriar en otro baño con hielo.', '3\nPara el plátano: Triturar el plátano y la nata hasta que esté cremoso.', '4\nPara la leche de almendras: Poner la almendra durante 5 horas en remojo con agua.', '5\nTranscurrido este tiempo, cocer con la leche y el resto del azúcar a fuego lento durante 1/2 hora.', '6\nAñadir las 2 hojas de gelatina y dejar enfriar.', '7\nMontaje: En una copa ponemos en la base crema de café, luego la crema de plátano y la leche de almendras.', '8\nLo batimos con una potente batidora hasta que esté espumosa y se lo añadimos a la copa.']","Valoración: 4,2 (24 votos)",https://www.recetasgratis.net/receta-de-capuchino-de-cafe-platano-y-leche-de-almendras-18074.html,4 comensales,30m,,Dificultad media,,[],"['5 ud. yema de huevo', '1 l. leche', '200 gr. azúcar', '3 ud. café expresso', '1 ud. plátano', '2 dl. nata', '50 gr. almendra crudas', '2 hoja gelatina']"
Daiquiri con Thermomix,,"['1\nPoner todos los ingredientes en el vaso 40 segundos a velocidad 3, 5, 8.', '2\nSe debe pasar por las velocidades 3 y 5 despacio para que el hielo quede frapé.', '3\nEsta medida puede dar alrededor de 20 copas (recordar que las copas son como las de vino) y advertir que esta bebida entra suavecito pero que tiene buen efecto.']","Valoración: 4,3 (3 votos)",https://www.recetasgratis.net/receta-de-daiquiri-con-thermomix-31160.html,1 comensal,15m,,Dificultad baja,,[],"['40 mililitros de Zumo de limón', '50 gramos de Azúcar (¼ taza)', '60 mililitros de Ron blanco', '240 gramos de Hielo']"
Thermomix: Daiquiri De Plátano,,"['1\nVierta todos los ingredientes indicados en el vaso del thermomix y programe 1 minuto, velocidad 6.', '2\nSirva el daikiri de platano sobre una copa tipo flauta y decore con una rodaja de plátano en el borde de la copa.']",Valoración: 2 (1 voto),https://www.recetasgratis.net/receta-de-thermomix-daiquiri-de-platano-31161.html,1 comensal,15m,,Dificultad baja,,[],"['200 g. (2 cub.) de ron blanco', '100 g. (1 cub.) de marrasquino', '100 g. (1 cub.) de zumo de limón', '1 plátano pelado y troceado', '1/2 cucharada de azúcar glass', '10 cubitos de hielo']"
Batidos clásicos,,"['1\nPara prepararlo realice los siguientes pasos: Mezclar todos los ingredientes.', '2\nBatir en la minipimer o con las varillas hasta que tenga espuma. Servir el batido muy frío. Puedes utilizar sirope de distintos sabores como la salsa de frutos rojos o sustituirlo por mermelada o helados, según el sabor que quieras darle a tu merengada.']","Valoración: 2,9 (11 votos)",https://www.recetasgratis.net/receta-de-batidos-clasicos-8107.html,2 comensales,15m,,Dificultad baja,,[],"['1 litro de Leche', '10 cucharadas de postre de Nata montada', '4 cucharadas de postre de Sirope', '6 cucharadas de postre de Azúcar']"
Café helado a la vainilla,,"['1\nDisolver el azúcar en el café, verterlo en la cubeta del congelador y cuando esté helado, triturarlo.', '2\nEn el momento de servirlo, repartir en el fondo de unas copas o vasos altos de refresco, el helado, el café triturado y la nata montada.', '3\nAl servir, espolvorear con el azúcar y el café en polvo.']","Valoración: 3,6 (64 votos)",https://www.recetasgratis.net/receta-de-cafe-helado-a-la-vainilla-23412.html,2 comensales,15m,,Dificultad baja,,[],"['8 cucharadas de helado de vainilla', '250 gr. de nata', '1/2 litro de café', '100 gr. de azúcar', 'café soluble para espolvorear']"
Blue tequila,El blue tequila es un llamativo cóctel con tequila que tiene un sabor suave y una presentación muy original. Sigue la receta y disfruta de este estupendo trago con tus amigos en la próxima reunión.,"['1\nEste cóctel se sirve en copas de martini o margaritas, pero puedes utilizar cualquiera que tengas a mano. Primero hazle un borde de azúcar, esto se hace pasando un limón por el filo de la copa y luego espolvorea azúcar.', '2\nCon el borde ya hecho, continua llenando la copa con hielo picado. No hace falta que lo llenes hasta arriba.', '3\nLuego, en el shaker, mezcla todos los ingredientes de la lista junto con tres hielos grandes. Agita con fuerza por un minuto y vacía el blue tequila en la copa con hielo. Si tienes en casa un shaker y te gustan los cócteles puedes probar el delicioso absolut tequila.']","Valoración: 3,9 (88 votos)",https://www.recetasgratis.net/receta-de-blue-tequila-6362.html,1 comensal,15m,,Dificultad baja,,[],"['25 mililitros de Blue Curasao', '50 mililitros de Tequila', '25 mililitros de Zumo de limón', '25 mililitros de Zumo de Naranja', '1 cucharada postre de Azúcar']"
Lícor de naranja,"Aprende cómo hacer un licor de frutas casera con ron blanco. Sorprende a todos ofreciendo como aperitivo un licor lleno de sabor, el licor de naranja es perfecto para cualquier ocasión.","['1\nCorta las naranjas y exprime para extraer todo el zumo de la fruta, procura que no se cuele ninguna semilla.', '2\nAparte, mezcla el agua con el azúcar y lleva al fuego durante 5 minutos hasta que se disuelva bien. Deja reposar hasta que tome temperatura ambiente.', '3\nUna vez frío, añadir el zumo de naranja, mezcla y pasa por un filtro esta primera mezcla. Entonces, une este jugo azucarado con el ron y deposita todo el líquido en un recipiente, de cristal preferiblemente.', '4\nConserva este recipiente en un sitio oscuro durante 4 semanas. Pasado este tiempo, filtrar nuevamente y rellenar en botellas. Agitar la mezcla durante el proceso de maceración y antes de su consumo.', '5\nEsta receta da para un litro y medio de licor de naranja casero.']","Valoración: 3,6 (26 votos)",https://www.recetasgratis.net/receta-de-licor-de-naranja-33419.html,5 comensales,24h,,Dificultad baja,,[],"['5 unidades de Naranja (400ml. de zumo)', '3 cucharadas soperas de Azúcar', '200 mililitros de Agua', '700 mililitros de Ron blanco']"
Chamoyada de mango,,"['1\nLicuar el mango con el zumo de naranja y un poco de hielo. Triturar y agregar más hielo para conseguir la consistencia deseada.', '2\nVerter un poco de chamoya en cada copa, un dedo aproximadamente, y sobre este ir vaciando poco a poco el contenido de la licuadora. Se debe distinguir los dos colores.', '3\nPuedes disfrutar de tu chamoyada de mango decorando el vaso con azúcar en los bordes o con fruta natural. Disfruta de esta rica bebida con comida auténtica mexicana como unos nopales y una pizza mexicana.']","Valoración: 3,1 (230 votos)",https://www.recetasgratis.net/receta-de-chamoyada-de-mango-35856.html,4 comensales,30m,,Dificultad baja,,['Recetas mexicanas'],"['1 taza de Zumo de naranja', '2 tazas de Hielo picado', '½ taza de Chamoy líquido', '1 lata de Mango']"
Baileys casero sin alcohol,,"['1\nPrepara un café espresso con tu café preferido, si quieres puedes hacerlo con café descafeinado.', '2\nAparte, calienta el whisky en un cazo y deja que hierva hasta que se evapore todo el alcohol. Como si se tratase de la preparación de una salsa con vino.', '3\nFinalmente, mezcla todos los ingredientes en la licuadora y bate a máxima potencia para que se integren por completo. El resultado es una crema suave color café.', '4\nVacía el baileys casero sin alcohol en una botella y refrigera hasta la hora de servir. Este deliciosa crema sera un aperitivo perfecto.']","Valoración: 3,5 (37 votos)",https://www.recetasgratis.net/receta-de-baileys-casero-sin-alcohol-16235.html,5 comensales,15m,,Dificultad baja,,[],"['80 mililitros de Café solo recién hecho', '80 mililitros de Whisky', '380 gramos de Leche condensada', '1 cucharadita de Esencia de vainilla']"
"¡Receta, historia y conjuro!","El rito y el conjuro de la queimada gallega es una tradición mágica que se sigue haciendo en la actualidad. Normalmente se hace de noche, en la oscuridad, a la luz de la llama de la propia queimada, recitando un conjuro mientras se remueve con un cazo el alcohol con azúcar en un pote típico de barro, en reuniones sociales y celebraciones en la comunidad gallega.Con la queimada se consiguen fusionar tres elementos básicos para el hombre: el fuego, la tierra y el agua. La tierra se simboliza mediante el pote de barro, el agua mediante el aguardiente, mientras que el fuego danza entre ellos. Se cree que este ritual ahuyenta los malos espíritus y brinda protección, y suele celebrarse con amigos o familia en el verano.Ahora que ya conoces un poco su historia, es el momento de preparar tu propia receta de queimada gallega. No es difícil y, si no tienes café, naranja o limón, ten en cuenta que también puede prepararse solo con aguardiente y azúcar. Sigue leyendo y descubre cómo hacer queimada gallega en RecetasGratis.","['1\nPara preparar la queimada gallega, deberás utilizar un recipiente adecuado, el ideal es un pote especial para queimada que suele tener patas, pero si no tienes, puedes usar una cazuela de barro común. Pon en la cazuela el litro de aguardiente y el azúcar.', '2\nLava bien la naranja y el limón, sécalos y pela la piel con un pelador de verduras. Añade esa piel al aguardiente con el azúcar. Si no tienes un pelador, puedes cortar la piel con un cuchillo bien afilado.', '3\nPor último, incorpora un puñado de granos de café.\nTruco: en otras preparaciones también se suelen añadir otras frutas como las manzanas.', '4\nAhora, es hora de quemar la queimada gallega. Este es un paso importante, procura hacerlo en un lugar amplio para que solo se encienda el alcohol. Para encenderla, lo ideal es usar un mechero de cocina largo o un soplete de cocina. Enciende la llama acercándola con cuidado a la olla, tan pronto se prenda el alcohol, retira la llama.', '5\nCon un cucharón de cocina, ve dando vueltas ligeramente sin llegar al fondo. Cuanto más llegues al fondo o más fuerte remuevas, más llamas se formarán, por lo que debes tener cuidado. En este momento, mientras se da vueltas con el cucharón, es cuando se lee el conjuro para la queimada gallega.', '6\nCuanto más quemes el alcohol, menos fuerte estará y tomará un color más dorado. Eso ya va en gustos, si te gusta muy fuerte, nada más leer el conjuro, puedes parar de remover. Para apagar la queimada, pon encima de la cazuela una tapadera.', '7\nSirve la queimada gallega caliente en pequeños cuencos de barro y disfruta de esta antigua tradición con tus seres queridos.Espero que te haya gustado la receta y te invito a que visites mi blog Cakes para ti.Si quieres conocer, además, más recetas gallegas tradicionales, no dejes de visitar nuestra sección de recetas gallegas para encontrar todo lo que buscas.']",,https://www.recetasgratis.net/receta-de-queimada-gallega-41139.html,10 comensales,10m,,Dificultad baja,,[],"['1 litro de aguardiente', '175 gramos de azúcar', '1 limón', '1 naranja', '1 puñado de granos de café']"
Licor de café,,"['1\nSe lleva a ebullición el agua, el café, la piel de naranja seca, las barras de canela y el anís.', '2\nCon el azúcar realizaremos un caramelo que no llegue a amargar y le pondremos la preparación anterior ya colada.', '3\nLo volveremos a hervir para deshacer el caramelo y le pondremos el orujo al gusto.']","Valoración: 3,9 (48 votos)",https://www.recetasgratis.net/receta-de-licor-de-cafe-16568.html,10 comensales,15m,,Dificultad baja,,[],"['1/2 ud. naranja (de la piel seca)', '2 rama canela', '150 gr. café (en grano)', '100 gr. anís dulce', '2 l. agua', '1 kg. azúcar', 'orujo (al gusto)']"
Michelada,,"['1\nPrimero se escarcha (que es poner sal en la boca del vaso) después, se ponen como 2 o 3 cubitos de hielo, el jugo de un limón, unas gotas de jugo maggi, unas más de salsa soya, y un poco de chile en polvo.', '2\nSe revuelve todo bien y se agrega la cerveza.', '3\nSe mezcla, y ya la puedes probar....es buenísima, es una bebida mexicana, originaria de San Luis Potosí.', '4\nSe pueden cambiar las cantidades de los ingredientes, ya que es al gusto de la persona.']",Valoración: 4 (87 votos),https://www.recetasgratis.net/receta-de-michelada-16279.html,1 comensal,15m,,Dificultad baja,,['Recetas mexicanas'],"['1 lata de Cerveza', '1 chorro de Zumo de limón', '1 chorro de Salsa Maggi', '1 cucharada postre de Chile en polvo', '1 chorro de Salsa soja', '1 pizca de Sal', '1 puñado de Hielo']"
Batido de melón con Thermomix,,"['1\nPoner todo en el vaso de la thermomix y programar 25 segundos, velocidad 5-7-9 progresivo.', '2\nDebe quedaros muy suave y cremoso.', '3\nPodeis hacerlo con cualquier otra fruta, aunque quizás haya que aumentar un poco el tiempo si se trata de una fruta más carnosa o consistente.']",Valoración: 5 (2 votos),https://www.recetasgratis.net/receta-de-batido-de-melon-con-thermomix-41030.html,6 comensales,15m,Desayuno,Dificultad baja,,['Recomendada para perder peso'],"['1 unidad de Melón', '500 gramos de Leche desanatada', '1 unidad de Clara de huevo']"
Thermomix: Leche De Pantera,,"['1\nPonga todos los ingredientes en el vaso del thermomix y programe 40 segundos, velocidad 5 o hasta que quede todo el hielo triturado.', '2\nEspolvoree con canela y sirva rápidamente la leche de pantera en un vaso alto y con una pajita.']",Valoración: 4 (4 votos),https://www.recetasgratis.net/receta-de-thermomix-leche-de-pantera-31166.html,4 comensales,15m,,Dificultad baja,,[],"['400 g. (4 cub.) De ginebra.', '1 bote pequeño de leche condensada', '50 g. (1/2 cub.) De brandy.', 'Canela en polvo.', '1 1/2 bandejas de hielo.']"
