title,intro,order,votes,comensales,duración,para,dificultad,coste,types,ingredientes,url
Boquerones en vinagre a la andaluza,"Tanto si vives como si has veraneado alguna vez en Andalucía has tenido que probar los boquerones en vinagre caseros. No es verano si no hay de por medio una buena ración de este pescado.Prepararlos en casa no es complicado aunque más de uno se guarda la receta casera de los boquerones en vinagre blancos como oro en paño presumiendo de preparar los mejores de la zona. No sé si esta que comparto con RecetasGratis es la mejor receta pero os aseguro que salen muy buenos y no es nada complicado ni es necesario utilizar ingredientes ""extraños"" para que queden blanquitos.El éxito de vuestra receta de boquerones en vinagre a la andaluza dependerá de la calidad del pescado, así que cuanto mejores sean los boquerones más ricos estarán. ¿Te animas? En casa te harán la ola a la hora del aperitivo o de la cena y... ¡no te olvides de comentar cómo te han quedado!","['1\nEmpezamos a hacer estos boquerones en vinagre a la andaluza limpiando el pescado. Les quitamos la cabeza, las vísceras y también la espina. Los lavamos muy bien, los ponemos en una bolsa para congelar y procedemos a congelarlos durante una semana. Esto evitará el contagio de anisakis en los boquerones en vinagre que hagamos ya que las bajas temperaturas matan a estos gusanos.', '2\nPasada la semana, sacamos los boquerones limpios del congelador y los dejamos en el frigorífico hasta que estén totalmente descongelados. Es imprescindible que el proceso de descongelación sea en frío para evitar la contaminación del pescado y una posterior intoxicación alimentaria.', '3\nUna vez descongelados los ponemos en un escurridor amplio y los lavamos durante varios minutos bajo el chorro de agua fría. Dejamos escurrir y mientras, pelamos y picamos los ajos en cuadraditos muy finitos y picamos también el perejil.\nTruco: Lo podemos hacer a mano o con ayuda de una picadora.', '4\nColocamos la mitad de los boquerones aproximadamente en un bol plano y con tapadera. Procuramos ponerlos bien colocaditos. Cubrimos con la mitad del vinagre y ponemos un poquito de sal (la sal siempre a nuestro gusto pero por favor evitemos los excesos) y la mitad del ajo y el perejil picados. Cubrimos esta capa con el resto de los boquerones y vertemos el resto del vinagre, el aceite y el ajo y el perejil restante. Podemos poner un poquito más de sal, aunque siempre podemos rectificar antes de servir.Si los boquerones en vinagre caseros no quedan cubiertos del todo añadimos un poquito más de vinagre o bien podemos poner agua si no queremos que estén muy fuertes.', '5\nTapamos bien los boquerones en vinagre con ajo y perejil y los dejamos reposar en el frigorífico al menos 24 horas. Pasado este tiempo, tendremos unos boquerones en vinagre a la andaluza deliciosos para disfrutar como aperitivo o como cena.En muchas zonas es frecuente acompañarlos de patatas fritas (de las de bolsa) pero yo prefiero tomarlos acompañados de una buena ensalada verde. ¡Espero que os gusten! y si es así, no olvides pasarte por mi blog Los dulces secretos de Cuca para ver muchas más recetas.']","Valoración: 3,7 (3 votos)",4 comensales,24h,Entrante,Dificultad baja,,"['Recetas españolas', 'Recetas andaluzas']","['1 kilogramo de Boquerones', '250 mililitros de Vinagre', '5 dientes de Ajo', '1 rama de Perejil fresco', '100 mililitros de Aceite de oliva virgen extra']",https://www.recetasgratis.net/receta-de-boquerones-en-vinagre-a-la-andaluza-61267.html
Bacalao en salsa verde,"Esta vez en RecetasGratis vamos a preparar un plato de bacalao en salsa verde, una salsa típica del país Vasco. Una salsa sencilla y fácil de preparar, que aunque en cada casa le dan su toque particular, está muy buena y con el bacalao queda genial.El bacalao es un pescado blanco muy consumido en España, bajo en grasas y con mucha proteínas. Así que no te lo pienses más y consigue un delicioso plato de bacalao fresco en salsa verde vasca que podemos preparar con antelación en poco más de media hora.","['1\nPara elaborar este bacalao fresco en salsa verde vasca primero tenemos que preparar todos los ingredientes que vamos a utilizar.', '2\nEmpezamos preparando el bacalao, que tiene que estar desalado al punto de sal. En el caso de que no lo esté, es necesario que lo pongas en remojo en un recipiente y le vayas cambiando el agua varias veces al cabo de unas horas para que se desale, hasta que compruebes que está en el punto de sal que te gusta.', '3\nA continuación, comenzaremos a preparar la salsa verde del pescado poniendo en un mortero los ajos picados.', '4\nLuego ponemos el perejil picado y lo machacamos un poco en el mortero.', '5\nSeguidamente, ponemos en el mortero el agua para empezar a volver la mezcla líquida.', '6\nY después agregamos las 4 cucharadas de vinagre. Lo removemos y mezclamos todo y reservamos la salsa verde para después.', '7\nPosteriormente pasamos el bacalao por la harina para rebozarlo.', '8\nPonemos una cazuela al fuego con el aceite y cuando esté caliente ponemos el bacalao. Lo dejamos un par de minutos a fuego fuerte para freírlo bien.', '9\nSeguidamente echamos al bacalao la salsa verde del mortero y removemos.', '10\nDejamos cocinar el bacalao fresco en salsa verde vasca a fuego medio e iremos moviendo la cazuela con movimientos de vaivén. Cuando veamos que la salsa está ligada y apunto de terminar de cocinarse (tardará unos 8-10 minutos) echaremos los huevos de codorniz y apagamos.', '11\nDejaremos reposar un rato el bacalao en salsa verde con los huevos de codorniz para que se cuajen y listo. Es mejor hacerlo un buen rato antes de comerlo para que la salsa coja todo el sabor del bacalao.¡Y listo para comer! Visita mi blog Cocinando con Montse para descubrir muchas otras recetas sabrosas de pescado como esta y déjame un comentario con tu opinión.']",Valoración: 4 (1 voto),4 comensales,30m,Plato principal,Dificultad baja,,"['Recetas españolas', 'Recetas vascas']","['8 trozos de Bacalao remojado', '4 dientes de Ajos', '150 gramos de Harina', '1 puñado de Perejil', '4 cucharadas soperas de Vinagre', '100 mililitros de Aceite', '1 vaso de Agua', '4 unidades de Huevos de codorniz']",https://www.recetasgratis.net/receta-de-bacalao-en-salsa-verde-61199.html
Bacalao con patatas y pimientos,"Imagen: http://frigorificosmorales.com/blogrecetas


Una buena forma de comer pescado blanco si es que no te gusta mucho su sabor es acompañándolo de una guarnición que sí te guste y te sea apetecible, como este bacalao con patatas y pimientos que esta vez te vamos a enseñar en RecetasGratis.Si quieres saber cómo preparar esta receta de bacalao con pimientos y patatas sigue leyendo y entérate de cómo hacerlo paso a paso.","['1\nEl primer paso para elaborar esta receta de bacalao con patatas y pimientos es limpiar bien los pimientos verdes italianos y freírlos enteros en una sartén con abundante aceite a fuego lento. Una vez bien hechos, los reservamos para más tarde.', '2\nAl mismo tiempo, pelamos y cortamos las patatas en rodajas finas, y lavamos y cortamos los pimientos rojos en tiras.', '3\nUna vez que los pimientos verdes estén hechos, en el mismo aceite aprovechamos y freímos los pimientos rojos y las patatas.', '4\nMientras se cocinan estos ingredientes, preparamos los trozos de bacalao que tienen que estar desalados. Si no tendrás que desalarlos poniéndolos en un recipiente con agua durante unas 36 horas y cambiándoles el agua cada 12. Una vez que el bacalao tenga su punto de sal, ponemos un chorro de aceite de oliva nueva en la sartén, lo rebozamos en harina de trigo y lo cocinamos a fuego fuerte.', '5\nUna vez que tengamos el bacalao frito lo colocamos en una bandeja de horno junto con los pimeintos verdes y rojos y las patatas por al lado. Entonces salpimentamos las verduras, añadimos el vino de Jerez y horneamos el bacalao con pimientos y patatas unos 5 minutos a 250º C aproximadamente (horno fuerte).', '6\nPasado este tiempo ya podremos disfrutar de un delicioso plato de bacalao con patatas y pimientos al horno para sorprender a toda la familia.']",Valoración: 5 (1 voto),6 comensales,45m,Plato principal,Dificultad baja,,[],"['1½ kilogramos de Bacalao cortado (en 6 trozos) y desalado', '1 kilogramo de Pimientos verdes italianos', '2 Pimientos rojos', '½ kilogramo de Patatas', '1 chorro de Aceite del oliva virgen extra', '1 pizca de Sal', '1 vaso pequeño de Vino de Jerez', '1 puñado de Harina de trigo']",https://www.recetasgratis.net/receta-de-bacalao-con-patatas-y-pimientos-61158.html
Pescado en papillote al horno,"La gracia de cocinar un pescado en papillote al horno es que conserva todos los nutrientes, sabores y olores concentrados del pescado en sí y de la guarnición que le pongamos, ya que esta técnica de cocina se basa en cocinar los alimentos en sus propios jugos internos sin nada de aceite u otra grasa y cerrándolos herméticamente, en este caso con papel de aluminio que es una cosa que todos tenemos en casa.Así pues, nuestros amigos de Nutrición y Cocina han querido compartir con RecetasGratis este papillote de merluza, para que veáis paso a paso como se hacer, pero en realidad, podéis hacer la receta de papillote saludable y con pocas calorías con cualquier pescado que os apetezca.","['1\nEmpezaremos a hacer este pescado en papillote al horno cortando las verduras en juliana y poniéndolas en una sartén con el aceite caliente para que se pochen. Añadimos también una pizca de sal y las vamos removiendo hasta que estén un poco pochaditas pero no demasiado hechas, porque luego las acabaremos de hacer en el horno. Luego las reservamos.\nTruco: No hacemos las verduras junto con el pescado en papillote al horno porque no tiene los mismos tiempos de cocción y podrían quedarnos crudas.', '2\nA continuación, salpimentamos las porciones de pescado que hayamos escogido y las colocamos cada una en un trozo de papel de aluminio, que es donde haremos el papillote de merluza. Ponemos por encima unas cuantas verduras pochadas también.\nTruco: Es mejor colocar cada ración de pescado en papillote individualmente porque si son muy grandes o ponemos varias juntas se pueden romper en el horno.', '3\nSeguidamente, cerramos el papel de aluminio como si fuera un libro, pero no muy justo, sino dejando espacio suficiente para que la merluza y las verduras quepan bien y pueda caber el vapor de cocción mientras que el pescado en papillote se cocina al horno. Entonces hacemos cuatro dobleces en los tres extremos del papel de plata hacia dentro para que no se salga nada. \nTruco: No podemos romper ni cerrar el papillote de merluza mal porque si no se escapará el vapor y no se cocinará bien.', '4\nFinalmente, precalentamos el horno a 200º C y metemos una bandeja con todas las raciones de pescado en papillote al horno. Cuando los paquetitos se hayan hinchado como una pelota, entonces empezamos a contar y los dejamos en el horno unos 10-12 minutos. ¡Y listo!Si te gustan las recetas de papillote prueba también este salmón al papillote con patatas o esta lubina en papillote, y recuerda que puedes utilizar esta técnica de cocina con cualquier pescado que te guste.']",,6 comensales,15m,Plato principal,Dificultad media,,"['Recomendada para perder peso', 'Recetas al horno']","['750 gramos de Pescado (salmón, merluza, mero,…)', '2 unidades de Zanahoria', '1 unidad de Pimiento verde', '1 unidad de Pimiento rojo', '1 unidad de Cebolla', '1 cucharada sopera de Aceite de oliva', '1 pizca de Sal', '1 pizca de Pimienta']",https://www.recetasgratis.net/receta-de-pescado-en-papillote-al-horno-61073.html
Bacalao al ajoarriero con patatas,"Si no sabes cómo hacer bacalao ajoarriero con patatas estás en el sitio indicado, porque RecetasGratis pone a tu disposición en esta ocasión esta receta de ajoarriero de bacalao con patatas asadas al microondas para ahorrar mucho más tiempo en su elaboración.El origen del bacalao ajoarriero es incierto pero está muy asociado con las comunidades más norteñas de España como son Aragón, Navarra, País Vasco, Asturias, y Castilla y León. No se sabe con certeza porque se llama así pero se cree que es debido a que los arrieros utilizaban esta preparación para conservar los alimentos que transportaban durante sus largos trayectos.Lo que sí te aseguro es que una vez pruebes este plato de bacalao al ajoarriero con patatas querrás volver a repetir seguro. ¡Ya me contarás!","['1\nDescongelar el bacalao en el caso de que lo hayamos comprado congelado, y desalarlo, en el caso de que sea fresco y no esté desalado, es lo primero que tenemos que hacer para preparar esta receta de bacalao al ajoarriero con patatas. Para ello, colócalo en un recipiente con agua y cámbiasela unas cuantas veces cada cierto tiempo hasta que esté en su punto de sal.', '2\nUna vez tenemos el pescado en su punto, ponemos el aceite en una sartén a fuego medio y cuando esté caliente freímos el bacalao poniéndolo con la piel hacia arriba durante unos 3 minutos. Después le damos la vuelta y lo freímos unos 5 minutos más con la piel por abajo. Para que no llegue a pegarse la piel espolvoreamos una pizquita de sal y tapamos la sartén durante unos 3 minutos más para cocinarlo esta vez a fuego lento y que se acabe de hacer al vapor con sus propios jugos.\nTruco: La cocción del bacalao depende del grosor del mismo pero se sabe si está hecho cuando las hojuelas se le van abriendo.', '3\nMientras tanto, lavamos las patatas, las pinchamos con un cuchillo en varios sitios, las envolvemos en papel de cocina húmedo y asamos las patatas en el microondas durante unos 6 minutos a 800 W de potencia. Cuando haya pasado ese tiempo, las dejamos reposar envueltas unos 4 minutos más y ya estarán bien hechas. Reservamos.Si lo prefieres puedes puedes cocinar las patatas asadas al horno pero de esta manera, se ahorra mucho tiempo y quedan igual de buenas.', '4\nUna vez hecho el bacalao, lo sacamos de la sartén y lo reservamos tapado para que se enfríe lo menos posible. Entonces ha llegado la hora de saber cómo hacer el ajoarriero: para ello pelamos y cortamos en rodajas los ajos y las ponemos a freír en esa misma sartén.', '5\nAhora colocamos los trozos de pescado frito en el plato donde vayamos a presentar el bacalao ajoarriero con patatas y, cuando los ajos estén dorados, los sacamos del aceite y los colocamos por encima del pescado.', '6\nSeguidamente, apagamos el fuego, añadimos el pimentón picante a la sartén, removemos un poco para que se integren todos los sabores de la receta de ajoarriero de bacalao con patatas y, sin que el pimentón llegue a quemarse, lo vertemos con el aceite por encima del pescado.', '7\nPara terminar, cortamos las patatas asadas en rodajas sin pelarlas y las colocamos en un lado del plato espolvoreadas con una pizca de sal y un poquito de perejil y cebollino picado. ¡Et voilà! En unos pocos minutos tenemos un bacalao al ajoarriero con patatas para mojar pan.Esta es la guarnición que yo he elegido para preparar esta receta de bacalao ajoarriero con patatas pero tú puedes servir el pescado solo o con otro acompañamiento que te guste más, como unas verduras asadas por ejemplo.\nTruco: Si lo prefieres puedes pelar las patatas asadas.']",,2 comensales,30m,Plato principal,Dificultad baja,,"['Recetas españolas', 'Recetas vascas']","['2 trozos de bacalao fresco o congelado (unos 400 gramos)', '4 dientes de ajo', '1 cucharadita de pimentón picante', '4 cucharadas soperas de aceite de oliva virgen extra', '2 patatas', '1 pizca de sal fina', 'perejil picado', 'cebollino picado']",https://www.recetasgratis.net/receta-de-bacalao-al-ajoarriero-con-patatas-61138.html
Boquerones en vinagre caseros,"La tapa de boquerones en vinagre es un clásico de la cocina española. ¿Quién no ha disfruta de una ronda de cervezas con un platito de boquerones junto a unas olivas? Pues bien, tanto si vives en España como si no, en RecetasGratis te enseñamos a preparar un clásico que nunca pasa de moda, los boquerones en vinagre.Aunque pueda parecer compleja, la preparación de estos boquerones marinados es más sencillo de lo que crees, lo que necesita es un poco de tiempo y listo. Vamos entonces con las instrucciones que comparte José Báez Labrador y disfruta de un auténtica tapa española.","['1\nEl primer paso para preparar nuestra tapa de boquerones en vinagre es limpiar muy bien el pescado. Para ello deberás quitar cabeza, espina y vísceras de cada uno de los boquerones.Una vez abierto mitad y mitad, lava bien con agua hasta que desparezca toda la sangre. Entonces, pasa los boquerones por el escurridor y seca muy bien con papel de cocina.', '2\nLos filetes de pescado se deben congelar, para hacerlo correctamente, ve colocando los boquerones en tandas dentro de un recipiente o sobre láminas de papel de aluminio.Congelar durante al menos 48 horas (para asegurarnos de no correr peligro por el anisakis) y pasado este tiempo, poner a descongelar en el frigorífico.', '3\nCuando los boquerones estén descongelados, ve colocando de nuevo los filetes por tandas, pero esta vez dentro de un envase de cristal.La idea es ir colocando capas de pescado, sal y vinagre y repetir hasta terminar con los ingredientes.', '4\nDejar los boquerones macerando en vinagre durante al menos 24 horas. Pasado este tiempo, sacamos y lo ponemos a escurrir.Mientras, preparamos un picado de perejil y ajo laminado y entonces, volvemos a colocar tandas de boquerones, aceite, ajo y perejil, hasta terminarlos en un recipiente siempre de cristal.', '5\nDebemos dejar macerando los boquerones en vinagre caseros otras 24 horas y listo, pasado este tiempo ya podemos disfrutar de nuestro manjar.Este plato es una tapa típica española que puedes servir junto a otras igual de famosas como la ensaladilla rusa o las croquetas de cocido.']",,4 comensales,24h,Entrante,Dificultad media,,['Recetas españolas'],"['200 gramos de Boquerones frescos', '1 manojo de Perejil fresco', '1 puñado de Sal gorda', 'Vinagre de vino blanco', '4 dientes de Ajo', 'Aceite de oliva', 'Agua']",https://www.recetasgratis.net/receta-de-boquerones-en-vinagre-caseros-61123.html
Corviche de atún,"Uno de los platillo más tradiciones y más populares en Ecuador es una preparación que se caracteriza en su receta original por llevar carne de corvina, un pez originario del mar mediterráneo, de ahí el nombre corviches ecuatorianos. Estos se combinan con un poco de plátano macho y se preparan en forma de pequeñas croquetas, las cuales tienen un sabor delicioso.En esta ocasión en RecetasGratis queremos enseñarte esta exquisita receta de corviche de atún, en la cual reemplazaremos la carne de corvina por carne de atún, por si no puedes encontrar ese pez donde tú vives.El corviche de atún es una preparación práctica, sencilla y queda perfecto para servir un rico tentempié en casa, o si lo acompañamos de una sustanciosa guarnición es excelente como plato principal.","['1\nEn primer lugar, para hacer este corviche de atún necesitamos reunir todos los ingredientes que vayamos a utilizar para tenerlos a mano.', '2\nPara comenzar vamos a cocinar la mitad de plátano macho: para esto lo colocamos en una cacerola con agua hirviendo, y dejamos que se cocine hasta que esté suave.', '3\nAhora tomamos la verdura picada finamente, el pimiento verde, el tomate rojo, la cebolla morada y el ajo, entonces la colocamos en un sartén y dejamos que se sofría.', '4\nUna vez suaves las verduras añadimos el atún, el cilandro picado, una pizca de sal y pimienta, y dejamos que se cocine todo junto 3 minutos más. Pasado este tiempo las retiramos del fuego y reservamos un momento.', '5\nPor otro lado, una vez listo el plátano lo hacemos completamente puré y añadimos el plátano crudo rallado. Mezclamos también con el cacahuate molido y el achiote. Así nuestros corviches ecuatorianos estarán súper sabrosos.', '6\nTomamos un poco de nuestra mezcla para el corviche de atún para formar unas croquetas alargadas de mediano tamaño y rellenamos con el guiso de atún y verdura.', '7\nFreímos los corviches de atún hasta que se observen completamente dorados y crujientes.', '8\nUna vez listos los retiramos del fuego, los colocamos sobre papel absorbente para retirar exceso de grasa, y servimos los corviches de atún calientes. Podemos acompañarlos con una sencilla ensalada de cebolla morada marinada en limón con sal por ejemplo, ¡que los disfrutes!Y si te gustan las recetas con atún, te recomiendo que le eches un vistazo a las siguientes:Bolitas de atúnTortitas de atúnEmpanadas de atún caseras']",Valoración: 5 (1 voto),5 comensales,45m,Plato principal,Dificultad baja,,[],"['3 piezas de Plátano macho', '2 latas de Atún en agua', '1 taza de Cacahuate molida', '1 pieza de Cebolla morada', '1 pieza de Pimiento verde', '2 piezas de Tomate rojo', '1 diente de Ajo', '1 cucharadita de Achiote', '3 ramas de Cilantro', '1 pizca de Pimienta', '1 pizca de Sal']",https://www.recetasgratis.net/receta-de-corviche-de-atun-61008.html
Albóndigas de salmón en salsa de tomate,"Las albóndigas en salsa son un platillo divertido, con una estética diferente a los platillos comunes y que pueden prepararse con una gran variedad de ingredientes y estilos. Además su preparación es sencilla, práctica y suelen ser bastante económicas, aunque esto depende mucho del ingrediente principal con el que son preparadas.En esta ocasión en RecetasGratis quisimos traer para ti una exquisita receta de albóndigas de salmón en salsa de tomate, un platillo digno de reyes ya que tiene un sabor increíble.Sigue leyendo y juntos preparemos paso a paso estas fascinantes albóndigas de salmón caseras, vas a dejar a todos en casa sorprendidos por lo especial del platillo y por su gran sabor, ¡te encantarán!","['1\nComenzaremos a elaborar estas albóndigas de salmón en salsa de tomate reuniendo los ingredientes que necesitamos.', '2\nPara empezar prepararemos una mezcla con el pan molido y la leche, esto ayudará a darle consistencia y forma a nuestras albóndigas en salsa.', '3\nA esta mezcla de pan molido con leche le añadiremos la yema de huevo, el ajo picado, el perejil picado y el salmón picado, y mezclamos nuevamente todo hasta integrarlo perfectamente.', '4\nAhora tomamos un poco de esta mezcla y con nuestras manos vamos formado bolitas de aproximadamente 4 cm de diámetro. Así quedaran nuestras albóndigas de salmón caseras.', '5\nCubrimos las albóndigas de salmón completamente con un poco de harina de trigo, hasta quedar completamente empanizadas.', '6\nAhora tomamos albóndigas de salmón caseras y las llevaremos a freír en un sartén con suficiente aceite de oliva muy caliente. Dejamos que se frían hasta que se observen doradas.', '7\nUna vez listas, retiramos las albóndigas caseras del aceite y las colocamos sobre un poco de papel absorbente para retirar el exceso de grasa que pudieran contener.', '8\nA continuación, las servimos calientes bañadas con la salsa de tomate caliente. Podemos acompañar estas ricas albóndigas de salmón en salsa de tomate con unos ricos crotones de pan de ajo.']","Valoración: 4,5 (2 votos)",4 comensales,45m,Plato principal,Dificultad baja,,[],"['600 gramos de Salmón fresco', '50 gramos de Pan molido', '60 mililitros de Leche entera', '1 pieza de Yema de huevo', '2 dientes de Ajo', '200 gramos de Salsa de tomate', '100 gramos de Harina de trigo', '200 mililitros de Aceite de oliva', '1 pizca de Sal', '1 rama de Perejil']",https://www.recetasgratis.net/receta-de-albondigas-de-salmon-en-salsa-de-tomate-61018.html
