title,intro,order,votes,comensales,duración,para,dificultad,coste,types,ingredientes,url
Camotillo frito con ensalada campera,"Imagen: http://saanaanddanielinecuador.blogspot.com.es/2014/01/manabi-food-nam-nam.html


Si quieres preparar un pescado frito con una receta ecuatoriana estás en la página indicada porque en esta ocasión nuestro amigo Nicolás Araya ha compartido con RecetasGratis su paso a paso para elaborar un delicioso camotillo frito con ensalada campera, un plato lleno sabor gracias a la manera de cómo sazonar el pescado para freír.Además, en vez de hacer filetes de camotillo puedes preparar esta receta con el pescado frito entero si lo prefieres. Y la ensalada campera, que en este caso es sin patata, va de acompañamiento pero siempre puedas hacerla a tu gusto y añadir o quitar todos los ingredientes que gustes. ¿Te animas a probar este camotillo frito de Ecuador?","['1\nLo primero que tienen que hacer para elaborar este camotillo frito con ensalada campera es preparar una pasta con el ajo y el jengibre y separarla en dos.', '2\nA continuación, filetear los camotillo, salpimentar y adobar con una de las partes de la pasta de jengibre y ajo y reservar en frío por 20 minutos.\nTruco: También puedes cocinar el camotillo frito entero sin filetearlo so lo deseas.', '3\nDespués clarificar la mantequilla y agregar la otra mitad de la pasta de ajo y jengibre para saborizarla.', '4\nSeguidamente blanquear las habas entre 10 y 15 minutos. Un vez estén bien hechas, pelar, dejar enfriar y reservar.', '5\nLuego cortar tomates en gajos y los aguacate en parmentier o cubos y reservar.', '6\nA continuación, cortar el tocino en brunoise y disponer en un sartén a fuego medio hasta que esté crujientes y completamente dorado, y reservar.', '7\nDespués mezclar la miel, el aceto balsámico y el aceite de oliva y formar un dressing o vinagreta para la ensalada campera sin patatas.', '8\nLuego disponer los filetes de camotillo en la mantequilla clarificada y darles cocción por 5 minutos aproximadamente. Esta es una buena manera de saber cómo preparar el pescado frito sin harina bien sabroso.', '9\nSeguidamente, mezclar cada ingrediente de la ensalada campera sin patatas, agregar la vinagreta o dressing, y revolver bien.', '10\nPor último, servir el camotillo frito con ensalada campera todo junto ¡y a disfrutar! Acompañar con unos patacones de platano y un poco de arroz suelto blanco, así queda delicioso.']",,4 comensales,45m,Plato principal,Dificultad media,,[],"['4 unidades de Camotillo fresco', '200 gramos de Mantequilla', '1 trozo de Jengibre', '4 dientes de Ajo', '1 libra de Habas', '100 gramos de Tomate cherry', '2 Aguacates grandes', '100 gramos de Tocino', '50 gramos de Rúcula fresca', '30 gramos de Miel', '100 mililitros de Aceto balsámico', '1 pizca de Sal', '1 pizca de Pimienta', '20 mililitros de Aceite de oliva']",https://www.recetasgratis.net/receta-de-camotillo-frito-con-ensalada-campera-60780.html
Sardinas enlatadas en salsa de tomate,"Si no tienes ganas ni tiempo de preparar algo laborioso, en RecetasGratis traemos para ti una sencilla receta de sardinas en lata con tomate, ya verás que es un proceso que no tomará mucho tiempo, que no tiene gran dificultad y que además te encantará.Uno de los productos preferidos de los amantes de los pescados es la sardina, además de uno de los más económicos y fáciles de encontrar. Es por ello que en esta ocasión hemos optado por un plato que toma como protagonista a este fruto del mar. Te invitamos a que te quedes con nosotros y preparemos juntos esta rica receta de sardinas enlatadas en salsa de tomate, prometemos que no te arrepentirás y que es querrás prepararla una y otra vez.","['1\nEn la siguiente imagen podrás observar los ingredientes que necesitaremos para la preparación de esta deliciosa receta de sardinas enlatadas en salsa de tomate.', '2\nTomamos los chiles jalapeños y los limpiamos perfectamente quitándoles las semillas y las venas, y los troceamos en pequeños pedazos.', '3\nPor otro lado, para continuar con la elaboración de la salsa roja que acompañará a las sardinas enlatadas a la mexicana, cortamos en trozos grandes la cebolla y el tomate rojo. Una vez listos estos ingredientes, los colocamos en la licuadora junto con el ajo y los chiles, y procedemos a licuar hasta obtener una salsa homogénea.', '4\nUna vez lista la salsa, la pasamos por un colador y la colocamos en una cacerola con aceite caliente. Entonces, dejamos que se sofría de 10 a 15 minutos, moviendo constantemente, y añadimos una pizca de sal y de pimienta.', '5\nMientras se cocina la salsa roja, para saber cómo preparar sardinas enlatadas, tomamos el pescado, lo enjuagamos con cuidado con agua limpia y pasamos al siguiente paso.', '6\nCuando las sardinas estén limpias y haya pasado el tiempo de cocción de la salsa, agregamos el pescado a la cazuela y dejamos que se cocine todo junto durante 5 minutos más. Como ves, preparar sardinas entomatadas siguiendo este proceso que emplea sardinas en lata es muy sencillo y rápido.', '7\nPasado este tiempo, podemos servir las sardinas enlatadas con salsa de tomate calientes y acompañadas con trozos de pan tostado, por ejemplo, arroz blanco o una ensalada verde. ¡Buen provecho!']",Valoración: 3 (2 votos),4 comensales,30m,Plato principal,Dificultad baja,,[],"['1 lata de Sardinas', '2 piezas de Chiles jalapeños verdes', '2 dientes de Ajo', '½ pieza de Cebolla', '½ kilogramo de Tomate rojo', '1 cucharada sopera de Aceite', '1 pizca de Sal', '1 pizca de Pimienta']",https://www.recetasgratis.net/receta-de-sardinas-enlatadas-en-salsa-de-tomate-60691.html
Dorada con patatas panaderas,"No se sabe con exactitud la fecha en que aparecieron las patatas en Europa, habiendo muchas versiones de la historia. Algunos escritos mantienen que fue Colón quien las importó aunque no existe documentación que lo confirme. Con el correr de los años su cultivo se extendió por toda Europa convirtiéndose en lo que se llamó ""el pan de los pobres"".Este versátil tubérculo es ahora uno de los alimentos principales en la dieta humana. Por eso en esta ocasión con RecetaGratis esta fácil receta de dorada con patatas panaderas al horno, con la que podrás deleitar a todos tus invitados en cualquier ocasión.","['1\nLo primero que haremos para elaborar esta dorada con patatas panaderas es precalentar el horno a 200º C.Si lo prefieres puedes limpiar el pescado tú mismo pero sino le podemos pedir al pescatero que nos limpie la dorada de escamas, nos quite la espina central y nos saque los lomos.A continuación, pelamos las patatas y las cortamos en rodajas redondas. Las escaldamos en agua hirviendo con sal durante un par de minutos.', '2\nDespués preparamos la bandeja de horno forrada con papel vegetal. Colocamos los lomos de dorada con la piel hacia abajo, salpimentamos, y los regamos con un chorrito de aceite por encima.', '3\nSeguidamente, cubrimos la dorada con las rodajas de patata, ligeramente superpuestas entre sí. Salpimentamos y echamos otro chorrito de aceite por encima.También podemos hacer los loamos de dorada al horno con patatas panaderas a modo de cama, de tal manera que las patatas actúen de base y el pescado quede por encima, pero en esta receta, he preferido poner las patatas a modo de costra de la dorada.', '4\nPor último, metemos la dorada al horno con patatas durante unos 15 o 20 minutos. Cuando veamos que todo está bien hecho y dorado, ya podremos servir bien caliente nuestra dorada con patatas panaderas en la mesa.Si quieres conocer más recetas de pescados al horno como esta, visita mi blog La Cocina de Catina.']",,4 comensales,1h 30m,Plato principal,Dificultad baja,,['Recetas al horno'],"['1 unidad de Dorada de 1 kgr aproximadamente', '350 gramos de Patatas', '3 cucharadas soperas de Aceite de oliva', '½ cucharadita de Pimienta negra molida', '1 cucharadita de Sal']",https://www.recetasgratis.net/receta-de-dorada-con-patatas-panaderas-60800.html
Pescado rebozado crujiente paso a paso,"En esta ocasión vamos a preparar un pescado blanco con un rebozado crujiente y con mucho sabor. A veces es difícil que los más pequeños coman pescado, por eso hay que buscar la manera de hacerlo lo más gustoso para ellos posible.Esta receta la podemos hacer con cualquier pescado blanco, como la merluza, el bacalao..., e incluso podéis utilizar pescado congelado. Estas tiras de pescado rebozado quedan jugosas y sabrosas, quedan suaves al paladar y sin espinas. Solo queda acompañarlas de una salsa de yogur o una mayonesa. Sigue leyendo y descubre en RecetasGratis cómo hacer pescado rebozado crujiente, ¡seguro que triunfa!","['1\nPreparamos los filetes de pescado y los salamos. Por otro lado, picamos el perejil y los 2 dientes de ajo; en un bol colocamos el pan rallado y ponemos el ajo y el perejil para empezar a preparar el rebozado crujiente para pescado frito.', '2\nEn otro bol batimos los huevos. Hecho esto, empezamos a rebozar el pescado blanco y, para ello, pasamos los filetes por el huevo. Se pueden rebozar los filetes de pescado enteros, o cortarlos a tiras.', '3\nLuego, pasamos el pescado por el pan rallado con el ajo y el perejil, tal y como se muestra en la fotografía. Debe estar bien cubierto para que el pescado rebozado quede crujiente.', '4\nPondremos una sartén al fuego y cuando esté caliente iremos friendo los filetes de pescado rebozados.', '5\nTendremos un plato con papel de cocina para que absorba el aceite sobrante del pescado rebozado crujiente, así cuando esté el pescado dorado lo sacaremos y lo iremos poniendo en el plato.', '6\nCuando ya esté todo cocinado lo pondremos en una fuente acompañado de una salsa de yogur o mayonesa y unos tomates cherry. ¡Y los filetes de pescado rebozados crujientes están listos para comer!Si te ha gustado esta receta de pescado frito, no dudes en visitar mi blog Cocinando con Montse y descubre platos fáciles y deliciosos.']",,4 comensales,30m,Entrante,Dificultad baja,,[],"['500 gramos de Filetes de pescado sin espinas', '1 taza de Aceite de oliva', '2 Huevos', '200 gramos de Pan rallado', '2 dientes de Ajo', '1 puñado de Perejil picado', '1 pizca de Sal', 'Salsa de yogur', 'Mayonesa']",https://www.recetasgratis.net/receta-de-pescado-rebozado-crujiente-paso-a-paso-60779.html
Mojarra frita al chipotle,"Cuando de pescados hablamos, la mojarra es uno de los más populares ya que además de ser un pescado que representa una buena porción de proteína al momento de consumirse, pues tiene un tamaño considerable, también es uno de los más accesibles por sus bajos precios.Por eso en esta ocasión en RecetasGratis hemos decidido traer para ti, aprovechando la época de Semana Santa por la que estamos pasando, una deliciosa receta de mojarra frita al chipotle. Se trata de una preparación muy sencilla y que tiene un increíble sabor.Entonces te invitamos a que te quedes con nosotros y te enseñaremos cómo hacer mojarra frita, con la podrás sorprender a todos tus visitantes en estas semanas de descanso.","['1\nEn la siguiente imagen podrás observar los ingredientes que necesitaremos para la preparación de esta increíblemente deliciosa mojarra frita al chipotle.', '2\nPara comenzar tomamos nuestras mojarras y las limpiamos muy bien, si ya nos las venden limpias perfecto, pero si no pues les sacamos todo el interior y les quitamos las escamas. Una vez limpias, hacemos dos pequeñas cortadas de cada lado del pescado con ayuda de un cuchillo, como las que se observan en la imagen y salpimentamos muy bien nuestro pescado blanco, añadiendo sal y pimienta en los dos lados del pescado y en el interior también un poco. Reservamos nuestras mojarras limpias un momento.', '3\nAhora tomamos la cebolla blanca y los dientes de ajo y los picamos muy finamente, así como podemos observar en la siguiente imagen.', '4\nPor otro lado, tomamos los chipotles, la crema agria, la leche, uno de los dientes de ajo y un trozo de cebolla y los colocamos en la licuadora, procedemos a licuar hasta obtener una salsa homogénea para la mojarra frita, la cual reservaremos un momento.', '5\nUna vez todo listo, tomamos la cebolla y el diente de ajo que picamos y los colocamos en un sartén con un poco de aceite previamente calentado, dejamos que se sofrían.', '6\nUna vez se observe dorado el ajo, tomamos nuestras mojarras y las ponemos a freír en este aceite aromatizado con ajo y cebolla, dejamos que se fría 1 minuto de cada lado.', '7\nUna vez listo esto, añadimos la salsa de chipotle y dejamos que nuestro pescado termine de cocinarse a fuego medio en esta salsa. Sabremos que está listo cuando el pescado se sienta suave y se desprenda fácil.', '8\nY ¡LISTO!, servimos este delicioso platillo de mojarra frita al chipotle caliente y acompañado con unos ricos crotones o con una rica ensalada.. Yo por ejemplo lo acompañé con una ensalada que lleva lechuga, tomate rojo, zanahoria y cebolla morada, queda estupendo.']","Valoración: 4,5 (2 votos)",4 comensales,45m,Plato principal,Dificultad baja,,['Recetas mexicanas'],"['4 piezas de Mojarra medina', '1 lata de Chile chipotle adobado', '1 pieza de Cebolla blanca', '2 dientes de Ajo', '2 tazas de Crema agria', '½ taza de Leche entera', '1 pizca de Sal', '1 pizca de Pimienta', '½ taza de Aceite', 'Zanahoria', 'Lechuga', 'Cebolla morada', 'Tomate rojo']",https://www.recetasgratis.net/receta-de-mojarra-frita-al-chipotle-60748.html
Carpaccio de salmón y bacalao con tomate,"El carpaccio se caracteriza por ser un platillo hechos base de rebanadas finas de algún ingrediente. Tradicionalmente el carpaccio se hace con ternera aunque actualmente se encuentran variedades de todo tipo, desde carpacccios veganos de sandía hasta recetas tan originales como esta, hecha con pescado.En esta ocasión en RecetasGratis traemos para ti una exquisita receta gourmet de carpaccio de pescado, pero no utilizaremos cualquier pescado, si no que lo prepararemos con salmón y bacalao, lo que hace a esta receta aún más atractiva. Quédate con nosotros y preparemos junto esta receta sencilla, practica y muy deliciosa, no te la puedes perder por nada. Cambia la rutina y olvídate de lo tradicional con este plato de carpaccio de salmón y bacalao con tomate.","['1\nEn la siguiente imagen podrás observar los ingredientes que necesitaremos para la preparación de este delicioso carpaccio de salmón y bacalao con tomate.', '2\nLo que hace diferente al carpaccio de otros platos donde se degustan alimentos crudos es el corte. El carpaccio debe estar presentado en láminas muy finas así que lo primero que haremos será cortar el pescado en láminas muy delgadas.Un truco para conseguir este corte es congelar un poco la carne, de ternera o pescado, para facilitar el laminado.', '3\nPara incorporar la sazón empezaremos por el bacalao. Extiende las láminas sobre papel film y añade un poco de pimienta molida.', '4\nEnseguida colocamos el salmón sobre la base de bacalao, justo como se observa en la siguiente imagen.', '5\nSobre la superficie del salmón esparcimos un poco de eneldo fresco finamente picado.El eneldo es una de las mejores especias para combinar con salmón, de hecho puedes hacer una mezcla de aceite, eneldo, sal y limón para comer carpaccio de salmón crudo o salmón ahumado.', '6\nAhora tomamos de un extremo la placa de papel film y comenzamos a enrollar nuestras capas de pescado, cuando vallamos enrollando vamos apretando para que todo quede firme, una vez formado el rollito, llevamos a la nevera y lo dejamos reposar ahí por 30 minutos.La idea es crear un rulo de pescado marinado el cual dejaremos solidificar en el congelador para después cortar nuevas láminas que incluyen una mezcla de todos los sabores.', '7\nMientras tanto tomamos los tomates rojos y los ponemos a cocinar en agua hirviendo hasta que se suavicen.', '8\nUna vez listos podemos hacer la salsa de tomate. Para ello, los colocamos en el vaso de la licuadora, añadimos un diente de ajo, un trozo de cebolla una pizca de sal y procedemos a licuar hasta obtener una mezcla homogénea. Reservar.', '9\nPasado el tiempo de reposo en la nevera, tomamos el rollito de pescado le quitamos la capa de plástico film y lo rebanamos en rodajas finas. Colocamos las rodajas en el plato y rociamos con jugo de limón dejando que marine durante unos 15 minutos. Colocamos el plato de nuevo en la nevera y reservamos.Para que el pescado compacte del todo, lo mejor es dejarlo en el congelador al menos unas 4-6 horas. Si no tienes este tiempo y quieres terminar la preparación más rápido, puedes cortar trozos más gruesos, como tacos y seguir el resto del procedimiento, como hemos hechos nosotros. La presentación no quedará como un carpaccio tradicional pero no dejará de ser un plato exquisito y muy elegante.', '10\nUna vez pasado este tiempo podemos servir nuestro carpaccio de salmón y bacalao con tomate, colocando una pequeña porción de salsa a un lado y acompañando con galletas saladas.Y recuerda que puedes usar esta preparación para hacer otros platos como por ejemplo la ensalada de carpaccio de ternera.. te quedaría una ensalada con carpaccio de pescado muy original, ¡anímate a crear tus propios platos!']",Valoración: 4 (1 voto),6 comensales,45m,Entrante,Dificultad baja,,[],"['300 gramos de Bacalao', '200 gramos de Lomo de salmón', '250 gramos de Tomate rojo mediano', '1 pieza de Cebolla blanca medina', '1 rama de Eneldo fresco', '2 piezas de Limón', '1 pizca de Sal', '1 pizca de Pimienta']",https://www.recetasgratis.net/receta-de-carpaccio-de-salmon-y-bacalao-con-tomate-60709.html
Salmón al horno con patatas y gambas,"Hacer un buen salmón al horno con patatas no es tan complicado como muchos de vosotros pensáis. En RecetasGratis os vamos a enseñar cómo hacer un buen salmón al horno hecho en su punto. El toque de la cama de patatas, cebolla, ajo con el que os proponemos hacer esta receta de salmón con gambas le aportará a la carne del pescado la jugosidad de la que carece.Aprende a elaborar la mejor receta de salmón siguiendo el paso a paso que te explicamos para hacer esta receta de salmón al horno con patatas y gambas.","['1\nAntes de comenzar con la elaboración de la receta de salmón al horno con patatas y gambas, presentamos los ingredientes que vamos a utilizar.', '2\nPelamos las patatas y las cortamos como si fueran para hacer patatas panaderas. En una fuente que sea apta para horno, rociamos el fondo con aceite, y colocamos las patatas. Añadimos un poco de cebollino y les damos un primer golpe de horno con este a 180º C durante 5 minutos.', '3\nEn esos cinco minutos, cortamos la cebolla, y pasado este tiempo se la sumamos a la patata.', '4\nColocamos a continuación el salmón y picamos los ajos. Rociamos todo con sal y aceite.', '5\nPor último, disponemos las gambas alrededor del salmón y lo metemos al horno a 160º C durante 13 minutos. Ni uno más o se os quedará seco. De hecho, os recomiendo que a los 10 minutos abráis el horno y toquéis la carne del salmón, si esta tiesa y parece que salen láminas, es que el salmón al horno con patatas y verduras está listo.', '6\nDejamos que el salmón al horno con patatas y gambas se enfríe unos minutos sobre una rejilla y lo decoramos con unas ramillas de cebollino.']",Valoración: 5 (1 voto),2 comensales,30m,Plato principal,Dificultad baja,,['Recetas al horno'],"['1 unidad de Lomo de salmón', '2 unidades de Patatas', '100 gramos de Gambas', '30 gramos de Cebolla', '3 dientes de Ajo', '6 ramas de Cebollino', '2 cucharadas de postre de Sal', '100 mililitros de Aceite de oliva']",https://www.recetasgratis.net/receta-de-salmon-al-horno-con-patatas-y-gambas-60636.html
Salmón a la plancha con salsa de yogur,"Si te gustan los contrastes de sabores, hoy traemos un plato caliente acompañando por una salsa fría, se trata del salmón a la plancha con salsa de yogur, una receta de 5 minutos que no te puedes perder.El salmón forma parte de lo que llamamos el pescado azul, su carne es muy saludable y posee grasas buenas que nos aportan Omega 3 entre otros nutrientes. Además, el salmón es muy fácil de preparar y con él podemos crear una infinidad de platillos deliciosos, así que es por todas estas ventajas que nos brinda que en RecetasGratis traemos para ti una receta de salmón a la plancha fácil, rápida y deliciosa.Salmón condimentando ligeramente, cocinado vuelta y vuelta para dorar ligeramente y acompañado con una espectacular salsa fría de yogur, que además podrás usar para acompañar otros platos de pescado.Vamos entonces con la receta paso a paso del salmón a la plancha con salsa de yogur.","['1\nEn la siguiente imagen podrás observar los ingredientes que necesitaremos para la preparación de este delicioso salmón a la plancha con salsa de yogur.', '2\nVamos a comenzar tomando el diente de ajo y con mucho cuidado lo vamos a picar muy finamente, así como se observa en la siguiente imagen.', '3\nAhora preparamos la salsa de yogur, para esto mezclamos el yogur griego con la mostaza, el ajo picado, el aceite de oliva, el jugo del limón y una pizca de pimienta. Integramos todo perfectamente.', '4\nUna vez lista nuestra mezcla, la cubrimos con un poco de plástico film y la llevamos a reposar por 15 minutos a la nevera.', '5\nMientras tanto tomamos nuestros lomos de salmón, los salpimentamos perfectamente y los llevamos a cocinar a la plancha caliente. Dejamos que se cocinen por tres minutos.', '6\nUna vez pasado el tiempo de reposo de nuestra salsa de yogur, la retiramos de la nevera y la servimos como una cama sobre la colocaremos nuestro pescado a la plancha y ¡Listo!Este estupendo plato de salmón a la plancha con salsa de yogur lo puedes preparar cuando no tengas mucho tiempo de cocinar, así como la recta de salmón con salsa de soja y miel. De guarnición de recomendamos acompañar con un poco de arroz basmati.']","Valoración: 4,7 (3 votos)",4 comensales,30m,Plato principal,Dificultad baja,,[],"['2 rodajas de Lomo de salmón fresco', '250 mililitros de Yogur griego natural', '1 diente de Ajo', '1 cucharada sopera de Moztaza', '1 pieza de Limón', '1 cucharada sopera de Aceite de oliva', '1 pizca de Pimienta', '1 pizca de Sal']",https://www.recetasgratis.net/receta-de-salmon-a-la-plancha-con-salsa-de-yogur-60698.html
Bacalao rebozado con harina y cerveza,"Apúntate esta receta de bacalao rebozado en tempura de cerveza si no sabes cómo hacerlo porque te aseguro que nunca has probado un bacalao fresco rebozado crujiente como este.El truco está en la masa para rebozar el bacalao que está hecho con harina de trigo, de maíz, un poco de levadura en polvo, yema de huevo, ajo molido, perejil picado y cerveza fría en vez de agua. ¿Suena bien, no?Pues no lo pienses más y aprovecha este paso a paso que RecetasGratis te ofrece para preparar un delicioso bacalao rebozado con harina y cerveza para chuparse los dedos.","['1\nPara empezar a preparar este bacalao rebozado con harina y cerveza lo primero que tenemos que hacer es cortar en bacalao en trozos gruesos si es que no lo hemos comprado ya así. Es importante que el bacalao esté al punto de sal porque sino está desalado tendrás que dejarlo en remojo y cambiarle el agua tantas veces como sea necesario.', '2\nA continuación, preparamos la masa para rebozar el bacalao, en este caso, una tempura de cerveza. Para ello, en un bol mezclamos la harina de trigo, de maíz y la levadura en polvo, y añadimos chorritos de cerveza fría que mezclamos con unas varillas hasta conseguir una crema espesa.\nTruco: Cuanto más fría esté la cerveza mejor quedará el bacalao rebozado en tempura después.', '3\nUna vez preparada la tempura del bacalao rebozado con harina y cerveza, añadiremos el ajo, el perejil picado y la yema de huevo para darle aún más sabor. Este paso es opcional pero la verdad es que con esta mezcla los bocaditos de bacalao en tempura quedan muy crujientes y sabrosos.', '4\nAhora calentamos una sartén con abundante aceite y mientras se calienta, rebozamos el bacalao en la tempura de cerveza.', '5\nUna vez que el aceite esté bien caliente freímos el bacalao fresco rebozado hasta que nos quede bien dorado por todos los lados.', '6\nPor último, colocamos los trozos de bacalao rebozado crujientes y esponjoso en un plato con papel absorbente para retirar el exceso de aceite que haya podido quedar.', '7\nY finalmente podemos emplatar nuestro bacalao rebozado con harina y cerveza acompañado con unos pocos canónigos y unas rodajitas de limón, que combinan muy bien con este pescado.']","Valoración: 4,5 (2 votos)",3 comensales,15m,Entrante,Dificultad baja,,['Recetas españolas'],"['450 gramos de Bacalao', '1 cucharada sopera de Harina de trigo', '2 cucharadas soperas de Harina de maíz', '1 cucharadita de Levadura química tipo Royal', '1 chorro de Cerveza fría', '1 Yema de huevo', '1 pizca de Perejil seco picado', '1 pizca de Ajo molido', 'Aceite para freír']",https://www.recetasgratis.net/receta-de-bacalao-rebozado-con-harina-y-cerveza-60695.html
