url,ingrediants,steps,title,uuid
https://elgourmet.com/recetas/higados-de-pollo-a-la-putanesca/, Aceite de oliva c/n A gusto   Alcaparras  2  cucharadas medianas   Diente De Ajo  1  unidad   Extracto de tomate  1 Cucharada   Hígados de pollo  500  Gramos   Vino tinto  1 Taza   Perejil  c/n A gusto   Mantequilla  1  cucharadas medianas   Papas hervidas al natural  c/n A gusto   Peperoncino  1  unidad   Sal fina  c/n A gusto   Albahaca  c/n A gusto   Tomates perita  200  Gramos   Anchoas  3 Unidades ,"Picar peperoncino,   un diente de ajo y dorar en sartén a fuego lento con aceite de oliva y mantequilla.   Limpiar y salpimentar los hígados de pollo,   añadir a la sartén y dorar de ambos lados sin tocarlos.   Añadir hojas de albahaca para perfumar el aceite.   Cuando estén dorados salar del otro lado.   Añadir extracto de tomate,   anchoas y desglasar con vino tinto y cuando evapora el alcohol añadir tomates perita en salsa y dejar que se cocinen.   Servir sobre una base de papas cortadas en cubo y hervidas.   Terminar con alcaparras y perejil picado.  ",Hígados de Pollo a la Putanesca,c45ce4ef-497c-4350-953b-818f776831e7
https://elgourmet.com/recetas/budin-con-frutas-abrillantadas-y-frutos-secos/, Ron 1/4 Taza   Almendras  100  Gramos   Azúcar  200  Gramos   Huevos  4 Unidades   Frutas abrillantadas  200  Gramos   Harina 0000  350  Gramos   Azúcar impalpable  c/n A gusto   Limón para su ralladura  1  unidad   Mantequilla  200  Gramos   Naranja para su ralladura  1  unidad   Nueces  100  Gramos   Polvo de hornear  2  cucharadas medianas   Sal fina  1 Pizca ,"Mezclar con batidora la mantequilla pomada con el azúcar.   Luego sumar de a uno los huevos.   Por último la harina 0000,   el polvo de hornear y una pizca de sal.   Agregar frutas abrillantadas,   nueces y almendras picadas.   Sumar ralladura de naranja y de limón con un poco de ron.   Verter en un molde previamente enharinada y enmantequillado.   Llevar a horno por 50 a 170°.  ",Budín con Frutas Abrillantadas y Frutos Secos,074d8a2a-168e-4bf4-8e31-1c72ce7eee92
https://elgourmet.com/recetas/gnocchetti-allo-zafferano/, Agua 250 Ml   Azafrán  1 Cápsula   Sal fina  c/n A gusto   Sémola de grano duro  500  Gramos  Salsa  Pimienta c/n A gusto   Sal fina  c/n A gusto   Aceite de oliva  c/n A gusto   Cebolla  1  unidad   Crema de leche  330 Ml   Queso parmesano  c/n A gusto   Limón para su jugo  1/2  unidad   Mantequilla  1  cucharadas medianas   Romero  c/n A gusto   Panceta  200  Gramos   Puerro  1  unidad ,"Mezclar la sémola con agua,   azafrán y sal.   Disolver los líquidos en forma de volcán con la ayuda de un tenedor.   Amasar hasta lograr una masa lisa.   Dejar secar tapado con una tela por 20 minutos.   Cortar rollos y estirarlos con la mano.   Extender el rollo todo lo posible utilizando la palma de la mano.   Cortar con cuchillo.   Con la ayuda de sémola pasar por una ñoquera para darle forma.    Llevar a cocinar la pasta en agua con sal gruesa.   Colar la pasta y terminar de cocinar en la salsa.   En una sartén con aceite de oliva dorar cebolla picada,   puerro y panceta picada.   Condimentar con sal.   Agregar mantequilla,   pimienta negra molida,   crema,   queso rallado y jugo de limón.   Servir y terminar con romero picado,   algo más de queso rallado y pimienta negra.  ",Gnocchetti allo Zafferano,60e25be2-b4c7-4ef4-90da-207617e11c53
https://elgourmet.com/recetas/bunuelos-de-pescado-con-ensalada-de-rabanitos/, Pimienta c/n A gusto   Eneldo  c/n A gusto   Aceite neutro  c/n A gusto   Menta  c/n A gusto   Huevos  2 Unidades   Harina  3  cucharadas medianas   Jugo De Limón  1/2  unidad   Limón  1  unidad   Mozzarella ahumada  100  Gramos   Perejil picado  c/n A gusto   Pescado blanco cocido  500  Gramos   Puré de papas  200  Gramos   Queso parmesano  50  Gramos   Queso parmesano  20  Gramos   Rabanitos  1 Atado   Sal fina  c/n A gusto   Albahaca  c/n A gusto ,"Desmenuzar el pescado.   Mezclar en un bowl con perejil picado,   sal,   los huevos,   puré de papas y queso parmesano rallado.   Sumar queso mozzarella ahumada.   Ligar la mezcla con un poco de harina.   Dar forma a la mezcla con la ayuda de dos cucharas y llevar a una sartén con aceite neutro para freír.   Cortar rodajas finas de rabanito en bol aparte.   Condimentar con jugo de medio limón,   sal,   aceite de oliva y queso rallado.  ",Buñuelos de Pescado con Ensalada de Rabanitos,1975f155-6e34-481b-941c-a03353e6cc2a
https://elgourmet.com/recetas/repollitos-de-bruselas-gratinados/, Pimienta c/n A gusto   Aceite de oliva  c/n A gusto   Nuez moscada  c/n A gusto   Curry  1 Cucharada   Tomillo  c/n A gusto   Limón para su ralladura  1  unidad   Crema de leche  1 Taza   Queso parmesano  200  Gramos   Repollitos De Bruselas  400  Gramos   Sal fina  c/n A gusto ,"Hervir los repollitos 6/7 minutos.   Reservar.   Llevar la crema de leche a un recipiente de horno.   Condimentar con pimienta,   curry,   tomillo,   nuez moscada y ralladura de limón.   Añadir los quesos rallados y mezclar.   Sumar los repollitos con un poco de sal,   mezclar bien,   cubrir con más queso rallado,   hilos de aceite de oliva y ralladura de limón.   Gratinar 15/20 minutos a 180/200 grados.  ",Repollitos de Bruselas Gratinados,3b84d8a1-e7cd-4ac4-b896-feac2a2bb1e0
https://elgourmet.com/recetas/sopa-acquacotta/, Papas 2 Unidades   Aceite de oliva  c/n A gusto   Achicoria  1/4  unidad   Apio  1  unidad   Caldo de verdura  c/n A gusto   Cebolla  1  unidad   Huevos  3 Unidades   Diente De Ajo  1  unidad   Extracto de tomate  1 Cucharadita   Tomates perita  5 Unidades   Hongos de pino  1/2 Taza   Romero  c/n A gusto   Zanahorias  2 Unidades   Queso fontina  100  Gramos   Rodajas de pan  c/n A gusto   Sal fina  c/n A gusto ,"Dorar en sartén cebolla,   apio y zanahoria en cubos.   Perfumar con romero y un diente de ajo entero.   Añadir papas en cubos,   hongos de pino previamente hidratados y su jugo,   extracto de tomate y tomates perita en cubos.   Salar,   cubrir con caldo y cocinar a fuego medio durante 40 minutos aproximadamente.   Añadir a último momento la achicoria,   cubos de queso y huevos.   Cocinar 3 o 4 minutos más.   Servir con hilos de aceite de oliva,   pimienta y pan.  ",Sopa Acquacotta,9f56bc47-38e1-40c3-811b-181ea1d3435d
https://elgourmet.com/recetas/costillas-de-credo-con-pure-de-boniato/, Pimienta c/n A gusto   Aceite neutro  c/n A gusto   Agua  c/n A gusto   Costillas de cerdo  4 Unidades   Harina  300  Gramos   Limón  1/2  unidad   Migas de pan  200  Gramos   Queso parmesano  100  Gramos   Sal fina  c/n A gusto   Salvia  c/n A gusto  Puré de Boniato  Miel c/n A gusto   Sal fina  c/n A gusto   Salsa picante  c/n A gusto   Mantequilla  100  Gramos   Leche  200 Ml   Boniatos  1 kg   Diente De Ajo  1  unidad ,"Mezclar harina y agua en un recipiente  ;   en otro migas de pan,   queso rallado y hojas de salvia.   Salpimentar las costillas,   remojarlas en la mezcla de harina y rebozar en la mezcla de migas y queso.   Freír en sartén bien caliente con aceite neutro hasta que estén doradas.   Reservar en bandeja con papel absorbente.   Hervir los boniatos pelados en abundante agua y sal.   Llevar a un bowl,   mixear con mantequilla y leche hervida con sal y ajo.   Condimentar con sal,   miel y salsa tabasco.   Servir con gajos de limón.  ",Costillas de Cerdo con Puré de Boniato,6b09e775-3b53-4409-af3f-63f60e621c52
https://elgourmet.com/recetas/torta-gialla-de-polenta-y-pistachos/, Jugo de naranja 1/2 Taza   Pistachos  1 Taza   Aceite de oliva  1/2 Taza   Huevos  2 Unidades   Harina 0000  1 1/4 Taza   Harina de maíz  1/2 Taza   Crema de leche  c/n A gusto   Azúcar  1 Taza   Azúcar impalpable  c/n A gusto   Polvo de hornear  1  cucharadas medianas   Ralladura de naranja  1  unidad   Sal  1 Pizca  Almíbar  Jugo de naranja 1 Taza   Azúcar  1/2 Taza ,"Mezclar los huevos con aceite de oliva,   jugo de naranja,   la harina 0000,   la harina de maíz,   el azúcar,   el polvo de hornear,   ralladura de naranja y sal.   Llevar a un horno a 180° por 35 minutos.   En una olla cocinar jugo de naranja con azúcar.   Una vez que la torta esté a temperatura ambiente agujerear con un palillo y embeberla con el almíbar.   Sumar pistachos picados como decoración.   Servir con crema y azúcar impalpable.  ",Gialla de Polenta y Pistachos,ed20aa03-b79e-4b35-84b4-be028c78659a
https://elgourmet.com/recetas/orecchiette-con-pesto-de-brocoli/, Orecchiette c/n A gusto  Pesto  Queso parmesano c/n A gusto   Nueces  50  Gramos   Aceite de oliva  c/n A gusto   Brócoli  150  Gramos   Diente De Ajo  1  unidad   Ricota  100  Gramos   Sal fina  c/n A gusto  Salsa  Anchoas 3 Unidades   Diente De Ajo  1  unidad   Brócoli  50  Gramos   Pasas de uva  40  Gramos   Peperoncino  c/n A gusto ,"Procesar brócoli hervido con sal,   ajo picado,   aceite de oliva,   queso parmesano,   nueces tostadas y mozzarella cremosa.    Cocinar la pasta seca en una olla con agua hirviendo y sal gruesa.   Cocinar en una sarten el ajo y las anchoas con aceite de oliva.   Sumar brócoli hervido y pasas de uva.   Después,   sumar a la sartén peperoncino picado.   Colar la pasta y llevar a la misma sartén.   Por último,   agregar el pesto.   Servir con queso rallado y aceite de oliva.  ",Orecchiette con Pesto de Brócoli,fc9136c9-a852-48fe-81d2-ffa232dab9f4
https://elgourmet.com/recetas/polpette-de-ternera-y-cerdo-envueltas-en-repollo/, Pimienta c/n A gusto   Nuez moscada  c/n A gusto   Carne picada de ternera  400  Gramos   Carne picada de cerdo  350  Gramos   Crema de leche  150 c.c.   Diente De Ajo  1  unidad   Huevo  1  unidad   Leche  c/n A gusto   Queso parmesano  c/n A gusto   Perejil  c/n A gusto   Migas de pan  c/n A gusto   Puré de tomates  1 Litro   Repollo  1  unidad   Sal fina  c/n A gusto   Albahaca  c/n A gusto ,"Mezclar la carne picada de cerdo con la carne picada de ternera.   Condimentar con sal,   queso parmesano rallado,   miga de pan,   pimienta y nuez moscada.   Unir la mezcla con el huevo y la leche.   Rallar el diente de ajo y revolver la mezcla.   Sumar otro huevo de ser necesario.   Agregar perejil rallado y dar forma de albóndigas con la mano.   Envolver cada albóndiga dentro de una hoja de repollo.   Tostar semillas de hinojo en una sartén.   Sumar salsa de tomate,   aceite de oliva,   pimienta,   sal y hojas de albahaca.   Incorporar las albóndigas envueltas en repollo dentro de esta sartén y dejar cocinar por 10 minutos en sartén tapada.   Sumar crema con perejil picado y aceite de oliva.  ",Polpette de Ternera y Cerdo Envueltas en Repollo,f4114e1d-7095-4482-8d43-ad78ef52b0db
https://elgourmet.com/recetas/ensalada-de-atun-con-repollo-y-radicchio/, Porotos 1 Taza   Aceite de oliva  c/n A gusto   Atún  170  Gramos   Cebolla morada  1/2  unidad   Cilantro  c/n A gusto   Perejil  c/n A gusto   Radicchio  1  unidad   Repollo blanco  1  unidad   Sal fina  c/n A gusto   Sumac  c/n A gusto   Huevos duros  2 Unidades   Vinagre de manzana  c/n A gusto ,"Cortar el repollo y el radicchio en tiras.   Añadir porotos blancos cocidos,   cebolla morada en pluma,   atún y hojas de perejil picado.   Condimentar con aceite de oliva,   sumac,   sal y pimienta a gusto.   Terminar con huevos duros en mitades y ralladura de limón.  ",Ensalada de Atún con Repollo y Radicchio,a27b9d02-f0e1-4cc1-9023-2f427e418690
https://elgourmet.com/recetas/sopa-de-polpette-de-ricota/, Pimienta c/n A gusto   Aceite de oliva  c/n A gusto   Nuez moscada  c/n A gusto   Caldo de verduras  c/n A gusto   Migas de pan  1 Taza   Huevo  1  unidad   Tomates  2 Unidades   Perejil  c/n A gusto   Queso parmensano  1/2 Taza   Ricota  500  Gramos   Sal fina  c/n A gusto   Sémola  c/n A gusto   Albahaca  c/n A gusto ,"Preparar un caldo a base de cebolla,   puerro,   zanahoria,   apio,   ajo y laurel.   Añadir tomates maduros cortados en cubos.   Llevar ricota sin suero en un bol aparte,   desgranar,   salpimentar,   condimentar con nuez moscada,   añadir queso parmesano rallado,   migas de pan tostado,   un huevo y perejil picado.   Mezclar bien hasta obtener una mezcla con la que se pueda formar bolitas.   Formar las polpetas,   pasar por semolín y añadir al caldo.   Dejar cocinar.   Terminar con hojas frescas e hilos de aceite de oliva.  ",Sopa de Polpette de Ricota,00b62b41-f454-4ffa-87c4-0e63a394d209
https://elgourmet.com/recetas/ninos-envueltos-con-hierbas-secas/, Pimienta c/n A gusto   Aceite de oliva  c/n A gusto   Anchoas  100  Gramos   Ralladura De Limón  c/n A gusto   Bifes de cuadrada  600  Gramos   Harina  c/n A gusto   Hinojo  c/n A gusto   Vino blanco  1 Taza   Perejil  c/n A gusto   Mantequilla  c/n A gusto   Miga de pan  c/n A gusto   Mozzarella  200  Gramos   Romero  c/n A gusto   Sal fina  c/n A gusto   Salvia  c/n A gusto   Ajo asado  2 Dientes ,"Procesar migas de pan del día anterior con perejil deshojado,   ajo asado,   romero,   barbas de hinojo,   sal y aceite de oliva.   Llevar a un bowl y reservar.   Disponer la mezcla sobre los bifes de cuadrada,   añadir anchoa,   mozzarella e hilos de aceite de oliva.   Enrollar,   ajustar con palillo y pasar por harina.   Dorar en sartén con base de mantequilla y aceite.   Desglasar con vino blanco,   cuando se evapore el alcohol tapar y dejar cocinar.   Acompañar los niños envueltos con puré de papa.  ",Niños Envueltos con Hierbas Secas,05dde363-98e4-4c09-8e78-fe13614cfa1f
https://elgourmet.com/recetas/ensalada-de-pasta-con-aderezo-de-palta/, Arvejas 50  Gramos   Bocconcini  100  Gramos   Palta  1  unidad   Tirabuzón  200  Gramos   Espinaca  c/n A gusto   Rúcula  c/n A gusto  Aderezo  Rúcula c/n A gusto   Espinaca  c/n A gusto   Albahaca  c/n A gusto   Sal  c/n A gusto   Aceite de oliva  c/n A gusto   Cilantro  c/n A gusto   Jugo De Limón  1/2  unidad   Palta  1  unidad ,"Procesar la palta con jugo de limón,   sal,   hojas de rúcula,   de espinaca,   cilantro,   albahaca y aceite de oliva.   Mezclar en un bol la pasta seca ya cocida.   Sumar arvejas,   hojas de rúcula,   espinaca,   cubos de palta y jugo de limón.   Sumar el aderezo y la mozzarella.  ",Ensalada de Pasta con Aderezo de Aguacate,3b0d92e3-1dcc-4901-af4d-390404fb627d
https://elgourmet.com/recetas/bifecitos-de-carne-a-la-sarten/, Papas 2 Unidades   Sal  c/n A gusto   Aceite de oliva  c/n A gusto   Arvejas  100  Gramos   Bola de lomo  1 kg   Diente De Ajo  1  unidad   Espárragos  150  Gramos   Vino blanco  1/2 Taza   Mantequilla  50  Gramos   Panceta  200  Gramos   Salvia  c/n A gusto   Harina  1 Taza ,"Cortar la carne en bifecitos no muy anchos.   Aplastarlos con el cuchillo para afinarlos.   Condimentar la carne con sal fina y pimienta.   Pasar por un plato con harina.   Cocinar cebolla,   ajo y panceta picados en una sartén con aceite de oliva.   Luego los bifecitos vuelta y vuelta.   Por último,   las verduras  :   la papa,   los espárragos y las arvejas.   Agregar el vino blanco,   las hojas de salvia,   sal,   pimienta y aceite de oliva.   Tapar la sartén,   dejar cocinar y de ser necesario sumar agua.   Luego de 10 minutos sumar perejil picado y los trozos de mantequilla.   Servir.  ",Bifecitos de Carne a la Sartén,952987e5-4389-4197-830c-0710ba64c937
https://elgourmet.com/recetas/ensalada-de-kale/, Sal gruesa c/n A gusto   Aceite de oliva  c/n A gusto   Almendras  100  Gramos   Cebolla de verdeo  50  Gramos   Garbanzos  100  Gramos   Kale  200  Gramos   Tomates cherries  300  Gramos  Vinagreta  Limón para su jugo 1/2  unidad   Miel  1 cda   Aceite de oliva  c/n A gusto   Aceto balsámico  1 cdas   Sal  c/n A gusto ,"Retirar las nervaduras del kale y dejar reposar las hojas en sal hasta que se ablanden.   Reservar.   Llevar sartén al fuego y tostar almendras picadas.   Sumar medio ajo,   un chorro de aceite de oliva,   garbanzos previamente cocidos y la parte verde de cebolla de verdeo picada.   Cuando esté todo blando salar,   sumar tomates cherry al medio.   Retirar del fuego y reservar.   En bol aparte mezclar limón y aceto,   miel y aceite de oliva.   Emplatar una base de kale picado fino y luego los vegetales de sartén.   Terminar con muzzarella ahumada.   Aderezar con la vinagreta.  ",Ensalada de Kale,badae125-f8c5-45f2-807b-faed25c55657
https://elgourmet.com/recetas/berenjenas-clasicas-a-la-parmesana/, Berenjenas 2 Unidades   Pimienta  c/n A gusto   Sal gruesa  c/n A gusto   Aceite de oliva  c/n A gusto   Diente De Ajo  1/2  unidad   Queso parmesano  c/n A gusto   Puré de tomate  c/n A gusto   Semolin  200  Gramos   Albahaca  c/n A gusto ,"Cortar las berenjenas en rodajas.   Dejar reposar en colador con sal gruesa por una hora.   Pasarlas por un paño para secar y por semolín.   Calentar aceite en sartén y llevar las berenjenas con semolín hasta que estén doradas.   Sumar hojas de albahaca a la fritura.   Retirar las berenjenas a un plato.   Disponer,   en la misma sartén,   una capa de berenjenas,   luego una capa de salsa de tomate,   queso parmesano,   más hojas de albahaca y repetir hasta completar.   Terminar con más queso,   agregar dos ajos aplastados,   terminar con oliva y albahaca.   Cocinar en fuego bien tapado hasta que se amalgamen los sabores.  ",Berenjenas Clásicas a la Parmesana,8a9b8985-4f33-4cd9-b3d6-ac89a287bbce
https://elgourmet.com/recetas/escalopes-de-brotola/, Pimienta c/n A gusto   Sal  c/n A gusto   Brótola  300  Gramos   Huevos  3 Unidades   Harina  4 cdas   Perejil  c/n A gusto   Repollitos De Bruselas  500  Gramos   Sémola  4 cdas  Aderezo  Mostaza de Dijon 2 cdas   Limón para su jugo  1/2  unidad   Diente De Ajo  1  unidad   Aceite de oliva  c/n A gusto   Agua  2 cdas   Sal  c/n A gusto ,"Salpimentar los filetes de brótola,   pasar por harina con sémola,   luego por huevos batidos con sal y perejil picado.   Freír en abundante aceite caliente.   Reservar en papel absorbente.   Hervir los repollitos de Bruselas en abundante agua con sal.   Retirar y reservar.   Llevar a mixer un diente de ajo,   sal,   agua de cocción de los repollitos,   mostaza Dijon,   jugo de limón y aceite de oliva.   Servir en bol aparte para aderezar los repollitos.  ",Escalopes de Brótola,72669dda-ac98-4a4d-a15b-87cef4ffb329
https://elgourmet.com/recetas/frutillas-con-mascarpone/, Aceto balsámico 1 cda   Hojas De Menta   c/n A gusto   Azúcar Rubia  100  Gramos   Frutillas  700  Gramos   Naranja para su jugo  1/2  unidad   Ralladura de naranja  1  unidad   Pimienta negra  c/n A gusto  Mascarpone  Limón para su jugo 1/2  unidad   Crema de leche  500 c.c. ,"Cortar las frutillas a la mitad.   Llevar a un bowl.   Macerar media hora fuera de la heladera con azúcar,   jugo de naranja,   aceto y pimienta negra.   Reservar.   Llevar a bowl la crema y mezclar con jugo de medio limón.   Llevar a un paño o bolsa de tela dentro de una jarra y dejar drenar toda una noche hasta que pierda todo el suero.   Batir a medio punto y servir junto a las frutillas.   Decorar con menta y lluvia de azúcar impalpable.  ",Frutillas con Mascarpone,c57a959e-4d83-4d32-ba49-c752d03885b5
https://elgourmet.com/recetas/noquis-de-papa-con-salsa-pomodoro/, Sal c/n A gusto   Nuez moscada  c/n A gusto   Harina 0000  300  Gramos   Huevo  1  unidad   Papas  1 kg   Queso rallado  50  Gramos ,"Hervir las papas con piel en abundante agua salada.   Pelar,   pisar y formar una corona.   Añadir en el centro un huevo,   salar,   agregar nuez moscada,   queso rallado y mezclar.   Añadir harina 0000 y mezclar.   Amasar suavemente hasta hidratar la harina evitando agregar de más.   Dejar descansar tapada unos 10 minutos.   Poner a hervir abundante agua con sal.   Formar rollitos con la masa,   porcionar,   pasar por tenedor y llevar a hervor inmediatamente.   Calentar la salsa pomodoro,   añadir aceitunas negras y mozzarella.   Cuando la salsa esté caliente llevar los ñoquis hervidos,   mezclar y dejar cocinar un minuto más.   Terminar con queso rallado e hilos de aceite de oliva.  ",Ñoquis de Papa con Salsa Pomodoro,6952c890-ae56-41ac-a949-6ce0dd51b081
https://elgourmet.com/recetas/bifecitos-de-cerdo-a-la-sarten/, Sal c/n A gusto   Aceite de oliva  c/n A gusto   Carré de cerdo  2 kg   Pimienta  c/n A gusto   Mantequilla  20  Gramos   Romero  c/n A gusto   Ralladura De Limón  1  unidad   Sémola  c/n A gusto   Salvia  c/n A gusto  Guarnición  Zucchinis 2 Unidades   Panceta  200  Gramos   Pimienta  c/n A gusto   Cebolla  1  unidad ,"Cortar el carré en bifecitos.   Marinar en bowl con sal,   pimienta,   ralladura de limón,   romero y aceite de oliva.   Reservar.   Cortar zucchinis y cebolla en rodajas,   filetear ajo,   dorar todo en sartén con aceite de oliva.   Sumar trozos de panceta y pimienta negra.   Pasar los bifes por sémola y reservar hasta su cocción.   Retirar de la sartén las verduras cuando estén dorados,   agregar un cubo de mantequilla,   perfumar con salvia y cocinar los bifes por ambos lados.   Desglasar la carne,   cuando esté cocida,   con vermut blanco y en cuanto evapore devolver las verduras cocidas.   Tapar y dejar cocinar 3 minutos más.   Servir con ralladura de limón,   hilos de aceite de oliva.  ",Bifecitos de Cerdo a la Sarten,d1651eb9-73b6-44db-afe0-398df91a5a92
https://elgourmet.com/recetas/ensalada-tibia-de-cebada/, Sal c/n A gusto   Aceite de oliva  c/n A gusto   Ralladura De Limón  c/n A gusto   Cebolla  1/2  unidad   Diente De Ajo  1  unidad   Cilantro  c/n A gusto   Espinaca  50  Gramos   Agua  1/2 Taza   Hongo de pino remojados  100  Gramos   Laurel  c/n A gusto   Perejil  c/n A gusto   Mantequilla  10  Gramos   Portobellos  200  Gramos   Queso crema  2 cdas   Cebada  1/2 Taza ,"Llevar a una olla mantequilla,   aceite de oliva,   cebolla picada y dorar.   Cuando transparente agregar un diente de ajo y la cebada,   nacarar hasta que transparente.   Perfumar con hoja de laurel y agua de hongos de pino hidratados.   Añadir los hongos de pino previamente hidratados,   cubrir con agua,   dejar cocinar media hora.   Dorar aparte ajo fileteado,   hongos portobello fileteados y espinaca cruda.   Cuando estén blandos mezclar en bowl de presentación con la cebada cocida.   Terminar con cilantro,   perejil y queso crema.   Mezclar bien.   Decorar con ralladura de limón.  ",Ensalada Tibia de Cebada,a3f4fda8-5d7b-4731-89e9-3a00a4a50565
https://elgourmet.com/recetas/prensatti-de-quesos/, Mostaza c/n A gusto   Cebolla confitada  c/n A gusto   Pan de campo  c/n A gusto   Pepinitos  c/n A gusto   Queso fontina  c/n A gusto   Queso parmesano  c/n A gusto   Queso cuartirolo  c/n A gusto  Pesto  Salvia c/n A gusto   Nueces  50  Gramos   Sal gruesa  c/n A gusto   Queso parmesano rallado  50  Gramos   Diente De Ajo  1/2  unidad   Aceite de oliva  c/n A gusto ,"Llevar a mortero o mixer hojas de salvia,   sal gruesa,   ajo.   Procesar bien,   sumar aceite de oliva y agregar nueces y queso parmesano.   Procesar hasta lograr un pesto liso.   Reservar.   Armar el sándwich con pan de campo  :   untar el pan con mostaza,   disponer una capa de pepinitos en vinagre,   una de pesto de salvia,   una de cebolla caramelizada y una de variedad de quesos.   Terminar con hilos de aceite de oliva,   pimienta negra.   Tapar con nueva capa de pan.   Llevar a una sartén unos cubos de manteca y aceite de oliva.   Dorar los sándwiches.  ",Prensatti de Quesos,4f8ae829-7a9c-4e0f-975b-c53cd3efcff1
https://elgourmet.com/recetas/risotto-al-pomodoro/,Risotto  Burrata 200  Gramos   Cebolla  1  unidad   Diente De Ajo  1  unidad   Arroz  1 Taza   Mantequilla  250  Gramos   Puré de tomate  200 c.c.   Queso rallado  200  Gramos   Caldo de verduras  4 Tazas   Aceite de oliva  c/n A gusto  Salsa Pomodoro  Aceto balsámico c/n A gusto   Azúcar Rubia  100  Gramos   Sal  c/n A gusto   Tomates cherries  200  Gramos   Salvia  c/n A gusto   Diente De Ajo  1  unidad   Tomates  3 Unidades ,"Asar a 180 grados por 30 minutos los tomates cortados en gajos en placa para horno con diente de ajo,   hojas de salvia,   sal,   azúcar,   aceto y aceite de oliva.   Reservar.   Llevar cacerola alta al fuego,   añadir manteca y aceite de oliva.   Transparentar las cebollas picadas y el ajo fileteado.   Salar.   Añadir el arroz y nacarar.   Añadir de a poco el caldo caliente y puré de tomates.   Revolver en cuanto rompa hervor.   Sumar los tomates asados y cortados y cuando el arroz esté cocido apagar el fuego y montar con mantequilla y queso.   Corregir pimienta,   servir con trozos de burrata e hilos de aceite de oliva.  ",Risotto al Pomodoro,83d35109-ca1a-4332-b79e-1f1e742ad999
https://elgourmet.com/recetas/crostata-de-mermelada-de-frutos-rojos/, Sal c/n A gusto   Azúcar impalpable  1 1/4 Tazas   Huevos  3 Unidades   Harina 000  4 Tazas   Limón para su ralladura  1  unidad   Mantequilla  150  Gramos   Mermelada de frutos rojos  300  Gramos   Polvo de hornear  1 cda   Leche  1/4 Taza ,"Llevar a bowl harina,   el azúcar impalpable,   polvo para hornear,   pizca de sal,   ralladura de limón y trabajar con mantequilla fría hasta lograr un arenado.   Añadir los huevos y la leche.   Mezclar,   bajar a mesada y amasar hasta obtener una masa lisa.   Dejar descansar tapada en heladera por una hora.  Estirar la mitad de la masa hasta lograr un disco de base.   Llevar a molde enmantequillado y enharinado.   Emprolijar los bordes.  Estirar la masa restante y cortar en tiras para el enrejado.  Pinchar la base de la masa,   rellenar con mermelada,   cubrir con el enrejado y pintar con huevo batido.  Hornear a 180 grados por 20 minutos.  ",Crostata de Mermelada de Frutos Rojos,ef4072a7-f82c-422a-8ac0-b541e4578227
