url,ingrediants,steps,title,uuid
https://elgourmet.com/recetas/niguiri-de-tamagoyaki/, Huevo 5 Unidades    Azúcar 1 ¾  Cucharadas   Sake 5 Cucharadas   Alga nori 1 Unidad   Arroz de sushi aderezado (shari) Cantidad Necesaria   Aceite Cantidad Necesaria   Sal Cantidad Necesaria  Para acompañar  Pikle de Jengibre Cantidad Necesaria   Salsa de soja china Cantidad Necesaria ,"En una sartén de tamago, colocar un poco de aceite, y retirar el exceso con papel de cocina. Llevar a fuego al fuego a temperatura baja, y colocar una capa de la mezcla de 3 mm máximo  y cuando se cocine sin tomar color y  babe, plegar en tres partes, y darle una forma rectangular de 6 cm de ancho y retirar de la sartén. Volver a aceitar levemente y colocar otra capa de 3 mm, y sobre esta  y en la punta superior colocar el rectagulo de huevo a reservado y plegar en tres partes comenzando por la parte que se agregò Realizar este procedimiento 2 veces mas o hasta que se acabe la mezcla de huevo. Retirar de la sartén, cortar los bordes laterales y cortar en làminas de 4 mm. Con tijera cortar cintas de alga nori de 1 cm de ancho. Humedecer las manos, tomar una porción de shari (arroz de sushi) y trabajar sin apretar mucho hasta dar forma. Colocar sobre una lámina de huevo (tamago), presionar un poco, dar vuelta y rodear con 1 tira de alga nori para sujetar la pieza. Acomodar en el plato  y servir con salsa de soja y pickle de jengibre.",Niguiri de Tamagoyaki,41351b02-5325-472b-9eea-a4d3d5562886
https://elgourmet.com/recetas/sashimi-de-lenguado-3/, Filetes de lenguado 2 Unidades   Lima 1 Unidad    Pepino 1 Unidad  Salsa  Salsa de soja 2 Cucharadas   Jugo De Limón 1 Cucharada  Para Acompañar  Nabo rallado Cantidad Necesaria   Cebolla de verdeo Cantidad Necesaria   Wasabi Cantidad Necesaria   Huevas de salmón Cantidad Necesaria   Benishoga (pickle de jengibre o gari) Cantidad Necesaria     ,"Retirar la piel y cortar laminas en un ángulo de 45°, de un tamaño de 7 cm de largo, x 2-3 cm de ancho, y 2 mm de espesor . Presentar en forma circular alrededor del plato seleccionado. Colocar laminas finas de pepino y en el centro una flor de sashimi de lenguado con rodajas de lima intercaladas. Terminar con una cucharadita de huevas de salmòn y servir acompañado  con gari, nabo rallado, cebolla de verdeo picada y wasabi y salsa. Salsa  En un bowl pequeño mezclar jugo de limòn y salsa de soja hasta integrar.  Reservar. En un bowl pequeño mezclar jugo de limòn y salsa de soja hasta integrar.  Reservar.",Sahime de lenguado,e187e250-219f-4695-856f-e67045924f8a
https://elgourmet.com/recetas/alfajores-de-chocolate/,MASA  Extracto de malta 40 g   Almidón de maíz 100 g   Azúcar 200 g   Bicarbonato de amonio 5 g   Bicarbonato De Sodio 5 g   Cacao amargo 20 g   Agua 50 cc   Huevos 120 g   Miel 50 g   Manteca 200 g   Harina 0000 400 g  RELLENO Y BAÑO  Aceite neutro 50 cc   Chocolate cobertura semi amargo 250 g   Dulce de leche de repostería 300 g ,"Batir la manteca pomada con el azúcar hasta blanquear, agregar el extracto de malta, la miel y los huevos. Tamizar la harina, el cacao y el almidón de maíz. Disolver los bicarbonatos en el agua y agregar a la preparación anterior. Unir los ingredientes secos. Tomar la masa sin amasar. Envolver en papel film y enfriar en heladera como mínimo una hs. Estirar la masa hasta lograr un espesor de 5 mm y cortar discos de 6 cm de diámetro, colocarlos en una placa enmantecada y fría. Hornear a 170° de 12 a 15 minutos. Enfriar y retirar de las placas. Para el RellenoRellenar las dos tapas con dulce de leche, fundir el chocolate a no más de 40°, retirar del baño María, agregar el aceite y mezclar. Bañar los alfajores y escurrir. Dejar en reposo 48 hs antes de consumir.",Alfajores De Chocolate,cf868cc7-a33e-4be5-b492-5c8be6079cb7
https://elgourmet.com/recetas/alfajores-de-maicena-tradicional/, Manteca 200 g   Yemas 10 unidades   Coco rallado Cantidad Necesaria   Dulce de leche de repostería Cantidad Necesaria   Esencia de vainilla Cantidad Necesaria   Polvo Para Hornear 25 g   Ralladura De Limón Cantidad Necesaria   Sal Cantidad Necesaria   Maicena 600 g   Azúcar impalpable 200 g ,"Batir la manteca blanda con el azúcar impalpable hasta blanquear, agregar las yemas, la vainilla y la ralladura de limón. Tamizar los ingredientes secos y hace una corona. Colocar el batido en el centro. Tomar la masa y unir sin amasar. Dejar descansar durante 15 minutos, estirar la masa hasta dejarla de 5 mm de espesor. Cortar las tapas del diámetro deseado. Colocarlas sobre placas enmantecadas y enharinadas. Hornear a 160° de 8 a 10 minutos. No deben colorearse mucho. Retirar y dejar enfriar sobre rejilla.",Alfajores De Maicena Tradicional,6e213728-160d-4844-a97e-2b1b423cfac4
https://elgourmet.com/recetas/semifrio-de-frambuesa-y-yogur/, Yogur griego 375 g   Agua de rosas 10 g   Azúcar 15 g   Claras de Huevos 3 Unidades   Crema de batir 230 g   Crema batida    Gelatina en Polvo 10 g   Mini rosas    Azúcar glass 75 g   Soletas    Hojas De Menta     Agua 50 g ,"PROCEDIMIENTO Hidratar la grenetina con el agua, derretir y colocar en un recipiente. Agregar el yogur el azúcar glass, el agua de rosas, temperar la crema y agregarla, batir a incorporar, en baño maría colocar las claras y el azúcar, mover hasta esponjar, vaciar a la mezcla anterior y mover a incorporar. Vaciar una porción en molde deseado, colocar soletas troceadas, esparcir frambuesas, agregar el semifrío restante, refrigerar por dos horas, desmoldar, decorar con crema batida, frambuesas y hojas de menta.",Semifrío de Frambuesa y Yogur,47fb7150-0086-41cc-bd2a-cad58741e456
https://elgourmet.com/recetas/volcan-de-elote-y-rompope/, Granos De Elote Crudos 380 g   Lata de leche condensada 290 g   Mantequilla 80 g   Queso crema 170 g  CREMA DE ROMPOPE  Rompope    Azúcar    Crema para batir   MEZCLA DE SEMILLAS  Ajonjolí 2 cucharas   Almendra fileteada 2 cucharadas   Amaranto 2 cucharas   Nueces molidas 2 cucharadas ,"PROCEDIMIENTO Precalentar horno a 170°C En un recipiente colocar todos los ingredientes, procesar o licuar. Colocar en molde deseado y espolvorear con la mezcla de semillas, hornear por 40 min o hasta que esté dorado. PARA LA MEZCLA DE SEMILLAS Combinar en un tazón todos los ingredientes. PARA LA CREMA DE ROMPOPE Batir la crema con el azúcar a punto de picos suaves agregar el rompope sin dejar de batir, a velocidad baja, acabando del rompope subir la velocidad a obtener picos firmes. Decorar con crema de rompope, hojas de elote y palomitas.",Volcán de Elote y Rompope,16882409-7a7d-490c-afb9-c695e46f55c4
https://elgourmet.com/recetas/pastel-con-zanahoria/,BETÚN DE QUESO  Extracto de vainilla 10g   Mantequilla 60 g   Rayadura de naranja 1 unidad   Vaina de vainilla 1 unidad   Azúcar glass 360 g   Queso crema 750 g  DECORACION  Nido de chocolate 1 Pieza   Huevo de chocolate 1 Pieza   Nueces molidas 30 g  PAN DE ZANAHORIA  Nueces molidas 100 g   Bicarbonato De Sodio 5 Gramos   Huevos 4 Unidades   Canela en polvo 10 g   Extracto de vainilla 30 Ml   Harina 250 g   Aceite 240 Ml   Arándanos 50 g   Azúcar 300 g   Jengibre En Polvo 5 Gramos   Piña 100 g   Polvo Para Hornear 10 g   Vaina de vainilla 1   Zanahoria rallada 300 g   Rayadura de naranja 1 Pizca ,"PAN DE ZANAHORIA Precalentar horno a 180°C En un tazón colocar el aceite, el azúcar a incorporar, agregar huevos, el extracto de vainilla, la zanahoria, la piña, la nuez, los arándanos, el jengibre la ralladura de naranja y la pulpa de la vaina de vainilla, mezclar todos los ingredientes secos e incorporar a la mezcla anterior, vaciar en 4 moldes pequeños engrasados y enharinados, hornear por 35 min o hasta que se sienta como colchón. Enfriar y rellenar con betún, decorar con nuez picada nido y huevo de chocolate. BETÚN DE QUESO Acremar el queso crema con azúcar, la mantequilla a temperatura ambiente mezclar y agregar el extracto de vainilla, la semilla de la vaina de vainilla y la ralladura de naranja hasta lograr una textura liza y untuosa sin sobre batir.",Pastel con Zanahoria,4557a8fc-b0bf-4f93-af97-efeb5d9dbd66
https://elgourmet.com/recetas/mini-brioche-chocolatoso/,COBERTURA CON CHOCOLATE Y ALMENDRAS  Almendras 30 gr   Chocolate negro 200 g  GANACHE DE CHOCOLATE BLANCO  Chocolate blanco 400 g   Crema de leche 200 Gramos  MASA BRIOCHE  Huevos 3 unidades   Esencia de vainilla 90 ml   Harina de fuerza 250 g   Leche 15 Ml   Mantequilla 125 g   Sal 6 Gramos   Levadura seca 2 g   Azúcar 30 g ,"Pesar todos los ingredientes.   Añadir en el tazón de la batidora la harina junto con el azúcar, sal y los huevos fríos. Integrar por 30 segundos, hidratar la levadura en la leche y añadirlo a la preparación.   Batir por 2 minutos hasta que se integren los ingredientes. Bajar la velocidad de la batidora y añadir la mantequilla pomada poco a poco hasta que se integre y dejar batir hasta que la masa quede completamente lisa.   Retirar la masa de la batidora y colocarla en un recipiente con aceite y taparlo con un paño de cocina o plástico film. Dejar reposar por doce horas en la nevera.   Pasado el reposo sacar la masa y desgasificar con golpes contundentes. Dividir la masa en bolitas de 60gr y bollarlas súper bien y llevarlo al molde previamente engrasado.   Precalentar el horno a 190c°  Fermentar hasta que doble su tamaño.   Pintar con huevo suavemente y llevarlo al horno de 15 a 20 minutos.   Dejar enfriar, rellenar y bañar en chocolate. GANACHE DE CHOCOLATE BLANCO  Pesar todos los ingredientes. Añadir en un tazón el chocolate blanco junto a la crema de leche. Llevar al microondas por intervalos de 1 minuto.   Mezclar bien para tapar con papel film al contacto y dejar enfriar toda la noche en el frigorífico. Pasado ese tiempo retirar de la nevera y batir enérgicamente con batidora hasta obtener picos firmes y sedosos. COBERTURA CHOCOLATE Y ALMENDRAS Pesar todos los ingredientes. Añadir en un tazón el chocolate y derretirlo a baño maría o en microondas.   Seguidamente triturar las almendras y añadirlo al  chocolate derretido.",Mini Brioche Chocolatoso,df1ff726-31c6-4049-b628-bb043832013d
https://elgourmet.com/recetas/receta-de-bombones-ferrero/, Chocolate amargo 100g   Avellanas tostadas sin piel 12 unidades   Avellanas picadas 3/4 taza   Cacao en polvo amargo 2 cucharadas   Datiles medjoul 6 unidad   Agua 1/4 taza   Harina de avellanas tostadas sin piel 3/4 taza ,PROCEDIMIENTO Descartar los carozos a los dátiles y procesarlos junto al agua hasta formar una pasta cremosa. Pasar la pasta a un bowl y agregar el cacao y harina de avellanas. Mezclar hasta integrar. Formar bolitas con la masa colocado 1 avellana en el centro. Pasar las bolitas por las avellanas picadas para cubrirlas en éstas. Derretir el chocolate a baño maría y bañar los bombones. Llevar al freezer por 30 minutos hasta que el chocolate se solidifique. Conservar en heladera.,Bombones Ferrero,ebd56fd4-19f5-4eb1-b643-ecc5eab5fa47
https://elgourmet.com/recetas/receta-de-rollos-de-canela-con-cacao/,FROSTING  Azúcar glass 1/2 Taza   Cacao en polvo 3 cucharaditas   Agua 2 cucharadas   Queso crema 1/4 taza  MASA  Sal 1 pizca   Harina de trigo 3 tazas   Canela en polvo 1 cucharada   Azúcar 1/4 cucharadas medianas  RELLENO  Azúcar    Chocolate cacao 82% derretido 2 cucharaditas   Canela 2 cucharadas   Nueces trozadas A gusto   Manteca a temperatura ambiente 2 cucharadas  SPONGE  Leche tibia 1 Taza   Levadura seca 3 cucharadita   Azúcar morena 2 cucharadas medianas ,"SPONGE Diluir bien la levadura en la leche, junto con el azúcar y dejar reposar 10 minutos en un lugar tibio para ayudar a que haga leude. Posterior a los 10 minutos tiene que hacer espuma y quedar con un color crema. Si no queda espumoso, inténtalo de nuevo.   PREPARACIÓN Tostar las nueces hasta que estén doradas, luego córtalas en trozos pequeños. Mezclar todos los ingredientes, exceptuando las nueces, hasta crear una pasta homogénea. FROSTING Mezclar todos los ingredientes hasta formar una salsa suave y lisa.   PREPARACIÓN Colocar en un un bowl grande la harina, el azúcar, la panela, la mantequilla el sponge Incorporar todo muy bien  Mezclar con una espátula hasta obtener una masa homogénea. Amasar por 10-15 minutos hasta formar una masa suave. Colocar en un bowl, tapar con un paño húmedo y dejar reposar durante 30 minutos o hasta que duplique su tamaño. Luego de dejar reposar, pasar a un mesón con harina y retirar el aire (desgasificar) la masa ; aplastar la masa con los dedos. Estirar la masa con la ayuda de un maso en forma rectangular, dejándola de un grosor de 2 cm. Esparcir el relleno encima, dejando 3 cm libres en un extremo a lo ancho de la masa. Así mismo, agregar las nueces encima. Enrollar la masa con mucho cuidado. Ayuda con un hilo, cortar los rollos del grosor de tu gusto. Colocar en una bandeja engrasada dejando 2 cm de espacio entre cada uno. Dejar reposar durante 30 minutos con un paño húmedo encima. Luego hornear durante 40 minutos a 180°C. Deja enfriar una vez horneados,   y sirve con el glaseado de chocolate encima.",Rollos de canela con cacao,6deea298-7ca1-46d0-bfbc-315e66df5f1f
https://elgourmet.com/recetas/torta-troncha-toro/,Bizcocho  Aceite 375 Ml   Azúcar 500 g   Chocolate De Taza Derretido 100 g   Huevos 3 Unidades   Esencia de vainilla 15 c.c.   Harina 375 g   Jugo De Limón 15 cc.   Leche 375 Ml   Polvo Para Hornear 14 g   Cacao 86 g  Crema  Maicena 65 g   Margarina 12 g   Cacao en polvo 45 g   Leche 1/2 lt   Azúcar 100 g   Arequipe 300 g ,"PREPARACIÓN DEL BIZCOCHO Preparar un buttermilk, para eso debemos mezclar la leche con el jugo de limón. Unir a parte, en un bowl los huevos y el azúcar, cremar con la batidora hasta que tenga consistencia de crema y después agregar poco a poco el aceite. Cuándo la mezcla se vea homogénea, agregar la esencia y continuar batiendo. Unir los ingredientes secos previamente tamizados : la harina, el cacao y el polvo para hornear. Agregar poco a poco a la mezcla los ingredientes secos y el buttermilk alternandolos entre sí y luego batir hasta obtener una mezcla suave y sin grumos. Agregar 100 g de chocolate derretido. Verter la mezcla en dos moldes de 20 cm previamente engrasados y con papel encerado en el fondo. Hornear a 160°C por aprox. 45 minutos. ARMADO Una vez listos ambos bizcochos, colocar el primero y rellenarlo con la crema de chocolate. Cuando se haya expandido uniformemente la crema, se procede a colocar encima el otro bizcocho. Por último, cubrir toda la torta con la crema de chocolate. CREMA TRONCHA TORO Colocar en una olla todos los ingredientes previamente licuados o batidos (colar para evitar grumos). Llevar a fuego medio mezclándolos con una paleta o un batidor manual hasta que tenga una consistencia de crema espesa. Agregar la margarina al espesar, revolver bien hasta diluir la margarina, retirar del fuego y dejar enfriar tapando la crema con un plástico para que no se le forme una capa dura.",Torta troncha toro,1b8ed9a7-07d9-4ddc-95b6-5a92f70936a4
https://elgourmet.com/recetas/flan-de-cacao/,Caramelo  Eritritol 200   Gramos  Decoración  Chocolate 80% sin azúcar c/n   Flores comestibles  c/n   Frutos rojos  c/n  Flan  Cacao 1/4 Taza   Leche evaporada de almendras  50  Gramos   Vainilla  1 cdta   Crema para batir sin azúcar  200  Gramos   Huevos  4 Unidades   Eritritol  100  Gramos ,"  Caramelo   Colocar en una olla el eritritol y a fuego alto formar el caramelo.   Verter en el molde del flan y reservar.     Flan   Verter en la licuadora los huevos,   seguidos de la crema,   la leche evaporada de almendras,   la vainilla,   el cacao y el ertitritol.   Mezclar todo muy bien.   Verter la mezcla en el molde del flan.   Cocinar a baño maria a 180°C por 1 hora.   Retirar del fuego y dejar enfriar.   Refrigerar 2 horas,   desmoldar y adornar con chocolate y frutos rojos.  ",Flan de Cacao,6da3701f-a499-4069-898e-7f8d2772126d
https://elgourmet.com/recetas/fideos-frios-de-batata/, Pepino Japonés 3 Unidades   Maní Tostado  20 g   Cebolla morada  1/2  unidad   Fideos batata  200 g  Salsa 1  Ajo 2 Dientes   Chiles (rodajitas)  2 Unidades   Aceite de maíz  1/2 Taza   Aceite de sésamo  1 Cucharada   Planta de Verdeo  1/2  unidad  Salsa 2  Salsa de soja clara 2 Cucharadas   Salsa De Hongos  1 Cucharada   Vinagre Negro Chino  2 Cucharadas   Azúcar  2 Cucharadas   Agua  3 Cucharadas ,"  Salsa     Parte 1   Cortar chile y cebolla de verdeo en rodajitas,   picar el ajo y reservar.   Poner todo en un bowl resistente a la temperatura.   Añadir ½ taza de aceite caliente a 150 grados y mezclar.   Reservar.     Parte 2   Calentar en una ollita sin que rompa el hervor salsa de soja,   salsa de hongos,   vinagre negro chino,   azúcar,   agua y reservar.   Mezclar ambas partes de la salsa y reservar.     Fideos   Hervir fideos de batata por 10 minutos,   cortar la cocción con agua fría,   colar y reservar.   Cortar unos pocos aros de cebolla morada bien finos y dejar remojando en agua fría 20 minutos,   después colar bien.   Golpear los pepinos enteros con el canto de un cuchillo pesado para romperlos un poco sin despedazarlos.   Cortar en tramos de 3 cm.   Poner un poco de sal y azúcar y dejar reposar unos 20 minutos.   Después eliminar el exceso de agua.    Colocar los fideos por debajo en el plato y por encima algunos aros de cebolla morada.   Por arriba de los aros de cebolla servir el pepino japonés.   Mezclar bien la salsa y servir con una cuchara intentando cubrir todo el pepino.   Terminar con un poco de maní troceado y unas cuantas hojas de cilantro.  ",Fideos Frios De Batata,4fcfb156-31f4-4992-9d08-3cc26073d223
https://elgourmet.com/recetas/sopa-de-pollo-con-hongos/, Cebolla de verdeo 2 Unidades   Aceite de sésamo  Cantidad Necesaria   Azúcar  1 cuchadita   Ginebra  1 Chorrito   Hongos shiitake hidratados  5 Unidades   Pechuga de pollo  1  unidad   Pimienta  Cantidad Necesaria   Sal  2 Cucharadas   Jengibre  10 g ,"Cortar el pollo en tiritas,   los hongos shitake y el jengibre en juliana y la cebolla de verdeo en rodajitas finas.   Hervir en una olla  el caldo junto al jengibre y los hongos shiitake.   Cuando rompe hervor bajar el fuego y dejar 10 minutos.   Condimentar con sal,   azúcar y pimienta.   Agregar el pollo en tiritas y un chorrito de ginebra.   Cocinar hasta que el pollo pase de rosa a blanco.   Servir y terminar con pimienta negra,   verdeo y gotitas de aceite de sésamo.  ",Sopa De Pollo Con Hongos,8d2da84c-6843-429d-8856-aabbf2dd7f9a
https://elgourmet.com/recetas/pesca-al-vapor/, Filet de Mero con piel 400 g   Cebolla de verdeo  1 Unidad   Jengibre  10 g  Salsa  Agua 2 cuacharada   Azúcar  1/2 Cucharada   Salsa de soja  1 Cucharada   Salsa de soja oscura  1/2 Cucharada ,"  Salsa Calentar en una olla pequeña salsa de soja,   salsa de soja oscura,   azúcar,   agua hasta que comience a burbujear,   reservar.   Pescado Cortar jengibre y cebolla de verdeo en juliana fina. Realizar tajos en la piel de cada filet y masajear con el jengibre en juliana. Colocar en un plato con jengibre tanto abajo como arriba del filet,   con la piel hacia arriba. Cocinar al vapor por 7 minutos. Mientras se está cocinando calentar aceite de maíz en una olla pequeña y reservar. Retirar del vapor el filet,   quitar el exceso de agua y agregar abundante cebolla de verdeo sobre cada filet.",Pescado Al Vapor,87aff1fc-22bc-44fe-92a7-6f0d81c392f7
https://elgourmet.com/recetas/langostinos-al-vapor/, Cebolla de verdeo 2 Unidades   Cola de langostinos crudos con càscara  10 Unidades   Confit de ajo  Cantidad Necesaria   Fideos de poroto de soja  100 g   Aceite de maíz  100 cc   Aceite de maíz  100 cc  Salsa  Azúcar 1 Cucharada   Agua  7 Cucharada   Salsa de soja  4 Cucharada   Salsa de ostras  1 Cucharada   Salsa de soja oscura  2 Cucharadas ,"Abrir los langostinos tipo mariposa sin quitarles la càscara.   Acomodarlos de manera concéntrica en un plato circular grande.   Hidratar en un bowl los fideos de porotos de soja con agua hirviendo por 20 minutos.   Agregar sobre cada langostino mariposa ajo confit (ajo picado cocinado a baja temperatura en aceite sin que se dore) y por encima los fideos hidratados y colados.   Añadir un poco mas de ajo confit pro arriba y llevar a cocinar al vapor con el plato (al wok o en vaporera) por 5 minutos.   Mientras se cocinan en una olla pequeña calentar el aceite de maíz.   Retirar los langostinos y acomodarlos en un plato.   Agregar por encima de cada uno cebolla de verdeo al bies (parte verde) y bañar cada langostinos con una cucharada de aceite caliente.   Terminar con la salsa a gusto por encima.     Salsa   Calentar salsa de soja,   salsa de soja oscura,   salsa de ostras,   azúcar y agua hasta fundir el azùcar y apenas comienza a aparecer las burbujas retirar del fuego y reservar.   ",Langostinos Al Vapor,fd863865-898c-4040-8859-9b90c19a7d0a
https://elgourmet.com/recetas/arroz-en-cazuela-de-barro/, Huevo 1 Unidad   Aceite de sésamo  Cantidad Necesaria   Cebolla de verdeo  Cantidad Necesaria   Chorizo taiwanés  3 Unidades   Panceta ahumada  200 g   Arroz largo fino  2 Tazas  Albóndigas De Camarones  Camarones crudos y pelados 500 g   Pimienta  Cantidad Necesaria   Sal  2 cucharaditas   Clara de huevo  1  unidad   Azúcar  3 Cucharadas   Aceite de sésamo  Cantidad Necesaria  Salsa  Azúcar 1 Cucharadita   Agua  7 Cucharada   Salsa de ostras  1 cuacharada   Salsa de soja oscura  2 Cucharadas   Salsa de soja  4 Cucharadas ,"Abrir las camarones en mitades transversalmente y aplastar con la hoja de la cuchilla (grande).   Picar muy bien hasta obtener una pasta.   Condimentar en un bowl con sal,   azúcar,   pimienta y mezclar.   Agregar clara de huevo y mezclar hasta tener una pasta consistente.   Condimentar con aceite de sésamo.   Con las manos húmedas trabajar pequeñas porciones hasta formar albóndigas (tamaño nuez pequeña) y reservar en frío.   Cocinar en agua hirviendo los chorizos hasta que se hinchen ( 3 minutos aprox) y reservar.   Cortar los chorizos blanqueados al bies y la panceta en finas làminas de 3 x 2.   Lavar el arroz bajo el agua y colocar en la cazuela de barro con tapa elegida.   Agregar el agua ( 2 tazas de arroz x 2 tazas de agua),   tapar y dejar reposar 30 minutos.   Llevar la cazuela a fuego hasta que rompa hervor y a fuego minino cocinar sobre un difusor hasta reducir el líquido hasta el nivel de arroz.   Acomodar sobre el arroz y por los bordes las laminas de chorizo.   Añadir las láminas alrededor de los chorizos y acomodar en el centro las bolitas de camarones.   Tapar y cocinar por 15 minutos a fuego mínimo sobre un difusor de calor (3 minutos en el centro y 3 minutos en cada esquina del difusor).   Volver al centro del fuego,   destapar,   agregar un huevo en el centro ,   tapar y cocinar con el fuego apagado por 3 minutos.   Condimentar con la salsa (cantidad a gusto) y terminar con cebolla de verdeo (verde) al bies por encima.     Salsa   Mezclar en un olla pequeña salsa de soja,   salsa de soja oscura,   salsa de ostras,   azúcar,   agua y llevar a fuego suave.   Apenas comience a burbujear retirar del fuego y reservar.  ",Arroz En Cazuela De Barro,ca6532e5-97c4-48ac-9abc-81183167e403
https://elgourmet.com/recetas/pollo-al-vapor/, Aceite de sésamo Cantidad Necesaria   Azúcar  1 Cucharada   Fécula de maíz  1  cucharadas medianas   Hongos Shiiake Secos  4 Unidades   Hongos oreja de madera hidratados  2 Unidades   Jengibre  20 Unidades   Pata Muslo De Pollo Deshuesado  2 Unidades   Sal  2 Cucharadas   Salsa de soja  1 Cucharada ,"Hidratar los hongos shiitake 2 horas previas a preparar el pollo o hasta que estén bien blandos.   Sacar el cabito y cortar en julianas de medio centímetro.   Cortar los hongos oreja de madera en tiras gruesas y el jengibre en juliana.   Cortar pata muslo en dados de 1,  5 cm.   Marinar en un bowl el pollo con las julianas de jengibre y hongos shiitake con azúcar,   sal,   una pizca de pimienta,   un chorrito de ginebra,   fécula de maíz,   un chorrito de agua y mezclar bien.   Agregar los hongos y un chorrito de aceite que cubra bien toda la preparación Acomodar en una fuente de vidrio rectangular que pueda ir al vapor y añadir fècula diluìa con agua y azúcar bañando bien todas las piezas de pollo.   Llevar en la misma fuente al vapor ( en wok o vaporera) y dejar cocinar por 20 minutos.   Terminar con cebolla de verdeo finito y unas gotitas de aceite de sésamo.  ",Pollo Al Vapor,fefc5eb2-b784-43c6-a196-9d49eb0c6bcf
https://elgourmet.com/recetas/ensalada-de-algas/, Ajo picado 25 g   Jengibre picado  25 g   Cebolla de verdeo picada  25 g   Algas Kombu  100 g  Salsa  Sal 15 g   Salsa de soja  75 g   Vinagre de alcohol  125 g   Aceite de sésamo  5 g   Azúcar  25 g ,"Hidratar algas kombu en agua por 1 hora,   enjuagar.   Cortar en varias láminas y poner una encima de la otra.   Luego enrollarlas y cortarlas en cintas de 2mm de espesor.   Incorporar en una olla de agua hirviendo algas y cocinar 1 minuto desde que rompa el hervor.   Retirar y cortar cocción con agua fría.   Colar y escurrir bien.   Verter en una fuente  el alga,   jengibre,   ajo y verdeo y condimentar con vinagre,   azúcar,   sal,   salsa de soja.   Dejar reposar 20 minutos y terminar con un chorrito de aceite de sésamo y un poco de verdeo encima.  ",Ensalada De Algas,fa3ffd13-a648-445d-9211-80b77af59960
