url,ingrediants,steps,title,uuid
https://elgourmet.com/recetas/matambre-relleno-tradicional/, Anchoas 10  Filetes   Acelga  1 Atado   Aji molido  2 Cucharada   Ajo  2 Dientes   Aceitunas negras descarozadas  100  g   Huevos  5  unidad   Matambre de res  1   unidad   Perejil picado  20 g   Zanahorias  2 Unidades   Queso Rallado Fino  100 g   Huevos duros  5 Unidades  Ensalada  Zanahorias Hervidas En Cubos 2 Unidades   Rabano Picante  3 cucharaditas.   Rabanitos Hervidos  1  Atado   Remolachas Hervidas En Cubos  200 g   Papas Hervidas En Cubos  2  unidad   Pepinillos  100 g   Mayonesa  c/n   Chauchas Rollizas Hervidas  100 g ,"Estirar y emprolijar el matambre dándole forma rectangular.   Mezclar en un bowl  con tenedor huevos,   queso rallado,   perejil y ajo picado,   ají molido y repartir por toda la superficie del matambre.   Realizar sobre el borde inferior  una hilera de huevos duros en mitades y hacer varias líneas de zanahorias en bastones hervidas.   Cubrir gran parte de los ingredientes con las hojas sin penca de la acelga blanqueada.   Hacer en el centro una hilera con aceitunas negras descarozada y acomodar filetes de anchoas en 2 líneas sobre el matambre.   Comenzar de la parte inferior  a arrollar apretando pero cuidando que no se salga el relleno.   Cocer con aguja de colchonero e hilo grueso desde uno de los bordes hasta la otra punta.   Pasar un hilo de atar carnes debajo del matambre arrollado,   de punta a punta.   Hacer con una de las puntas un lazo y pasar el matambre por el lazo ajustándolo.   Repetir la operación hasta atarlo todo.   Cocinar en caldo a hervor suave por 2 horas.   Dejar enfriar en caldo de cocción.   Llevar a frio varias horas algo de peso encima.   Retirar el hilo de cocer y el del bridado.   Cortar en rodajas y servir con la ensalada.     Para la ensalada   Mezclar en un bowl papas,   zanahorias,   chauchas en trozos de 2 cm,   remolachas,   rabanitos en cuartos hervidos,   pepinillos en rojas,   mayonesa y rábano picante",Matambre relleno Tradicional,34c21541-c1e1-4c5b-8f84-091b19113cd6
https://elgourmet.com/recetas/galantina-de-pollo/, Caldo de ave c/n c/n   Ciruelas Pasas Presidente  8  Unidades   Hígados de pollo  300 g   Crema de leche  200 c.c.   Huevos  2  unidad   Oporto  50 c.c.   Pimienta  a gusto   Pollo Deshuesado Con Piel  1 Unidad   Pan de molde  3 Unidad   Sal     Puerros  4 Unidades   Zanahoria  1  unidad  Aderezo  Sal y pimienta a gusto   Aceite de oliva  75 cc   Vinagre de vino  25 c.c.   Miel  1 Cucharadas   Mostaza Dijon  1 Cucharada.  Ensalada  Naranjas 1  unidad   Endivias  3 Unidad   Radiccio  ½   unidad   Pistacho  25 g ,"Retirar las alitas y retirar parte de la carne de las pechugas para tener un cantidad de carne similar en toda la superficie.   Procesar la carne de las pechugas,   pan de molde sin bordes en cubos,  crema,   huevos,   sal y pimienta hasta tener una preparación homogénea.   Llevar a un bowl y mezclar con oporto,   reservar Estirar un repasador blanco sobre la tabla y sobre el acomodar el pollo deshuesado con piel,   dejando la piel para el lado del repasador.   Condimentar la carne con sal,   pimienta y esparcir prolijamente el relleno.   Acomodar sobre la preparación puerros hervidos enteros y en mitades generando 3 hileras de puerros en toda la superficie.   Añadir ciruelas pasa Presidente en mitades ,   zanahoria blanqueada en cubos y por último Añadir hìgaditos de pollo repartiendo por la superficie.   Enrollar usando el repasador como exterior y con hilo atar las puntas formando un caramelo apretado para contener bien el relleno.   Ajustar con hilo apretado cada 5 cm y cocinar en caldo caliente a 90ª c por 60 minutos.   Dejar enfriar en el caldo de cocciòn Retirar el paño,   los hilos y servir en rodajas acompañada de la ensalada.     Para la ensalada   Mezclar n un bowl endivias deshojadas,   hojas de radiccio cortado con las manos,   gajos de naranja a vivo,   pistachos y condimentar con el aderezo.     Aderezo   Mezclar en un bowl con batidor de alambre mostaza dijon,   vinagre,   sal,   pimienta,   miel.   Agregar vez integrado  aceite de oliva en forma de hilo sin dejar de batir para emulsionar.  ",Galantina De Pollo,ea7e9a55-0edc-4841-8ed2-ec04ecbeb8b4
https://elgourmet.com/recetas/curry-veganos-de-lentejas/,Curry  Caldo De Vegetales ½ Litro   Cebolla  1 Cucharada   Chile seco  1  unidad   Comino En Grano  2 Cucharadas   Coriandro  2 Cucharada   Cúrcuma  2 Cucharadas   Fenogreco  1 Cucharada   Aceite de coco  a gusto   Ajo  2 Dientes   Apio  3 Varas   Morrón rojo  1/2  unidad   Pimienta negra  1 Cucharada   Lentejas  1 ½  Taza   Puerro  1  unidad   Sal  c/n   Semillas De Mostazo  2 Cucharadas   Jengibre En Polvo  2 Cucharada   Zanahoria  1  unidad  Raita  Jugo De Lima 1  unidad   Mango  1  unidad   Yogurt De Coco  200 c.c.   Azúcar  1  unidad   Granada  ½   Hojas De Menta   ½  Puñado ,"Calentar en una sartén fenogreco,   pimienta negra,   semillas de mostaza,   coriandro y comino en grano hasta que comiencen a soltar su aroma.   Moler en mortero junto la curcuma en polvo y el jengibre molido.   Reservar.   Rehogar en una olla con aceite de coco cebolla,   apio y zanahoria (todo picado) hasta ablandar.   Agregar morrón rojo picado y puerro y seguir cocinando hasta tiernizar.   Condimentar agregando el curry,   mezclar y calentar.   Añadir 1 chile seco picado sin semillas y las lentejas turcos sin remojo.   Cubrir con caldo y cocinar hasta que las lentejas estén cocidas sin que se desarmen.   Para la raitaProcesar con mixer yogur de coco,   azúcar,   mango en cubos,   hojas de menta y jugo de lima hasta homogeneizar.   Servir en bowl con semillas de granada y hojas de menta por encima,   reservar en frío.  ",Curry Veganos De Lentejas,b243dd5a-7d1d-4759-bd2a-d16629787f3c
https://elgourmet.com/recetas/cerdo-asado-5-especias/, Fécula de maíz ¼ Taza   Aceite de maíz  c/n   Anís estrellado  2  unidad   Arroz para acompañar     Hongos shiitake  100  g   Canela en rama  1  unidad   Clavo de olor  5  unidad   Ajo  2 Dientes   Jengibre  20 g   Pak choi  a gusto   Pechito De Cerdo  1 kg   Pimienta sichuan  1  Cucharada.   Sal  c/n   Semillas De Hinojo   1 Cucharada   Zanahoria  1  unidad  Salsa Para El Cerdo  Salsa de soja ½   Agua  1/2 Taza   Azúcar  2 Cucharadas ,"Calentar en sartén canela en rama rota,   clavo de olor,   anis estrellado,   semillas de hinojo y pimienta de Sichuan hasta que comiencen a solar sus aromas.   Procesar en molinillo hasta obtener un polvo Cortar el pechito de cerdo en trozos del tamaño de 1 dedo.   Mezclar con las manos en un bowl con las especias molidas.   Agregar fécula de maíz y seguir mezclando con las manos hasta unificar.   Cubrir la base del wok con aceite y calentar bien.   Sellar los trozos de cerdo condimentado hasta dorar por todos lados.   Agregar finas láminas de jengibre y de ajo y saltear 3 minutos.   Añadir la salsa y cocinar hasta tiernizar la carne.   Sumar zanahorias el bies y cocinar.   Incorporar hongos shitake frescos en tiras de 1 cm,   hojas de pack choy y terminar de cocinar.   Servir en fuente con arroz blanco.  ",Cerdo Asado 5 Especias,fb856da2-ee94-47b8-9e1a-393b90e4553e
https://elgourmet.com/recetas/tarta-de-salmon-y-esparragos/,Masa Brisee  Manteca 150 g   Agua  60 c.c.   Harina  500 g   Huevo  1  unidad   Sal  c/n  Relleno  Sal a gusto   Salmón rosado  700 g   Espárragos  400 g   Huevos  4  unidad   Mascarpone  400 g   Pimienta blanca  a gusto   Cebollas moradas  2  unidad   Eneldo  c/n   Manteca  100  g ,"Procesar harina y manteca bien fría en cubos hasta arenar,   Agregar huevo,   sal y agua,   seguir procesando hasta integrar.   Bajar a mesada enharinada y con las manos unir sin amasar Dejar en bowl tapada en frìo 3 horas.   Estirar con palote de manera rectangular y fonzar un molde de vidrio rectangular.   Cocinar 15 minutos a 180ª C con peso encima y dejar enfriar   Relleno   Rehogar en sartén con manteca cebolla morada en pluma hasta tiernizar.   Mezclar en un bowl  mascarpone,   huevos,   sal,   pimienta blanca y eneldo.   Agregar la cebolla Salteada y reservar.   Colocar en la base de la masa estirada en el molde cubos grandes de salmòn fresco.   Agregar el relleno y cubrir toda la superficie y por encima acomodar los espárragos.   Llevar a horno por 25 minutos aprox.   Dejar enfriar y servir en porciones",Tarta De Salmon Y Esparragos,ec6301fc-0747-4e47-8e77-d05b92d27586
https://elgourmet.com/recetas/potted-meat/, Manteca 200 g   Clavo de olor  c/n   Dientes de ajo  4 Dientes   Vino blanco  1/2 Taza   Laurel  a gusto   Nuez moscada  c/n   Paleta  3 kg   Pimienta negra en granos  c/n   Sal  c/n   Tomillo  c/n  Picalilli  Zanahorias 2  unidad   Zucchini  1  unidad   Sal gruesa  c/n   Rabanito  1 Atado   Brócoli  ½  unidad   Chauchas  100 g   Coliflor  ½  unidad   Agua  1 Litro  Salsa  Aji molido 2 Cucharadas   Azúcar  120 g   Comino  1 Cucharadas   Coriandro  2 Cucharadas   Cúrcuma  2 Cucharada   Dientes de ajo  6 Cabezas   Mostaza de Dijon  1 Cucharada   Agua  500 cc   Vinagre blanco  500 cc   Jengibre En Polvo  1 Cucharada   Semillas De Mostaza  3 Cucharadas ,"  Para el potted meat Cortar la carne en trozos grandes y en sartén de hierro caliente con aceite sellar por sus lados hasta dorar,   condimentar con sal. Agregar ajo,   laurel,   tomillo,   granos de pimienta,   clavo de olor,   nuez moscada y mezclar. Añadir vino blanco.  ,   manteca,   revolver,   tapar y llevar a horno moderado 170 grados por 2 horas. Llevar en caliente la carne a un bowl y con ayuda de 2 tenedores deshilacharla. Mezclar con el jugo de cocción y llevar a potes pequeños presionando la preparación hasta llenar. Completar con manteca fundida y llevar a frío. Servir con panes,   picalilli y salsa   Para el picalilli Mezclar en un bowl brocoli y coliflor en flores pequeñas,   zanahoria en rodajas,   chauchas en trozos de 2 cm,   rabanitos en cuartos,   zuchini en media rodajas con el 10% del peso del total de los vegetales en sal gruesa.   Para la salsa Calentar en una olla agua,   vinagre de alcohol,   azúcar,   dientes de ajo,   curcuma,   jengibre en polvo,   ajì molido,   semillas de mostaza,   coriandro molido ,   comino,   mostaza de dijon y cuando hierve agregar la fècula de maíz disuelta en agua y los vegetales escurridos y lavados. Cocinar hasta que estén cocidos y crocantes. Dejar enfriar en guardar en frascos en frìo.",Potted Meat,2ba4b763-51f7-47df-bf4e-e31eccc3906d
https://elgourmet.com/recetas/cima-rellena/,Cima 1 u  Apio 1  unidad   Cebollas  2  unidad   Pimienta  a gusto   Puerro  2  unidad   Sal Entre Fina  a gusto   Zanahoria  2  unidad  Relleno  Queso rallado 100 g   Sal  a gusto   Pimienta  a gusto   Diente De Ajo  1 Diente   Huevos  3  unidad   Huevos duros  4  unidad   Aceitunas negras  200 g   Morrón rojo  1  unidad   Pan Lacteado De Molde  2 Rodajas   Cebolla  1  unidad   Aceite de oliva  a gusto   Acelga Cocida y Escurrida  2 atados ,"Rehogar en sartén con aceite de oliva cebolla,   morrón rojo picado ,   ajo picado,   sal y pimienta.   Ablandar y reservar  Mezclar en un bowl acelga cocida,   escurrida y picada,   3 huevos,   queso rallado y unir.   Agregar cubos de pan de molde sin corteza,   sal,   pimienta y el sofrito reservado.   Desgrasar un poco la carne y abrir Colocar en una mitad el relleno bien esparcido.   Agregar huevos duros en fila en la mitad del relleno y una hilera de aceitunas negras también.   Doblar,   cerrar,   cubrir el relleno y con aguja de colchonero cocer para que en la cocciòn no se escape el relleno.   Colocar en placa de horno con cebollas,   zanahorias,   puerro,   apio,   cortados rústicamente en la base.   Condimentar con sal entrefina y pimienta y cocinar en horno a 180ª c por 90 minutos.   Servir con los vegetales y una ensalada de lechuga,   cebolla y tomate.  ",Cima rellena,f0d8cc09-4aae-469e-a4c1-af3918921cca
https://elgourmet.com/recetas/postre-vigilante-clasico/, Dulce de batata 500 g  Masa  Azúcar 100 g   Leche  40 cc   Manteca  100  g   Esencia de vainilla  1  cucharadas medianas   Huevo  1  unidad   Harina leudante  250 g   Ralladura De Limón  1/2  limones   Sal  c/n  Relleno  Ralladura De Limón c/n   Jugo De Limón  1/2   Fécula de maíz  20 g   Huevo  1 Unidad   Queso blanco  700 g   Azúcar  150 g   Yemas  2 Unidades   Esencia de vainilla  1 cuchara ,"Trabajar en batidora con lira azúcar,   ralladura de limón,   sal,   esencia de vainilla y manteca pomada hasta integrar.   Añadir leche y seguir mezclando hasta unir.   Incorporar huevo y una vez unido agregar harina tamizada.   Continuar hasta integrar,   mezclar a máxima velocidad 15 segundos y retirar.   Dar forma con un poco de harina y llevar a heladera por 6 horas mínimo tapada.   Cortar el dulce de batata en cubos y llevar a baño maría en un bowl mezclando hasta fundir,   reservar.     Relleno   Mezclar en un bowl  queso blanco tipo americano,   azúcar,   huevo,   yemas,   ralladura de limón,   fécula disuelta en el jugo de limón y esencia de vainilla hasta integrar.     Armado   Estirar la masa y fonzar el molde de tarta.   Agregar el dulce de batata fundido y por encima el relleno de queso.   Llevar a horno a 180ª Gramos  por 40 minutos.   Dejar enfriar antes de servir.  ",Postre Vigilante Clásico,9a975a1e-a341-4c1c-8738-4337f9695dfd
https://elgourmet.com/recetas/panna-cotta-de-caffe/, Café Soluble 3 Cucharada   Chocolate  c/n   Crema Acida  2 Tazas   Crema para batir  ½ Litro   Azúcar  1 Taza   Leche entera  2  Tazas   Tomillo  2 Cucharadas   Grenetina en polvo  10 g ,"Poner a calentar en una cacerola,   a fuego bajo,   la leche junto con la crema ácida,   el azúcar,   el tomillo y el café,   sin que hierva, Retirar del fuego y dejar enfriar.   exactamente a los  80 º Grados. Mientras esté enfriándose la mezcla anterior,   hidratar la grenetina en un recipiente con agua durante 5 minutos y montar la crema para batir en un tazón. Cuando todavía la mezcla de la leche esté tibia,   integrar poco a poco,   con movimientos envolventes,   la grenetina y la crema montada. Vaciar en moldes individuales y dejar enfriar en el refrigerador durante 2 horas. Desmoldar para servir, Espolvorear con CHOCOLATE RALLADO",Panna Cotta De Caffé,838e0905-7ea9-4790-9174-41b095967082
https://elgourmet.com/recetas/chiles-cuaresmenos-rellenos-y-en-salsa-de-queso/, Calabacitas Cortadas En Cubitos ½  kg   Cebolla picada finamente  ½  unidad   Crema   ¼ Litros   Elotes Desgranados  3   unidad   Epazote  1 Ramita   Flores De Calabaza Picadas  12   unidad   Mantequilla  90  g   Queso Manchego En Rebanadas  300 g   Sal  a gusto ,"Freír en la mantequilla la cebolla  ;   luego agregar los granos de elote y después los cubitos de las calabacitas.   Ya que estén fritos estos ingredientes,   incorporar las flores de calabaza,   la crema,   la ramita de epazote y la sal.   Apagar.   retirar la ramita de epazote y reservar Para la salsa de queso poner en una sartén mantequilla y harina y mover hasta que desaparezcan los grumos.   Agregar un chorrito de leche y una vez incorporado todo,   incorporamos el queso para que se derrita.   Rellenar los chiles y bañarlos con la salsa de queso una vez fría la preparación anterior .  ",Chiles Cuaresmeños Rellenos y En Salsa De Queso,74e779da-dcaa-4b00-bd7d-81e13a08bc39
https://elgourmet.com/recetas/pastel-con-chocolate-sin-harina/, Canela en polvo 1 Cucharada   Chocolate Semiamargo Rallado  1 ½  Tazas   Claras de Huevos  6   unidad   Azúcar mascabado  90 g   Extracto de vainilla  1 Cucharada   Mantequilla sin sal  90 g   Pimienta negra  1 Cucharada.   Yema De Huevo Batida  1  unidad ,"Precalentar el horno a 180 Grados.   Untar con mantequilla un molde y enharinarlo. En baño María,   derretir la mantequilla junto con el chocolate,   moviendo constantemente. Una vez mezclados,   incorporar la yema de huevo batida junto con la canela,   la pimienta y el extracto de vainilla. En una batidora,   montar las claras,   agregar poco a poco el azúcar mascabado,   e incorporar de la misma manera la mezcla del chocolate hasta que quede una preparación homogénea.   Verter en el molde y hornear durante 40 minutos. Servir pedazos pequeños.",Pastel Con Chocolate Sin Harina,36d4ff08-1caa-40b1-8dbf-1df9f7530ecf
https://elgourmet.com/recetas/mole-de-datil-con-chocolate/, Aceite de oliva ¼ Tazas   Agua  c/n   Almendras  2 Tazas   Canela  ½ cuacharadita   Cebolla mediana  ½   unidad   Chiles Guajillo Desvenados  200  g     200  g   Chiles Anchos Desvenados  75  g   Chocolate Semiamargo Troceado  5  unidad   Ciruelas Pasas Sin Huesos  2   unidad   Clavo de olor  1   cucharadas medianas   Cucharada Tomillo Fresco  5   Dátiles Sin Huesos  2 Dientes   Diente De Ajo  4  Unidad   Duraznos En Cubos  4   unidad   Guayabas  1   unidad   Manzana roja  1   unidad   Pera En Cubos  1/2 Cucharadas   Pimienta  3 Unidades   Plátanos dominicos  4   unidad   Rebanadas De Piña  1  Unidad   Tortilla  ,"Moler los chiles con un poco del agua caliente donde se remojaron y colar.   Poner aceite (o manteca) en una sartén y freír la mezcla de chiles,   moviendo constantemente para que la poca agua con que se molieron se evapore  ;   apagar el fuego y reservar.   Aparte,   freír en aceite (o manteca) las almendras hasta que tomen color  ;   retirar y reservar.   En esta misma sartén dorar sucesivamente,   retirar y reservar la canela,   los clavos,   la pimienta,   la cebolla,   los dientes de ajo,   la tortilla,   las ciruelas pasas,   los dátiles,   el tomillo,   la manzana,   los duraznos,   la pera,   la piña,   los plátanos dominicos y las guayabas.   Ya fritos estos ingredientes molerlos con algo de agua,   colar y volver a moler con poca agua lo que va quedando en el colador.   Calentar de nuevo aceite (o manteca) y freír,   a fuego muy bajo moviendo constantemente hasta que se reduzca.   Agregar la mezcla de chiles,   las almendras y los trozos de chocolate semiamargo,   así como sal,   y continuar revolviendo.   Dejar cocinar hasta que el chocolate se disuelva muy bien.   Debe quedar una pasta bastante espesa.  ",Mole De Dátil Con Chocolate,e9b6503f-e935-45eb-8cce-cbb64011d547
https://elgourmet.com/recetas/horneado-de-coliflor/, Coliflor 1  unidad   Aceite de oliva  c/n   Sal y pimienta  c/n  Salsa  Yogur Natural 200  Gramos   Cilantro  1 Puñado   Pimienta     Ralladura De Limón  a gusto   Ralladura y Jugo De Limón  a gusto ,"Acomodar en una olla profunda con abundante agua coliflor entera con la base para arriba y cocinar 10 minutos.   Previamente hacer una incisión profunda en forma de cruz en la base.   Retirar la coliflor del agua y descartar el líquido.   Acomodar en la misma olla a modo de pirotìn papel manteca y volver la coliflor a la olla pero esta vez con la base para abajo.   Agregar bastante aceite de oliva por encima,   sal y llevar a horno a 200 ª C hasta dorar bien (30 minutos) Servir el coliflor dorado y acompañarlo con la salsa.     Salsa   En un bowl mezclar yogur natural,   cilantro picado,   ralladura de lima,   ralladura y jugo de limòn y pimienta.  ",Horneado De Coliflor,f3736796-7d8d-4448-8200-ac4aea48838c
https://elgourmet.com/recetas/pollo-con-curry/, Agua caliente c/n   Arvejas  1/2  unidad   Berenjena  1  unidad   Cebolla morada  1  unidad   Cilantro fresco  a gusto   Curry  1 Unidades   Jengibre  1 Cucharadita   Maní Tostado  c/n   Leche de coco  150  cc   Pollo  2 Presa   Ralladura De Lima   a gusto   Sal y pimienta  a gusto   Tomate  2 Unidades   Zanahoria  2 Unidades ,"Saltear en una olla con aceite de girasol zanahorias en rodajas hasta que tomen un poco de color.   Agregar cebolla morada picada y cocinar hasta ablandar.   Añadir las berenjenas en cubos grandes y seguir cocinando 5 minutos.   Incorporar tomates en cubos (con piel y semillas),   curry,   jengibre en polvo,   mezclar y seguir cocinando hasta que comiencen las especias a largar su aroma.   Agregar el pollo en cubos grandes,   mezclar bien y cubrir con agua caliente.   Tapar y dejar cocinar.   A mitad de cocción añadir arvejas frescas y dejar cocinar 10 minutos.   Incorporar leche de coco y cocinar 5 minutos.   Servir en plato hondo y terminar con hojas de cilantro,   ralladura de lima y manì tostado por encima.  ",Pollo Con Curry,962022aa-60ef-4c49-844c-4cbdb3db0c19
https://elgourmet.com/recetas/sopa-con-cebolla/, Manteca 70 g   Caldo  c/n   Cebollas grandes  3 Unidades   Sal  a gusto   Whisky Estilo Bourbon  1 Chorro  Acompañar  Pan Baguette ½  g   Queso Gouda  c/n   Queso Gruyere   c/n ,"Rehogar en una sartén de bordes alto con tapa a fuego medio con abundante manteca y sal cebollas en juliana hasta que se ablanden,   doren y caramelicen.   Agregar bourbon hasta reducir y evaporar el alcohol.   Añadir abundante caldo,   tomillo y dejar cocinar hirviendo hasta reducir un poco.   Incorporar por encima rodajas de baguette cubriendo la superficie y sobre ella láminas de quedo gouda y gruyere.   Llevar a horno fuerte hasta gratinar los queso.   Presentar en el mismo recipiente.  ",Sopa Con Cebolla,207f62df-9a12-477a-81f3-2e68b7e7a8e0
https://elgourmet.com/recetas/cuadrados-helados-de-mascarpone-y-dulce-de-leche/, Chocolate cobertura 100  grs   Dulce de leche  400 g   Paquete De Galletitas De Chocolate  1   Queso mascarpone  200 g   Taza De Café  1 Taza ,"Cubrir con un papel manteca un molde rectangular y rellenar con las galletitas de chocolate.   Pintar con pincel las galletitas con café hasta que estén húmedas.   Mezclar en un recipiente vas a el dulce de leche con queso mascarpone.   Rellenar el molde y llevar a frio durante 3 horas.   Cortar una vez frio vas a en cuadrados y bañar con chocolate derretido.   Agregar los elementos secos de a poco y unir .   finalmente agregar la leche .   Forrar un aro de 20cm con papel aluminio y papel manteca en la base y rellenar .   Llevar  al horno durante 18 a 20 minutos a 160 grados .   Rellenar como mas te guste una vez que enfrié,   Dulce de leche ,   Chocolate,   Crema batida.  ",Cuadrados Helados De Mascarpone y Dulce De Leche,2e02f81b-5b6e-433e-9172-fa2bbd30b6b4
https://elgourmet.com/recetas/budin-de-ricotta-con-corazon-de-dulce-de-leche/, Huevos 3 Unidades   Dulce De Leche Tregar  100  Gramos   Manteca pomada  170 g   Polvo Para Hornear  2  Cucharadas   Ralladura De Limón  a gusto   Ricotta Tregar  200  grs   Harina 0000  250 g   Azúcar  300  grs ,"Tamizar la harina,   mezcla los secos y apartar.   Integrar la manteca a temperatura ambiente con el azúcar hasta formar una crema.   Agregar ralladura de limón,   los huevos de a uno y finalmente la ricota,   la vainilla y la ralladura.   Agregar por ultimo a la mezcla del batido hasta unir.   Llenar hasta la mitad una budinera enmantecada y enharinada.   Rellenar con unas chucharas de dulce de leche y completar con el resto de la mezcla de ricota .   Llevar al horno por 25 minutos a 160 grados.  ",Budin De Ricotta Con Corazón De Dulce De Leche,90540f9d-9724-4d46-8d2b-25c84b23d2e0
https://elgourmet.com/recetas/torta-de-chocolate-y-yogurt-natural/, Aceite 45  grs.   Azúcar  75 g   Cacao amargo  25 g   Huevos  1  unidad   Polvo de hornear  1 Cucharada   Harina 0000  115  g   Yogurt Natural Tregar  140  grs ,"Tamizar la harina con el polvo de hornear y el cacao.   Incorporar el azúcar.   En otro recipiente  mezclar los huevos con el yogurt y el aceite.    Agregar los elementos  secos de a poco y unir.   Agregar la leche.   Forrar un aro de 20cm con papel aluminio  y papel manteca en la base y rellenar.     Llevar al horno durante 18 a 20 minutos a 160 grados.    Esperar que enfríe y rellenar como más te guste,   con dulce de leche,   crema batida o más chocolate.  ",Torta De Chocolate y Yogurt Natural,574fbdbb-ac4c-4d27-b888-eee3dbf24020
https://elgourmet.com/recetas/muffins-con-frutos-rojos/, Manteca 125 g   Azúcar  200 g   Frutos rojos  100 g   Huevos  3  unidad   Polvo de hornear  1 Cucharadas   Harina 0000  200 g   Yogurt De Frutillas Tregar  1  unidad ,Integrar con una espátula la manteca y el azúcar a temperatura ambiente.   Agregar los huevos de a uno.   Incorporar el yogur.   Agregar por último la harina y el polvo de hornear.   Llevar al Horno por 15 minutos .  ,Muffins Con Frutos Rojos,1443f5f2-3f2e-4d72-b624-f1864c3c7409
https://elgourmet.com/recetas/gorditas-de-chicharron-con-quesillo/,Acompañar  Cilantro picado 1/2 Taza   Salsa Verde Cruda  1/2 Taza   Queso rallado  ½ Taza   Crema   1/2 Taza   Cebolla picada  1/2 Taza  La Masa  Masa de maíz 150 g   Aceite  1 Cucharada sopera   Chicharrón Prensado Molido  1 Taza  Relleno  Jitomate picado 2 Unidades   Cebolla picada  1/2 Unidad.   Chicharrón Prensado Picado  2 Tazas   Aceite Caliente  2 cucharaditas   Cilantro picado  1/2 Taza   Quesillo  1 Taza ,"  Masa   Mezclar la masa con el chicharrón prensado molido hasta integrar perfectamente.   Formar bolitas y con la ayuda prensa de tortilla y 2 plásticos.   Cocinar en el comal caliente por ambos lados y posteriormente freir en abundante aceite caliente.   Abrir con ayuda de un cuchillo por la mitad y reservar   Relleno   Sofreír en aceite caliente cebolla,   jitomate picado,   cilantro y el chicharrón prensado.   Agregar el quesillo hasta integrar.   Rellenar las gorditas abiertas por la mitad.    Acompañamiento  Servir cada una de las gorditas y disponerlas con crema,   queso rallado,   cilantro y cebolla picada y salsa verde.  ",Gorditas De Chicharrón Con Quesillo,5f8c3d15-bc33-48f3-8663-7dce66eea71a
