url,ingrediants,steps,title,uuid
https://elgourmet.com/recetas/risotto-de-pulpo-caramelizado-con-alioli-de-jamon-iberico/, Sal c/n A gusto   Aceite de oliva extra virgen  c/n A gusto   Arroz Carnaroli  400  Gramos   Cebolla  1  unidad   Chalota  2 Unidades   Diente De Ajo  2 Unidades   Grasa de jamón ibérico  c/n A gusto   Huevo  1  unidad   Mantequilla de frutos secos  c/n A gusto   Pulpo  500  Gramos ,"Por un lado,   pochamos las chalotas y la cebolla a fuego medio.   Cuando empiecen a estar transparentes,   añadimos el pulpo troceado y lo dejamos cocer tapado a fuego medio-bajo hasta que quede casi tierno del todo añadiendo agua durante la cocción si es necesario.   Después añadimos el arroz,   rehogamos durante un par de minutos a fuego vivo y vamos añadiendo poco a poco agua ligeramente salada hasta que esté al dente.   A continuación,   derretimos la grasa de jamón ibérico en una cacerola al fuego y la ponemos en un vaso para batidora junto con el huevo y una pizca de sal.   Batimos.   Una vez esté listo el risotto,   lo rematamos con una cucharada de este “alioli ibérico”",Risotto de Pulpo Caramelizado con Alioli de Jamón Ibérico,d35c4ddb-467a-4989-843d-434d1c016416
https://elgourmet.com/recetas/costillas-de-wagyu-con-ensalada-de-papas-sorpresa/, Pimienta c/n A gusto   Sal  c/n A gusto   Romero fresco  c/n A gusto   Cebollas rojas  2 Unidades   Costillas de Wagyu  6 Unidades   Vino blanco  1 Vaso   Huevos  4 Unidades   Lima  1  unidad   Limón  1/2  unidad   Papas  1 kg   Verdeo fresco  c/n A gusto ,"Salpimentamos las costillas y las colocamos en una fuente de horno con un poco de vino blanco en la base,   las tapamos con papel de aluminio y las horneamos a 180-190º durante unas 2 horas (hasta que estén tiernas).   Controlamos que no se peguen en la base y si hace falta les damos una vuelta o añadimos agua.   Mientras tanto,   cortamos la cebolla en juliana muy fina y la ponemos a marinar con el jugo de lima.   Pasadas las dos horas,   destapamos las costillas y seguimos horneándolas a 200-220º hasta que estén bien doradas.   Hervimos el romero y la infusión resultante la ponemos en un vaso de batidora junto con los huevos,   el aceite y una pizca de sal y trituramos.   Por último,   cortamos las papas en cuartos,   las cubrimos con la salsa de huevo y por encima ponemos la cebolla encurtida y verdeo picado fino.   Servimos las costillas con esta guarnición y listo.  ",Costillas de Wagyu con Ensalada de Papas Sorpresa,8435803a-068a-435e-8a73-89801624756b
https://elgourmet.com/recetas/lobster-roll/, Aceite de girasol 1 Vaso   Aguacate  1  unidad   Chile serrano fresco  1  unidad   Cilantro fresco  c/n A gusto   Huevo  1  unidad   Langostas cocidas  4 Unidades   Lima  1  unidad   Pan de pancho  c/n A gusto   Salsa Sriracha  c/n A gusto   Verdeo  c/n A gusto ,"Lo primero que hacemos es trocear el aguacate junto con el chile,   el cilantro y una pizca de sal y mezclamos bien con un tenedor.   Reservamos.   Por otro lado,   en un vaso para batidora ponemos el aceite,   el huevo,   una pizca de sal y batimos hasta que se forme una mayonesa y añadimos una o dos cucharadas de salsa Sriracha.   Por último,   en una sartén doramos la langosta en mantequilla y montamos el roll poniendo abundante guacamole en la base del pan,   después la langosta y finalmente la mayonesa picante.   Rematamos con verdeo picado muy fino.  ",Lobster Roll,20f2e968-6264-4900-af69-385af4fb8ccd
https://elgourmet.com/recetas/cheesecake-al-chocolate-y-capuccino/, Chocolate para postres 250  Gramos   Huevos  4 Unidades   Harina  150  Gramos   Nata para montar  300  Gramos   Queso mascarpone  600  Gramos   Sal  1 Pizca   Azúcar  250  Gramos  Mousse  Azúcar 240  Gramos   Café Soluble  70  Gramos   Agua muy fría  280  Gramos ,"Calentamos la nata y derretimos en ella el chocolate.   Una vez mezclado,   añadimos el resto de los ingredientes y batimos hasta incorporarlos bien.   Colocamos esta mezcla en un molde forrado con papel de horno y horneamos a 200º durante 35 minutos.   En un bowl,   ponemos los ingredientes para la mousse y batimos hasta que espese tipo merengue.   Cubrimos con ella la tarta una vez ha enfriado.  ",Cheesecake al Chocolate y Capuccino,56fcb7de-59f7-4a68-8d24-a16540565b32
https://elgourmet.com/recetas/cotoletta-a-la-milanesa-con-fonduta-de-grana-padano/, Pimienta c/n A gusto   Sal  c/n A gusto   Aceite de oliva extra virgen  c/n A gusto   Chuleta de ternera con hueso largo  2 Unidades   Huevos  4 Unidades   Grana padano  250  Gramos   Mantequilla  150  Gramos   Nata líquida  280  Gramos   Pan rallado  c/n A gusto ,"En una cacerola al fuego derretimos el queso rallado con la nata hasta que espese un poco.   Por otro lado,   ablandamos la carne hasta que aumente considerablemente su extensión.   Después,   la pasamos por huevo y pan rallado.   En una sartén amplia calentamos la mantequilla y freímos la chuleta hasta que dore.   Por último,   servimos con la salsa de queso.  ",Cotoletta a la Milanesa con ¨Fonduta¨ de Grana Padano,b13d2cd5-d650-4bba-b309-2493254aebcb
https://elgourmet.com/recetas/bocata-fish-and-chips/, Papas 3 Unidades   Sal  c/n A gusto   Aceite de girasol  c/n A gusto   Aceite de oliva extra virgen  c/n A gusto   Agua con gas (muy fría)  2 Vasos   Bacalao desalado  600  Gramos   Cebolla de verdeo  1  unidad   Harina  300  Gramos   Huevo  1  unidad   Jalapeños en vinagre  1 Frasco   Pan crujiente  c/n A gusto   Pepinillos  1 Frasco   Piparras  1 Frasco ,"Ponemos el huevo en la batidora,   el aceite,   una pizca de sal y batimos sin mover nada durante los primeros segundos,   después añadimos los encurtidos picados y terminamos de triturar.   En un bowl con el agua con gas vamos añadiendo harina removiendo hasta que adquiera la textura de una bechamel espesa.   Después,   empapamos el bacalao cortado en trozos grandes en la mezcla y lo freímos hasta que dore.   Reservamos.   Por otro lado,   lavamos bien las papas,   las cortamos en gajos sin pelarlas y las freímos en abundante aceite.   Cuando estén doradas las sacamos sobre un papel de cocina y las salamos.   Montamos el bocadillo con el bacalao,   las patatas y la mayonesa de encurtidos.  ",Bocata Fish and Chips,3f9d4a21-50d1-41f8-80a3-6bd5b5d1ecf9
https://elgourmet.com/recetas/bignolata/, Agua 250  Gramos   Crema de chocolate y avellanas  100  Gramos   Harina 00  150  Gramos   Mantequilla de maní  250  Gramos   Mantequilla  90  Gramos   Nata líquida  150  Gramos   Huevos medianos  4 Unidades   Sal  1 Pizca ,"Lo primero es poner a hervir el agua y deshacer la mantequilla con la sal.   Después,   añadimos la harina de golpe y seguimos mezclando hasta que se forme una masa compacta y un poco pegajosa.   Dejamos enfriar en un recipiente tapado con film.   Pasado este tiempo,   vamos añadiendo a la masa los huevos de uno en uno y vamos mezclando hasta que estén completamente incorporados.   Ponemos esta masa en una manga pastelera y formamos bolitas encima de una placa con papel de horno con un poco de distancia entre ellas.   Horneamos a 210º durante 15 minutos y a 180º 15 minutos más.   Mientras,   mezclamos la mantequilla de maní con la nata y la introducimos en una manga pastelera.   Una vez tenemos los profiteroles listos,   los dejamos enfriar y los rellenamos con la crema de maní desde la parte de abajo.   Formamos una montaña con los profiteroles y los cubrimos con la crema de chocolate y avellanas en hilos.  ",El Gourmet,a3238e21-f01f-47e1-93e0-983f3c6a48d8
https://elgourmet.com/recetas/perrito-caliente-al-estilo-l-a/, Pimienta c/n A gusto   Sal  c/n A gusto   Aceite de oliva extra virgen  c/n A gusto   Carne de ternera picada  300  Gramos   Fondo de carne  1 Vaso   Panceta ahumada  4 Tira   Pan para perritos  c/n A gusto   Papas paille  1 Bolsa   Queso cheddar  200  Gramos   Salchichas Frankfurt  4 Unidades   Sirope de Arce  1 Chorrito ,"En una sartén sofreímos la carne con un poco de aceite y cuando está bien dorada añadimos una cucharada de fondo de carne,   otra cucharada de sirope de arce y un puñado de queso cheddar rallado.   Reservamos sin dejar que se enfríe.   En otra sartén ponemos las salchichas cada una con una tira de panceta enrollada y las doramos.   Finalmente montamos los perritos poniendo las Frankfurt en el pan,   después el queso,   la carne,   las patatas,   más queso y el resto de la carne.  ",Perrito Caliente al Estilo L.A.,8e272305-8d5f-47c8-987e-794451bdccba
https://elgourmet.com/recetas/ramen-mar-y-montana-de-carabineros-y-porchetta/, Sal c/n A gusto   Aceite de oliva extra virgen  c/n A gusto   Cebolla de verdeo (picado)  c/n A gusto   Fideos para ramen  100  Gramos   Salsa de soja  c/n A gusto   Huevos de pato  2 Unidades   Lonjas gruesas de panceta  2 Unidades   Langostinos grandes  4 Unidades   Pernil de cerdo  1  unidad   Setas enoki  2 Manojo ,"Pelamos los langostinos y ponemos sus cabezas a rehogar en una olla con aceite.   Por otro lado,   ponemos a hervir el pernil de cerdo en agua.   En un cacerola con agua muy salada cocemos el huevo durante 6-7 minutos y lo reservamos en agua muy fría.   Hervimos también los fideos en agua salada.   Por último salteamos las gambas con unas gotas de salsa de soja.   Servimos poniendo los fideos en un bowl grande,   los langostinos,   el huevo partido por la mitad y la panceta y terminamos con el caldo y el verdeo picado.  ",Ramen Mar y Montaña de Langostinos y Cerdo,0c896423-93a4-4046-813e-2f68550e64db
https://elgourmet.com/recetas/butter-chicken-con-pan-naan/, Comino 1 Cucharada   Contramuslos de pollo  6 Unidades   Cúrcuma en polvo  1 Cucharada   Garam Masala  1 1/2 Cucharada   Raíz de Jengibre  1 Unidad   Paprika en polvo  1 Cucharada   Yogurt Natural  300  Gramos   Ajo  1 Cabeza  Pan  Harina 00 500  Gramos   Sal  1 Cucharada   Yogurt natural cremoso  1  unidad   Leche  120  Gramos   Mantequilla  50  Gramos   Azúcar  1 Cucharada   Aceite  3 Cucharadas   Agua templada  120  Gramos  Salsa  Ajo rallado 1 Cucharada   Aceite de girasol  c/n A gusto   Cebolla  1/2  unidad   Cilantro fresco  c/n A gusto   Comino  1 Cucharada   Concentrado de tomate  1 Cucharada   Mantequilla  100  Gramos   Menta fresca  c/n A gusto   Nata para cocinar  200  Gramos   Garam Masala  1 Cucharada   Sal  c/n A gusto   Tomate  1  unidad   Jengibre rallado  1 Cucharada   Pistachos  50  Gramos ,"En un bowl,   ponemos todos los ingredientes menos la mantequilla y amasamos hasta obtener una masa lisa.   La tapamos con film y dejamos reposar hasta que doble su tamaño.   Una vez ocurra,   dividimos la masa en partes iguales y no muy grandes,   con cuidado de que no pierda mucho aire.   Con las manos,   empezamos a presionar la masa y a darle un formato ligeramente ovalado.   Calentamos aceite de girasol en una sartén a fuego medio alto y freímos los trozos de masa hasta que en la superficie se empiecen a formar burbujas,   que será el momento de darles la vuelta y cocinarlos por el otro lado.   Pincelamos con mantequilla derretida y listo.   Por otro lado,   en un bowl mezclamos el pollo con los ingredientes del marinado y reservamos en la nevera durante 30 minutos.   Pasados los 30 minutos,   en una sartén,   rehogamos bien el pollo con mantequilla.   En otra sartén,   ponemos aceite de girasol y freímos la cebolla seguida por el tomate,   la cucharada de ajo y jengibre,   el concentrado de tomate,   las especias y la nata.   Trituramos y reservamos.   Reincorporamos la crema y el pollo y cocinamos unos 10 o 15 minutos.   Terminamos con las hierbas frescas y los pistachos.  ",Butter Chicken con Pan Naan,6c16e03e-1985-44ec-99f2-7226ed1fc6cc
https://elgourmet.com/recetas/paccheri-costa-brava/, Gambas 10 Unidades   Leche  1 L   Sal  c/n A gusto   Boletus frescos  300  Gramos   Butifarra  1  unidad   Grana Padano (cuña)  1  unidad   Harina  100  Gramos   Mantequilla  100  Gramos   Mantequilla  100  Gramos   Paccheri  10 Unidades   Polvo de boletus  1/2 Cucharada ,"En una olla con agua salada ponemos a cocer los paccheri un minuto menos del tiempo indicado.   Los reservamos aliñados con un poco de aceite.   Picamos bien las gambas y las mezclamos con la butifarra y una pizca de sal.   Rellenamos los paccheri y reservamos en la nevera.   En un cacerola,   derretimos la mantequilla,   rehogamos los boletus en ella y añadimos la harina.   Seguimos cocinando un par de minutos sin parar de remover con un batidor.   Incorporamos la leche poco a poco sin parar de remover y dejamos cocer hasta que espese,   agregando en el último momento el polvo de boletus.   Salteamos a fuego medio los paccheri con mantequilla unos 3 minutos y los servimos napando con la bechamel y un poco de Grana Padano y gratinamos hasta que estén en su punto.  ",Paccheri Costa Brava,52ffcfd5-86d4-4410-8344-8adfef166c81
https://elgourmet.com/recetas/bocata-de-popcorn-porchetta/, Sal c/n A gusto   Romero fresco  c/n A gusto   Aceite de girasol  c/n A gusto   Aceite de oliva extra virgen  c/n A gusto   Cuerda de carnicera gruesa  c/n A gusto   Dientes de ajo  4 Unidades   Grana Padano (cuña)  1  unidad   Huevo  1  unidad   Panceta grande de cerdo  1  unidad   Pan de cristal  1  unidad   Ramo de tomates cherry  1  unidad   Rúcula  50  Gramos   Pimienta negra  c/n A gusto   Semillas De Hinojo   c/n A gusto ,"Primero picamos todas las hierbas aromáticas,   los ajos,   aliñamos con aceite de oliva y reservamos.   Cortamos la panceta por la mitad a lo ancho abriéndola como un libro y le ponemos por encima el aliño.   La enrollamos y bridamos.   Después,   hacemos unos cortes sobre la piel para que no reviente y la untamos con aceite de oliva y bastante sal gruesa,   así quedará muy crujiente.   La envolvemos en papel de aluminio y horneamos a 250º durante una hora.   Pasado ese tiempo,   quitamos el papel y seguimos horneándola a 200º 1h y media más.   Cuando la porchetta está lista,   la ponemos en una rejilla con una bandeja debajo,   mojamos con el aceite muy caliente y veremos cómo la piel empieza a hacer burbujas que parecen pochoclos.   Mientras la porchetta se enfría,   horneamos los tomates aliñados con aceite de oliva y sal a máxima temperatura hasta que estén bien pochados pero no desechos.   En un vaso para batidora preparamos la “pestonesa” de rúcula poniendo un vaso de aceite de girasol,   un huevo,   una pizca de sal y batimos sin mover la batidora durante los primeros segundos.   Añadimos la rúcula,   el queso,   el ajo y seguimos batiendo.   Por último abrimos el pan,   untamos la pestonesa en la base,   lo llenamos de porchetta cortada fina y rematamos con los tomates.  ",Bocata de Popcorn Porchetta,f66df516-10b1-4fbd-a392-ff8922872e1c
https://elgourmet.com/recetas/tarta-de-rubia-gallega/,Masa  Huevos 2 Unidades   Harina  600  Gramos   Mantequilla fría  300  Gramos  Relleno  Tomillo fresco c/n A gusto   Salvia fresca  c/n A gusto   Vino tinto de calidad  1/2 L   Zanahoria  1  unidad   Azúcar impalpable  c/n A gusto   Grasa de vaca  1 Cucharada   Sal  c/n A gusto   Romero fresco  c/n A gusto   Aceite de oliva extra virgen  c/n A gusto   Ajos  2 Unidades   Carrilleras de vaca rubia gallega  1 kg   Cebolla  1  unidad   Concentrado de tomate  1 Cucharada ,"En una olla,   ponemos a rehogar la carne troceada como para estofado con grasa de vaca,   sal y pimienta negra.   Añadimos las verduras trituradas muy finas,   le damos un par de vueltas más y después agregamos el tomate concentrado y las hierbas aromáticas.   Cuando veamos que se está creando un “caramelo” en el fondo,   añadimos el vino bien frío y así desglasará con más facilidad.   Si vemos que la carne no está del todo cubierta por el vino,   añadimos agua hasta cubrirla.   Cocinamos la carne a fuego medio-bajo durante un par de horas al menos o hasta que empiece a deshacerse.   En un bowl mezclamos la harina con la mantequilla bien fría,   los huevos y una pizca de sal.   Amasamos hasta que los ingredientes se unifiquen y reservamos en la nevera envuelta en film.   Cuando la carne esté lista y la salsa haya espesado un poco apagamos el fuego y dejamos enfriar.   Estiramos 2/3 de la masa dejándola de un grosor de 1 o 2 cm.   La colocamos en el molde con unos garbanzos crudos encima y horneamos a 180º unos 15 o 20 minutos.   Después,   ponemos la carne ya fría en el molde y pincelamos con huevo.   Horneamos nuestro pastel a 200º hasta que la parte de arriba quede muy bien dorada.   Por último,   dejamos que temple y decoramos con azúcar impalpable.  ",Tarta de Rubia Gallega,afa5006a-b7e6-43a8-b4a8-b014ce38d461
https://elgourmet.com/recetas/pizza-frita-con-chicharrones/, Aceite de girasol c/n A gusto   Aceite de oliva extra virgen  c/n A gusto   Agua templada  500  Gramos   Chicharrones  200  Gramos   Diente De Ajo  1  unidad   Grana Padano (cuña)  1 Unidad   Harina de fuerza  900  Gramos   Levadura fresca  10  Gramos   Provolone picante  150  Gramos   Orégano fresco  c/n A gusto   Ricotta fresca  200  Gramos   Sal  25  Gramos   Tomate triturado  1 Lata ,"En un bowl,   diluimos la sal en el agua,   después la levadura y por último la harina.   Mezclamos con un tenedor hasta que empiece a formarse una masa.   Seguimos amasando fuera del bowl unos 10 minutos y dejamos la masa tapada otros 15.   Una vez transcurrido este tiempo,   volvemos a amasar durante unos minutos más y volvemos a dejarla bien tapada con film hasta que doble su tamaño.   Mientras tanto preparamos la salsa marinera calentando el aceite y añadiendo el tomate y el ajo rallado.   Añadimos también el orégano.   Por otro lado,   sofreímos los chicharrones y reservamos.   Dejamos caer suavemente la masa en la mesa intentando que no pierda el aire.   Después la cortamos en tres partes y empezamos a abrir una de ellas pero sin estirarla mucho y haciendo un disco de unos 15-20 cm.   En la base ponemos un poco de salsa de tomate,   la ricotta mezclada con el provolone troceado y los chicharrones cortados en tiras y sofritos.   Cerramos el calzone dándole su clásica forma a media luna y aplastando bien el borde con el puño.   Calentamos el aceite hasta que llegue a unos 180º y antes de freír el calzone,   lo estiramos hasta casi doblar su tamaño.   Lo freímos sin dejar de mojarlo con el aceite y/o darle vueltas.   Cuando esté inflado y dorado,   lo escurrimos,   lo ponemos en un plato y lo cubrimos con la salsa marinera muy caliente,   más chicharrones crujientes y un puñado de Grana Padano rallado.  ",Calzone Frito con Chicharrones,d8074f4c-4cfd-4372-8e59-2b5e96da4312
https://elgourmet.com/recetas/tortelloni-de-zamburinas-y-bacon-en-salsa-meuniere/, Pimienta c/n A gusto   Sal  c/n A gusto   Bechamel casera  80 Ml   Huevos  6 Unidades   Harina  600  Gramos   Limón  1  unidad   Lonjas de bacon  4 Unidades   Mantequilla  100  Gramos   Zamburiñas  8 Unidades ,"En un bowl,   amasamos los huevos con la harina hasta obtener una masa lisa.   Tapamos con film y reservamos.   Después,   doramos el bacon hasta que esté crujiente y en la misma grasa marcamos las zamburiñas.   Una vez tenemos esto,   picamos tanto las zamburiñas como el bacon y reservamos.   Estiramos la pasta hasta que esté bastante fina.   Ponemos sobre cada tira de “sfoglia” (hojas de pasta) la mezcla de zamburiñas y bacon y una cucharadita de bechamel,   espolvoreamos con un poco de agua y ponemos otra “sfoglia” encima.   Intentamos que no quede aire en el interior mientras pegamos la pasta sobre el relleno y formamos los tortelloni recortando con un cortapastas.   Una vez tenemos estos cuadrados los ponemos a hervir dos minutos.   Terminamos los tortelloni marcándolos en una sartén con mantequilla y un chorrito de jugo de limón.  ",Tortelloni de Zamburiñas y Bacon en Salsa Meunière,45ba304c-b090-42bc-bd0b-5171fb3a3f85
https://elgourmet.com/recetas/pastel-rebosante-de-moras/, Azúcar 250  Gramos   Azúcar impalpable  200  Gramos   Huevos  2 Unidades   Harina  600  Gramos   Limón  1/2  unidad   Mantequilla fría  300  Gramos   Moras congeladas  1 kg   Ralladuras de limón  c/n A gusto  Crema Pastelera  Esencia de vainilla c/n A gusto   Leche entera  500  Gramos   Almidón de maíz  1 Cucharada   Azúcar  130  Gramos   Yemas De Huevo  7 Unidades ,"En un cacerola,   cocinamos las moras con el azúcar y el jugo de limón hasta que empiece a parecerse a una mermelada.   En un bowl,   amasamos la harina con la mantequilla fría,   los huevos y el azúcar hasta que obtengamos una masa compacta.   Tapamos con film y reservamos en la nevera.   Dividimos la masa en dos,   dejando la parte de la base un poco más grande.   Estiramos con un rodillo y algo de harina dos discos de masa gruesos y con uno de ellos forramos una fuente de unos 20 cm.   Horneamos la base durante unos 10 minutos a 180º.   Después,   volcamos las moras bien frías encima de la base y tapamos con la otra masa.   Horneamos de nuevo a 180º unos 15-20 minutos más.   Mezclamos las yemas y el azúcar con el almidón de maíz.   Calentamos la leche hasta casi punto de ebullición y la echamos en el bowl de las yemas y el azúcar.   Mezclamos bien,   cocinamos a fuego medio sin parar de remover con un batidor.   Reservamos.   Cuando la crema pastelera esté fría,   la ponemos en el congelador unos 30 minutos y la utilizamos para decorar la tarta por encima.  ",Pastel Rebosante de Moras,aead6f3e-275b-4958-ba4a-d1632792d361
https://elgourmet.com/recetas/mi-sandwich-de-queso/, Burrata fresca 1  unidad   Cheddar  150  Gramos   Grana padano rallado  200  Gramos   Mantequilla  100  Gramos   Pan tipo Brioche  c/n A gusto   Provolone picante rallado  150  Gramos ,"Trituramos la burrata y reservamos.   Cortamos un par de rebanadas de pan de un dedo de grosor.   Rellenamos el pan con el provolone,   lo cerramos y lo untamos con mantequilla antes de ponerlo a tostar en una sartén antiadherente.   Cuando esté dorado,   lo reservamos.   En la misma sartén ponemos el grana padano y en cuanto empiece a derretirse volvemos a poner el sándwich encima.   Cuando el grana está derretido del todo,   le damos la vuelta a la sartén sujetando el sándwich y dejando que el queso lo envuelva.   Esperamos unos segundos para que se endurezca el queso manteniendo la forma.   Ahora ponemos la burrata en un bowl y dipeamos con el sándwich antes de volar.  ",Mi Sándwich de Queso,81a806fd-13d8-4f85-b6fe-c6546962a167
https://elgourmet.com/recetas/focaccia-de-leche-rellena-de-jordan-pulled-lamb/, Harina 850  Gramos   Leche entera  500  Gramos   Levadura fresca  10  Gramos   Limón  1  unidad   Menta fresca  c/n A gusto   Paleta de cordero  2 Unidades   Sal  25  Gramos   Yogur griego natural  250  Gramos ,"En un bowl ponemos la leche,   deshacemos la sal en ella y luego la levadura.   Añadimos la harina y amasamos hasta que tengamos una masa compacta pero blanda.   La dejamos tapada y que descanse unos 15 minutos antes de seguir amasando unos 10 minutos más.   Después,   tapamos con film hasta que doble su tamaño.   Salamos las paletas,   las ponemos en una fuente apta para horno con un poco de agua en la base y tapamos con papel de aluminio.   Horneamos a 200º durante 2 horas.   Después destapamos la fuente y seguimos horneando a 200° hasta que dore muy bien.   Por otro lado,   distribuimos la masa en una placa de horno untada con aceite y dejamos que leve un rato antes de hornearla.   Cuando la focaccia esté esponjosa,   horneamos a 190º durante unos 25 o 30 minutos.   Sacamos la focaccia de la fuente y la cortamos por la mitad.   Desmenuzamos la carne,   la mezclamos con los jugos que se han formado en el fondo de la fuente y la ponemos dentro de la focaccia.   Por último mezclamos el yogur con la menta picada,   el jugo de limón y un poco de ralladura también.   Añadimos una pizca de sal y napamos la carne.   Tapamos con la otra mitad y a disfrutar.  ",Focaccia de Leche Rellena de Jordan Pulled Lamb,de762e7b-28f1-42d7-a817-79060bd68002
https://elgourmet.com/recetas/cheesecake-a-pura-dulzura/, Azúcar 2 y 1/2 cda   Extracto de vainilla  c/n   Galletas trituradas  4 cdas   Huevo  1  unidad   Mantequilla derretida  1 cda   Mermelada a gusto  c/n   Queso crema  4 cdas   Yogur Natural  2 cdas ,"Engrasar con mantequilla el interior de una taza apta para microondas.   Triturar las galletas,   mezclar con mantequilla derretida y verter la mezcla en la base de la taza.   En un bol mezclar el huevo,   el queso,   el yogur,   el azúcar y la vainilla.   Mezclar bien hasta deshacer por completo los grumos.   Verter la masa dentro de la taza,   sobre la galleta.   Tapar la taza con una servilleta e introducir en el microondas durante 20 segundos.   Abrir el microondas y volver a cocinar otros 20 segundos.   Volver a abrir el microondas y cocinar por 20 segundos.   Deja enfriar a temperatura ambiente durante algunos minutos y dar vuelta sobre un plato.   Decorar con la mermelada.  ",Cheesecake A Pura Dulzura,f98bfc01-95a3-4c8e-ab3f-43c61f2dd0f6
https://elgourmet.com/recetas/hamburguesa-de-roast-beef-con-doble-inmersion/,   ,,Hamburguesa de Roast Beef con Doble Inmersión,165a813d-3148-45bd-89f6-d5a1e2e7129f
