title,intro,order,votes,comensales,duración,para,dificultad,coste,types,ingredientes,url
Empanadas de carne fritas,"Las empanadas de carne son las más tradicionales argentinas. Generalmente, se ofrecen al horno, aunque fritas son aún más ricas. Por supuesto que el consumo frecuente y elevado de productos fritos está relacionado con el aumento de las probabilidades de desarrollo de enfermedades. Sin embargo, justamente, si uno hace un consumo esporádico y en una porción moderada, puede disfrutar del sabor de los productos fritos mientras cuida su salud. Asimismo, en esta receta te enseñaremos a realizar una fritura fácil y un relleno sabroso que todos querrán probar.Quédate leyendo en RecetasGratis y aprende cómo hacer empanadas de carne fritas jugosas. ¡A cocinar!","['1\nPara empezar con la receta de las empanadas de carne, primero cocina los huevos durante 12 minutos partiendo de agua fría.', '2\nPela y pica la cebolla. También corta el morrón en cuadraditos. A continuación, saltea las verduras en una sartén a fuego alto con el aceite y la manteca.', '3\nCuando la cebolla esté transparente, baja el fuego al medio y remueve cada tanto para que no se pegue, pero se siga cocinando.', '4\nCuando las verduras estén cocidas, retíralas del fuego y vuelve a subir el fuego al máximo para saltear la carne.', '5\nCuando la carne cambie de color, agrega las verduras y llévalo todo hacia los bordes de la sartén. Todavía con el fuego alto, agrega el vino blanco y reserva hasta que cambie el olor de ácido a más dulce, ya que esto indicará que se ha evaporado el alcohol. Retíralo del fuego y reserva hasta que se enfríe.', '6\nPor otro lado, corta las aceitunas en rodajitas.', '7\nTambién pela y pisa los huevos o pícalos del tamaño que desees.', '8\nAgrega ambos ingredientes al relleno junto con los condimentos al gusto.', '9\nSi deseas agregar pasas de uva, hidrátalas previamente con agua tibia.', '10\nAñade las pasas de uva en el relleno y reserva mientras se termina de enfriar.', '11\nCuando esté frío el relleno de empanadas de carne jugoso, agrega una cucharada del relleno mismo en el disco de empanada y humedece la mitad del borde para cerrarla, sellarla y hacerle el repulgue. Resérvalas en el freezer.', '12\nCalienta el aceite en un recipiente con un diámetro no muy grande o no se sumergirán completamente y, por tanto, no se cocinará la masa para empanadas fritas de carne de forma pareja.', '13\nAgrega las empanadas en aceite cuando hayan alcanzado los 180 ºC - 200 ºC. Si no tienes termómetro, cuando haga pequeñas burbujas alrededor de la empanada deberás añadirlas. Maneja las empanadas argentinas de carne con una pinza y no con algún elemento punzante para que se mantenga el relleno dentro. Además, si es necesario, gírala para que se dore de forma pareja. Retírala cuando veas que está dorada.', '14\nA medida que saques las empanadas de la fritura, llévalas a un papel absorbente para retirar el exceso de aceite.', '15\nSi deseas una opción más saludable, lleva las empandas a la freidora de aire, pintándolas previamente con huevo batido. Cocínalas a 160 ºC durante 10 minutos.', '16\nAquí puedes ver el resultado de las empanadas de carne fritas en la freidora de aire. Puedes quedarte con esta opción para consumir de forma frecuente y la opción frita en aceite para comer de forma esporádica, por los efectos en la salud que comentábamos al principio de la receta.', '17\nAsí queda el resultado de las empanadas fritas en aceite. Puedes acompañarlas con jugo de limón para cortar lo grasoso de la fritura. ¡A comer las mejores empanadas de carne! Cuéntanos en los comentarios tu opinión y comparte con nosotros una fotografía del resultado final.']",,3 comensales,1h 30m,Plato principal,Dificultad baja,,"['Receta sin lactosa', 'Receta sin sal', 'Recetas argentinas']","['2 huevos', '1 cebolla', '¼ morrón rojo', '¼ morrón verde', '¼ morrón amarillo', '1 cucharada sopera de aceite', '1 cucharada sopera de manteca', '500 gramos de carne picada', '25 centímetros cúbicos de vino blanco', '12 aceitunas descarozadas', '1 cucharadita de orégano', '1 pizca de nuez moscada', '⅓ taza de pasas de uva']",https://www.recetasgratis.net/receta-de-empanadas-de-carne-fritas-76150.html
7 tipos de aguachile,"Para quienes no sepan qué es el aguachile, deben saber que es un platillo típico de la costa occidental de México, específicamente de Sinaloa, Nayarit, Jalisco, Sonora y Baja California. El aguachile es muy similar al ceviche, pero hecho con ingredientes de la región y una maceración más rápida, ya que después de agregar el limón, se suele dejar en reposo 10 minutos. Aunque actualmente existen muchas variantes de este plato, se dice que todas estas parten de tres tipos de aguachile básicos: el aguachile tradicional, el mestizo y el contemporáneo. ¿Qué te parece incluir este platillo en tu menú de verano?En RecetasGratis te enseñamos cómo hacer 7 tipos de aguachile para sorprender a tus comensales. ¡A cocinar!",[],,,,,,,,,https://www.recetasgratis.net/articulo-7-tipos-de-aguachile-76141.html
Receta FÁCIL y TRADICIONAL,"Es probable que si no eres de México te preguntes qué son las chalupas poblanas. Pues bien, las chalupas de Puebla son un antojito mexicano muy popular para disfrutar en la merienda o en la cena. Se trata de una tortilla taquera frita en aceite o manteca acompañada con salsa roja o salsa verde y, además, se puede agregar encima carne de res o de pollo. Las puedes encontrar fácilmente en las llamadas cenadurías, que son lugares donde sirven antojitos mexicanos para disfrutar por la noche. También te enseñaremos a preparar la salsa verde y roja para que acompañes este rico antojito mexicano.Así que si quieres aprender cómo hacer chalupas de Puebla, en RecetasGratis te enseñamos cómo elaborarlas. ¡A cocinar!","['1\nPara empezar con la receta de chalupas de Puebla primero debes cocer la pechuga de pollo con agua y sal. Si utilizas una olla normal, cuece la pechuga entre 40 minutos y una hora. En cambio, si utilizas una olla a presión, cocina la pechuga de 20 a 25 minutos. Cuando esté cocida deja que se enfríe y desmenúzala. Por último, reserva.', '2\nPara hacer las salsas para chalupas, empezaremos con la salsa verde. Primero, pon en una olla con agua a cocer los tomates verdes y los chiles serranos, deja que se cuezan alrededor de unos 8-10 minutos.\nTruco: si lo prefieres puedes tatemarlos antes para que tomen un mejor sabor.', '3\nCuando los tomates y los chiles estén cocidos, llévalos a la licuadora con un trozo de cebolla, 2 dientes de ajo, 1 rama de cilantro, sal, pimienta y un poco del agua de cocción. A continuación, licúa todo muy bien durante dos minutos, cuando esté lista, pásala a un recipiente y resérvala.', '4\nPara la salsa roja, primero debes tatemar los tomates, el trozo de cebolla, los dientes de ajo y los chiles Morita. Estos últimos no los dejes tanto tiempo en el comal o sartén, porque se quemaran y tomarán un sabor amargo. Deja tatemar todos los ingredientes hasta que estén dorados.', '5\nCuando tengas el tomate, la cebolla, los dientes de ajo y los chiles tatemados es momento de pasar a la licuadora. Debes agregar media taza de agua con una pizca de sal y pimienta. Luego, licúa todo muy bien durante 2 minutos, cuando esté lista, pásala a un recipiente y resérvala.', '6\nPara hacer las chalupas poblanas, debes calentar en una sartén con suficiente aceite o manteca para poder freír las tortillas taqueras. Puedes freírlas ligeramente o hacer fritura profunda, esto es completamente al gusto.', '7\nCon las tortillas de maíz fritas y las salsas estén listas ya puedes armar las chalupas de Puebla. Primero, coloca la tortilla de maíz. A continuación, vierte una buena cucharada de salsa que puede ser tanto de la verde como de la roja. Luego, un poco del pollo cocido desmenuzado, un poco de cebolla picada y por último, el queso desmoronado. Listo, ya puedes disfrutar de unas ricas chalupas de Puebla.']",,8 comensales,45m,Merienda,Dificultad baja,,"['Recetas mexicanas', 'Recetas poblanas']","['1 kilogramo de tortilla de maíz taquera', '1 pieza de cebolla picada', '150 gramos de queso fresco desmoronado', '1 pechuga de pollo', 'sal al gusto', 'agua la suficiente', '5 piezas de tomates verdes', '3 chile serrano', '1 trozo de cebolla', '2 dientes de ajo', '1 rama de cilantro', 'agua la suficiente', 'sal y pimienta al gusto', '2 piezas de jitomates', '3 chile morita', '1 trozo de cebolla', '2 dientes de ajo', 'sal y pimienta al gusto', '½ taza de agua (120 mililitros)']",https://www.recetasgratis.net/receta-de-chalupas-de-puebla-76197.html
Receta FÁCIL y DELICIOSA,"Si de antojitos mexicanos se trata, la quesadillas son uno de los más populares y, sin entrar en debate sobre si lleva queso o no, existen muchos guisos e ingredientes variados. En esta ocasión, te proporcionamos una deliciosa receta de quesadillas de chorizo. Aprende con nosotros a preparar con pocos ingredientes y de manera sencilla, te mostramos como hacerlas desde la tortilla, porque siempre es mejor con una tortilla recién hecha, además te proporcionamos algunos tips para que disfrutes a cualquier hora y cualquier día.Si quieres saber cómo hacer quesadillas de chorizo con queso, sigue leyendo, y comprueba que no es para nada complicado y que al final obtendrás un platillo rico y rápido de preparar. ¡A cocinar!","['1\nPara empezar con la receta de quesadillas de chorizo, primero prepara las tortillas. Para ello, en un recipiente amplio coloca la masa de maíz, agrega una pizca de sal y un poquito de agua tibia. Asimismo, comienza a amasar para calentar la masa y así sea más fácil manejar. Si lo deseas, puede conseguir la masa en tortillerías o bien puedes hacerla tú mismo con harina de maíz nixtamalizado que se consigue en el supermercado, solo siguiendo las instrucciones del empaque.\nTruco: este paso es completamente opcional si quieres ahorrarte tiempo.', '2\nCon ayuda de una prensa para tortillas y un plástico, toma una porción de masa de aproximadamente 40 gramos y bolea. A continuación, coloca en el centro de la prensa y presiona para formar la tortilla hasta que quede delgada de unos 2 o 3 milímetros.', '3\nEn un comal o sartén caliente, cocina las tortillas hasta que se inflen, aproximadamente tardarán de 1 o 2 minutos en estar listas. Únicamente mantén a una temperatura media alta y proporciona la vuelta para que se cocinen uniformemente.', '4\nCuando estén las tortillas elaboradas, es momento de preparar el chorizo. Para ello, primero calienta en una sartén una cucharada de aceite, agrega la cebolla picada, deja sofreír hasta que esta esté ligeramente transparente y se vea dorada.', '5\nAñade el chorizo en trozo y mezcla muy bien para terminar de trocearlo. Luego, agrega el cilantro picado, mezcla nuevamente y deja cocinar durante unos 8 minutos moviendo regularmente. Cuando esté listo, reserva.', '6\nPara armar las quesadillas, primero toma una tortilla, agrega queso rallado al gusto y, seguido, añade una cucharada copeteada del chorizo cocido. Luego, dobla la tortilla y presiona un poco.', '7\nLleva directamente al comal o sartén previamente engrasado y a temperatura media baja deja calentar por ambos lados hasta que el queso esté bien derretido.', '8\nSirve enseguida y agrega alguna salsa de tu preferencia. ¡Ya puedes disfrutar de estas exquisitas quesadillas de chorizo! Cuéntanos en los comentarios tu opinión y comparte con nosotros una fotografía del resultado final.']",,4 comensales,15m,Entrante,Dificultad baja,,['Recetas mexicanas'],"['500 gramos de masa de maíz nixtamalizado', '1 pizca de sal', '½ tarro de agua tibia', '200 gramos de chorizo', '½ pieza de cebolla picada', '1 cucharada sopera de aceite', '400 gramos de queso', '1 rama de cilantro picado']",https://www.recetasgratis.net/receta-de-quesadillas-de-chorizo-76317.html
Chilaquiles con huevo estrellado,"Uno de los mejores desayunos que puede haber es, sin duda, los chilaquiles. Además, existe una gran variedad de salsas: las más populares son la salsa verde y la salsa roja, pero también puede haber de mole, de salsa de guajillo, de 7 chiles y muchas otras más. También debes saber que los chilaquiles se disfrutan solo con crema y queso, pero también se pueden acompañar con alguna proteína como pollo o carne de res y con huevo. Asimismo, en esta oportunidad vamos a compartir una deliciosa receta de chilaquiles con huevo estrellado con una picosita salsa verde. También te proporcionamos algunos tips para que el huevo te quede en su punto para que al final obtengas un delicioso desayuno.Sin más, en RecetasGratis te enseñamos cómo hacer chilaquiles con huevo estrellado. ¡Vamos allá!","['1\nPara hacer esta receta de chilaquiles con huevo estrellado, primero prepara la salsa. Para ello, en una sartén calienta una cucharada de aceite, coloca los tomates verdes, los chiles serranos, el trozo de cebolla y los dientes de ajo, mueve constantemente para que se doren uniformemente. Debes mantener a una temperatura media baja, deja que se doren durante 6 a 8 minutos hasta que notes que el color verde de los tomates y chiles se haya opacado. La cebolla y los dientes de ajo también debes estar bien dorados.', '2\nCuando tengas listos los tomates, la cebolla, los chiles y los dientes de ajo, es momento de pasar a la licuadora con una ramita de cilantro y una taza de caldo de pollo. Licúa todo muy bien durante un par de minutos.', '3\nCalienta un par de cucharadas de aceite en una olla y, una vez caliente, vierte la salsa licuada. Si la notas muy espesa, puedes añadir un poco más de caldo de pollo o agua. A continuación, sazona con sal y pimienta al gusto, deja cocinar hasta que hierva y, cuando haya hervido, comprueba de sazón y retira del fuego.', '4\nPara preparar el huevo estrellado uno de los mejores tips es utilizar la sartén adecuada y generar una temperatura media constante para que no se pegue y tenga el término de cocción adecuado. Asimismo, rompe la cantidad que quieras poner a tus chilaquiles, agrega una pizca de sal y pimienta, cocina al término que prefieras. Puedes tapar si quieres la yema bien cocida o bien puedes voltear con cuidado que no se rompa.', '5\nPara servir los chilaquiles en un plato coloca una cama de totopos, estos pueden ser fritos y horneados. Luego, también coloca un poco del queso desmoronado, distribuye muy bien tanto los totopos cómo el queso.', '6\nBaña con la salsa verde y, enseguida, coloca el huevo estrellado. A continuación, decora con cebolla y cilantro picado, un par de cucharadas de crema ácida y queso desmoronado al gusto. ¡Ahora sí puedes disfrutar de unos ricos chilaquiles con huevo estrellado! Cuéntanos en los comentarios tu opinión y comparte con nosotros una fotografía del resultado final.']",,2 comensales,30m,Desayuno,Dificultad muy baja,,['Recetas mexicanas'],"['6 tomates verdes', '3 chiles serranos', '1 trozo de cebolla blanca', '2 decilitros de ajo pelados', '1 rama de cilantro fresco', '1 taza de caldo de pollo', 'sal y pimienta al gusto', '1 bolsa de totopos de maíz', '4 huevos', 'sal y pimienta al gusto', 'aceite el necesario', '100 gramos de queso desmoronado', '½ pieza de cebolla picada', '5 hojas de cilantro']",https://www.recetasgratis.net/receta-de-chilaquiles-con-huevo-estrellado-76301.html
Empanadas sin carne,"Durante la temporada de vigilia, quienes son religiosos respetan la tradición de no consumir carne de vaca o de cerdo, es decir, carnes rojas. Para este momento o si buscas aumentar el consumo de pescados por sus grandes beneficios para la salud, recomendamos que elabores y pruebes estas empanadas argentinas sin carne. Se trata de un relleno con una base de atún y vegetales. Muy sabroso y húmedo, ideal para disfrutar de una cena liviana o una vianda práctica para el trabajo, facultad o escuela. Puedes hacerlas con masa comprada o bien hacerla casera para que el resultado sea más saludable aún.Asimismo, quédate leyendo en RecetasGratis y aprende cómo hacer empanadas sin carne. ¡A cocinar!","['1\nPara empezar con la receta de las empanadas sin carne, primero pela y pica la cebolla para saltearla con 1 cucharadita de aceite en una sartén a fuego máximo hasta que esté transparente.', '2\nCuando la cebolla esté transparente, añade los morrones lavados y picados, sin las nervaduras blancas ni semillas. Luego, baja el fuego a medio-bajo y continúa salteando hasta que estén bien cocidas las verduras. Si se está pegando, agrega un poco del líquido de la conserva del atún para sumar sabor. También puedes usar agua.', '3\nCuando estén cocidas las verduras, retíralas del fuego y mézclalas con el atún previamente colado, las aceitunas cortadas en rodajitas y condimentos al gusto, como orégano, pimentón, comino y pimienta. Pruébalo y corrige si es necesario.', '4\nCuando el relleno esté frío, rellena las empanadas agregando una cucharada de la preparación de atún en el centro del disco de empanada. Luego, humedece la mitad del borde para que al cerrarlas se sellen bien y no se salga el relleno.', '5\nCiérralas con el repulgue que más te guste y llévalas a una asadera previamente engrasada con el cierre hacia arriba como ves en la imagen. Luego, píntalas con el huevo batido para que se doren bien y cocínalas en el horno precalentado a 200 ºC - 220 ºC durante unos 15 minutos hasta que estén cocidas.', '6\n¡Ya están listas para comer las empanadas al horno sin carne! ¿Qué te ha parecido esta receta? Cuéntanos en los comentarios y no te pierdas a continuación más ideas de relleno sin carne.']",,2 comensales,30m,Plato principal,Dificultad baja,,"['Recomendada para perder peso', 'Receta sin lactosa', 'Receta sin sal', 'Recetas al horno', 'Recetas argentinas']","['1 lata de atún al natural', '1 cebolla', '¼ morrón rojo', '¼ morrón verde', '¼ morrón amarillo', '6 aceitunas', '1 cucharadita de orégano', '1 pizca de pimienta', '½ cucharadita de pimentón', '1 pizca de comino', '1 huevo (para pintar)']",https://www.recetasgratis.net/receta-de-empanadas-sin-carne-76209.html
Tarta de acelga y carne,"Las tartas son uno de los platos más versátiles y rendidores tanto para quienes viven en familia como para los que están solos. La posibilidad de rellenos es infinita y, en esta oportunidad, queremos mostrarte cómo hacer uno combinando acelgas y carne picada, verás que es muy sencillo y nutritivo. Si no te gusta la acelga o quieres probar otras versiones de esta tarta, recomendamos que pruebes combinando la carne con zanahoria, tomate, berenjena o calabaza y por qué no, combinando más de una. Desde el aspecto nutricional, la tarta cubre con las necesidades de hidratos de carbono y proteínas. Sin embargo, podemos evaluar distintas opciones de acompañamiento para que también cubra con el de vegetales, fibra, micronutrientes y dar volumen. No dejes de leer el apartado final para conocerlas.Sin más, te invitamos a continuar leyendo en RecetasGratis para aprender a cómo hacer tarta de acelga y carne. ¡A cocinar!","['1\nPara empezar con la preparación de la tarta de acelga y carne, pela y pica la cebolla junto al diente de ajo, para saltearlos con una cucharadita de aceite en una sartén antiadherente. Cuando la cebolla esté transparente, baja el fuego a medio-bajo y agrega una cucharada de agua caliente si se está secando. Repite cada vez que sea necesario hasta que la cebolla se caramelice.', '2\nCuando la cebolla esté cocida, retírala de la sartén y sube el fuego a máximo. Agrega la carne picada en dos o tres tandas para que se dore. Cuando esto pase, mezcla toda la carne en la sartén, junto con las hojas de acelga previamente lavadas. Saltéalas unos minutos para que tomen sabor y la carne picada termine de cocinarse.', '3\nRetira el relleno de carne y acelga del fuego y condiméntalo a gusto con el comino, la nuez moscada, el ají molido y la pimienta. Pruébalo y, si te gusta, añade el huevo. Por otro lado, prepara la masa de tarta en un molde engrasado y, si lo deseas, cubre la base con pan rallado, avena o polenta para que absorba la humedad del relleno y quede crocante.', '4\nRellena tu pastel de acelga y carne picada agregando el queso fresco cortado en tiras. También podrías rallarlo, sería aconsejable congelarlo previamente para que no se deshaga. En este caso, es una tarta de carne y verduras con masa simple, pero puedes cubrirla en este momento con una segunda masa.', '5\nHazle el cierre que más te guste a la tarta y cocínala en el horno precalentado a 200 °C -220 °C por unos 25 o 30 minutos hasta que la masa esté dorada y el queso gratinado.', '6\nSirve tu tarta de acelga sin tapa con una ensalada fresca, como en este caso, de tomate y pepino, que combina de maravilla y ¡a comer! ¿Qué te pareció esta receta? Cuéntanos en los comentarios.\nTruco: si lo deseas, puedes presentar diferentes tartitas de acelga y elaborar más de una.']",,4 comensales,45m,Plato principal,Dificultad baja,,"['Recomendada para perder peso', 'Receta sin lactosa', 'Receta sin sal', 'Recetas al horno']","['500 gramos de carne picada', '1 cebolla', '1 huevo', '1 diente de ajo', '30 hojas de acelga', '90 gramos de queso fresco', '1 cucharadita de comino', '1 cucharadita de nuez moscada', '1 pizca de pimienta', '1 pizca de ají molido']",https://www.recetasgratis.net/receta-de-tarta-de-acelga-y-carne-76312.html
Empanadas de roquefort y apio,"Las empanadas son una de las comidas preferidas de los argentinos. Después del asado, la empanada es su plato más característico. Además, disfrutan tanto elaborando la receta y degustándolas que todo el tiempo buscan crear nuevos rellenos. Asimismo, en esta oportunidad, vamos a compartirte una combinación perfecta: roquefort, apio y nuez. Es ideal para preparar cuando tienes poco tiempo, ya que no requiere precocinar el relleno y, por tanto, es más fácil y rápida de hacer.En RecetasGratis te enseñamos cómo hacer empanadas de roquefort y apio. Así que, sin perder más tiempo, ¡vamos a cocinar!","['1\nPara empezar con la receta de empanadas de roquefort y apio, primero enciende el horno para precalentarlo a temperatura máxima 200 ºC- 230 °C. A continuación, unta con aceite y enharina la asadera donde cocinarás las empanadas.', '2\nLava perfectamente y pica las ramas de apio, tanto el tallo como las hojas. Luego, reserva.\nTruco: te recomendamos elegir las ramas centrales, ya que son más tiernas.', '3\nPica las nueces un poquito gruesas para que se noten y reserva las empanadas de roquefort y nuez.', '4\nEn un recipiente, pisa el queso azul junto la mozzarella con un tenedor. Luego, agrega la harina y unifica con los quesos formando una especie de masa.\nTruco: puedes usar queso cremoso para reemplazar la mozzarella.', '5\nForma bolitas alargadas con la preparación de quesos y harina. Este procedimiento te ayudará a repartir de manera más proporcional los ingredientes para armar las empanadas de roquefort sin jamón.', '6\nDistribuye las tapas de empanada sobre la mesada y comienza a armarlas. A continuación, coloca una cucharada de apio en cada una y, luego, las bolitas de queso y las nueces. El orden es indistinto, lo importante es armarlas en serie para hacerlo más rápido y ordenado.', '7\nCierra las empanadas de roquefort y apio humedeciendo la mitad del borde de cada tapa con un poquito de agua. A continuación, cierra las empanadas superponiendo los bordes.\nTruco: humedece ligeramente los bordes porque si lo mojas demasiado, será más difícil pegarlos.', '8\nRealiza el repulgue que te guste y coloca las empanadas de queso y nueces sobre la placa. A continuación, píntalas con huevo batido y llévalas a horno fuerte durante 10-15 minutos o hasta que estén doradas.', '9\nCuando retires del horno las empanadas de roquefort y muzzarella, solo espera unos minutos antes de comerlas para no quemarte y poder disfrutar su exquisito sabor. ¡A comer! Cuéntanos en los comentarios tu opinión y comparte con nosotros una fotografía del resultado final.']",,6 comensales,45m,Plato principal,Dificultad baja,,"['Recomendada para vegetarianos', 'Receta sin azúcar', 'Recetas al horno']","['12 tapas de empanadas', '150 gramos de queso muzzarella', '50 gramos de queso roquefort', '30 gramos de nueces', '2 ramas de apio', '1 cucharada sopera de harina']",https://www.recetasgratis.net/receta-de-empanadas-de-roquefort-y-apio-76298.html
