title,intro,order,votes,comensales,duración,para,dificultad,coste,types,ingredientes,url
Receta FÁCIL y RÁPIDA,"Los bocoles son un antojito mexicano tradicional de la zona huasteca de muchas regiones de México, como Hidalgo, Puebla, San Luis Potosí, Veracruz, entre otros estados. Los bocoles son muy similares a las gorditas huastecas, estos se elaboran con un disco de masa grueso preparado con manteca y que se puede rellenar con diferentes ingredientes y guisados. Asimismo, en esta ocasión, te proporcionamos una receta sencilla para preparar unos bocoles combinando el sabor de un queso añejo o quesillo con una pasta de chile.En RecetasGratis te enseñamos cómo hacer bocoles de queso mexicanos. ¡A cocinar!","['1\nPara comenzar esta receta de bocoles de queso, en un recipiente coloca la masa de maíz, esta la puedes conseguir en tortillerías o en el supermercado, pero si lo prefieres, la puedes preparar con harina de maíz agregando agua tibia poco a poco hasta conseguir una masa manejable y firme. Combina manteca agregando e integrando poco a poco con la masa.', '2\nCuando la masa y la manteca estén integradas, agrega media taza de cilantro, puede ser picado finamente o conservar la hoja entera. A continuación, mezcla muy bien hasta integrar por completo, deja reposar mientras preparas el relleno.', '3\nPara el relleno tuesta un puñado de chiles secos, puede ser chile de árbol o chile cascabel, tuesta sin quemar. Luego, muele en un triturador o licuadora con un chorrito de agua para formar una pasta, también lo puedes hacer en un molcajete manualmente.', '4\nMezcla el queso desmoronado o rallado con la pasta de chile seco, puedes usar queso fresco, quesillo, queso panela, queso añejo o cotija, elige el que más te guste. Asimismo, mezcla muy bien hasta integrar, no es necesario agregar sal ni condimentos extra, pues bastará con la sal del propio queso.', '5\nPara armar los bocoles de queso, toma una porción de masa de más o menos el tamaño de tu palma de la mano, boléala un poco y forma una especie de cuenco para rellenar con la mezcla de queso y chile.', '6\nCierra el bocol con la misma masa envolviendo el relleno, presiona ligeramente y termina de formar el disco de masa, no debe quedar muy delgado, si queda de unos 1 a 1.5 centímetros está perfecto.', '7\nLleva los bocoles de queso a un comal o sartén caliente, mantén a una temperatura media y cocínalos durante unos 2 o 3 minutos por lado vigilando que no se quemen.', '8\nCuando estén cocidos los bocoles de queso, ya los podrás servir. ¡A comer!']",,6 comensales,30m,Plato principal,Dificultad baja,,['Recetas mexicanas'],"['500 gramos de masa de maíz nixtamalizado', '200 gramos de manteca de cerdo o manteca vegetal', '1 cucharadita de sal', '1 puñado de chiles secos', '300 gramos de queso desmoronado fresco', '1 rama de cilantro']",https://www.recetasgratis.net/receta-de-bocoles-de-queso-76129.html
Receta TRADICIONAL,"Los bocoles son un antojito mexicano tradicional de la zona Huasteca, como Hidalgo, Puebla, San Luis Potosí, Veracruz, entre otros estados. Se trata de un disco de masa grueso muy similar a las gorditas huastecas, estos se preparan con manteca, que puede ser de cerdo, vegetal e incluso de res. También se puede rellenar con diferentes ingredientes y guisados, por ejemplo, son muy populares los bocoles de queso y los bocoles de frijol. Sin embargo, en esta ocasión, te mostramos cómo preparar la base para unos bocoles huastecos.En RecetasGratis te enseñamos cómo hacer bocoles huastecos. ¡Descubre el tradicional sabor!","['1\nPara hacer la receta de bocoles huastecos, primero en un recipiente bate la manteca, que puede ser de cerdo, res o vegetal, con la cucharadita de sal. Debes batir hasta cremar y hasta que se haya aclarado ligeramente.\nTruco: puedes batir manualmente o bien con una batidora eléctrica.', '2\nAñade la manteca poco a poco en el mismo recipiente con la masa de maíz nixtamalizado. A continuación, mezcla muy bien hasta que se integren los ingredientes por completo.\nTruco: recomendamos agregar poco a poco la manteca e ir mezclando con las manos o con una batidora, así evitaremos que queden grumos grandes.', '3\nAgrega media taza de cilantro finamente picado, si lo prefieres, también puedes usar el cilantro solamente troceado o solo las hojas. A continuación, mezcla muy bien hasta que se integren por completo todos los ingredientes. Además, si observas que la masa está muy seca, puedes agregar un chorrito de agua tibia o caldo de pollo y, luego, dejar reposar mientras continúas con la receta.', '4\nPara el relleno vamos a preparar un pollo a la mexicana. Para ello, corta en trocitos el pollo, que puede ser en fajitas o pechuga, incluso puedes usar desmenuzado ya cocido. Si decides utilizar pollo desmenuzado y al momento de cocinar quieres agregar sazón, añade unas hojitas de laurel y un par de clavos de olor.', '5\nEn una sartén calienta 2 cucharadas de aceite vegetal y añade la cebolla, el jitomate, el chile serrano y el pollo picado. Asimismo, agrega un poco de sal y cocina moviendo constantemente durante 5-7 minutos, cuando esté listo, retira del fuego y reserva.', '6\nPara hacer los bocoles huastecos toma una porción de la masa preparada más o menos del tamaño de la palma de tu mano. A continuación, bolea un poco para después aplanar ligeramente y comenzar a proporcionar forma de disco o gordita, debe quedar de un grosor de aproximadamente 1.5 cm a 2 cm.\nTruco: también puedes usar una prensa para tortillas y solo presionar un poco para obtener el grosor deseado.', '7\nSobre un comal o una sartén caliente, cocina los bocoles por cada lado durante unos 2-3 minutos. Asimismo, mantén la sartén a una temperatura media baja para que el bocol se cocine uniformemente y no quede masa cruda. El bocol estará listo cuando el centro se vea ligeramente tostado.', '8\nPara armar el bocol huasteco, toma uno de los bocoles cocidos en el comal o sartén y parte por la mitad con un cuchillo. A continuación, rellena con el guiso de pollo a la mexicana que preparaste. ¡Listo para comer! Cuéntanos en los comentarios tu opinión y comparte con nosotros una fotografía del resultado final.']",,6 comensales,30m,Entrante,Dificultad baja,,"['Recetas mexicanas', 'Recetas poblanas']","['500 gramos de masa de maíz nixtamalizada', '150 gramos de manteca de cerdo o vegetal', '1 cucharadita de sal', '½ taza de cilantro picado', '300 gramos de pollo', '1 jitomate picado', '½ cebolla picada', '2 chile serrano picado']",https://www.recetasgratis.net/receta-de-bocoles-huastecos-76147.html
Arepa de choclo,"Las arepas son denominadas como el pan nativo en América Latina, especialmente en Venezuela y Colombia. Originariamente, estaban elaboradas con una masa de maíz asado, sin embargo, dado su salto al continente europeo, se añadieron otros productos lácteos, tales como la leche, la mantequilla o el queso. Asimismo, debes saber que, actualmente, existen unas 70 variedades de arepas, todas ellas con diferentes cocciones, ingredientes, utensilios y variados rellenos. En esta ocasión, mostramos una arepa de choclo colombiana realmente deliciosas con su sabor intenso a maíz y algo dulzonas.En RecetasGratis te enseñamos cómo hacer arepa de choclo con este paso a paso. ¡Manos a la obra!","['1\n¿Te preguntas cómo hacer arepas de maíz colombianas o venezolana? Pues bien, para hacer la receta de las arepas de choclo, primero coloca los granos de maíz cocidos en el vaso de la batidora junto con la leche, tritura hasta conseguir una papilla.', '2\nEn un bol coloca la harina de maíz, el azúcar y una pizca de sal. Mezcla con una cuchara.\nTruco: en este punto, puedes añadir queso rallado para enriquecer más la masa.', '3\nIncorpora la papilla de maíz y leche a la harina, mezcla bien con la cuchara.', '4\nCoge una pequeña porción con las manos para formar las arepas.\nTruco: la masa quedará algo más blanda que la plastilina.', '5\nCalienta una sartén y funde la mantequilla en ella. Cuando ya esté fundida, añade las arepas que has formado con las manos. A continuación, deja que se doren las arepas de choclo por un lado y, después, proporciona la vuelta para que se doren por el otro. Tardarán unos 2 minutos por cada lado aproximadamente.', '6\nSirve las arepas de choclo con queso enseguida bien calientes. ¡Verás qué delicioso queda y cuántas combinaciones admite para acompañar estas arepas! Anímate a prepararlas en casa y cuéntanos qué tal han resultado. Además, si quieres conocer más variedades de arepas, no te pierdas este artículo sobre los Tipos de arepas.Espero que te haya gustado la receta y te invito a que visites mi blog Cakes para ti.']",,4 comensales,30m,Desayuno,Dificultad baja,,['Recetas colombianas'],"['300 gramos de granos de maíz dulce cocido (2 tazas)', '100 mililitros de leche (1/2 taza)', '150 gramos de harina de maíz amarilla para las arepas (1 taza)', '25 gramos de panela rallada (1/4 taza)', '1 pizca de sal', '2 cucharadas soperas de mantequilla']",https://www.recetasgratis.net/receta-de-arepa-de-choclo-76126.html
Canastitas de calabaza,"La calabaza es uno de los vegetales más utilizados en las dietas de quienes buscan bajar de peso o comer de forma saludable, aunque muchas veces la única opción para consumir sea en puré acompañando un churrasquito de pollo. Sin embargo, es un vegetal muy versátil que podemos incluirlo en una infinidad de preparaciones dulces y saladas. Por ello, en esta oportunidad queremos enseñarte a preparar unas canastitas de calabaza, muy similares a las empanadas de calabaza, para que puedas usar como vianda en el colegio, trabajo o como cena liviana y saludable. Al final de la elaboración te proporcionamos algunas ideas para acompañarlas para que completes tu plato.En RecetasGratis te enseñamos cómo hacer canastitas de calabaza. ¡Vamos allá!","['1\nPara empezar con la receta de canastitas de calabaza, primero pela y corta la calabaza en cubos. Recomendamos que uses un pela papa para quitar la cáscara sin desperdiciar parte del vegetal, como bien ocurre cuando la pelamos con una cuchilla.', '2\nCocina la calabaza en el microondas en un recipiente apto y tapado durante unos 15 minutos, añade también 1 diente de ajo pelado. Si no dispones de microondas, puedes cocinarla al vapor por aproximadamente el mismo tiempo. Con cualquiera de los dos métodos, mantendrás todos los nutrientes de la calabaza. En cambio, si la hierves, se perderán algunos en el agua.', '3\nCuando la calabaza esté cocida, písala junto con el diente de ajo para hacer un puré. A continuación, condimenta al gusto con la nuez moscada, la pimienta y la crema o el queso crema. Pruébalo y asegúrate que te gusta el sabor.\nTruco: si lo deseas, puedes añadir choclo y elaborar unas exquisitas canastitas de calabaza y choclo.', '4\nCubre un molde para muffins con las tapas de empanada para formar las canastitas.\nTruco: si no dispones de estos moldes, puedes forrar la base de una lata limpia con la tapa de empanada y cocinarla durante 5 minutos en el horno. Cuando esté ligeramente crocante, podrás retirarla y rellenarla para calentarla con el relleno.', '5\nRellena las canastitas con el puré de calabaza y, si deseas agregar queso, haz un pequeño hueco en el centro.', '6\nAgrega el queso fresco cortado en cubitos y cocina tus canastitas de calabaza en el horno precalentado a 200 ºC o 220 ºC durante unos 12-15 minutos hasta que la masa esté ligeramente dorada.', '7\n¡A comer las deliciosas canastitas de calabaza! Cuéntanos en los comentarios tu opinión y comparte con nosotros una fotografía del resultado final.']",,3 comensales,30m,Plato principal,Dificultad baja,,"['Recomendada para vegetarianos', 'Recomendada para perder peso', 'Receta sin sal', 'Recetas al horno']","['12 discos de empanada', '6 rodajas de calabaza', '1 diente de ajo', '1 cucharada sopera de crema o queso crema', '1 cucharadita de nuez moscada', '1 pizca de pimienta', '60 gramos de queso fresco (opcional)']",https://www.recetasgratis.net/receta-de-canastitas-de-calabaza-76121.html
Receta FÁCIL y SALUDABLE,"Las canastitas de hojaldre son una versión abierta de las empanadas, sin embargo, son mucho más fáciles de preparar, ya que no corremos el riesgo de que exploten en el horno como pasa con los rellenos húmedos de verdura, carne, queso, etc. Por ello, en esta oportunidad, queremos enseñarte a preparar unas ricas y saludables canastitas de acelga. Ideales para llevar como vianda al colegio, trabajo o facultad, gracias a su practicidad. Además, al final de la receta te proporcionaremos otras ideas de rellenos para que puedas alternar y no aburrirte.En RecetasGratis te enseñamos cómo hacer canastitas de acelga fáciles y saludables. ¡A cocinar!","['1\nPara empezar con la receta de las canastitas rellenas de verduras, primero pela y pica la cebolla para saltearla en una sartén a fuego máximo con una cucharadita de aceite. Cuando esté transparente, baja el fuego al medio y, si es necesario, agrega una cucharada de agua caliente para despejarla del fondo. Repite unas 2 o 3 veces para que se cocine.', '2\nMientras, lava y pica las hojas de acelga.', '3\nCuando las cebollas estén cocidas, sube el fuego al máximo y agrega las hojas de acelga limpias y picadas. Saltéalas durante 1 minuto y apaga el fuego. No las saltees más tiempo o empezarán a liberar mucho líquido y tus canastas con masa de empanadas quedarán demasiado húmedas. Reserva la mezcla mientras se enfría.', '4\nDisuelve la maicena en la leche fría y caliéntala 30 segundos en el microondas, remueve y repite unas 2 o 3 veces hasta que la salsa blanca esté espesa. Si no tienes microondas, puedes cocinarla en una olla chica sobre la hornalla a fuego medio mientras mezclas durante unos 3 o 5 minutos. Cuando esté lista, condiméntala al gusto con la nuez moscada, pimienta y provenzal.', '5\nMezcla la salsa blanca con las verduras salteadas.', '6\nDispón las tapas de empanadas de verdura en un molde para muffins para formar las canastitas.', '7\nRellena las canastitas con el relleno de acelga.', '8\nSi lo deseas, puedes añadir un cuadradito de queso fresco en el centro para agregar más proteínas a este plato, así como sabor. A continuación, cocínalas en el horno precalentado a 200 ºC o 220 ºC durante unos 12 a 15 minutos hasta que la masa esté ligeramente dorada.', '9\n¡A comer las deliciosas canastitas de verdura! Cuéntanos en los comentarios tu opinión y comparte con nosotros una fotografía del resultado final.']",,3 comensales,30m,Plato principal,Dificultad baja,,"['Recomendada para vegetarianos', 'Recomendada para perder peso', 'Receta sin sal', 'Recetas al horno']","['12 discos de empanada', '10 hojas de acelga', '1 cebolla', '½ taza de leche (120 mililitros)', '1 cucharada sopera de maicena', '1 cucharadita de nuez moscada', '1 pizca de pimienta', '½ cucharadita de provenzal', '60 gramos de queso fresco (opcional)']",https://www.recetasgratis.net/receta-de-canastitas-de-acelga-76120.html
Receta FÁCIL y RÁPIDA,"Las empanadas se elaboran con masa rellena y con variedad de ingredientes, esta preparación se cierra por distintos tipos de repulgues. En general, las masas son bastante calóricas y están hechas con grasas no muy saludables, como manteca o margarina, ambas fuente de grasas saturadas. Además, suelen ser de harina de trigo blanca, asimismo, puede ser contraproducente para quienes tienen diabetes. Es por eso que, en esta oportunidad, queremos enseñarte a hacer masa integral para empanadillas de verduras. Asimismo, aportarán las mismas calorías, pero el doble de fibra.En RecetasGratis te enseñamos cómo hacer empanadas integrales fáciles. ¡A cocinar!","['1\nPara empezar con la receta de las empanadas integrales, primero vuelca en una mesada limpia la harina con la pizca de sal y los condimentos que desees. En este caso, no hemos agregado ninguno y están exquisitas, sin embargo, puedes saborizarlas con comino, cúrcuma, pimentón, orégano o pimienta. También puedes mezclar la harina integral con la blanca para que el resultado sea un poco menos crocante.', '2\nMezcla los ingredientes secos y elabora un hueco en el centro para añadir el resto de los ingredientes.', '3\nEn el centro incorpora casi toda el agua fría.\nTruco: reserva un poco de agua por las dudas que tu harina no necesite tanta y no tengas que corregir con más harina.', '4\nIncorpora el aceite y empieza a integrar del centro hacia afuera para amasar y formar una masa integral para empanadas. Asimismo, si la masa light para empanadas necesita más humedad, puedes mojarte las manos y continuar amasando hasta lograr un bollo.', '5\nReserva el bollo de la masa para empanadas con harina integral tapado mientras preparas el relleno.', '6\nPara el relleno, pela y pica la cebolla para saltearla con 1 cucharadita de aceite en una sartén a fuego fuerte. Cuando esté transparente, baja el fuego al medio y remueve cada tanto para bajar la temperatura y que no se queme. Si se está pegada, puedes agregar 1 cucharada de agua para despegarla.', '7\nMientras, lava y pica las hojas de la acelga.', '8\nCuando la cebolla esté cocida, sube el fuego al máximo y agrega la acelga que has picado. Solo saltéala durante 1 minuto y apaga el fuego. Si la cocinas demasiado, soltará mucho líquido y puede que tus empanadas exploten en el horno, además que será difícil rellenarlas. A continuación, reserva estas verduras para que se enfríen.', '9\nMezcla la leche fría con las cucharadas de maicena y calienta en el microondas durante 30 segundos, remueve y repite 3 veces hasta que espese.', '10\nCondimenta tu salsa blanca al gusto con nuez moscada, pimienta y provenzal.', '11\nMezcla las verduras que habías salteado con la salsa blanca y ya tendrás listo tu relleno para las empanadas integrales.', '12\nEstira la masa unos 3 milímetros de alto como máximo.', '13\nCorta las tapas del tamaño que desees, recomendamos unos 10-12 centímetros de diámetro.', '14\nRellena las empanadas con una cucharada de la preparación de acelga y ciérralas, humedeciendo la mitad del disco y ejerciendo algo de presión para juntar ambos lados. Puedes hacer el clásico repulgue o cerrarlas con un tenedor. A continuación, disponlas en una asadera previamente engrasada con el cierre hacia arriba.', '15\nCocina tus empanadas integrales de verduras en el horno precalentado a 200 ºC-220 ºC durante 15 minutos o hasta que la masa de harina integral esté ligeramente dorada. ¡A comer! Cuéntanos en los comentarios tu opinión y comparte con nosotros una fotografía del resultado final.\nTruco: º']",,3 comensales,45m,Plato principal,Dificultad baja,,"['Recomendada para vegetarianos', 'Recomendada para perder peso', 'Receta sin azúcar', 'Receta sin sal', 'Recetas al horno', 'Recetas argentinas']","['1 taza de harina integral (150 gramos)', '⅓ taza de agua fría', '1 cucharada sopera de aceite', '1 pizca de sal (opcional)', '10 hojas de acelga', '1 cebolla', '⅓ taza de leche', '2 cucharadas soperas de maicena', '1 pizca de pimienta']",https://www.recetasgratis.net/receta-de-empanadas-integrales-76117.html
Empanadas de roquefort,"Como muchos otros ingredientes en la historia de la cocina, el queso azul surgió de forma inesperada. Se explica que un quesero dejó una barra a medio comer en una cueva y al volver, había generado moho por las condiciones del lugar. Asimismo, se transformó el queso en lo que hoy conocemos como roquefort. Se denomina este nombre gracias al lugar homónimo de Francia donde sucedieron estos hechos. En esta oportunidad, queremos enseñarte a utilizar este delicioso queso para el relleno de unas empanadillas. Lo combinaremos con un poco de queso fresco y cebollas para aligerar un poco el sabor, que es muy intenso.En RecetasGratis te enseñamos cómo hacer empanadas de roquefort fáciles y rápidas. ¡A cocinar!","['1\nPara empezar con la receta de empanadas de roquefort, primero pela y pica la cebolla. Debes saber que la elaboraremos caramelizada para generar contraste con el sabor fuerte del queso. Para ello, saltea la cebolla en una sartén bien caliente con 1 cucharadita de aceite y 1 de manteca. Cuando esté transparente, baja el fuego al medio y, si se pega, agrega 1 cucharada de agua caliente.', '2\nSi se pega, repite el procedimiento agregando 1 cucharada de agua caliente para que se despegue del fondo, pero no en exceso para que se hierva. Repite unas 4 o 5 veces hasta que esté bien dorada, como ves en la imagen. En ese momento, sube el fuego al máximo y, cuando la sartén esté caliente, agrega el vino blanco. Cuando sientas un olor dulce, en lugar de ácido por el alcohol, retira las cebollas del fuego y resérvalas.', '3\nPrepara una salsa blanca sencilla disolviendo la maicena en la leche fría. A continuación, caliéntala en el microondas 30 segundos removiendo o en una ollita a fuego medio hasta que espese. Debe quedar bien consistente como ves en la imagen. Resérvala para que se enfríe.\nTruco: si no consumes leche, puedes elaborar la salsa con agua, ya que solo buscamos una preparación que una el relleno de las empanadas de roquefort.', '4\nMezcla el queso mozzarella con el queso fresco.', '5\nAñade la salsa blanca fría, los condimentos (nuez moscada y orégano) y las cebollas caramelizadas.', '6\nRellena tus empanadillas de queso roquefort humedeciendo previamente los bordes del disco. A continuación, ejerce algo de presión y proporciona la forma que desees, por ejemplo, une las dos puntas para dar forma redondeada.', '7\nLleva las empanadas de cebolla y queso roquefort a una asadera previamente engrasada y, a continuación, píntalas con el huevo ligeramente batido para que se doren. Cocínalas en el horno precalentado a 200 ºC - 220 ºC durante unos 20 minutos hasta que adquieran un lindo color.\nTruco: no abras el horno hasta que estén doradas, por el contrario, el aire frío podría hacer que exploten.', '8\nPasado el tiempo, sirve las empanadas de roquefort. ¡A comer! Cuéntanos en los comentarios tu opinión y comparte con nosotros una fotografía del resultado final.']",,2 comensales,45m,,Dificultad baja,,[],"['6 discos de empanada', '100 gramos de queso mozzarella', '40 gramos de roquefort', '1 cucharadita de aceite', '1 cucharadita de manteca', '1 cebolla chica', '1 cucharadita de orégano', '1 cucharadita de nuez moscada', '½ taza de leche (120 mililitros)', '1 cucharada sopera de maicena', '25 centímetros cúbicos de vino dulce', '1 huevo (para pintar)']",https://www.recetasgratis.net/receta-de-empanadas-de-roquefort-76107.html
