title,intro,order,votes,comensales,duración,para,dificultad,coste,types,ingredientes,url
Empanadas de calabaza y queso,"La calabaza es de los vegetales más gustosos, además de ricos y versátiles. Además, no solo podemos utilizarla para preparaciones saladas, como es el caso de la receta que compartimos a continuación, sino que también podemos utilizarla para recetas dulces. Asimismo, si tienes ganas de utilizarla para preparaciones saladas, ideales para almuerzos o cenas livianas, entonces no querrás dejar de hacer esta receta de empanadas de calabaza y queso. Elaboramos un relleno sencillo, apto para quienes no son expertos en la cocina, pero quieren comer de forma saludable y casera.En RecetasGratis te enseñamos cómo hacer empanadas de calabaza y queso fáciles y rápidas. ¡A cocinar!","['1\nPara empezar con la receta de las empanadas de calabaza y queso, primero deberás cocinar la calabaza. Para hacerlo, tienes diferentes opciones. Una de las opciones consiste en pelarla, cortarla en cubos y hervirla durante 20 minutos hasta que al pincharla se caiga del tenedor. Al final de la receta puedes encontrar otras formas de cocinar la calabaza.', '2\nCuando esté cocida, llévala a un colador con un recipiente debajo para colarla y que libere el agua que haya podido absorber. Tanto este líquido como el que has utilizado para hervir la calabaza, tiene numerosos nutrientes, así que querrás guardarlo para un fondo de cocción o caldo.\nTruco: obviar este paso puede hacer que tu relleno quede muy húmedo y se abran tus empanadas. Al final de la receta encontrarás otras formas de cocinar la calabaza donde absorbe menos humedad.', '3\nPisa la calabaza y condiméntala al gusto con la nuez moscada, pimienta, provenzal y mostaza. Estos son solo algunos ingredientes que puedes utilizar para saborizarla, pero si es de tu preferencia, puedes elegir más bien tomillo, romero, orégano, comino o ají molido si te gustan los picantes, entre otros. Prueba el relleno y corrige el sabor si es necesario.\nTruco: al combinarlo con la masa perderá un poco de sabor, así que asegúrate de que quede bien sabroso e intenso.', '4\nCuando el relleno esté listo, procede a rellenar las empanadillas de calabaza al horno. Para ello, toma una cucharada del puré y ubícala en el centro del disco de masa. Humedece un poco los bordes para que se sellen bien al cerrarlos y, a continuación, agrega un cubo de queso en el centro. Cierra la empanada y proporciona la forma que te guste para llevarla a una asadera previamente engrasada.', '5\nPinta las empanadillas de calabaza salada con el huevo batido y cocínalas en el horno precalentado a 200 ºC - 220 ºC durante unos 20 minutos o hasta que estén doradas.\nTruco: puedes cocinarlas unos 3-5 minutos en la parrilla para que el dorado y el crocante de la masa sea más intenso.', '6\nCuando estén listas las empanadas de zapallo y queso, ya podrás disfrutarlas durante un almuerzo o cena liviana saludable y deliciosa. ¡A comer! Cuéntanos qué te ha parecido esta receta en los comentarios.']",,2 comensales,45m,Plato principal,Dificultad muy baja,,"['Recomendada para vegetarianos', 'Recomendada para perder peso', 'Receta sin sal', 'Recetas al horno', 'Recetas argentinas']","['400 gramos de calabaza', '60 gramos de queso fresco', '6 tapas de empanada', '1 cucharada sopera de mostaza', '1 cucharada postre de nuez moscada', '1 cucharadita de provenzal', '1 pizca de pimienta', '1 huevo (para pintar)']",https://www.recetasgratis.net/receta-de-empanadas-de-calabaza-y-queso-76201.html
Empanadas de pollo fritas,"Las empanadas de pollo, junto a las de carne y jamón y queso, son de las más clásicas argentinas. Su cocción frita aporta un sabor inigualable, manteniendo toda la humedad del relleno y dando como resultado una masa para empanadas de pollo crocante. Por supuesto que no es la opción más saludable, sin embargo, también puedes incorporarse en el menú de vez en cuando. Sin embargo, es importante tener en cuenta que, en el marco de una alimentación balanceada, el consumo eventual es más que saludable si a uno le gusta.En esta oportunidad, junto a Recetas Gratis, te mostramos cómo hacer empanadas de pollo fritas con un estilo portugués, sin embargo, si lo prefieres, podrás hacer el relleno combinando el pollo con salsa blanca, verdeo, hongos y calabaza, entre otras opciones. ¡A cocinar!","['1\n¿Te preguntas cómo hacer empanadas fritas de pollo? Pues bien, para empezar con la receta de las empanadas de pollo fritas, cocina el pollo en abundante agua con vegetales, como por ejemplo con zanahoria, calabaza, ajo, acelga, apio y condimentos, como laurel y tomillo. Previamente, deberás limpiar las verduras y pelarlas, como es el caso de la zanahoria, calabaza y ajo. También debes limpiar el apio y la acelga. Hierve durante unos 30 minutos.\nTruco: si no tienes estas verduras, puedes utilizar las que dispongas para hacer el caldo. Aquí buscamos proporcionar sabor al pollo. Reserva el caldo para hacer una rica sopa casera.', '2\nPela y pica la cebolla para saltearla con la cucharada de manteca en una sartén a fuego máximo hasta que esté transparente. Añade también la parte blanca del verdeo y el diente de ajo picado.\nTruco: si deseas reducir un poco las grasas saturadas de esta receta, puedes reemplazar en este punto la manteca por aceite.', '3\nCuando la cebolla esté transparente, agrega los morrones lavados y picados, sin las nervaduras blancas ni las semillas. A continuación, baja el fuego a medio-bajo y sigue salteando hasta que estén bien cocidas. Cuando estén bien cocidas, sube el fuego al máximo y agrega el vino blanco. Retira del fuego cuando sientas olor dulce, en lugar de ácido.', '4\nPasado el tiempo de cocción del pollo, desméchalo con ayuda de dos tenedores. Como la cocción en fritura es muy corta, asegúrate de que el pollo está bien cocido, pero húmedo.', '5\nMezcla el pollo con las verduras salteadas, la pizca de pimienta, la barbacoa y el tomate. En este caso, es tomate perita, pelado de lata pisado, pero puedes usar tomate rallado o reemplazarlo por puré de tomate. Prueba el relleno y corrobora el sabor. Si lo ves necesario, corrige con condimentos al gusto, como ají molido, tomillo o pimentón.', '6\nRellena las empanadas agregando una cucharada de la preparación del pollo en el centro del disco y mojando una mitad del borde para que, al cerrarlo, se selle perfectamente. Con ayuda de las yemas de los dedos, haz el repulgue o cierre que más te guste y resérvalas. A continuación, llévalas al congelador para que estén bien frías a la hora de cocinarlas.', '7\nCalienta el aceite a 160 ºC- 180 ºC y cocina las empanadas durante unos 2-4 minutos, asegurándote de que se doran por todos los lados. Puedes ayudarte a girarlas con una pinza cuidadosamente para que no se rompan. A medida que retires las empanadas del aceite, llévalas a un plato con papel absorbente para retirar el exceso del mismo.', '8\nY ahora sí, ya puedes comer las deliciosas empanadillas fritas de pollo. Cuéntanos que te ha parecido esta receta, ¡te animamos a hacerla!']",,4 comensales,1h 30m,Plato principal,Dificultad media,,"['Receta sin lactosa', 'Receta sin sal', 'Recetas argentinas']","['12 discos de empanada', '1 suprema de pollo', '1 cebolla', '1 cucharada sopera de manteca', '¼ morrón verde', '¼ morrón rojo', '¼ morrón amarillo', '25 centímetros cúbicos de vino blanco', '2 ramas de verdeo', '1 pizca de pimienta', '1 diente de ajo', '1 cucharada sopera de barbacoa', '4 cucharadas soperas de tomate pisado', '1 zanahoria', '1 rodaja de calabaza', '1 diente de ajo', '1 rama de apio', '3 hojas de acelga']",https://www.recetasgratis.net/receta-de-empanadas-de-pollo-fritas-76187.html
Empanadas de pollo y salsa blanca,"Si quieres disfrutar de unas empanadas con un relleno sabroso, húmedo, cremoso y fácil de hacer, entonces quédate leyendo, porque a continuación te mostraremos cómo hacer unas empanadas con todas estas características. Se trata de un relleno de pollo con salsa blanca y cebolla que seguro no querrás dejar de probar. Además, puedes hacer las empanadas de pollo de esta forma o bien con un estilo más bien a la portuguesa, es decir, con morrones y tomate. Ambas son deliciosas, así que te animamos a probarlas y alternar o elegir tu preferida. También puedes cocinarlas al horno, como verás en esta receta. ¿Qué te parece si empezamos a cocinar?Asimismo, en RecetasGratis te enseñamos cómo hacer empanadas de pollo y salsa blanca.","['1\n¿Te preguntas cómo hacer empanadas de pollo jugosas? Para empezar con la receta de las empanadas de pollo y salsa blanca, primero cocina la proteína en abundante agua con vegetales para hacer un caldo casero. En este caso, hemos utilizado zanahoria, acelga, calabaza, ajo, apio y condimentos, como laurel y tomillo. Previamente, deberás limpiar las verduras y pelarlas. A continuación, hierve durante unos 20-30 minutos.\nTruco: si no dispones de estas verduras, puedes utilizar las que tengas para hacer el caldo. Aquí buscamos proporcionar sabor al pollo. A continuación, reserva el caldo para hacer una rica sopa casera.', '2\nPela y pica la cebolla para saltearla junto con la parte blanca del verdeo. También debes añadir el ajo picado en una sartén a fuego máximo con una cucharada de manteca, hasta que esté transparente. En este momento, retírala del fuego y resérvala mientras preparas el resto del relleno.\nTruco: si deseas hacer un relleno más saludable, puedes reemplazar en este punto la manteca por aceite.', '3\nPrepara la salsa blanca para tu relleno. Para ello, calienta la segunda cucharada de manteca con la cucharada de harina de trigo en una olla a fuego medio, hasta que la harina tome un color ligeramente dorado.', '4\nEn este momento, agrega la leche y remueve hasta que espese. Verás que de esta forma obtendrás una salsa blanca, cremosa y sin grumos. A continuación, cuando esté lista, retírala del fuego y condiméntala con nuez moscada y pimienta. Reserva.', '5\nPasado el tiempo de cocción del pollo, desméchalo con ayuda de dos tenedores, como observas en la imagen. Ten en cuenta que cocinarás las empanadas de pollo y salsa blanca unos 20 minutos en el horno. Por tanto, si no lo ves del todo cocido, no te preocupes, terminará de elaborarse en el horno.', '6\nMezcla el pollo con las verduras salteadas, la salsa blanca y la parte verde del verdeo. Si el pollo estaba bien cocido, prueba el relleno y corrobora el sabor. Además, si es necesario, corrige con condimentos al gusto, como ají molido, tomillo, pimienta, sal y ajo en polvo.', '7\nRellena tus empanadas jugosas de pollo y salsa blanca cuando la preparación esté bien fría. A continuación, añade una cucharada de la misma en el centro y humedece la mitad del borde para que, al cerrarlo, se selle bien y no salga el relleno durante la cocción. Haz el clásico repulgue de empanada de pollo, que consiste en hacer pequeños pellizcos de masa, como ves en la imagen. Luego, dispón las empanadas con salsa blanca en la asadera previamente engrasada con dicho cierre hacia arriba.', '8\nPinta las empanadas de pollo con huevo batido. Seguido, cocínalas en el horno precalentado a temperatura máxima, exactamente a 200 ºC-220 ºC durante unos 20 minutos o hasta que la masa esté bien dorada.\nTruco: puedes cocinarlas unos 2-3 minutos en la parrilla del horno para que la masa reciba más calor directo y se dore mejor.', '9\n¡Ya puedes comer las deliciosas empanadas de pollo con salsa blanca! Cuéntanos en los comentarios tu opinión y comparte con nosotros una fotografía del resultado final.']",,3 comensales,1h 30m,Plato principal,Dificultad baja,,"['Recetas al horno', 'Recetas argentinas']","['12 discos de empanada', '1 suprema de pollo', '1 cebolla', '2 cucharadas soperas de manteca', '1 cucharada sopera de harina', '1 taza de leche (240 mililitros)', '1 cucharada postre de nuez moscada', '1 pizca de pimienta', '2 ramas de cebolla de verdeo', '1 huevo para pintar', '1 zanahoria', '1 rama de apio']",https://www.recetasgratis.net/receta-de-empanadas-de-pollo-y-salsa-blanca-76189.html
Receta FÁCIL y DELICIOSA,"La carne de osobuco es una de las más ricas gracias a los cartílagos y a la grasa intramuscular, que aporta un sabor mucho más intenso que las carnes magras, que no contienen esta grasa. Cuando la utilizamos para elaborar el relleno de empanadas, obtenemos un resultado jugoso y sabroso para chuparse los dedos. Asimismo, a continuación observarás cómo elaborarlas en simples pasos detallados con imágenes. Además de esta opción, te enseñaremos otra elaboración para que elijas tu preferida y puedas prepararlas para disfrutarlas en una cena en tu casa o en compañía.Por ello, en RecetasGratis te enseñamos cómo hacer empanadas de osobuco fáciles y rápidas. ¡A cocinar!","['1\nPara empezar con la receta de las empanadas de osobuco, primero cocina la carne en un rico caldo saborizado con verduras. En este caso, hemos utilizado zanahoria, calabaza, ajo, acelga, apio y condimentos, como laurel y tomillo. Previamente, deberás limpiar las verduras y pelarlas, como es el caso de la zanahoria, la calabaza y el ajo. También debes limpiar el apio y la acelga. A continuación, hierve durante unos 60 minutos para que la carne esté bien tierna. Si tienes olla a presión, también será ideal utilizarla para reducir el tiempo.\nTruco: si no dispones de estas verduras, puedes utilizar las que tengas para hacer el caldo. Aquí buscamos proporcionar sabor a la carne. A continuación, reserva el caldo para hacer una rica sopa casera.', '2\nMientras, prepara el salteado de vegetales para proporcionar más sabor y humedad al relleno. Para ello, pela y pica la cebolla y el ajo. También lava y pica la parte blanca del verdeo para saltear todas las verduras con la cucharada de manteca, debes añadirlas en una sartén a fuego máximo hasta que esté transparente.', '3\nCuando esté transparente, agrega los morrones lavados y picados sin las nervaduras blancas ni semillas. A continuación, baja el fuego al medio-bajo y continúa salteando hasta que estén cocidas y tiernas. Luego, sube el fuego a máximo, agrega el vino blanco y saltea hasta que el olor cambie de ácido a dulce. Así sabrás que el alcohol se ha evaporado. Retira del fuego y reserva.', '4\nPasado el tiempo de cocción de la carne, córtala en cubos pequeños retirando los cartílagos más duros para que no sea incómodo comer las empanadas.', '5\nMezcla la carne con las verduras salteadas, la parte verde del verdeo salteada, la barbacoa y los condimentos, como pimienta, orégano, comino y nuez moscada. Asimismo, prueba el relleno y corrobora el sabor. Si es necesario, corrige con condimentos al gusto.', '6\nEnciende el horno a 200 ºC-220 ºC y empieza a rellenar tus empanadas. Asimismo, agrega una cucharada de la preparación de osobuco en el centro del disco y moja una mitad del borde para que, al cerrarlo, se selle perfectamente. A continuación, con ayuda de las yemas de los dedos, haz el repulgue y ubica las empanadas en una asadera previamente engrasada con el cierre hacia arriba.', '7\nPinta las empanadas de osobuco con el huevo batido y, a continuación, cocínalas en el horno precalentado a 200 ºC-220 ºC durante unos 20 minutos o hasta que estén doradas. Además, si lo deseas, puedes llevarlas los últimos minutos a la parrilla del horno para que reciban más calor en la parte superior y se dore la masa.', '8\n¡Ya puedes comer las deliciosas empanadas de osobuco! A continuación, comentaremos otra forma de cocinarlas para que puedas elegir tu preferida, pero ciertamente vale la pena probar este relleno de empanada con una carne tan sabrosa, te encantará. Cuéntanos en los comentarios tu opinión y comparte con nosotros una fotografía del resultado final.']",,3 comensales,1h 30m,Plato principal,Dificultad baja,,"['Receta sin lactosa', 'Receta sin sal', 'Recetas al horno', 'Recetas argentinas']","['12 discos de empanada', '500 gramos de osobuco', '1 cebolla', '1 cucharada sopera de manteca', '¼ morrón verde', '¼ morrón rojo', '¼ morrón amarillo', '25 centímetros cúbicos de vino blanco', '2 ramas de cebolla de verdeo', '1 pizca de pimienta', '1 pizca de nuez moscada', '½ cucharadita de comino', '1 cucharada sopera de barbacoa']",https://www.recetasgratis.net/receta-de-empanadas-de-osobuco-76188.html
Receta FÁCIL y SALUDABLE,"En esta oportunidad, compartimos una preparación sin carne que gustará a todos, incluso a los que no descartan estos alimentos en su dieta. Se trata de una mezcla de vegetales con espinaca y champiñones, con el rico sabor del ajo, la cebolla y el queso rallado. Con ellos, formaremos el relleno de unas sabrosas empanadas. En este caso, hemos utilizado tapas de empanada caseras y veganas, pero puedes utilizar las que consigues empaquetadas en el supermercado. Además, si quieres convertir estas empanadas vegetarianas en veganas, no te pierdas los detalles que compartimos a continuación.En RecetasGratis te enseñamos cómo hacer empanadas vegetarianas. ¡Quédate leyendo!","['1\nPara empezar con la receta de las empanadas vegetarianas con huevo, primero pela y pica la cebolla para saltearla con 1 cucharadita de aceite en una sartén a fuego máximo hasta que esté transparente.', '2\nCuando esté transparente, agrega el diente de ajo también pelado y picado y, a continuación, baja el fuego a medio-bajo para cuidar que el ajo no se queme. Si lo ves conveniente, agrega un poco de agua para levantar el fondo de cocción.', '3\nCuando los vegetales estén tan cocidos como gusten, sube el fuego y añade las hojas de espinaca previamente lavadas y picadas. Remueve unos segundos y apaga el fuego para que no liberen mucho líquido.', '4\nMezcla la espinaca salteada con la cebolla y el ajo con los champiñones escurridos.', '5\nCondimenta el relleno de tus empanadillas vegetarianas al gusto con, por ejemplo, queso rallado, nuez moscada y pimienta. Si deseas convertir estas empanadas en veganas, deberás evitar el queso y reemplazarlo, por ejemplo, por levadura nutricional, sabor queso.', '6\nCuando el relleno esté frío, agrega una cucharada en el centro de la tapa de empanada. A continuación, humedece con ayuda de la yema de los dedos la mitad del borde para que, al cerrarlo, se selle perfectamente. A continuación, con ayuda de las yemas, haz el repulgue o cierre que más te guste y ubícalas en una asadera previamente engrasada.', '7\nAntes de cocinar tus empanadas vegetarianas con huevo, puedes pintarlas con huevo batido para que se doren mejor. Si quieres evitar el huevo, no las pintes. A continuación, llévalas al horno precalentado a 200 ºC - 220 ºC durante unos 15 minutos.', '8\n¡Listas para comer las mejores empanadas vegetarianas! Cuéntanos en los comentarios tu opinión y comparte con nosotros una fotografía del resultado final.']",,2 comensales,30m,,Dificultad baja,,[],"['6 tapas de empanadas vegetarianas o veganas', '1 cebolla', '1 diente de ajo', '1 taza de champiñones', '1 puñado de espinaca', '2 cucharadas soperas de queso rallado', '1 pizca de pimienta', '1 pizca de nuez moscada', '1 huevo (para pintar)']",https://www.recetasgratis.net/receta-de-empanadas-vegetarianas-76213.html
Canastitas de espinaca,"La espinaca es uno de los vegetales menos calóricos, pero más nutritivos gracias a sus micronutrientes. Estas aportan vitamina K, hierro, ácido fólico y vitamina C, todos importantes para nuestra salud. Asimismo, en esta oportunidad, te proponemos una preparación rica y original para incluir la espinaca en tu dieta habitual. Se trata de unas canastitas que rellenamos con espinaca, salsa blanca, cebolla y queso, para obtener como resultado un almuerzo o una cena liviana, ideal para los que quieren bajar de peso, alimentarse de forma saludable y para los que tienen diabetes. También es una opción perfecta para quienes no tienen la posibilidad de almorzar en casa y necesitan llevarse una vianda al colegio, facultad o trabajo, gracias a su practicidad.Por todo ello, en RecetasGratis te enseñamos cómo hacer canastitas de espinaca fáciles y saludables. ¡A cocinar!","['1\nPara empezar con la receta de las canastitas de espinaca, primero prepara las hojas lavándolas una por una debajo de la canilla de agua o en una solución de agua con un poco de vinagre de alcohol. Luego, desinféctalas en una solución con 1 gota de lavandina apta para alimentos por litro de agua, remojándolas unos 15 minutos. A continuación, retíralas y escúrrelas. Pícalas y resérvalas mientras preparas el relleno de tus canastitas.', '2\nPela y pica la cebolla para saltearla en una sartén a fuego máximo con una cucharadita de aceite. Cuando esté transparente, baja el fuego al medio y, si es necesario, agrega una cucharada de agua caliente para despejarla del fondo. Repite hasta que esté caramelizada.', '3\nPuedes reemplazar las últimas cucharadas por vino blanco para proporcionar más sabor. En este caso, sube el fuego al máximo antes de agregarlo y mantenlo de esta forma hasta que sientas que el olor cambia de ácido a dulce, por la evaporación del alcohol. Luego, baja el fuego al medio y añade la manteca junto con la harina.', '4\nVigila que no se queme la manteca. Por otro lado, cuando la harina esté un poco tostada, agrega la leche y remueve hasta que espese.', '5\nCuando haya espesado, agrega las hojas de espinaca que habías preparado previamente y apaga el fuego. Mezcla para que se calienten e integren con la salsa blanca. A continuación, condimenta al gusto con la nuez moscada, pimienta y queso rallado.\nTruco: si lo deseas, puedes añadir ricota y elaborar unas deliciosas canastitas de espinaca y ricota.', '6\nDispón las tapas de empanada en un molde para muffins y rellena las canastitas con la preparación de espinaca. Si no tienes este tipo de molde, al final de la receta te proporcionaremos más ideas para que puedas hacer tus canastitas sin que se desarmen.', '7\nHonestamente, recomendamos agregar un poco de queso fresco porque queda muy rico, como corazón de tus canastitas. A continuación, cocínalas en el horno precalentado a fuego máximo, 200 ºC- 220 ºC durante unos 15-20 minutos hasta que observes la masa ligeramente dorada y el queso derretido.', '8\nRetira las canastitas de espinaca del horno, sírvelas y listas para comer. Cuéntanos en los comentarios tu opinión y comparte con nosotros una fotografía del resultado final.']",,2 comensales,30m,Plato principal,Dificultad baja,,"['Recomendada para vegetarianos', 'Recomendada para perder peso', 'Recetas al horno']","['10 hojas de espinaca', '1 cebolla', '½ taza de leche (120 mililitros)', '1 cucharada sopera de harina 000', '10 gramos de manteca', '1 cucharadita de nuez moscada', '1 pizca de pimienta', '60 gramos de queso fresco', '1 cucharada sopera de queso rallado', '6 tapas de empanada']",https://www.recetasgratis.net/receta-de-canastitas-de-espinaca-76172.html
