title,intro,order,votes,comensales,duración,para,dificultad,coste,types,ingredientes,url
Tacos de canasta receta de la abuela,"Los tacos de canasta son uno de los platillos populares y tradicionales de México que puedes encontrar en este país o en otras regiones con una ligera variación en cuanto al relleno. Estos se consideran un platillo rico, económico y rendidor. También existen los tacos vegetarianos rellenos de papa, de frijol o uno de los más tradicionales es el famoso taco de chicharrón prensado y hasta combinado de papa con carne. Cuando yo era pequeña recuerdo las tardes de septiembre previas al festejo de todos los años, a mi abuela preparando la canasta para preparar los tacos y disfrutar durante la noche con toda la familia. Y es que no se puede negar que la sazón de la abuela es única y siempre se extraña.Asimismo, en RecetasGratis te enseñamos cómo hacer tacos de canasta, receta de la abuela. ¡A cocinar!","['1\nPara empezar con la receta de tacos de canasta, primero prepara los guisados. Asimismo, en una olla con una cucharada de aceite añade los frijoles refritos y los chiles chipotle, estos últimos pueden ser enteros o picados. A continuación, con ayuda de un machacador, ve mezclando y machacando para integrar el frijol con el chile chipotle. Mantén a una temperatura baja para evitar que se quemen los frijoles, una vez se hayan integrado bien con el chile, cocina solo durante un par de minutos más. Luego, reserva.', '2\nPara el relleno de papa, en una olla calienta una cucharada de aceite y, enseguida, añade las papas previamente cocidas en agua. Apóyate de un machacador para aplastar las papas y que se vuelvan puré. Agrega también sal, pimienta y perejil seco, cocina alrededor de unos 5 a 8 minutos, después reserva.', '3\nPara el adobo de los tacos, coloca en la licuadora un trozo de cebolla blanca, un par de dientes de ajo, de tres a cuatro chiles guajillo, una pizca de comino y una taza de agua caliente, licua todo muy bien durante 2 o 3 minutos hasta que se haya molido todo. Puedes hidratar los chiles guajillo previamente con suficiente agua tibia o caliente para que se suavicen y sea más fácil licuarlos.', '4\nEn una olla calienta el aceite y, enseguida vierte la salsa de chile guajillo licuada, puedes colar la antes si lo prefieres. A continuación, a fuego bajo mezcla para que se vaya integrando, añade también un poco de sal y pimienta al gusto y cocina durante 6-8 minutos. Cuando esté lista la salsa, reserva.', '5\nAhora es momento de armar los tacos. Para ello, utiliza tortillas de maíz taqueras que estén ligeramente calientes para que se puedan doblar fácilmente y no se rompan. Asimismo, primero agrega el relleno, que puede ser con el frijol con chile chipotle o la papa cocida, elige el relleno que más te guste. Si quieres que las tortillas tengan una textura ligeramente crujiente puedes freírlas antes, pero este paso es completamente opcional.', '6\nDobla la tortilla con el relleno y sumérgelas en la salsa de chile, puede ser solo la mitad o completamente. La salsa debe estar caliente para que al momento de pasarlo la canasta o la olla empiece a generar vapor.', '7\nVe acomodando los tacos en una canasta con papel destraza. Si no tienes una canasta, puedes usar una olla con papel destraza o papel encerado, ve alternando capas de tacos y de cebolla fileteada, continúa hasta llenar tu canasta o tu olla. Cuando esté llena y, si te sobró un poco de la salsa, con aceite baña todos los tacos y cubre con más papel. Añade una servilleta de tela y una bolsa plástica para que selle bien y no se enfríen. Deja reposar durante 15 a 20 minutos los tacos dentro de la canasta o la olla antes de servir.', '8\nPasado el tiempo de reposo de los tacos al vapor, ya los podrás servir y disfrutar. ¡A comer! Cuéntanos en los comentarios tu opinión y comparte con nosotros una fotografía del resultado final.']",,8 comensales,30m,Plato principal,Dificultad baja,,"['Recetas al vapor', 'Recetas mexicanas']","['1 kilogramo de tortillas de maíz taqueras', '½ taza de aceite vegetal', '4 chile guajillo', '1 trozo de cebolla', '2 dientes de ajo', '1 pizca de comino', 'sal y pimienta al gusto', '1 pieza de cebolla mediana en julianas', '2 tazas de frijoles refritos', '2 chiles chipotle adobados', '3 papas medianas cocidas', '1 pizca de perejil seco', '1 canasta', 'papel destraza o encerado el suficiente']",https://www.recetasgratis.net/receta-de-tacos-de-canasta-receta-de-la-abuela-76179.html
Pionono de jamón y queso,"Aprende a cocinar de manera fácil y sencilla este pionono de jamón y queso, lo podrás elaborar en casa sin ninguna complicación. Además, es una elaboración que se puede consumir tanto en frío como en caliente y no se necesita mucho tiempo para tenerlo listo, pues tan solo necesitarás cinco minutos de horno para tener lista la base del pionono. Asimismo, atrévete a hacer esta deliciosa receta en casa, aunque no seas muy cocinillas, seguro que este pionono te va a quedar perfecto.Sigue leyendo y aprende en RecetasGratis cómo hacer pionono de jamón y queso o arrollado de jamón y queso. ¡A cocinar!","['1\nPara realizar la receta de pionono de jamón y queso, primero vamos a elaborar la base del pionono. Para ello, casca los huevos en un bol y añade el azúcar. Con unas varillas eléctricas bate hasta que resulte una mezcla muy espumosa.', '2\nIncorpora de golpe la harina común y mezcla bien, esta vez con unas varillas manuales para que no se bajen en exceso los huevos, mezclando con movimientos envolventes.', '3\nPrecalienta el horno a 180 ºC y, a continuación, forra una bandeja con papel de horno, extiende la masa de los piononos en ella con una espátula. Luego, hornea con calor arriba y abajo a 180 ºC durante 5 minutos o hasta que la plancha de pionono esté dorada.', '4\n¿Te preguntas cómo rellenar un pionono? Pues bien, primero retira la plancha de pionono del horno y coloca encima de ella las lonchas de jamón cocido.', '5\nEspolvorea toda la superficie con el queso rallado y añade pequeños trozos de queso fresco por encima.\nTruco: puedes utilizar queso en lonchas, quesos fuertes, roquefort o tus quesos preferidos. Señalamos que el pionono de roquefort y jamón está exquisito.', '6\nVe despegando con cuidado la plancha de pionono y ve enrollando el pionono de jamón y queso.', '7\nCorta el pionono relleno de queso y jamón en rodajas gruesas.', '8\nSirve enseguida el pionono salado de jamón y queso y disfruta de esta deliciosa receta. Además, si lo deseas, puedes acompañar el pionono con mayonesa casera o mayonesa fitness. Anímate en casa y cuéntanos qué te ha parecido esta elaboración. Puedes enviarnos una foto con el resultado final.Espero que te haya gustado la receta y te invito a que visites mi blog Cakes para ti.']",,4 comensales,30m,Entrante,Dificultad baja,,['Recetas al horno'],"['6 huevos M', '75 gramos de azúcar moreno (1/2 taza)', '100 gramos de harina común (3/4 taza)', '225 gramos de jamón cocido', '50 gramos de queso rallado', '25 gramos de queso fresco']",https://www.recetasgratis.net/receta-de-pionono-de-jamon-y-queso-76165.html
Receta FÁCIL y RÁPIDA,"Los tacos rancheros son un platillo mexicano que, según la región donde se preparen, se añade un relleno u otro, además de diferentes ingredientes. Se pueden hacer prácticamente de cualquier tipo de carne o pescado, de carne molida con papa y zanahoria, de pollo deshebrado con chile o pimiento morrón, pescado frito o capeado. Sin embargo, si quieres una opción más económica, fácil y sin carne, esta receta de tacos rancheros es perfecta, será el platillo protagonista para un desayuno de domingo o para la hora del almuerzo.Asimismo, si quieres saber cómo hacer tacos rancheros, sigue leyendo y descubre esta sencilla y rápida receta.","['1\nPara empezar con la receta de tacos rancheros, primero lava muy bien los jitomates, la cebolla, los chiles serranos, los dientes de ajo y la rama de cilantro. Luego, corta en trozos medianos para que se puedan moler fácilmente.', '2\nCuando tengas los vegetales limpios y cortados, lleva a la licuadora con media taza de agua, una pizca de sal, 1 pizca de pimienta y una pizca de comino seco, licua todo muy bien durante 2 minutos.', '3\nCuando hayas licuado la salsa de jitomate, calienta una cucharada de aceite en una olla y enseguida vierte la salsa licuada, cocina a temperatura media alta durante unos 5 o 6 minutos hasta que empiece a hervir y haya cambiado su color. También comprueba la sazón y, si lo ves necesario, agrega un poco más de sal o pimienta al gusto. Cuando esté lista y sazonada la salsa, retira del fuego y reserva.', '4\nEn un recipiente rompe los huevos, agrega una pizca de sal y una pizca de pimienta y bate muy bien. Si lo deseas, puedes batir con una batidora eléctrica para que se esponjen un poco más y la torta de huevo quede más gordita.', '5\nEn una sartén caliente agrega un poco de aceite o mantequilla al gusto y enseguida vierte el huevo que batiste. A continuación, cocina la torta de huevo por ambos lados hasta que esté completamente cocida, tomará alrededor de unos 2-3 minutos por lado manteniendo a una temperatura media baja.', '6\nAhora solo queda armar estos tacos rancheros. Asimismo, primero calienta la tortilla de maíz y, enseguida, rellena con un poco de la torta de huevo, si lo deseas, puedes cortar en tiras o en trozos pequeños. Por otro lado, si lo prefieres, puedes freír la tortilla antes de rellenar, también puedes hacer el huevo estrellado o revuelto.', '7\nDobla la tortilla y acomoda para servir. Enseguida baña con la salsa ranchera que preparaste al inicio de esta receta, agrega un poco de queso fresco desmoronado y un poco de rábano en cubitos. ¡Ya puedes servir y disfrutar de estos ricos tacos rancheros, ideales para el desayuno!']",,4 comensales,30m,Desayuno,Dificultad muy baja,,['Recetas mexicanas'],"['500 gramos de tortilla de maíz', '4 huevos', '3 piezas de jitomates', '1 trozo de cebolla', '2 chile serrano', '2 dientes de ajo', '1 rebanada de cilantro', 'aceite vegetal al gusto', '100 gramos de queso fresco desmoronado', '2 piezas de rábano en cubos']",https://www.recetasgratis.net/receta-de-tacos-rancheros-76180.html
Receta PASO A PASO con fotos,"Si de tamales se trata, México siempre es protagonista, puesto que hay tamales de todo tipo, desde salados hasta dulces e incluso agridulces. En esta ocasión, te vamos a enseñar a preparar unos ricos tamales de gansito, que aunque no son tan tradicionales, son cada vez más populares. El gansito, para quienes no son de México, es un pastelito muy popular, hecho a base de pan de vainilla relleno con mermelada de fresa y crema y con una cubierta de chocolate. Es uno de los pastelitos favoritos de todos, al menos para mí, desde muy pequeña ha sido uno de mis postres favoritos. Por ello, utilizarlo para preparar unos tamales es una excelente idea. La preparación no es para nada complicada y es relativamente rápida de hacer, pues no contiene un relleno tan elaborado.Si quieres descubrir cómo hacer tamales de gansito, sigue leyendo esta receta y anímate a prepararla en casa.","['1\nPara comenzar la receta de tamales de gansito, pon a hidratar las hojas para tamal. Para ello, prepara un recipiente amplio con agua caliente e introduce las hojas. Normalmente las puedes encontrar en paquetes de 50 hojas, solo sepáralas un poco y déjalas en remojo durante unos 20-30 minutos para que se suavicen y sea más fácil rellenarlas luego.', '2\nPrepara la masa de los tamales de gansito. Primero, bate la manteca vegetal manualmente o con una batidora eléctrica hasta que se esponje o se creme. Lo que buscamos es que la manteca se suavice y quede con una textura cremosa para que se pueda integrar fácilmente con el resto de los ingredientes.\nTruco: utiliza la manteca a temperatura ambiente.', '3\nAgrega la leche evaporada, la leche condensada, el polvo para hornear y la pizca de sal, y mezcla todo muy bien hasta que se integre y obtengas una pasta ligeramente espesa. Todo esto lo puedes hacer manualmente con tus manos muy limpias o puedes apoyarte de una batidora eléctrica o una batidora de pedestal, elige lo que más te convenga.Endulzar el tamal es completamente al gusto, en esta receta hemos utilizado leche condensada, pero también puedes endulzar con azúcar normal o bien elegir un edulcorante no calórico como stevia o monkfruit, aunque el gansito por sí solo ya le aporta al tamal un cierto grado de dulzor.', '4\nIncorpora la harina de maíz nixtamalizado mezclándola poco a poco para que se vayan integrando todos los ingredientes. Si sientes la masa muy seca, puedes agregar un chorrito más de leche, que puede ser entera o también evaporada, o incluso puedes usar un chorrito de agua. Cuando se haya integrado la harina, continúa amasando por unos 10 minutos para que la masa se esponje y quede de la mejor textura.', '5\nCon la masa lista y las hojas previamente hidratadas, es momento de armar los tamales de gansito. Primero, toma una de las hojas para tamal y extiéndela en tus manos, lo ideal es que elijas hojas grandes para que puedas rellenar muy bien toda la hoja. Luego, comienza agregando una cucharada grande de masa y espárcela bien por la hoja, preferiblemente desde el medio hacia arriba. Enseguida, coloca un mini gansito, que será el relleno. Si no consigues mini gansitos puedes usar gansito de tamaño normal y rebanarlo o ponerlo en trozos, esto es completamente al gusto. Cierra el tamal.También puedes preparar tu propio Pastel de gansito con esta sencilla receta.', '6\nRepite el proceso hasta terminar con toda la masa y las hojas. Con las cantidades mencionadas obtendrás de 20 a 25 tamales, aunque esto dependerá mucho del tamaño que quieras hacerlos. Acomódalos en una olla vaporera de forma vertical para cocerlos.', '7\nPara cocinar los tamales, cúbrelos con las hojas para tamal que te hayan sobrado y encima coloca un trapo húmedo para sellar bien y que se puedan cocinar perfectamente al vapor. El tiempo de cocción variará entre una hora y 2 horas, por lo que te recomendamos que revises los tamales a la hora y veas qué tan cocidos están. Si aún están muy aguados, déjalos cocinar por 20 minutos y repite el proceso hasta que estén con la textura perfecta, esponjosos y que se despeguen de la hoja.', '8\nUna vez pasado el tiempo de cocción, deja enfriar un poco y listo. Así de fácil es preparar unos ricos tamales de gansito. No olvides disfrutarlos con un buen vaso de leche fría o un rico café de olla. Ahora sí, ¡a comer!']",,10 comensales,2h 30m,Postre,Dificultad media,,"['Recetas al vapor', 'Recetas mexicanas']","['500 gramos de harina de maíz nixtamalizado', '220 gramos de manteca vegetal', '1 pizca de sal', '1 cucharadita de polvo para hornear', '220 mililitros de leche evaporada', '100 gramos de leche condensada', '1 paquete de hojas para tamal', 'Agua caliente (cantidad suficiente)', '20 piezas de mini gansitos']",https://www.recetasgratis.net/receta-de-tamales-de-gansito-76166.html
Empanadas de vigilia con acelga,"Las empanadas de vigila son clásicas de la Pascua, más precisamente, del Viernes Santo. Como durante estos días no se come carne, los rellenos más tradicionales son de pescado, como por ejemplo de atún o de bacalao. Además, también son populares las empanadas vegetales, como de espinaca o como en el caso de esta receta, de acelga. Asimismo, a diferencia de otras empanadas, las de vigilia se caracterizan por elaborarse con una masa bien hojaldrada con un toque dulce de azúcar en su superficie.Si quieres aprender a elaborarlas, en Recetas Gratis te enseñamos cómo hacer empanadas de vigilia con acelga. ¡Vamos a cocinar!","['1\nPara empezar con la receta de las empanadas de vigilia con acelga, primero deberás hacer la masa hojaldrada. Para ello, mezcla la harina con la cucharadita de sal. Si no puedes consumir sal, entonces evita agregarla.', '2\nA continuación, haz un hueco en el centro para agregar la manteca fría cortada en cubos. Con ayuda de las manos, integra ambos ingredientes con las yemas de los dedos buscando formar arenilla.', '3\nPoco a poco, añade las cucharadas de agua fría. A continuación, integra con ayuda de un cornet o cuchara para no transferir demasiado calor con la mano, tampoco debes amasar demasiado. Por el contrario, se formará el hojaldre.', '4\nCuando hayas formado un bollo, sin importar que esté demasiado unido, llévalo a la mesada limpia y enharinada.', '5\nEspolvorea un poco de harina sobre la masa y estírala con ayuda de un palo de amasar. En este paso solo buscamos terminar de integrar la masa. Asimismo, ayúdate con el cornet o espátula para doblarla dos veces hacia el centro, como ves en la imagen.', '6\nUbica los pliegues hacia ti y estira la masa nuevamente de forma vertical hasta 1 dedo de alto.', '7\nDóblala en 3 nuevamente y llévala al frío durante 15 o 20 minutos. Estira verticalmente, dobla y refrigera 2 veces más.', '8\nMientras, comienza con la preparación del relleno de tus empanadas de vigilia. Por un lado,primero cocina en agua fría los huevos 12 minutos.', '9\nPor otro lado, pela y corta la cebolla en cubos pequeños. A continuación, saltéala en una sartén con 1 cucharadita de aceite a fuego máximo. Cuando esté transparente, baja el fuego al medio y remueve cada tanto para que no se pegue. Si empieza a pegarse, puedes agregar 1 cucharada de agua para evitarlo.', '10\nPica las hojas de acelga limpias y reserva hasta que la cebolla esté cocida.', '11\nCuando la cebolla esté cocida, sube el fuego al máximo y agrega las hojas de acelga limpias y picadas. A continuación, remueve y cocina por tan solo unos segundos, por el contrario, empezará a liberar mucho líquido. Retira del fuego y reserva para que se enfríe.', '12\nPrepara una salsa blanca para unir el relleno de tus empanadas. Para elaborarla, disuelve la maicena en la leche fría y, luego, caliéntala en el microondas unas 3 veces de 30 segundos en 30 segundos, removiendo cada vez. También puedes hacer la salsa blanca en una olla a fuego medio hasta que espese.', '13\nCondimenta al gusto la salsa blanca con la nuez moscada, provenzal y pimienta, también mezcla con los vegetales salteados.', '14\nAñade también los huevos que habías hervido previamente, pelados y picados, junto con las cucharadas de avena, esta ayudará a absorber la humedad excesiva del relleno. Reserva en la heladera.', '15\nEstira la masa, esta vez de forma vertical y horizontal hasta formar un rectángulo de medio centímetro de alto.', '16\nCorta las tapas de tus empanadas con ayuda de un cortante, taza o vaso de unos 12 centímetros de diámetro.', '17\nAgrega una cucharada de relleno en el centro y pinta la mitad del disco con huevo batido.', '18\nCierra tus empanadas de vigilia haciendo algo de presión cerca del relleno.', '19\nDispón las empanadas de verduras en una asadera ligeramente húmeda y, a continuación, píntalas con huevo. Deja reposar durante 1 hora a temperatura ambiente para que el hojaldre se abra bien en el horno. Luego, cocínalas en el horno precalentado a 200 ºC - 220 ºC durante unos 15 minutos o hasta que empiecen a dorarse.', '20\nPasado el tiempo, retira las empanadas del horno para espolvorearlas con el azúcar impalpable. Luego, llévalas al horno, preferentemente a la parrilla, durante unos 5 minutos extra para que se terminen de dorar.', '21\n¡Ya puedes comer las deliciosas empanadas de acelga! Como la masa de las empanadas tiene bastante manteca, recomendamos que las acompañes con ensalada verde para hacer este plato más saludable y moderar la cantidad que come cada comensal. Cuéntanos en los comentarios tu opinión y comparte con nosotros una fotografía del resultado final.']",,4 comensales,3h,Plato principal,Dificultad media,,"['Recomendada para vegetarianos', 'Recetas al horno']","['200 gramos de harina 0000', '100 gramos de manteca', '1 cucharadita de sal', '10 cucharadas soperas de agua fría', '1 cucharada sopera de azúcar impalpable', '1 huevo', '1 cebolla', '2 huevos', '1 cucharada postre de nuez moscada', '1 cucharadita de provenzal', '1 pizca de pimienta']",https://www.recetasgratis.net/receta-de-empanadas-de-vigilia-con-acelga-76146.html
Bocoles de frijol,"Los bocoles son un antojito mexicano tradicional de la zona Huasteca, como Hidalgo, Puebla, San Luis Potosí, Veracruz, entre otros estados. Esta elaboración consta de un disco de masa grueso, muy similar a las gorditas, pero más chicos y un poco más gruesos. Estos se preparan con manteca, que puede ser de cerdo, vegetal, incluso de res. Se rellenan con diferentes ingredientes y guisados. Asimismo, en esta oportunidad, te enseñamos uno de los bocoles más tradicionales, los bocoles de frijol.En RecetasGratis te enseñamos cómo hacer bocoles de frijol. Ahora ya sabes, no tienes que viajar a la huasteca para poder probar un exquisito bocol, solo sigue esta receta y aprende a preparar este antojito mexicano. ¡A cocinar!","['1\nPara empezar con la receta de bocoles de frijol, primero adquiere o prepara la masa. Para ello, puedes elegir comprar la masa ya hecha en las tortillerías o en el supermercado o puedes prepararla tu mismo. Si escoges la segunda opción, prepararlo tu mismo, elabora con harina de maíz y agua, la cantidad dependerá de las instrucciones del empaque, pero normalmente por cada kilo de harina se utiliza 1.5 a 2 tazas de agua, pero deberás ir probando poco a poco hasta obtener la textura deseada. Si usas la masa ya preparada, amasa ligeramente para calentarla y, si la sientes muy seca o grumosa, añade un chorrito de agua tibia.', '2\nAñade poco a poco la manteca, que puede ser de cerdo, de res o manteca vegetal, también si lo prefieres puedes usar aceite o aceite de coco. Asimismo, si eliges alguno de estos últimos, bastará con una media taza, solo ten cuidado de que no adquiera mucha agua la masa. Por otro lado, también agrega la cucharadita de sal y mezcla muy bien.', '3\nCuando la masa esté bien amasada, agrega media taza de cilantro picado y las hojitas de epazote también picadas, el epazote añadirá un sabor excepcional, pues es bien sabido que la combinación con el frijol es una de las mejores, ya que eleva su sabor. Mezcla hasta integrar por completo.', '4\nCuando hayas integrado el cilantro y el epazote a la masa, es momento de agregar el frijol, lo ideal es que sea entero, pero también puedes usar frijol molido o si tienes frijoles refritos también los puedes usar. Asimismo, agrega poco a poco y amasa hasta integrar completamente.', '5\nToma una porción de la masa y bolea un poco con tus manos para después presionar e ir dándole forma de disco o de gordita. Deberá quedar de un grosor no mayor a 2 cm, pero tampoco deberá quedar muy delgado, el tamaño tampoco deberá exceder de la palma de tu mano.', '6\nLleva los bocoles a un comal o a una sartén caliente y cocina por cada lado unos 2 o 3 minutos o, hasta que estén ligeramente tostados. Mantén a una temperatura media baja para que se cocine uniformemente y no queden espacios del bocol crudos.', '7\nYa puedes servir los bocoles de frijol, pero si quieres proporcionar una mejor presentación y un mejor sabor, añade un poco de queso desmoronado y un poco de cebolla picada finamente. ¡A comer los bocoles con queso y frijol! Cuéntanos en los comentarios tu opinión y comparte con nosotros una fotografía del resultado final.']",,6 comensales,30m,Entrante,Dificultad baja,,['Recetas mexicanas'],"['500 gramos de masa de maíz nixtamalizado', '150 gramos de manteca', '1 cucharadita de sal', '½ taza de cilantro picado', '3 hojas de epazote', '1 taza de frijoles enteros cocidos', '½ pieza de cebolla picada', '200 gramos de queso desmoronado']",https://www.recetasgratis.net/receta-de-bocoles-de-frijol-76148.html
