title,date,url,ingredients,steps
Receta de Katsu sando o sándwich japonés,2018-10-16 15:30:29+00:00,https://okdiario.com/recetas/katsu-sando-o-sandwich-japones-3237926/,4 chuletas de cerdo. 8 rebanadas de pan de molde. Harina de trigo. Pan rallado. Sal. Pimienta. 1 huevo. Aceite de oliva. 1 diente de ajo. 1 cucharada de mostaza. ½ cucharada de jengibre. 2 cucharadas de kétchup. 4 cucharadas de salsa Wercestershire. 1 cucharada de miel,"La grandeza de este sándwich la encontramos en la salsa que lo cubre, empezaremos la receta preparándola con especial atención. Esta salsa combinará muy bien con todo tipo de carnes blancas y estará increíble con un poco de pan rústico.. Machacamos un diente de ajo pelado y cortado en el mortero. Le añadimos la mostaza y el jengibre, mezclamos hasta obtener una pasta homogénea cargada de sabor. Le ponemos un poco de salsa de soja para hacerla más ligera y conseguir una textura más adecuada.. Ponemos en el fuego esta mezcla con la salsa Worcestershire, el kétchup y la miel. Vamos mezclando hasta que hierva unos 5 minutos. La salsa espesará y cogerá la consistencia adecuada para fundirse en un maravilloso bocado de carne.. Seguimos con las chuletas, les quitamos el hueso y las aplastamos un poco para que quede una carne mucho más fina. Este sándwich deberá quedar con una textura muy fina, es mejor que el ingrediente principal disfrute de un trato preferencial.. Empanamos las chuletas las pasamos por el huevo batido y el pan rallado. En una sartén con aceite las freímos hasta conseguir que queden doradas y buen cocinadas. Retiramos del fuego y las ponemos a escurrir para que eliminen el aceite sobrante.. Untamos un lado del pan con la salsa, podemos tostarlo un poco para que quede más consistente. Le añadimos un poco de col cortada en juliana y los trozos de chuleta empanada. Tendremos lista una fusión de sabores impresionante."
Receta de Pulpo en salsa picante fácil de preparar,2018-10-16 15:00:30+00:00,https://okdiario.com/recetas/pulpo-salsa-picante-3237906/,200 gr de pulpo cocido. 450 gr de tomates. 1 cebolla. 2 dientes de ajo. 1 chorrito de tabasco. 1 cucharada de pimienta negra. 1 cucharada de pimentón dulce. 1 vaso de vino blanco. 1 chorrito de coñac. 500 ml de caldo de pescado. 1 chorrito de aceite de oliva,"Vamos a empezar a preparar el pulpo casero en salsa picante o americana. Para esta receta es mucho mejor que el pulpo esté ya cocinado, lo podemos preparar al momento sabiendo los secretos de cómo cocerlo o comprarlo listo.. Cuando tenemos el ingrediente principal preparado nos centraremos en la salsa. Preparamos el fondo de verduras, pelamos y picamos muy finitos los ajos y la cebolla. En una sartén con un poco de aceite empezamos a pocharlos.. Mientras tenemos las verduras en el fuego, seguimos pelando los tomates y cortándolos en trocitos irregulares. Irán directamente al vaso de la batidora para crear una salsa lo más fina posible. Lo ideal es colarla para elimina las semillas.. Añadimos el tomate en la sartén de las verduras, dejaremos que se impregnen de su sabor y textura antes de ponerle un poco de sal y pimienta. El tomate es un ingrediente con mucho líquido que necesita cocinarse a la perfección para obtener esa textura de salsa que necesitamos.. En unos 7 minutos ponemos el vino y el coñac, dejaremos que el alcohol se evapore antes de incorporar el caldo de pescado. Será el momento de ir reduciéndose la salsa hasta conseguir una exquisita mezcla.. Aderezamos con el tabasco y un poco de pimienta negra, tendremos lista un tipo de salsa que podemos utilizar en una gran variedad de platos. Troceamos el pulpo y lo servimos con la salsa por encima, picamos un poco de perejil para aportarle un poco de color y sabor."
Receta de salmón ahumado vegano fácil de preparar,2018-10-16 14:30:11+00:00,https://okdiario.com/recetas/salmon-ahumado-vegano-3237880/,4 zanahorias. 1 alga kombu. 2 cucharadas de salsa de soja. 1 cucharada de vinagre de manzana. 1 cucharada de sirope de arce. 1 cucharada de pimentón dulce. 1 cucharada de aceite de sésamo. 1 cucharada de zumo de limón. Pimienta. Sal. 2 cucharadas de agua,"Empezamos este salmón ahumado vegano pelando las zanahorias, con la ayuda de una mandolina la cortaremos bien fina a modo de escamas de pez. Deberá tener el aspecto más parecido al salmón posible, la estética es un factor importante en este tipo de recetas que copian un ingrediente ya existente.. Colocamos estas zanahorias en un bol y las cocinamos durante unos 3 minutos al microondas, lograremos que queden tiernas y se asemejen aún más a la carne de este pescado azul.. Ponemos la zanahoria en una fuente para horno, le colocaremos encima una tira de alga nori, la hornearemos para que recoja todos los sabores de este producto oriental.. Añadiremos un poco de agua y horneamos a 180º entre 6 y 8 minutos. Cuando veamos que el alga se ha cocinado  y la zanahoria está un poco más oscura, será el momento de retirarlas del horno.. Colocaremos el alga nori en el vaso de la batidora cortada en trocitos. Ponemos el resto de los ingredientes que nos faltan para hacer el aderezo perfecto de un salmón ahumado de lo más especial. Mezclaremos hasta obtener una salsa que será la encargada de darle a esta zanahoria un sabor ahumado muy parecido al del pescado.. Regamos la zanahoria con este aderezo y dejamos que repose durante unas 24 horas, lo ideal es usar una fiambrera de cristal para que recoja todos los jugos y no se impregne de ningún olor exterior. Pasado este tiempo tendremos listo un salmón ahumado vegano perfecto para una gran variedad de platos. El resultado es espectacular."
Receta de Lentejas con pollo y verduras,2018-10-16 14:00:36+00:00,https://okdiario.com/recetas/lentejas-pollo-3237848/,200 gr de lentejas. 300 gr de pechuga de pollo. 200 gr de tomates triturados. 1 cebolla. 4 dientes de ajo. 1 pimentón verde. 2 cucharadas de pimentón dulce. Aceite de oliva. 2 vasos de caldo de pollo o agua,"Esta receta de lentejas es una de las más recurrentes en muchas casas, mezcla dos productos de subsistencia a la perfección. Utilizaremos para prepararla unas lentejas pardinas son un poco más pequeñas y no hay que dejarlas a remojo toda la noche, se pueden cocinar directamente.. Pelamos y picamos la cebolla y los ajos, cortaremos estos ingredientes en trocitos pequeñicos para empezar a pocharlos. Repetimos la operación con los tomates, para esta receta mejor utilizar tomate natural pelado y triturado. El último ingrediente para este sofrito será el pimiento que limpiaremos y trocearemos.. Empezamos el sofrito poniendo a pochar la cebolla y el ajo. Cuando empiecen a estar tiernos les añadiremos el pimiento, este ingrediente tardará un poco más en hacerse que el tomate.. En el momento en que el pimiento empiece a ablandarse le ponemos los tomates. Mientras se cocina el fondo de verduras preparamos el pollo, lo cortaremos en trozos del mismo tamaño y lo añadiremos al sofrito.. Salpimentaremos al gusto y dejaremos que se cocine todo junto durante unos 10 minutos. Pasados estos minutos le pondremos el pimentón dulce y removeremos un poco más.. Añadimos el caldo y las lentejas, si hace falta pondremos un poco más de agua. Dejaremos que se cocinen las lentejas a fuego lento con el resto de los ingredientes. Este plato mejor comerse caldoso estaremos pendientes de que las lentejas estén bien hidratadas.. Con las lentejas cocidas solo nos quedará servirlas, lo mejor es que reposen unos minutos antes de disfrutarlas en caliente, estarán de vicio con un poco de pan y poco más."
Receta de Bizcocho de leche evaporada fácil de preparar,2018-10-15 15:21:59+00:00,https://okdiario.com/recetas/bizcocho-leche-evaporada-3234198/,Azúcar (200g). Leche evaporada (200g). 5 huevos. Harina normal (250g). 12 g de levadura de repostería o polvo de hornear. Aceite de oliva virgen extra (200g). Una pizca de sal,"El primer paso de esta receta es precalentar el horno a 180°C, comprobando que llegue el calor tanto arriba como abajo.. Engrasar el molde, ya sea con manteca o aceite y espolvorear un poquito de harina. Esto evitará que el bizcocho se pegue.. Colocar en un bol los huevos, la pizca de sal y el azúcar y batir a mano durante al menos cinco minutos.. Poner la leche evaporada y el aceite en un cazo y quitar del fuego antes que comience a hervir. Remover bien con unas varillas y luego añadir esta mezcla a los huevos y el azúcar. Agregarlo poco a poco y no dejar de batir.. Luego, tamizar la harina y agregarla junto con la levadura a la preparación poco a poco. Después incorporar la ralladura de limón y seguir batiendo hasta que todos los ingredientes de integren.. Verter la masa en el molde.. Hornear durante 40 minutos a un horno a 180°C. Después de este tiempo, bajar la temperatura a 170°C y hornear unos 10 minutos más. Pinchar con una brocheta para comprobar que el bizcocho está listo.. Sacar del horno y, una vez que este frío, espolvorear con azúcar glas."
Receta de galletas de crema de cacahuete,2018-10-15 14:00:16+00:00,https://okdiario.com/recetas/galletas-crema-cacahuete-3232086/,100 gr de azúcar blanco. 100 gr de azúcar moreno. 120 gr de mantequilla. 120 gr de crema de cacahuete. 1 huevo. 150 gr de harina de trigo. 4 ml de bicarbonato sódico. 2 cucharadas de levadura en polvo,"Empezamos la receta batiendo la mantequilla hasta conseguir una fina crema batida. La mantequilla mejor que esté a temperatura ambiente para conseguir un acabado mucho más cremoso.. Le añadiremos el azúcar poco a poco y seguiremos batiendo hasta que quede una salsa pálida y consistente.. Cuando tenemos esta base lista, le incorporamos la crema de cacahuete. Este ingrediente tiene una textura elástica que necesitará que se mezcle correctamente antes de seguir con la receta. Añadimos en huevo y tendremos lista la primera mezcla, un tanto más líquido de estas galletas de mantequilla de cacahuete.. En otro bol mezclamos los ingredientes secos, la harina, el bicarbonato y la levadura, hasta obtener una masa que irá directamente a la anterior. Poco a poco obtendremos una masa húmeda que dejaremos que repose mientras precalentamos el horno a 190º.. Lo ideal es que la masa de las galletas repose al menos una hora, la dejaremos en la nevera tapada. Cuando esté lista la empezaremos a trabajar con las manos.. Les damos forma a las galletas, inicialmente haremos bolitas del mismo tamaño hasta obtener la base que trabajaremos con un rodillo de cocina hasta tenerlas listas. También podemos utilizar un cortapastas.. Las ponemos en una fuente para horno con una distancia entre ellas de unos centimetros teniendo en cuenta que se expandirán en el horno.. Horneamos las galletas a 190º unos 10 minutos hasta que estén doradas y crujientes. Podemos sacarlas del horno y dejarlas sobre una rejilla para que se enfríen. Tendremos listas unas galletas perfectas para el café o la merienda."
Receta de Sándwich de pollo y aguacate fácil de preparar,2018-10-15 13:00:02+00:00,https://okdiario.com/recetas/sandwich-pollo-aguacate-3232073/,9 rebanadas de pan de molde sin corteza. 1 aguacate. 1 pechuga de pollo. Mayonesa. Unas hojas de lechuga. 1 cebolla tierna. 1 lima. Hojas de cilantro picado,"Empezamos la receta preparando el pollo, utilizaremos una pechuga de pollo. La limpiaremos y quitaremos cualquier pielecilla que haya podido quedar. Salpimentaremos al gusto y lo cortaremos en tiras del mismo tamaño para que se prepare antes.. Si queremos obtener un sándwich rápido, filetearemos la pechuga lo más pequeña posible para poder obtener un bocadillo mucho más eficiente.. La pechuga la ponemos cocinar a la plancha o frita dependiendo de nuestros gustos. Si la freímos vamos a utilizar un poco de aceite y la cocinaremos hasta obtener un exterior crujiente con un interior suave.. Si la preparamos a la plancha no utilizaremos tanto aceite y nos quedará una pechuga un poco más seca. Teniendo en cuenta que uno de los ingredientes es la mayonesa casera, ayudará en gran medida a obtener un sándwich mucho más tierno.. Para darle una textura crujiente pelaremos y picaremos la cebolla, la podemos cortar en juliana o en trocitos pequeños para mezclarla con la mayonesa y el aguacate.. Partimos el aguacate por la mitad, lo vaciamos por dentro, colocaremos la pulpa en un bol y lo iremos aplastando con la ayuda de un tenedor. Salamos ligeramente el aguacate y lo cocíamos con un chorrito de lima para que no se oxide.. Le añadiremos la cebolla picada hasta formar una masa perfecta llena de sabor, este ingrediente será el relleno casi perfecto.. Tostaremos el pan ligeramente y lo rellenamos con un poco de mayonesa, las hojas de lechuga y la mezcla de aguacate y cebolla. Finalmente, colocaremos la pechuga de pollo en el interior. Tendremos listo uno de los sándwich más sencillo y delicioso que existe."
Receta de paté de berenjenas y aceitunas negras fácil de preparar,2018-10-15 12:19:03+00:00,https://okdiario.com/recetas/pate-berenjenas-aceitunas-negras-3233485/,2 berenjenas grandes. 25 aceitunas negras deshuesadas (la cantidad dependerá del gusto). 1 diente de ajo. Aceite de oliva extra (cantidad necesaria para asar las berenjenas y luego para incorporar al paté). 1 puñado de hierbas provenzales. Sal y pimienta al gusto,"En primer lugar, cocer las berenjenas. Para ello, lavarlas bien y quitarles el tallo. Luego cortarlas a lo largo en mitades y hacerle pequeños cortes con un cuchillo.. Salarlas y dejarlas reposar 20 minutos para que se escurran y suelten el amargor. Enjuagar, secarlas y reservar.. Precalentar el horno a 180º. Colocar las berenjenas en una bandeja para horno y echar un chorrito de aceite de oliva para cocinarlas, y un punto de sal. Hornearlas durante 30 minutos o hasta que estén blandas y se vean ligeramente doradas. Dejar enfriar.. A continuación, quitar la pulpa con una cuchara y desechar la piel.. Pelar el diente de ajo y cortarlo finamente. Deshuesar y cortar las aceitunas negras en trozos pequeños.. Meter la berenjena, el ajo, las aceitunas y las hierbas en un vaso de batidora y triturar los ingredientes hasta que quede una pasta homogénea.. Añadir un poco de sal y pimienta y un chorrito de aceite de oliva Volver a mezclar y probar.. Llevar a un recipiente para luego servir y enfriar unas horas en la nevera."
Receta de risotto de pato confitado,2018-10-15 11:31:44+00:00,https://okdiario.com/recetas/risotto-pato-confitado-3233243/,2 muslos de pato confitados (se pueden elaborar en casa o comprarlos ya cocinados). Arroz Carnaroli (320g). Medio puerro. 1 litro de caldo de pollo. ½ vaso de vino blanco. 1 cucharada de mantequilla. Queso parmesano rallado. Sal a gusto,"Calentar los muslos de pato confitado siguiendo las instrucciones las instrucciones del envase. Sacarlos de la bolsa, dejar que pierdan un poco de temperatura sin que se enfríen para poder manipularlos. Reservar.. Calentar el caldo de pollo en el microondas o un cazo para que esté listo para cuando se necesite.. En una cazuela a fuego bajo colocar la mantequilla y sofreír el medio puerro, previamente cortado. Remover de vez en cuando.. Añadir el arroz y sofreír durante unos minutos moviendo constantemente.. Añadir el vino blanco y seguir cocinando hasta que se vaya evaporando el alcohol.. A partir de entonces comenzar a añadir poco a poco el agua caliente o caldo al arroz, removiendo todo el tiempo. Sazonar y volver a hacerlo a la mitad de la cocción o cuando sea necesario. No volver añadir agua hasta que el arroz haya absorbido la inicial. El tiempo de cocción del rissoto estará entre 15 y 18 minutos. Agregar, cinco minutos antes de terminar, la carne de pato confitado desmenuzada. Mezclar los ingredientes para que se integren, tapar la cazuela y dejar 5 minutos.. Sacar del fuego y servir. Acompañar el risotto de pato confitado con un poco de queso parmesano."
Receta de Tortilla de patatas cuatro quesos fácil de preparar,2018-10-15 11:07:17+00:00,https://okdiario.com/recetas/fattoush-2-3233121/,3 papas grandes. 5 huevos. 100 gr de queso crema. 100 gr de ricotta. 100 gr de mozzarella. 100 gr de queso parmesano rallado. 1 trozo de apio. 1 cebollino. Sal y pimienta. Aceite de oliva. Cilantro (opcional). Jamón cocido (opcional),"Cortar las patatas en rodajas finas. Freírlas en abundante aceite hasta que estén bien doradas. Escurrirlas sobre papel absorbente.. Aparte, batir los huevos con los vegetales picados sal y pimienta.. Añadir al batido las patatas y los quesos. Mezclar bien.. Calentar una sartén profunda con un poco de aceite.. Echar el batido y dejar cocinar a fuego moderado a bajo hasta que los costados de tortilla se vean cuajados.. Con la ayuda de un plato plano dar vuelta la tortilla y cocinar del otro lado. Servir.. Para enriquecer el batido, agregar cilantro y jamón picado. También se pueden usar patatas hervidas en vez de fritas. "
Receta de calabacín al vapor en microondas,2018-10-15 10:51:03+00:00,https://okdiario.com/recetas/calabacin-vapor-microondas-3232960/,2 calabacines. 400 gr. de tomate frito. Queso en dados. 100 gr. de queso tipo emmental rallado. Un puñado de orégano. Sal y pimienta al gusto,"Primero lavar y pelar los calabacines. Cortar en rodajas pequeñas y colocar en una fuente apta para microondas.. Tapar el recipiente con papel film y llevar al microondas durante 10 minutos, dependiendo el programa y la potencia utilizada. Una vez finalizado el tiempo, retirar el agua que quede de excedente.. Retirar del microondas y colocar encima el tomate frito y los dados de queso. Añadir una pizca de sal y pimienta, el queso emmental rallado y una buena cantidad de orégano.. Llevar nuevamente al microondas durante cinco minutos, para que se funda el queso y se integren los sabores.. Se pueden añadir unos taquitos de jamón york y el resultado es realmente sabroso.. Una vez terminado, servir caliente y disfrutar."
Masterchef Celebrity: Receta de Mar y montaña,2018-10-15 07:00:27+00:00,https://okdiario.com/recetas/mar-montana-3232054/,250 gr de migas de pescado. 100 gr de setas. 1 cebolla. 200 ml de leche. 100 gr de harina. 2 huevos. 100 gr de pan rallado. Aceite. Sal. Pimienta. 1 pato. 2 puerros. 1 zanahoria,"Empezaremos este mar y montaña preparando el caldo de pato. Para esta receta usaremos un pato entero, lo trocearemos y quitaremos la parte más grasa.. Pelamos el puerro y lo cortamos a rodajas, nos quedamos con la parte central blanca. Sofreímos el puerro en un sartén con aceite. Cuando esté tierno le ponemos el pato. Le daremos unas vueltas hasta que esté doradito.. Cuando haya soltado gran parte de su grasa añadimos agua y la zanahoria troceada le dará sabor y color a un caldo de excepción.. Mientras se cocina el caldo seguiremos con las croquetas de pescado. Una idea bastante interesante que el concursante no supo materializar del todo bien, con calma añadiremos los ingredientes necesarios para hacer unas croquetas de 10.. Limpiamos y picamos las cebollas y las setas. Las colocamos en una sartén para que se pochen durante unos minutos.. Cuando la cebolla y las setas estén tiernas, le ponemos el pescado, para esta receta podemos utilizar un pescado blanco quedará de maravilla. Cuando tenemos todos los ingredientes integrados le añadimos la harina y la leche hasta formar una croqueta perfecta.. Para que espese la masa añadimos el pan rallado. Le damos forma con las manos, rebozamos las croquetas en un poco de huevo batido y las freímos. Óscar hizo unas albóndigas que en realidad eran croquetas, en este caso mejor hacer unas croquetas directamente.. Colamos el caldo de pato y ponemos estas croquetas en ellas. Podemos incorporar un poco de pato troceado o unas setas tal y como hizo el concursante de Masterchef Celebrity. Solo nos quedará preparar nuestro pan favorito para poder disfrutarlas."
Receta de cocido madrileño estilo Masterchef Celebrity,2018-10-15 06:00:56+00:00,https://okdiario.com/recetas/cocido-madrileno-estilo-masterchef-celebrity-3232045/,300 gr de garbanzos. 300 gr de morcillo. 1 muslo de pollo. 200 gr de chorizo. 1 morcilla de cebolla. 150 gr de tocino. 80 gr de jamón. 1 hueso de jamón. 2 zanahorias. ½ repollo. 2 patatas. 3 dientes de ajo. Aceite de oliva. Sal. Perejil,"Para preparar este delicioso cocido madrileño vamos a empezar por los garbanzos. Los dejaremos a remojo toda la noche para que se cocinen más fácilmente. Al día siguiente los escurrimos y reservamos.. En una olla con abundante agua, ponemos las carnes que serán las encargadas de crear un delicioso caldo. Le añadimos un poco de sal y aceite.. Cuando la olla empiece a hervir le añadiremos los garbanzos, iremos retirando la espuma que se vaya formando hasta que quede la olla limpia. Tapamos la olla y cocemos todos los ingredientes durante unos 30 minutos si utilizamos una olla rápida o un poco más si optamos por una convencional.. Tenemos el caldo del cocido listo y el resto de los ingredientes preparados. Colamos un poco de este caldo y lo colocamos en otra cazuela, le incorporamos el repollo picado con la morcilla y el chorizo. Coceremos estos ingredientes durante unos 15 minutos.. Pelamos las patatas y las zanahorias y las agregamos directamente a la cazuela. Le vamos a poner los garbanzos y la carne antes de volver al fuego. Dejaremos que se mezclen todos los sabores durante unos 15 minutos más. La esencia de un buen cocido es disponer del tiempo necesario para conseguir un resultado tradicional.. Por último, el truco de las abuelas, freímos unos ajos con aceite. Servimos el cocido con las carnes troceadas y los garbanzos, por encima regamos con los ajos fritos y un poco de perejil picado. Tendremos listo un plato de cuchara de los de antes."
Receta de escalope Vienés (Wiener Schnitzel),2018-10-14 18:18:27+00:00,https://okdiario.com/recetas/escalope-vienes-wiener-schnitzel-3231230/,200 gr. de ternera blanca. 1 huevo. 1 plato con harina de trigo. Pan rallado para rebozar. 1 limón. Sal y pimienta al gusto. 1 ramita de perejil fresco. Aceite de oliva virgen,"En primer lugar, preparar la carne para que resulte lo más tierna posible. Para ello, disponer cada filete en una superficie lisa y darle unos golpes con un martillo de carne para ablandarla. Lo ideal es que quede de aproximadamente medio centímetro de grosor, dependiendo del gusto.. Salpimentar la carne y añadirle unas hojitas de perejil fresco finamente picado. Reservar.. A continuación, batir el huevo en un recipiente y poner la harina y el pan rallado en otros recipientes por separado.. Empanar la carne. Pasar primero por la harina, quitándole el exceso, luego por el huevo batido y finalmente rebozar con el pan rallado, apretando ligeramente para que se adhiera. Repetir el procedimiento con cada uno de los filetes de ternera.. En una sartén, colocar un chorro de aceite de oliva y calentar. Cuando alcance temperatura, echar cada uno de los filetes y cocinarlos de un lado y del otro, hasta que estén dorados de ambos frentes.. Retirarlos del aceite y colocarlos sobre papel absorbente para quitar el exceso de grasa.. Para acompañar, lavar unas hojas de verdura fresca y unos tomates cherry. Añadir unas rodajas de limón para que cada comensal bañe el escalope como guste."
