title,date,url,ingredients,steps
3 recetas a partir de una lata de mejillones,2020-06-10 16:00:03+00:00,https://okdiario.com/recetas/3-recetas-partir-lata-mejillones-5736714/,400 gramos de arroz. 2 latas de mejillones al natural. 2 latas de calamares en su tinta. Medio litro de caldo de pescado. 3 dientes de ajo. 1 tomate. 1 cebolla. Agua. Aceite de oliva,Pelamos y picamos los ajos y la cebolla en pequeños trozos. Reservamos por separado.. En una sartén con aceite freímos los ajos. Antes de que se doren añadimos la cebolla. Rehogamos cinco minutos y añadimos el tomate rallado. Cocinamos hasta que este pochado.. Añadimos los mejillones escurridos y los calamares con su jugo e integramos.. Agregamos el arroz y revolvemos bien.. Incluimos el caldo de pescado y damos un punto de sal al conjunto.. Cocemos durante 10 minutos a fuego alto y luego bajamos a fuego medio por 10 minutos más.
Receta de arroz tres delicias al microondas,2020-06-10 15:00:18+00:00,https://okdiario.com/recetas/receta-arroz-tres-delicias-microondas-5736885/,1 tacita de arroz. 2 tacitas de agua. 100 gr de guisantes congelados. 1 zanahoria. 100 gr de jamón cocido. 1 huevo. Salsa de soja. Aceite. Sal,"Este arroz tres delicias sorprende por el resultado y la sencillez con la que se prepara. Podemos dejar a un lado los fogones o dejar que los niños cocinen esta maravilla.. Ponemos en un recipiente apto para microondas el agua con un poco de sal, lo encendemos a máxima potencia durante 2 minutos.. Mientras se calienta el agua, pelamos la zanahoria y la cortamos en trocitos. Podemos rallarla para conseguir un resultado más uniforme.. Cuando el agua esté caliente ponemos el arroz, la zanahoria y los guisantes. Volveremos a poner en el microondas, pero esta vez durante 9 minutos.. No tapamos el recipiente de esta manera conseguiremos que se cocine el arroz más rápidamente y de forma más uniforme. Es importante remover todo para que queden bien repartidos los ingredientes.. Con todo listo nos centramos en incluir los complementos de este arroz. Podemos ponerle unas gambas congeladas peladas y el clásicos jamón cocido.. Cortamos el jamón cocido en porciones similares a la zanahoria de esta manera nos quedará un plato más bonito.. En el momento en que el arroz está casi listo retiramos del microondas y ponemos las gambas y el jamón. Tapamos y dejamos que se termine de cocinar con el calor residual.. Batimos en un plato el huevo. Le añadimos un poco de aceite y sal. Ponemos el plato en el microondas a máxima potencia durante 1 minuto.. Habremos conseguido crear una tortilla muy rápidamente. Cortamos la tortilla en trocitos y los incorporamos al arroz.. Mezclamos todo muy bien y le añadimos la salsa de soja. De esta manera conseguiremos tener un arroz tres delicias de lujo en menos de 15 minutos. Atrévete a probarlo."
La receta de pastel de cangrejo,2020-06-10 12:00:17+00:00,https://okdiario.com/recetas/receta-pastel-cangrejo-5736495/,¼ kg. de carne de cangrejo. 1 taza de pan rallado. 1 cucharada de perejil fresco picado. ½ cebolla. 2 cucharadas de mayonesa. ½ cucharada de mostaza. ½ cucharadita de salsa inglesa. ¼ limón (el zumo). 1 huevo batido. 2 cucharadas de aceite de oliva. 1 pizca de pimienta. 1 pizca de sal. 1 limón picado en 4 trozos.,"Pelar y cortar la cebolla en trozos pequeños.. Cortar la carne de cangrejo en pequeños trozos.. En un bol, incorporar media taza de pan rallado. Reservar el resto en un recipiente para empanar.. Agregar al bol la cebolla, el perejil, la mayonesa, la mostaza, la salsa inglesa y el huevo batido. Añadir el zumo de limón, sal y pimienta al gusto. Mezclar bien hasta integrar los ingredientes.. A continuación, incorporar a la mezcla anterior la carne de cangrejo picada. Con ayuda de una cuchara, mezclar hasta obtener una pasta.. Humedecerse las manos y tomar cuatro porciones de la pasta anterior para formar cuatro bolas.. Pasar las bolas por pan rallado y aplanarlas hasta dejar un pastel de 2 cm. de grosor, aproximadamente.. En una sartén antiadherente, verter el aceite de oliva y calentar a fuego medio-alto.. Colocar los pasteles de cangrejo y cocinar durante 3 minutos por cada lado hasta que se doren.. Al servir, acompañar cada pastel con un cuarto de trozo de limón."
Receta de sopa de quinoa con cebolla,2020-06-10 11:00:28+00:00,https://okdiario.com/recetas/receta-sopa-quinoa-cebolla-5734500/,3 cebollas moradas grandes. 3 cucharas harina de trigo. 10 cucharas quinoa. 6 tazas caldo de verduras. 10 rodajas pan. 100 gr queso rallado. 1 diente ajo. Sal. Pimienta. Nuez moscada. Aceite de oliva,"La sopa de quinoa con cebolla es una receta sencilla y deliciosa, perfecta para una cena o comida rápida saludable. Nos ponemos manos a la obra con las cebollas que son las protagonistas de este plato.. Pelamos las cebollas y las cortamos muy finitas. Preparamos una sartén con un poco de aceite de oliva para empezar a pochar las cebollas.. Dejamos que las cebollas se cocinen a fuego lento hasta que estén transparentes, mientras pelamos y cortamos muy finito el ajo.. Cuando las cebollas estén tiernas, ponemos la harina y el ajo. Sin dejar de remover hasta que se cree una especie de base, similar a la que hacemos para preparar una bechamel.. La harina se tostará pasados unos 3 minutos. Empezamos a añadir poco a poco el caldo de verduras, nos quedará la base ideal para poder cocinar la quinoa.. Lavamos la quinoa para que nos quede más suelta. Incorporamos la quinoa al resto de los ingredientes.. Rectificamos de sal y pimienta y dejamos que se cocine durante unos 15 minutos. Podemos adelantarnos un poco a estos tiempos usando una quinoa ya cocinada.. Mientras tostamos unas rebanadas de pan y las gratinamos con un poco de queso rallado por encima para acompañar la quinoa.. Si es necesario podemos añadir más caldo, nos interesa que nos quede una sopa suave y delicada. Cuando la tenemos lista apagamos el fuego.. Servimos la sopa en frío o en caliente con un poco de cebollino picado por encima y las tostadas con queso. Tendremos listo un plato completo y delicioso en un abrir y cerrar de ojos."
Receta de Guiso de pollo con cítricos,2020-06-10 10:00:43+00:00,https://okdiario.com/recetas/receta-guiso-pollo-citricos-5736385/,4 muslos y contra muslos de pollo. 2 limones. 4 naranjas. 2 limas. 2 dientes de ajo. 1 cebolla morada. 4 ciruelas. 2 patatas. 1 ramita de romero. Vino blanco. Aceite de oliva. Sal y pimienta,"Precalentar el horno a 200° C.. En un mortero grande, machacar los ajos con el romero y un poco de aceite, hasta formar una pasta.. Exprimir las naranjas, los limones y las limas, y añadir este zumo al mortero, mezclar muy bien. Reservar algunas rodajas de naranja.. Poner el pollo en una fuente de horno y salpimentarlo.. Verter sobre el pollo la mezcla de cítricos y ajos y remover para que se impregne completamente.. Hornear durante 45 minutos a 170° C.. Cortar la cebolla en aros, las patatas en rodajas e incorporarlas a la fuente, así como las ciruelas previamente hidratadas en agua y un chorrito de vino blanco.. Añadir también las rodajas de naranja.. Hornear durante 30 minutos más utilizando el grill para que dore, bañando de vez en cuando con la salsa cítrica."
Receta de croissant de mascarpone,2020-06-10 09:00:42+00:00,https://okdiario.com/recetas/receta-croissant-mascarpone-5733247/,125 ml de agua templada. 3 cucharadas de queso mascarpone. 8 gr de levadura de panadería. 75 gr de azúcar. 300 gr de harina de fuerza. 30 gr de mantequilla. 5 gr de sal,"Esta elaboración es una de las más simples que existen y el resultado merece mucho la pena. Se necesita un poco de tiempo para dejar reposar la masa, pero es tan fácil de hacer que hasta nos podrán ayudar los niños.. Colocamos la harina de fuerza en un bol. Hacemos un agujero en el medio como si fuera un volcán. En ese centro colocamos un poco de sal.. Calentamos el agua hasta que esté templada, no debe estar muy caliente porque podría afectar a la levadura y no quedarnos tan bien.. Disolvemos la levadura de panadero en ese vaso. Cuando esté listo colocamos esta mezcla en el centro. Le añadimos el azúcar.. Llega el turno del mascarpone, le ponemos 3 cucharadas generosas. Con esta base empezamos a amasar hasta que tengamos todos los ingredientes bien ligados.. La masa se puede conseguir crear con menos tiempo usando un amasador o panificadora, es una herramienta que cada vez más cocinas poseen.. Cuando estén estos ingredientes bien incorporamos le incorporamos la mantequilla Creamos una bola que será la masa de croissants de mascarpone ideal.. Dejamos que repose unas dos horas o hasta que haya doblado su tamaño. En ese momento extendemos la masa.. Cortamos triángulos que enrollamos hasta tener listos los croissants. Los vamos poniendo en una fuente para horno o en el congelador si queremos tenerlos preparados para una ocasión especial.. Encendemos el horno a 180º, cuando esté caliente, horneamos durante unos 15 minutos. Ponemos un poco de azúcar glass por encima y servimos.. Podemos rellenarlos de Nutella, mermelada, mantequilla o cualquier ingrediente que nos guste, estarán increíbles. Atrévete a crear un bocado maravilloso, el resultado es un pequeño vicio."
Receta de Ensalada veraniega de nopal,2020-06-10 08:00:55+00:00,https://okdiario.com/recetas/receta-ensalada-veraniega-nopal-5736292/,1 kilo de nopal. 6 tomates. ½ cebolla morada. ½ cebolla blanca. 100 gramos de queso tierno en tacos. 2 limones. Cilantro. Sal. Pimienta,"Lavar y picar el nopal.. Cocer el nopal en agua hirviendo con sal y la cebolla blanca durante unos 20 minutos. Sacar el nopal y reservar.. Lavar y picar los tomates en dados pequeños.. Pelar y picar la cebolla morada en juliana fina.. Añadir los tomates, el queso y la mitad de cebolla en un bol con profundidad.. Agregar el nopal picado al bol con los vegetales y mezclar bien.. Rectificar la sal y añadir tanto la pimienta como el cilantro.. Exprimir el zumo de los limones sobre la ensalada. Repartir bien en la totalidad de la ensalada."
Receta de 4 postres de chocolate light,2020-06-09 18:00:39+00:00,https://okdiario.com/recetas/receta-4-postres-chocolate-light-5730165/,200 gramos de Chocolate negro. ½ taza de Agua (120 mililitros). 3 huevos. 2 cucharadas de postre de edulcorante,Derretir el chocolate mezclado con la media taza de agua en baño de maría. Luego dejar a temperatura ambiente.. Agregar las tres yemas de huevo y batir.. Batir las tres claras de huevo con una batidora eléctrica hasta llegar a punto de nieve.. Incorporar el edulcorante.. Mezclar las claras batidas con el chocolate utilizando una cuchara de madera.. Servir la mezcla en un molde y dejar en la nevera durante cuatro horas.
Receta de Pollo envuelto en tocineta con mostaza y miel,2020-06-09 16:00:37+00:00,https://okdiario.com/recetas/receta-pollo-envuelto-tocineta-mostaza-miel-5728913/,1 kilo de pechuga de pollo deshuesada. 30 tiras de tocineta bien delgadas (o las que hagan falta). 3 cucharadas de miel. 2 cucharadas de mostaza. Zumo de un limón,"Precalentar el horno a 225° C.. Cortar la pechuga en tiras, del grosor que se prefiera.. Para preparar el marinado: en un bol mezclar el zumo de limón, la mostaza y la miel. Debe quedar todo bien integrado.. Tomar una tira de tocineta y enrollarla en una tira de pollo, de un extremo al otro. Asegurar ambos extremos con palillos.. Hacer lo mismo con el resto de tocineta y de pollo.. Colocar el pollo envuelto en tocineta en una bandeja de horno, y con una brocha untar la mitad del marinado sobre el pollo.. Dar un punto de sal al conjunto.. Llevar al horno durante 10 o 15 minutos, o hasta que dore. Cuando esté dorado, retirar del horno y dar la vuelta para que se doren por el otro lado.. Volver a untar el pollo con el resto del marinado y hornear de nuevo hasta que la carne esté dorada por todos lados."
Receta de alitas de pollo con judías verdes y salsa de cúrcuma,2020-06-09 15:00:25+00:00,https://okdiario.com/recetas/receta-alitas-pollo-judias-verdes-salsa-curcuma-5729938/,100 gr de judías verdes. 250 gr de alitas de pollo. 2 dientes de ajo. 2 cucharaditas de cúrcuma. Zumo de medio limón. 1 cucharada de salsa de tomate. 1 vaso de caldo de verduras. ½ cucharadita de maicena. Sal. Pimienta. Aceite,"Esta receta es muy fácil de preparar, el primer paso será tener listas las judías verdes. Hay muy buen producto congelado que puede hacernos la vida más fácil.. Si optamos por un ingrediente fresco, lavamos las judías verdes, les quitamos las puntas y los hilos más duros. Cortamos en trocitos.. En un cazo con agua hirviendo y un poco de sal, colocamos las judías. Tardarán unos 10 minutos en estar en su punto, las acabaremos de cocinar con el pollo.. Pelamos el diente de ajo y lo cortamos en trocitos. En una sartén con un poquito de aceite tostamos el aceite.. Lavamos las alitas y las salpimentamos al gusto. Le daremos el punto extra de sabor sorpresa, con un par de cucharadas de zumo de limón. Maceremos un poco esta carne.. Cuando esté el ajo tostado añadimos el pollo. Le damos un poco de color. Cuando la carne esté sellada, añadimos el caldo.. En ese momento le ponemos la cúrcuma para que le aporte todo su sabor y no se queme. Terminamos de cocinar las judías verdes con estos ingredientes.. Dejamos que se cocinen durante unos 10 minutos, hasta que el pollo esté cocinado. Rectificamos de sal y pimienta.. Si queremos la salsa más espesa, la maicena será una gran aliada. La diluimos con un poco de agua y la incorporamos.. Servimos esta maravilla con un poco de salsa por encima. Tendremos listo un plato sin hidratos, proteínas y verduras en estado puro. Atrévete a probar la perfecta cena o comida rápida saludable."
Receta de crema de aguacate para untar,2020-06-09 13:00:26+00:00,https://okdiario.com/recetas/receta-crema-aguacate-untar-5729627/,1 aguacate. 1 yogur griego sin azúcar. 1 limón. Aceite de oliva virgen. Sal. Pimienta blanca. Pan integral de centeno. Semillas,"Esta crema de aguacate para untar la podemos prepara siempre que nos apetezca disfrutar de una alternativa al clásico queso o a las mermeladas, es más saludable y quede exquisita.. Nos ponemos manos a la obra con el aguacate, en este caso, mejor que esté maduro, queda mucho más cremoso.. Trituramos el aguacate con un tenedor o en el vaso de la batidora, le añadimos un poco de sal y pimienta.. Para que no se oxide es momento de incorporar el zumo de limón, de esta manera mantendrá un color verde mucho más intenso.. El aguacate ya es cremoso, pero le daremos un poco más de alegría con el yogur griego. Lo ponemos entero.. Por último, regamos con un chorrito de aceite de oliva. Trituramos de nuevo hasta obtener una crema que impresiona.. Preparamos el pan, lo tostamos un poco para que quede crujiente y contraste mejor con la cremosidad del aguacate.. Untamos bien y coronamos con unas semillas de chía, girasol o sésamo tostadas. Tendremos la merienda o el desayuno perfecto listo en un abrir y cerrar de ojos, solo nos quedará probarla."
Receta de tacos de camarones,2020-06-09 12:00:09+00:00,https://okdiario.com/recetas/receta-tacos-camarones-5728792/,"12 tortillas de maíz (ideales pata tacos). ½ kg. de camarones limpios. 3 cucharadas de mantequilla. ½ cucharada de aceite de oliva virgen extra. 2 dientes de ajo, picados en trozos pequeños. ½ lechuga picada en tiras finas. Pimienta negra al gusto. Sal al gusto","Pelar y cortar en trozos muy pequeños la cebolla y el tomate.. Pelar los aguacates, desechar las semillas y triturarlos en un bol con ayuda de un tenedor.. Añadir el zumo del limón al aguacate para evitar que se oxide y conserve su atractivo color verde. Agregar también el cilantro picado, el tomate, la cebolla y sal al gusto, mezclar bien hasta obtener un puré.. Para los tacos de camarones, lavar y escurrir los camarones.. En una sartén, agregar la mantequilla y el aceite de oliva. Calentar a fuego medio-alto e incorporar el ajo picado. Pochar durante 1 minuto.. Incorporar los camarones a la sartén y dejar cocinar a fuego medio-alto durante 8 minutos, removiendo de vez en cuando. Dar un punto de sal.. Calentar sutilmente las tortillas en una plancha.. Para armar cada taco, poner una capa de lechuga sobre la tortilla. Encima una porción de camarones, y por último una capa de guacamole."
