title,date,url,ingredients,steps
Champiñones al horno,2021-02-06 18:00:39+00:00,https://okdiario.com/recetas/champinones-horno-59601/,400 gr de champiñones o setas. 4 cucharadas de perejil picado. 3 dientes de ajo. ½ cucharadita de hierbas provenzales. El zumo de un limón. Aceite de oliva virgen. Sal. Pimienta. Queso rallado (opcional),"Estos champiñones al horno no tienen más que algunos trucos básicos que debemos aplicar cuando trabajamos con este ingrediente.. Uno de los más importantes es conseguir que nuestra materia prima quede en perfectas condiciones, los champiñones deben estar bien limpios para que nos queden de vicio.. Este ingrediente puede acumular algunos restos de tierra que pueden acabar estropeando este plato. De igual forma que las setas si optamos por este alimento.. Cortamos la parte del tallo del champiñón que haya estado en contacto con la tierra. Ponemos en un recipiente con agua, es mejor de esta manera que bajo el chorro de agua del grifo, podría hacer que se peguen la tierra o las impurezas más.. Con la ayuda de un paño húmedo retiramos la tierra o las impurezas hasta que estén bien limpios. Son la base del plato, deberá estar perfecta en todos los sentidos.. El otro truco principal de esta receta consistirá en untar los champiñones con un poquito de zumo de limón, de esta manera no se pondrán negros.. El limón es un truco muy utilizado para los champiñones o, por ejemplo, el aguacate que sufre las mismas consecuencias de una rápida oxidación, ese color negro que no es nada apetecible y puede influir en su textura y sabor.. Dependiendo del tamaño de nuestros champiñones o setas, podemos ponerlos enteros en la fuente o trocearlos. Tendremos en cuenta que tienen mucho líquido por lo que tendrán un volumen mucho menor.. Nos ponemos manos a la obra precalentando el horno, lo vamos a poner a 220º. De esta manera tendremos el horno listo. Se irá calentando mientras preparamos el resto de los ingredientes y ahorraremos algo de tiempo.. Pelamos los ajos, los vamos a poner en el mortero para triturarlos junto al perejil. De esta manera crearemos una especie de salsa que le dará mucho sabor a los champiñones o setas.. Esta especie de ajillo se aligerará con la llegada de un buen aceite de oliva. Con una cuchara vamos repartiendo esta especie de aliño por encima de los champiñones o setas.. Podemos ponerle unas hierbas provenzales, le darán un buen sabor y ayudarán a crear un plato más completo.. De igual forma podemos añadirle un poco de queso, es un ingrediente que le aportará cremosidad.. El tipo de queso dependerá un poco de nuestros gustos, desde un roquefort o un cabrales que sea capaz de intensificar aún más el sabor de los champiñones a una suave mozzarella.. Con todo listo, ponemos los champiñones en el horno. Podemos ponerle más aliño por encima si queremos que nos queden muy intensos.. Horneamos esta delicia a 180º unos 20 minutos. Vamos comprobando como se van cocinando. Los champiñones deben quedar bien tiernos de tal forma que se fusionen con el resto de los sabores y tengan una textura suave.. Cuando estén dorados será el momento de retirarlos del horno. Tal como están, solo necesitaremos esperar a que se enfríen para disfrutarlos, aunque en caliente también estarán de vicio.. Estos champiñones pueden ser una buena tapa o una guarnición que vamos a preparar con especial atención para una carne o un pescado o incluso unas verduras salteadas.. Un surtido de ibéricos o quesos, unas latas de conservas nacionales, pueden ser los complementos perfectos para disfrutar de esta delicia.. Atrévete a probarlos en su estado más puro. Es época de ir en busca de setas, se pueden cocinar de la misma forma que los champiñones.. Las setas llegan después de las lluvias en aquellas zonas en las que no haga un frío intenso y puedan crecer.. En unas semanas con la llegada del buen tiempo y quizás el fin de las restricciones se podrá volver a salir en busca de este alimento básico.. Los champiñones son una buena alternativa y podemos ternos siempre en casa. Solo tendremos que ir en busca de este alimento disponible todo el año.. Puedes incluso cultivarlos en casa si te apasionan los champiñones. En esta receta los podrás comer en estado puro, quedan de vicio y son muy fáciles de preparar."
Receta de bizcocho de oreo al microondas,2021-02-06 14:00:32+00:00,https://okdiario.com/recetas/receta-bizcocho-oreo-microondas-6796463/,2 huevos. 16 galletas oreo. 50 gr de azúcar (opcional). 80 ml de aceite de girasol. 150 ml de leche. 1 sobre de levadura,"Si te gusta el sabor de las galletas oreo, no lo dudes, este bizcocho te apasionará. Hay días en los que es imposible escapar del antojo de algo dulce, para esos momentos, este bizcocho es indispensable.. La parte más complicada es buscar los ingredientes, el único que se escapa de los que tenemos en casa son las galletas oreo. Puedes hacer la misma elaboración con cualquier tipo de galleta, las que tengas en casa te servirán en caso de ‘emergencia’.. Ponemos las galletas en el vaso de la batidora y las trituramos. Sobre esta base añadimos la leche y seguimos batiendo.. Conseguiremos una especie de masa que aligeraremos con la llegada de los huevos. Los incorporamos a la mezcla para que se fusionen en una masa maravillosa.. Añadimos también el aceite de girasol y seguimos batiendo. Conseguiremos casi todo lo necesario para un buen bizcocho. Las galletas ya llevan harina y conseguirán la consistencia necesaria.. Llegados a este punto, nos planteamos si añadir más azúcar o no. En todos los dulces existe la creencia que cuanto más azúcar mejor, pero este sabor es muy personal.. Probamos la masa para determinar si queremos que esté más dulce, podemos añadirle en caso de ser amantes de este sabor unos 50 gramos.. Batimos todo muy bien antes de incorporarle la levadura. Este ingrediente conseguirá que suba en el microondas.. Para cocinar el bizcocho debemos tener en cuenta que doblará su tamaño, debemos hacernos con un recipiente apto para este electrodoméstico adecuado.. Si el molde no es antiadherente le ponemos un poco de mantequilla para que la masa no se pegue. No es necesario que sea un molde o recipiente con tapa.. Ponemos nuestro bizcocho en el microondas a potencia medía durante 8 minutos. Comprobamos si está cocinado, en caso de no estar listo, lo ponemos un para de minutos más.. Dependerá de la potencia del microondas el tiempo. Es importante conocer bien esta herramienta para conseguir un bizcocho perfecto.. Cuando esté listo, dejamos que repose antes de desmoldarlo. En frío es cuando lo tenemos que desmoldar para evitar que se rompa.. El resultado visualmente es el de un bizcocho contundente, pero probarlo es ya otro nivel. Es uno de los mejores dulces que existen.. Si eres fan de los bizcochos y quieres probarlo, no lo dudes, con galletas Oreo el resultado es impresionante. Si quieres versionarlo con otro tipo de galletas también quedará de vicio.. Decoramos con un poquito de azúcar glass, en caso de no haberle añadido más azúcar o con un poco de chocolate de cobertura.. Tendremos listo un bizcocho perfecto que podemos ‘tunear’ para cumpleaños, fiestas o días especiales.. Para una fiesta de cumpleaños, decoramos con las galletas oreo y la nata. Podemos poner el nombre con chocolate blanco por encima y en los laterales la nata y las galletas trituradas.. Cualquier fan de este tipo de galletas estará encantado de disfrutar de este bizcocho cargado de buenas sensaciones."
Receta de bacaladilla al horno,2021-02-06 11:00:07+00:00,https://okdiario.com/recetas/bacaladilla-horno-65951/,"1 kilo de bacaladillas (sin aletas, cabeza ni tripas). 5 dientes de ajo. 1 limón. 100 ml de aceite de oliva. Perejil al gusto. Patatas para guarnición. Sal y pimienta. Hierbas provenzales y aromáticas al gusto","Pelar las patatas y cortarlas en rebanadas gruesas. Untarlas con aceite de oliva, hierbas provenzales y aromáticas, sal y pimienta.. Precalentar el horno a 180° C.. Introducir las patatas al horno y cocinarlas durante 30 minutos, o hasta que estén listas.. Mientras tanto, recortar con tijeras las aletas pectorales y dorsales de las bacaladillas.. Salpimentar las piezas de pescado y colocarlas en un recipiente hondo, apto para el horno.. Picar los ajos muy pequeños, en brunoise muy fina.. Mezclar 100 ml de aceite con los ajos y verter sobre el pescado masajeando para que todo se impregne; cubrir con papel film y dejar macerar media hora (si hace calor, meter en la nevera).. Cortar los extremos al limón y luego a lo largo. Cortarlo después en medias rodajas y encajarlas entre las bacaladillas (que estarán bien juntas).. Meter al horno y hornear durante 15 minutos a 180° C (que será más o menos dependiendo del tamaño del pescado).. Servir inmediatamente."
Receta de Menestra de cordero,2021-02-06 09:00:11+00:00,https://okdiario.com/recetas/receta-menestra-cordero-3477198/,500 gramos de carne de cordero. ½ kilo de patatas. ½ cebolla mediana. 150 gramo de tomates rallados. 100 gramos de guisantes. 150 gramos de alcachofas. 150 gramos de champiñón. 10 gramos de pimentón dulce. 150 mililitros de vino blanco. 1 diente de ajo. Perejil. Sal. Aceite de oliva,"Picar la carne de cordero en trozos de tamaño intermedio.. Rallar el tomate con ayuda de un rallador de queso.. Pelar y cortar tanto la cebolla y el ajo en juliana muy fina.. Limpiar y cortar las alcachofas dejando su parte comestible.. Lavar los champiñones con suficiente agua y cortar en láminas.. Calentar una sartén y freír el tomate rallado con un poco de aceite.. Colocar aceite de oliva en una olla espaciosa y freír los trozos de cordero hasta sellar.. Incorporar a la olla del cordero las cebollas cuando la carne esté algo dorada. Rehogar durante unos tres minutos.. Añadir a la mezcla del cordero el vino blanco, el pimentón, y cocinar durante unos tres minutos más.. Verter un poco de agua en la mezcla de cordero y seguir cociendo hasta que la carne comience a estar tierna.. Pelar, trocear y cortar las patatas en pedazos medianos.. Cocer las patatas en la olla junto con el cordero y el resto de los ingredientes.. Incorporar a la olla los guisantes, los champiñones y las alcachofas.. Mantener la cocción hasta que el líquido rompa en hervor y todas las verduras estén suaves. Agregar el agua que sea preciso.. Rectificar el punto final de sal."
"Receta de Rosquillas de anís caseras, receta de la abuela",2021-02-05 17:30:25+00:00,https://okdiario.com/recetas/rosquillas-anis-caseras-46861/,600 gr de harina. 2 huevos. 150 gr de azúcar. 200 gr de leche. La ralladura de medio limón. 100 ml de aceite de girasol. 100 ml de anís. 1 sobre de levadura. Una pizca de sal. Aceite de girasol. Azúcar para decorar,"Esta receta es la típica que nos preparaba nuestra abuela o madre en esos días especiales de celebración. Solo olerlas ya era un placer y comerlas mucho más, el sabor del limón y el anís son los más auténticos de hace unas décadas.. Actualizaremos las rosquillas o las disfrutaremos por todo lo alto con la ayuda de unos sencillos trucos. Las abuelas o madres tenían mucha práctica, pero la podemos compensar con ayuda de unas herramientas básicas.. Nos ponemos manos a la obra tamizando la harina y la levadura. Con un colador pasamos toda la harina, de esta manera no nos quedará ningún grumo.. Dejamos la harina a un lado y nos ponemos con otro bol con los huevos. Cascamos los dos huevos y empezamos a batirlos.. Incorporamos poco a poco el azúcar hasta que estén perfectamente integrados estos dos ingredientes en una sola salsa ligera.. Le daremos el punto de grasa necesario sin incorporar casi nada de sabor con la llegada del aceite de girasol.. Conseguiremos de esta manera un acabado de excepción para un dulce que hará historia gracias al ingrediente que está a punto de llegar.. El anís es una bebida dulce con un olor característico. Usada para la sobremesa con un poco de café o para cocinar los pequeños bocados esponjosos y con personalidad que se preparaban para la ocasión.. Las rosquillas son uno de los dulces más cocinados con esta deliciosa bebida, pero no son los únicos, también podemos usarla en tartas de manzana con mucha alegría. La combinación con la manzana queda impresionante.. Con el anís integrado, añadimos la leche. Aromatizamos el conjunto con la ralladura de la cáscara de medio limón.. Le daremos un poco más de sabor a la leche si la hervimos con el limón, de esta manera no encontraremos los trocitos de la cáscara. Este paso lo podemos hacer de la manera que más nos guste.. Vamos añadiendo a esta base líquida la harina y la levadura. Poco a poco la masa irá cogiendo consistencia.. Sabremos que está perfecta cuando no se pegue a las manos. En ese momento dejamos que repose la masa durante una hora.. Este tipo de dulces necesita su tiempo, aunque merece la pena el esfuerzo para que quede perfecto.. Con todo listo llegará el momento de hacer las rosquillas. Si queremos que nos queden bonitas, seguiremos estos pasos.. Enharinamos una superficie de trabajo. Con el rodillo haremos una lámina del mismo tamaño. Debe tener un grosor adecuado, teniendo en cuenta que al freírse ganarán volumen.. La base la vamos a cortar en forma circular, podemos usar un vaso, nos quedará igual de bien y solo tendremos que hacerle el agujero en el centro.. Para hacer el agujero, podemos incluso usar el dedo o el mango de una espátula, cortamos con el cuchillo y retiramos el centro. Las rosquillas no son muy grandes.. El siguiente paso, mientras las rosquillas reposan es calentar el aceite. Unas buenas rosquillas se preparaban en aceite de girasol.. Cuando está caliente vamos friendo las rosquillas hasta que estén doradas, en ese momento les damos la vuelta y esperamos a que estén listas.. Colocamos las rosquillas sobre un papel absorbente para que eliminen el exceso de aceite. Solo nos quedará esperar a que se enfríen un poco y rebozar con el azúcar.. Si queremos hacerlas con un poco menos de grasa, las podemos cocinar al horno. En este caso calentamos el horno a 220º.. Ponemos las rosquillas en una fuente para horno forrada con papel vegetal para que no se pegue la masa.. Pintamos las rosquillas con un poquito de aceite por encima para que tengan color. Horneamos a 180º unos 15 minutos hasta que estén listas.. De igual forma que las anteriores, las vamos a rebozar con azúcar. Podemos saltarnos este paso si buscamos un acabado light.. Disfrutaremos de una combinación de ingredientes impresionante que se cocina en un tiempo récord. Regresa al pasado con esta combinación de sabores que impresiona."
Receta de Merluza rellena de gambas,2021-02-05 16:00:09+00:00,https://okdiario.com/recetas/merluza-rellena-gambas-2799360/,2 lomos de merluza. 200 gr de gambas frescas o congeladas. 100 gr de almejas o mejillones.. 1 diente de ajo. 1 vaso de vino blanco. 2 cucharadas de harina. Aceite de oliva. Sal. Pimienta. Perejil picado,"Esta receta nos ayudará a disfrutar de unos alimentos que pueden ser frescos, procedentes directamente de nuestras costas.. Tendremos un buen producto, aunque el coste será mucho más elevado, merecerá la pena el esfuerzo. En el caso del pescado una vez nos lo entreguen limpio en la pescadería siempre será mejor congelarlo previamente.. Si tenemos un buen producto congelado, será la excusa perfecta para comerlo en compañía de nuestros seres queridos.. Descongelamos el producto previamente, en el caso de las gambas si las queremos cocinar peladas, no esperamos a que se descongelen. Podemos pelarlas cuando se estén descongelando de esta manera el proceso es más sencillo.. Nos pondremos manos a la obra con los lomos de merluza. Este elemento es más fácil de cocinar, lavamos bien el pescado y le retiramos cualquier espina que pueda haber quedado.. Usaremos las cáscaras de las gambas para cocinar un caldo fácil de preparar que tendrá una serie de sabores espectaculares listos para la acción.. Sofreímos en un cazo con un chorrito de aceite las cabezas y las cáscaras. Cuando hayan cogido color añadimos agua y de esta manera conseguiremos un caldo casi de profesionales.. Con el caldo preparado nos pondremos manos a la obra con el relleno de esta merluza, las gambas.. Pelamos el ajo y lo cortamos muy finito. Vamos a freír el ajo en una sartén con un chorrito de aceite.. Le añadimos las gambas para que se cocinen y adquieran ese punto de color y sabor que le dará gracia al plato.. Acabaremos este pescado al horno, para que quede perfecto, precalentamos el horno, lo ponemos a 220ºC para que tarde unos minutos en estar preparado el plato.. Preparamos una fuente apta para horno. Partimos o abrimos los lomos de merluza por la mitad, los salpimentamos al gusto.. Colocamos en el interior las gambas, podemos cortarlas o triturarlas para que nos quede un relleno más suave.. Uniremos las dos partes de las merluzas con la ayuda de un hilo de cocina, de esta manera se cocinarán de forma uniforme y nos quedará una merluza más bonita,. En un bol mezclamos el aceite de oliva suave, podemos usar de girasol en caso de no tener de oliva. Con estos dos ingredientes fusionados le pondremos medio vaso de caldo de gambas.. Vertemos este líquido sobre la merluza, nos interesa que nos quede una merluza suave y jugosa con todo el sabor de estos ingredientes.. Horneamos a 180º durante unos 8 minutos. Pasado este tiempo, le podemos añadir unas almejas que tendremos bien limpias. Del propio calor del resto de los ingredientes se abrirán.. Aportarán ese jugo especial que ayudará a crear un plato con todo el sabor del mar con el mínimo esfuerzo. Podemos ponerle unos langostinos para completar el plato.. Para acabar de crear un plato digno de una estrella Michelín cocinaremos una ligera bechamel con el caldo de gambas sobrante.. Ponemos dos cucharadas de aceite en un cazo, añadiremos la misma cantidad de harina. Tostamos la harina a fuego lento.. La harina deberá coger color para evitar que nos quede un plato con sabor a crudo. Con todo listo vamos añadiendo poco a poco el caldo.. Conseguiremos una especie de bechamel ligera. Podemos ponerle un poquito de leche si queremos que tenga ese color blanco al que estamos acostumbrados.. Rectificamos de sal y pimienta. Este elemento irá directamente al plato para cubrir la merluza con gambas que tenemos en el horno.. Le añadirá cremosidad y hará que sea más fácil que podamos disfrutar de esta delicia en estado puro.. Servimos en caliente, incluyendo las almejas que quedarán increíbles en esta salsa que tiene todo el sabor de las gambas y de la merluza.. A la hora de decorar podemos añadir un poquito de perejil picado, no le faltará nada más a este plato de pescado para triunfar.. Acompañamos de un buen vino blanco nacional y disfrutamos de una combinación de sabores maravillosa. Toma nota de esta receta, es fácil de preparar y queda de vicio."
