title,date,url,ingredients,steps
Bombones de chocolate con naranja y jengibre,2021-11-29 12:45:07+00:00,https://okdiario.com/recetas/bombones-chocolate-naranja-jengibre-8192380/,400 gramos de chocolate negro (70 % cacao). Ralladura de naranja. 50 mililitros de licor dulce. Jengibre molido. 40 gramos de mantequilla,"Vierte en un bol la ralladura de naranja, el licor, el jengibre y la mantequilla. Introduce en el microondas hasta que derrita todo o cocina a fuego lento.. Corta finamente el chocolate para que se derrita mejor. Agrega a la mezcla derretida el chocolate troceado. Remueve suavemente con una espátula hasta incorporar bien todos los ingredientes. En caso que se enfríe y no se haya mezclado por completo, introduce unos segundos más al microondas o pon sobre el fuego bajo. Distribuye la mezcla sobre un molde de silicona con la forma que prefieras. Introduce al refrigerador de 2-3 horas o hasta que estén firmes."
Fesols de Santa Pau con butifarra,2021-11-29 11:00:03+00:00,https://okdiario.com/recetas/fesols-santa-pau-butifarra-8192220/,300 gramos de Fesols de Santa Pau. Laurel. Puerro. 2 butifarras (medianas). Setas (pueden ser variadas). Perejil cortado. Sal. Pimienta negra. Aceite de oliva,"Remoja los fesols de Santa Pau desde la noche anterior.. Al día siguiente, cuela las alubias.. Échalos en una cazuela y vierte suficiente agua con un punto de sal, hasta que los cubra (alrededor hora y media). Agrega el laurel y el puerro cortados. También puedes agregar una cabeza de ajo un poco cortada por la mitad, medio tomate, media cebolla grande y una zanahoria.. Cuando estén tiernas las alubias, rectifica el punto de sal y la pimienta negra.. Sobre una sartén vierte un chorrito de aceite de oliva y añade las butifarras peladas.. Aprieta suavemente con un tenedor hasta que desmenuce. Cuando haya dorado, agrega las setas troceadas (preferiblemente níscalos). Da un punto de sal.. Saltea hasta que estén listos. Agrega los fesols de Santa Pau, mezcla un poco y retira del fuego."
Curry verde de pollo con arroz y verduras,2021-11-29 09:00:35+00:00,https://okdiario.com/recetas/curry-verde-pollo-arroz-verduras-8192021/,4 contramuslos de pollo. 15 mililitros de curry verde. 1 taza de arroz. 5 gramos de jengibre rallado. 2 gramos de comino molido. 2 gramos de pimentón picante. 4 o 5 hojas de lima kaffir (también funciona ralladura de lima). 200 mililitros de leche de coco. Caldo de pollo o verduras. 2 zanahorias. 250 gramos de calabacín. 1 cucharada de cilantro. Sal. Pimienta. Ajo polvo. Aceite de oliva. Zumo de lima o limón,"Cortar el jengibre y el ajo finamente.. Pela y corta la zanahoria y el calabacín.. Deshuesar los contramuslos de pollo y limpiar la grasa extra.. Sazona con la sal y pimienta.. Vierte en una cazuela un chorro de aceite de oliva, añade el ajo, comino, el pimentón picante, el jengibre.. Agrega el curry verde a la mezcla cuando ya esté dorada.. Cuando se hayan mezclado los ingredientes, incorpora la leche de coco hasta que se fusionen los sabores a fuego lento.. Las verduras y pollo reservados añádelos a la mezcla.. Remueve suavemente. Coloca la tapa y espera 40 minutos.. Vierte el arroz y el caldo de pollo hasta que se cocine lentamente sin tapar.. Rectificar el punto final de sal."
Mantequilla de manzana con sidra,2021-11-29 08:45:35+00:00,https://okdiario.com/recetas/mantequilla-manzana-3096145/,2 Kilos de manzana. 200 gramos de azúcar moreno. 1 botella de sidra natural. 7 clavos de olor. Nuez moscada. Canela. Pimienta negra,"Lavamos muy bien todas las manzanas y pelamos con cuidado.. A continuación, cortamos en trozos pequeños pero de tamaño similar para que se cocinen al mismo tiempo.. En una olla vertemos la sidra y cocinamos con las manzanas a fuego bajo.. Cuando los trozos de manzana estén blandos agregamos los demás ingredientes, los clavos, el azúcar, la canela, nuez moscada y pimienta negra.. Mezclamos todo muy bien y tapamos. Dejamos cocer a fuego bajo durante una hora y media. En caso de tener una olla rápida nos tomará menos tiempo.. En el momento en que la mantequilla se torne de un color tostado y se fusione la manzana con el azúcar sabremos que está lista. . Retiramos del fuego y dejamos enfriar. Luego pasamos a un envase con tapa para conservarla por más tiempo.. Puede mantenerse varios días en buen estado si la conservamos en la nevera bien tapada."
"Bizcocho de pera al microondas, receta de merienda o desayuno rápido",2021-11-28 17:00:04+00:00,https://okdiario.com/recetas/bizcocho-pera-microondas-receta-merienda-o-desayuno-rapido-8187975/,150 gr de azúcar moreno. 200 gr de harina. 100 gr de mantequilla. 2 yogures naturales. 2 huevos. 10 gr de levadura. 1 cucharada de canela. 4 peras,"Uno de los primeros trucos para que nos quede perfecto cualquier postre hecho en el microondas es tener el molde apto. Untamos el molde con un poco de mantequilla para que no se pegue, en caso de ser antiadherente no será necesario.. Nos ponemos manos a la obra batiendo los huevos con el azúcar y la mantequilla. Las varillas eléctricas nos ayudarán a conseguir una base que doblará su tamaño.. Hemos elegido un azúcar moreno, pero puedes ponerle cualquier tipo o incluso un edulcorante natural como la miel o la Stevia, igualmente quedará bien.. Le daremos un poco de alegría a esta base con los yogures naturales, un griego quedará de vicio, son más cremosos y siempre le darán un toque extra de buenas sensaciones.. Cuando tenemos los yogures integrados, será el momento de darle el toque especial con la canela que combina increíblemente bien con las peras.. Llega el turno de la harina, la vamos a tamizar junto a la levadura para que se integre perfectamente en esta masa que recibirá a una fruta de lo más especial.. Con todo listo, llega el momento estelar de las peras, las vamos a lavar bien y pelar con cuidado, podemos trocearlas o rallarlas.. Dependiendo si nos gusta encontrar los trocitos en la masa o si queremos que desaparezcan por completo integrándose en este bizcocho de lujo.. Podemos ponerle unos trocitos de chocolate, le vendrá de maravilla a la pera y nos quedará un bizcocho espectacular.. Vertemos la masa en el molde y colocamos a máxima potencia en el microondas durante 7 minutos.. Comprobamos que el bizcocho esté listo, dejamos que repose y si es necesario le colocamos 3 minutos más.. Habremos creado un bizcocho espectacular en un abrir y cerrar de ojos, solo nos quedará probarlo y disfrutarlo."
"Boniato relleno de queso y pera, receta gourmet original y saludable",2021-11-28 15:00:01+00:00,https://okdiario.com/recetas/boniato-relleno-queso-pera-receta-gourmet-original-saludable-8187887/,Boniato. 1 pera. 200 gr queso ricotta o requesón. 1 rulo de queso de cabra. Sal. Pimienta. Canela al gusto,"Esta receta de boniato relleno de queso y pera es ideal para una de esas cenas románticas que se cocinan a la velocidad de la luz.. Podemos prepararlo con antelación y dejarlo listo para el gratinado en el horno, con una tabla de ibéricos y una botella de vino, el éxito será total.. Nos ponemos manos a la obra cocinando el boniato, lo ponemos en el microondas a máxima potencia durante unos 10 minutos.. Dependiendo de lo grande que sea y de la potencia del microondas puede necesitar un poco más. Comprobamos que esté cocinado.. Partimos el boniato por la mitad, lo vaciamos con la ayuda de una cuchara dejando la base que usaremos como recipiente.. El boniato que hemos sacado con la cuchara irá directamente a un bol donde lo vamos a mezclar con el resto de los ingredientes.. Añadimos la ricotta o el requesón, también podemos usar un queso de untar, debe ser un queso cremoso que se mezcle perfectamente con el resto de los ingredientes.. La pera la pelamos y la cortamos en trocitos pequeñitos, podemos rallarla para que se mezcle mejor con el boniato y la ricotta.. El secreto de esta delicia es el toque de canela, le añadimos media cucharadita. Mezclamos bien y volvemos a rellenar el boniato.. Para darle el punto de calor final y el toque salado, usaremos un poco de queso de cabra, lo cortamos en trocitos y colocamos por encima.. Gratinamos al horno a 180º hasta que esté dorado el queso de cabra. Lo idea es mientras hacemos el aperitivo cocinarlo, así lo comemos en su punto.. Atrévete a probar un boniato relleno de queso y pera, es uno de esos platos que destaca y es muy fácil de preparar."
Muñecos de nieve con huevos duros,2021-11-28 13:00:34+00:00,https://okdiario.com/recetas/munecos-nieve-huevos-duros-8178649/,6 huevos. 6 huevos de codorniz. 24 clavos. Hojas de lechuga. Zanahorias. Aceitunas,"En una cacerola con agua, cocina los huevos durante 8 minutos. A los 4 minutos, agrega los huevos de codorniz, para que se cocinen 4 minutos.. Retira los huevos del agua y colócalos en un recipiente con agua fría. Deja que se enfríen unos minutos, luego pélalos y resérvalos.. Corta una zanahoria en rodajas, colócalas en un cazo pequeño con agua y cocínalas hasta que estén tiernas.. Utiliza un cuchillo bien afilado y corta palitos de zanahoria pequeños, para hacer las narices. Ralla el resto de la zanahoria para decorar.. En una fuente amplia, dispón las hojas de lechuga lavadas.. Corta una rebanada de cada huevo de gallina, para que se mantengan en pie y apoya los huevos sobre la lechuga.. Coloca en cada huevo un palillo, verticalmente. Encima, pincha los huevos de codorniz para formar las cabezas de los muñecos de nieve.. En la parte superior de la cabeza, pincha los sombreros de zanahoria. . Agrega las narices de zanahoria y haz los ojos y los botones del muñeco con clavos.. Termina la decoración con aros de aceitunas y coloca la zanahoria rallada sobre el césped de lechuga.. Al momento de comer, retira los clavos y sirve con la salsa que prefieras."
Crema thai con coco y langostinos,2021-11-28 11:00:10+00:00,https://okdiario.com/recetas/crema-thai-coco-langostinos-8178511/,300 gramos de langostinos cocidos. 5 gramos de lemon grass o citronela. 20 gramos de jengibre. 100 gramos de cebolla redonda. 400 gramos de leche de coco. 120 gramos de champiñones. 35 gramos de salsa de pescado. Zumo de limón. 1 cucharada de azúcar. Pimienta. Cilantro picado,"Vierte un chorro de aceite en una cazuela y añade la cebolla cortada.. Agrega lentamente la leche de coco y mezcla despacio.. Incorpora a la preparación el lemon grass troceado, el jengibre rallado, los champiñones cortados y la salsa de pescado.. Añade el zumo de limón, la pimienta y una cucharada de azúcar.. Mezcla y deja que hierva durante 15 minutos.. Retira del fuego y licúa todo hasta lograr una crema.. Pon el conjunto a punto de sal.. Añade los langostinos previamente lavados y cocidos, y déjalos 1 minuto sobre el fuego hasta que los sabores se incorporen por completo."
Rillettes de salmón ahumado,2021-11-28 09:00:09+00:00,https://okdiario.com/recetas/rillettes-salmon-ahumado-8171649/,300 gramos de salmón. 80 gramos de salmón ahumado. 80 gramos de mantequilla. 10 gramos de nata fresca. ½ manojo de cebolletas. ½ limón. Eneldo. Sal. Pimienta,"En un bol, mezcla el salmón ahumado con la mantequilla. Condimenta con eneldo, revuelve y reserva.. Enjuaga el salmón fresco, sécalo y colócalo en un plato apto para microondas. . Cocina durante 1 minuto, luego retira la piel y desmenúzalo.. Añade el jugo de limón recién exprimido, las cebolletas picadas finas, sal y pimienta. . Incorpora el salmón ahumado y la nata. Mezcla bien hasta homogeneizar los ingredientes.. Rectificar el punto de sal final, sin olvidar que el salmón ya tiene un matiz salado.. Reserva en el refrigerador durante al menos 3 horas."
"Quiche de setas vegana, receta saludable de cena fácil de preparar",2021-11-27 17:00:53+00:00,https://okdiario.com/recetas/quiche-setas-vegana-receta-saludable-cena-facil-preparar-8184225/,Para la masa:. 110 gr de harina integral. 110 gr de harina común. ½ cucharadita de sal. 110 gr de margarina vegana,"Esta receta no tiene complicación es tan sencilla que el primer paso consistirá en encender el horno para que esté listo.. Podemos comprar la masa ya lista o hacerla al momento. Para conseguir que nos quede perfecta usaremos margarina vegana.. Ponemos la margarina cortadita en cubos a temperatura ambiente, le añadimos el resto de los ingredientes. Amasamos bien y con esta masa forramos el molde que tendremos listo.. Un molde antiadherente, engrasado con aceite de oliva o forrado con papel de horno evitará que se pegue la masa.. Para el relleno vamos a pelar y trocear las cebollas y ajos bien pequeñitos. En una sartén con un chorrito de aceite empezaremos a pocharlos.. Cuando estén listos añadimos las setas lavadas y troceadas dejamos que se cocinen unos minutos antes de añadirle el vino.. En el momento en que se haya evaporado, ponemos la harina removemos un poco y dejamos que se tueste con todos los sabores.. Vamos añadiendo poco a poco la leche de almendras hasta que esté bien integrada, empezará a espesar el conjunto.. Será el momento de rectificar de sal y pimienta siguiendo nuestros gustos, tendremos el relleno del quiche preparado.. Vertemos sobre la masa que tenemos ya lista. Horneamos a 180º unos 20 minutos hasta que tenemos la masa y el relleno preparados.. Disfrutaremos de un plato vegano espectacular que se prepara en un abrir y cerrar de ojos sin apenas esfuerzo."
"Trufas de chocolate con pacharán, receta de postre rápido para disfrutar",2021-11-27 15:00:23+00:00,https://okdiario.com/recetas/trufas-chocolate-pacharan-receta-postre-rapido-disfrutar-8184194/,125 gr de mantequilla. 1 tableta de chocolate sin leche. 1 huevo. 2 cucharadas soperas de pacharán. Cacao en polvo,"Este postre no tiene complicación alguna, debemos tener en cuenta que los ingredientes principales y nuestra habilidad son claves para crear el bocado que buscamos.. El chocolate sin leche será el que elijamos, podemos ponerle uno con más o menos intensidad del cacao, incluso alguna variedad con café, estarán de vicio.. Las trufas se empiezan a preparar mezclando los ingredientes principales que le darán color y sabor a esta delicia.. En un cazo ponemos la mantequilla. Troceamos el chocolate para que se funda más rápido y añadimos el licor.. La cantidad de pacharán dependerá en gran medida de nuestros gustos, podemos ponerle más o menos. Un poco de alegría nunca viene mal y si es con chocolate mejor.. Cuando tenemos todos los ingredientes perfectamente integrados, será el momento de reservamos, mientras seguimos con el huevo.. Separamos la clara del huevo, usaremos la yema en primer lugar. Añadimos la yema al chocolate fundido, le dará brillo e intensidad.. No dejamos de mezclar la yema con el chocolate o se nos puede cuajar, es importante hacerlo cuando esté frio.. Seguimos con la clara, la batimos a punto de nieve y la incorporamos al chocolate, de esta manera nos quedarán unas trufas de profesional.. Esta mezcla la dejamos en la nevera hasta el momento de hacer las trufas, podríamos usar un molde para que nos queden todas iguales.. Hacemos las bolitas con las manos o unas cucharas que nos ayuden a darles la forma que queremos a las trufas.. Las vamos a rebozar con cacao en polvo para que queden con más sabor de chocolate. Presentamos en una fuente bonita para disfrutar de esta maravilla casera fácil de preparar."
"4 recetas de aperitivos para Navidad, fáciles y económicos",2021-11-27 13:00:46+00:00,https://okdiario.com/recetas/4-recetas-aperitivos-navidad-faciles-economicos-8178365/,1 mini baguette. 200 gramos de bonito de lata. 100 gramos de mayonesa. 1 cebolleta. 1 tomate. 2 dientes de ajo. Perejil,"Corta el pan en rebanadas finas.. Pica los ajos finamente, la cebolleta en aros gruesos y el tomate en rebanadas.. Mezcla el ajo con la mayonesa y esparce en cada rodaja de pan.. Agrega aros de cebolla, luego tomate y encima el bonito de lata en tiras.. Pincha todo con un palillo y decora con perejil."
"Jalea de maracuyá casera, con y sin albedo",2021-11-27 11:00:54+00:00,https://okdiario.com/recetas/jalea-maracuya-casera-sin-albedo-8178252/,2 maracuyá grandes. Azúcar. Agua,"Corta los maracuyá a la mitad y retira la pulpa.. Coloca la pulpa en el vaso de la licuadora, agrega un poco de agua, bate 1 minuto y reserva.. Si vas a utilizar el albedo, corta y desecha la parte amarilla de la cáscara, luego rebana el albedo en tiras bien finas y hiérvelas con un poco de agua hasta que estén bien suaves. A continuación, tritura estas tiras en la licuadora (junto con el agua) hasta obtener un puré. Combina el albedo con la pulpa.. Mide las cantidades de pulpa (con o sin albedo) y mézclala con azúcar, dentro de una cacerola, en partes iguales. Si tienes 1 taza de pulpa, usa 1 taza de azúcar.. Revuelve hasta homogeneizar y cocina hasta que espese, aproximadamente 20 minutos.. Deja enfriar, envasa la jalea de maracuyá y guárdala en el refrigerador."
Postre de pera rápido con mascarpone,2021-11-27 09:00:07+00:00,https://okdiario.com/recetas/postre-pera-rapido-mascarpone-8171486/,1 pera. Galletitas de canela. Queso mascarpone. Queso crema blanco. Canela. Azúcar. Agua,"Pela la pera, retira el cabo y el centro y córtala en cubos pequeños.. Coloca algunas galletas en un recipiente y tritúralas sin llegar a hacerlas polvo.. En una cacerola pequeña, prepara un almíbar en una proporción de 2 partes de azúcar por 1 parte de agua.. Cocina hasta que el azúcar se disuelva, 1 o 2 minutos luego de que entre en ebullición. Apaga el fuego y reserva.. Aparte, mezcla el queso mascarpone con el queso blanco.. En los vasos, coloca una capa de galletitas, luego vierte unas cucharadas de almíbar, continúa con la mezcla de quesos y luego la pera en pequeños dados. . Haz las capas necesarias, intercalando cucharadas de almíbar en cantidades suficientes, hasta llegar al borde del vaso o recipiente.. Para terminar, agrega una capa de mascarpone y espolvorea con canela.. Lleva al refrigerador durante 1 hora, al menos.. ¡Disfruta!"
Grechotto: guisado con alforfón y leche de coco,2021-11-26 12:45:47+00:00,https://okdiario.com/recetas/grechotto-guisado-alforfon-leche-coco-8178160/,350 gramos de boniatos. 200 gramos de trigo sarraceno. 2 cebollas. 2 dientes de ajo. 100 mililitros de vino blanco. 50 mililitros de leche de coco. 50 mililitros de caldo de verduras. 20 mililitros de aceite de oliva. 30 gramos de tocino o panceta. 20 gramos de queso parmesano. ½ cucharadita de sal. ¼ cucharadita de cúrcuma. ¼ cucharadita de pimentón. Perejil fresco,"Lava los boniatos, sécalos y pínchalos con un cuchillo en varios lugares.. Envuélvelos en papel de aluminio, colócalos en una fuente y hornea durante 50 minutos, aproximadamente, a 200°C. Antes de retirar los boniatos del horno, pínchalos con un tenedor para asegurarte que están bien blandos.. Deja que se enfríen, córtalos a la mitad y retira la pulpa. Colócala en el vaso de la licuadora y tritura hasta obtener un puré suave.. Pela y pica la cebolla y el ajo. En una sartén con 1 cucharada de aceite de oliva, sofrita solo la mitad del ajo y la cebolla durante 5 minutos.. Agrega el vino blanco y cocina hasta que se evapore.. Añade la leche de coco, el caldo de verduras, el puré de boniatos, sal y condimentos.. En una sartén sofríe el trigo sarraceno con el ajo y la cebolla restante, durante 2 o 3 minutos.. Retira e incorpora a la cocción y cocina durante 25 minutos más.. Fríe las lonchas de panceta en aceite caliente y pásalo después a un plato con papel absorbente, para quitar el exceso de grasa.. Lava y pica el perejil.. Sirve el grechotto, acompañado de los trozos crujientes de la panceta.. Espolvorea por encima el queso rallado y el perejil picado."
"Rollitos de pollo rellenos de setas, rápidos y fáciles",2021-11-26 11:00:27+00:00,https://okdiario.com/recetas/rollitos-pollo-rellenos-setas-rapidos-faciles-8178130/,4 filetes de pollo grandes. 400 gramos de champiñones. 1 cebolla o chalota. 1 cucharada de estragón picado. 1 cucharada de aceite de oliva. Sal. Pimienta,"Cepilla suavemente los champiñones para limpiarlos y córtalos en trozos bien pequeños. No es interesante lavarlos debajo del grifo, pues son como unas pequeñas esponjas que absorben agua.. Pela la cebolla (o la chalota) y córtala en rodajas finas.. Vierte un chorrito de aceite de oliva en una sartén, dora la cebolla y agrega luego los champiñones picados.. Cocina a fuego lento hasta que las setas estén tiernas. . Agrega un poco de sal, pimienta y estragón, a gusto.. Si los filetes son muy anchos, córtalos a la mitad, a lo largo. Coloca cada filete sobre un trozo de papel film. Esparce por encima una cucharada de relleno y enrolla en espiral, suave pero firmemente.. Envuelve cada rollito en el film, cierra el paquetito y reserva en el refrigerador, de 15 a 20 minutos.. Pasado ese tiempo, retira el papel film y saltea los rollitos en una sartén antiadherente con un poquito de aceite, 5 minutos de ambos lados. Si lo prefieres, pínchalos con palillos de dientes, para que no se desarmen.. Una vez listos, corta los rollitos en rodajas y sírvelos con puré de patatas, de boniato o de calabacín."
Bizcocho de almendras dieta cetogénica,2021-11-26 10:45:05+00:00,https://okdiario.com/recetas/bizcocho-almendras-dieta-cetogenica-8178049/,3 y ½ tazas de harina de almendras. ¾ tazas de crema agria. ½ taza de edulcorante en polvo. 1/3 taza de mantequilla. 4 huevos. ½ cucharadita de polvo de hornear. ¼ cucharadita de polvo de sal. ½ cucharadita de extracto de vainilla. ¼ cucharadita de extracto de almendras,"Precalienta el horno a 180°C, unta un molde de horno con mantequilla y fórralo con papel vegetal.. En un bol, deshaz la mantequilla con un tenedor (previamente ablandada), agrega el edulcorante en polvo y mezcla bien, hasta que se integren totalmente ambos ingredientes.. Aparte, combina la harina de almendras, el polvo de hornear y la sal.. En un tercer recipiente, bate los huevos, agrega la crema agria, la vainilla y el extracto de almendras.. Mezcla los ingredientes líquidos y luego agrégalos a la mezcla seca poco a poco, revolviendo hasta obtener una crema homogénea.. Vierte en la fuente de horno y hornea el bizcocho durante 30 minutos, aproximadamente, hasta que, al insertar un palillo, salga limpio.. Retira del horno y deja que se enfríe completamente, mientras preparas la cobertura.. En una cacerola pequeña, derrite la mantequilla y agrega los demás ingredientes, excepto las almendras laminadas. . Revuelve bien hasta homogeneizar, apaga el fuego y deja enfriar un poco.. Reserva 1 cucharada del glaseado y vierte el resto sobre el bizcocho.. Espolvorea por encima las almendras tostadas y laminadas, aprieta un poco para que integren y luego esparce la cucharada de glaseado restante, para ayudar a sellar la cobertura.. Deja que se enfríe completamente.. Si lo deseas más dulce, puedes espolvorear por encima un poco de edulcorante en polvo al servir."
Pastel de mousse de fresas y chocolate blanco,2021-11-26 09:45:44+00:00,https://okdiario.com/recetas/pastel-mousse-fresas-chocolate-blanco-8177170/,200 gramos de azúcar. 200 gramos de almendras molidas. 100 gramos de mantequilla. 4 huevos,"Prepara la base. Combina en un bol todos los ingredientes, revuelve bien y hornea en una fuente forrada con papel, durante 20 minutos, en horno precalentado a 200 °C.. Al retirar deja que se enfríe, desmolda y coloca el bizcocho sobre una fuente para servir.. A continuación haz la mousse de chocolate blanco. Monta primero las natas (de ambas mousses) y reserva un poco para la decoración final.. En un bol, mezcla el azúcar con las yemas y agrega la leche tibia. Calienta revolviendo constantemente hasta que espese.. Añade el chocolate blanco cortado en trozos, revuelve hasta que esté derretido y agrega la gelatina previamente hidratada.. Incorpora la nata, revuelve bien y vierte en un aro de repostería (del tamaño de la base). Refrigera hasta que se congele.. Prepara la mousse de fresa, utilizando 400 gramos de las fresas. Coloca las fresas limpias y lavadas en una cacerola, agrega un poco de agua y el azúcar. . Cocina unos minutos, apaga el fuego, agrega la gelatina previamente hidratada y la nata montada. Mezcla bien, vierte en otro aro de repostería y deja que se congele.. Retira las mousses del frío y monta el postre, colocando encima del bizcocho la mousse de chocolate blanco y encima, la mousse de fresas.. Decora con el chantilly restante y las frutillas que has reservado.. Mantén el pastel en el refrigerador durante al menos 4 horas."
