title,date,url,ingredients,steps
Receta de Buñuelos de Águilas de carnaval,2021-02-13 20:00:56+00:00,https://okdiario.com/recetas/receta-bunuelos-aguilas-carnaval-6826389/,125 ml de leche. 125 gr de harina. 4 gr de levadura. Aceite de oliva. 1 huevo. Azúcar para rebozar,"Esta sencilla receta de buñuelos de Águilas es una de las más típicas de esta época del año. Se buscaba aprovechar al máximo los ingredientes más básicos de la cocina en un dulce que se cocina frito.. Los fritos son muy típicos de los meses que hacía frío. Si retrocedemos en el tiempo, había unos básicos, una comida más contundente en invierno y ligera en verano.. Dependía en gran medida de la actividad o los ingredientes que acababan en las despensas. Los buñuelos son un básico que recorre la geografía de nuestro país.. En todas las sartenes del país se han cocinado para recrear ese sabor intenso, pero sobre todo la textura crujiente que proporciona.. Rebozados con un poco de azúcar conseguiremos darle el acabado perfecto a esta receta cargada de buenas sensaciones.. Para preparar esta masa fácil y deliciosa, nos pondremos manos a la obra con la masa de esta delicia. La realidad es que es tan sencilla de hacer que los vamos a cocinar en más de una merienda i desayuno.. No es necesario que sea estas fechas del año para empezar a mezclar los huevos con la leche. Incluiremos 30 mililitros de aceite de oliva.. La masa no lleva azúcar, rebozaremos a posteriori esta delicia con el sabor dulce al final de este proceso.. Le añadimos la harina hasta que espese y nos quede una masa de buñuelos suave, que podemos manejar fácilmente para poder freírlos bien.. Con la masa lista, el siguiente paso igual de importante que el anterior es preparar la sartén. Colocamos una buena cantidad de aceite de oliva.. El aceite debe estar caliente para que nos queden unos buñuelos perfectos, fritos y con la textura adecuada por dentro.. La cantidad de aceite debe ser la adecuada para que se pueden freír de forma uniforme y nos queden dorados al momento.. El tipo de aceite marcará el acabado final de esta delicia. El aceite es un poco más intenso, pero no debemos olvidar el de girasol, perfecto para cocinar dulces.. Para que nos queden unos buñuelos del tamaño perfecto, podemos usar un par de cucharadas. Le damos forma con ellas para poder freír siempre las mismas bolitas de masa.. Podemos usar una manga pastelera que consiga crear las mismas porciones de alegría de esta masa.. A medida que vamos colocando la masa en el aceite estamos pendiente de ella. Se cocinará muy rápidamente.. En unos minutos estará lista, es importante cuando friamos este tipo de dulces, estar muy pendiente.. Unos segundos de más puede suponer que nuestros buñuelos no nos queden bien hechos, incluso puede que se quemen, si nos despistamos.. Preparamos un plato o una fuente con papel de cocina. A medida que tenemos los buñuelos listos los ponemos sobre este papel.. De esta manera eliminaremos el exceso de aceite. El papel absorbente será el encargado de evitar que nos queden unos buñuelos demasiado aceitosos.. Cuando tenemos todos los buñuelos listos, los rebozamos con el azúcar y si nos gusta un poquito de canela.. Habremos cocinado unos buñuelos típicos de carnaval. En otros tiempos encontraríamos esta delicia en uno de los puestos de camino a las fiestas.. Hace un año se bailaba y disfrutaba del carnaval. Estos buñuelos eran perfectos para poder coger fuerzas de camino a una fiesta o no parar de bailar hasta el amanecer.. En estos tiempos de confinamiento, podemos prepararlos y comerlos con moderación o combinarlos con un poco de actividad física.. Carnaval pasará desapercibido este año, en un momento en el que se necesita más que nunca la alegría que genera.. No debemos renunciar a lo que haríamos en estos tiempos complicados. Un poco de fiesta, aunque sea casera es esencial en estos tiempos que corren.. Los dulces son una forma de conectar con una celebración que sin ellos sería especialmente complicado.. Un poco de vino dulce o cava puede acompañar estos buñuelos típicos de carnaval. Atrévete a cocinarlos son muy fáciles de preparar.. El resultado de esta receta es un dulce bocado cargado de energía. No dudes en cocinarlos siempre que te apetezcan. Viaja a Murcia sin salir de casa, disfrutando de su gastronomía."
Menú fácil para San Valentín con Thermomix,2021-02-13 09:00:30+00:00,https://okdiario.com/recetas/menu-facil-san-valentin-thermomix-6820303/,50 gramos de zanahoria. 80 gramos de puerro. 20 mililitros de aceite. 20 gramos de maíz dulce. 1 huevo. 50 gramos de pimiento morrón asado. Masa de hojaldre,Se lavan y pelan las zanahorias y el puerro. Se cortan y se colocan en el vaso de la Thermomix. Picar durante 5 segundos a velocidad 5.. Se añade el aceite y se procesa durante 10 minutos a 100º y velocidad 1.. Se incorpora el maíz y se mezcla con cuchara.. Precalentar el horno a 180º C.. Se cortan cuadrados de hojaldre de 12 cm de lado. Se coloca relleno en el centro y se los cierra como formando sobres.. Pincelar con huevo batido y se decoran corazones de morrón.. Se hornean durante 10 minutos.
Receta de Callos a la gallega,2021-02-12 17:00:15+00:00,https://okdiario.com/recetas/callos-gallega-2834358/,1 kilo de garbanzos. 1 kilo de callos de ternera. 1 pata de cordero. 2 chorizos. 1 cabeza de ajo. 300 gramos de tocino. 300 gramos de jamón. 1 cebolla. 7 gramos de comino. Un puñado de perejil. Pimentón dulce. Sal. Aceite de oliva virgen extra. 4 limones,"Poner los garbanzos en remojo desde la noche anterior.. Limpiar con detalle los callos utilizando sal gruesa y un cepillo de cocina. Enjuagar con abundante agua.. Pelar y cortar las patatas en dados y colocar en un cuenco con agua.. Incorporar al cuenco de las patatas los limones cortados y exprimir el zumo de tres en el interior.. Añadir al cuenco de las patatas la pata de cordero totalmente limpia. Dejar marinar hasta el día siguiente también.. Pelar la cabeza de ajo en dos mitades.. Cortar el tocino, el jamón y el chorizo en rodajas de tamaño intermedio.. Cocer los callos en una olla espaciosa con agua y mantener la cocción durante 20 minutos una vez que entre en hervor.. Añadir a la olla con los callos, el jamón, el tocino, la cebolla, el ajo y el perejil.. Incorporar a la olla también las patatas, la pata de cordero y cocinar a fuego fuerte durante unos 30 minutos y apagar la llama.. Añadir a la olla los garbanzos y mantener la cocción durante una hora más aproximadamente.. Retirar las ramas de perejil.. Sacar de la olla la pata de cordero, cortar y retirar el hueso.. Volver a incorporar la carne de la pata de cordero a la olla.. Retirar la cebolla de la cocción, picar en cuatro pedazos y rehogar en una sartén.. Sacar el ajo y triturar.. Añadir a la cebolla rehogada el pimentón y el comino con un poco de sal.. Colocar la mezcla de la cebolla, el ajo triturado y un poco del caldo en un vaso de licuadora y triturar.. Colocar la mezcla de las cebollas trituradas con las especias en la olla y reiniciar la cocción.. Mantener la cocción durante unos 30 minutos a fuego bajo y remover toda la mezcla. Corregir la sal."
Receta de Chipirones al horno con ajo y perejil,2021-02-12 11:00:05+00:00,https://okdiario.com/recetas/receta-chipirones-horno-ajo-perejil-3413767/,"1 kg de chipirones. Pueden ser frescos o congelados. En este último caso, es necesario descongelarlos con anticipación, para que suelten toda el agua.. Perejil fresco. 4 dientes de ajo. Zumo de 1 limón. Aceite de oliva virgen extra. 125 mililitros de vino blanco. Sal y pimienta al gusto",El primer paso es precalentar el horno a 180ºC.
Receta de arroz con ternera casero muy fácil de preparar,2021-02-12 09:00:24+00:00,https://okdiario.com/recetas/arroz-ternera-2539384/,300 gramos de arroz bomba o redondo. 350 gramos de carne de ternera. 1 litro de caldo de carne. 3 cebollas. 2 dientes de ajo. 100 gramos de judías verdes. 1 pimiento rojo. 100 gramos de tomate frito. 3 tomates. Sal y pimienta. Aceite de oliva,"Cortar la carne en trozos muy menudos.. Picar las cebollas, el ajo y el pimiento en brunoise pequeña. Retirarles las semillas a los tomates y picarlos en trozos más grandes. Trocear las judías.. En una sartén amplia y de pareces altas, poner tres cucharadas de aceite y echar la carne picada. Cocinar a fuego medio, removiendo de vez en cuando.. Cuando la carne esté dorada, agregar la cebolla, el ajo y el pimiento, añadir una pizca de sal y otra cucharada de aceite de oliva. Remover todo.. Dejar cocinar unos 5 minutos más, hasta que las verduras estén doradas también.. Añadir entonces el tomate picado y las judías. Rehogar e incorporar el tomate frito. Dejar cocer hasta que se reduzcan los líquidos.. Si el tomate aporta demasiada acidez, siempre es interesante poner un poco de azúcar, pero sin pasarse.. Añadir el caldo y llevar a ebullición.. Cuando la carne esté tierna ya, incorporar el arroz.. Cuando hierva de nuevo, bajar el fuego a medio bajo, corregir el punto de sal y pimienta, y cocinar durante 10 minutos.. Al pasar este tiempo, rectificar de sal si fuese necesario, bajar el fuego a mínimo, tapar y cocinar dos minutos más.. Comprobar que el arroz esté listo y el líquido consumido. Apagar y dejar reposar unos minutos más.. Servir."
Receta de Casadielles típicas de carnaval,2021-02-11 19:00:40+00:00,https://okdiario.com/recetas/receta-casadielles-tipicas-carnaval-6819190/,100 ml de vino blanco. 50 gr de mantequilla derretida. 30 gr de manteca de cerdo. 400 gr de harina de trigo. 200 gr de nueces sin cascara. 80 gr de azúcar. 1 yema de huevo. 30 mililitros de anís dulce. Ralladura de un limón. Anís estrellado. Levadura química. Aceite de girasol para freír,"El nombre de esta receta ya es muy carnavalesco, deriva de «cosadielles» que significa acertijos asturianos. Cuenta la historia de esta receta que los comensales pocas veces sabían que venían rellenos.. Estas empanadillas dulces fritas rellenas están rellenas principalmente con frutos secos. En esta receta pondremos nueces, pero quedarán igual de buenas con unas avellanas o una mezcla de varios frutos.. Son un bocado muy contundente, un final de fiesta que podemos acompañar con un poco de cava o incluso con un poquito de vino dulce.. Los dulces de esta época del año son muy completos. En tiempos anteriores a la pandemia, saldríamos a la calle a disfrutar del carnaval, con unas temperaturas que esta época del año acostumbra a ser bajas.. Esta receta no es tan complicada como parece a simple vista, no dejan de ser unas empanadillas fritas cargadas de buenas sensaciones.. Nos ponemos manos a la obra buscando los ingredientes principales de esta delicia típica de Asturias.. Preparamos, en primer lugar, el relleno para que vaya macerando. Podemos poner casi cualquier fruto seco.. En este caso, trituramos las nueces hasta que formen una pasta, le añadimos el azúcar y el anís para que quede un relleno húmedo con un aroma y dulzor muy marcado.. Le podemos añadir un poquito de agua, sin excedernos, debe quedar suave y no aguado o puede afectar a la textura de estas empanadillas.. Seguimos con las manos en la masa. Colocamos dentro de un bol el aceite de oliva con el vino y un poco de sal. Mezclamos bien para que nos sirva de base.. Añadimos la yema del huevo sin dejar de remover, lo ideal es usar las varillas eléctricas para que nos quede una masa perfecta.. Seguimos con la mantequilla, la vamos a incorporar con la manteca para que se forme una masa suave y ligera.. A continuación, ponemos la levadura que será la encargada de darle a las casadielles la textura que destaca, con ese punto crujiente que tanto gusta.. Con todo listo, vamos añadiendo poco a poco la harina. La tamizamos para que nos quede mucho más suave y sin ningún grumo.. Al final debe quedar una masa blanda que no sea pegajosa, si vemos que falta un poco más de harina la añadimos.. Estiramos la masa con el rodillo hasta que nos quede en forma de cuadrado y con un grosor de al menos 1 centímetro.. Doblamos la masa por la mitad y se repite el mismo procedimiento tres veces. Es el mismo sistema que el del hojaldre, tendrá varias capas que serán las que le aporten esta textura especial.. Cuando tenemos la masa lista, cubrimos con un poco de papel film para que no se haga costra y dejamos reposar en la nevera durante un par de horas.. Preparamos unos 12 cuadros de masa con 1 centímetro y medio de grosor y colocar un poco de relleno en el centro.. Para sellar esta delicia, vamos a usar un poco de agua, la colocamos en los extremos y se enrollan sobre el relleno.. Con un tenedor sellamos las empanadillas o casadielles para que no se nos escape nada de masa. Tendremos la base de este delicioso dulce preparado.. Calentamos la sartén con una buena cantidad de aceite para freír nuestras casadielles. Debe estar caliente el aceite para que nos queden perfectas.. Cuando vemos que se doran las podemos ir retirando de la sartén. Preparamos un poco de papel de cocina para que eliminen el exceso de aceite y nos queden más bonitas.. Decoramos estas empanadillas con un poco de azúcar glass y canela. Tendremos listo uno de los dulces de carnaval más aplaudido.. Atrévete a viajar a Asturias sin moverte de casa, el resultado de este viaje culinario te encantará. Prepara un vino dulce o una botella de cava para acompañar esta receta típica de estas fechas."
Receta de tortillas canarias típicas de carnaval,2021-02-11 16:00:40+00:00,https://okdiario.com/recetas/receta-tortillas-canarias-tipicas-carnaval-6819128/,½ de patatas cocidas. 200 ml de leche. 100 ml de anís. Ralladura de un limón. 200 gr de harina. 2 cucharadas soperas de azúcar. Aceite de oliva,"Con esta receta viajaremos a Canarias sin salir de casa. Esta deliciosa receta se basa en una masa que tiene en su ingrediente principal a la patata.. Gracias a este ingrediente conseguiremos una textura que nos seducirá al primer bocado. También llevan harina por lo que son especialmente contundentes.. En este tipo de platos también se usa el anís, muy típico de los dulces de carnaval de todo el país. Las tortillas canarias son quizás, una de las más desconocidas.. Vamos a poner rumbo a unas islas maravillosas, que sin la pandemia de por medio quizás visitaríamos. Un paraíso en la tierra que llegará a nuestra mesa de la mano de uno de sus platos más típicos.. Nos ponemos manos a la obra cocinando las patatas. El tipo de patata dependerá de nuestros gustos o de las que tengamos en casa.. Lavamos las patatas y cocemos enteras con la piel y un poco de sal, si son de piel suave tendrán un interior más cremoso. Nos interesa que queden lo más tiernas posibles para que sean la base de una masa que recordará un poco la de los panellets.. Cuando las patatas estén listas, tardarán unos 30 minutos esperamos a que se enfríen, para pelarlas y triturarlas.. Podemos cocinar esta delicia al microondas ahorraremos un poco de tiempo, en unos 20 minutos las tendremos listas. Dependiendo de su tamaño, puede que estén antes.. Con las patatas cocinadas y peladas, trituramos hasta obtener un puré que será la base de una receta cargada de buenas sensaciones.. Preparamos los complementos de estas patatas. Ponemos la leche en un bol. Le daremos sabor con la ralladura de la cáscara de un limón.. Podemos poner los trocitos de cáscara enteros para poder retirarlos una vez ya nos haya aportado el limón su sabor.. Añadimos un buen chorrito de anís. Podemos ponerle menos cantidad, dependiendo de lo acostumbrados que estemos a este sabor.. El anís es una bebida que se usa en una gran variedad de postres. Incluida una tarta de manzana con nombre propio. Le da un toque dulce muy marcado y está muy presente en la gastronomía de nuestro país.. Con todo listo le ponemos el azúcar y removemos, dejaremos que reposen unos minutos para que impregnen bien todos los sabores de estas tortillas. Podemos ponerle menos azúcar, dependiendo de cuánto nos guste este sabor.. Al puré de patatas le iremos añadiendo la leche, hasta que vaya teniendo una consistencia menos espesa y se vaya impregnando de los sabores dulces de estos ingredientes.. El aroma de estas tortillas canarias de Carnaval ya empezará a notarse, es uno de los pequeños placeres que nos podemos permitir en casa.. Le añadimos un poco de harina para que gane consistencia. La tamizamos para que no queden grumos. Podemos incluir una harina integral o de maíz, la receta se puede adaptar a nuestros gustos.. Con las manos vamos a hacer las tortillas, las empezaremos a freír. Tendremos lista la sartén con una buena cantidad de aceite de oliva muy caliente. Si nos gusta un postre más suave, el aceite de girasol es una buena opción para conseguir el acabado perfecto.. Cuando las tortitas se empiecen a cocinar o dorar, les damos la vuelta. A medida que estén listas las colocaremos sobre papel absorbente hasta que hayan eliminado todo el exceso de aceite.. Espolvoreamos con un poco de azúcar o le ponemos miel. También pueden quedar de vicio con un poco de canela.. Este carnaval no puedes dejar de preparar estas tortillas canarias de Carnaval son una maravilla muy fácil de cocinar que hará las delicias de toda la familia.. Viaja a Canarias desde tu cocina y deja que los sabores más tradicionales lleguen hasta ti. Estas tortillas canarias de Carnaval se pueden preparar todo el año.. No es necesario que sea Carnaval para disfrutarlas son una buena merienda o desayuno perfecto en todos los sentidos. Un día con ganas de fiesta o de probar una receta especial es la excusa perfecta para cocinarlas."
Día de San Valentín 2019: Recetas de cócteles para sorprender a tu pareja,2021-02-11 13:00:34+00:00,https://okdiario.com/recetas/cocteles-san-valentin-sorprender-tu-pareja-3704435/,"60 mililitros de ginebra. 10 frutos rojos (frambuesas, arándanos, fresas o moras). 200 mililitros de agua tónica.. Hielo en cubos","En un vaso alto se ponen los frutos rojos.. Se agregan dos cubos de hielo y la ginebra.. Por último, se incorpora el agua tónica y se mezcla."
10 cenas proteicas que te encantarán,2021-02-11 11:00:45+00:00,https://okdiario.com/recetas/10-cenas-proteicas-que-te-encantaran-100126/,Lubina de 1 kilo. 3 patatas. 5 cebollas. 150 gramos de lentejas. 2 pimientos verdes. 2 puerros. 2 zanahorias. 1 cucharada de salsa de tomate natural. 6 ajos. 2 hojas de laurel. 5 huevos. 50 gramos de maíz tierno. 50 gramos de guisantes. 3 lonchas de queso bajo en grasas. 1 pimiento rojo. 50 gramos de jamón. 50 gramos de mozzarella. 1 bote de cardos. 1 puñado de almendras. 1 puñado de piñones. 2 cucharadas de harina de trigo. 100 ml de leche. 400 gramos de mejillones. 50 ml de vino blanco. Tomillo fresco. Romero fresco. 500 gramos de alcachofas. ½ limón. 4 champiñones grandes. 100 gramos de garbanzos. 8 claras de huevo. 3 lonchas de pavo. Tomillo seco. Orégano seco. Albahaca seca. Perejil fresco. 1 cucharada de pan rallado. 2 cucharadas de queso curado rallado. Pimentón dulce. Sal y pimienta. Aceite de oliva,"Cortar 1 patata en la mandolina, picar 1 cebolla en juliana fina.. Poner las patatas en el fondo de una bandeja y colocar la cebolla encima. Añadir sal, un chorrito de aceite de oliva, 75 ml de agua y hornear 15 minutos a 180° C.. Salpimentar la lubina abierta y limpia, pincelar con aceite y ponerlo encima de las patatas. Cocer hasta que la lubina esté lista. Retirarle la raspa y servir."
Receta de arroz con liebre fácil de preparar paso a paso,2021-02-11 09:00:16+00:00,https://okdiario.com/recetas/arroz-liebre-2020416/,1 liebre. Agua. ½ cebolla. 4 hojas de laurel. 8 dientes de ajo. 800 gramos de arroz. Sal,"Para elaborar el caldo: el día antes, limpiar muy bien la liebre y trocearla en pedazos entre medianos y grandes (se puede pedir en alguna carnicería que pelen y deshuesen el animal).. En una cazuela grande, poner 3 litros de agua, los huesos de la liebre y la carne, la cebolla, el laurel, los ajos y una cucharada de sal.. Llevar a ebullición y dejar cocinar entre 45 minutos y 1 hora a fuego medio (puede ser más, dependiendo del tamaño de la liebre). No pasa nada si se deja un poco más.. Una opción más rápida, para tener la opción de cocinar el caldo de la libre el mismo día que hagamos el arroz, es utilizar la olla a presión. El tiempo estará, de esta forma, en torno a la media hora desde que comience a salir la presión por la válvula.. Colar y reservar el caldo.. En una cacerola honda poner el caldo y la liebre guisada. Calentar a fuego medio alto y cuando hierva echar el arroz.. Cocinar a fuego medio bajo durante 15 minutos. Ajustar el punto de sal, tapar y dejar cocinar de 3 a 5 minutos más, hasta que el arroz esté en su punto.. Servir inmediatamente."
San Valentín 2021: Receta de Tarta de San Valentín fácil de preparar,2021-02-10 21:00:04+00:00,https://okdiario.com/recetas/receta-tarta-san-valentin-2021-3694235/,100 gr de queso crema tipo Philadelphia. 100 ml de nata para montar. 2 hojas de gelatina neutra. 30 gr de azúcar glas. Frutos rojos variados. Mermelada de fresa. Azúcar. Agua,"Esta tarta de San Valentín tendrá todo nuestro corazón convertido en una cucharada de amor con sabor a mousse de queso con fresa.. Vamos a apostar por el sabor de una clásica tarta de queso que vamos a decorar al gusto con un poco de alegría.. La podemos personalizar al máximo, es decir, la decoración es algo que merece la pena cuidar. Una tarta siempre irá dirigida a su propietario.. Podemos colocar los frutos rojos que más nos gusten o directamente la fresa si es la preferida en nuestra casa.. También quedará bien si decoramos con un poco de chocolate o le damos ese toque más dulce con alguna chuchería o golosina con forma de corazón.. Quedará una tarta bien decorada y con un sabor dulce que seguro que recordaremos durante mucho tiempo.. En una taza o bol colocamos agua muy fría y las hojas de gelatina para que se hidraten. La gelatina en este caso será neutra para la mousse, pero podemos usar una gelatina de fresa también para decorar o darle volumen a la tarta.. Colocamos en el vaso de la batidora la mitad de la nata, es decir, 50 mililitros, el resto reservamos.. Uno de los secretos para que nos quede una nata montada de textura adecuada es haciéndolo sobre un bol frío.. Montamos la nata y una vez conseguida la textura adecuada dejamos reposar dentro de la nevera, mientras continuamos con el resto de los ingredientes.. Batimos el queso crema a temperatura ambiente junto con el azúcar glas. Remover muy bien hasta que los dos ingredientes se integren.. Sacamos las hojas de gelatina del bol de agua y escurrir con cuidado, para tener lista esta delicia que le dará consistencia a la mousse.. Calentaremos en un cazo la nata que habíamos reservado sin montar. Le añadimos las hojas escurridas de gelatina para que se disuelvan bien. Removemos constantemente.. Cuando la gelatina esté bien disuelta, agregamos el queso crema y el azúcar glas que hemos batido. Removemos con cuidado hasta que todos los ingredientes para que se integren y nos quede una mousse suave.. La textura mousse la conseguiremos agregando a la mezcla anterior se le incorpora con movimientos suaves y envolventes la nata previamente montada.. En otro bol montamos las claras a punto de nieve, conseguiremos que se mantengan más fuertes y le añadimos una cucharadita de azúcar.. Ponemos las claras a punto de nieve, batimos hasta que estén perfectamente integrados y tengamos una mousse de queso espectacular.. El otro elemento destacado de esta tarta de San Valentín es el molde, preparamos un molde en forma de corazón.. Vertemos la masa y dejamos que se enfríe en la nevera durante unas cuatro horas hasta que tenga la consistencia adecuada.. Si puede estar toda la noche mucho mejor, solo nos quedará preparar la presentación que estará lista rápidamente.. Colocamos en un cazo los frutos rojos, un poquito de agua y una pizca de azúcar al gusto. Cocinamos como si estuviéramos haciendo una mermelada. Podemos dejar que se vean los frutos rojos o no.. Cuando esté la mezcla lista trituramos hasta tener una salsa que podemos completar con la mermelada y un poco de gelatina de fresa que le dará más consistencia al acabado.. Cubrimos la tarta sin sacarla del molde con esta mezcla, le dará la forma y la consistencia adecuada.. Una idea de decoración bonita es darles color a unas almendras, de color rojo o rosa. Colocarlas con un poco de nata en los bordes.. Conseguiremos de esta manera el acabado de pastelería profesional que este San Valentín 2021 se merece.. Ponte manos a la obra con una tarta mousse de queso que será un regalo para los sentidos. El resultado de este dulce será uno de los mejores recuerdos de este San Valentín tan extraño que vamos a vivir."
5 platos típicos de carnaval en cada región de España,2021-02-10 20:00:35+00:00,https://okdiario.com/recetas/5-platos-tipicos-carnaval-cada-region-espana-6814284/,"350 gr de berzas. 1 cebolla grande. 1 pimiento verde. 250 gr de falda de ternera. 200 gr de alubias blancas (también llamadas frijoles o judías blancas). 4 patatas medianas. 60 gr de carne de cerdo (costilla, tocino). 2 chorizos. Sal. Pimienta. Aceite de oliva","Pelamos y picamos muy finitos la cebolla y el ajo. Preparamos una sartén con un poco de aceite de oliva.. Añadimos la carne troceada, agua y las alubias. Dejamos que se unos minutos, vamos retirando la espuma de vez en cuando.. Agregamos un poco de agua fría para que las alubias queden más blanditas y suaves.. Incorporamos la verdura troceada y las patatas cortadas y troceadas para darle el acabado de cocido perfecto.. Salpimentamos al gusto al final de este proceso o rectificamos de este ingrediente para disfrutar de este cocido gallego."
