title,date,url,ingredients,steps
Receta de espinacas con huevo,2018-10-20 12:48:59+00:00,https://okdiario.com/recetas/espinacas-huevo-3255169/,4 huevos. 1 manojo de espinacas. 1 cebolleta. ½ cucharadita de sal. 2 cucharadas de aceite. 1 pizca de pimienta. Queso rallado (opcional),"En primer lugar, lavar muy bien las espinacas, quitando las hojas marchitas. Escurrirlas en el colador.. Cortar las hojas de espinaca en juliana fina y picar la cebolleta, tanto su parte blanca, como verde.. Aparte, calentar una sartén con el aceite.. Batir los huevos, agregar las espinacas, la cebolleta y salpimentar.. Echar poco a poco el batido en la sartén, removiendo con una espátula.. Cuando el huevo se vea cuajado, retirar del fuego y servir de inmediato. Si se desea, espolvorear con queso parmesano rallado.. Se le puede dar un toque hindú añadiendo al batido ½ cucharadita de curry. Al servir, espolvorear con almendras fileteadas y coco rallado sin azúcar.. También se le puede añadir jamón cocido picado, que debe saltearse un poco antes de echar el batido en la sartén."
Receta de leche materna para perros casera,2018-10-19 17:45:40+00:00,https://okdiario.com/recetas/leche-materna-perros-casera-3253163/,400 ml de leche entera de vaca sin lactosa. 50 ml de crema de leche. 10 gr. de mantequilla. 25 gr. de caseinato de calcio. 1 yema,"En un bol, mezclar la leche, la crema de leche y la mantequilla derretida.. Batir la yema e incorporarla a la mezcla anterior junto con el calcio.. Mezclar bien hasta que se integren todos los ingredientes. Debe quedar un producto totalmente homogéneo."
Receta de Pan de lino,2018-10-19 17:29:11+00:00,https://okdiario.com/recetas/pan-lino-3253110/,6 cucharadas de semillas de lino (linaza). 6 claras de huevo. 2 cucharaditas de polo de hornear. ½ cucharadita de sal de fruta. 1 sobre de levadura. 2 cucharadas de semillas de sésamo. Azúcar. Sal. Aceite vegetal para engrasar el molde,"Precalentar el horno a 180ºC.. Encontrar harina de lino o de linaza no es común, así que probablemente haya que prepararla. Tomar las semillas de lino y molerlas en el procesador de alimentos o en el molinillo de café.. Cuando las semillas de lino se hayan convertido en harina, poner en un bol amplio y agregarle el polvo de hornear, la sal de frutas, una pizca de sal y de azúcar.. Amasar con las claras de huevo hasta obtener una mezcla uniforme que no llegará a tener la consistencia firme de una masa de harina. Dejar reposar unos 15 minutos.. Engrasar un molde rectangular con aceite vegetal. Poner la masa y barnizar la parte superior con un huevo batido. Esparcir semillas de sésamo por encima, de una forma decorativa y homogénea.. Hornear durante unos 15 minutos. Al cabo de este tiempo, introducir un palito de madera. Si sale limpio, está listo. Si no, hay que darle un tiempo más en el horno. Dejar enfriar y desmoldar."
Receta de nuggets veganos de tofu,2018-10-19 16:28:58+00:00,https://okdiario.com/recetas/nuggets-veganos-tofu-3252484/,150 gr. de tofu. Cereales según preferencia (mejor si no son dulces). 70 gr. de harina. Sal y pimienta al gusto. 1 pizca de ajo en polvo. 1 cucharada sopera de salsa de soja. 1 cucharada mediana de salsa inglesa. 2 tazas de pan rallado. ¾ taza de leche de soja,"En primer lugar, triturar los cereales. Tener en cuenta que para lograr un mejor resultado es mejor que éstos sean crujientes y evitar los que sean dulces. Ponerlos en un mortero, triturarlos y luego mezclar con el pan rallado para obtener el rebozado.. A continuación, en un bol añadir la harina, la sal y pimienta, el ajo en polvo y las especias que se prefieran. Mezclar los ingredientes.. Incorporar la salsa de soja, la salsa inglesa y la leche de soja. Batir bien hasta lograr una mezcla uniforme y sin grumos.. Cortar el tofu en dados pequeños y colocarlo en el bol junto al resto de ingredientes. Dejar reposar durante 30 minutos para que el tofu se marine.. Transcurrido el tiempo, rebozar los pedacitos de tofu en la mezcla de cereal y pan rallado. . En una sartén, poner aceite de oliva y una vez que esté caliente, freír los nuggets de manera uniforme, removiendo para que se doren uniformemente.. Retirar del fuego y colocarlos en papel absorbente. Servir calientes y bañarlos con la salsa que se prefiera."
Receta de hamburguesa con pan bao,2018-10-19 16:00:52+00:00,https://okdiario.com/recetas/hamburguesa-pan-bao-3251711/,½ kg de harina. 180 ml de agua. 40 gr de aceite de oliva. 10 gr de levadura seca. 45 gr de azúcar. 20 gr de leche en polvo. 20 gr de sal. 4 gr de bicarbonato de sodio. Hamburguesas. Escarola. Tomate. Cebolla. Mostaza,"Lo más complicado de esta receta es preparar el pan bao, en este caso, en lugar de hacerlo al vapor, lo haremos al microondas, es mucho más fácil y rápido. Podremos preparar un suave y delicioso pan oriental siempre que queramos.. En un cuenco ponemos el agua con el aceite los dos ingredientes líquidos que ayudarán a darle textura al pan. Le incorporamos con la ayuda de un colador para evitar que queden grumos el azúcar, la levadura, el bicarbonato sódico, la leche en polvo, la harina y la sal.. Amasamos estos ingredientes bien con la harina que necesiten. Podemos utilizar una amasadora o hacerlo manual, en unos 10 minutos deberían estar integrados.  En el momento en que tenemos una masa elástica y maleable tendremos lista la base de este pan.. Vamos formando bolas del mismo tamaño a modo de estos panecillos. Los untamos de aceite doblamos por la mitad y dejamos que reposen durante 10 minutos.. Ponemos los panecillos al microondas a máxima potencia durante unos 10 minutos, podemos hacer dos tandas de 5 minutos si no estamos del todo seguros del funcionamiento de esta herramienta.. Dejaremos que repose el pan mientras preparamos el relleno. En una sartén con un poco de aceite cocinamos la hamburguesa. La dejaremos bien cocinada por ambos lados y reservamos. Cortamos las verduras y vamos a rellenar el panecillo.. Mezclamos el tomate, la escarola y la cebolla con un poco de mostaza para darle cremosidad. Añadimos la hamburguesa y tendremos listo un bocadillo oriental sencillo y delicioso, listo en unos minutos."
Receta de aguacate al horno con gambas,2018-10-19 15:42:21+00:00,https://okdiario.com/recetas/aguacate-horno-gambas-3252368/,20 gambas congeladas. 5 aguacates medianos. 1 limón. 5 cucharadas de perejil picado. 3 dientes de ajo. 150 gr de queso parmesano rallado. Sal y pimienta. Aceite de oliva. Rúcula,"Para descongelar las gambas, poner dos litros de agua con una cucharada de sal en una olla y llevar al fuego. Cuando rompa el hervor apagar el fuego e incorporar las gambas. Dejar durante dos minutos y escurrir.. Picar el ajo finamente y mezclarlo con el perejil, un chorrito de aceite de oliva, sal y pimienta.. Macerar con esta mezcla las gambas durante cinco minutos.. Calentar una sartén y saltear las gambas con el macerado hasta que se vean doradas.. Cortar los aguacates por la mitad. Retirar los huesos y salpimentar.. Rellenar con dos gambas por mitad.. Espolvorear con queso rallado y llevar al horno hasta que el queso se gratine.. Servir sobre un colchón de hojas de rúcula."
Receta de risotto de trufa y setas,2018-10-19 15:30:56+00:00,https://okdiario.com/recetas/risotto-trufa-setas-3251640/,100 gr de setas. 1 l de caldo de verduras. 250 gr de arroz bomba. 30 gr de parmesano rallado. 1 cebolla. 20 gr de mantequilla. 1 trufa. 1 vaso de vino blanco. Aceite de oliva. Sal,"Empezamos este risotto preparando el fondo de verduras. Pelaremos y picaremos la cebolla y la cortaremos en cuadraditos. Seguiremos con las setas, las lavaremos en seco y las trocearemos para que se integre mejor con el resto de los ingredientes.. Calentamos el caldo en una olla, a la hora de preparar un buen risotto uno de los secretos tradicionales es que la temperatura de los ingredientes sea la misma. El caldo de debe incorporar en caliente.. En una sartén con un poco de aceite empezamos a pochar las verduras. La cebolla y el ajo se pocharán a fuego lento. Cuando la cebolla esté blandita será el momento de ponerle las setas. Este ingrediente suelta mucha agua, esperaremos a que evapore durante unos minutos.. Añadimos el arroz y dejaremos que se tueste un poco, cuando esté listo le ponemos el vino blanco. Aromatizará todos los sabores y le dará un punto extra a este risotto.. Cuando se haya evaporado el alcohol iremos poniendo poco a poco el caldo, este arroz deberá quedar lo más seco posible. Cocinaremos durante unos 18 minutos, hasta que el arroz empiece a quedar en su punto.. La última parte de cualquier risotto es la destinada a incorporarle la mantequilla cortada en daditos. Mezclamos y dejamos que repose unos 2 minutos. Para darle más sabor y cremosidad le ponemos el parmesano rallado por encima y seguimos unificando todos los ingredientes.. Serviremos este risotto de setas con trufa rallada por encima, este paso lo haremos en directo para disfrutar del aroma de este ingrediente."
Receta de croquetas de pavo y manzana,2018-10-19 15:00:56+00:00,https://okdiario.com/recetas/croquetas-pavo-manzana-3251553/,350 gr de pechuga de pavo. 1 cebolla. 1 manzana. Aceite. Sal. Pimienta negra. 150 gr de pan rallado. 40 gr de queso parmesano,"Empezamos la receta de estas deliciosas croquetas de pavo y manzana preparando la carne. Si la compramos fresca podemos pedir en la misma carnicería que nos la piquen, de hacerlo en casa intentaremos dejarla lo más fina posible con la ayuda de un robot de cocina quedará perfecta.. Seguimos con la manzana, la pelamos y troceamos. Repetimos la operación con la cebolla, la picamos lo más fina posible.. Ponemos la manzana, la cebolla y el pavo en un bol para mezclarlos y formar la masa de las croquetas perfectas. Le podemos añadir en este punto unas hierbas aromáticas para que queden unas croquetas mucho más intensas, salpimentamos al gusto y reservamos.. Rallamos el queso parmesano para unirlo a la mezcla, podemos utilizar cualquier tipo de queso que nos guste, su finalidad es que nos aporte una cremosidad extra a estas croquetas. Un curado o semicurado convencional harán el mismo efecto que un parmesano.. Cuando tenemos todos estos ingredientes bien mezclados podemos empezar a dar forma a estas croquetas. Con las manos vamos haciendo las croquetas y rebozándolas en un poco de pan rallado.. Llegados a este paso podemos ponerle huevo batido o no, igualmente quedarán rebozadas y nos evitaremos algunas calorías o intolerancias. La gracia de las croquetas es más por el pan rallado que por el huevo.. A medida que las vamos teniendo hechas las vamos poniéndolas en una bandeja de horno previamente forrada con papel de horno. Las untamos con un poco de aceite y horneamos a 180º durante unos 20 minutos.. Las croquetas se hornearán hasta quedar doradas por fuera y tiernas por dentro. Tendremos listo un plato de tapas que combinará a la perfección con cualquier ensalada o salsa casera."
Receta de huevos rellenos de aguacate y gambas,2018-10-19 14:30:40+00:00,https://okdiario.com/recetas/huevos-rellenos-aguacate-gambas-3251505/,6 huevos. 2 aguacates. Sal. 200 gr de gambas. Mayonesa. Tomate frito. Coñac. Kétchup,"El primer paso para obtener unos maravillosos huevos rellenos será hervirlos. Como cualquier entrante de estas características la materia prima es una de las claves principales. Tener una serie de ingredientes para poder convertir unos sabores básicos en algo sumamente refinado es cuestión de cuidar perfectamente los tiempos y el producto con el que trabajamos.. Con los huevos listos, los ponemos bajo un buen chorro de agua fría para que se pelen mejor. Esperamos a que se enfríen y los pelamos. Los cortamos por la mitad y ponemos la pulpa en un bol. Disponemos la mitad del huevo en una bandeja pera prepararlos y presentarlos.. Partimos los aguacates por la mitad, los deshuesamos y extraemos la pulpa. Ponemos el aguacate con la yema de los huevos. Añadimos un chorrito de zumo de limón para que no se oxide y salpimentamos al gusto.. En un cazo con agua y un puñado de sal cocinamos las gambas. Cuando el agua empiece a hervir incorporamos las gambas. Este ingrediente puede ser fresco o congelado dependiendo de la disponibilidad. Necesitarán unos 7 minutos para estar perfectamente cocinadas, no demos hacerlas mucho o quedarán demasiado secas.. Pelamos las gambas y las reservamos, podemos ponerlas en el relleno, aunque quedarán mucho mejor como decoración de este plato. Las vamos reservando mientras terminamos la receta.. En el bol donde tenemos el aguacate con la yema del huevo empezamos a mezclar estos ingredientes con un tenedor hasta que queden como una pasta homogénea.. Incorporamos la mayonesa un poco de tomate frito, coñac y el kétchup para crear una salsa rosa casera al gusto. Mezclamos de nuevo y rellenamos los huevos con esta masa.. Coronamos cada huevo con una gamba y un poco de perejil picado, tendremos listo un entrante delicioso en un tiempo récord."
Receta de berenjenas rellenas de champiñones,2018-10-19 14:00:08+00:00,https://okdiario.com/recetas/berenjenas-rellenas-champinones-3251456/,4 berenjenas. 200 gr de queso. 250 gr de champiñones. 1 cebolla. 2 dientes de ajo. 1 tomate. 50 gr de piñones. Aceite de oliva. Sal. Perejil,"Empezamos esta receta de berenjenas rellenas preparando la base principal. Limpiamos las berenjenas que utilizaremos como receptáculo, nos las podemos comer enteras en este caso. Las partimos por la mitad y les hacemos unos cortes en la superficie.. Salamos y untamos con aceite antes de asar estas berenjenas en el horno. Las pondremos a 180º unos 20 minutos para que queden totalmente cocinadas.. Mientras se preparan las berenjenas nos centraremos en su maravilloso relleno. Vamos a pelar y cortar las cebollas bien finitas. Repetiremos la operación con los ajos para que se conviertan en el fondo de este plato.. Ponemos un chorrito de aceite y vamos a pochar la cebolla con el ajo. Rehogamos durante unos 4 minutos o cuando empiecen a estar blanditos estos ingredientes.. Siguiendo la evolución de las verduras pochadas limpiaremos los champiñones, podemos poner unas cuantas setas de temporada con ellos le darán un toque extra de sabor. Las cortamos en trozos muy pequeños para incluirlos en el sofrito.. Cuando esté pochada la cebolla y el ajo, le incorporaos los champiñones. Retiramos las berenjenas del horno y extraemos la pulpa que cortaremos en trocitos muy pequeños.. Añadimos la pulpa de las berenjenas al sofrito y le ponemos el tomate. Podemos utilizar tomate natural o frito ya preparado. La idea es que cubra el relleno y lo uniformice bajo su textura y color.. Rellenamos las berenjenas con este relleno tan espectacular. Las espolvoreamos con el queso rallado y las gratinamos al horno. En unos 4 minutos estarán perfectas para llegar a la mesa. Podemos decorar con un poco de perejil picado, también quedará bien con orégano le dará un sabor más intenso."
Receta de judías verdes con parmesano al horno,2018-10-19 11:38:16+00:00,https://okdiario.com/recetas/judias-verdes-parmesano-horno-2-3251035/,1 kilo de judías verdes. 200 g de queso parmesano. ½ cebolla. 3 huevos. Aceite de oliva virgen extra. Sal. Pimienta,"Limpiar las judías retirando las puntas y las venas o hebras.. Cortar en mitades o tercios.. Hervir en una cacerola con agua y sal hasta que estén blandas. Escurrir y reservar.. Cortar la cebolla en brunoise (dados pequeños).. Calentar una sartén con aceite de oliva y sofreír las cebollas y las judías. Retirar del fuego y reservar.. Precalentar el horno a 180 grados.. Batir los huevos y agregar sal, pimienta y el queso parmesano, dejando un poco para espolvorearlo al final.. En un bol refractario o bandeja para horno, colocar la mezcla de judías y el huevo con el queso parmesano.. Espolvorear el queso restante.. Hornear por 15 minutos aproximadamente o hasta gratinar.. Servir para acompañar al gusto. Esta receta rinde para 4 porciones."
Receta de batido de avena y ciruelas,2018-10-18 15:54:12+00:00,https://okdiario.com/recetas/batido-avena-ciruelas-3247689/,12 ciruelas. 5 cucharadas soperas de avena. 5 cucharaditas de azúcar o edulcorante a gusto. 1 litro de leche (entera o descremada). Canela molida,"Lavar y limpiar bien las ciruelas. Si tienen hueso o carozo, quitárselos.. Continuar con troceado de las ciruelas. No hace falta que sea muy pequeño.. Agregar las ciruelas a una licuadora. A continuación, introducir el azúcar o el edulcorante, la avena, y el litro de leche.. Dejar reposar todos los ingredientes durante cinco minutos. De esta manera, la avena va a ablandarse y las ciruelas se van a hidratar.. Pasados el tiempo de reposo, licuar todos los ingredientes hasta que se unifiquen.. Probar el licuado antes de servir para verificar que está bien de dulce. Si le falta azúcar, agregarle la cantidad a gusto y volver a licuar unos segundos más.. A continuación, servir el licuado en vasos altos.. Para que la presentación sea aún más tentadora, espolvorear un poco de polvo de canela por encima del licuado una vez que está servido."
Receta de zumo de perejil,2018-10-18 15:36:23+00:00,https://okdiario.com/recetas/zumo-perejil-3247581/,1 manojo de perejil fresco. 1 manzana verde. 1 zanahoria. ½ cucharadita de jengibre rallado. Zumo de 1 limón. 1 cucharada de miel líquida. Hielo. 1 vaso de agua,"Lavar muy bien todos los ingredientes.. Pelar y cortar la manzana en cuartos.. Pelar y trocear la zanahoria.. Colocar el perejil con todo y tallos en el vaso de la licuadora.. Agregar la manzana, la zanahoria, el jengibre rallado, el zumo de limón y un poco de hielo.. Licuar todo, incorporando el agua hasta que la consistencia sea la deseada.. Endulzar con miel a gusto.. Servir bien frío con una rodaja de limón y una ramita de perejil como decoración.. También se pueden utilizar otras frutas como piña, kiwi o aguacate previamente hecho puré. El zumo queda muy bien con vegetales como el pepino, espinacas, col rizada y cilantro."
Receta de Hamburguesas de espinacas y patatas,2018-10-18 14:30:45+00:00,https://okdiario.com/recetas/hamburguesas-patatas-espinacas-3246534/,4 patatas. 400 gr de espinacas. 2 dientes de ajo. 2 cebollas. Perejil fresco. ½ cebollino. 2 cucharadas de salsa de soja. 1 cucharada de orégano. 1 cucharada de pimiento dulce. 200 gr de pan rallado. 2 yemas de huevo,"Empezaremos esta receta cocinando las patatas, el ingrediente que más tardará en estar listo. Cuando empiecen a hervir dejaremos que se cocinen durante unos minutos, en una media hora estarán listas. Si las pinchamos con un tenedor y están blanditas las retiramos del fuego.. Seguimos con las espinacas, las limpiamos y cortamos muy finitas. Este ingrediente se cocina muy rápidamente no necesitaremos tenerlo hervido, se preparará directamente cuando hagamos las hamburguesas.. Escurrimos las patatas las chafamos con un tenedor y le ponemos las espinacas troceadas, formaremos una masa que iremos complementando poco a poco.. Pelamos y picamos la cebolla, la podemos poner unos minutos en el microondas para que esté un poco más tierna y sea más fácil de cocinar.. Cortamos el cebollino y el perejil en trocitos muy pequeños para que se mezclen mucho mejor con el resto de los ingredientes.. Ponemos en el bol estos ingredientes y vamos mezclando, lo ideal es añadirlos poco a poco e ir creando un puré compacto a base de estas verduras repletas de color.. Llega el momento de darles la consistencia adecuada a estas hamburguesas. Ponemos el pan rallado necesario para que tengan la textura más marcada y queden más compactas.. Les añadimos las yemas de huevo y las especias. Cuando esté todo bien mezclado vamos a darles forma con las manos. Estas hamburguesas se pueden congelar y tenerlas siempre listas o cocinar al momento.. En una sartén con un poco de aceite vamos dorando las hamburguesas. Tardarán unos 7 minutos en estar listas. Las podemos cocinar también en el horno con menos aceite, quedarán deliciosas."
Receta de Aligot tradicional de la cocina francesa,2018-10-18 14:00:07+00:00,https://okdiario.com/recetas/aligot-3244994/,"1,5 kg de patatas. 600 gr de queso fresco de Laguiole. 2 dientes de ajo. 225 gr de mantequilla sin sal. 20 ml de leche entera. Sal. Pimienta","Empezamos esta receta cocinando las patatas. Las pelaremos y cortaremos en trozos del mismo tamaño. Nos interesa que queden cocinadas de forma uniforme y la mejor manera es tener unos trozos similares.. Cocemos las patatas con agua y sal durante unos 30 minutos, hasta que estén tiernas y podamos hacer una especie de puré de patatas.. Escurrimos las patatas y las chafamos con un tenedor hasta tener un puré homogéneo. Colocaremos esta ingrediente al fuego, vamos removiendo poco a poco hasta que estén secas, este proceso durará unos 5 minutos, el agua debe haberse evaporado por completo.. Calentamos aparte la leche y la incorporamos a las patatas. Es importante que estén en una temperatura constante, de esta manera será mucho más fácil de cocinarse y quedará un plato más cremoso.. Ponemos la mantequilla troceada y dejamos que se funda con los otros dos ingredientes hasta formar una salsa consistente con una textura fina.. Esta será la base, ahora nos faltará poner uno de los protagonistas del plato, el queso. Lo cortamos en lonchas y los vamos poniendo por encima. Volvemos a poner esta delicia en el fuego.. Seguimos removiendo hasta que se empiece a generar una textura totalmente especial. La elasticidad de este plato, a modo de fondue es espectacular. Este plato lo suelen comer con unos trocitos de pan y en caliente.. Para darle un punto especial, le podemos añadir el ajo picado, mezclamos de arriba a bajo hasta tener lista por completo esta receta. Podemos añadir algo de sal y pimienta, teniendo en cuenta que el queso ya lleva sal. Lo comemos en caliente para poder disfrutarlo al máximo."
"Receta de Pasta con pollo, brócoli y queso",2018-10-18 12:14:34+00:00,https://okdiario.com/recetas/pasta-pollo-brocoli-queso-3246538/,300 gramos de pasta corta. 300 gramos de pechuga de pollo deshuesada. 1 queso crema. ¼ taza de leche. ½ brócoli. 1 cebolla. 2 dientes de ajo. 150 gramos de queso parmesano. Mantequilla. Sal. Pimienta. Aceite de oliva virgen extra,"Cortar las pechugas de pollo en tiras no muy largas. Sazonar con sal y pimienta.. Poner a calentar una sartén con un chorrito de aceite de oliva. Derretir unas dos cucharadas de mantequilla y sellar las pechugas de pollo. Cuando estén doradas, retirar del fuego. Reservar.. Cortar el brócoli en racimos. Ponerlo a cocinar en agua caliente con sal y esperar a que esté al dente. Escurrir. Reservar.. Picar la cebolla y el ajo en cuadritos pequeños. Poner a calentar una sartén amplia con un chorrito de aceite de oliva. Sofreír la cebolla. Cuando empiece a transparentarse, agregar el ajo. Cuando ambos hayan cambiado de color, agregar el queso crema y la leche.. Agregar las tiras de pollo y el brócoli cortado en trozos. Mezclar y rectificar la sal. Remover durante un par de minutos en el fuego.. Cocinar la pasta en agua con sal, siguiendo las instrucciones del paquete. Colar y servir con la salsa de brócoli espolvoreando abundante queso parmesano."
Receta de Alubias con tomate y cebolla,2018-10-18 12:02:38+00:00,https://okdiario.com/recetas/alubias-tomate-cebolla-3246469/,250 gr. de alubias. 250 ml de tomate triturado. 2 cebollas. 2 dientes de ajo. 30 gr. de puerro. 1 pimiento verde. 1 puñado de albahaca fresca. Sal y pimienta al gusto. 1 pizca de pimentó dulce. 1 pizca de comino. Aceite oliva virgen,"En primer lugar, se lavan las alubias y se colocan en remojo la noche anterior a su preparación, cuidando que el agua las cubra completamente.. El día siguiente, utilizando la misma agua utilizada en el remojo, se deben cocinar. Para ello, lavar el puerro y la cebolla y cortar ambos ingredientes en varios trozos. Reservar ½ cebolla para el sofrito.. Colocar estas verduras junto con las alubias y cocinar hasta que estén blandas, aproximadamente 1 hora y media.. Lavar el pimiento verde y cortarlo pequeño. En una sartén con un chorro de aceite de oliva, sofreír la ½ cebolla restante, el ajo y el pimiento. Añadir sal y pimienta y remover hasta que se doren ligeramente.. Añadir el tomate triturado, la albahaca, el comino y el pimentón y cocinar todo durante cinco minutos más. Para evitar la acidez del tomate se puede añadir una pizca de azúcar.. A continuación, escurrir las alubias y pasar la ½ cebolla y el puerro por la trituradora.. Añadir las alubias y las verduras trituradas junto al tomate sofrito y mezclar. Incorporar 1 vaso del caldo de cocción de las alubias para que la preparación no se seque.. Rectificar de sal y echar un chorrito de aceite de oliva encima.. Servir bien caliente."
Receta de Arroz integral con alga wakame fácil de preparar,2018-10-18 11:51:28+00:00,https://okdiario.com/recetas/arroz-integral-alga-wakame-3246364/,1 ½ taza de arroz integral. ½ taza de alga wakame deshidratada. 1 cebolla. 3 dientes de ajo. 1 pimiento rojo. 2 tomates maduros. ½ taza de guisantes. 3 tazas de agua o caldo de verduras. ½ cucharadita de pimentón dulce ahumado. Sal. Aceite de oliva extra virgen,"Calentar una olla con dos cucharadas de aceite. Sofreír la cebolla y el pimiento picados hasta que estén tiernos.. Aparte, moler con la ayuda de un mortero el alga con los ajos.. Añadir a la olla los tomates rallados y la mezcla de algas y ajo. Condimentar con el pimentón y sal. Dejar cocinar durante 5 minutos.. Agregar el caldo o agua y el arroz. Cuando rompa el hervor, bajar el fuego e incorporar los guisantes.. Cocinar hasta que el arroz esté a punto. Poner a punto de sal.. Si es necesario añadir más líquido."
