title,date,url,ingredients,steps
"Tronco navideño de frambuesas, almendras y queso",2021-11-26 09:00:33+00:00,https://okdiario.com/recetas/tronco-navideno-frambuesas-almendras-queso-8177095/,80 gramos de almendras molidas. 80 gramos de azúcar glas. 50 gramos de harina. 15 gramos de mantequilla. 10 gramos de azúcar. 2 huevos. 2 claras de huevo,"Bate las claras a nieve y agrega poco a poco el azúcar.. Aparte, combina el azúcar glas con las almendras molidas.. Agrega los huevos enteros batidos, la mantequilla derretida y la harina. Mezcla hasta obtener una crema suave.. Agrega las claras y revuelve suavemente con una espátula.. Extiende en una fuente de horno cubierta con papel vegetal y hornea 10 minutos en horno precalentado a 200°C. El bizcocho debe mantenerse flexible y dorarse un poco. Deja enfriar y desmolda.. Para la preparación de la mousse, separa las claras de las yemas y pon la gelatina en agua.. Bate las claras a punto nieve, agrega el azúcar glas, la vainilla y el mascarpone desmenuzado.. En una cacerola pequeña, calienta la leche y derrite la gelatina previamente escurrida.. Luego añade las claras, revuelve y vierte sobre el bizcocho. . Encima, esparce las frambuesas, cierra enrollando, para darle la forma de tronco y cubre con la nata restante. Con la ayuda de un tenedor, haz las canaletas para simular la corteza.. Lleva al refrigerador durante 4 horas, aproximadamente.. Pasado ese tiempo, desmolda y calienta con un secador o gratinadora la cobertura, para que se doren las canaletas. También puedes utilizar para ello el gratín del horno.. Por último, prepara el glaseado. Remoja la gelatina y tritura las frambuesas sin las pepitas. . Vierte en una cacerola pequeña, agrega el azúcar glas y cocina 10 minutos.. Agrega la gelatina escurrida, mezcla y deja enfriar.. Esparce sobre el tronco y decóralo con algunas frambuesas.. Refrigera antes de servir."
Galletas de chocolate sin gluten caseras,2021-11-26 08:45:58+00:00,https://okdiario.com/recetas/como-hacer-galletas-chocolate-sin-gluten-6249875/,250 gramos de harina sin gluten. 125 gramos de azúcar glas. 125 gramos de mantequilla sin sal. 50 gramos de cacao en polvo sin azúcar. 1 huevo grande. 1 cucharadita de extracto de vainilla. ½ cucharadita de sal fina,"En un bol amplio tamizamos los ingredientes secos, la harina, el cacao y la sal. Reservamos.. En la thermomix o a mano batimos la mantequilla con el azúcar glas hasta obtener una mezcla cremosa y blanca.. Enseguida añadimos el huevo y la vainilla, seguimos batiendo para ir consiguiendo una mezcla uniforme.. A continuación, incorporamos poco a poco los ingredientes que tamizamos. Batimos hasta que se forme una masa y que esta se despegue de las paredes del envase o batidora.. Con nuestra masa formamos una bola y luego la estiramos con ayuda de un rodillo en un papel para hornear. Tiene que quedar con un grosor de entre 5 y 6 milímetros. Después refrigeramos durante un mínimo de dos horas.. Precalentamos el horno a 180 grados.. Cortamos la masa de galletas dándole la forma que deseamos y las vamos colocando en la bandeja para horno, que debe estar fría.. Es importante que no haya mucho calor cuando las estemos cortando porque se pueden deformar. Si es así las volvemos a meter en la nevera un tiempo más.. Horneamos las galletas aproximadamente entre ocho y 10 minutos. El tiempo depende del tamaño, las pequeñas requieren menos tiempo que las grandes.. Cuando estén listas dejamos enfriar en una rejilla y servimos. Podemos acompañarlas con un rico vaso de leche."
El menú vegetariano con el que sorprenderás a tus invitados en el Día de Acción de Gracias,2021-11-25 17:15:57+00:00,https://okdiario.com/recetas/menu-vegetariano-celebrar-dia-accion-gracias-2021-4871422/,,Menú vegetariano para Acción de Gracias
La mejor receta de pavo relleno para el Día de Acción de Gracias,2021-11-25 16:00:05+00:00,https://okdiario.com/recetas/receta-pavo-relleno-dia-accion-gracias-2021-4866574/,1 pavo grande. ½ kg de carne picada de cerdo. 200 gr de cebolla. 200 gr de ciruelas pasas. 100 gr de miga de pan. 1 vaso de leche. 1 vaso de vino de Jerez. 1 vaso de vino blanco. Caldo de pollo o carne. Sal. Mantequilla. Pimienta,"Este pavo relleno lo podemos preparar para cualquier celebración, cada domingo o cena de navidad o fin de año puede ser una excusa para cocinarlo.. El primer paso lo debe hacer el carnicero o en casa con mucha paciencia, deshuesamos el pavo, de esta manera aprovecharemos mejor la pieza.. También lo podemos encontrar ya listo para rellenar, merece la pena pagar un poco más y ahorrarnos un poco de trabajo.. Para que el pavo quede más tierno lo ponemos a macerar mínimo una hora antes con vino de Jerez. Este toque español conseguirá un pavo que muchos americanos desearían.. Con el pavo macerando ponemos la miga con la leche para que nos aporte su cremosidad, es uno de los ingredientes que usaremos en el relleno, la ponemos en un bol.. Seguimos con el relleno pelamos la cebolla y la cortamos muy finita. La pocharemos con un poco de mantequilla.. Cuando esté lista la cebolla le ponemos con la carne de cerdo picada, podemos añadirle unas lonchas de bacon cortadas muy finitas.. Incorporamos la miga y los frutos secos picados. Rellenamos el pavo y lo ponemos en el horno a 180º durante unas dos horas.. Cada 15 minutos regamos con el jugo que suelta para que no nos quede seco. Este paso es importante para poder disfrutar de un bocado impresionante.. Pasado este tiempo, ponemos el vino en la fuente para horno. Desglasamos el líquido, lo pasamos a una sartén con un litro de caldo de pollo o carne.. Añadimos una cucharada de maicena para crear la salsa perfecta para un pavo relleno de alegría. Servimos con un poco de puré de patatas o un puré de manzanas, el resultado es espectacular."
Guiso de pescado tradicional brasileño,2021-11-25 15:00:17+00:00,https://okdiario.com/recetas/guiso-pescado-tradicional-brasileno-8169411/,500 gramos del pescado que más guste. Zumo de limón. Pimienta negra. Sal al gusto. 100 ml de aceite. 1 cebolla redonda pequeña. 4 tomates grandes. Semillas de achiote. 400 mililitros de leche de coco. 6 tazas de caldo de pescado. Cilantro picado. Zumo de limón. Sal,"Marina al pescado con zumo de limón, la pimienta y sal. Tápalo y llévalo al refrigerador durante 30 minutos. En lugar de limón puedes utilizar lima, pero siempre que sean productos en su máximo momento de frescura.. Coloca una sartén sobre fuego alto y vierte un chorro de aceite. Fríe al pescado hasta dorarlo. Retira del fuego y déjalo reposar en otro recipiente.. Agrega las semillas de achiote sobre el aceite caliente dentro de una cazuela. Deja que se torne rojizo el aceite y retira del fuego. Déjalo reposar.. Corta en dados los tomates pelados, corta la cebolla en aros y pica finamente los dientes de ajo.. Lava y corta muy fino el cilantro.. Usa una olla de barro para poner 50 ml de aceite y 50 ml del aceite con achiote. Vierte el ajo y la cebolla hasta que doren. Retira la cebolla y resérvala.. Sofríe el tomate unos minutos, hasta que vaya perdiendo parte de su jugo y se vuelva una salsa. Echa un punto de azúcar para compensar el punto ácido que tiene, pero sin pasarte para que no sepa dulce.. Coloca sobre el tomate sofrito el pescado y cubre con la cebolla que retiramos antes. . Agrega 2 cucharas de cilantro. Tapa la olla y deja que se cocine con el caldo y la leche de coco alrededor de 15 minutos. No lo destapes ni remuevas.. Rectificar el punto final de sal."
"Sopa lionesa, receta casera",2021-11-25 13:00:24+00:00,https://okdiario.com/recetas/sopa-lionesa-receta-casera-8169346/,2 cebollas blancas. 1 diente de ajo. 50 gramos de mantequilla. 1 litro de caldo de carne. 6 rebanadas de baguette o pan de pueblo. 2 cucharadas de aceite de oliva extra virgen. 1 cucharada de brandy. 100 gramos de queso gruyere (o emmental). Sal. Pimienta,"Cortar las cebollas en juliana muy fina. Picar en brunoise el diente de ajo.. Colocar en una cacerola la mantequilla y el aceite de oliva; mezclar a fuego lento.. Aumentar el fuego y agregar las cebollas, y un poco después el ajo.. Salpimentar al gusto, bajar el fuego y remover hasta que las cebollas se ablanden.. Si no son cebollas dulces este es un buen momento para agregar una cucharadita de azúcar, para caramelizarlas.. Añadir la cucharada de brandy y dejar que se evapore mientras se remueve.. Agregar el caldo de carne, dejar que hierva y luego mantener en fuego mínimo, durante unos 20 minutos.. Poner a punto de sal el conjunto. Se podrían en este punto agregar algunas especias, como podría ser el caso del comino molido.. Apagar y servir en 2 cuencos refractarios, poner una capa de queso en la superficie de la sopa, colocar las rebanadas de pan y poner más queso encima.. Precalentar el horno a 200° C e introducir los cuencos.. Esperar unos 6 minutos y retirar del horno cuando el pan y el queso comiencen a dorarse. Siempre con cuidado de que no se tuesten demasiado. "
Receta rusa de passha,2021-11-25 11:00:24+00:00,https://okdiario.com/recetas/receta-rusa-passha-8169334/,"1,2 kilos de queso de granjero tvorog. 180 mililitros crema fresca. 150 gramos de mantequilla sin sal. 300 gramos de azúcar. 1 limón. extracto de vainilla. sal. Molde especial para passha","Rallar la piel del limón y exprimir aparte su zumo. Reservar.. Picar el queso en porciones más manejables.. Colocar el queso, la crema, la mantequilla a temperatura ambiente, el azúcar, la ralladura, el zumo de limón y un poco de vainilla en el procesador de alimentos.. Procesar todos los ingredientes hasta obtener una pasta muy suave y sin grumos.. Colocar el molde en la mesa de trabajo y verter la mezcla dentro de él. Colocar encima un papel de horno.. Colocar encima del papel de horno un plato para generar peso.. Refrigerar el passha durante unas 10 horas aproximadamente. Sacar cuando la mezcla esté seca.. Sacar, desmoldar y servir."
Receta de patatas lionesas,2021-11-25 10:45:43+00:00,https://okdiario.com/recetas/receta-patatas-lionesas-8169324/,1 kilo de patatas. 1 cebolla. 6 cucharadas de mantequilla. 2 cucharadas de aceite de oliva. unas ramitas de perejil. Sal. Pimienta,"Pelar y cortar las patatas en rodajas, y colocarlas al menos 30 minutos en agua con un chorrito de vinagre blanco (da mayor consistencia a las patatas y evita que se rompan en trozos). Sacarlas y eliminar el agua con papel secante.. Cortar la cebolla en juliana.. En una sartén poner el aceite de oliva y añadir las cebollas, moviéndolas hasta pochar.. Salar al gusto las patatas y colocarlas en la sartén con las cebollas. Remover hasta que las patatas estén listas.. Retirar las patatas y las cebollas, escurrir el aceite y colocarlas en un envase para hornear. agregar las 6 cucharadas de mantequilla, bien distribuidas, y espolvorear pimienta al gusto.. Hornear a 180° C y dejar hasta que se gratine.. Cortar finamente el perejil y decorar con él las patatas, ya listas para servir."
Receta de Charquicán chileno: un muy sabroso y versátil plato de Chile para este invierno,2021-11-25 09:00:18+00:00,https://okdiario.com/recetas/receta-charquican-chileno-muy-sabroso-versatil-plato-chile-este-invierno-8169309/,Carne de vacuno picada: 500 g (también puedes usar pollo o cerdo).. Calabaza: 250 g cortado en dados medianos. Patatas sin piel: 4 grandes cortadas en trozos medianos. Frijoles o guisantes verdes: 1 taza. Maíz amarillo: 1 taza. Cebolla: 1 grande picada finamente. Ajo: 2 dientes picados. Caldo de carne o verduras: 2 tazas (puedes usar agua). Comino molido: ½ cucharadita. Pimentón dulce: 1 cucharadita. Orégano seco: 1 cucharadita. Aceite vegetal: 1 cucharada. Sal y pimienta negra molida: al gusto. Huevos: 5 unid (opcional para servir),"En una olla mediana, calentamos el aceite vegetal a fuego medio y sofreímos la cebolla. Cuando estén doradas, añadimos el ajo y seguimos salteando durante unos minutos más.. Añadimos la carne picada en trocitos pequeños y seguimos cocinando hasta que esté bien dorada (suele tomar unos 10 minutos). La carne puede estar más o menos picada según el gusto de cada comensal y de quien cocina.. A continuación, sumamos la calabaza, las patatas, los frijoles o guisantes verdes y los granos de maíz. También incorporamos los condimentos y salpimentamos al gusto.. En seguida, vertemos las dos tazas de caldo o agua caliente para que cubran todos los ingredientes, y mezclamos. Tapamos la olla y dejamos cocinar alrededor de 20 minutos a fuego bajo-medio, o hasta que los vegetales estén tiernos.. Pasado este tiempo, probamos nuestro charquicán chileno y, si es necesario, corregimos la sal. Apagamos el fuego y dejamos reposar unos minutos antes de servir."
Espárragos con salsa de naranja y mayonesa,2021-11-25 07:45:21+00:00,https://okdiario.com/recetas/receta-esparragos-cocinados-naranja-5555874/,1 kilo de espárragos verdes. 50 gramos de mayonesa para veganos. 1 naranja. 1 cucharadita de mostaza Dijon. Caldo de pollo concentrado,"Lavamos muy bien los espárragos, cortamos y desechamos el tallo de cada uno.. Llenamos una olla con un poco menos de la mitad de agua y una parte del caldo de pollo concentrado. Calentamos y añadimos los espárragos, dejamos hervir durante unos 25 minutos o hasta que estén bien cocidos.. Mientras tanto rallamos la cáscara de la naranja en un recipiente pequeño. Reservamos.. A continuación, cortamos la naranja por la mitad y exprimimos hasta sacar todo su jugo. Colamos y lo vertemos en un bol.. En otro recipiente agregamos la mayonesa junto a la ralladura que reservamos, mezclamos muy bien.. Enseguida vertemos el jugo de la naranja y removemos hasta que obtengamos una mezcla homogénea.. Cuando los espárragos estén listos los escurrimos y dejamos que se enfríen un poco. . Servimos en un plato con la salsa de naranja y mayonesa. Podemos adornar con un poco de la ralladura de naranja."
"Charlotte de nuez, receta casera",2021-11-24 13:00:38+00:00,https://okdiario.com/recetas/charlotte-nuez-receta-casera-8163134/,200 gramos de bizcochos de soletilla. 150 gramos de nueces. 180 gramos de mantequilla. 200 gramos de crema de leche. 120 gramos de azúcar glas. 50 gramos de azúcar corriente. 2 yemas de huevo. 1 clara de huevo. 100 ml de leche. 1 copa de licor de cassis (opcional),"Triturar las nueces.. Batir las dos yemas con la crema de leche y el azúcar glas hasta obtener una crema espumosa. Incorporar la mantequilla.. Dividir la crema en dos partes, una mayor que la otra; en la mayor agregar las nueces (no todas, reservar algunas para decorar). Reservar la restante.. Batir las claras a punto de nieve. Integrar a la mezcla con movimiento envolvente.. En un bol pequeño mezclar la leche con el licor de cassis y el azúcar.. Mojar los bizcochos en esta mezcla y colocar en el borde de un molde redondo, previamente engrasado, hasta cubrir todas las paredes.. Colocar bizcochos, previamente remojados, en el fondo del molde, y agregar una capa con la mezcla con nueces. Repetir la operación hasta acabar con los bizcochos y la mezcla.. Colocar el molde en la nevera por un mínimo de tres horas; luego sacar y desmoldar en un plato o bandeja.. Agregar la crema reservada por toda la superficie, creando un centro donde se colocarán las nueces reservadas, como decoración."
