title,date,url,ingredients,steps
3 recetas con aguacate de platos rápidos y saludables,2020-06-12 16:00:57+00:00,https://okdiario.com/recetas/3-recetas-aguacate-platos-rapidos-saludables-5745618/,1 aguacate maduro. Jugo de limón. Aceite de oliva. Sal. Pimienta (opcional),"Corta el aguacate a la mitad y coloca la pulpa en un tazón.. Haz un puré con un tenedor hasta deshacer completamente la pulpa.. Exprime el limón sobre la pasta, agrega un chorrito de aceite de oliva y sal a tu gusto.. Si lo deseas, puedes agregar pimienta o ají picante troceado bien fino.. Revuelve bien y sirve con galletas saladas o snacks."
Receta de tarta helada de galletas integrales con crema de coco sin horno,2020-06-12 15:00:20+00:00,https://okdiario.com/recetas/receta-tarta-helada-galletas-integrales-crema-coco-sin-horno-5746874/,Galletas integrales. Bebida de almendras. 200 gr de queso fresco batido 0%. 2 cucharadas soperas de sirope de agave. 100 ml de leche de coco. Coco rallado. Cacao en polvo,"Esta elaboración es un clásico de los dulces de toda la vida. La tarta de galletas de la abuela que llegaba los domingos para hacernos disfrutar al máximo.. Esta tarta no necesita horno ni apenas elaboración y queda increíble. Para preparar la base de la crema usaremos un queso fresco batido desnatado. De esta manera crearemos un postre más ligero.. Ponemos el queso fresco batido en un bol y empezamos a batirlo con las varillas eléctricas. Le incorporamos el sirope de agave o cualquier otro edulcorante natural que nos guste.. Cuando estén estos ingredientes bien integrados, le ponemos la leche de coco. Mezclamos hasta tener una crema ligera y suave que cogerá consistencia en el congelador.. Por último, le añadimos el coco rallado, potenciará aún más su sabor y este ingrediente le dará una textura de lo más especial.. Mezclamos todo y reservamos, será esta crema la que rellene una base marcada por las galletas integrales.. Forramos un molde con papel film para que sea más fácil desmoldar nuestra tarta. Mojamos las galletas en leche de almendras y las vamos poniendo en la base.. Cubrimos las galletas con la crema de coco. Repetimos la operación hasta que consigamos cubrir toda la superficie del molde.. Ponemos en el congelador hasta la hora de servir. Podemos decorar con un poco de nata por encima y cacao en polvo o añadirle unas frutas, la piña le va muy bien.. Tendremos lista una tarta helada de galletas integrales con crema de coco sin horno espectacular. Solo nos quedará probar esta maravilla que será la protagonista de las comidas o cenas veraniegas."
Receta de entrecot de ternera con puré de guisantes y remolacha,2020-06-12 13:00:24+00:00,https://okdiario.com/recetas/receta-entrecot-ternera-pure-guisantes-remolacha-5745968/,Entrecot de ternera. 150 gr de guisantes. 1 vaso de caldo de verduras. 100 gr de remolacha. 150 ml de nata líquida. Sal. Pimienta. Sal Maldon,"Para cocinar un buen entrecot de ternera uno de los primeros trucos que existen es sacarlo de la nevera con antelación. A temperatura ambiente conseguiremos un resultado un poco más tierno.. Preparamos la plancha, ponemos un poco de aceite para que no se pegue la carne. Salpimentamos al gusto.. Sellamos la carne, la cocinamos un poco para que los jugos queden en su interior. Antes de servir este increíble entrecot lo cocinamos durante unos minutos al horno.. Seguimos con los dos tipos de puré. Cocinamos los guisantes con agua y sal hasta que estén tiernos.. Trituramos los guisantes con un poco de caldo de verduras. Ponemos en un cazo con la mitad de la nata líquida hasta que coja consistencia.. La segunda parte de estos purés es el de remolacha. Podemos usar una remolacha ya cocinada si nunca hemos cocinado esta verdura.. La trituramos y ponemos en otro cazo con un poco de caldo de verduras y nata para cocinar. Rectificamos de sal y pimienta.. Con todo listo encendemos el horno a 180º para que esté listo a la hora de recibir el entrecot. 5 minutos antes de sentarnos a la mesa, ponemos el entrecot y calentamos los purés.. Presentamos el plato con el puré de guisantes de fondo. Hacemos unas gotitas con el de remolacha, es un ingrediente al que puede que no estemos tan acostumbrados.. Colocamos el entrecot y lo cortamos en trocitos. Le añadimos un poco de sal maldon por encima y unas gotas de aceite de oliva. Tendremos listo un plato de restaurante fácil de preparar y delicioso."
Recetas de los mejores tacos de pollo,2020-06-12 12:00:43+00:00,https://okdiario.com/recetas/recetas-mejores-tacos-pollo-5744115/,500 gramos de carne de pollo picada. 2 cebolletas rojas. 1 pimiento verde. 1 pimiento amarillo. 1 pimiento rojo. 2 dientes de ajo. 1 tomate. 2 chiles verdes. 2 aguacates. 1 cucharada de pimentón. 2 cucharadas de aceite de oliva virgen extra. 1 cucharada de comino. 2 cucharadas de cilantro picado. 1 cucharada de tabasco. 12 tortillas de maíz. 2 limas. Crema agria. Sal y pimienta negra al gusto,"Lavar y trocear los pimientos en trozos pequeños. Trocear también una de las cebolletas.. Colocar un chorro de aceite de oliva e incorporar las verduras troceadas. Cocinar a fuego medio.. Cuando la cebolla comience a tornarse transparente, se incorpora la carne de pollo picada. En el momento en que la carne comience a ponerse blanquecina, se le agrega sal y pimienta negra al gusto, así como también la cucharada de pimentón y el comino. Mezclar bien para que el pollo adquiera todo el sabor de las especies.. Después de que las verduras y el pollo dejen de soltar agua, se agrega un diente de ajo picado en dos. Dejar cocinar durante un par de minutos adicionales y posteriormente retirar del fuego. Poner a punto de sal y reservar.. En un bol, agregar los siguientes ingredientes bien picados: chiles verdes, cebolleta, tomate y cilantro. Agregar también el tabasco, el zumo de una lima y una pizca de sal al gusto. Mezclar para que todos los ingredientes se integren.. Para la preparación del guacamole, se deben picar los aguacates en pequeños trozos. Agregar el zumo de otra lima, un ajo machacado y una pizca de sal. Luego, con la ayuda de un tenedor, machacar muy bien los ingredientes. Se debe obtener una textura cremosa, pero con pequeños trozos de aguacate.. Finalmente, tomar una de las tortillas y proceder a rellenarlas. Primero el pollo, luego las verduras y después el guacamole. Finalmente, agregar un poco de crema agria. Repetir el proceso con cada una de las tortillas."
Receta de tartar de pepino con lentejas,2020-06-12 11:00:12+00:00,https://okdiario.com/recetas/receta-tartar-pepino-lentejas-5743563/,1 pepino. 150 gr de lentejas. 1 zanahoria. ½ cebolla roja. ½ aguacate. 50 gr de maíz dulce. Aceite. Sal. Zumo de medio limón. Vinagre de Módena blanco,"Este tartar al igual que los de carne o pescado es perfecto para hacerlo en verano, no necesita ninguna elaboración, solo una correcta disposición de los ingredientes con un buen macerado.. Las lentejas las podemos tener ya listas o hacer al momento. Este tipo de legumbres es uno de los que más gustan.. Si queremos cocinar las lentejas en lugar de usar unas de bote, podemos elegir una variedad que no necesite estar en remojo.. Las cocinamos con un poco de agua y sal, dejaremos que se pongan tiernas, tardarán unos 20 minutos en estar listas.. Escurrimos las lentejas y las ponemos en un bol mientras preparamos el resto de los ingredientes que crearán este tartar.. Pelamos una cebolla y la cortamos en taquitos del mismo tamaño. Colocamos la cebolla con las lentejas.. Seguimos con el aguacate, este ingrediente sorprenderá por ese toque cremoso que posee. Le quitamos el hueso y lo troceamos.. Añadimos un poco de maíz dulce, los escurrimos y colocamos con las lentejas. Cortamos media zanahoria, la pelamos y troceamos en cuadraditos.. Preparamos un aliño, mezclamos el aceite, el vinagre, la sal y la pimienta. Añadimos un chorrito de limón para evitar que el aguacate se oxide.. Mezclamos la ensalada con el aliño. La otra mitad de la zanahoria la rallamos para darle un aspecto más bonito al plato.. Lavamos los pepinos. Les quitamos las puntas y con la ayuda de una mandolina los cortamos en tiras del mismo tamaño.. Salpimentamos estas tiras y las enrollamos para que nos sirvan de base de este tartar. Podemos poner uno o dos, dependiendo de la consistencia.. Colocamos el tartar en el centro. Un poco de zanahoria rallada por encima y más aliño. Tendremos listo un plato espectacular muy fácil de preparar."
"Cómo preparar y usar aquafaba, el líquido de los garbanzos",2020-06-12 10:00:04+00:00,https://okdiario.com/recetas/como-preparar-usar-aquafaba-liquido-garbanzos-5743600/,1 parte de garbanzos. 6 partes de agua para remojar. 3 partes de agua para cocinar,"Coloca en un recipiente los garbanzos junto con el agua y déjalos en remojo toda la noche o durante al menos 8 horas.. Pasado ese tiempo, escúrrelos y desecha el agua.. En una cacerola, pon a hervir el agua y agrega los garbanzos hidratados.. Una vez que hierva, baja el fuego y cocina hasta que estén blandos, aproximadamente 40 minutos.. Retira los garbanzos del fuego y deja el agua hasta que se reduzca a la tercera parte.. Apaga el fuego, espera que la aquafaba se enfríe y guárdala en un envase hermético dentro del refrigerador."
"Receta de pudin de kiwi, arándanos y semillas de chía",2020-06-12 09:00:08+00:00,https://okdiario.com/recetas/receta-pudin-kiwi-arandanos-semillas-chia-5743532/,500 ml de bebida vegetal. 50 gr de semillas de chía. 2 cucharadas de sirope de agave. 2 plátanos. Arándanos. Kiwi,"Este pudin se prepara con un poco de antelación, los amantes de las semillas de chía conocen a la perfección como consumir este ingrediente. Lo debemos dejar en reposo para que se hinche, al menos durante la noche antes.. Empezamos poniendo la bebida vegetal, puede ser la que más nos guste. Una de arroz, de almendras o de avellanas le vendrá de maravilla, tienen ese punto dulce muy apetecible.. Incorporamos un par de cucharadas de sirope de agave, este ingrediente lo podemos sustituir por un poco de miel o cualquier edulcorante que nos guste.. Removemos bien e incorporamos las semillas de chía. Este ingrediente ayudará a que se cree el pudin, al reposar coge textura. Dejamos esta mezcla en la nevera la noche antes o con unas horas de antelación.. Pelamos los plátanos y los congelamos. Los arándanos también pueden ser congelados, quedarán bien y siempre los tendremos disponibles.. A la mañana siguiente vamos a preparar esta maravilla. Empezamos poniendo el plátano con los arándanos en el vaso de la batidora.. Trituramos todo hasta conseguir una crema suave de un color intenso y un sabor impresionante. La acidez de los arándanos quedará perfecta con el dulzor del plátano.. Pelamos el kiwi y lo cortamos en trocitos. Colocamos el kiwi en el fondo del vasito de presentación para que resalte su color.. Removemos las semillas de chía con la bebida vegetal y el edulcorante Ponemos por encima en una capa uniforme.. Colocamos la mezcla de los arándanos y el plátano, por encima podemos ponerle más arándanos de decoración.. Tendremos listo un desayuno o merienda saludable impresionante, muy fácil de preparar y con un sabor que destacará. Atrévete a probarlo."
Receta de tarta de manzanas con especias,2020-06-11 18:00:46+00:00,https://okdiario.com/recetas/receta-tarta-manzanas-especias-5731287/,1 cucharadita de canela molida. ½ cucharadita de jengibre rallado. ¼ cucharadita de nuez moscada. 130 gr de harina de repostería. 4 huevos. 250 ml de leche. 125 gr de azúcar. 3 manzanas. 20 gr de levadura química,"Precalentar el horno a temperatura moderada (180°).. Batir los huevos con el azúcar hasta que estén espumosos. . Agregar las especias.. Intercalar la harina con la leche hasta terminar. Batir la preparación durante cinco minutos para que tome aire.. Pelar las manzanas. Cortar a la mitad, retirar el corazón y las semillas.. Cortar en cuartos.. Engrasar un molde para tarta.. Ir colocando las manzanas. . Verter encima el batido.. Hornear durante 40 a 50 minutos o hasta que la superficie se vea dorada.. A mitad de cocción, espolvorear con azúcar.. Comprobar que está cocido, introduciendo un palillo en el centro. Debe salir seco y limpio. Si no, dejar en el horno durante unos minutos más.. Dejar entibiar y desmoldar. Servir la tarta de manzanas con especias tibia, acompañada de un copete de nata montada."
"Receta de Torrijas veganas de pan integral, sin azúcar",2020-06-11 17:00:10+00:00,https://okdiario.com/recetas/receta-torrijas-veganas-pan-integral-sin-azucar-5731230/,6 rebanadas de pan integral. 300 ml de leche de almendras. 1 cucharadita de semillas de lino. ½ cucharadita de canela en polvo. 1 vaina de vainilla. Gotas de vainilla. 100 ml de agua. 100 ml de zumo de naranja. ½ limón. 1 rama de canela. Estevia,"En un bol mezclar la leche de almendras con la canela en polvo, la vainilla y las semillas de lino.. Batir con varillas para obtener una mezcla homogénea. Dejar reposar durante 10 minutos.. Remojar las rebanadas de pan (deben ser gruesas) en la mezcla anteriormente preparada durante 15 minutos, para que el pan se empape, pero no se desmigue.. Darle la vuelta al pan cada algunos minutos, para que se embeba por ambos lados. Si se advierte que la miga se deshace, sacar el pan del remojo.. Mientras, en una cazuela pequeña cocinar el zumo de naranja con el de medio limón, la cáscara del limón, la canela en rama, el agua y unas gotas de vainilla.. Añadir estevia al gusto.. Cocinar el almíbar sin que llegue a hervir, solo que reduzca.. Calentar la plancha y bañarla con un chorro de aceite de oliva.. Cocinar en la plancha caliente las torrijas a fuego medio, volteándolas con cuidado."
¿Cómo preparar un rico batido de coliflor?,2020-06-11 16:00:25+00:00,https://okdiario.com/recetas/como-preparar-rico-batido-coliflor-5731098/,2 flores de coliflor. 8 fresas maduras y firmes. 1 plátano maduro. 2 tazas de leche líquida (puede ser vegetal). 2 cucharadas de avena en hojuelas. 1 ½ cucharadas de azúcar o edulcorante. 5 cubitos de hielo,"Lavar muy bien la coliflor y dejar escurrir.. Cortar las flores de coliflor en trozos.. Lavar las fresas, retirar la parte verde y cortarlas en trozos.. Pelar el plátano y cortarlo en trozos.. En un vaso de licuadora, incorporar las dos flores de coliflor troceadas, agregar las ocho fresas y el plátano. Verter las dos tazas de leche.. Añadir al vaso de licuadora, las dos cucharadas de avena en hojuelas y la cucharada y media de azúcar. Incorporar los cubitos de hielo y triturar durante 15 segundos hasta obtener un batido homogéneo.. Distribuir el batido en vasos, ponerles una pajilla y consumir inmediatamente."
Receta de bocaditos de crema de calabacín con salmón,2020-06-11 15:00:27+00:00,https://okdiario.com/recetas/receta-bocaditos-crema-calabacin-salmon-5741779/,1 calabacín. 4 quesitos o queso para untar. 2 cucharadas de mayonesa. Salmón ahumado. Tostadas. Aceite. Sal. Pimienta. Flores para decorar,"Estos bocaditos son muy fáciles de preparar, los podemos tener listos en unos minutos y no tienen ningún secreto.. Empezamos por el calabacín, lavamos bien esta verdura. Nos interesa que se vea un poco el color verde intenso de la piel.. Cortamos el calabacín en rodajas del mismo tamaño para que se cocinen a la vez. En un cazo con una buena cantidad de agua, cocinamos el calabacín.. Cuando esté listo los escurrimos. Lo dejamos directamente en el vaso de la batidora. Trituramos hasta tener una salsa.. El calabacín tiene bastante agua, para que nos quede como una crema, añadimos los quesitos o el queso para untar y lo trituramos todo.. Podemos incorporarle un par de cucharadas de mayonesa, le darán un sabor un poco distinto, muy fresco para el verano.. Trituramos de nuevo hasta crear una crema de calabacín impresionante, podemos ponerla en una manga pastelera o montar el plato con cucharas, quedará igualmente bien.. Preparamos las tostadas pequeñas de canapés. Si tenemos tiempo podemos hacerlas en casa, cortamos con un cortador o un vaso pequeño rebanadas de pan de molde.. Ponemos el pan de molde en la tostadora unos minutos o lo tostamos en la sartén o en el horno hasta que nos quede en su punto.. Colocamos encima de cada tostada un poco de crema de calabacín. La repartimos bien sobre cada una de ellas.. Una buena pieza de salmón ahumado será la que corone el plato. Lo cortamos en trocitos de la misma forma que la tostada y ponemos encima.. Podemos decorar con unas flores comestibles o con unos germinados, tendremos listo un aperitivo sencillo y delicioso."
Receta de tarta fría de fresas con yogur,2020-06-11 13:00:39+00:00,https://okdiario.com/recetas/receta-tarta-fria-fresas-yogur-5740494/,250 gr de galletas maría. 3 cucharadas de aceite de coco. 1 cucharada de agua. 500 ml de yogur griego. 1 cucharada de vainilla. 2 cucharadas de azúcar. 1 cucharada de gelatina en polvo neutra. 400 ml de yogur natural. 200 gr de fresas. 1 cucharada de azúcar. 1 cucharada de gelatina. Fresas o frutos rojos para decorar. Chocolate de cobertura. Colorante comestible rosa,"Esta tarta es muy sencilla de preparar y queda especialmente bien. Nos ponemos manos a la obra a preparar la base.. Trituramos las galletas, les añadimos el aceite de coco líquido. Conseguiremos de esta manera la base sobre la que se posará la tarta.. Podemos hacer una versión más grande o pequeñas tartitas para cada uno de nuestros invitados o ese capricho veraniego para disfrutar.. En un cazo ponemos el yogur griego con la vainilla y el azúcar. Podemos añadirle más azúcar en caso de gustarnos muy dulce.. Incorporamos la gelatina sin dejar de remover. Colocamos esta primera base en la tarta, le dará un sabor increíble.. Seguimos con las fresas, lavamos las fresas y las colocamos en el vaso de la batidora. Trituramos hasta formar una base perfecta para esta segunda preparación.. Mezclamos las fresas con el yogur y ponemos de nuevo en el fuego. Las fresas suelen ser bastante dulces, pero podemos añadirle más azúcar.. Incorporamos la gelatina sin dejar de remover hasta que esté perfectamente integrada. Tendremos la segunda base de esta tarta.. Ponemos por encima de la gelatina de yogur. Podemos dejarla en el centro para crear varias capas o darle el aspecto que más nos guste.. Esta tarta irá directamente al congelador. Le daremos un acabado profesional con un poco de chocolate de cobertura y colorante comestible rosa.. Fundimos el chocolate y ponemos el colorante. Disponemos por encima de la tarta y dejamos que se enfríe.. Decoramos con frutos rojos o fresas, tendremos lista una tarta de esas que enamoran en verano, fresquita y deliciosa."
Receta de Sopa de tapado olanchano de Honduras,2020-06-11 12:00:05+00:00,https://okdiario.com/recetas/receta-sopa-tapado-olanchano-honduras-5730669/,"5 kilos de carne de vacuno. 500 gramos de chorizo, que no se deshaga al cocerse. 1 kilo de costilla de cerdo. 1 kilo de yuca. 3 plátanos maduros. 2 plátanos verdes. 4 tazas de leche de coco. 1 pastilla de consomé o caldo de pollo. 3 tomates. 1 cebolla. 1 chile. 4 dientes de ajo. 1 paquete de cilantro. 2 cucharadas de salsa inglesa. 2 cucharadas de salsa de tomate. 1 cucharadita de achiote o pimentón dulce. Especias al gusto (romero, tomillo…)","Cortar la carne en trozos medianos y ponerla a cocer en una olla mediana con suficiente agua con sal, hasta que se ablande.. En otra olla poner a cocinar las costillas de cerdo con dos ajos picados finamente y sal.. Aparte, cocinar el chorizo en dos dedos de agua.. Preparar un sofrito: en una cacerola aparte, poner una cucharada de aceite y echar los ajos y la cebolla finamente picados, los tomates en cuadrados pequeños, el chile, y el cilantro.. Dejar cocinar durante 5 minutos y luego sazonar con las especias, el achiote, la pastilla de consomé, la leche de coco, salsa inglesa, la salsa de tomate. Triturar en la batidora.. Poner a cocinar los plátanos maduros, los verdes y la yuca, todo picado en trozos medianos en una olla de buen tamaño.. Ir agregando la carne de cerdo, el chorizo y la carne salada, incorporar el sofrito y parte del caldo donde se cocinaron las costillas.. Agregar unas cáscaras de plátano verde a la sopa, tapar y cocinar hasta que las verduras estén listas.. Poner el conjunto a punto de sal."
Receta de ensalada de cuscús con aguacate y tomate,2020-06-11 09:00:20+00:00,https://okdiario.com/recetas/receta-ensalada-cuscus-aguacate-tomate-5738708/,2 tazas de cuscús. 2 tazas de agua. 2 cucharadas de aceite de oliva. 2 cucharadas de vinagre. 2 cucharadas de zumo de limón. ½ cucharadita de orégano deshidratado. 2 tomates. ½ pepino. ½ cebolla morada. 1 cebolleta. Col Kale. Rúcula o espinacas. Semillas. ½ aguacate. Sal. Pimienta,"El cuscús es uno de esos básicos que se prepara rápidamente y queda increíble. Calentamos el agua hasta que empiece a hervir.. Retiramos del fuego, ponemos el cuscús y una cucharada de aceite de oliva. Tapamos la olla y dejamos que se cocine el cuscús. Tardará unos 5 minutos en estar perfecto.. Preparamos un aderezo sencillo con un poco de zumo de limón, vinagre, aceite, sal, pimienta y el orégano. Batimos hasta tener esta base lista.. Seguimos con el pepino. Lavamos el pepino, lo pelamos y cortamos en trocitos del mismo tamaño. Repetimos la operación con los tomates.. Incluiremos el toque crujiente de la cebolla, la pelamos y cortamos en trocitos. Podemos escaldarla un poco más que no quede tan intensa.. El aguacate es uno de los protagonistas, lo partimos por la mitad, deshuesamos y cortamos una parte en trocitos.. Estos ingredientes frescos serán la base que le dará sabor y alegría a la ensalada. Con el cuscús listo incorporamos el aguacate, tomate y cebolla, cubrimos con el aliño y mezclamos. . Tostamos las semillas, podemos poner de girasol o de sésamo. Le darán un toque crujiente y todas sus propiedades.. Ponemos las semillas antes de la llegada de dos complementos más igual de saludables. Las espinacas y la col kale son dos ingredientes que le darán el toque de color y sabor a este cuscús.. En menos de 10 minutos podemos tener listo un plato saludable y delicioso. Solo nos faltará probarlo y disfrutarlo con la mejor compañía posible."
Receta de camarones al limón,2020-06-11 08:00:02+00:00,https://okdiario.com/recetas/receta-camarones-limon-5730284/,4 limones. 450 gramos de camarones. 3 cucharadas de aceite de oliva. 2 dientes de ajo bien picados. Un poco de jerez. Sal y pimienta al gusto. 4 cucharadas de perejil fresco picado,"Limpiar los camarones.. Rallar la piel de dos limones y exprimir su jugo.. Cortar en mitades los otros dos limones. Reservar hasta servir el plato.. Calentar una sartén con profundidad y agregar aceite de oliva.. Rehogar el ajo en la sartén durante menos de un minuto.. Añadir los camarones a la sartén y freír unos minutos. Ir removiendo durante toda la cocción.. Añadir al final la sartén el jerez, la ralladura y el zumo de limón. Mezclar bien.. Sacar los camarones de la sartén y colocar en un bol o fuente.. Salpimentar los camarones al gusto y agregar un poco de perejil."
Receta de tarta de coco con ron y especias,2020-06-10 18:00:58+00:00,https://okdiario.com/recetas/receta-tarta-coco-ron-especias-5736944/,200 gr de harina de repostería. 50 gr de coco rallado. 30 ml de ron. 3 huevos. 150 gr de azúcar. 120 gr de mantequilla. 120 ml de leche de coco. 1 cucharadita de canela molida. ¼ cucharadita de nuez moscada. ½ cucharadita de jengibre rallado. 1 cucharadita de polvo de hornear. 1 pizca de sal,"Precalentar el horno a temperatura media (170°).. Batir la mantequilla con el azúcar hasta obtener una crema.. Añadir la esencia de vainilla y una cucharada de ron, integrar.. Agregar uno a uno los huevos, batiendo bien después de cada uno para integrar por completo.. Tamizar la harina junto con las especias, el coco, el polvo de hornear y la sal.. Incorporar al batido en tandas, intercalando con la leche de coco.. Batir la preparación enérgicamente durante cinco minutos.. Engrasar y enharinar un molde y rellenar con la mezcla.. Hornear durante 35 a 40 minutos. Comprobar que esté cocido pinchando con un cuchillo en el centro.. Preparar un almíbar con dos cucharadas de ron, cinco de agua y cinco de azúcar.. Cuando el almíbar comience a hervir, retirar del fuego.. Pinchar la tarta con un palillo en varias partes, y verter el almíbar.. Dejar enfriar por completo antes de desmoldar.. Espolvorear la tarta de coco con ron y especias con coco rallado y servir."
Receta de pan de coliflor y ajo,2020-06-10 17:09:49+00:00,https://okdiario.com/recetas/receta-pan-coliflor-ajo-5736609/,"100 gramos de harina integral de espelta. 3 cucharadas de aceite de oliva. 3 dientes de ajo. 1 coliflor mediana. 3 huevos. Orégano, albahaca, ajo en polvo. Sal y pimienta","Batir los huevos hasta que estén espumosos.. Precalentar el horno a 200° C.. Añadir la harina tamizada junto con la sal, las especias y un poco de agua.. Triturar la coliflor, agregar el aceite de oliva y los ajos machacados.. Combinar esta mezcla con los huevos y la harina hasta integrar todo.. Dar un punto de sal.. Forrar una bandeja con papel vegetal.. Con ayuda de una cuchara, disponer pequeñas porciones en la bandeja de la forma que se quiera.. Hornear durante 20 minutos, o hasta que estén doradas.. Sacar del horno y reservar en una rejilla hasta que atemperen los panecillos de ajo y coliflor. No es recomendable comerlos con la masa todavía caliente, además de que así no se apreciaría bien su textura."
