title,date,url,ingredients,steps
"Caviar de tomate casero, receta para crear aperitivos de Navidad de lujo",2021-12-01 16:00:56+00:00,https://okdiario.com/recetas/caviar-tomate-casero-receta-crear-aperitivos-navidad-lujo-8207784/,1/2 litro de aceite de oliva virgen extra. 1 tomate. 10 gr Gelatina sin sabor,"Los ingredientes de este caviar de tomate son muy sencillos una muestra más de la grandeza de una receta que no podrás parar de cocinar.. El tomate te dará color y sabor a un caviar que queda de vicio con cualquier tipo de base, una tostada con queso de untar y este caviar ya destacar.. El procedimiento es muy sencillo, los 10 gramos de gelatina los diluimos en un poco de agua, la dejaremos lista para hacer el caviar.. Paralelamente vamos a por el tomate, lo pelamos y trituramos, quitamos las semillas, lo ideal es colarlo antes de colocarlo en el fuego.. Para darle alegría y cuerpo, incluimos con este tomate el aceite de oliva. Nuestro país es rico en este ingrediente, debe ser de buena calidad para disfrutar de un caviar casero de lujo.. Con la base lista calentándose al fuego y cocinando el tomate, será el momento de ponerle la gelatina.. Retiramos del fuego y mezclamos hasta que esté bien integrada, de esta forma tan sencilla conseguimos el caviar.. El siguiente paso es preparar un cuenco con agua y hielo. Vamos a colar la masa del caviar por un colador para que nos queden las bolitas hechas.. Tendremos listo el caviar a medida que se enfríe y coja un poco de textura, lo podemos guardar en un bote de cristal o tener en un plato listo para montar nuestros canapés.. Las posibilidades de esta base son enormes, desde colocarlo sobre un poco de queso, hasta combinarlo con un salmón ahumado o unos taquitos de jamón ibérico.. Atrévete a crear tu caviar de tomate casero, está buenísimo y es más saludable de lo que podrías llegar a imaginar."
"Janssons frestelse, receta sueca",2021-12-01 15:30:12+00:00,https://okdiario.com/recetas/janssons-frestelse-receta-sueca-8207969/,"8 patatas de tamaño mediano. 2 cebollas grandes. 3 latas de ansjovis, una conserva de pescado en lata escandinava, que se prepara con pescado espadín. 300 ml de crema de leche. 2 cucharadas de mantequilla. Pan rallado. Pimienta","Pelar las patatas, cortarlas en tiras pequeñas y sumergirlas en agua durante unos 10 minutos, para que suelten el almidón.. Cortar las cebollas en anillos finos. Poner la mantequilla en una sartén y una vez derretida añadir las cebollas, y dejarlas hasta que se doren.. Abrir las latas de ansjovis y sacar los filetes. Si se usan anchoas en vez de ansjovis se puede reservar el aceite de oliva.. En una bandeja para hornear previamente engrasada con mantequilla colocar una capa de patatas, luego una capa de cebolla y luego los ansjovis.. Agregar el punto de sal deseado.. Precalentar el horno a 225°C.. Añadir la crema de leche y espolvorear encima el pan rallado mezclado con pimienta.. Hornear a 225° durante 45 minutos, o a 200° durante una hora. Si se va a recalentar conviene agregarle un poco de leche."
Mousse de caramelos salados,2021-12-01 15:00:34+00:00,https://okdiario.com/recetas/mousse-caramelos-salados-8207844/,175 gramos de nata para montar. 150 gramos de azúcar. 50 gramos de mantequilla. Sal,"Verter la nata en un bol y calentar en el microondas durante un par de minutos. Sacar y reservar. Es importante que la nata que elijamos para esta receta tenga un buen porcentaje de materia grasa, sea un producto de la máxima calidad.. Calentar el azúcar en una cacerola a fuego bajo hasta caramelizar. Hay que tener cuidado, en este paso, de no calentar en exceso el caramelo y quemarlo, pues el postre amargaría al final.. Verter la nata tibia en la cacerola del caramelo.. Incorporar la sal y la mantequilla al caramelo. Cocinar durante dos minutos y mezclar bien.. Batir la nata bien fría y el azúcar glas en un bol aparte durante 2 minutos.. Agregar el mousse el queso para untar, la esencia de vainilla y el caramelo salado preparado con anterioridad. Mezclar suavemente hasta obtener una mezcla que sea bien homogénea.. Repartir la preparación en vasos o copas para postre.. Verter un poco de caramelo salado y enfriar en la nevera durante dos horas."
Semifrío de yogur y frutos del bosque,2021-12-01 13:14:43+00:00,https://okdiario.com/recetas/semifrio-yogur-frutos-del-bosque-8206004/, 200 gramos de yogur natural. 200 mililitros de nata (crema de leche). 25 mililitros de agua. 8 cucharadas de azúcar. 1 clara de huevo. 250 gramos de frutos del bosque,"Vierte el agua y 6 cucharadas de azúcar en una cazuela hasta formar un almíbar que servirá para montar el merengue italiano.. En un bol añade la clara de huevo y con la ayuda de unas varillas mezcla, vierte lentamente el almíbar hasta que monten.. Ahora, también usa las varillas para montar la nata en otro bol. No puede quedar a punto de nieve, sino semi montada.. Agrega la nata montada sobre el yogur y mezcla suavemente hasta que se integren.. Sobre el merengue vierte la mezcla de nata montada y yogur lentamente mientras mezclas con una espátula. Para lograr que se integren mejor, usa movimientos envolventes. No dejes grumos.. Elige el molde de tu preferencia y vierte toda la mezcla. Distribuye bien, cubre con papel film y lleva al refrigerador (3-4 horas). Aprovecha este tiempo para preparar la salsa de frutos del bosque. . Bate los frutos hasta formar una pasta o puré.. Cuela la mezcla para eliminar las semillas.. Agrega 2 cucharadas de azúcar y remueve hasta que se disuelva.. Cubre la mezcla y llévala al refrigerador."
Trufas de cava y frutos rojos,2021-12-01 09:00:11+00:00,https://okdiario.com/recetas/trufas-cava-frutos-rojos-8205824/,100 gramos chocolate negro (70 % cacao). 30 mililitros de champagne o de cava. 25 gramos de frutos rojos deshidratados. 80 mililitros de crema de leche. Cacao en polvo. 25 gramos de azúcar glas. 5 gramos de mantequilla,"En una cazuela, vertemos el azúcar y la crema de leche hasta que hiervan a fuego a lento.. Corta el chocolate en trozos pequeños y viértelo en un bol.. Añade encima del chocolate la mezcla de crema de leche y azúcar mientras esté caliente para que lo derrita.. Remueve suavemente con varillas o cuchara de madera hasta que esté homogéneo todo.. Agrega la mantequilla y el champagne o cava hasta que todos los ingredientes se incorporen.. Cuando la mezcla esté lista, extiéndela sobre una bandeja y distribuye los frutos rojos deshidratados encima hasta que integren.. Lleva al refrigerador hasta que se enfríe (unos 15 minutos). Saca la bandeja del refrigerador y con una cuchara de helado o con tus manos, forma pequeñas bolitas.. Por último, reboza las bolitas sobre una cama de cacao, incluso puedes usar el ingrediente de tu preferencia. Virutas de chocolate, azúcar, anís…"
Pollo al horno para que quede crujiente y jugoso,2021-12-01 08:45:23+00:00,https://okdiario.com/recetas/pollo-horno-62401/,1 pollo entero limpio y vacío por dentro. 2 chalotas. 2 zanahorias. 1 limón. 200 mililitros de agua. 2 cucharadas soperas de aceite de oliva. 1 cucharada de zumo de limón. 1 cucharada sopera de coñac o brandy. 1 cucharadita de pimienta negra recién molida. 1 cucharadita de sal. Tomillo. Romero,"Precalentamos el horno a 180 grados con calor arriba y abajo.. Depositamos el pollo en una bandeja y la colocamos sobre la rejilla del horno mientras se calienta. Esto nos permitirá obtener un pollo crujiente por fuera.. Mientras tanto cortamos las hojas de romero y tomillo. Luego las colocamos en un pequeño recipiente y vamos añadiendo el zumo de limón, el coñac, el aceite, pimienta, sal y una cucharadita de agua. Mezclamos todo muy bien.. Con esta mezcla pintamos el pollo por dentro y por fuera con ayuda de un pincel de cocina. . Cortamos el limón por la mitad y lo dejamos en el interior del pollo.. Vertemos el agua en la bandeja, debemos asegurarnos que no sea sobre el pollo, si no a los lados.. Calculamos el tiempo, cada 500 gramos de pollo son 30 minutos de cocción.. Horneamos y si notamos que se queda sin líquido podemos agregarle más agua en el proceso.. Mientras tanto pelamos y cortamos las chalotas y zanahorias.. Cuando al pollo le falte una hora de cocción agregamos las verduras a la bandeja.. Si nuestro horno es muy fuerte podemos tapar el pollo con papel aluminio. Cuando falten 10 o 15 minutos le retiramos el papel y llevamos a 200 grados para que terminar de dorar.. Es importante que en este tiempo estemos muy atentos de que no se queme.. Transcurrido el tiempo de cocción retiramos del horno y dejamos reposar unos minutos en la rejilla. Después podemos consumir."
"Tacos de atún rojo, receta de un entrante de lujo fácil de preparar",2021-11-30 19:00:50+00:00,https://okdiario.com/recetas/tacos-atun-rojo-receta-entrante-lujo-facil-preparar-8201709/,Un trozo de lomo de atún rojo. 1 aguacate. 1 chile picante. Tortillas de maíz. 1 limón o lima. 1 cebolla. Tomates cherry. 2 tomates. Aceite de oliva virgen extra. 1/4 de cucharada de sal. Soja. Cilantro fresco,"Esta receta no tiene complicación alguna, la mejor forma de que nos quede perfecta es usar un buen atún rojo nacional.. El atún puede ser fresco o congelado. Nos pondremos manos a la obra cortando el filete de atún en taos del mismo tamaño.. Con el atún listo, lo colocamos sobre papel absorbente mientras seguimos con el resto de los ingredientes.. La cebolla es el siguiente elemento que pelamos y cortamos por la mitad en trocitos del mismo tamaño, la ponemos en un bol con soja para que macere un poco. Reservamos la otra mitad.. Seguimos con el tomate, cortamos el resto de la cebolla y medio chile. Freímos la cebolla troceada con un buen chorrito de aceite.. Cuando la cebolla esté tierna añadimos el tomate y dejamos cocinar a fuego lento unos minutos hasta que seste lista la salsa.. Le ponemos un poco de chile picado al gusto, dejamos que se cocine unos minutos y cuando esté todo listo, rectificamos de sal y pimienta. Trituramos.. En un sartén con un chorrito de aceite ponemos el atún para que se cocine rápidamente un poco, nos interesa que quede en su punto.. Incorporamos la salsa de tomate picante y removemos durante unos minutos, estará listo el relleno de este taco.. Pelamos el aguacate y lo ponemos en el vaso de la batidora. Añadimos una cucharada de zumo de lima, sal, un poco de cilantro fresco. Trituramos hasta crear el guacamole perfecto.. Nos quedará calentar las tortillas de maíz y rellenarlas con el atún y el guacamole. Tendrás listo un taco de atún rojo de los que parece sacado de un restaurante con estrella Michelin."
"Receta de Masterchef Celebrity, corales «Cena de Navidad»",2021-11-30 18:00:58+00:00,https://okdiario.com/recetas/receta-masterchef-celebrity-corales-cena-navidad-8201015/,"1 bogavante. 250 gr aceite de oliva. c/s de ralladura de limón. c/s de pimienta negra molida. 1 bouquet garní formado por ramas de tomillo, estragón, romero y albahaca","La principal complicación de la receta de Juanma Castaño consistía en hacerse con una buena materia prima, un bogavante de lujo de origen local puede ser la clave de nuestro éxito.. Cocinamos el bogavante en agua hirviendo, con una proporción de sal de 20 gr por litro de agua, durante 4 minutos. Cortamos la cocción en agua con hielos y sal.. De esta manera el bogavante se mantendrá en perfectas condiciones y nos dará su preciada carne suave y deliciosa.. Mezclamos en un bol aceite, ralladura de limón, tomillo, pimienta negra molida, estragón, romero y albahaca.. Troceamos el bogavante con las manos y reservamos los trozos grandes para que se impregne con el macerado que hemos creado.. Reservamos la cabeza y las cáscaras para salsa americana que preparamos fácilmente, rehogando en la mantequilla los carabineros, las cabezas y cáscaras de bogavante picadas.. Le añadimos las verduras y cocinamos hasta tostar. Incorporamos un poco de tomate frito, la nata y el agua.. Hervimos suave durante 15 minutos y colamos salpimentamos al gusto y reservamos unos 150 gramos para hacer el falso caviar.. Para hacer el caviar, mezclamos la salsa americana con un poquito de colorante y el agar-agar. Tiramos unas gotas sobre aceite y dejamos que cuaje."
Polvorones con crema de avellanas de Mercadona: una delicia al alcance de todos,2021-11-30 16:00:32+00:00,https://okdiario.com/recetas/polvorones-crema-avellanas-mercadona-delicia-alcance-todos-8200957/,320 gr de harina todo uso. 120 gr de azúcar glass. 100 gr de manteca de cerdo a temperatura ambiente. 200 gr crema de avellanas,"Esta receta se prepara muy fácilmente, solo necesitamos hacernos con una buena base y unos ingredientes que son la clave principal de unos buenos polvorones.. Encenderemos el horno, lo ponemos a 180º y empezamos a tostar la harina en él. Es la mejor forma de conseguir la base perfecta de unos mantecados tradicionales con un toque especial.. Removemos la harina que tenemos en el horno cada 10 minutos para que tenga el sabor tostado, pero también la textura que buscamos.. Con la harina tostada, tamizamos con cuidado los ingredientes secos y los mezclamos en un bol. Directamente con las manos conseguiremos crear una masa fina deliciosa.. La manteca de cerdo, el azúcar glass y la crema de avellanas serán los culpables de crear un polvorón de Kinder Bueno espectacular.. Una vez superada la tentación de comerse la masa a mordiscos, vamos a hacer una bola que estiraremos con cuidado con un rodillo.. Sobre una superficie enharinada crearemos una lámina de unos centímetros de grosos para poder darles forma a los polvorones.. Podemos usar un vaso o un cortador de galletas para que nos quede con una forma redonda bonita. Si nos atrevemos con las manos también pueden quedar bien.. Colocamos los polvorones en una bandeja con papel vegetal, los vamos a poner en el horno a 180º unos 7 minutos hasta que cojan color.. Una vez listos los retiramos del horno y los decoramos al gusto. Podemos rebozarlos en azúcar glass y canela o ir un poco más allá.. Con chocolate rallado o unas galletas por encima, estos polvorones de crema de avellanas están de vicio. Atrévete a probarlos, el esfuerzo merecerá la pena."
Mug cake de café con glaseado,2021-11-30 16:00:19+00:00,https://okdiario.com/recetas/mug-cake-cafe-glaseado-8202555/,15 gramos de manteca o mantequilla pura. 25 gramos de azúcar. 30 gramos de harina. 2 gramos de polvo para hornear. 30 mililitros de café expreso. vainilla. Sal,"Diluir el azúcar glas en un bol con agua hirviendo y zumo de limón. Batir enérgicamente para hacer el glaseado y reservar.. Poner la manteca o mantequilla en otra taza y calentar 10 segundos en el microondas hasta ablandar.. Retirar la manteca del microondas y añadir el azúcar. Mezclar bien hasta que no tenga grumos.. Agregar a la mezcla de la manteca el café, la vainilla, la harina, el polvo de hornear y la sal. Mezclar bien todo.. Cocinar la mezcla durante 50 segundos seguidos en el microondas.. Seguir cocinando la mezcla en intervalos de 10 segundos ocho veces.. Retirar la mezcla del microondas y esperar a que termine de cocinarse.. Verter el glaseado sobre el mug y servir en el mismo recipiente."
Bizcocho de té verde al microondas,2021-11-30 15:00:51+00:00,https://okdiario.com/recetas/bizcocho-te-verde-microondas-8202435/,4 gramos de té matcha. 2 huevos. 50 gramos de azúcar. 50 gramos de harina. 5 gramos de levadura en polvo. 70 mililitros de leche entera. 15 mililitros de aceite de oliva.,"Colocar en un bol los huevos y batir.. Agregar el azúcar y batir hasta que la mezcla blanquee.. Incorporar el aceite y seguir batiendo.. Calentar la leche en el microondas y añadir el té verde.. Remover loa leche y el té verde hasta que la mezcla adquiere un color verde intenso. Colar y reservar.. Integrar la mezcla del té a la de los huevos batidos.. Tamizar la harina y la levadura e incorporar a la mezcla progresivamente.. Preparar un molde de 15 centímetros de diámetro y verter la preparación. Tapar con papel film.. Llevar al microondas y cocinar durante 5 minutos en potencia baja a 200 vatios.. Subir la intensidad del microondas a 500 vatios y cocinar durante 90 segundos más.. Retirar del horno, desmoldar y poner a enfriar a temperatura ambiente."
"Polos de limón y leche condensada, receta casera",2021-11-30 13:00:16+00:00,https://okdiario.com/recetas/polos-limon-leche-condensada-receta-casera-8201506/,150 gramos de leche en polvo. 200 gramos de azúcar. 50 mililitros de agua,"Colocar el azúcar junto con el agua en una cacerola y cocinar a fuego bajo hasta hervir.. Mezclar hasta que se disuelva bien el azúcar.. Verter la preparación en la licuadora e incorporar la leche en polvo. Licuar para integrar los ingredientes.. Colocar esta leche condensada casera en un bol y dejar enfriar a temperatura ambiente. Reservar.. Verter la leche entera, la leche condensada casera y el zumo de limón en una jarra.. Remover muy bien hasta obtener una crema homogénea y espesa.. Colocar la mezcla en los moldes para polos y refrigerar durante 4 horas.. Pasar los moldes por el chorro de agua durante unos segundos para desmoldar cada polo antes de comer."
Crema de café con chantilly,2021-11-30 10:45:44+00:00,https://okdiario.com/recetas/crema-cafe-chantilly-8201337/,35 gramos de café soluble. 150 gramos de azúcar. Virutas de chocolate. 140 mililitros de agua fría,"Colocar en un bol el café soluble, el azúcar y el agua muy fría.. Batir la mezcla anterior en la batidora manual de varillas a velocidad media durante 4 minutos. Mezclar hasta obtener una crema esponjosa.. Verter la nata en otro bol y batir con la batidora de mano a máxima velocidad durante 1 minuto.. Incorporar el azúcar glas a la nata y batir durante 3 minutos más.. Bajar la velocidad a media y añadir la nata a la esencia de vainilla. Mezclar hasta integrar todo y reservar.. Verter la crema de café en una manga pastelera y colocar una porción generosa en un vaso para postre.. Poner también la crema chantilly en una manga pastelera y colocar una capa sobre la crema de café.. Decorar con virutas de chocolate y servir."
"Mug cake de vainilla, receta sencilla",2021-11-30 09:00:34+00:00,https://okdiario.com/recetas/mug-cake-vainilla-receta-sencilla-8201162/,45 gramos de harina. 1 huevo. 30 gramos de azúcar. 15 mililitros de aceite de maíz. 30 mililitros de leche. Extracto de vainilla. Polvo para hornear. Sal,"Batir el huevo en un bol enérgicamente.. Añadir al huevo la leche, el aceite, el extracto de vainilla y el azúcar.. Mezclar bien hasta integrar todos los ingredientes y eliminar los grumos.. Tamizar la harina y el polvo de hornear previamente.. Integrar la harina y el polvo de hornear a la mezcla con movimientos suaves y envolventes.. Colocar la mezcla en una taza para hornear y cocinar en el microondas durante 2 minutos a máxima potencia.. Retirar del microondas y esperar que termine de cocinar por dentro."
"Paté de gambas y palitos de mar, receta de aperitivo navideño fácil de preparar",2021-11-29 19:00:29+00:00,https://okdiario.com/recetas/pate-gambas-palitos-mar-receta-aperitivo-navideno-facil-preparar-8194615/,12 gambas. 12 palitos de mar. 1 huevo duro. 2 cucharadas soperas de queso crema. 4 cucharadas soperas de mahonesa. Tostaditas para untar. Sal. Pimienta,"Esta receta es muy fácil de preparar, solo necesitamos preparar una buena materia prima para disfrutar.. Las gambas pueden ser frescas o congeladas, en nuestro país tenemos zonas donde se pescan, comprarlas frescas es un pequeño placer que nos podemos permitir.. Si son congeladas las sacamos del congelador mientras cocinamos el huevo duro, necesitará unos minutos en estar listo.. Cuando el huevo esté cocinado lo ponemos bajo un buen chorro de agua fría para que se pele mejor.. Colocamos el huevo en un bol perfectamente troceado, mientras esperará al resto de los ingredientes.. Cocinamos las gambas en una sartén con un chorrito de aceite, de esta manera nos quedará un paté espectacular.. Sean frescas o congeladas, las gambas es un tipo de marisco que necesita unos minutos en estar perfecto.. Pelamos las gambas una vez estén en su punto y las ponemos cortaditas con el huevo que ya estará listo.. Nos faltarán los palitos de mar, el otro ingrediente que también ponemos en este bol que será la base de un paté navideño de lujo.. Incorporamos el queso crema para que nos quede un paté cremoso y delicioso. Podemos usar un queso light para añadirle menos calorías.. Con todo casi listo, los faltará la mayonesa y añadirle la sal y pimienta al gusto para obtener el acabado que buscamos.. Trituramos todo hasta que nos quede con la textura que buscamos. Podemos colocarlo en un tarro de cristal para que se sirvan los invitados con un trocito de pan al lado.. Este paté es una buena base de canapés, con unas huevas de salmón este paté de gambas y palitos de mar coronado con eneldo pueden estar espectaculares."
"Empanadillas de rabo de toro, receta para una tapa de lujo",2021-11-29 18:00:14+00:00,https://okdiario.com/recetas/empanadillas-rabo-toro-receta-tapa-lujo-8194560/,6 obleas para empanadillas. 390 gr de rabo de toro estofado. Aceite de oliva. 4 pimientos rojos,"Esta receta de empanadillas de rabo de toro, parte de este ingrediente ya cocinado. Para hacerlo en casa es importante disponer de una buena materia prima y las herramientas para hacerlo.. Podemos hacerlo en unos minutos en la olla expres, con ayuda de un vaso de vino tinto y uno de caldo. Junto con el rabo de toro conseguiremos que nos quede jugoso y delicioso.. Cuando tenemos el rabo de toro cocinado, lo deshuesamos y cortamos en trocitos pequeños para que nos quede la carne perfecta para unas empanadillas de lujo.. Aprovechamos los minutos que tenemos la carne en la olla para cocinar los pimientos. Los untamos con aceite de oliva y asamos en el horno.. Con el aceite de oliva se podrán pelar más fácilmente, quitamos las semillas y troceamos hasta tener los pimientos preparados.. Troceamos y mezclamos con la carne, les darán sabor y alegría a unas empanadillas con mucha personalidad.. Para hacer las típicas empanadillas de media luna, solo colocamos en un extremo el relleno y plegamos. Fusionamos las puntas con un poco de agua y el tenedor.. También pueden quedar bien en moldes de cupcakes, colocamos una oblea, rellenamos y sellamos con la otra por encima.. Pintamos con el aceite de oliva cada empanadilla de rabo de toro para que quede perfecta y se dore en el horno.. Colocamos en el horno a 200º durante unos minutos, la carne ya está cocinada, solo esperamos a que la masa coja color.. Tendremos listas unas empanadillas de rabo de toro espectaculares, solo nos quedará disfrutarlas en una buena cena en familia o amigos. Atrévete a probarlas están de vicio."
"Arenque con tomate, receta noruega",2021-11-29 15:30:30+00:00,https://okdiario.com/recetas/arenque-tomate-receta-noruega-8193657/,12 filetes de arenque. 100 ml de vinagre blanco. 3 cucharadas de salsa de soja. 150 ml de puré de tomate o de kétchup. Sal. Pimienta,"Limpiar los filetes de arenque y luego enrollarlos, sujetándolos con un palillo.. Mezclar en un bol el vinagre, las cucharadas de soja y el puré o kétchup.. Salpimentar al gusto.. Colocar los arenques enrollados en un envase para hornear y rociar encima la salsa.. Hornear a 180° por 10 minutos.. Una vez frío, poner en el refrigerador y dejar reposar al menos 24 horas antes de servir."
"Consomé de albóndigas, receta noruega",2021-11-29 15:00:29+00:00,https://okdiario.com/recetas/consome-albondigas-receta-noruega-8193495/,"500 gramos de cordero con hueso (se consiguen preparados con codillo, cuello y otras partes de cordero). 125 gramos de carne picada de cordero. 125 gramos de carne picada de vacuno. 1 litro de agua. 2 patatas pequeñas. 1 zanahoria mediana. 50 gramos de pan rallado. 60 ml de crema de leche. Leche, la necesaria. ½ cucharadita de nuez moscada. ¼ cucharadita de pimienta. ¼ de cucharadita de jengibre. Sal","Deshuesar los 500 gramos de cordero y colocar los huesos en una cacerola con el agua y hervir para hacer el caldo. Cortar la carne en cuadrados y reservar.. Una vez que hierva el agua con los huesos, dejar a fuego medio durante unas tres horas. Retirar con espumadera la espuma que se vaya formando.. Poner las carnes de cordero y vacuno en boles separados, no hay que mezclarlas. Añadir a cada bol la mitad de los siguientes ingredientes: pan rallado, crema de leche, leche, pimienta y jengibre. Sal al gusto.. Amasar la carne hasta que tenga la consistencia deseada, formar las albóndigas y reservar.. Cortar la zanahoria y las patatas en cuadrados y poner a hervir en otra cacerola.. Pasada las tres horas el caldo pasar por el chino, agregar los cuadrados de cordero, la media cucharada de nuez moscada y sal al gusto, y cocinar durante una hora más.. Cocer las albóndigas en el caldo durante 15 minutos y retirar.. Una vez apagado el caldo, en dos platos soperos distribuir las zanahorias, las patatas y las albóndigas, y luego verter el caldo."
