title,date,url,ingredients,steps
Receta de Bolitas de frutos secos y naranja,2020-05-24 16:00:15+00:00,https://okdiario.com/recetas/receta-bolitas-frutos-secos-naranja-5651653/,2 naranjas (ralladura). 200 gramos de anacardos crudos o almendras. 70 gramos de dátiles sin hueso,"Utilizar la ralladura de dos naranjas.. Triturar lo más posible los anacardos o las almendras. Colocar los frutos secos triturados en un bol.. Agregar al bol la ralladura de las naranjas, así como también los dátiles deshuesados. Triturar nuevamente todos los ingredientes hasta obtener una masa homogénea.. Cuando la masa esté lista, se toma un poco de la misma y con la ayuda de las palmas de la mano se le da forma de bolita. Una vez que esté lista, se coloca en un plato limpio.. Se debe repetir el procedimiento anterior hasta que se termine la masa. Se debe tratar de que todas las bolitas queden, más o menos, del mismo tamaño para una mejor presentación. Luego solo queda servir y listo."
Receta de bizcocho de salchichas de Frankfurt,2020-05-24 15:00:16+00:00,https://okdiario.com/recetas/receta-bizcocho-salchichas-frankfurt-5654525/,3 huevos. 150 gr de harina. 1 sobre de levadura. 1 vaso de leche entera. ½ vaso de aceite de oliva. 1 cucharada de mostaza. 100 gr de queso en polvo. 1 paquete de salchichas Frankfurt. Pimienta. Sal,"Para esta receta no necesitamos complicarnos la vida, si disponemos de los ingredientes en la nevera nos pondremos manos a la obra con una elaboración de lo más sencilla.. Encenderemos el horno en primer lugar para que esté listo a la hora de recibir nuestro bizcocho. Lo pondremos a 180º.. Preparamos un recipiente, lo engrasamos con un poco de mantequilla, de esta manera lo tendremos todo listo.. Batimos los huevos en un bol. Cuando estén bien esponjosos, incorporamos la leche sin dejar de batir. Estos dos ingredientes serán la base de esta delicia.. Le daremos un poco de grasa con la llegada del aceite de oliva. Este ingrediente será perfecto para darle la gracia a un bizcocho repleto de sabor.. El secreto de esta preparación consiste en un poco de mostaza que le aporte el sabor inesperado que hace grande este bizcocho.. Tamizamos la harina y la levadura. Mezclamos con cuidado para que se integren perfectamente en la masa.. Salpimentamos al gusto. Llega el turno de las protagonistas, abrimos el paquete de salchichas de Frankfurt y las cortamos en porciones pequeñas.. Incorporamos al bizcocho las salchichas. Le añadimos el queso en polvo para darle un poco más de alegría. Esta masa será la que se convierta en un básico de cualquier cocina.. Ponemos en la fuente que tenemos lista y horneamos a 180º durante unos 40 minutos. Comprobamos nuestro bizcocho.. Retiramos del horno y esperamos a que se enfríe para desmolarlo, podemos servirlo con un poco de kétchup o de mayonesa. Este bizcocho es un descubrimiento que no podemos dejar escapar."
Cómo hacer patatas fritas light al microondas,2020-05-24 13:00:43+00:00,https://okdiario.com/recetas/como-hacer-patatas-fritas-microondas-crujientes-saludables-5654447/,Patatas. Aceite de oliva. Sal. Pimienta,"Usar el microondas para freír unas patatas es el gran invento del siglo XXI. Esta herramienta nos permitirá crear las mismas sensaciones que en una sartén llena de aceite con mucha menos grasa.. Elegiremos la variedad de patata que más nos guste. Lavamos bien las patatas, podemos dejarles la piel o directamente pelarlas. Para que nos queden lo más crujientes posibles, las cortaremos con la mandolina.. Esas láminas de patata, lo más finas posibles, podemos cortarlas con un cuchillo bien afilado, irán directamente a un recipiente con agua fría. De esta manera las podemos dejar reposar en la nevera hasta la hora de prepararlas.. Las patatas perderán almidón y nos quedarán mucho más crujientes, es un pequeño truco que siempre viene bien para crear el mejor resultado posible.. Seguimos con el papel de horno. Cortamos un trozo que sea igual que la bandeja del microondas para poder colocar unas gotas de aceite de oliva encima.. Colocamos las patatas, los trocitos los unos al lado de los otros sin que no se solapen entre ellas. De esta manera tendremos un bocado maravilloso listo para la acción.. Salpimentamos al gusto. Podemos ponerle algunas especias que nos gusten, le darán sabor y una cierta alegría.. Con todo listo encendemos el microondas a máxima potencia durante unos 6 minutos. Comprobamos que las patatas están listas.. Sacamos las patatas y esperamos que se enfríen. Mientras repetimos la operación y volvemos a poner nuevamente una tanda de patatas en el microondas.. De esta manera tan sencilla se pueden conseguir unas patatas fritas más naturales y deliciosas, sin tanta grasa, con todo el sabor.. Atrévete a disfrutarlas por todo lo alto, merece la pena probar unas patatas fritas tan deliciosas y poder comerlas sin remordimientos."
Receta de Maxibon con chocolate crujiente saludable,2020-05-24 11:00:23+00:00,https://okdiario.com/recetas/receta-maxibon-chocolate-crujiente-saludable-5653812/,700 gr de queso fresco batido. 500 ml de leche evaporada. 2 cucharaditas de extracto de vainilla natural. 20 gr de chocolate negro 85 %. Stevia al gusto,"Empezamos esta delicia preparando el helado. Batimos el queso fresco en un bol, le añadimos la leche evaporada sin dejar de batir.. Cuando estén estos ingredientes bien integrados añadimos la vainilla y la Stevia al gusto. Tendremos una buena base.. El Maxibon no sería lo mismo sin los trocitos crujientes de chocolate. Rallamos el chocolate negro para incluirlo en este helado.. Ponemos el helado en el congelador para que vaya cogiendo consistencia, mientras seguiremos con el resto de los ingredientes.. Tamizamos la harina de trigo integral. Añadimos la crema de cacahuete y el huevo. Le daremos sabor con la vainilla.. Creamos la masa de la galleta de esta forma tan sencilla. Extendemos la masa hasta que nos queden los rectángulos que formarán el Maxibon.. Cortamos la pasta en los trozos que necesitamos, los ponemos en una fuente par horno. Horneamos a 180º unos 8 minutos.. Con las galletas listas, las retiramos del horno y esperamos a que se enfríen para montar este helado casero.. Calentamos el chocolate negro y lo mezclamos con las avellanas tostadas troceadas. Reservamos para el último momento.. Sacamos el helado del congelador, lo cortamos y colocamos entre dos galletas. Sumergimos una parte o cubrimos con el chocolate y avellanas.. Dejamos los helados en el congelador hasta que nos apetezca un Maxibon saludable. Tendremos lista la merienda del verano sin ningún remordimiento."
Receta de Entrecot con salsa de cabrales,2020-05-24 10:00:54+00:00,https://okdiario.com/recetas/receta-entrecot-salsa-cabrales-5651823/,4 entrecot de ternera. 80 gramos de queso cabrales. 1 cucharada de extracto de carne. 300 mililitros de nata. Aceite de oliva. Sal. Pimienta negra,"Media hora antes de comenzar a cocinar, sacamos el entrecot del refrigerador para que vuelva a la temperatura normal.. En una sartén a fuego medio bajo colocamos el queso cabrales desmenuzado, la nata y el extracto de carne. Revolvemos suavemente hasta que se mezclen bien los ingredientes.. Aumentamos el fuego, revolviendo contantemente, para que la sala espese y se reduzca.. Agregamos una pizca de pimienta y de sal al gusto. Reservamos.. Calentamos una sartén o plancha. Agregamos un poco de aceite de oliva directamente en el entrecot por ambos lados y lo llevamos al fuego.. El tiempo que dure en cocinarse depende del gusto. Si el entrecot es grueso y lo queremos rosado por dentro, con 2 minutos en ambos lados bastará.. Rectificamos la sal del entrecot y lo servimos con salsa por encima, acompañado con ensalada, patatas fritas o puré."
Receta de doritos caseros,2020-05-23 15:00:53+00:00,https://okdiario.com/recetas/receta-doritos-caseros-5652127/,24 tortillas de maíz. Aceite. ¼ taza de queso cheddar en polvo. 2 cucharadas de pimentón. 1 cucharada de ajo en polvo. 1 cucharada de cebolla en polvo,"Esta receta no tiene ninguna complicación es muy sencilla de conseguir con los ingredientes adecuados. Las tortitas de maíz serán la base que se cubrirá de gloría con unas especies adecuadas.. Nos ponemos manos a la obra con las tortitas, las cortamos en triángulos. Les damos forma a estos doritos empezando por la base.. Una vez los tenemos listos, tendremos que elegir entre freírlos o cocinarlos al horno. Deben quedar lo más crujientes posibles.. Si optamos por freírlos ponemos en una sartén abundante aceite. Cuando esté caliente ponemos los doritos. Dejamos que se doren. Los retiramos con cuidado y ponemos sobre papel absorbente para que eliminen el exceso de aceite.. Hacerlos al horno significa invertir un poco más de tiempo. Ponemos los doritos en una fuente para horno forrada por papel de horno.. Horneamos los doritos a 180º durante unos 20 minutos. Cuando vemos que ya están crujientes retiramos del horno.. Llega el momento de hacer magia, ponemos los doritos en una bolsa con cierre hermético. Añadimos las especias y agitamos bien.. Las tortitas quedarán perfectamente cubiertas con uno dorito de bolsa, pero a nuestro estilo. Merece la pena que probemos esta maravilla, está para chuparse los dedos."
Receta de tarta de galletas con crema de fresas y chocolate blanco,2020-05-23 13:00:16+00:00,https://okdiario.com/recetas/receta-tarta-galletas-crema-fresas-chocolate-blanco-5651582/,1 paquete de galletas tipo maría. 200 gr de fresas. 150 gr de chocolate blanco. 125 ml de nata líquida para montar. 125 gr de azúcar. Fresas frescas para la decoración,"Esta receta es tan sencilla de preparar que no podrás resistirte a hacerla una y otra vez. Con una buena materia prima el éxito estará asegurado, esas fresas frescas serán la excusa perfecta para prepararla.. Empezamos lavando bien las fresas. Las vamos a cortar en trocitos del mismo tamaño. Añadimos un poco de azúcar y las ponemos en el vaso de la batidora.. La cantidad de azúcar es relativa, depende de cómo nos gusten los postres y del dulzor de esta maravillosa fruta.. Trituramos hasta tener una especie de batido o crema que reservamos mientras continuamos con el resto de los ingredientes.. Ponemos la nata a calentar en un cazo. Este elemento le dará la textura y un sabor marcado al resto de los ingredientes.. Fusionamos la nata con el chocolate blanco. Lo troceamos y añadimos a la nata. A medida que se vaya calentando se irá fundiendo.. Cuando tenemos la nata y el chocolate listo, incorporamos la crema de fresas. Este increíble relleno será el que le de sabor a esta tarta.. Preparamos un molde. Mojamos las galletas en leche y las ponemos en el fondo, encima disponemos la crema bien repartida.. Repetimos la operación hasta rellenar todo el molde. Cubrimos con un poco de nata si queremos darle un aire más festivo.. Dejamos en la nevera o en el congelador hasta la hora de servir. Acompañamos de unas fresas cortadas o de unas gominolas tendremos listo un postre rápido, sencillo y delicioso que gustará a toda la familia."
Receta de Croquetas picantes de carne de ternera,2020-05-23 12:00:27+00:00,https://okdiario.com/recetas/receta-croquetas-picantes-carne-ternera-5651575/,300 gramos de carne bien picada. 200 ml de leche. 100 gramos de harina de trigo. 30 gramos de mantequilla. 1 huevo. 150 gramos de pan rallado. Pimienta negra recién molida. 1 guindilla picante. 2 cucharadas de aceite de oliva. Sal. Aceite para freír,"En una sartén, poner el aceite de oliva y freír ligeramente la carne junto con la guindilla picada muy fina.. Cuando haya cambiado de color, salpimentar y añadir la mantequilla y la harina.. Remover para que la carne absorba la harina y se haga una especie de masa.. Trabajar la masa durante unos minutos, para que la harina no quede cruda.. Agregar un chorrito de leche (se añade muy despacio, para que las croquetas no queden grumosas).. Dejar que la masa vaya absorbiendo la leche, a fuego bajo, sin dejar de remover.. Rectificar de sal. Reservar en la nevera durante dos horas.. Cuando la masa esté totalmente fría y reposada, formar las croquetas. Pasarlas por huevo y luego por el pan rallado.. En una cacerola o sartén grande, poner aceite suficiente. Cuando esté caliente, freír las croquetas hasta que doren.. Sacarlas del aceite y pasarlas a un plato con papel absorbente de cocina, para que pierdan el exceso de grasa."
Receta de huevos con tomate y albahaca,2020-05-23 11:00:04+00:00,https://okdiario.com/recetas/receta-huevos-tomate-albahaca-5650584/,1 diente de ajo. 1 loncha de jamón. Mantequilla. 2 tomates. Mozzarella. Albahaca. Sal. Pimienta. 2 huevos,"Esta receta además de ser muy sencilla quedará increíble con el mínimo esfuerzo. Solo necesitamos hacernos con unos ingredientes básicos para poder crear un plato de restaurante.. La misma cazuela que usaremos para prepararla será la de la presentación, podemos emplear un molde para horno que nos permita cocinarlo a la perfección. Las cazuelas de barro son una buena opción.. Pelamos el diente de ajo y lo rallamos. En el fondo de la cazuela ponemos la mantequilla para darla la grasa necesaria.. Añadiremos a esta mantequilla el ajo bien repartido para darle un punto de sabor. Podemos ponerle un poco más de ajo si nos gusta o no ponerlo, si no somos mucho de ajo.. Encima de la mantequilla y el ajo colocamos una loncha de jamón. De york o ibérico, nos interesa esa grasa que desprenderá y que le dará sabor a esta receta.. Seguimos con los tomates. Los troceamos para que se conviertan en el siguiente ingrediente en entrar en juego.. Salpimentamos al gusto los tomates, sin pasarnos si usamos un jamón ibérico que ya sería salado y no nos haría falta potenciar aún más este sabor.. Cortamos un poco de mozzarella y la colocamos en lonchas por encima del tomate. Esta combinación es un clásico que nunca fallará.. Llega el turno de los ingredientes estrella, los huevos. Ponemos encima. Los vamos a cocinar en el horno que tendremos precalentado a 200º.. Ponemos los huevos en el horno y dejamos que se cocine todo el conjunto unos 10 minutos. Pasado este tiempo retiramos del horno, comprobamos si están listos.. Coronamos esta receta con unas hojas de albahaca picada, le darán color y sabor a unos huevos que se acabarán convirtiendo en un básico de cualquier cocina."
Receta de Hot Dog neoyorkino: el original,2020-05-23 10:00:04+00:00,https://okdiario.com/recetas/receta-hot-dog-neoyorkino-original-5651542/,4 salchichas de vacuno. 4 panecillos de Hot Dog. 1 cebolla dulce. 1 cucharadita de azúcar moreno. Chucrut al vino. Mostaza especiada. Kétchup. 1 pizca de canela molida. Aceite de girasol,"Cortar la cebolla dulce en juliana.. Colocar un poco de aceite de girasol en una sartén a fuego medio. Cuando esté caliente, se incorpora la cebolla.. En el momento en que la cebolla comience a transparentar, se agrega la cucharadita de azúcar moreno, una pizca de canela molida y un chorrito de Kétchup. Mezclar muy bien los ingredientes mientras se continúa sofriendo a fuego suave – medio.. Calentar las salchichas durante unos minutos en agua caliente. Aprovechar el vapor del agua para calentar también los panecillos de Hot Dog.. Introducir la salchicha en el pan con mucho cuidado de no quemarse. A continuación, agregar la mostaza, el chucrut al vino y finalmente el sofrito de cebolla dulce. Repetir el método con cada uno de los hot dogs que se quieran preparar."
Receta de coulant de chocolate relleno de mantequilla de cacahuete,2020-05-23 09:00:55+00:00,https://okdiario.com/recetas/receta-coulant-chocolate-relleno-mantequilla-cacahuete-5650144/,200 gr de chocolate negro. 100 gr de mantequilla. 2 huevos. 110 gr de azúcar glass. 35 gr de harina. 8 cucharadas de mantequilla de cacahuete. Cacao en polvo,"Esta receta se cocinará muy rápidamente solo se necesita tener todo listo, el horno encendido a 200º si vamos a prepararlo al momento es fundamental. Podemos dejarlo listo para la cena o comida y hacerlo entonces.. Para esta receta usaremos un chocolate negro, aunque podemos emplear cualquier tipo que tengamos en casa. Lo mejor es optar por una pieza con poco azúcar para hacer este coulant mucho más saludable.. Ponemos el chocolate negro con la mantequilla en un cazo. Fundimos estos dos ingredientes que serán la base principal de este postre con alma. Cuando estén listos reservamos.. Continuamos con los huevos. Los ponemos con el azúcar y empezamos a batirlos. Para esta receta un azúcar glass le va muy bien, queda también perfecto con azúcar convencional, moreno o algún edulcorante.. Tamizamos la harina que irá directamente a completar esta fusión de sabores, los huevos y el azúcar. Tendremos la base de nuestro coulant.. Le añadimos el chocolate con la mantequilla. Le dará el sabor indispensable y el color a una masa que tendrá una sorpresa inesperada en su interior.. Preparamos los moldes para el horno, los engrasamos o forramos con papel de horno para que no se nos pegue la masa.. Vertemos un poco de masa y le añadimos unas cucharadas de mantequilla de cacahuete. Cubrimos con un poco más de chocolate.. Horneamos el coulant a 200º durante unos 11 minutos. Quedará hecho de fuera y dentro encontraremos la mantequilla fundida.. Presentamos el coulant con un poco de azúcar glass por encima. Podremos disfrutar de un postre fácil de preparar y con un contraste interior que sorprenderá. Atrévete a prepararlo, se tarda menos de 15 minutos y merece la pena."
Receta para una deliciosa tarta de galletas Oreo y queso (sin horno),2020-05-22 18:00:56+00:00,https://okdiario.com/recetas/receta-deliciosa-tarta-galletas-oreo-queso-sin-horno-5648122/,2 paquetes de Galletas Oreo. Galletas mini Oreo para decorar. 60 ml de leche. 60 gramos de mantequilla. 60 gramos de azúcar. 300 gramos de crema de queso. 200 ml de nata para montar. 5 hojas de gelatina sin sabor,"Comienza hidratando las hojas de gelatina, colocándolas en un recipiente con agua fría.. Mientras tanto, abre las galletas Oreo y raspa la crema con un cuchillo. Reserva la crema en un bol aparte y también reserva 4 galletas para agregar después.. En un recipiente amplio, tritura las galletas hasta lograr una arena fina, incorpora la mantequilla y amasa bien hasta lograr una pasta.. Vierte la mezcla de galletas y mantequilla en un molde, presionando bien contra el fondo, para compactar la masa. Puedes ayudarte con el dorso de una cuchara o con el fondo de un vaso de vidrio.. Coloca la fuente en el refrigerador mientras continúas preparando la receta.. Vierte el azúcar en un bol, agrega el queso y la crema que has reservado de las galletas.. Calienta la leche, disuelve en ella la gelatina y añade a la mezcla anterior, batiendo hasta obtener una crema.. Con unas varillas eléctricas, monta la crema y agrégala a la mezcla, revolviendo bien.. A continuación, agrega las galletas que has reservado, bien trituradas, y vuelve a mezclar..  Saca del refrigerador el molde con la masa de galletas y vierte encima la preparación..  Refrigera la tarta de Oreo y queso durante al menos 4 horas..  Al servir, decora el plato con unas mini Oreo, o ralla algunas galletas de chocolate por encima."
Receta de brownie de pomelo,2020-05-22 17:00:54+00:00,https://okdiario.com/recetas/receta-brownie-pomelo-5648035/,100 gr de harina de repostería. 100 gr de mantequilla a temperatura ambiente. 170 gr de azúcar. 2 huevos. Zumo de 1 pomelo. Ralladura de 1 pomelo. 100 gr de azúcar glas. Zumo de 1 limón,"Precalentar el horno a temperatura media (180°).. Batir la mantequilla con el azúcar hasta integrar bien.. Agregar los huevos de uno a uno, batiendo cada vez.. Incorporar la ralladura y el zumo de pomelo.. Agregar la harina de a poco, con movimientos envolventes.. Engrasar y enharinar un molde rectangular. Si se desea, cubrirlo con un rectángulo de papel para horno.. Verter la mezcla en el molde y hornear durante 30 minutos.. Para comprobar que esté bien cocido, pinchar con un palillo en el centro. debe salir seco y limpio.. Retirar del horno y dejar enfriar.. Preparar un glasé mezclando el azúcar glas con el zumo de limón, hasta que quede una pasta blanca y espesa.. Desmoldar el brownie de pomelo, cubrirlo con el glasé y dejar que termine de enfriar. cortar en cuadrados y servir."
Receta fácil de liebre en escabeche,2020-05-22 16:00:05+00:00,https://okdiario.com/recetas/receta-facil-liebre-escabeche-5647958/,2 kilos de liebre. 2 cebollas grandes. Medio pimiento rojo. 5 dientes de ajo. Dos hojas de laurel. ½ cucharada de tomillo. 300 mililitros de vinagre de vino. 300 mililitros de Aceite de oliva. Romero. Pimienta. Sal. 1 guindilla,"Limpiar la liebre retirando las tripas y la piel. Reservar la sangre en un recipiente.. Picar la liebre en pedazos de tamaño mediano.. Pelar y cortar la cebolla en juliana.. Calentar una cazuela con el aceite y añadir la liebre, la cebolla, el ajo y el pimiento.. Agregar a la cazuela con la liebre el romero, el laurel y la guindilla. Dejar sofreír unos minutos.. Incorporar el vinagre y mantener la cocción a fuego moderado.. Cocinar durante una hora o hasta que la liebre termine de ablandar y se rebaje el vinagre.. Poner el conjunto a punto de sal.. Dejar enfriar la carne durante unos 15 minutos antes de meter en la nevera."
Receta de bizcocho Kinder Delice saludable,2020-05-22 15:00:55+00:00,https://okdiario.com/recetas/receta-bizcocho-kinder-delice-saludable-5647664/,80 gr de harina de avena. 80 gr de harina de almendras. 2 cucharadas soperas de aceite de coco. 40 gr de cacao puro desgrasado. 100 gr de azúcar de coco. 5 gr de levadura en polvo. 5 gr de bicarbonato. 5 gr de sal. 1 cucharadita de esencia de vainilla. 210 ml de ‘buttermilk’,"Podemos empezar esta receta haciendo la buttermilk, que no nos asuste la palabra, porque es muy fácil de preparar.. En un cazo ponemos la leche vegetal con una cucharada de vinagre de manzana. Dejamos que repose unos 10 minutos.. Para hacer la masa de los bizcochos, ponemos en un bol los dos tipos de harinas. En este caso de almendra y avena que le darán la textura necesaria a este dulce.. Le añadiremos la levadura y el bicarbonato que serán los encargados de conseguir que suba la masa. Mezclamos también con el cacao puro.. En este tipo de bizcochos se ponen primero los ingredientes sólidos para que queden perfectamente fusionados.. Nos faltará el azúcar de coco que también le dará un punto extra de dulzor. Con esta base lista le daremos el punto líquido.. Ponemos la esencia de vainilla y el aceite de coco. Crearemos una masa vegana de textura suave que se transformará en los bizcochos de este kínder.. Preparamos una fuente para horno, cubrimos de papel de horno. Vertemos la masa y horneamos a 180º durante unos 15 minutos.. Tendremos listos los bizcochos, solo deberemos cortarlos por la mitad cuando estén fríos. Ponemos leche de coco, vainilla y sirope al gusto. Batimos y rellenamos con esta mezcla los bizcochos.. Mezclamos chocolate de cobertura con leche. Este elemento será el que cubra el Kinder Delice y le aporte ese sabor especial que hará que tengamos listo un postre que impresionará a más de uno. Atrévete a crear este dulce vegano y saludable."
Receta de patatas de cristal,2020-05-22 13:00:34+00:00,https://okdiario.com/recetas/receta-patatas-cristal-5647497/,Patatas agrias. Patatas monalisa. Longaniza o chorizo. Aceite de Oliva. Sal. Pimienta,"Estas patatas se pueden cocinar de una y mil maneras distintas, su grandeza es que deben quedar lo más crujientes posibles para poder disfrutarlas por todo lo alto. La variedad que se suele usar es una agrias, sin casi piel y de textura suave.. Nos ponemos manos a la obra con las patatas, las pelamos y cortamos lo más finas posibles. Podemos darles forma de rectángulo para que sean más fáciles de preparar.. Ponemos estos trocitos en agua fría y en la nevera durante un par de horas, este truco nos ayudará a potenciar su textura crujiente y sabor.. Secamos las patatas bien con papel de cocina. Las ponemos en el horno con papel de horno para que no se peguen y un poco de presión encima para que queden más finas.. Estarán unas 2 horas a 100º hasta que queden perfectas. Comprobamos que están cocinadas y muy crujientes, esta textura es la que buscamos en este plato.. Con las patatas mona lisa podemos hacer un puré para completar la receta. Las lavamos y las cortamos en trocitos. Hervimos con abundante agua y sal durante unos minutos.. Trituramos las patatas y les añadimos el caldo de su cocción para que queden más ligeras. Además de las patatas, les podemos poner un poco de longaniza o chorizo.. Cocinamos la longaniza y el chorizo, añadimos esta delicia a las patatas y servimos con estilo. Tendremos listas unas patatas de cristal de lo más apetecibles."
