title,intro,order,votes,comensales,duración,para,dificultad,coste,types,ingredientes,url
Espuma de limón,"Te ofrecemos un postre muy sencillo y fresco, una espuma de limón. Una elaboración que se prepara con pocos ingredientes y que estará listo en poco tiempo. Asimismo, los postres con cítricos son muy buenos y refrescantes, ideales para comerlos después de una buena comida para toda la familia. También puedes hacer la crema con otras frutas, como naranja o añadir frutas mezcladas. Además, si quieres hacer el postre más festivo, añade galleta molida por encima de la crema o incorpora en la base del vaso. También puedes tostar almendra en trocitos o añadir caramelo líquido.Asimismo, en ReccetasGratis te enseñamos cómo hacer espuma de limón. ¡A comer!","['1\nPara preparar la receta de espuma de limón, primero debes poner todos los ingredientes en la nevera. Deben estar bien fríos, unos 15 minutos antes de utilizarlos puedes meterlos en el congelador. A continuación, añade en un bol la leche evaporada bien fría. También puedes introducir el bol un rato en la nevera.', '2\nCon unas varillas bate la leche evaporada hasta que esté montada. Luego, incorpora la leche condensada y sigue batiendo hasta que quede montada todo montado y la leche condensada esté bien incorporada.', '3\nExprime medio limón y añade al bol junto con la espuma. A continuación, bate para mezclar el limón, enseguida espesará más la crema. Luego, prueba la espuma o mousse de limón y, si te gusta con más sabor a limón, añade más cantidad de zumo, también puedes añadir ralladura de limón.', '4\nCuando tengas la crema montada, puedes introducir en la nevera.', '5\nAñade la espuma de limón con leche evaporada en vasos o tazas para servirla. A continuación, introduce los vasos con la crema unos 15 minutos antes de servirla para que se mantenga firme la espuma. Para que quede buena la crema debe estar como mínimo 2 horas en la nevera.', '6\nA la hora de servir la espumilla de limón, acompaña con frutas como fresas, arándanos, frutas del bosque, mermeladas o galletas trituradas. También puedes acompañar con caramelo líquido e ir formando capas de galletas. Te quedará un postre genial y muy bueno. ¡A comer! Cuéntanos en los comentarios tu opinión y comparte con nosotros una fotografía del resultado final.']",,4 comensales,15m,,Dificultad baja,,[],"['200 mililitros de leche evaporada', '200 mililitros de leche condensada', '1 unidad de limón', 'Para acompañar', 'galletas', 'arándanos, fresas...']",https://www.recetasgratis.net/receta-de-espuma-de-limon-76443.html
Bocaditos de dulce de leche,"El dulce de leche es uno de los productos que más enorgullecen como argentinos. Su origen se dio de forma accidental, cuando la cocinera de uno de nuestros próceres olvidó leche en el fuego. Al volver a la cocina, la misma se había caramelizado, dando como resultado un producto cremoso dulce y delicioso. Hoy en día está distribuido en nuestra gastronomía formando parte de diversos platos de la pastelería y repostería. Asimismo, en esta oportunidad, queremos enseñarte a preparar unos sencillos, pero no por ello menos ricos, bocaditos dulces para un cumpleaños o para cualquier ocasión. Se trata de una preparación que podrás preparar con los más chicos de la casa, ideal para preparar para el próximo cumpleaños o reunión con familia o amigos. Puedes probar distintas alternativas para encontrar la preferida para ti.En RecetasGratis te enseñamos cómo hacer bocaditos de dulce de leche. ¡Vamos allá!","['1\nPara empezar a preparar los bocaditos de dulce de leche, en un recipiente mezcla la avena con el dulce de leche. Intégralos con una espátula, una cuchara o con tus manos.', '2\nCuando estén integrados, humedece tus manos para tomar una cucharada de la preparación y darle forma de pelotita o trufa. Puedes dejarlas al desnudo o rebozarlas con coco rallado, chispas de colores o cacao dulce. Como verás, es una preparación muy sencilla que puedes hacer con los más chicos de la casa, recuerda que hacer los participar de la cocina es una actividad que fomenta la interacción familiar, la motricidad fina y su interés por su alimentación.', '3\nCuando tengas todos tus bocaditos de dulce de leche listos, llévalos a la heladera por, al menos, 1 hora para que tomen más cuerpo.', '4\nPasado el tiempo, ya podrás disfrutar de tus bocaditos de dulce de leche. ¿Qué te pareció esta preparación? Cuéntanos en los comentarios tu opinión y comparte con nosotros una fotografía del resultado final.']",Valoración: 5 (1 voto),4 comensales,15m,Postre,Dificultad muy baja,,"['Recomendada para vegetarianos', 'Recetas argentinas']","['100 gramos de dulce de leche repostero', '100 gramos de avena', 'cacao dulce', 'coco rallado', 'chispas de colores']",https://www.recetasgratis.net/receta-de-bocaditos-de-dulce-de-leche-76426.html
Torta Oreo y dulce de leche,"Las galletitas oreo son de las más famosas a nivel mundial. Se trata de unas galletitas estilo alfajor o sándwich compuestas por dos tapitas de chocolate con un relleno sabor vainilla. Actualmente, su consumo no se limita al desayuno o merienda acompañadas con un vaso de leche, sino que existe una gran variedad de preparaciones: helados, golosinas, malteadas, tortas, trufas, brownies, arrollados y muchas más. Asimismo, en esta oportunidad, queremos mostrarte cómo preparar una torta de Oreo y dulce de leche combinando estas galletitas con el manjar argentino. Verás que se trata de una preparación sencilla y sin horno.En RecetasGratis te enseñamos cómo hacer torta de Oreo y dulce de leche. ¡A cocinar!","['1\nEl primer paso para la preparación de la torta de oreo y dulce de leche es abrir las galletitas para separar, por un lado, la crema y, por otro, las tapitas de chocolate.\nTruco: reserva algunas galletitas para decorar la torta al final de la receta.', '2\nTritura las tapas de las galletitas hasta obtener una consistencia tamaño arena. Luego, mézclalas con la manteca blanda.\nTruco: si no tienes procesadora, puedes disponer las tapitas en una bolsa y aplastarlas con ayuda de un palo de amasar.', '3\nA continuación, lleva las galletitas húmedas mezcladas con la manteca al molde donde desees armar tu torta Oreo y dulce de leche. Con ayuda de una cuchara o tus manos, distribuye de forma pareja las galletitas y haz algo de presión para que se asienten.\nTruco: recomendamos que el mismo esté cubierto con papel film para facilitar su desmolde. Puedes rociar el molde con aceite en aerosol o manteca para que el film se adhiera mejor a él.', '4\nTapa la masa de tu torta y llévala a la heladera mínimo 2 horas. De esta forma, tomará cuerpo y podrás rellenarla sin que se desarme.\nTruco: si lo deseas, podrías cocinar unos 10 minutos la masa de tu torta en un horno precalentado a 180 ºC y solo dejarla enfriar antes de continuar con el siguiente paso. Asegúrate de no usar film en este caso.', '5\nUna vez que la masa de tu torta esté fría, rellénala con el dulce de leche. Recomendamos agregues una parte como base y luego, decores con ayuda de una manga los bordes. Llévala al frío nuevamente.', '6\nPor último, bate la crema de leche fría hasta que monte. En punto, agrega el relleno de las galletitas oreos que habías reservado en el primer paso. Bate solo para integrarlas o se cortará.', '7\nRetira la torta de la heladera y desmóldala para disponerla en el plato donde quieras presentarla. Decora a gusto con unas galletitas rotas y otras partidas a la mitad. Recomendamos que la enfríes bien antes de servirla.', '8\nAsí tendrás lista tu torta Oreo con dulce de leche. ¿Qué te ha parecido esta receta? Cuéntanos en los comentarios tu opinión.']",,6 comensales,2h 30m,Postre,Dificultad baja,,"['Recomendada para vegetarianos', 'Receta sin lactosa']","['4 paquetes de galletitas Oreo', '80 gramos de manteca', '400 gramos de dulce de leche repostero', '150 centímetros cúbicos de crema de leche', '1 cucharada postre de esencia de vainilla']",https://www.recetasgratis.net/receta-de-torta-oreo-y-dulce-de-leche-76436.html
Marquise de frutos rojos,"Una de las combinaciones más exitosas en repostería es la del chocolate con los frutos rojos. Además, particularmente, esta torta es un 100. La dulzura y cremosidad de su base, sumada al sabor levemente ácido de las frutillas, arándanos y cerezas, conquistarán a todos los paladares. Por otra parte, se trata de un postre ideal para personas con intolerancia al gluten, puesto que no lleva harina en su elaboración.Anímate y aprende en RecetasGratis cómo hacer marquise de frutos rojos.¡Vamos a cocinar!","['1\nPara cocinar la base de esta torta, utiliza un molde desmontable de 24 cm de diámetro que debes acondicionar de la siguiente manera: primero unta con aceite la base y los bordes. Luego cubre la base con papel manteca y vuelve a untar (puedes rociar con rocío vegetal). Luego, enciende el horno para precalentar a 160°C.', '2\nSepara las yemas y las claras de los huevos en distintos recipientes. Reserva.', '3\nFunde la manteca y el chocolate. Puedes hacerlo al baño María o en el microondas. Luego, integra ambos ingredientes.\nTruco: si bien puedes derretir todo junto, nosotros preferimos hacerlo por separado y luego mezclarlos, para respetar las temperaturas de fundición de cada uno.', '4\nCuando el chocolate y la manteca hayan bajado un poco la temperatura, intégralos con las yemas. Reserva.', '5\nBate las claras de los huevos hasta que dupliquen su volumen. En ese punto, incorporar el azúcar en forma de lluvia mientras continúas batiendo hasta formar un merengue firme.', '6\nVierte un par de cucharadas de merengue a la preparación de yemas, manteca y chocolate. Integra con espátula realizando movimientos lentos y envolventes. Una vez integrado, continúa agregando el resto del merengue. Puedes hacerlo en una o dos veces más. Lo importante es que lo hagas con suavidad y de manera envolvente para conservar todo el aire que sumaron las claras durante el batido.', '7\nVierte la preparación en el molde y lleva a horno precalentado a 160 °C durante 35 minutos.', '8\nVerifica la cocción de la base de la marquise de frutos rojos, pinchando con un palillo. Si este sale limpio, ya puedes retirar del horno. Deja enfriar a temperatura ambiente y luego lleva un ratito a la heladera antes de desmoldar.\nTruco: en cuanto saques la masa del horno, notarás que se baja mucho. No te asustes, esto es perfectamente normal.', '9\nMientras tanto, lava las frutas, reserva algunas para decorar y al resto retírales los cabitos, hojas o semillas. Colócalas en un recipiente y déjalas macerar con el azúcar, la miel y ralladura de piel de naranja. Conserva en la heladera.', '10\nColoca en un bol la crema de leche junto con el azúcar impalpable y la esencia de vainilla. Bate hasta que esté firme. Reserva en la heladera.', '11\nSolo resta armar la marquise de frutillas. Desmolda la base sobre una fuente. Retira con mucho cuidado el papel manteca. Ten en cuenta que es una masa muy tierna.\nTruco: te recomendamos tener todo listo y armar la torta cuando vayas a consumirla, así se mantienen firmes todas las capas. Si tuvieras que armarla antes, lleva inmediatamente a la heladera hasta el momento de comerla.', '12\nCubre la superficie con el dulce de leche.', '13\nA continuación, coloca la crema chantilly.', '14\nPor último, esparce las frutas maceradas y decora con algunas frutas enteras por arriba o al costado de la fuente.', '15\nLa marquise con frutos rojos está lista. Sin duda, el resultado enamora a primera vista. Y cuando la pruebes, querrás comer otra porción. Así que no esperes más ¡A comer! Comparte con nosotros tus fotos y opinión en comentarios.']",,8 comensales,2h 30m,Postre,Dificultad baja,,"['Recomendada para vegetarianos', 'Receta sin gluten', 'Receta sin sal', 'Recetas al horno']","['180 gramos de chocolate amargo', '130 gramos de manteca', '90 gramos de azúcar', '4 huevos', '350 gramos de crema de leche', '35 gramos de azúcar impalpable (¼ taza)', '1 cucharadita de esencia de vainilla', '150 gramos de dulce de leche', '500 gramos de frutos rojos a elección', '2 cucharadas soperas de azúcar', '1 cucharada sopera de miel', 'ralladura de naranja']",https://www.recetasgratis.net/receta-de-marquise-de-frutos-rojos-76394.html
Tarta de duraznos con gelatina,"El verano invita a realizar preparaciones frescas y frutales. Es por eso que las tartas de frutas, son el postre ideal para esta época del año. Hoy vamos a enseñarte a realizar una tarta con base de masa crocante y tierna a la vez, rellena de duraznos frescos y cubierta con gelatina. Sin dudas, podrás disfrutarla y repetirla muchas veces, incluso utilizando otras frutas o rellenos, como te contaremos al finalizar el paso a paso.En RecetasGratis, te enseñamos cómo hacer tarta de duraznos con gelatina. ¡Vamos a cocinar!","['1\nEl primer paso para realizar la tarta de duraznos con gelatina, es realizar la masa. Para ello, coloca en un bol la manteca pomada junto con el azúcar, la esencia de vainilla y la ralladura de limón. Bate hasta obtener una preparación cremosa. Luego incorpora el huevo y vuelve a batir.', '2\nA continuación, tamiza la harina junto con el polvo para hornear y únelo a la preparación anterior utilizando una espátula.', '3\nColoca la masa sobre un papel film y aplasta con la mano sin amasar. Luego cubre con otro film y estira con palote hasta unos 3 mm de espesor.Coloca todo sobre una placa y lleva a la heladera sobre una placa por al menos 2 horas hasta que esté bien dura (incluso puedes dejarlo de un día para el otro)', '4\nUna vez que la masa se haya enfriado lo suficiente, precalienta el horno a 170°C y forra el molde. Corta un círculo de la medida de la base de la tartera desmontable de 15 cm de diámetro y con el excedente corta tiras del alto de la misma. Presiona un poco con los dedos en todas las uniones para unificar y cubrir todo el molde. Verás que es una masa bastante quebradiza, pero se une muy fácil, por lo que no te hagas problema si se rompe ya que lo podrás arreglar sencillamente.', '5\nCubre la masa con papel de aluminio y material de carga (porotos, arroz, piedritas) para evitar que se levante demasiado y hornea por 20 o 25 minutos, hasta que esté apenas dorada. Retira del horno y deja enfriar sin desmoldar.', '6\nPara el relleno de la tarta de duraznos frescos, pela los duraznos y córtalos en rodajas. Reserva.', '7\nLuego, prepara la gelatina diluyendo el polvo con 125 cc de agua hirviendo. Luego agrega 125 cc de agua fría, mezcla y guarda en la heladera para que tome algo de consistencia, pero sin que solidifique por completo.', '8\nColoca en un bol la crema de leche, junto con el azúcar y la esencia de vainilla. Bate con batidora eléctrica hasta que esté firme.', '9\nPara armar la tarta de durazno y crema, retira del molde la masa ya cocida y fría y ubícala en una fuente de presentación. Rellena primero con la crema batida. Luego distribuye las rodajas de durazno en forma de espiral. Por último, cubre con la gelatina y lleva a la heladera para que la gelatina endurezca.', '10\nLa tarta de durazno con gelatina, ya está lista para disfrutar. ¡A comer! Comparte con nosotros tus fotos y opinión en comentarios.']",,6 comensales,6h,,Dificultad baja,,"['Recomendada para vegetarianos', 'Receta sin sal', 'Recetas al horno']","['50 gramos de manteca pomada', '35 gramos de azúcar', '100 gramos de harina 0000', '½ cucharada postre de polvo para hornear', '1 yema de huevo', '1 cucharadita de esencia de vanilla', '200 centímetros cúbicos de crema de leche', '1 cucharada sopera de azúcar impalpable', '1 cucharadita de esencia de vainilla', '10 gramos de gelatina sabor durazno', '3 duraznos']",https://www.recetasgratis.net/receta-de-tarta-de-duraznos-con-gelatina-76391.html
Arroz con leche de coco y mango,"El arroz con leche es un postre clásico de la gastronomía española. Actualmente, existen muchas versiones sobre esta versión igual de ricas y algunas más refrescantes, como en este caso, con este delicioso arroz con leche de coco y mango. Además, elaborarlo en casa es muy fácil y apto para todos, pues lo pueden tomar tanto los intolerantes a la lactosa como los veganos o los vegetarianos, al no contener ningún ingrediente de origen animal. Si no lo has probado antes, anímate a hacerlo, verás qué delicia de postre podrás preparar en casa de sabor único.En RecetasGratis te enseñamos cómo hacer arroz con leche de coco y mango de manera fácil y sencilla. ¡A cocinar!","['1\nPara preparar un delicioso arroz con leche de coco y mango, coloca los 750 g de leche de coco en un cazo junto con la ramita de canela y la piel de limón. Pon al fuego y deja que hierva a fuego suave.\nTruco: corta la piel de limón con un cortador de verduras para conseguir una piel fina y con la menor parte blanca que es la que amarga.', '2\nCuando hierva la leche de coco, añade el arroz y deja cocer a fuego suave durante unos 30-40 minutos hasta que el arroz esté blandito pero quede aún con líquido.', '3\nAgrega el azúcar y remueve.', '4\nAbre la lata de leche de coco y remueve si tiene parte sólida. A continuación, incorpora la leche de coco al arroz con leche y remueve unos 5 o 10 minutos más hasta que el arroz quede cremoso. No lo dejes seco, pues una vez enfría tiende a embeber y quedará más rico cremoso. Deja entibiar.', '5\nMientras prepara el mango. Pélalo y corta la mitad en dados y tritura la otra mitad con unas varillas eléctricas hasta hacerlo puré.', '6\nReparte el puré de mango en cuatro vasitos.', '7\nSeguidamente, retira del arroz con leche de coco la canela y la piel de limón y reparte en los vasitos encima del puré de mango. Por último, decora con los daditos de mango.', '8\nReserva los vasitos de arroz con leche de coco y mango en la nevera hasta el momento de servir. Verás qué ricos están. ¡Anímate a hacerlos en casa y cuéntanos qué te ha parecido la receta!Espero que te hayan gustado este arroz con leche de coco y mango y te invito a que visites mi blog Cakes para ti.']",,4 comensales,45m,Postre,Dificultad baja,,"['Recomendada para veganos', 'Recomendada para vegetarianos', 'Receta sin lactosa', 'Receta sin gluten', 'Recetas españolas']","['750 mililitros de bebida de leche de coco', '1 rama de canela', '1 limón', '125 gramos de arroz redondo', '200 gramos de azúcar (1 taza)', '1 lata de leche de coco (400 g)', '1 mango de buen tamaño']",https://www.recetasgratis.net/receta-de-arroz-con-leche-de-coco-y-mango-76334.html
Alfajores santiagueños,"El alfajor santiagueño puede parecerse a simple vista a la conocida torta Rogel. Sin embargo, algunos detalles lo diferencian de este clásico de la pastelería. Por ejemplo, un ingrediente estrella utilizado en la preparación de la masa. Se trata del anís. Puedes usar sus semillas o bien infusionar la estrella en el agua que utilizas para prepararla. También se diferencia de otros alfajores argentinas porque no está compuesto por dos capas y un relleno, sino varias capas crocantes y mucho dulce de leche, bien argentino. En lugar de utilizar chocolate o glasé para su cobertura, disfrutamos de un delicioso merengue italiano. Durante este año 2022, la provincia de Santiago del Estero, cumplió 469 años. En su honor, los maestros pasteleros de esta provincia elaboraron el alfajor santiagueño más grande de la historia, el cual pesaba unos 1.300 kilos. Para su preparación, usaron aproximadamente 50 bolsas de harina y alrededor de 900 kilos de dulce de leche.Si deseas aprender cómo hacer alfajores santiagueños, quédate leyendo en RecetasGratis. ¡A cocinar!","['1\nPara empezar con la preparación del alfajor santiagueño, mezcla la harina con la pizca de sal y llévala a una mesada limpia. Haz un hueco en el centro para agregar allí las yemas de los huevos, el aceite, casi toda el agua y las semillas de anís. Si no tienes semillas, puedes infusionar el agua con una estrella. Reserva las claras para hacer el merengue más adelante.', '2\nComienza a integrar los ingredientes del centro hacia afuera, para formar una masa. De ser necesario, agrega el resto del agua, humedeciendo tus manos antes de seguir amasando. De esta forma, agregarás la humedad de forma progresiva.', '3\nDivide la masa en 6 bollos de igual tamaño y déjala descansar tapada por unos 20 minutos. De esta forma, será más fácil estirarla.', '4\nPasado ese tiempo, enciende el horno a 180 ºC y comienza a estirar los bollos. Lleva cada disco a una asadera, la cual no necesita estar engrasada, y pínchalo con un tenedor para que no se englobe demasiado en el horno.', '5\nCocina cada disco de tu alfajor santiagueño por unos 10 a 12 minutos, girándolo cuando se dore de uno de los lados. Resérvalos en una rejilla para que se enfríen sin humedecerse.', '6\nAcomoda los discos de tu alfajor santiagueño de forma tal que queden bien encastrados entre sí. Cuando hayas armado esta pila, unta cada disco con dulce de leche repostero, dejando la última capa sin untar. Resérvalo', '7\nPor otro lado, prepara el merengue para tu alfajor santiagueño. Para ello, debes calentar a fuego medio el azúcar con suficiente agua como para que apenas la tape. Agrega cucharadas de a poco en la misma hornalla para que no tengas que moverlo y tocar con el azúcar los bordes de la olla o podría caramelizarse. El almíbar debe alcanzar los 118 ºC.', '8\nComienza a batir las claras que habías reservado anteriormente apenas pones el azúcar a calentar con el agua.', '9\nCuando tengas el almíbar listo, agrégalo a las claras en forma de hilo y sobre el borde del recipiente mientras continúas batiendo', '10\nDeberás batir hasta que el merengue esté frío, sostenido y brillante, como ves en la imagen', '11\nCubre tu alfajor santiagueño con el merengue italiano y llévalo a la heladera para que esté más contenido a la hora de servir.', '12\nPuedes decorar tu alfajor con picos o cubriéndolo por completo, como haz visto en la imagen principal de esta receta. Cuéntanos qué opinas de este alfajor y, si lo pruebas, no dudes compartir la foto del resultado final, ¡nos encantaría verla!']",,12 comensales,1h 30m,Postre,Dificultad media,,"['Recomendada para vegetarianos', 'Receta sin lactosa', 'Recetas al horno', 'Recetas argentinas']","['2 huevos', '300 gramos de harina', '120 centímetros cúbicos de agua', '50 centímetros cúbicos de aceite', '1 cucharada postre de anís o 1 estrella', '300 gramos de dulce de leche repostero', '1 pizca de sal', '1 cucharada postre de alcohol etílico', '120 gramos de azúcar']",https://www.recetasgratis.net/receta-de-alfajores-santiaguenos-76388.html
"Bizcocho de calabaza, nueces y chocolate","El pastel de calabaza y chocolate es una deliciosa combinación, con un resultado delicioso y suave. Este bizcocho es una especie de flan con calabaza. Asimismo, tiene una textura cremosa que contrasta con la base de chocolate. Por su lado, la calabaza encaja a la perfección, ya que aporta un dulzor y una textura cremosa. Es por ello, que es perfecta para postres y cremas.En RecetasGratis te enseñamos cómo hacer un bizcocho de calabaza, nueces y chocolate. ¡Manos a la obra!","['1\nPara empezar con esta receta, primero debes precalentar el horno a 180 ºC con calor arriba y abajo. Luego, debes pelar la calabaza, quitando los hilos y cortándola en trozos. Seguidamente, pon los trozos a cocer en un cazo con un poco de agua y déjalos hasta que se cuezan, ya que luego los usaremos para hacer puré. Cuando estén cocidos, los escurrimos muy bien y los reservamos.\nTruco: también se puede asar la calabaza al horno, así cogerá menos agua.', '2\nEn un bol pon la calabaza con la nata y lo trituramos bien hasta que quede una masa lisa, sin grumos ni trozos.', '3\nSeguidamente, en otro bol debes poner los huevos con el azúcar y batirlo muy bien hasta que aumente su volumen.', '4\nA continuación, debes ir añadiendo a la masa de la calabaza un poco de la mezcla de los huevos y mezclarlo bien para que quede integrada la mezcla. Debes seguir haciendo este paso hasta que quede todo bien mezclado.\nTruco: si lo deseas, puedes añadir nueces, aunque este paso completamente opcional, pero las nueces le darán un toque diferente al bizcocho.', '5\nCuando esté todo bien mezclado, prepara un molde cuadrado de 20x20 cm, debes untar con un poco de mantequilla en el molde y forrarlo con papel vegetal para horno. Ahora, incorpora toda la masa en el molde y mételo en el horno a 180 ºC durante 30 minutos o hasta que al pinchar con un palillo este salga seco.', '6\nCuando veamos que está listo lo sacamos y dejamos enfriar a temperatura ambiente.', '7\nAhora, es el momento de preparar la cobertura de chocolate. En un bol debes poner el chocolate troceado con la mantequilla y la leche. A continuación, mételo en el microondas a 600 W unos 30 segundos, debes removerlo y volver a meter otros 30 segundos, así hasta que el chocolate esté derretido.\nTruco: ve con cuidado, ya que el chocolate se quema con facilidad.', '8\nA continuación, cubre con la cobertura de chocolate el bizcocho de calabaza con nueces y ponlo en la nevera unas horas.', '9\nPor último, cuando esté frío el bizcocho de calabaza y cacao, debes desmoldarlo y, ¡ya puedes servirlo a tus invitados! Esta tarta la puedes preparar un día antes, ya que durante ese tiempo cogerá mejor los sabores.']",,6 comensales,45m,,Dificultad baja,,[],"['500 gramos de calabaza', '3 trozos de huevos', '150 mililitros de nata de cocina o crema de leche', '150 gramos de azúcar (¾ taza)', '1 pizca de nueces (opcional)', '1 cucharada sopera de mantequilla', '3 cucharadas soperas de leche', '100 gramos de chocolate de fundir']",https://www.recetasgratis.net/receta-de-bizcocho-de-calabaza-nueces-y-chocolate-76281.html
