title,intro,order,votes,comensales,duración,para,dificultad,coste,types,ingredientes,url
Picarones peruanos,"Los picarones dulces son unos de los postres más tradicionales de la cultura peruana, populares desde el tiempo del Virreinato. Durante esta época, las pregoneras, con su pícaro cantar llamaban a las 2 de la tarde al público para vender estos buñuelos que posteriormente los llamaron “picarones”. Un postre peruano que combina a la perfección una masa caliente-crocante por fuera y suave por dentro, bañados de unamiel especiada y afrutada.Asimismo, en RecetasGratis queremos enseñarte cómo hacer picarones peruanos.","['1\nPrimero empezamos elaborando la miel. Para ello, en una olla alta coloca la chancaca o panela, azúcar, agua, especias, naranjas cortadas en gajos medianos y las hojas de higo. Lleva a fuego medio y hierve hasta que la chancaca se haya derretido por completo. Para este momento, esta miel, aún liquida, ya debe estar muy bien aromatizada y saborizada, así que pasa a colar.', '2\nDespués de retirar las cáscaras de naranja y las especias, vuelve a poner la miel a fuego medio bajo y mantenla hirviendo hasta que la miel adquiera un poco más de consistencia, este paso te tomará alrededor de media hora. Revuelve la miel de vez en cuando para que no rebalse.', '3\nCuando notes que la miel se vea un poco más espesa, introduce un termómetro hasta alcanzar los 95°C. Si no cuentas con un termómetro, separa un poco de miel y viértela sobre un plato frío, déjala enfriar y podrás ver la consistencia final de la miel. Recuerda que cuando la miel se enfría se vuelve mucho más densa.', '4\n¿Te preguntas cómo preparar picarones fáciles? Pues bien, empieza pelando y picando el zapallo y el camote en trozos medianos. Luego, colócalos en dos ollas medianas por separado, cubre con agua y aromatiza cada una con los clavos de olor y las ramas de canela. Lleva ambos insumos a sancochar hasta que estén tiernos y asegúrate de que estén bien suaves pinchándolos con un palillo.', '5\nContinúa colándolos y reserva el agua de cocción. Retira las especias y aplástalos inmediatamente para tener un puré, puedes tamizarlos para separar cualquier tipo de fibra y obtener un puré muy sedoso.', '6\nAparte, activa la levadura seca, es decir, hidrata la levadura con 50 mililitros de agua tibia de camote o zapallo, mezcla bien y deja reposar por 10 minutos.', '7\nPara hacer la masa, en el bowl de la batidora, vierte el puré de camote y zapallo, la levadura activada y los huevos, mezcla bien con el accesorio de paleta. Añade el azúcar, la harina y el anís tostado, sigue batiendo hasta obtener una masa homogénea y antes de amasar, vierte 100 mililitros del agua tibia de camote o zapallo o dependiendo de la humedad de la masa.', '8\nComienza a amasar a máxima velocidad por 15 minutos. Cumplido el tiempo, notarás que la masa está muy suave, pegajosa y muy elástica. Cubre con papel film o un pañuelo húmedo y deja reposar en la zona más caliente de tu casa por 1 hora.\nTruco: si no cuentas con un ambiente caliente con una temperatura propicia para leudar la masa, puedes calentar el horno a temperatura mínima e introducir el bowl hasta que duplique su volumen.', '9\nCuando la masa haya duplicado su volumen, prepara una olla con abundante aceite y lleva a fuego alto. Cuando el aceite esté caliente, humedécete las manos, separa un poco de la masa de picarones, rompe el centro y dale forma de dona a esta masita. Ve estirando esta dona y colócala cuidadosamente en el aceite caliente sin que pierda su forma circular.', '10\nInmediatamente inserta un palo de madera en el orificio del picaron y gíralo rápidamente mientras el aceite burbujea. Cuando el aceite deje de burbujear, dale la vuelta y deja que tome un color dorado ligeramente oscuro por ambos lados.', '11\nRetira del aceite, colócalo sobre una rejilla para que escurra el exceso de aceite y sigue friendo el resto de la masa.', '12\nFinalmente, sirve los mejores picarones peruanos cuando estén fritos y no olvides echarles una generosa cantidad de miel para endulzarlos. ¡Buen provecho! Cuéntanos en los comentarios tu opinión y comparte con nosotros una fotografía del resultado final.']",,10 comensales,3h,Postre,Dificultad media,,"['Receta sin lactosa', 'Recetas peruanas']","['1½ naranja', '250 gramos de azúcar morena', '150 gramos de chancaca o panela', '250 gramos de agua', '1 rama de canela', '6 sobres de clavo de olor', '2 hojas de higo', '500 gramos de harina', '300 gramos de zapallo', '300 gramos de camote', '60 gramos de huevo', '16 gramos de levadura seca', '12 gramos de azúcar', '2 ramas de canela', '6 sobres de clavo de olor', '1 gramo de anís tostado', 'aceite para freír']",https://www.recetasgratis.net/receta-de-picarones-peruanos-76466.html
Mazamorra con arroz con leche,"La mazamorra morada con arroz con leche es la combinación de los dos dulces de cuchara más tradicionales que, para los peruanos, se ha convertido en un “clásico”, así como Alianza Lima versus Universitario de Deportes, el clásico enfrentamiento entre los dos equipos de fútbol más importantes del país. No es casualidad que este postre le hace alusión, ya que sus colores crema y morado son los colores distintivos de estos equipos.En RecetasGratis queremos enseñarte cómo hacer mazamorra con arroz con leche peruano, un combinado que crea una perfecta sinergia entre el arroz con leche de herencia hispánica y la mazamorra morada de herencia incaica.","['1\nPara la receta de mazamorra empieza desgranando las mazorcas de maíz morado, ponlas a hervir (los granos y las corontas) en una olla grande y cubre hasta llegar al tope con agua (aproximadamente 4 litros). También aromatiza con cáscaras de piña, ramas de canela, clavos de olor y anís estrella. Deja hervir a fuego medio por 1 hora y cuélalo.', '2\nCuando tengas la esencia de maíz morado, agrega el azúcar, damascos, orejones, guindas y la fruta fresca picada que son la manzana, piña y membrillo. Dejar hervir por otros 10 minutos.', '3\nDespués de 10 minutos, exprime el jugo de los limones dentro de la olla y añade los guindones.', '4\nAparte, en un tazón pequeño, disuelve la harina de chuño o camote con un chorro de agua fría y vierte en la olla de chicha morada.', '5\nRemueve inmediatamente para evitar grumos y mantén en fuego hasta espesar. Reserva.', '6\nPara el arroz con leche, en una olla pon el arroz, las ramas de canela, los clavos de olor y si deseas las cáscaras de naranja, pero retírales la parte blanca que da amargor. Cubre con medio litro de agua, tapa y cocina hasta que el arroz esté graneado (tardará unos 20 minutos). Revuelve cada 5 minutos para asegurarte que tenga suficiente cantidad de agua.', '7\nCuando los granos de arroz estén blandos, incorpora la leche evaporada, la leche condensada y el azúcar, puedes aromatizar con un toque de vainilla. Para finalizar con todos los ingredientes, agrega los coquitos chilenos y las pasas.', '8\nMueve constantemente para evitar que la base se queme y mantén en fuego por 15 minutos o hasta que el arroz con leche obtenga la consistencia que prefieras.', '9\nPara servir el “clásico”, vierta en la mitad de la dulcera, una buena cucharada de mazamorra morada caliente y completa la otra mitad con el arroz con leche, que también debe estar caliente. No olvides de decorar con canela en polvo. ¡A disfrutar! Cuéntanos en los comentarios tu opinión y comparte con nosotros una fotografía del resultado final.']",,15 comensales,1h 30m,,Dificultad baja,,"['Receta sin gluten', 'Receta sin sal', 'Recetas peruanas']","['1 kilogramo de maíz morado', '3 ramas de canela', 'clavos de olor c/n', '1 piña picada y su cáscara', '400 gramos de azúcar (2 tazas)', '200 gramos de damascos', '200 gramos de orejones', '70 gramos de guindas', '200 gramos de manzana picada', '200 gramos de membrillo picado', '3 limones', '300 gramos de guindones', '100 gramos de harina de chuño o camote', '150 gramos de arroz blanco', '3 ramas de canela', 'clavos de olor c/n', 'cáscara de naranja c/n', '3 latas de leche evaporada', '300 gramos de leche condensada (1¼ tazas)', '200 gramos de azúcar (1 taza)', 'vainilla al gusto', 'pasas rubias o negras c/n', 'coquitos chilenos c/n']",https://www.recetasgratis.net/receta-de-mazamorra-con-arroz-con-leche-76489.html
Pasta frola de chocolate,"La pastafrola es una torta que cuenta con una base de masa llamada quebrada, ya que se rompe al cortarla o manipularla un poco. También cuenta con un relleno dulce, el cual originalmente era membrillo y por encima, un enrejado hecho con la misma masa de la base. Se dice que este detalle final fue creado por un cocinero argentino, inspirado en una tarta suiza. Sin embargo, puedes probar otros rellenos para la pastafrola como el de batata, batata con chocolate, manzana o bien chocolate, como aprenderás a hacer en esta receta. Además, lo haremos con una sencilla crema pastelera que quedará para chuparse los dedos.En RecetasGratis te enseñamos cómo hacer pastafrola de chocolate. ¡Vamos a cocinar!","['1\nPara empezar con la preparación de la pastafrola de chocolate, crema la manteca pomada con el azúcar, la ralladura de limón y la esencia de vainilla.', '2\nA continuación, agrega el huevo a temperatura ambiente y bate a mano hasta que se emulsionen los ingredientes.', '3\nUna vez integrados, agrega la harina 0000 con el polvo de hornear, tamizándolos previamente para evitar que se formen grumos.', '4\nIntegra los ingredientes para formar la masa ayudándote con una espátula para no amasar ni transmitir calor con tus manos. Resérvala en la heladera por 30 minutos a 1 hora, envuelta en film.\nTruco: estira un poco la masa para que se enfríe más rápido y disponla sobre una asadera para que se mantenga recta.', '5\nMientras, prepara el relleno de tu pastafrola de chocolate. Para ello, mezcla el huevo con la harina.', '6\nPor otro lado, calienta la leche con el azúcar.', '7\nCuando la leche esté caliente, agrégala poco a poco a la mezcla de harina con huevo, mientras mezcla para que no se formen grumos.', '8\nLleva la pastelera nuevamente al fuego, esta vez a temperatura media, y revuelve suavemente hasta que espese.', '9\nRetira la pastelera del fuego y agrega las dos tabletas de chocolate picado mientras esté bien caliente. Revuelve para integrar y resérvala con un papel separador en contacto para que no se haga una capa dura encima.', '10\nEstira un poco más de la mitad de la masa para cubrir la base de la tarta. Reserva la otra parte para luego estirarla y hacer las tiras para el enrejado.\nTruco: estírala en el mismo film para que no se pegue al palo de amasar y engrasa el molde con manteca. En este caso, es un desmontable de 16 centímetros de diámetro.', '11\nCubre el molde y asegúrate que no queden agujeritos o tu relleno podría escaparse. Puedes emparcharlo con los restos de los bordes.', '12\nRellena tu pastafrola con la pastelera de chocolate fría.', '13\nEstira y corta tiras con la masa que habías reservado previamente. Haz el enrejado clásico de la pastafrola.', '14\nCocina tu pastafrola de chocolate en el horno precalentado a 180 ºC durante 30 minutos o hasta que esté ligeramente dorada la masa.', '15\nReserva hasta que tu pastafrola de chocolate esté bien fría antes de desmoldar. Los moldes desmontables son ideales para este tipo de tartas y para facilitar su presentación, ya que, como hemos mencionado, la masa es algo frágil. Puedes decorar con un poco de azúcar impalpable y listo. Disfruta de tu pastafrola de chocolate. ¿Qué te pareció esta receta? Cuéntanos en los comentarios.']",,6 comensales,1h 30m,Postre,Dificultad baja,,"['Recomendada para vegetarianos', 'Recetas al horno']","['1 huevo', '200 gramos de harina 0000', '1 pizca de sal', '5 gramos de polvo para hornear', '60 gramos de azúcar', '1 cucharada postre de esencia de vainilla', 'ralladura de limón', '1 huevo', '60 gramos de harina 0000', '30 gramos de azúcar', '1 cucharada postre de esencia de vainilla', '2 tabletas de chocolate', '500 centímetros cúbicos de leche']",https://www.recetasgratis.net/receta-de-pasta-frola-de-chocolate-76481.html
Tarta de limón de la abuela,"Si quieres preparar una receta sencilla y con mucho sabor, te proporcionamos una exquisita tarta de limón rápida de la abuela, una receta fácil que no contiene gelatina. Además, si te gusta mucho el sabor del limón se puede añadir más zumo de limón. Por otro lado, la puedes acompañar con otras frutas, por ejemplo, las fresas le van muy bien, los frutos rojos, alguna mermelada por encima, frutos secos en trocitos, etc. Es una tarta de limón casera sin gelatina muy rápida de hacer, ya que no necesita horno y la puedes preparar con antelación, así aun estará más buena, ya que habrá cogido los sabores.En RecetasGratis te enseñamos cómo hacer tarta de limón de la abuela. ¡Seguro que gustará a todos, es ideal para un postre o para una celebración!","['1\nPara hacer la tarta de limón sin horno de la abuela, lo primero que debes hacer es preparar la base. Para ello, tritura las galletas en un robot hasta dejarlas en polvo.', '2\nDerrite la mantequilla unos segundos en el microondas y mezcla con las galletas hasta que quede una masa compacta.', '3\nCoge un molde de 20 cm. y cubre la base del molde con la masa de galletas. A continuación, aprieta con una cuchara la base de un vaso para que quede consistente. Luego, incorpora el molde en la nevera mientras prepara la crema de limón.', '4\nAñade un bol con la nata y bate hasta que esté medio montada, añade la cuchara de vainilla y la leche condensada. Vuelve a mezclar.', '5\nRalla los dos limones y saca el zumo de ellos. Añádelo al bol, junto con la crema. Vuelve a batir, notarás que al añadir el zumo de limón se espesará enseguida la crema.', '6\nRetira el molde de las galletas de la nevera, rellena la tarta con la crema de limón. Con una espátula alisa la superficie de la tarta para que quede lisa.', '7\nVuelve a introducir la tarta de limón de la abuela en la nevera un mínimo de 2-3 horas, o si puedes hacerla de un día para otro aun estará mas buena. A la hora de servir, adorna la tarta con rodajas de limón, ralladura de limón o con galletas trituradas por encima. Sírvela bien fría, la puedes introducir en el congelador un rato.', '8\n¡Ya está lista para comer la mejor tarta de limón del mundo! Cuéntanos en los comentarios tu opinión y comparte con nosotros una fotografía del resultado final.']",,6 comensales,2h 30m,,Dificultad baja,,[],"['180 gramos de galletas maría o digestivas', '80 gramos de mantequilla', '2 limones', '1 cucharada postre de aroma vainilla', '200 gramos de leche condensada', '200 gramos de crema de leche para montar']",https://www.recetasgratis.net/receta-de-tarta-de-limon-de-la-abuela-76482.html
Panqueques flambeados,"El panqueque, también llamado crêpe o crep, es una preparación francesa que puede servirse en diversos platos. Wraps, canelones, desayunos, meriendas y postres son tal vez los más clásicos. Asimismo, en esta oportunidad, te enseñaremos a cocinarlos y a servirlos con una presentación única: flambeados. Esto hará que queden crocantes y con un sabor caramelizado que te enamorará. Al final de la receta, podrás encontrar distintas opciones de rellenos para que elijas tu preferida.En Recetas Gratis te enseñamos cómo hacer panqueques flambeados. ¡Manos a la obra!","['1\nPara empezar con la preparación de los panqueques flambeados, hidrata la harina en la leche, junto con el huevo. Repósalo de 20 minutos a 1 hora en heladera, para que tus panqueques queden bien firmes.', '2\nPasado ese tiempo, hidrata una sartén antiadherente con un poco de manteca o aceite con ayuda de una servilleta. Cuando la sartén esté caliente, baja el fuego a medio y comienza a cocinar los panqueques, agregando una cucharada de la preparación y distribuyéndola en una capa fina. Cuando haga globos y se despegue solo, puedes girarlo para cocinarlo del otro lado.', '3\nReserva los panqueques en un plato y, cuando tengas todos listos, puedes empezar a flambearlos. Para ello, rellénalos con una cucharada de dulce de leche y dóblalos por el medio dos veces para tener un paquetito.', '4\nCalienta a fuego medio en la misma sartén una cucharada de manteca con azúcar y, cuando esté derretida, agrega el panqueque. Cuando se dore, sube el fuego al máximo y, cuidando que no se queme el azúcar, gíralo y agrega un poco de ron, corriendo la sartén un poco para que el fuego de la hornalla se encienda con el alcohol.', '5\nCuando el fuego se apague, el panqueque flambeado estará listo para que lo disfrutes. ¡A comer! Cuéntanos que te parecieron estos panqueques y compártenos tu foto en los comentarios.']",,8 comensales,30m,Postre,Dificultad media,,"['Recomendada para vegetarianos', 'Receta sin sal']","['1 huevo', '100 gramos de harina 000', '200 centímetros cúbicos de leche', '300 gramos de dulce de leche repostero', '100 gramos de azúcar (½ taza)', '75 centímetros cúbicos de ron']",https://www.recetasgratis.net/receta-de-panqueques-flambeados-76471.html
Tarta de ciruelas,"¡Qué deliciosas son las futas de verano! Además de su sabor único que invita a simplemente lavarlas y comerlas, también son ideales para licuados, helados, ensaladas, guarniciones agridulces, chutney, mermeladas y postres. Y entre estos últimos, las tartas son un verdadero clásico, ya que integra en un mismo bocado una masa crocante, con lo dulce de la crema y el leve tono ácido de la fruta.En RecetasGratis te enseñamos cómo hacer tarta de ciruelas frescas. ¡Vamos a cocinar!","['1\nPara preparar la masa de la tarta fresca de ciruelas, primero coloca en un bol el azúcar, la manteca pomada, la esencia de vainilla y la ralladura de naranja. Bate hasta obtener una preparación cremosa. Luego, agrega el huevo y vuelve a batir.', '2\nPosteriormente, agrega la harina tamizada con el polvo para hornear e integra utilizando una espátula. Obtendrás una masa muy tierna y húmeda que volcarás sobre papel film.', '3\nCubre con otro film y estira de unos 3 mm de espesor. Coloca sobre una placa y lleva a la heladera durante 2 horas hasta que endurezca.\nTruco: puedes preparar la masa de un día para otro.', '4\nMientras tanto, prepararemos la crema pastelera que rellena la tarta de ciruelas. Comienza calentando la leche con la esencia de vainilla y la piel de naranja en una cacerola hasta que rompa el hervor.', '5\nMezcla en un recipiente el azúcar, la harina y la maicena. Luego, añade el huevo y bate formando una crema.', '6\nVierte la leche caliente en el recipiente con la harina y el huevo. Mezcla bien disolviendo cualquier grumo que pudiera formarse y vuelve a poner en la cacerola. Lleva a fuego bajo y continúa mezclando bien por todo el fondo y los bordes de la olla para que no se pegue. Cocina hasta que espese.', '7\nPasa la preparación a otro recipiente, retira las cáscaras de naranja con cuidado de no quemarte, tapa con un film o separador en contacto con la crema y deja entibiar a temperatura ambiente y luego enfría bien en la heladera.', '8\nPrecalienta el horno a 170 °C y forra un molde desmontable de 16 cm de diámetro con la masa. Recuerda que es una masa quebradiza, pero si se rompe puedes unirla fácilmente. Intenta manipularla lo menos posible para que no tome temperatura. Cubre la masa con papel de aluminio y agrega porotos, arroz o piedritas. Hornea por 20 o 25 minutos, hasta que esté apenas dorada. Retira del horno y deja enfriar sin desmoldar.', '9\nLava las ciruelas y córtalas en gajos sin pelarlas.', '10\nPara armar la tarta de ciruelas frescas, retira la masa del molde y colócala sobre el plato de presentación. Rellena con la crema pastelera fría y decora con los gajos de ciruelas.\nTruco: de manera opcional, puedes fundir mermelada con un poco de agua y pincelarla para darle más brillo.', '11\n¡La torta de ciruelas está lista! Si no vas a comerla en el momento, mantenla en la heladera. Cuanto más fría esté, más sabrosa resultará. ¡A comer! Comparte con nosotros tus fotos y opinión en comentarios.']",,6 comensales,3h,Postre,Dificultad baja,,"['Recomendada para vegetarianos', 'Receta sin sal', 'Recetas al horno']","['30 gramos de manteca pomada', '30 gramos de azúcar', '1 huevo', '100 gramos de harina 0000', '1 cucharadita de polvo para hornear', '1 cucharadita de esencia de vanilla', 'ralladura de naranja', '250 centímetros cúbicos de leche', '1 huevo', '20 gramos de harina 0000', '20 gramos de maicena', '60 gramos de azúcar', 'esencia de vainilla', 'cáscara de naranja', '5 ciruelas frescas']",https://www.recetasgratis.net/receta-de-tarta-de-ciruelas-76479.html
Pasta frola de manzana,"La pastafrola o posta frola es un postre en el cual se fusionan distintas culturas. Y, es que a pesar que los argentinos la sentimos propia, la masa de esta tarta es originaria de Italia y era neutra, utilizada tanto para recetas dulces como saladas. El término frolla en español significa quebrada y hace referencia a que se rompe en cuanto se corta o se manipula un poco. El relleno clásico es el membrillo, ingrediente español por excelencia y el enrejado fue un agregado argentino, inspirado en la Linzer Torte suiza. En esta oportunidad, te mostraremos como preparar un delicioso relleno de manzana para que pruebes una versión distinta.En Recetas Gratis te enseñamos cómo hacer pastafrola de manzana. ¡A por ello!","['1\nEl primer paso de la preparación de la pastafrola de manzana consiste en batir la manteca pomada con el azúcar, el huevo a temperatura ambiente, la ralladura de limón y la esencia de vainilla para emulsionar.', '2\nAgrega la harina mezclada con el polvo de hornear, previamente tamizada, para evitar grumos. Intégrala poco a poco con ayuda de una espátula, para no transmitirle mucho calor con tus manos a la masa o se pegará en ellas. Tampoco amases mucho o desarrollarás gluten y la masa de tu pastafrola quedará algo dura.', '3\nReposa la masa envuelta en film en la heladera durante 1 hora.', '4\nMientras, lava y pela la manzana para cortarla en gajos finos, retirándole las semillas. Mézclala con el azúcar, la esencia de vainilla, el juego de limón y la canela. Resérvala en la heladera mientras terminas de preparar la masa.', '5\nCorta la masa en dos y estira una mitad en el film, hasta alcanzar aproximadamente medio centímetro de alto. Reserva la otra mitad en la heladera', '6\nCubre con la masa estirada el molde donde deseas cocinar tu pastafrola. En este caso, uno desmontable de 16 cm de diámetro que deberás previamente enmantecar y enharinar. No cortes los bordes que sobresalen de él para que en ellos puedas pegar el enrejado clásico de la pastafrola.', '7\nRellena la pastafrola con una capa de crema pastelera. Si no la consigues y deseas prepararla de forma casera, consulta la receta de crema pastelera.', '8\nLuego, añade los gajos de manzana que habías preparado anteriormente, acomodándolas decorativamente. Reserva tu pastafrola tapada, en la heladera, mientras continúas con el siguiente paso.', '9\nEstira la mitad de masa restante hasta un poco menos de medio centímetro de alto. Apóyala sobre una asadera o cualquier superficie recta y llévala unos 2 minutos al congelador para que tome cuerpo. Corta tiras de 1 dedo de ancho para hacer el enrejado de tu pastafrola.', '10\nDecora con las tiras de forma vertical y horizontal para generar el enrejado. Corta los bordes para emparejarlos y cocina la pastafrola de manzana en el horno precalentado a 180 ºC por unos 35-40 minutos o hasta que la masa esté ligeramente dorada.', '11\nReserva hasta que tu preparación esté fría para desmoldarla. Puedes pintarla con un poco de miel mezclada con agua para que quede más brillante.', '12\nY así tienes lista tu pastafrola de manzana. ¿Qué te pareció esta receta? Cuéntanos en los comentarios y comparte la foto de tu resultado, ¡nos encantaría verla!']",,6 comensales,1h 30m,Postre,Dificultad baja,,"['Recomendada para vegetarianos', 'Recetas al horno']","['1 huevo', '200 gramos de harina 0000', '1 pizca de sal', '5 gramos de polvo para hornear', '1 cucharada postre de esencia de vainilla', 'ralladura de limón', '200 gramos de crema pastelera', '1 cucharada postre de esencia de vainilla', 'ralladura de limón', '1 manzana grande', '1 cucharada postre de canela', '1 cucharada sopera de azúcar']",https://www.recetasgratis.net/receta-de-pasta-frola-de-manzana-76473.html
