title,intro,order,votes,comensales,duración,para,dificultad,coste,types,ingredientes,url
Galletitas de maicena sin manteca,"Los alfajores de maicena o galletitas de maicena sin manteca son un clásico argentino. Se trata de dos galletas de maicena que se deshacen en tu boca, rellenas por una generosa cantidad de dulce de leche, el elixir argentino. Asimismo, están quienes prefieren los alfajores más grandes, con las tapitas más gruesas, más cantidad de dulce de leche. Por ello, en esta oportunidad, queremos enseñarte a hacer los alfajores en casa para que puedas adaptarlos a tu gusto y disfrutar de una deliciosa y tradicional receta. Además, verás que en esta receta reemplazaremos la manteca por aceite, mejorando la calidad nutricional del resultado.Si quieres obtener más información al respecto, quédate leyendo en RecetasGratis y aprende cómo hacer galletitas de maicena sin manteca. ¡A cocinar!","['1\nPara empezar con la preparación de las galletitas de maicena sin manteca o alfajores de maicena sin manteca, primero bate el huevo con el aceite y los ingredientes que elijas para aromatizarlos. Recomendamos esencia de vainilla y ralladura de limón, pero también podrías utilizar esencia de coco o ralladura de naranja.', '2\nCuando los ingredientes estén integrados, agrega el azúcar y remueve hasta no sentir sus cristales. Si lo deseas, podrías reemplazar el azúcar por unos 4 o 5 sobres de edulcorante apto cocción o azúcar mascabo. En el caso del edulcorante, es la opción ideal para quienes tienen diabetes, para reducir el índice glucémico de esta preparación. También puedes buscar en nuestra web la receta de alfajores de maicena con harina integral.', '3\nA continuación, agrega el resto de los ingredientes de esta receta, es decir, la harina 0000, la maicena, el polvo de hornear y la pizca de sal. Hazlo con ayuda de un tamiz o colador fino con el fin de evitar que se formen grumos en tu preparación. Intégralos con una espátula o cornet, sin amasar.', '4\nLleva tu masita de maicena a una mesada para estirarla. Recomendamos que lo hagas entre dos separadores para que no se pegue al palo ni a la mesada. También podrías utilizar papel film.', '5\nCorta las tapitas para tus alfajores de maicena con un cortante de galletitas o una tapita de frasco y llévalas a una asadera previamente engrasada. Vuelve a unir tu masa, sin amasar, para estirarla y cortarla hasta utilizarla toda.', '6\nCocina tus tapitas en un horno precalentado a 180 ºC durante unos 7-8 minutos hasta que hayan leudado y estén ligeramente doradas debajo.', '7\nCuando estén frías, unta una tapita con el dulce de leche y tápala con otra para formar tu alfajor. Empareja los bordes para que en todos queden dulce de leche y puedas cubrirlos con el coco rallado a continuación.', '8\nGira los alfajores en un cuenco con el coco rallado para que se pegue en el dulce de leche.', '9\nSirve tus alfajores o galletitas de maicena sin manteca y ¡a comer! ¿Qué te ha parecido esta receta? Cuéntanos en los comentarios.']",,5 comensales,30m,Merienda,Dificultad baja,,"['Recomendada para vegetarianos', 'Recetas al horno', 'Recetas argentinas']","['1 huevo', '¼ limón (su ralladura)', '½ cucharadita de esencia de vainilla', '75 gramos de maicena', '60 gramos de harina 0000', '1 pizca de sal', '1 cucharada postre de polvo para hornear', '2 cucharadas soperas de azúcar', '3 cucharadas soperas de aceite neutro', '150 gramos de dulce de leche repostero', '3 cucharadas soperas de coco rallado']",https://www.recetasgratis.net/receta-de-galletitas-de-maicena-sin-manteca-76177.html
59 postres navideños en vasitos,"Hay tanto que hacer en Nochebuena y lo último que queremos es complicarnos más la vida con un postre muy elaborado. Allí es donde entran nuestros postres fáciles en vasitos para Navidad, que te darán una solución rápida y sabrosa para tus comidas navideñas. Asimismo, quedan geniales también en Año Nuevo. ¿Por qué en esta presentación? Servir un postre en vasito te permite pasar de lo informal a lo formal con mucha facilidad, porque para servirlos, se valen desde vasos de plástico simples hasta copas, tazas o cuencos. Pero eso no es todo, montar un postre en vasito te permite jugar con lo visual y las texturas del postre, abriéndole un mundo de sensaciones al comensal. Anda, checa nuestro menú y dinos cuáles son tus favoritas, tenemos una gran variedad de pudines, natillas, sabayones, bizcochos, yogures y cuajadas.En RecetasGratis te enseñamos cómo hacer 59 postres navideños en vasitos. ¡Qué comience la fiesta!",[],,,,,,,,,https://www.recetasgratis.net/articulo-postres-navidenos-en-vasitos-76382.html
Mermelada de mandarina sin azúcar,"La mermelada es una preparación infaltable en los desayunos y las meriendas de la mayoría. Sin embargo, también puedes utilizarla en diferentes platos: para salsear una torta, rellenar alfajores e incluso en platos salados, dando lugar a recetas agridulces. Además, estamos seguro que preparar mermeladas en casa es una experiencia que querrás repetir, ya que es muy sencillo y el resultado es fantástico. Asimismo, puedes prepararla con la mayoría de las frutas y con algunas verduras, como zapallo o zanahoria. Otra ventaja que tiene esta receta es que puedes prepararla en su versión más saludable y baja en calorías. Verás que la receta es rápida, sencilla y deliciosa gracias a su delicado equilibrio entre dulce y ácido.En RecetasGratis te enseñamos cómo hacer mermelada de mandarina sin azúcar. ¡A cocinar!","['1\nPara empezar con esta receta, primero debes lavar y pelar las mandarinas. En caso de que la mandarina tenga demasiados hollejos blancos, retíralos y reserva la cáscara de una de ellas.', '2\nA continuación, corta las mandarinas en octavos. De esta forma, podrás retirar mejor las semillas y el resto de hollejos blancos que queden.\nTruco: si quieres que la mermelada de mandarina light tenga una textura más fina y sin trozos de fruta, puedes licuar la mandarina.', '3\nSeguidamente, debes retirar la parte blanca interior de las cáscaras que reservaste.', '4\nCuando hayas retirado la parte blanca, debes cortar la cáscara en finas tiras. No olvides incluir la piel de la fruta, ya que esta intensificará el sabor de la mandarina en la mermelada.', '5\nPosteriormente, debes exprimir medio limón. Ahora es el momento de colar el jugo y envolver las semillas de limón en una gasa atada con hilo blanco.\nTruco: las semillas de limón contienen pectina, un espesante natural que ayudará a que la mermelada tome más consistencia. Otra forma de espesar es agregando 1 cucharadita de semillas de chía o utilizando agar agar.', '6\nA continuación, coloca en una cacerola las mandarinas, las cascaritas, el jugo de limón y las semillas envueltas en la gasa. Y después, llévalo a fuego alto.', '7\nCuando empiece a hervir, baja el fuego al mínimo. Debes remover de vez en cuando a medida que va tomando consistencia para que no se pegue o queme.\nTruco: puedes pisar algunas porciones de la fruta y otras dejarlas más grandes para darle distintas texturas a la mermelada.', '8\nTranscurridos aproximadamente 30 minutos, comprueba si la mermelada está en su punto. Para ello, coloca una cucharada del producto en un plato y realiza un surco en el centro con la yema del dedo o con una cuchara. Si permanece abierto, está lista. Llegado este punto, apaga el fuego, agrega el edulcorante y mezcla. Prueba si está a tu gusto o si prefieres agregar más edulcorante.', '9\nPor último, envasa en un frasco limpio y seco mientras la mermelada aún está caliente. Limpia los bordes, tapa y colócalo boca abajo hasta que esté completamente fría. Para terminar, lleva la mermelada a la heladera y conserva la mermelada sin azúcar durante aproximadamente 2 semanas.', '10\nYa está todo listo para saborear esta deliciosa mermelada casera de mandarina. ¿Qué te pareció esta receta de mermelada de mandarina casera? ¡Cuéntanos en los comentarios!']",,9 comensales,45m,Desayuno,Dificultad baja,,"['Recomendada para veganos', 'Recomendada para vegetarianos', 'Recomendada para perder peso', 'Receta sin lactosa', 'Receta sin azúcar', 'Receta sin gluten', 'Receta sin sal']","['3 mandarinas', 'jugo de medio limón', '2 cucharaditas de edulcorante']",https://www.recetasgratis.net/receta-de-mermelada-de-mandarina-sin-azucar-76322.html
Alfajores de maicena fácil con harina leudante,"Los alfajores de maicena pueden ser una preparación un poco difícil para quienes no tienen experiencia en la cocina al ser una masa delicada con manteca. Asimismo, en esta receta, queremos mostrarte cómo hacerlos de forma fácil con muy pocos ingredientes para que puedas prepararlos independientemente de tu talento en la cocina. Se trata de una masa con una base de maicena, harina leudante, aceite, azúcar y huevo, con la que elaboramos unas galletitas para rellenar con abundante dulce de leche y cubrir con coco rallado. El resultado son unos alfajores de maicena ideales para el desayuno, la merienda, el postre o para servir como parte de una mesa dulce de cumpleaños o celebración en general.Quédate leyendo en RecetasGratis y aprende cómo hacer alfajores de maicena fácil con harina leudante. ¡A cocinar!","['1\nPara empezar con la receta de los alfajores de maicena fáciles con harina leudante, primero mezcla el huevo con el aceite, el azúcar y la esencia de vainilla. Debes mezclar hasta no sentir los cristales de azúcar y que se emulsione el aceite con el huevo.\nTruco: además de aromatizar tus alfajores con la esencia de vainilla, puedes utilizar ralladura de limón o naranja.', '2\nAgrega el resto de los ingredientes de esta receta, es decir, la harina leudante y la maicena. Hazlo con ayuda de un tamiz o colador fino con el fin de evitar que se formen grumos en tu preparación. Intégralos con una espátula o cornet sin amasar, por el contrario, tus alfajores quedarán duros.', '3\nDispón la masa de tus alfajores de maicena con harina leudante entre dos separadores u hojas de papel film para llevar a una mesada y estirarla sin la preocupación de que se pegue en la mesada o en el palote.', '4\nEstira la masa de aproximadamente medio centímetro de alto o menos, siendo que luego van a leudar gracias a la harina leudante. Corta las tapitas y vuelve a unir tu masa, sin amasar, para estirarla y cortarla hasta utilizarla toda.', '5\nDispón las tapitas en una asadera previamente engrasada para cocinar tus tapitas en un horno precalentado a 180 ºC durante unos 7 a 8 minutos, hasta que hayan leudado y estén apenas doradas debajo.', '6\nUna vez frías, rellena los alfajores con el dulce de leche y empareja los bordes con ayuda de un untador para que no queden huecos y puedas cubrirlos con el coco rallado.', '7\nDispón el coco rallado en un cuenco para girar los alfajores en él y hacer que se pegue en el dulce de leche.', '8\n¡Y listo, a comer! ¿Qué te ha parecido esta receta? Mucho más fácil que la original, ¿no? Cuéntanos en los comentarios.']",,5 comensales,30m,Postre,Dificultad baja,,"['Recomendada para vegetarianos', 'Recetas al horno', 'Recetas argentinas']","['1 huevo', '½ cucharadita de esencia de vainilla', '75 gramos de maicena', '60 gramos de harina leudante', '2 cucharadas soperas de azúcar', '3 cucharadas soperas de aceite neutro', '150 gramos de dulce de leche repostero']",https://www.recetasgratis.net/receta-de-alfajores-de-maicena-facil-con-harina-leudante-76185.html
Tarta de Nutella y queso,"La Nutella es una pasta dulce y cremosa elaborada con una base de avellanas y cacao. Gracias a su delicioso sabor se ha convertido en un elixir de la pastelería y es utilizada como relleno en helados, cheesecake de Nutella, brownies... Además de conseguirla de forma industrializada en los supermercados, se puede hacer de forma casera con muy pocos ingredientes. Además, esta receta de tarta de queso y Nutella es sin horno, así que puedes prepararla con los más pequeños de la casa y, a la vez, incentivar su espacio en la cocina.En RecetasGratis.net, te mostraremos cómo hacer una tarta de Nutella y queso fácil y rápida. ¡Vamos a ello!","['1\nPara empezar, debes moler las galletitas de chocolate con la manteca derretida. Puedes derretirla en el microondas o en una ollita a fuego medio-bajo. Es posible usar un procesador de alimentos para que las galletitas queden bien deshechas. Si no lo tienes, puedes molerlas dentro de una bolsa de plástico para alimentos, con la ayuda de un palo de amasar.\nTruco: si quieres hacer esta torta sin gluten, debes elegir las galletitas y los ingredientes aptos para tu consumo.', '2\nPrepara el molde donde quieras realizar tu bizcocho de Nutella, forrándolo con papel film. Esto facilitará su desmolde. Si tienes moldes de torta desmontables, utilízalos cubriendo los bordes con acetato. Este molde es de 15 centímetros de diámetro y 7 de alto. Con estas cantidades, podrías usar moldes hasta 22 centímetros de diámetro. Para un molde más grande, podrías aumentar la cantidad de los ingredientes. Por último, guárdalo en el congelador por 15 minutos, mientras preparas el relleno.', '3\nPara el relleno de tu torta con Nutella, debes mezclar el cacao y el queso untable. Si deseas hacer otras versiones de esta torta, puedes hacer tu tarta de Nutella sin horno con queso mascarpone, o reemplazar la mitad de la Nutella por dulce de leche repostero y el queso untable por crema batida.\nTruco: es posible hacer tarta de Nutella sin queso, solo hace falta que encuentres un sustituto, por ejemplo la nata, y así poder hacer una tarta de Nutella y nata. Esta receta es de tarta de queso con Nutella si horno, pero también hay la opción de elaborar tarta de Nutella al horno.', '4\nPor otro lado, hidrata la gelatina sin sabor con el agua. Con esta cantidad de gelatina, la torta no quedará para nada rígida, solo sostenida y sin grumos. A continuación, calienta 3 veces la gelatina durante 10 segundos en el microondas, revolviendo entre cada vez. Por último, mezcla 1 cucharada del relleno con esta gelatina para equiparar densidades y, luego, con el resto.', '5\nSeguidamente, vierte el relleno sobre la base de galletitas y manteca. Por último, refrigera tu torta por unas 2 horas en la heladera.\nTruco: esta receta es de tarta de Nutella y queso con galletas, pero hay muchas otras opciones para preparar la base de tu pastel de Nutella.', '6\nCuando haya pasado ese tiempo, calienta la crema de leche y viértela sobre el chocolate para hacer la cobertura. Debes dejarlo reposar durante 1 minuto y remueve para integrarlos, de esta manera se formará la ganache. Seguidamente, cubre la torta con ella y enfríala por al menos 30 minutos más.', '7\nPara finalizar, sirve tu torta con lo que más te apetezca. ¿Qué opinas de esta receta? ¡Cuéntanos en los comentarios y mándanos una foto con el resultado final!']",,6 comensales,2h 30m,Postre,Dificultad muy baja,,"['Recomendada para vegetarianos', 'Receta sin lactosa', 'Receta sin gluten']","['100 gramos de galletitas de chocolate', '50 gramos de manteca', '1 cucharada sopera de cacao amargo', '200 gramos de Nutella', '100 gramos de queso untable', '3 gramos de gelatina sin sabor', '15 centímetros cúbicos de agua', '50 gramos de chocolate cobertura', '50 centímetros cúbicos de crema de leche']",https://www.recetasgratis.net/receta-de-tarta-de-nutella-y-queso-76002.html
14 postres con turrón,"Nada como el turrón para recordarnos a los golosos que ya llegó la época decembrina. Ahora imagínate ese mismo sabor repartido en muchos postres, ideados para que tu menú navideño y de fin de año sea original y con mucho estilo. ¿Maravilloso, verdad? Además, viéndolo desde otro punto de vista, si te han regalado mucho turrón o compraste demasiado, aprovechando lo que sobre podrás incluso ahorrar un poco. Pues ya se nos quedaron cortas las palabras, te presentamos un montón de recetas creativas, deliciosas que seguro querrás tener en tu mesa.En RecetasGratis, te enseñamos cómo hacer 14 postres con turrón para que sorprendas a tus invitados estas Navidades. ¡Sigue leyendo!",[],,,,,,,,,https://www.recetasgratis.net/articulo-14-postres-con-turron-76311.html
Receta FÁCIL y DELICIOSA,"La ricota es un queso que se obtiene del suero de la leche, este tiene un color blanco y sabor muy suave. Además, brinda un amplio abanico de posibilidades en la cocina, ya que se adapta tan bien a platos dulces, como salados. Asimismo, entre las opciones saladas, es muy común utilizarla como relleno de pastas, topping de pizzas o en ensaladas. Y entre las propuestas dulces, destacan los cannolis y las tortas de ricota.En RecetasGratis te enseñamos cómo hacer tarta de ricota y limón, una variante de ese postre clásico. ¿Empezamos?","['1\nPara empezar con la receta de tarta de ricota y limón, primero coloca la manteca pomada junto con el azúcar, la esencia de vainilla y la ralladura de limón en el bol de la batidora. Bate hasta cremar la preparación.', '2\nIncorpora las yemas de los huevos y reserva las claras en otro recipiente. Bate 1 minuto más.', '3\nPor último, tamiza la harina y agrégala a la preparación anterior junto con el polvo para hornear y la pizca de sal. Une los ingredientes con espátula, sin amasar para no formar gluten.', '4\nSe formará un arenado que debes volcar entre dos papeles film. Primero, aplasta un poco con la mano y, luego, estira con palo de amasar hasta unos 4 mm de espesor. A continuación, coloca la masa de torta de ricota fácil sobre una placa y enfríala en heladera mínimo 1 hora.', '5\nCuando la masa se haya enfriado, precalienta el horno a 170 °C y forra un molde desmontable de 15 cm de diámetro de la siguiente manera. Primero, corta un círculo de la medida de la base y coloca en el molde.', '6\nCon el excedente de masa corta tiras para cubrir los bordes.', '7\nColoca los bordes en el molde y únelos en la base ayudándote con los dedos.', '8\nRevisa que el molde quede completamente cubierto y no queden espacios por donde pueda filtrarse el relleno. A continuación, reserva en la heladera mientras preparas el relleno.', '9\nColoca en un bol la ricota junto con la crema y el azúcar. Bate con batidor de mano.', '10\nA continuación, agrega la esencia de vainilla, la ralladura y el jugo de limón. Vuelve a batir para integrar.', '11\nFinalmente, agrega las claras y bate suavemente hasta unificar la preparación.', '12\nVierte el relleno en el molde forrado y hornea a 170 °C durante 40 y 50 minutos o hasta que el relleno esté cocido y la superficie se haya dorado un poco.', '13\nCuando esté cocida la tarta de ricota y limón, retira del horno y deja templar a temperatura ambiente. Luego, llévalo a la heladera como mínimo 2 horas antes de desmoldar.', '14\nDesmolda y decora la tarta de ricota y limón o si ya no puedes esperar a probarla, simplemente corta una porción y ¡a comer! Cuéntanos en los comentarios tu opinión y comparte con nosotros una fotografía del resultado final.']",,6 comensales,4h,,Dificultad media,,"['Recomendada para vegetarianos', 'Receta sin sal', 'Recetas al horno']","['100 gramos de manteca', '70 gramos de azúcar', '2 yemas de huevos', '½ cucharadita de esencia de vainilla', 'ralladura de limón', '200 gramos de harina 0000', '1 cucharada postre de polvo para hornear', '1 pizca de sal', '200 gramos de ricota', '50 gramos de crema de leche', '70 gramos de azúcar', '2 claras de huevo', '½ cucharadita de esencia de vainilla', 'ralladura de 1 limón', 'jugo de 1 limón']",https://www.recetasgratis.net/receta-de-tarta-de-ricota-y-limon-76282.html
Receta FÁCIL y EXQUISITA,"Existen distintas recetas de alfajores argentinos que terminan con un delicioso glaseado. Por un lado, tenemos los alfajores cordobeses, que podemos encontrarlos rellenos con dulce de fruta o dulce de leche, cubiertos por azúcar glas y agua o jugo de limón. Por otro lado, tenemos los santafesinos, con unas tapitas más finas, parecidas a las que componen el rogel, rellenos con dulce de leche. Estos están cubiertos por un glasé real de clara de huevo, azúcar y limón. Por último, los alfajores marplatenses, que además de chocolate, podemos encontrarlos con un glaseado como el que aprenderás a hacer a continuación. También existen los alfajores en otros países latinoamericanos y europeos, como por ejemplo: los alfajores de nieve uruguayos, los alfajores andaluces o los alfajores tipo Havanna.Quédate leyendo, porque en RecetasGratis te enseñamos cómo hacer alfajores glaseados. ¡Vamos a ello!","['1\nPara empezar con la preparación de los alfajores glaseados, debes pesar y tamizar los ingredientes secos de esta receta. Estamos hablando de: la harina 0000, el cacao amargo, el polvo de hornear, el bicarbonato de sodio y la maicena. En este punto no deberás incluir el azúcar,ya que la usaremos más tarde. Una vez los hayas pesado y tamizado, resérvalos.', '2\nPor otro lado, crema la manteca pomada con el azúcar. Se trata de batir ambos ingredientes hasta obtener una consistencia cremosa, donde no se vean los cristales de azúcar.', '3\nA continuación, agrega el huevo a temperatura ambiente, la esencia de vainilla, la miel y la ralladura de los cítricos (la naranja y el limón). Puedes elegir uno de los dos, pero su combinación le da un sabor único a los alfajores. Luego, bate un poco más para integrar bien los ingredientes.', '4\nSeguidamente, añade la mezcla de harina y el resto de los ingredientes secos que habías dejado listos al principio de la preparación. Integra con ayuda de una espátula o cornet, pero hazlo sin amasar, ya que se desarrollará el gluten y tus alfajores quedarán duros.', '5\nLleva la masa a una mesa con dos papeles film, uno debajo y otro encima. Para de esta forma, poder estirarla sin que se pegue a la superficie o el palote. Por lo tanto, estírala hasta que tenga unos 4 o 5 milímetros de alto. Una vez hecho esto, refrigérala por 2 horas sobre una placa para que no se doble.', '6\nPasado ese tiempo, corta las tapitas de tus alfajores con un cortante de 5 o 6 centímetros de diámetro.', '7\nA continuación, disponlas sobre una asadera previamente engrasada, separadas para que al crecer en el horno, no se peguen. Debes cocinarlas en el horno precalentado a 180 grados de 8 a 10 minutos. Si es necesario, gira la placa para que lo hagan de forma pareja.\nTruco: sabrás que están listas si tocas la superficie y esta no se hunde. También pueden estar ligeramente doradas debajo.', '8\nPosteriormente, vuelve a unir la masa sin amasar, con ayuda del papel film para estirarla y cortarla hasta usarla toda. Si se llega a calentar será difícil maniobrarla, por lo que deberás refrigerarla nuevamente hasta que tome cuerpo.', '9\nDespués, enfría tus tapitas sobre una rejilla para que no se humedezcan.', '10\nMientras, prepara el baño azucarado para alfajores. Para ello, deberás calentar el azúcar blanco con unos 150 centímetros cúbicos de agua a 120 ℃ en una hornalla a fuego medio. Una vez que tengas la olla en la hornalla, aconsejamos que pongas el azúcar primero y agregues agua poco a poco hasta cubrir ligeramente el azúcar, como ves en la imagen.', '11\nA continuación, comienza a batir el azúcar impalpable con la clara de huevo y las cucharadas de jugo de limón. Si no te gusta el limón en el glasé, puedes reemplazarlo por agua.', '12\nCuando el almíbar haya alcanzado la temperatura de 120 ℃, viértelo en forma de hilo sobre la clara con el azúcar glas mientras continúas batiendo, como si hicieras un merengue italiano.', '13\nDebes de seguir batiendo hasta que la preparación se enfríe.', '14\nActo seguido, rellena tus alfajores con el dulce de leche repostero. Con ayuda de un untador o espátula, asegúrate que el dulce llegue hasta los bordes y estos queden bien cargados, como ves en la imagen. De lo contrario, no podrás cubrirlos correctamente con el baño blanco para alfajores.', '15\nPara glasearlos, toma uno de los alfajores y cubre la base con glasé. Luego, llévalo a una placa de silicona antiadherente o a un papel con manteca con el glasé hacia abajo. Por último, cubre el resto del alfajor.', '16\nPuedes humedecer un poco el untador para ayudarte a mejorar el glaseado. El glaseado debe cubrir bien tus alfajores, pero no debe quedar muy grueso. Aproximadamente el tiempo de secado son de unas 8 a 24 horas. Esto depende de lo húmedo que sea el lugar donde te encuentras haciendo de esta receta de alfajores tipo Jorgito.\nTruco: puedes dejar los alfajores en un espacio con buena corriente de aire o delante de un ventilador para acelerar el proceso de secado.', '17\nUna vez seco, ya puedes disfrutar de estos deliciosos alfajores glaseados. Los alfajores blancos son clásicos de la ciudad balnearia de Mar del Plata, en Buenos Aires, Argentina. Si los pruebas, cuéntanos qué te parece esta deliciosa receta de alfajores con azúcar impalpable y mándanos una foto con el resultado final. ¡A comer!']",,15 comensales,24h,Postre,Dificultad media,,"['Recomendada para vegetarianos', 'Recetas al horno', 'Recetas argentinas']","['250 gramos de harina 0000', '50 gramos de maicena', '20 gramos de cacao amargo', '1 cucharada postre de polvo de hornear', '½ cucharadita de bicarbonato de sodio', '150 gramos de manteca', '50 gramos de azúcar (¼ taza)', '1 huevo', '1 cucharada postre de esencia de vainilla', '1 cucharada sopera de miel', '300 gramos de dulce de leche repostero', '1 clara de huevo', '3 cucharadas soperas de jugo de limón', '200 gramos de azúcar impalpable', '200 gramos de azúcar blanco']",https://www.recetasgratis.net/receta-de-alfajores-glaseados-76200.html
