url,title,date,text
https://www.pequerecetas.com/compras/mejores-robots-de-cocina-analisis-opiniones/,Los mejores ROBOTS DE COCINA (opinión de nuestros expertos),2021-11-23 16:24:46+01:00,"Los robots de cocina son uno de esos electrodomésticos que piensas que no necesitas hasta que lo pruebas… y te cambia la vida. Y aunque podemos encontrar robots de cocina baratos que rondan los 150 euros, hay robots de cocina súper equipados que prácticamente cocinan solos y pueden superar los mil euros. Así que si quieres darte el gusto de comprar ese robot de cocina que siempre soñaste, aprovechar ofertas y rebajas es una gran idea.

Por eso te hemos preparado un análisis completo de los mejores robots de cocina del mercado con un montón de consejos para que puedas escoger teniendo en cuenta tus necesidades y tu presupuesto.

¿Qué robot de cocina es mejor para mí?

Un buen robot de cocina nos permite ahorrar mucho tiempo y esfuerzo en la cocina porque hacen casi todo: trituran, baten, montan, emulsionan, muelen, pican, amasan, pesan, recalientan, fríen, cuecen, asan… claro que depende del modelo y de lo que quieras gastar. A grandes rasgos hay dos tipos de robots entre los que se puede escoger:

Ollas programables: son ollas eléctricas que solo cocinan los alimentos a través de varias funciones, pero no los procesan, es decir que no pican, trituran, etc. Existen muchos modelos y marcas diferentes, suelen tener varios programas de cocción y al igual que una olla rápida, aceleran mucho los tiempos , pero además tienen otra ventaja fundamental que es poder programarla para mantener caliente la comida o para que comience a cocinar a una determinada hora.

son ollas eléctricas que a través de varias funciones, pero no los procesan, es decir que no pican, trituran, etc. Existen muchos modelos y marcas diferentes, suelen tener y al igual que una olla rápida, , pero además tienen otra ventaja fundamental que es poder programarla para Procesadores de alimentos: son verdaderos robots que además de cocinar, procesan los alimentos, en mayor o menor medida según el modelo. Un ejemplo de este tipo de robot es la Thermomix, pero hay muchas marcas y sobre todo mucha variedad de precios.

Teniendo en mente esto podrás escoger cual es el mejor robot de cocina para ti.

Robot de cocina MAMBO CECOTEC

El robot de cocina Cecotec es uno de los más populares, sobre todo por su excelente relación calidad-precio. Aunque en realidad deberíamos decir los robots, porque hay varios modelos de Mambo Cecotec. Y entre todas las opciones, el más popular y valorado en este momento es el Cecotec Mambo 10090, os contamos por qué.

Cecotec Mambo 10090

El Mambo 10090 es un robot de alta gama con un precio bastante contenido. Tiene 30 funciones: trocea, pica, licua, tritura, sofríe, muele, pulveriza, ralla, recalienta, bate, yogurtera, monta, emulsiona, mezcla, cocina, remueve, cocina al vapor, escalfa, confita, amasa, cocina a baja temperatura, hierve, mantiene caliente, fermenta, SlowMambo, cocina con precisión grado a grado, cocina al baño maría, cocción lenta, velocidad cero y dispone de función turbo.

Y aunque algunas de estas funciones suenen a lo mismo con distinto nombre, lo cierto es que con un robot así puedes prescindir de otros electrodomésticos y reunirlos todos en uno.

El Cecotec Mambo nos gusta porque su jarra es de acero inoxidable y bastante grande, de 3,3 l. Esto permite cocinar para una familia, dependiendo de lo que prepares, y el acero inoxidable es un material duradero y fácil de limpiar. Otro detalle que nos ha conquistado es que se puede manejar desde una app que incluye un montón de recetas, lo que facilita bastante su uso.

Precio del Robot de cocina Mambo Cecotec 10090 En cuanto a su precio ronda los 450€, aunque a veces puedes conseguirlo de oferta por tiempo limitado. Te recomendamos visitar primero la Web de Cecotec, para ver allí sus precios de oferta ¡a veces lanzan ofertas muy interesantes! VER PRECIO EN WEB OFICIAL CECOTEC

También puedes comparar los precios con los de Amazon, que puntualmente pueden tener alguna oferta para cazar al vuelo:

Robot de cocina TAURUS MYCOOK TOUCH

Tras la popular Thermomix salieron muchos competidores, y uno de ellos es Taurus MyCook, con modelos como el Taurus MyCook Touch, que, aunque es de los más caros dentro de la comparativa (ronda los 600€ si no está de oferta), sigue siendo más económico que su competidora.

Si te interesa este modelo lo hemos probado y te dejamos nuestra detallada opinión sobre su funcionamiento en este artículo:

El Taurus MyCook Touch tiene conexión multidispositivo a través de Wi-Fi con pantalla táctil de 7″. Dos modos de cocinado: manual y recetas guiadas. Su principal diferencia frente a sus competidores es que calienta por inducción de 40 a 140º C. Tiene 10 velocidades y cuatro funciones especiales (sofrito, amasado, turbo y balanza).

¿Qué precio tiene Taurus Mycook Touch? Te recomendamos mirar antes la web de Taurus, porque aquí suelen tener precios más bajos y ofertas puntuales (por ejemplo en el momento de escribir esta review su precio en la web de Taurus estaba rebajado al 50% y es 200€ más barato que el de Amazon). VER PRECIO EN WEB OFICIAL TAURUS

Lo ideal es mirar y comparar la web oficial y Amazon porque pueden variar cada día dependiendo de las diferentes promociones puntuales que se realicen:

También tienes la versión Black Edition (puedes verla aquí), ligeramente más económica y cuya única diferencia es que la carcasa es de plástico en lugar de metal, así como el cestillo.

Si te gusta la marca pero no te lo puedes permitir por presupuesto, tienes la versión económica de Taurus MyCook One (puedes ver su precio aquí), cuya principales diferencias con su hermano mayor son la ausencia de pantalla táctil, y que no tendrás las recetas guiadas por pasos, sino que tendrás que guiarte por el recetario impreso que trae, pero su precio, casi la mitad que el Taurus MyCook Touch puede merecer la pena.

Robot de cocina MOULINEX

Otra marca muy bien valorada y muy popular es Moulinex. En este caso nos decantamos por tres robots diferentes, porque como hemos dicho al principio podemos diferenciar entre robots que solo cocinan, y robots que procesan y cocinan. Y Moulinex tiene muy buenos productos en ambas tipologías.

Robot de cocina Moulinex Maxichef

Por un lado el Moulinex Maxichef Advance porque dentro de las opciones económicas que no procesan los alimentos, es ideal para familias con horarios encastrados y con poco tiempo: tiene 5 l de capacidad, se puede dejar programada con 24 horas de antelación y sirve para todo tipo de cocciones.

Robot de cocina Moulinex ClickChef

Si buscas un robot procesador el Moulinex ClickChef es una buena opción con 32 funciones diferentes: corta, pica, tritura, sofríe, muele, pulveriza, prepara crema, licua, recalienta, bate, mezcla, cocina, guisa, pesa, cuece a baja temperatura, remueve, amasa, cocina al vapor, fermenta, conserva, hierve, confita, cocina con precisión, monta, emulsiona, escalfa, pica hielo, estofa, derrite, prepara sorbetes, prepara mantequilla y función turbo.

Nos gusta porque a pesar de ser bastante compacto, permite cocinar para hasta 4 personas, dependiendo de la receta, y tiene la báscula externa, lo que te permite corregir si te equivocas antes de incorporar el ingrediente a la receta.

Robot de cocina Moulinex i-Companion

El Moulinex i-Companion es otra excelente alternativa dentro de los robots de cocina de Moulinex. Tiene 13 programas, 6 programas para salsa, 2 para sopas, 3 para cocción lenta, 2 para vapor, 3 programas para masa, 1 para postre, y el modo manual para crear tus propias recetas.

TOP 3 Nuestros robots favoritos

Hemos seleccionado nuestros 3 robots de cocina preferidos teniendo en cuenta los siguientes parámetros: el más completo, el más económico y nuestro robot favorito. Aunque estas apreciaciones pueden variar si salen modelos nuevos, hoy por hoy, este es nuestro TOP 3 en robots de cocina.

Como el robot más completo, el que te recomendamos si tu presupuesto te lo permite, sale vencedor en la batalla por sus prestaciones Taurus Mycook Touch (recuerda siempre mirar en la web oficial de Taurus su precio porque suelen tener ofertas). Como robot más económico el Aigostar Power Cook puede ser una excelente alternativa. Finalmente el Cecotec Mambo 10090 combina un precio contenido y muy buenas prestaciones, por lo que es un gran rival en la batalla por el podio.

Los robots de cocina más populares

Puede que te sorprenda la variedad de marcas y modelos con las que te encontrarás a la hora de decidir comprar un robot de cocina. Si no logras decidir o quieres entender mejor cómo funcionan, más abajo te dejamos una guía para elegir un robot de cocina que seguro te será muy útil.

En el listado de abajo verás los modelos de robots de cocina más vendidos en Amazon. En la esquina superior derecha puedes ver, si es que en este momento está en oferta, el porcentaje de descuento que tiene actualmente ese modelo. Ten en cuenta que el listado se actualiza diariamente y los precios pueden variar cada día, pero si ves una buena oferta aprovéchala porque no suelen durar mucho.

Robots de cocina de gama alta

Los robots de cocina de gama alta suelen tener también precios más elevados, aunque en algunos modelos están muy ajustados teniendo en cuenta sus características y funciones. En este caso tomamos como referencia un precio medio a partir de 300€. En ese rango de precios encontrarás modelos muy interesantes, que hacen prácticamente de todo lo que puedas imaginar:

Robots de cocina económicos

Si tu presupuesto es más ajustado pero no quieres prescindir de la ayuda que te aporta un robot de cocina echa un vistazo a este listado, porque hay modelos más que interesantes.

¿Qué es un robot de cocina?

Un robot de cocina es un electrodoméstico que automatiza algunos procesos y es capaz de llevar a cabo varios. Podríamos decir que es un aparato que reúne las funciones de varios: una batidora, una amasadora, una olla exprés, una yogurtera, una picadora… todo esto y algunas cosas más en un solo electrodoméstico multifunción.

Como hemos visto, pueden ser de dos tipos: una olla programable que cocina de diferentes modos pero no procesa los alimentos, o un procesador de alimentos que los procesa y también los cocina.

Guía para comprar el mejor robot de cocina

Veamos cuáles son las características más importantes que tienes que mirar para elegir el mejor robot de cocina.

Funciones del robot de cocina

Lo primero que tenemos que pensar es qué necesitamos que haga el robot. Teniendo en claro esto, podemos analizar las características y las funciones de cada modelo que nos interese. No siempre más es mejor, porque esto dependerá del uso que le daremos. Por ejemplo puede haber un robot con una función buenísima para hacer pan, pero si nunca hacemos pan casero de poco nos servirá.

Piensa en lo que necesitas tú de tu robot. ¿Necesitas dejarlo programado para que a una determinada hora esté lista la comida o para que esté caliente? Pues una olla programable como el Robot Superchef puede ser lo que te hace falta. ¿Quieres eliminar todos los demás electrodomésticos y hacer todo con uno solo? Entonces necesitarás un robot procesador con muchas funciones como el Cecotec Mambo 9590.

Facilidad de uso

Puedes mirar algunos vídeos, que suelen estar disponibles en las páginas de compra de cada producto, para ver cómo se usa el robot de cocina. Trata de escoger uno que además de tener las funciones que necesitas, no requiera muchas complicaciones a la hora de usarlo. Ten en cuenta por ejemplo los modelos que se pueden manejar a través de una app instalada en el móvil, que por ahí incluya ya recetas para facilitarte todavía más la tarea. Solo por poner un ejemplo, el Taurus Mycook Touch es un robot de cocina inteligente con wifi que se conecta a tu smartphone o tablet y envía recetas, crea la lista de la compra, recibe señales de fin de cocción, etc.

Recuerda asegurarte que la app del robot sea compatible con el sistema operativo de tu dispositivo.

Capacidad del robot

Está claro que no es lo mismo cocinar a diario para dos o para seis personas. Y el robot que escojas tiene que tener la capacidad que necesitas, ni más ni menos. Dependiendo de la receta, lo recomendable es un robot con un bol de 4-5 litros de capacidad para cocinar para 4 personas, donde podrás cocinar desde sopas y guisados hasta cocer garbanzos y otras legumbres.

Fácil de limpiar

El robot debe hacernos la vida más sencilla, también a la hora de lavarlo y limpiarlo. Controla entonces que las piezas sean fáciles de desmontar y lavar. Si tienes lavavajillas, es importante que las piezas se puedan meter en él para lavarlas y que no tengas que hacerlo a mano. Y fíjate que en el cuerpo del robot y en general en todas las partes que no se pueden desmontar, no haya huecos o zonas de difícil acceso que no puedan limpiarse bien con un paño.

Accesorios para robot de cocina

Más allá de la cantidad de accesorios que traiga tu robot, vamos a prestar atención a la calidad: cuchillas, varillas, ganchos de amasar, vasos, cestas para cocinar al vapor….lo ideal es que las piezas que sufren mayor desgaste sean de acero inoxidable y las que son de plástico, que sean robustas.

Otro detalle a tener en cuenta es la facilidad para encontrar repuestos de los accesorios y el costo. Si se te rompe alguna parte y luego te cuesta un patrimonio comprar una nueva o no la consigues, lo que puedas haberte ahorrado en la compra del robot no tendrá sentido.

Las opiniones sobre robots de cocina

Por último, poder leer la opinión y la experiencia de otras personas que han comprado el robot que tienes en mente es un modo muy práctico de hacerte una idea sobre el producto. Te aconsejamos leer unas cuantas, tanto positivas como negativas para poder formarte tu propia opinión.

¡Ya tienes toda la información que necesitas para elegir tu robot de cocina perfecto!

Algunos enlaces aquí publicados son de afiliados. No obstante los artículos recomendados responden a una decisión de criterio del equipo de Pequerecetas, no existiendo ningún incentivo por parte de las marcas."
https://www.pequerecetas.com/receta/flan-de-turron-postre/,"Flan de turrón blando o Jijona, ¡un postre casero de libro!",2021-11-23 11:12:48+01:00,"Hoy vamos a ver cómo hacer una receta de flan de turrón blando o flan de Jijona, con la que os chupareis los dedos y con el que triunfaréis esta Navidad, o bien daremos salida a esa tableta de turrón que se pierde en la despensa tras las fiestas y que no sabemos qué hacer con ellas.

Hacer flan casero es muy sencillo, no lleva mucho tiempo, y si lo hacéis con turrón, será uno de esos postres navideños con el que disfrutaréis en familia. También es buena opción para aprovechar los restos de turrón una vez pasadas las fiestas navideñas.

¿Queréis saber cómo se hace el flan con turrón del blando?

Receta de flan de turrón

Ingredientes

280 g turrón blando o turrón de Jijona

480 g nata líquida para montar (35% M.G.)

5 huevos grandes

5 cucharadas de azúcar

5 cucharadas de azúcar (para el caramelo)

Cómo hacer flan de turrón de Jijona

Preparamos la masa con turrón blando

Deshacemos el turrón blando con ayuda de un tenedor.

Batimos los huevos junto con el azúcar

Incorporamos el turrón que tendremos reservado, y con la batidora trituramos bien hasta que no queden trocitos de turrón y esté bien mezclada la masa.

Añadimos la nata y batimos para mezclar.

Precalentamos el horno a 180º, calor arriba y abajo.

Hacemos el caramelo para el flan casero

En un cazo pequeñito incorporamos 5 cucharadas de azúcar y derretimos a fuego fuerte.

Cuando empiece a tomar color, bajamos un poco el fuego.

Vamos moviendo el cazo hasta que el azúcar coja color dorado.

Vertemos el caramelo líquido en los moldes de flan y terminamos de rellenar con la mezcla del flan que tenemos reservada.

Horneado del flan de turrón

Llenamos de agua una bandeja grande con 3 dedos de agua e incorporamos las flaneras dentro para cocinarlas al Baño María

Horneamos aproximadamente 25 minutos.

Comprobad que están listos metiendo un palo de brocheta: si sale limpio, ya lo tenéis.

Cómo degustar el flan casero de turrón

Una vez estén listos, retiramos los flanes del horno y dejamos enfriar a temperatura ambiente. A continuación los llevamos a la nevera y dejamos enfriar durante toda la noche.

Al día siguiente, desmoldamos y decoramos con un poquito de turrón picado por encima.

Consejos para hacer flan de turrón blando

¿Qué tipo de turrón se usa en este flan?

En mi casa siempre hablamos de «turrón blando» o «turrón duro» , sin tener muy en cuenta las denominaciones de origen de estos productos, y supongo que en muchas casas pasa lo mismo, pero no está de más recordarlas:

o , sin tener muy en cuenta las denominaciones de origen de estos productos, y supongo que en muchas casas pasa lo mismo, pero no está de más recordarlas: El que llamamos «turrón blando» es el turrón de Jijona , mientras que el «turrón duro» que todos conocemos es el turrón de Alicante .

, mientras que el «turrón duro» que todos conocemos es el . El turrón de Jijona se elabora con almendras tostadas y miel, y es el que vamos a usar para esta receta de flan de turrón. Por razones obvias es el preferido cuando elaboramos otro tipo de recetas con turrón, como las que os enseñamos más abajo y que también os invitamos a probar: helado de turrón, tarta de turrón blando o mousse de turrón.

¿Se puede sustituir la nata?

Podéis sustituir la nata líquida para montar (crema de leche espesa) por leche, como más os guste. Si queréis conocer mi opinión, al hacerlos con nata quedan mucho más cremosos…

¿Qué tipo de moldes son mejores para el flan?

Veréis en la fotografía que hemos optado por utilizar moldes individuales desechables de este tipo .

. Si hacéis a menudo flan casero también podéis comprar moldes individuales de acero inoxidable como éstos . Así a la hora de servir el flan casero de turrón cada uno tiene su porción directamente, pero por supuesto esto queda a vuestro criterio.

. Así a la hora de servir el flan casero de turrón cada uno tiene su porción directamente, pero por supuesto esto queda a vuestro criterio. Si os gusta más, podéis hacer un flan grande utilizando un molde rectangular grande de este tipo, o incluso para darle más vistosidad, un molde redondo tipo Savarín como éste.

Otras recetas con turrón blando de Jijona

Si este flan de turrón blando te ha gustado, espera a ver estas otras recetas con turrón ¡te van a sorprender!

Panacota de turrón

Si quieres algo aún más ligero que el flan prueba la panacota de turrón.

Tarta de turrón navideña

También te recomendamos probar la tarta de turrón navideña que hemos preparado, tipo mousse y una delicia para los sentidos.

Mousse de turrón

Tampoco te puedes perder la mousse de turrón, porque te va a encantar, o la receta de helado de turrón casero, perfecta para finalizar una comida copiosa navideña.

Otras recetas con flan casero

Y si quieres experimentar con otras recetas de flan casero tienes que probar nuestra receta de flan de huevo casero, este flan de queso, que en este caso se prepara al horno con huevos y queso tierno, el flan de naranja, el flan de coco, este original flan de café, o el flan de leche condensada. Tampoco te pierdas el pudin de pan, similar a esta receta y también delicioso.

Algunos enlaces aquí publicados son de afiliados. No obstante los artículos recomendados responden a una decisión de criterio del equipo de Pequerecetas, no existiendo ningún incentivo por parte de las marcas."
