url,title,date,text
https://www.pequerecetas.com/menus-semanales-para-ninos/menu-semanal-diciembre-2021/,Menú semanal de DICIEMBRE (recetas invernales y navideñas),2021-11-27 20:07:19+01:00,"Cómo organizar el menú semanal

Os recordamos que si bien los menús están pensados para toda la familia, en el caso de que tengáis niños muy pequeños, es conveniente que hayan ya incluido todo tipo de alimentos en la alimentación. En algunos casos las recetas pueden llevar alcohol, tened presente que no se evapora completamente durante la cocción, queda una mínima parte. Por eso si queréis evitar del todo el uso de alcohol para cocinar, podéis o bien reemplazarlo en la mayoría de los casos para agua o caldo, o podéis directamente sustituir la receta por otra.

Os recordamos también que incluyendo alimentos de temporada en el menú comeremos bien gastando menos y de manera más sostenible.

Según la pirámide nutricional estas son las raciones semanales recomendadas de cada tipo de alimento:

Pescado 3-4 raciones

Carne 2-3 raciones (1 sola ración de carnes rojas)

Legumbres 2-3 raciones

Hidratos de carbono 1 ración diaria (pasta, arroz, patatas, pan y otros cereales)

Vegetales 2 raciones diarias

Fruta 3 o más raciones diarias

Lácteos de 2 a 4 raciones diarias

Como elaboramos nuestro menú siguiendo las raciones recomendadas de cada tipo de alimento, os sugerimos que si queréis modificarlo para adaptarlo a vuestros gustos, lo hagáis reemplazando los platos por otro de características nutricionales similares: pescado por pescado, legumbres por legumbres, etc.

En diciembre el invierno ya está en plena regla, por lo que hemos incluido en el menú platos de cuchara como sopas y cremas y varios guisos. Entre estos últimos nos quedamos con el pollo a la cerveza, las lentejas con arroz y las espinacas con garbanzos, solo por citar algunas.

Pero diciembre es el mes de la Navidad, así que más allá del menú semanal no podemos dejar de recomendaros las mejores recetas navideñas: para menús de Navidad y de Nochevieja os sugerimos los mejores aperitivos navideños, recetas de pescado para Navidad como plato principal, hasta los dulces típicos como el flan de turrón, los borrachuelos malagueños, las hojaldrinas, el turrón de yema tostada, el pan de Cádiz, los cortadillos de cidra, los almendrados, los carquinyolis, o los alfajores de almendra.

Para los que aman probar cosas nuevas en la web encontrarán también muchas recetas de Navidad de otros países, como las galletas nussecken, el vino caliente glühweim y los pretzels dulces con canela alemanes, o las hallacas venezolanas.

Os recordamos como siempre que para llevar un estilo de vida saludable, la buena alimentación va de la mano con el ejercicio físico. Caminatas, paseos en bicicleta, bailar y jugar con los peques, cualquier actividad que nos permita hacer un poco de movimiento cada día viene muy bien."
https://www.pequerecetas.com/receta/rodaballo-al-horno/,Rodaballo al horno con patatas y cebolla (receta tradicional),2021-11-25 21:27:56+01:00,"Hoy os enseñamos a preparar el rodaballo al horno con patatas, un plato delicioso ideal para cualquier comida de fiesta. Lo vamos a cocinar a la manera tradicional, en el horno con una cama de patatas y cebolla y un aliño de ajo, perejil, sal, pimienta, vino blanco y aceite de oliva virgen extra ¡exquisito!

El rodaballo es un pescado con forma de rombo aunque es casi circular, y plano, suele vivir en el fondo del mar, en la arena. El rodaballo salvaje tiene un precio muy elevado, pero ahora podemos encontrar en el mercado rodaballos criados en piscifactorías mucho más asequibles de precio y disponibles durante casi todo el año.

Es un pescado muy apreciado desde la Antigüedad, su carne es blanca, firme y muy sabrosa. Animaos a preparar en casa el rodaballo asado al horno porque es muy sencillo de hacer, incluso si no sois expertos en cocina.

Receta de rodaballo al horno

Ingredientes

1 rodaballo

4 patatas

2 cebollas

4 dientes de ajo

1 cucharadita de sal

Unos granos de pimienta negra

Perejil fresco

Aceite de oliva virgen extra

1 vasito de vino blanco

Cómo hacer rodaballo al horno con patatas panaderas y cebolla

Preparamos la cama de patatas y cebolla al horno

Pelamos y cortamos las patatas en rodajas

Hacemos igual con las cebollas

Ponemos las patatas y cebolla en una bandeja de horno, añadimos un poco de sal y aceite de oliva virgen extra

Cocinamos a 180º C unos 15 o 20 minutos, hasta que las patatas estén hechas.

Metemos el rodaballo al horno

Ponemos en el vaso de la batidora el vino, el perejil, la sal, la pimienta y los ajos, trituramos todo.

Sacamos las patatas del horno, ponemos encima el rodaballo y vertemos la mezcla por encima.

Volvemos a meter la bandeja en el horno otros 20 minutos.

Cómo servir el rodaballo al horno

Tan sólo nos queda servir este delicioso rodaballo al horno cortando una porción a cada comensal y acompañándolo con las patatas y la cebolla. El rodaballo al horno se debe consumir recién hecho, es como está más rico. ¡Una comida de lujo!

Consejos para hacer Rodaballo al horno

Cómo pedir que nos preparen el rodaballo en la pescadería

Pedid en la pescadería que os preparen el pescado para cocinar el rodaballo al horno, es decir que le hagan unos cortes en la superficie, pero sin llegar al fondo.

¿Qué tipo de vino blanco puedo usar en esta receta?

Podéis poner el vino blanco que más os guste, incluso si os ha quedado algún resto de cava, cuanto mejor sea el vino mejor estará el rodaballo.

¿Cuánto tiempo de horneado necesita el rodaballo?

Nosotros damos como orientación 20 minutos desde que metéis el rodaballo junto a las patatas y cebolla (recuerda que estas tienen que meterse antes para hacerse).

Tened cuidado con los tiempos de horneado, ya que si cocinamos en exceso el rodaballo , la carne puede quedar algo seca y sería una pena perder su jugosidad.

, la carne puede quedar algo seca y sería una pena perder su jugosidad. Si veis que vuestro rodaballo no es muy grande y necesita unos minutos de horneado menos sacadlo antes.

¿Cómo limpiar la piel y espinas del rodaballo una vez horneado?

El rodaballo tiene una espina central y muchas laterales, a la hora de servir, quitad las laterales cortando todo el extremo, luego en el plato es muy fácil que cada comensal retire la espina central.

tiene una espina central y muchas laterales, a la hora de servir, quitad las laterales cortando todo el extremo, luego en el plato es muy fácil que cada comensal retire la espina central. La piel de este pescado es muy gruesa, pero una vez hecho el rodaballo al horno , la piel se desprende muy fácil.

, la piel se desprende muy fácil. Si queréis hacer el rodaballo en filetes en lugar de entero os puede resultar interesante este vídeo donde se ve de forma muy clara cómo sacar los lomos del rodaballo.

Otras recetas de pescado al horno

Si tienes duda sobre la receta de pescado para Navidad que quieres servir, te recomendamos que eches un vistazo a nuestra recopilación, donde vas a poder ver muchas otras opciones, además de este delicioso rodaballo al horno: lubina al horno, el tradicional besugo al horno, y otro plato también tradicional como es el salmón al horno.

Y si prefieres los pescados en salsa prueba la merluza en salsa verde, o la merluza a la gallega, el lenguado Menier, o el salmón a la naranja. ¡Como verás tienes montones de opciones para preparar un delicioso pescado estas Navidades!"
https://www.pequerecetas.com/compras/envasadoras-al-vacio-analisis-opiniones/,"ENVASADORAS AL VACÍO, ¿cuáles son las mejores máquinas para envasar al vacío en casa?",2021-11-25 14:27:25+01:00,"¿Alguna vez te has planteado comprar una envasadora al vacío porque alguien que conoces la tiene y te habla maravillas de ella? Ya te adelantamos que se trata de un pequeño electrodoméstico al que sacarás mucho partido, y si al final te decides a comprarlo, te preguntarás cómo has podido vivir sin él hasta ahora.

Pero como toda decisión que requiere de una inversión, seguro que tienes dudas sobre cual es el mejor modelo dentro de las máquinas de envasar al vacío. Nosotros te despejamos esas dudas, y te animamos a aprovechar las ofertas que puntualmente hacen las mejores marcas, tanto en Black Friday, como en rebajas, o a lo largo del año en promociones puntuales.

Vamos a ver qué marcas y modelos de envasadoras al vacío son las más populares, y luego te diremos cuál son para nosotros las mejores.

¿Cuál es la mejor envasadora al vacío?

Envasadora al vacío Laica, nuestra ganadora

Nos quedamos con la envasadora al vacío Laica por varios motivos: está pensada para un uso intensivo, por lo que no tenemos que preocuparnos de «darle caña»; hace un doble sellado para mayor seguridad; tiene una excelente capacidad de aspiración, 20 litros por minuto, lo que significa que tarda menos y es más eficiente; y además incluye el tubo para contenedores, por lo que no solo se puede usar con bolsas, sino también con contenedores reutilizables, lo que resulta sin duda más ecológico.

Envasadora al vacío Bonsenkitchen

De la marca Bonsenkitchen nos quedamos con dos modelos muy económicos: la envasadora VS3801 y la envasadora Bonsenkitchen VS3750 , que por un precio muy contenido ofrecen la posibilidad de envasar alimentos húmedos y secos y vienen con bolsas y rollo de vacío incluidos. La primera además cuenta con tubo para contenedores.

Envasadora al vacío Foodsaver

Entre las varias opciones que ofrece esta marca hemos seleccionado la envasadora Foodsaver FFS017X porque tiene función especial para marinado que permite que los jugos penetren en profundidad en las carnes y pescados, porque incluye el tubo para recipientes y porque tiene también función de solo sellado.

1.621 Opiniones FoodSaver Envasadora al Vacío con un Cutter Incorporado, Funciones «solo sellado»,… Mantiene los alimentos frescos durante hasta cinco veces más tiempo gracias a la tecnología de…

Ahorro de dinero: conservar mejor los alimentos reduce el desperdicio, lo que ayuda a no tirar…

Envasadora al vacío Cecotec

No hace falta ya hablar de la popularidad de la marca Cecotec que es garantía de excelente relación calidad-precio en todos sus productos. Las envasadoras SealVac 120 y SealVac 140 tienen una excelente capacidad de succión que permite envasar al vacío de forma automática en 10 segundos. El rollo incorporado y el cúter permiten adaptar el tamaño de las bolsas para no desperdiciar, y además se pueden usar con bolsas genéricas de hasta 30 cm. Ambos modelos incluyen el tubo de vacío para envases genéricos.

Es muy interesante la posibilidad de cocinar al vacío combinando la envasadora con el robot de cocina Mambo Cecotec, podéis verlo muy bien en el vídeo.

La diferencia entre el modelo 120 y 140 es básicamente su potencia: 120 y 140 W.

Envasadora al vacío KitchenBoss

La envasadora al vacío KitchenBoss es una máquina compacta y pequeña pero con buena capacidad de succión. Incluye rollo y bolsas, pero no tiene espacio interno para alojar el rollo ni cúter. También trae tubo de succión para contenedores, y combinándola con el roner KitchenBoss podemos cocinar a baja temperatura.

Envasadoras al vacío portátiles

Hasta ahora hemos visto un tipo de envasadora que además de aspirar el aire, sellan. Pero existe otro tipo, las envasadoras al vacío portátiles o de mano, que son más pequeñas y se utilizan de otro modo, con bolsas especiales con un círculo de absorción, algo parecido a las grandes bolsas que se venden para guardar edredones ahorrando espacio, y se usan con la aspiradora.

Ten en cuenta que este tipo de envasadoras extraen menos aire, por lo que pueden alargar el tiempo de vida de los alimentos a aproximadamente el doble, mientras que las clásicas máquinas más grandes lo alargar cinco o más veces.

Nuestro TOP ganador en envasadoras al vacío

La envasadora al vacío más completa

Como hemos dicho antes, nuestra elección recae sobre la envasadora al vacío Laica y ya hemos citado algunos de los motivos: está pensada para un uso intensivo; hace un doble sellado para mayor seguridad; tiene una excelente capacidad de aspiración, 20 litros por minuto, gracias a su bomba de aspiración doble; se puede regular la potencia de aspiración para no dañar los alimentos más frágiles; incluye 3 tipos de sellados: seco, húmedo y con líquidos.

Es la envasadora más costosa, pero si tienes la posibilidad de hacer esta inversión tendrás sin duda un producto de gran calidad, con una valoración de 4,4 sobre 5 en más de 1300 valoraciones positivas.

Mejor envasadora de vacío relación calidad-precio

Teniendo en cuenta lo que ofrece en relación al precio nos quedamos con la envasadora Foodsaver FFS017X que incluye todo lo básico que necesitamos en una envasadora: espacio interno para el rollo y cúter para cortar las bolsas; función de solo sellado, alimentos húmedos/secos y marinados: tubo de succión para contenedores y viene con rollo, bolsas pequeñas y grandes y tipo zip.

La máquina de envasar al vacío más compacta

Como hemos dicho la envasadora al vacío KitchenBoss es una máquina compacta y pequeña y por ese motivo no tiene espacio interno para alojar el rollo ni cúter, pero tiene una buena capacidad de succión y las mismas funciones que las envasadoras de mayor tamaño.

Otras opciones de envasadoras al vacío domésticas

También nos parecen opciones interesantes la y . De ambas os hemos hablado anteriormente, son dos muy buenas máquinas con una excelente relación calidad-precio y muy buenas valoraciones por parte de los compradores.

Las envasadoras al vacío más populares con descuento

Si quieres saber cuáles son las envasadoras al vacío en oferta en este momento, no te pierdas esta tabla que se actualiza periódicamente. En el ángulo superior derecho puedes ver el porcentaje de descuento actual del producto.

¿Qué tipo de bolsas y accesorios hay para envasar al vacío?

Podemos decir que a grandes rasgos hay 3 tipos de bolsas y accesorios para envasar:

ROLLOS: con los rollos puedes hacer tus propias bolsas del tamaño que necesites . Simplemente se sella un lado para crear la bolsa, se mete el alimento, se corta dejando algunos centímetros de margen para que la bolsa pueda llegar hasta la bomba de aspiración interna de la envasadora, se sella y se corta el excedente. Las mejoras envasadoras cuentan con un espacio interno donde alojar el rollo, y con un cúter para cortar cómodamente las bolsas.

con los rollos puedes hacer . Simplemente se sella un lado para crear la bolsa, se mete el alimento, se corta dejando algunos centímetros de margen para que la bolsa pueda llegar hasta la bomba de aspiración interna de la envasadora, se sella y se corta el excedente. Las mejoras envasadoras cuentan con un espacio interno donde alojar el rollo, y con un cúter para cortar cómodamente las bolsas. BOLSAS: también puedes usar bolsas ya hechas de diferentes dimensiones. Resulta menos práctico, al menos que no envases siempre los mismos alimentos y entonces sepas que necesitas un tamaño de bolsa en particular.

también puedes usar bolsas ya hechas de diferentes dimensiones. Resulta menos práctico, al menos que no envases siempre los mismos alimentos y entonces sepas que necesitas un tamaño de bolsa en particular. RECIPIENTES PARA ENVASADO AL VACÍO: este tipo de recipientes tienen una tapa especial que permite insertar el tubo de vaciado que traen la mayoría de las máquinas y aspirar el aire en el interior. Tienen dos grandes ventajas y una desventaja: las ventajas es que se lavan y reutilizan como cualquier contenedor, y por lo tanto son más ecológicos que las bolsas, y son más apropiados para envasar alimentos líquidos. La desventaja es que ocupan más lugar.

¿Qué debo de tener en cuenta al comprar una máquina de envasar al vacío?

A la hora de comprar una envasadora al vacío presta atención a estos detalles:

Capacidad de aspiración

La potencia de una envasadora se mide claro está en W y suele ser de entre 100 y 150, pero lo que realmente interesa es cuánto es potente aspirando. Te recomendamos que escojas una que aspire por lo menos 10 l de aire por minuto.

Sistema de sellado

Lo ideal es el sellado térmico, es decir que la máquina selle la bolsa con calor luego de aspirar el aire. Y ya que estamos que también corte, para no tener que hacerlo nosotros con unas tijeras.

Versatilidad

Escoge una envasadora que además de envasar al vacío en bolsas, incluya un tubo para contenedores, lo que permite usar también envases especiales para envasar al vacío e incluso se puede poner en el pico de las botellas de vino.

Tamaño de la envasadora

Todo depende claro está del espacio con el que contamos en casa. También podemos tener en cuenta que una envasadora compacta y portátil se puede llevar fácilmente a cualquier parte si nos hace falta.

Bolsas para envasadora al vacío

Además de fijarnos en las características de la máquina, es importante comprobar que las bolsas que usa sean fáciles de encontrar y económicas, lo mejor es que la máquina sea versátil y permita el uso de diferentes marcas.

¿Cómo envasar al vacío?

El funcionamiento de las máquinas para envasar al vacío suele ser muy sencillo, no obstante es importante que leamos bien las instrucciones de funcionamiento, porque equivocarnos en algún paso puede significar que los alimentos no queden bien envasados y se estropeen.

En líneas generales debemos:

Preparar los alimentos de manera correcta : limpios y secos, sin partes arruinadas en el caso de la fruta y la verdura, las carnes desgrasadas, cortado en trozos si es así que lo usaremos luego, sazonados si vamos a cocinarlos directamente envasados.

: limpios y secos, sin partes arruinadas en el caso de la fruta y la verdura, las carnes desgrasadas, cortado en trozos si es así que lo usaremos luego, sazonados si vamos a cocinarlos directamente envasados. Utiliza bolsas o envases adecuados: comprueba que las bolsas o envases que usarás sean compatibles con tu máquina, y utiliza el tipo de envase sugerido por la marca. Por ejemplo algunas envasadoras no envasan bien los alimentos con líquidos en bolsas, y es necesario usar contenedores.

comprueba que las bolsas o envases que usarás sean compatibles con tu máquina, y utiliza el tipo de envase sugerido por la marca. Por ejemplo algunas envasadoras no envasan bien los alimentos con líquidos en bolsas, y es necesario usar contenedores. Deja el espacio vacío indicado: para que la bomba de succión pueda hacer su trabajo, la bolsa debe llegar cómodamente hasta ella. Por eso cada modelo te indica el espacio libre que debes dejar al cortar la bolsa, aunque te parezca mucho, respétalo.

para que la bomba de succión pueda hacer su trabajo, la bolsa debe llegar cómodamente hasta ella. Por eso cada modelo te indica el espacio libre que debes dejar al cortar la bolsa, aunque te parezca mucho, respétalo. Coloca la bolsa en la envasadora y acciónala: una vez que has introducido los alimentos, coloca la bolsa en la máquina, ciérrala y pulsa el botón indicado según el tipo de alimento. Espera a que haya terminado (si es automática se detiene sola) y retira la bolsa.

¿Qué alimentos se pueden envasar al vacío?

El envasado al vacío aumenta la duración de los alimentos, en líneas generales duran 5 veces más. Pero recuerda que el envasado al vacío no reemplaza el método de conservación adecuado para cada alimento: es decir que un alimento que normalmente se conserva en el frigorífico, debe seguir siendo conservado así. De este modo, por ejemplo los quesos, embutidos, platos cocinados, carnes, etc., durarán más tiempo y conservarán intactas sus propiedades.

Si en cambio envasamos alimentos secos de despensa, pues seguiremos guardándolos allí. Frutos secos, cereales, snacks, galletas, se conservan crujientes y frescos, evitando que se humedezcan una vez abiertos como suele suceder.

Si vamos a cocinar los alimentos envasados al vacío debemos envasarlos ya sazonados, y comprobar que las bolsas sean aptas para la cocción.

Ten en cuenta que algunos tipos de alimentos, como la coliflor, el brócoli, la col y las setas no se conservan bien con este método, porque desprenden gases que los estropean.

¿Cuánto tiempo se conservan los alimentos envasados al vacío?

Extrayendo el aire el proceso de oxidación de los alimentos se vuelve mucho más lento. Según el tipo de alimento, su vida útil se puede alargar hasta 8 veces más.

Por poner algunos ejemplos, la carne congelada pasa de 3 a 12-20 meses; el pescado congelado de 5 a 12 meses; las galletas de 8 meses a 18-24 meses. Las envasadoras también se pueden utilizar para conservar bebidas que se deterioran rápidamente, como los zumos y los batidos o el vino: algunos modelos incorporan un tapón especial para botellas de vino que permite sacar el aire del interior para que no se oxide una vez abierto.

¿Merece la pena tener una máquina de envasar al vacío en casa?

La respuesta corta y rápida es SÍ, merece mucho la pena contar con una máquina para envasar al vacío en casa, mi opinión al menos es que merece la pena esa inversión.

La razón fundamental es que las envasadoras al vacío nos permitirán conservar mejor los alimentos, evitando que nuestra comida se estropee y tengamos que tirarla. Seguro que os ha pasado alguna vez, compras carne, pescado o pollo pensando que lo vas a consumir al día siguiente, pero te surgen cosas que retrasan su consumo, y cuando vas a echar mano, ha pasado su fecha de caducidad, y con todo el pesar del mundo tienes que tirar ese alimento, algo que a mí me duele en el alma…

Por eso, si estás dudando sobre las ventajas de tener una envasadora al vacío doméstica te las resumimos:

Conservarás más tiempo los alimentos tanto en el frigorífico como en el congelador, multiplicando su fecha de caducidad y además conservando su sabor y textura

tanto en el frigorífico como en el congelador, multiplicando su fecha de caducidad y además conservando su Ahorrarás dinero al evitar el desperdicio de alimentos y al poder comprar alimentos frescos en oferta

al evitar el desperdicio de alimentos y al poder comprar alimentos frescos en oferta Ahorrarás tiempo ya que tendrás que ir menos a comprar y envasar tanto alimentos crudos como cocinados y consumirlos más adelante (no os perdáis nuestro artículo sobre el batch cooking para cocinar un día para toda la semana)

ya que tendrás que ir y envasar tanto y consumirlos más adelante (no os perdáis nuestro artículo sobre el para cocinar un día para toda la semana) Evitarás que los alimentos como embutidos y quesos se sequen

Ahorrarás espacio en el frigo y el congelador al reducir el tamaño de los alimentos

en el frigo y el congelador al reducir el tamaño de los alimentos E incluso puedes marinar y te puedes lanzar al mundo del cocinado a baja temperatura o sous vide a nivel casero (si tienes un robot de cocina con esa función o un roner de este tipo)

¿Y vale cualquier envasadora al vacío del mercado? Hombre valer, valen, pero está claro que la relación calidad-precio en cualquier electrodoméstico se nota. Nuestra recomendación es, dentro de nuestro presupuesto, no optar por la más barata, sino tener en cuenta una serie de puntos como la potencia y capacidad de aspiración, la posibilidad de envasar al vacío tanto alimentos secos como líquidos (guisos, sopa o salsa), el sellado, y otros puntos que te hemos detallado arriba.

Estamos seguros que con toda la información que os hemos traído os ayudará a escoger vuestra próxima envasadora ¡y sacarle mucho partido!

Algunos enlaces aquí publicados son de afiliados. No obstante los artículos recomendados responden a una decisión de criterio del equipo de Pequerecetas, no existiendo ningún incentivo por parte de las marcas."
