url,title,date,text
https://www.pequerecetas.com/receta/triangulos-avellanas-chocolate-nussecken/,Triángulos de avellanas y chocolate (galletas Nussecken alemanas navideñas),2021-11-18 16:10:31+01:00,"Estos triángulos de avellanas y chocolate son una de las galletas navideñas más tradicionales en Alemania, donde se conocen como Nussecken. Literalmente, significa esquinas de nueces debido a su forma triangular y a su cobertura que suele ser con una mezcla de avellanas y almendras.

Además llevan un relleno de mermelada de melocotón o albaricoque, y por si fuera poco les damos un baño de chocolate, una combinación de sabores que las hace irresistibles.

Aunque parezcan complicadas y con muchos pasos, se llena toda la bandeja del horno con la masa con lo que dependiendo del tamaño que las cortéis os darán unas 30 o 40 galletas, ideal para una merienda con amigos o familia, o bien guardadas para tomarnos una cada día (¡si podéis resistir!) para la merienda.

Receta de galletas Nussecken navideñas

Ingredientes

Para la masa

250 g de harina

1/2 cucharadita de levadura química o polvos de hornear (la puedes comprar aquí)

80 g de azúcar

1 cucharada de azúcar de vainilla

1 pizca de sal

1 huevo

125 g de mantequilla o margarina

Para el relleno

3 cucharadas de confitura o mermelada de melocotón o albaricoque

Para la cobertura

4 cucharadas de agua

2 cucharadas de miel

100 g de azúcar

100 g de mantequilla

1 pizca de sal

200 g de avellanas molidas

200 g de almendras picadas

Para decorar

100 g de cobertura de chocolate (aquí veis como poder hacerla o podéis comprarla p.ej. aquí)

Cómo hacer galletas alemanas de Navidad (Nussecken)

Preparamos la masa de las galletas

Precalentamos el horno a 200°C (arriba y abajo). Con un poco de mantequilla o margarina engrasamos bien la bandeja del horno y espolvoreamos una capa de harina.

Añadimos poco a poco y vamos batiendo con una batidora de varillas la mantequilla, el azúcar, el huevo, el polvo de hornear (o levadura química), el azúcar de vainilla, la sal y la harina hasta formar una masa.

la mantequilla, el azúcar, el huevo, el polvo de hornear (o levadura química), el azúcar de vainilla, la sal y la harina hasta formar una masa. Con las manos formamos una bola con la masa y envuelta en papel transparente la enfriamos durante media hora en el frigorífico.

Hacemos la cobertura

En ese tiempo preparamos la cobertura y para ello calentamos una cacerola y mezclamos la mantequilla con el azúcar, la miel, la sal y el agua.

Añadimos y mezclamos bien las avellanas molidas y las almendras picadas, retiramos la cacerola del fuego y dejamos enfriar.

Damos forma a las galletas

Una vez pasada la media hora sacamos la masa del frigorífico y la alisamos cubriendo toda la bandeja e intentando que tenga el mismo grosor por todas partes. Si la masa está muy pegajosa, podemos añadirle un poco de harina y antes de alisarla podemos poner papel transparente por encima de la masa para que no se nos pegue al rodillo.

Con un tenedor pinchamos la masa por varios puntos, esto es para evitar que se formen burbujas al hornear.

Seguidamente repartimos la mermelada por toda la masa y finalmente repartimos bien la cobertura de avellanas y almendras por encima.

Horneamos las galletas Nussecken

Horneamos la masa durante 25 minutos a 200° con calor arriba y abajo.

Una vez horneada la dejamos enfriar durante unos 10-15 minutos.

Damos forma de triángulo a las galletas

Para hacer los triángulos de avellanas y chocolate cortamos la masa en tiras de unos 5cm de ancho, después en cuadrados y finalmente en triángulos.

cortamos la masa en tiras de unos 5cm de ancho, después en cuadrados y finalmente en triángulos. Podéis hacer los triángulos del tamaño que queráis, según eso os saldrán más o menos galletas.

Derretimos la cobertura de chocolate y mojamos las dos esquinas de los triángulos en el chocolate, los dejamos secar y ya están listos para comer.

Consejos para hacer galletas navideñas Nussecken

¿Se pueden guardar los Nussecken o triángulos de avellanas y chocolate?

Sí, guardándolas en una caja de galletas en un lugar fresco y oscuro. Idealmente, cubrimos el fondo de la caja con galletas, ponemos papel de hornear por encima y vamos creando distintos pisos con papel de hornear entre medio. De esta forma, nos aguantarán unas 3 o 4 semanas.

¿Se pueden congelar las galletas?

Si sois capaces de resistir la tentación de no comer las galletas recién salidas del horno, o guardarlas en una caja de galletas para ir sacándolas poco a poco, sí, también se pueden congelar. Para ello, una vez las sacas del horno y se enfrían, las puedes guardar en una bolsa de congelación en el congelador. Para descongelar, las dejamos en el frigorífico durante al menos una noche y luego a temperatura ambiente.

Otras recetas de galletas navideñas alemanas

Si te han gustado estos triángulos de avellana y chocolate, puedes probar otras recetas de galletas de Navidad alemanas que ya os hemos enseñado como las galletas Linzer, las galletas Spekulatius o las deliciosas Vanillekipferl

Y si quieres seguir preparando galletas navideñas, además de las tradicionales galletas de jengibre, no dejes de probar estas recetas, porque te van a encantar:

Algunos enlaces aquí publicados son de afiliados. No obstante los artículos recomendados responden a una decisión de criterio del equipo de Pequerecetas, no existiendo ningún incentivo por parte de las marcas."
https://www.pequerecetas.com/receta/pastel-de-pescado-4-recetas/,"Pastel de pescado (9 recetas fáciles al horno, frío, o con microondas)",2021-11-18 12:33:15+01:00,"El pastel de pescado es una forma estupenda de cocinar este ingrediente que nos puede solucionar muchos problemas.

Los pasteles fríos de pescado por ejemplo, son perfectos para tenerlos preparados con antelación en cualquier tipo de celebración o reunión familiar. Los puedes dejar hechos el día anterior y metidos en el frigorífico y en el momento de servirlos acompañarlos con alguna mayonesa casera o salsa similar.

Por otro lado un pastel de pescado al horno es una receta infalible para todos aquellos poco aficionados como los peques, ya que al ser texturas en las que no encontrarán espinas y su sabor queda suavizado por natas y otras salsas. También perfectos para dejarlos preparados y unos momentos antes de servirlo darles un golpe de horno.

Hoy vamos a ver siete recetas fáciles de pastel con pescado que os recomendamos que guardéis bien porque las vais a utilizar a menudo.

Recetas de pastel de pescado al horno

Pastel de merluza al horno

Merluza, queso y huevos son los ingredientes principales de este plato que se prepara en un abrir y cerrar de ojos. Si buscáis una receta para una cena rápida, ¡aquí tenéis la solución!

El pastel de merluza puede prepararse de manera tradicional o en Thermomix ¡y sabe buenísimo!

Pastel de atún al horno

Una receta facilísima de hacer y lo mejor es que se trata de un pastel de pescado que podemos tomar caliente o frío. Mira la receta paso a paso de este pastel de atún al horno:

Pastel de cabracho

El pastel de cabracho es una receta perfecta para Navidad. El cabracho es un pescado de carne suave y delicada, que al prepararse en forma de pastel conseguimos disfrutar evitando sus molestas espinas.

Pastel de pescado al microondas

El microondas también puede ser un buen aliado en la cocina para preparar estos pasteles de pescado. Prueba por ejemplo el pastel de atún con tomate en microondas y verás qué resultado más bueno

Pastel de pescado frío sin horno

El pastel de salmón es un plato riquísimo y muy fácil de preparar. Tan pero tan fácil que ¡no necesita horno!

Como sabéis, el salmón aporta Omega3, sumamente importante en la alimentación infantil. Así que ¡no dudéis en preparar esta nutritiva receta de pastel de salmón y langostinos!

Recetas de pasteles de pescado en pan de molde

Pastel de salmón ahumado en pan de molde

¿A que se ve apetitoso este pastel de salmón ahumado con pan de molde? Con tantos colores, llamará la atención de los peques sin lugar a dudas.

Aunque no lo creáis, para preparar esta receta tampoco necesitaréis horno sino tan sólo pan de molde, mayonesa, atún, salmón ahumado, tomate, huevos duros, remolachas y aceitunas. Mmm, se me hace agua la boca.

Pastel de atún en pan de molde

Otra versión del pastel de arriba es este pastel de atún en pan de molde, perfecto para tenerlo como aperitivo en cualquier celebración.

Pastel de pescado al horno para niños

Con una bonita presentación, este pastel de pescado con puré de patatas hará las delicias de cualquier niño."
https://www.pequerecetas.com/receta/gluhwein-vino-caliente-aleman-navidad/,Cómo hacer Glühwein (vino caliente alemán navideño),2021-11-17 13:41:50+01:00,"El Glühwein es un vino caliente y especiado típico de la Navidad en Alemania, aunque en realidad existen recetas similares en otros países. Un buen vino tinto y especias como el laurel, la canela, el cardamomo, el anís, el clavo y la nuez moscada, con un toque cítrico de naranja y limón y un poco de azúcar, son los ingredientes de esta receta de vino caliente alemán que perfuma como la Navidad.

Una bebida reconfortante que los mayores pueden disfrutar durante las fiestas, reunidos en familia mientras los peques juegan y disfrutan de los regalos navideños. Os vamos a contar cómo hacer vino caliente alemán navideño o Glühwein, pero también os daremos algunos consejos y os contaremos algunas curiosidades sobre esta bebida al final de la receta, ¡no os perdáis ningún detalle!

Receta de Glühwein

Ingredientes para Glühwein

Para 4 copas

1/2 litro de un buen vino tinto

50 g de azúcar moreno

1 hoja de laurel (puedes comprar aquí)

1 anís estrellado + algunos para decorar (puedes comprar aquí)

3 clavos de olor + algunos para decorar (puedes comprar aquí)

1 rama de canela (puedes comprar aquí)

1 pizca de nuez moscada (puedes comprar aquí)

2 vainas de cardamomo (puedes comprar aquí)

Medio limón biológico

1 naranja biológica

Cómo hacer Glühwein (vino caliente especiado)

Preparamos los aromáticos

Lavamos bien el limón y la naranja, cortamos en rebanadas el medio limón y la naranja, de la que reservaremos la mitad para decorar. Si prefieres un gusto cítrico menos intenso puedes pelar el limón y la naranja procurando coger lo menos posible de la parte blanca, que es amarga.

En una cacerola ponemos todas las especias (laurel, anís, canela, clavo, nuez moscada y cardamomo), el limón y la naranja (o la piel) junto con el azúcar y llevamos al fuego suave, removiendo un poco, hasta que comencemos a percibir que las especias están soltando su aroma.

Preparación del vino caliente especiado

Incorporamos un chorro de vino, lo suficiente para mojar el azúcar, y seguimos removiendo hasta que veamos que el azúcar está disuelta. Ahora sí añadimos el resto del vino, y con el fuego bien suave, porque no queremos que llegue nunca a hervir, dejamos que se caliente y el vino coja los aromas durante 30 minutos, removiendo de vez en cuando.

Probamos y si hace falta y así lo preferimos añadimos un poco más de azúcar, removiendo para que se disuelva bien.

Cómo servir el Glühwein

Servimos inmediatamente, colando el vino especiado y sirviéndolo en vasos o tazas. Decoramos los vasos con rodajas de naranja, a las que podemos clavarles algunos clavos de olor sobre el borde, y un anís estrellado. También se puede decorar con una ramita de canela, o dejarlo tal cual sin decoración, el sabor no cambiará.

El Glühwein se puede preparar también con antelación. En ese caso dejamos que el vino se enfríe en la cacerola, luego lo colamos y lo pasamos a una botella o una jarra con tapa, y reservamos en la nevera como máximo dos días. Al momento de servir lo calentamos.

Con qué acompañar el vino caliente alemán

Para acompañar este vino dulce y especiado nada mejor que algunos dulces típicos navideños. Podemos optar por alguna receta tradicional de países centroeuropeos como los pretzels dulces con azúcar y canela, las galletas Speculoos, los Lussekatter o bollos suecos de Santa Lucía, o las Vanillekipferl, unas galletas de vainilla y almendras.

Pero claro está que también le sentarán de maravilla otros dulces más españoles como los almendrados, los carquinyolis, los alfajores de almendra, los cortadillos de cidra o el pan de Cádiz…¿o por qué no una casita de jengibre?

Curiosidades sobre el vino caliente de Navidad

Como decíamos, la tradición del vino caliente especiado es común a muchos países europeos: vin brulé en Italia, gløgg o glögg en algunos países escandinavos y muchos nombres más, incluso aquí en España tenemos el vi calent catalán o el vin cao aragonés, solo por citar algunos.

Ya en época romana se bebía el vino caliente y condimentado, y se le conocía como conditum o piperatum. Pero solo a partir de finales del siglo XIX se comenzó a asociar esta bebida al periodo navideño, y hoy en día es muy común encontrarlo en mercadillos de Navidad de casi toda Europa.

Esperamos que os haya gustado esta receta, no dejéis de probar otras bebidas típicas de la Navidad y el invierno como el ponche de huevo, el rompope mexicano y el chocolate a la taza.

Algunos enlaces aquí publicados son de afiliados. No obstante los artículos recomendados responden a una decisión de criterio del equipo de Pequerecetas, no existiendo ningún incentivo por parte de las marcas."
https://www.pequerecetas.com/receta/arroz-con-carabineros/,Arroz con carabineros (tienes que probar esta receta),2021-11-15 10:11:49+01:00,"Si te gustan los arroces tradicionales, este arroz con carabineros te va a encantar, porque tiene un sabor difícil de superar, que viene dado por el protagonista del plato, el carabinero.

El carabinero se pesca fundamentalmente en el sur de la Península Ibérica, y, aunque está delicioso cocinado simplemente a la plancha con sal disfrutando de su intenso sabor, tiene otros usos culinarios, como este espectacular arroz meloso con carabineros que vamos a cocinar hoy.

El secreto del sabor de este arroz está en preparar un buen fumet con las cáscaras y las cabezas de los carabineros, de las que extraeremos su coral, estrujando bien para aprovechar al máximo sus jugos, que son los que le aportarán ese sabor tan particular.

¿Preparados para hacer esta receta de arroz de carabineros…?

Receta de arroz con carabineros

Ingredientes (para 4 personas)

8 carabineros

350 g de arroz bomba o similar

Unas hebras de azafrán

125 g de salsa de tomate

100 ml de vino blanco

1 cebolla

2 tomates

1 diente de ajo

Aceite de oliva virgen extra

Sal

Perejil

1,5-2 l de agua

Cómo hacer arroz meloso con carabineros

Pelamos los carabineros

Para este arroz hemos utilizado carabineros de tamaño mediano, porque los grandes son más apropiados para disfrutarlos a la plancha. Hemos utilizado ocho, y su peso es de aproximadamente 250 g.

Pelamos cuatro carabineros, reservando las cáscaras.

Las cabezas las estrujamos bien apretando con las manos y reservando el coral de la cabeza, que reservamos porque utilizaremos luego.

Los otros 4 carabineros los pelamos dejando la cabeza y las colas para adornar el arroz.

Hacemos el fumet de carabineros

Cortamos la cebolla y el ajo de forma gruesa y salteamos en una cacerola con un chorro de aceite de oliva.

Cortamos el tomate en trozos y le quitamos las pepitas. Nosotros hemos usado tomate entero de lata, que ya viene sin piel.

Salteamos todo unos minutos a fuego medio.

Añadimos las cáscaras de los carabineros, y salteamos, aplastando bien para que suelten todo el jugo.

Dejamos que se salteen junto a la verdura unos minutos.

Añadimos de un litro y medio a dos litros de agua, echamos una pizca de sal y dejamos que se cueza tapado durante media hora.

Cuando finalice la cocción colamos bien el caldo y reservamos.

Salteamos los carabineros

En la cazuela que vayamos a preparar el arroz ponemos un poco de aceite y cuando esté caliente colocamos los carabineros, tanto los pelados como los que están con la cabeza y cola.

Cocinamos un minuto por cada lado. Es importante no pasarnos ya que luego se cocinarán al final de la cocción con el arroz.

Reservamos.

En la misma cazuela donde hemos hecho los carabineros, ponemos la salsa de tomate.

Añadimos los corales de las cabezas que habíamos reservado.

Echamos también unas hebras de azafrán.

Dejamos cocinar a fuego medio un par de minutos.

Cocinamos el arroz

Ha llegado el momento de añadir el arroz bomba. Mezclamos con la salsa de tomate.

Añadimos el vino blanco y dejamos que se evapore el alcohol unos minutos.

Salamos ligeramente al gusto. Es mejor añadir más sal luego si vemos que el fumet lo necesita.

Añadimos el fumet de carabineros caliente que teníamos reservado.

Dejamos que cueza a fuego medio durante 15 minutos

Añadimos los carabineros

Pasados los 15 minutos, probamos el punto del arroz, que todavía debe estar ligeramente entero, y aprovechamos para rectificar de sal si fuera necesario.

Añadimos los carabineros pelados y dejamos que se cuezan con el arroz durante otros 4 minutos.

En el último minuto añadimos los carabineros con la cabeza sobre el arroz.

Espolvoreamos perejil picado y servimos inmediatamente.

Consejos para hacer el mejor arroz con carabineros

¿Cuál es el mejor arroz para esta receta?

Este tipo de platos necesitan un arroz de grano redondo corto. Para el arroz con carabineros y otros similares la mejor variedad es el arroz bomba, que, aunque es de origen indio, se cultiva en la Península Ibérica desde la Edad Media, utilizándose sobre todo para paellas y arroces caldosos.

El arroz bomba absorbe mucho el caldo y los sabores del fumet, pero no se pega al fondo del recipiente, y tiene menos tendencia a abrirse durante la cocción, manteniendo su forma, gracias a que sus granos se comportan como un acordeón.

Dentro del arroz bomba, hay variedades muy apreciadas, como el de Calasparra, con denominación de origen.

Los carabineros

El carabinero es un crustáceo de aspecto similar a la gamba y los langostinos, pero más grande y de color rojo intenso. Puede alcanzar los 30 cm, pero para los arroces es mejor utilizarlos de tamaño mediano, dejando los más grandes para cocinarlos a la plancha, ya que en este caso lo que le aporta el carabinero sobre todo es el sabor con las cáscaras y las cabezas con sus corales al fumet.

Es importante extraer bien los jugos de las cabezas, apretando con las manos y reservando los corales. También es necesario aplastar las cáscaras cuando las estemos cocinando para el fumet.

Como podéis ver este arroz en realidad lleva muy pocos ingredientes, y todo el sabor se lo aportan los carabineros con el fumet.

¿Arroz meloso o arroz caldoso con carabinero?

Pues esto ya es cuestión de gustos, porque están todos muy ricos. A mi personalmente me gusta más la textura melosa del arroz, y hay quien lo prefiere más caldoso.

Si quieres un arroz meloso para la cantidad de arroz que te hemos dado debes utilizar un litro y medio de fumet y si te gusta más caldoso puedes añadir hasta dos litros de fumet.

Cómo degustar el arroz con carabineros

Sirve el arroz con carabineros en cada plato acompañado de un carabinero con cabeza. Y lo único que resta es disfrutar de este delicioso plato, que seguro que incluís en vuestro recetario familiar.

Es cierto que se trata de un marisco caro, pero si tenéis la oportunidad merece la pena prepararlo en días especiales para lucirse.

Si te gustan este tipo de recetas de arroz no dejes de probar el arroz con bogavante, un clásico plato que está entre el top de los platos mediterráneos.

También son reseñables el arroz negro, el arroz al horno valenciano, el arroz con conejo, el arroz caldoso con pollo, el arroz del señoret, o el arroz a banda sin olvidarnos por supuesto de nuestra afamada paella valenciana."
