url,title,date,text
https://www.pequerecetas.com/compras/cafeteras-de-capsulas-oferta/,Las mejores CAFETERAS DE CÁPSULAS (para regalar o regalarte),2021-11-19 15:59:38+01:00,"Si llevas tiempo soñando con una cafetera de cápsulas para poder tomarte tu café favorito por la mañana, ha llegado el momento de que atiendas a las ofertas que este Black Friday están ya haciendo las mejores marcas de cafeteras.

¿Qué cafetera de cápsulas es mejor?

Abajo te explicamos con detalle las ventajas y desventajas de cada sistema, pero podríamos resumirlos así:

Si eres muy cafetero y te gustan los cafés de mucha calidad, y no te importa pagar un poco más por cada café, elige una cafetera Nespresso . Como alternativa también enfocada solo al café, pero con cápsulas más económicas , puedes elegir una Senseo , teniendo en cuenta eso sí que en este último caso no tiene cápsulas compatibles de café y tendrás que comprar las cápsulas originales

y te gustan los cafés de mucha calidad, y no te importa pagar un poco más por cada café, elige una . Como alternativa también enfocada solo al café, pero con , puedes elegir una , teniendo en cuenta eso sí que en este último caso y tendrás que comprar las cápsulas originales Si en tu familia hay diferentes edades y quieres usar la cafetera para hacer todo tipo de bebidas, como chocolates o tés, elige una Dolce Gusto o una Tassimo, teniendo de nuevo en cuenta que esta última, aunque cuenta con muchas opciones de bebidas de buena calidad y a buen precio, no tienen cápsulas compatibles, tienes que comprar las originales.

No te preocupes porque vamos a intentar aclararte las dudas para que decidas entre las mejores máquinas de café de cápsulas del mercado, y entre ellas las que están ahora mismo de oferta en el Black Friday de Amazon.

Las mejores ofertas en cafeteras de cápsulas

Una de las ventajas que podemos encontrar si queremos comprar cafeteras de cápsulas es que la gran demanda y competencia que existe entre las diferentes marcas nos permite encontrar grandes rebajas, especialmente en periodos como Black Friday o Navidad.

En cambio si tienes dudas y te vuelves loco intentando entender cómo funcionan los diferentes modelos de cafeteras de cápsulas, más abajo te ofrecemos una guía para elegir cafeteras de cápsulas que te resultará muy útil.

En el listado de abajo verás los modelos de cafeteras de cápsulas más vendidos en Amazon que actualmente tienen ofertas.

Si ya tienes claro el sistema de cápsulas que buscas y la marca de cafetera que quieres en este listado vas a ver los modelos más rebajados, para comprobar su precio haz clic en el modelo que buscas. En la esquina superior derecha tienes el porcentaje de descuento que tiene actualmente ese modelo. El listado se actualiza diariamente y los precios pueden variar cada día, pero si ves una buena oferta no lo pienses mucho porque los modelos más populares se pueden agotar.

Cafeteras de cápsulas NESPRESSO

Las Nespresso, además de tener como embajador de la marca desde hace tiempo a George Clooney, quien las ha popularizado de forma notable, son conocidas y muy populares por la calidad de su sistema y sus cafés.

Hemos seleccionado varias cafeteras que cumplen con los requisitos de calidad y precio. La principal diferencia que encontrarás en el precio es por detalles como la posibilidad de preparar café con leche gracias a al accesorio de leche con espuma incluido, y en los modelos más superiores la posibilidad de conectarlo por Bluetooth con tu smartphone.

Entre las marcas de cafeteras que llevan el sistema Nespresso las más populares son Krups y De’Longhi, aunque algunas marcas como la Philips L’OR Barista están despuntando desde su lanzamiento y hoy están entre las más vendidas. Estos son los modelos más vendidos y actualmente en oferta, ordenados de menor a mayor precio:

Las cápsulas Nespresso suelen ser caras y tiene diferentes sabores (Expresso & Lungo, Ispirazione Italiana, Barista Creations y Master Origin), con varias intensidades y varios aromas (afrutado, equilibrado e intenso).

Cafeteras de cápsulas TASSIMO

Dentro de la marca de Bosch TASSIMO existen varios modelos que están entre los más vendidos en Amazon. Entre ellos las diferencias están fundamentalmente en su tamaño y prestaciones, pero todos los modelos se caracterizan por su calidad. No obstante tienen una pega que viene dada por sus cápsulas como te explicamos más abajo.

Tassimo Happy, la cafetera más popular de Bosch

La más conocida es la Tassimo Happy que es una de las cafeteras de cápsulas más vendidas de Amazon y con muy buenas valoraciones por parte de los clientes. La Tassimo Happy está disponible en cinco combinaciones de colores diferentes, desde un vistoso rosa, hasta combinaciones bicolor que contrastan en negro o rojo. Tiene un depósito de agua de 0,7 l y un precio que ronda los 40€ si la pillas en oferta.

Tassimo Vivy 2, la cafetera más compacta

Por otro lado la Tassimo Vivy 2 es una cafetera compacta que cabrá sin problema incluso en las cocinas más pequeñas. Tiene un depósito de agua de 0,7 l y el mismo sistema Intellibrew con la gama de bebidas de su hermana mayor.

Tassimo MyWay 2, para los cafeteros más exigentes

Se trata de una cafetera más avanzada en tecnología (y en consecuencia más cara que sus hermanas), con sistema de filtración de agua de Britta, y un depósito de agua de 1,3 litros. Permite grabar hasta cuatro perfiles cambiando la cantidad, intensidad y temperatura del café. Además su sistema flexible permite poner tazas de cualquier tamaño.

VENTAJAS: Sus cafeteras son compactas, rápidas y hacen poco ruido. Además tienen un precio muy ajustado para las prestaciones que ofrecen, que si consigues pillar en oferta puede rondar desde los 40€ a los 70€, por lo que también puede ser una buena opción de regalo. Las bebidas de Tassimo tienen una mayor calidad y variedad de marcas que otros sistemas como Dolce Gusto (Milka, Twinnings…), y su café solo es muy bueno.

DESVENTAJAS: Aunque tiene más de 40 tipos de cafés y otras bebidas, y su precio es similar al de otras marcas, hay que tener en cuenta que no hay cápsulas compatibles con el sistema de Bosch, por lo que tienes que comprar los discos de Tassimo, cada uno con su propio código de barras Intellibrew que permite preparar cada bebida con la cantidad de agua, la temperatura y el tiempo, pero que al mismo tiempo impide que otros fabricantes puedan producir cápsulas para sus máquinas. Además Tassimo suele utilizar 2 cápsulas para preparar una sola bebida (por ejemplo el café con leche) algo que terminará encareciendo tu bebida a la larga.

Cafeteras de cápsulas DOLCE GUSTO

Las cafeteras de cápsulas Dolce Gusto son las grandes competidoras de Nespresso, aunque ambas son de la marca Nestlé. No obstante este tipo de cafeteras van dirigidas a un público más familiar, con modelos llenos de diseño que además nos permiten no solo preparar café, sino todo tipo de bebidas frías y calientes. Lo mejor es que todo esto lo ofrecen a precios muy competitivos.

Sus modelos van desde la más sencilla Krups Piccolo hasta la Dolce Gusto Esperta con gran depósito de agua, bluetooth, y una app que te permite diseñar un café a tu medida.

Estos son los modelos más vendidos y actualmente en oferta, ordenados de menor a mayor precio:

Cafeteras de cápsulas SENSEO

Son modelos también enfocados al mundo del café de forma exclusiva, por lo que podría ser una buena alternativa a Nespresso en relación calidad-precio. Permite preparar una o dos dosis de café simultáneamente. Sus cápsulas, que son más ecológicas al ser de papel, están entre las mas baratas del mercado. Además su facilidad de uso, y su sistema patentado de producción de espuma la convierten en una opción a tener en cuenta.

Nuestro TOP recomendado en cafeteras de cápsulas

Y si sigues siendo incapaz decidir cuál es la cafetera que más te conviene, te dejamos nuestra opinión personal por si te sirve de ayuda:

Philips L’Or Barista, la mejor cafetera de cápsulas Nespresso

Aunque hay modelos de Krups y De’Longhi de muy buena calidad, como la De'Longhi Essenza Mini, nos hemos decidido por el modelo de Philips L’OR Barista porque desde su lanzamiento en 2019, se trata de una de las cafeteras de cápsulas más vendidas del mercado, y no es de extrañar porque ofrece más prestaciones y a la mitad de precio que otras marcas. Además su diseño, cuidado y elegante, quedará bien en cualquier cocina.

Entre sus ventajas están las siguientes:

Permite hacer dos espressos al mismo tiempo , ya que admite cápsulas doble espresso y reconoce automáticamente si introduces una cápsula espresso o una cápsula doble espresso L’OR Barista.

, ya que admite cápsulas doble espresso y reconoce automáticamente si introduces una cápsula espresso o una cápsula doble espresso L’OR Barista. L’OR Barista funciona con todas las cápsulas compatibles con la cafetera Nespresso (que ya os hemos indicado que son muchas), incluyendo las cápsulas individuales L’OR Espresso y además es compatible con las cápsulas doble espresso L’OR Barista

funciona (que ya os hemos indicado que son muchas), incluyendo las cápsulas individuales L’OR Espresso y además es compatible con las cápsulas doble espresso L’OR Barista Podrás ahorrar al tener la opción de usar cápsulas compatibles, además si para preparar dos tazas de café o un café doble utilizas una cápsula doble espresso también ahorrarás bastante.

al tener la opción de usar cápsulas compatibles, además si para preparar dos tazas de café o un café doble utilizas una también ahorrarás bastante. Permite elaborar café ristretto, espresso o lungo , pudiendo ajustar la cantidad de agua desde los 25 ml de un ristretto hasta los 220 ml de un café americano.

, pudiendo ajustar la cantidad de agua desde los 25 ml de un ristretto hasta los 220 ml de un café americano. Dispone de una bomba de presión de 19 bares , perfecta para hacer un buen espresso, y un depósito de agua de 1 litro , además de un depósito de cápsulas usadas .

, perfecta para hacer un buen espresso, y un , además de un . Gracias a su sistema Thermoblock tendrás listo tu café en 30 segundos .

. Existe este modelo con espumador de leche que aunque es algo más caro tiene un precio ajustado también, y te saldrá más barato que comprar un espumador de leche aparte, además te permitirá preparar macchiato, caffe latte, capuccino , etc..

que aunque es algo más caro tiene un precio ajustado también, y te saldrá más barato que comprar un espumador de leche aparte, además te permitirá preparar , etc.. Tiene una bandeja antigoteo que te permite ajustar la altura y usar todo tipo de tazas.

Tassimo Vivy 2, la mejor cafetera de cápsulas Tassimo relación calidad-precio

Dentro de las cafeteras Tassimo nos hemos decantado por la Bosch Tassimo Vivy 2

Se trata de una cafetera fácil de usar , muy barata , y con un mantenimiento muy sencillo .

, muy , y con un . Las cápsulas de este sistema son algo más baratas que las de Nespresso o Dolce Gusto. Ya os hemos comentado no obstante que las Tassimo están restringidas a sus propias cápsulas ya que no existen cápsulas compatibles.

de este sistema son algo que las de Nespresso o Dolce Gusto. Ya os hemos comentado no obstante que las Tassimo están restringidas a sus propias cápsulas ya que no existen cápsulas compatibles. Es una cafetera ideal para familias que quieren preparar muchos tipos de bebidas.

Nescafé Dolce Gusto Mini Me, la mejor cafetera Dolce Gusto

La cafetera de cápsulas Dolce Gusto Mini Me ha sido nuestra favorita dentro de las cafeteras de cápsulas Dolce Gusto por su relación calidad precio. Se trata de una de las cafeteras más pequeñas y compactas que hay ahora mismo, pero tiene bastantes prestaciones a pesar de su precio ajustado:

Puede preparar bebidas de hasta 230-240 ml y permite preparar bebidas calientes o frías .

y permite preparar . Incluye una bandeja de goteo de altura ajustable para acomodar una taza de café grande.

para acomodar una taza de café grande. El depósito de agua de plástico tiene capacidad para 0,8 litros y es desmontable .

y es . Tiene una bomba de presión de 15 bar que te permitirá tener tu café listo en 35 segundos.

Philips SENSEO Quadrante, la mejor cafetera Senseo

Es una cafetera de aspecto robusto y clásico que requiere muy poco mantenimiento, y utiliza las cápsulas de café de SENSEO, más baratas que las de otros fabricantes. La capacidad del depósito de agua es grande (1,2 litros) y permite hacer una o dos tazas de café al mismo tiempo.

REBAJADO HOY 18% 116 Opiniones Philips hd7866/61 Senseo Quadrante cafetera monodosis negro Un café preparado al instante, apoyando un botón.

Una o dos tazas de café en menos de un minuto.

¿Qué es una cafetera de cápsulas?

Las cafeteras de cápsulas son una opción limpia, práctica y rápida para tomar café cada mañana, y el motivo de que hayan inundado casas y oficinas en los últimos años. Pero ante la multitud de ofertas de cafeteras es normal que dudes antes de comprar, ¿cuál es el mejor modelo?, ¿es mejor una cafetera Nespresso, Dolce Gusto, las Tassimo…?

Estas máquinas de café de cápsulas monodosis se consideran cafeteras express, ya que utilizan el mismo método de extracción., pero diferencia de las cafeteras espress manuales, en lugar de añadir el café molido a un filtro, se inserta a través de una cápsula monodosis.

VENTAJAS : Su mayor ventaja es la comodidad y facilidad de uso, además ocupan muy poco espacio , y tienen un mantenimiento mínimo . Tendrás una taza de café en apenas 30 segundos, por lo que si andas siempre con prisas te pueden resultar muy prácticas. Otra de sus ventajas en muchos sistemas, es que con una misma máquina puedes elaborar no solo cafés, sino otro tipo de especialidades como chocolates, tés, cappuccinos, etc.

: Su mayor ventaja es la y de uso, además ocupan muy , y tienen un . Tendrás una taza de café en apenas 30 segundos, por lo que si andas siempre con prisas te pueden resultar muy prácticas. Otra de sus ventajas en muchos sistemas, es que con una misma máquina puedes elaborar no solo cafés, sino otro tipo de especialidades como chocolates, tés, cappuccinos, etc. DESVENTAJAS: Utilizar cápsulas en lugar de café molido te saldrá más caro. Además en temas ecológicos también generan mayor cantidad de residuos.

Guía para comprar la mejor máquina de café de cápsulas

A la hora de decidirte a comprar una cafetera de cápsulas tienes que tener en cuenta estos puntos que te mencionamos a continuación:

¿Cómo funciona una cafetera de cápsulas?

Las cafeteras de cápsulas tienen en su interior una bomba de presión con la que se consigue un café con mucho cuerpo rápidamente. Cuando introducimos la cápsula en la máquina de café, la parte superior de la misma se agujerea y la cafetera envía agua caliente a la cápsula a alta presión, produciéndose el café.

Esas cápsulas son monodosis, y lo más importante es que hay distintos tipo de cápsulas en función del fabricante.

¿Qué sistema de cápsulas me interesa más?

Lo primero que tienes que entender es que las distintas marcas de cafeteras van condicionadas por el sistema de cápsulas de café que utilizan, porque cada uno de ellos es diferente, y todos tienen ventajas y desventajas que debes conocer.

Las 4 firmas más prestigiosas y que dominan el mercado son Nespresso, Tassimo, Senseo y Dolce Gusto. De estas cápsulas va a depender la variedad de cafés y bebidas, además de la calidad de las mismas.

Dependiendo de la marca que elijas las cápsulas serán más o menos económicas, aunque excepto Tassimo, el resto tienen cápsulas compatibles, que te permitirán adquirirlas por un precio significativamente inferior.

CÁPSULAS NESPRESSO: Esta marca es de Nestlé , y está orientada a los muy cafeteros ya que solo ofrece café de distintas variedades , y con gran intensidad de sabor y aroma. Existen cápsulas compatibles con este sistema que pueden salir más económicas.

Esta marca es de , y está orientada a los muy cafeteros ya que solo ofrece , y con gran intensidad de sabor y aroma. Existen con este sistema que pueden salir más económicas. CÁPSULAS DOLCE GUSTO: También es de la marca Nestlé pero aunque también ofrecen una gran calidad, son más económicas. Además, tienen mucha diversidad de bebidas, no solo cafés , también puedes preparar té, chocolate, bebidas frías, etc. por lo que si hay niños en casa pueden resultar interesantes. Igual que en el caso de Nespresso existen cápsulas compatibles con este sistema que te permitirán disfrutar de más variedad y precios.

También es de la marca pero aunque también ofrecen una gran calidad, son más económicas. Además, tienen mucha diversidad de bebidas, no solo , también puedes preparar etc. por lo que si hay niños en casa pueden resultar interesantes. Igual que en el caso de Nespresso existen con este sistema que te permitirán disfrutar de más variedad y precios. TASSIMO: También son muy populares, porque son muy económicas y además ofrecen una gran variedad de bebidas . Su única pega es que no tiene cápsulas compatibles, tienen que ser originales de la marca , ya que su sistema Intellibrew va con un código de barras que permite preparar cada bebida con la cantidad de agua, la temperatura y el tiempo óptimos, pero que al mismo tiempo impide que otros fabricantes puedan producir cápsulas para sus máquinas.

También son muy populares, porque son muy y además ofrecen una . Su única pega es que , ya que su sistema Intellibrew va con un código de barras que permite preparar cada bebida con la cantidad de agua, la temperatura y el tiempo óptimos, pero que al mismo tiempo impide que otros fabricantes puedan producir cápsulas para sus máquinas. SENSEO : Es similar a la Tassimo, pero también enfocado al mundo del café de forma exclusiva , por lo que podría ser una buena alternativa a Nespresso. Permite preparar una o dos dosis de café simultáneamente . Además sus cápsulas, que están entre las mas baratas del mercado, su facilidad de uso, y su sistema patentado de producción de espuma la convierten en una opción a tener en cuenta.

: Es similar a la Tassimo, pero también enfocado al mundo del , por lo que podría ser una buena alternativa a Nespresso. Permite preparar . Además sus cápsulas, que están entre las mas baratas del mercado, su facilidad de uso, y su sistema patentado de producción de espuma la convierten en una opción a tener en cuenta. Otros sistemas de cápsulas de café: Existen también otras cápsulas originales, como las FAP de Lavazza, las Caffitaly, Illy Iperespresso, etc.

Variedad de bebidas

Antes de decidirte piensa si vas a querer hacer solo café o quieres preparar otras bebidas como chocolates o tés. Si te decantas por la segunda opción debes descartar las máquinas Nespresso porque solo tienen cápsulas de café, al contrario que Dolce Gusto, Tassimo o Senseo, que tienen otras variedades de bebidas. Incluso algunos modelos de Dolce Gusto permiten preparar tanto bebidas calientes como frías, desde un café espresso a un té frío.

Modo manual o automático de la cafetera

Las manuales eres tú quien debe detener la salida del agua para regular la cantidad de café. Las automáticas no hay que preocuparse por las cantidades, ya que es la máquina la que controla todo el proceso. Tú solo tendrás que seleccionar la intensidad de café que prefieres.

Potencia de la cafetera

Es un factor fundamental que debes tener en cuenta. La mayoría funcionan a 1450 W y permiten preparar en 30 segundos una taza de café con espuma.

Presión

La presión con la que se bombea el agua caliente es lo que le dará textura y sabor al café. Si quieres disfrutar de un auténtico espresso, tu cafetera debe tener como mínimo entre 12 y 17 bares de presión, si es más mejor.

Precio

Una forma de valorar la relación calidad-precio es calcular el coste por cada taza y el precio de la cafetera, y multiplicarlo por los días del año, así podrás comparar.

El depósito de agua

Con un depósito de agua de 0,7 litros podrás elaborar unas 6 tazas de café, que para el día a día es más que suficiente. Pero si no quieres estar llenándolo todos los días puedes elegir algún modelo que tenga un depósito de agua superior.

El diseño de la cafetera

Hay algunas cafeteras con un diseño moderno, clásico o futurista, pero más allá de esto, lo que tienes que mirar también es que por ejemplo tenga una bandeja regulable en altura para que puedas utilizar tazas de tamaño grande. También es importante que el sistema de carga sea sencillo y si el depósito y otras partes son desmontables para que sea fácil su limpieza. Otra cosa a tener en cuenta es el contenedor de cápsulas usadas, así no tendrás que estar sacando la cápsula cada vez que hagas café.

Funciones extra de la cafetera de cápsulas

Algunos modelos tienen funciones adicionales como aviso de descalcificación o apagado automático. También algunas cafeteras permiten configurar y memorizar la cantidad, intensidad y temperatura del café en diferentes perfiles. También existen modelo con conectividad bluetooth como la , para conectarte a través de una app a tu móvil y elegir el tamaño, la temperatura y programar tu café a la hora que prefieras. Estas funciones, a igualdad de precios, te ayudarán a decidirte por uno u otro modelo.

Recetas de cafés especiales

Las opciones de preparar cafés especiales con estas máquinas es infinita. Por poner un ejemplo a nosotros nos ha llamado mucho la atención este Cappuccino de Palomitas que se prepara con una máquina Nespresso.

Para hacerlo necesitarás un espumador de leche de este tipo. Pones 70 ml de leche en el espumador, haciendo que se haga la espuma de leche. Luego coloca 5 ml de leche condensada en el fondo de una taza, vierte sobre ella la espuma hasta llenar la taza. Pon una cápsula de Chiaro puedes comprarlas aquí, y coloca la taza en la cafetera para que el café caiga sobre la mezcla de leche condensada y leche espumada. Para finalizar coloca algunas palomitas de caramelo por encima de la espuma ¡y voilà! Ya tienes listo un café con el que deleitarte a lo grande.

Algunos enlaces aquí publicados son de afiliados. No obstante los artículos recomendados responden a una decisión de criterio del equipo de Pequerecetas, no existiendo ningún incentivo por parte de las marcas."
