title,intro,order,votes,comensales,duración,para,dificultad,coste,types,ingredientes,url
Cebollas rellenas con salsa a la crema,,"['1\nPelar las cebollas y cortar dos rodajitas en cada extremo, hervirlas en agua con sal hasta que estén tiernas pero que no se deshagan, ahuecarlas con cuidado.', '2\nPicar la pulpa extraída y colocarla con la carne en una sartén con el aceite, agregar el perejil y condimentar con sal, pimienta y 1 cdita de pimentón.', '3\nCocinar 4´a 5´hasta que la carne esté lista, retirar del fuego y mezclar con la mitad del queso, distribuir dentro de las cebollas, espolvorearlas con el resto del queso, rociarlas con aceite y gratinarlas en horno caliente.', '4\nAparte, mezclar la leche con el queso fundido cortado en trocitos y cocinar revolviendo hasta formar una salsa.', '5\nNapar los platos y servir 2 cebollas por persona, acompañando con arvejas salteadas en manteca y triángulos de pan tostado.']","Valoración: 3,3 (21 votos)",,,,,,,"['3/4 kg cebollas', '200 g carne picada', '3 cdas aceite', '2 cdas perejil', '1 huevo', '3 cdas quesao rallado', '400 cc', 'Leche', '250 g queso fundido gruyere', 'Sal', 'Pimienta', 'Pimentón', 'Nuez moscada']",https://www.recetasgratis.net/receta-de-cebollas-rellenas-con-salsa-a-la-crema-12031.html
Chiles rellenos a la crema,,"['1\nTostar los chiles, pelarlos y rellenarlos de queso, salpimentarlos.', '2\nCortar la cebolla en rodajas y sofreirla a que quede transparente.', '3\nEngrasar un recipiente refractario con la mantequilla y acomodar los chiles.', '4\nVertir la crema sobre los chiles y hornear por 20 minutos a fuego alto.', '5\nSon deliciosos con tortillas de maiz y frijoles refritos.']","Valoración: 3,9 (36 votos)",3 comensales,30m,Entrante,Dificultad baja,,"['Recetas al horno', 'Recetas mexicanas']","['6 Chiles Poblanos', '1/3 litro de crema de leche', '1 cebolla grande', '50 grms de mantequilla', '1/4 kilo queso chihuahua', 'Sal', 'Pimienta al gusto']",https://www.recetasgratis.net/receta-de-chiles-rellenos-a-la-crema-12004.html
Tortilla de puerros y queso,,"['1\nCorte finamente los puerros en rodajitas, sofríalos en una sartén junto con la mantequilla, hasta que esté tierno y ligeramente dorado. Aparte separe las yemas de las claras y bata estás últimas a punto de nieve, agregándole después las yemas y mezclando con el queso parmesano.', '2\nLuego coloque una sarten al fuego con un poco de aceite y coloque una capa de la mezcla de huevos y queso, y encima una de puerros y queso ricotta troceado, siga haciendo capas hasta acabar con una capa de huevos, deje que cuaje un poco y voltee la tortilla con la ayuda de un plato, deje cocer a fuego suave y sirvala templada.']",Valoración: 4 (3 votos),,,,,,,"['3 puerros limpios', '1 1/2 taza de queso ricotta', '2 cdas. de mantequilla', '1 taza de queso parmesano rallado', '6 huevos', 'sal']",https://www.recetasgratis.net/receta-de-tortilla-de-puerros-y-queso-11930.html
Pastel de alcachofa (alcauciles),,"['1\nCocinar las alcachofas y sacarles la pulpa de las hojas y los corazones, reservar.', '2\nPicar las vainitas y sancochar en M. ondas por 5 minutos.', '3\nReservar.', '4\nEn la licuadora poner el tarro de leche , los huevos enteros, la harina sal, pimienta y vainitas.', '5\nLicuar y vacear sobre la pulpa de las alcachofas.', '6\nAgregar el queso parmesano.', '7\nVacear en molde enmantequillado y espolvorear queso parmesano.', '8\nLlevar al Microondas por 10 minutos.']",Valoración: 4 (3 votos),,,,,,,"['5 alcachofas', '1/4 kg. de vainita', '1 tarro de leche evaporada', '3 cucharada de harina', '100 grs. de queso parmesano', '4 huevos', 'un sobrecito de caldo de pollo', 'sal', 'pimienta blanca', 'ajinomoto']",https://www.recetasgratis.net/receta-de-pastel-de-alcachofa-alcauciles-11875.html
Tomates rellenos con carne molida,,"['1\n1-Corta la parte superior de los tomates y resérvalas.', '2\nVacia los tomates.', '3\nEngrase una fuente y coloque los tomates dentro.', '4\n2-Sofría la cebolla en un sartén hasta que esté dorada.', '5\n3-Reduzca el fuego y añada el jengibre, el ajo, la pimienta y la sal. Saltee luego entre 3 a 5 minutos.', '6\n4-Agregue la carne molida y sofría durante 10-15 minutos, o hasta que se dore.', '7\n4-Añada la guindilla verde y las hojas frescas de cilantro y saltee unos 3-5 minutos más.', '8\n6-Con una cuchara, disponga la mezcla de carne en los tomates y tápelos con la parte superior.', '9\nCuézalos en el horno precalentado a 350F. durane 15 a 20 minutos.', '10\n7-Disponga los tomates en platos individuales y sirválos calientes.']","Valoración: 4,1 (83 votos)",,,,,,,"['6 tomates grandes y firmes', '4 cucharadas de mantequilla', '5 cucgaradas de aceite vegetal', '1 cebolla mediana, picada muy fina', '1 cucharada de raíz de jengibre, picado, fresco', '1 cucharadita de ajo machacado', '1 cucharadita de pimienta', '1 cucharadita de sal', '450 gramos de carne de cerdo molida o de pavo', '1 guindilla verde fresca, sin semillas y bien picadas', 'hojas frescas de cilantro']",https://www.recetasgratis.net/receta-de-tomates-rellenos-con-carne-molida-11869.html
Acelgas florentinas,"No te pierdas esta receta de acelgas florentinas fácil y práctica con la que preparar un entrante o plato principal para chuparse los dedos, ya que se trata de unas acelgas a la florentinas que incluyen carne molida de res, crema de leche y queso rallado entres sus ingredientes, con lo cual, están muy sabrosas y son ideales para aquellos a quien no les gusta el sabor de esta hortaliza. Sigue leyendo los pasos de RecetasGratis y comprueba su gran sabor.","['1\nCortamos los tallos gruesos y duros de las acelgas, ponemos en una olla con agua hirviendo y los dejamos cocer durante 3 minutos. Luego retiramos, escurrimos y dejamos enfriar.', '2\nMientras, picamos la cebolla y el ajo en pequeños cuadritos, los ponemos en la sartén con aceite y cocinamos durante 15 minutos, hasta que esté cristalina la cebolla. Con este sofrito las acelgas a la florentina estarán mucho más sabrosas.', '3\nLuego agregamos la carne molida, los condimentos y salpimentamos a gusto.', '4\nCuando la carne esté debidamente cocida agregamos las hojas de acelga previamente bien picadas y la crema de leche. Cocinamos a fuego lento durante 1 minuto más.\nTruco: Si espesa mucho la acelga florentina agregamos un poco de agua de la cocción de los tallos de la verdura.', '5\nEspolvorear con queso rallado y servir recién hechas las acelgas florentinas. Acompañar con patatas fritas y/o arroz blanco suelto por ejemplo.Encuentra más recetas con acelgas fáciles y deliciosas en la web como estas que te recomendamos aquí mismo:Acelgas a la cremaAcelgas salteadas con patatasAcelgas fritasAcelgas rehogadasAcelgas guisadas', '6\nEspolvorear con queso rallado.']","Valoración: 3,9 (31 votos)",4 comensales,30m,Entrante,Dificultad baja,,[],"['2 Atados de acelgas', '400 Gramos de carne de res molida', '1 Cebolla grande', '2 Dientes de ajo', '3 Cucharadas de aceite de oliva', '1 Tableta de concentrado de carne', '200 cc de crema de leche', 'Queso rallado para espolvorear', 'Orégano', 'Pimienta', 'Sal']",https://www.recetasgratis.net/receta-de-acelgas-florentinas-11686.html
El clasico pimiento morron relleno,,"['1\nDORA la carne con la cebolla en un sartén grande a fuego moderado.', '2\nAñade 1 taza de salsa de tomate, la mezcla para aderezo y el arroz revolviendo, hasta que queden bien mezclados.', '3\nSaca del fuego.', '4\nCORTALES la parte superior a los pimientos, quitales las semillas.', '5\nMezcla la salsa de tomate restante y 1/4 taza de agua en un molde cuadrado para hornear de 9 pulgadas.', '6\nColoca los pimientos, con la parte cortada hacia arriba, en un recipiente para hornear.', '7\nCon una cuchara rellena los pimientos con la mezcla de carne, cubre con papel de aluminio.', '8\nHORNEA a 400F. de 35 a 40 o hasta que los pimientos estén tiernos.', '9\nCon una cuchara recoge la salsa del fondo del recipiente y viertela sobre los pimientos justo antes de servir.']","Valoración: 3,9 (33 votos)",,,,,,,"['1 libra carne de res molida', '1 cebolla grande, picada', '1 lata de 15 onzas de salsa de tomate (jitomate) cantidad dividida', '1 sobre de mezcla para aderezo con ajo', 'hierbas', '2 tazas de arroz cocido', '4 pimiemtos grandes, verdes (pimentones)']",https://www.recetasgratis.net/receta-de-el-clasico-pimiento-morron-relleno-11684.html
Pure de batata rosada,,"['1\n1) En una olla con agua y sal, se cocinan a fuego alto las batatas hasta que ablanden (unos 15 minutos).', '2\n2) Se escurren y se pasan inmediatamente por un pasapurè.', '3\n3) Se calienta la leche a fuego medio.', '4\n4) Con una cuchara de madera, se mezcla vigorosamente la batata con la mantequilla y se añade poco a poco la leche, sin dejar de batir, hasta que quede una mezcla homogènea.']","Valoración: 3,3 (18 votos)",,,,,,,"['4 batatas rosadas medianas peladas y cortadas en trozos', '8 tazas de agua', '2 cucharaditas de sal', '1/2 litro de leche espesa', '1/2 panela de mantequilla a temperatura ambiente cortada en trocitos']",https://www.recetasgratis.net/receta-de-pure-de-batata-rosada-11570.html
Mousse de aguacate con curry,,"['1\nEn una olla se pone la mantequilla a derretir.', '2\nSe agregan la cebolla, el perejil, el tomillo y el polvo curry y revolviendo se cocina hasta marchitar.', '3\nSe agregan el consomè, la sal, la pimienta y la salsa picante. Se lleva a un hervor y se cocina 5 minutos.', '4\nSe eliminan el tomillo y el perejil y se pone aparte.', '5\nEntretanto se ponen en agua las láminas de gelatina por varios minutos para hidratarlas, se pela el aguacate, se pica en pedazos y se ponen en el vaso de una licuadora el consomè todavía caliente, el aguacate y el jugo de limón y se tritura bien. Se cuela y se le incorpora la gelatina hidratada, revolviendo bien.', '6\nSe le revuelve la crema, se vuelve a colar,se vierte en un molde de 28x12x7 cms. y se mete en la nevera hasta endurecer,unas 4 a 6 horas.', '7\nCuando se va a servir, se mete el molde en agua tibia por unos segundos y se vierte la mousse sobre una bandeja humedecida, lo que permite acomodar bien la mousse.', '8\nPara servirla se corta en tajadas de 1 a 1.1/2 centímetros de espesor.', '9\nPREPARACIÓN DE LA SALSA DE AJÍ DULCEEn una olla se pone el aceite a calentar. Se agregan la cebolla y el ajo y se cocinan hasta marchitar, unos 4 minutos. Se agregan los ajís picaditos y se cocinan unos 4 minutos más.', '10\nSe le revuelve el consomè, la sal y la pimienta, se cocina por unos 2 minutos. Se pasa al envase de una trituradora y se tritura bien.', '11\nSe cuela y se pasa a una olla limpia. Se vuelve al fuego, se le revuelve si se quiere, la crema, se lleva a fuego suave a un hervor y se cocina por 1 o 2 minutos.']","Valoración: 3,3 (18 votos)",,,,,,,"['5 Cucharadas de mantequilla', '2 tazas de cebolla picadita', '2 ramitas de perejil', '2 ramitas de tomillo', '1 cucharada de polvo curry', '2 tazas de consomè de pollo', '4 cucharaditas de sal', '1/4 de cucharadita de pimienta blancamolida', '6 làminas de gelatina sin color y sin sabor, unos 28 gramos', '1/4 de cucharadita de salsa picante', '1.1/2 kilo de aguacate sin pelar o 1.1/4 ya pelado', '1 cucharada de jugo de limòn', '1 taza de crema gruesa, para batir']",https://www.recetasgratis.net/receta-de-mousse-de-aguacate-con-curry-11553.html
Budín de puerros,,"['1\nLimpiar los puerros, retirándoles la parte verde, lavarlos bien, asegurándose que no le quede alguna tierrilla entre las hojas, luego cortálos en rodajas finitas y rehógalos en una sartén grande junto con los 100 grs de mantequilla, por espacio de unos 10 min.', '2\nLuego agregáles la harina y cuece unos instantes, seguidamente incorpora la leche, salpimenta a tu gusto y agregalé una pizca de nuez moscada y luego deja cocer a fuego lento hasta que espese.', '3\nRetira del fuego la preparación, deja enfriar un poco y agrega los huevos más las tres yemas, mezcla suavemente incorporando todo bien y seguidamente añade el queso rallado, rectifica la sazón y vierte la mezcla en un molde de plum-cake, previamente untado con la cucharada de mantequilla.', '4\nCuece el budín a a baño de maría en el horno precalentado a 200ºC, durante unos 30 ó 40 min. apróx. hasta que esté cuajado, luego sácalo del horno y no lo desmoldes hasta que se enfríe, sirvelo adornado a tu gusto con picos de mahonesa por ejemplo.']","Valoración: 3,4 (19 votos)",,,,,,,"['1 litro de leche', '100 grs de mantequilla', '1 cucharada de mantequilla', '100 grs de harina de trigo', '3 manojos de puerros', '3 huevos', '3 yemas de huevos', '50 grs de queos rallado', '1 pizca de sal', '1 pizca de pimienta', '1 pizca de nuez moscada']",https://www.recetasgratis.net/receta-de-budin-de-puerros-11515.html
Peperonata,,"['1\nCortar en cubos grandes los morrones y los tomates con piel y despepitados.', '2\nCortar las cebollas en pluma.', '3\nColocar en una cacerola el aceite, llevar al fuego y añadir las cebollas, cocinarlas hasta dorar. Incorporar los morrones y los tomates.', '4\nCuando las verduras estén crujientes pero cocidas, agregar el vinagre y salpimentar a gusto.', '5\nCocinar 10´y añadir las aceitunas descarozadas y cortadas en arandelas.', '6\nMezclar y cocinar hasta que los morrones estén a punto.']","Valoración: 3,9 (26 votos)",,,,,,,"['2 morrones verdes', '1 morrón rojo', '1 morrón amarillo', '300g tomates', '3 cebollas', '2 cdas aceite de oliva', '3 cdas vinagre de vino', '50g aceitunas verdes', 'hierbas aromáticas', 'sal', 'pimienta']",https://www.recetasgratis.net/receta-de-peperonata-11489.html
Moldeado de brócoli,,"['1\nDescongelar los brócoli y procesarlos hasta formar un puré.', '2\nColocarlo en un bol junto a la ricotta, las claras y la harina.', '3\nSalpimentar y mezclar los ingredientes.', '4\nVerter la preparación en un molde enmantecado.', '5\nCocinar en horno precalentado en 200º a Baño María hasta que coagule.', '6\nAcompañamiento: Pelar las cebollas, cortarlas en juliana y rehogar en aceite de oliva hasta dorar.', '7\nRetirar de la sartén, dejar escurrir en papel absorbente, salpimentar y espolvorear con albahaca picada.']",Valoración: 3 (1 voto),,,,,,,"['400g brócoli congelado', '200g ricotta', '20g harina', '2 claras', 'Sal', 'Pimienta', 'Acompañamiento', '2 cebollas', '8 hojas albahaca fresca', '2 cdas aceite de oliva', 'Sal', 'Pimienta']",https://www.recetasgratis.net/receta-de-moldeado-de-brocoli-11488.html
Pastelón de berenjenas asadas,"En esta receta vamos a realizar una especie de lasaña hecha a base de plátano maduro y berenjenas, una deliciosa opción para aquellas personas que no desean consumir carne. Quédate en RecetasGratis.net para descubrir el paso a paso de esta receta vegetariana de pastelón de berenjenas asadas, ¡te encantará!","['1\nNuestro primer paso para realizar la receta de pastelón de berenjena es prealistar los ingredientes.', '2\nCorta las berenjenas en rodajas delgadas y llévalas a un bol o tazón con suficiente agua y sal para reducir el amargar de esta verdura. Deja la berenjena a remojo durante 30 minutos aproximadamente, veras que sale un líquido de color café.', '3\nPasado el tiempo de remojo, retira las rodajas de berenjena del agua y colócalas sobre papel absorbente para retirar el exceso de líquido.', '4\nLleva una sartén con suficiente aceite para freír a fuego medio, sofríe las tajadas de plátano hasta que estén doradas.', '5\nLuego, con mucho cuidado sofríe las berenjenas hasta que estén doradas.', '6\nEngrasa un molde o refractaria, añade una capa de plátanos fritos y encima una capa de berenjenas.', '7\nAgrega suficiente salsa bechamel encima de las capas de plátano y berenjenas y agrega queso mozzarella rallado por encima.', '8\nRepite este proceso (plátano, berenjena, salsa bechamel) hasta finalizar con los ingredientes; acaba con una capa de queso parmesano bien distribuido por todo el pastelón de berenjena. Precalienta el horno a 200ºC e introduce la receta de berenjenas hasta que gratinen los quesos.', '9\nRetira del horno el pastelón de berenjenas cuando veas que está listo y sírvelo bien caliente.', '10\nCon mucho cuidado, corta las porciones de nuestra receta de berenjenas como observa en la fotografía y fíjate en las distintas capas de plátano, berenjena, salsa y queso. Este es un plato realmente exquisito que agradecerás haber cocinado, y todos tus invitados también. Y para acabar de completar tu menú, elabora un postre casero como los vasitos de limón.']","Valoración: 4,3 (57 votos)",6 comensales,1h 30m,Plato principal,Dificultad media,,"['Recomendada para vegetarianos', 'Recetas al horno']","['6 unidades de Berenjenas', '4 unidades de Plátano maduro', '200 gramos de Queso mozzarella', '100 gramos de Queso parmesano', '5 tazas de Salsa bechamel']",https://www.recetasgratis.net/receta-de-pastelon-de-berenjenas-asadas-11473.html
Puré de patatas con coliflor,"Tanto las patatas como la coliflor son dos verduras que aportan gran cantidad de hidratos de carbono, una fuente de energía sana para el crecimiento de los niños. En RecetasGratis.net os presentamos esta receta de puré de patatas con coliflor para que vuestros hijos coman verduras de un modo distinto.","['1\nReunimos todos los ingredientes para elaborar el puré de patatas con coliflor pensado especialmente para los niños.', '2\nCocemos la coliflor en trozos en abundante agua hirviendo con sal. Ademas de resultar una fuente excelente de hidratos de carbono, la coliflor cuenta con una gran cantidad de vitaminas del grupo B y es rica en vitamina C, ideales para el desarrollo de los niños.', '3\nA los 2 minutos incorporamos las patatas peladas y cortadas en gajos a la olla donde estamos cociendo la coliflor. Cocemos hasta que las verduras estén tiernas.', '4\nUna vez cocidas, escurrimos las verduras y reservamos un vaso del agua de la cocción para utilizarlo más adelante.', '5\nAgregamos la mantequilla, una yema de huevo, sal y una pizca de pimienta negra molida. Batimos el puré de patatas con coliflor hasta que quede sin grumos. Para que quede más suave, vertemos el vaso de caldo que reservamos y mezclamos.', '6\nServimos el puré de patatas con coliflor con hierbabuena picada que le da un aroma muy fresco (también podéis utilizar orégano o albahaca). Si os gustan los purés como acompañamiento, podéis probar el puré de patatas con mostaza o el puré de calabacín. ¡Esperamos que os guste!']","Valoración: 3,9 (16 votos)",4 comensales,30m,Acompañamiento,Dificultad baja,,['Recomendada para vegetarianos'],"['1 kilogramo de Patatas', '150 gramos de Coliflor', '1 unidad de Yema de huevo', '2 cucharadas soperas de Mantequilla', '1 pizca de Sal', '1 pizca de Pimienta negra molida', '1 pizca de Hierbabuena']",https://www.recetasgratis.net/receta-de-pure-de-patatas-con-coliflor-11444.html
Alcachofas asadas,,"['1\nCorta el tallo y las puntas de las hojas de cada alcachofa y golpéalas un poco para que se abran.', '2\nColócalas en una fuente para horno, salpimentalas a tu gusto y rocíalas con el aceite y el vinagre.', '3\nMete la bandeja al horno, precalentado a 180ºC, y dejálas cocer por espacio de 1 hora ó hasta que veas que las hojas exteriores de las alchachofas están doraditas, sácalas del horno, elimina las hojas exteriores y las impurezas del tallo y sirvelas calientes o frías, como más te apetezca.']","Valoración: 3,6 (23 votos)",,,,,,,"['8 alcachofas pequeñas ó 4 grandes', '4 cdas. de aceite de oliva', '2 cdas. de vinagre', 'sal', 'pimienta al gusto']",https://www.recetasgratis.net/receta-de-alcachofas-asadas-11440.html
Acelgas con patatas a mi manera,,"['1\nSe cuecen las acelgas en agua.', '2\nEn una sarten se frien las patatas y la cebolla, como para tortilla.', '3\nSe rehogan con un ajo las acelgas y las patatas con la cebolla, machacandolas un poco.', '4\nSe maja en un mortero el otro ajo y el perejil, se añade al majado el vino y el agua, y se se mezcla con el resto, se le da un hervor 5 Minutos.', '5\nSe ponen por encima los huevos batidos y el queso rallado y se gratina 10 min. en el horno.']","Valoración: 3,8 (6 votos)",,,,,,,"['1 kilogramo de Acelgas', '1 kilogramo de Patatas', '1 unidad de Cebolla', '2 dientes de Ajos', '1 chorro de Vino blanco', '¼ vaso de Agua', '1 pizca de Perejil', '2 unidades de Huevos', '1 barra de Queso rallado']",https://www.recetasgratis.net/receta-de-acelgas-con-patatas-a-mi-manera-11402.html
Papas chirrionas,,"['1\nTueste, desvene, remoje y licue los chiles con el ajo, la sal y un poco de agua.', '2\nCueza las papas en agua, pélelas y pártalas en cuadritos.', '3\nFríalas con suficiente aceite.', '4\nBata los huevos ligeramente.', '5\nVierta sobre el sartén, con las papas y el chile molido, los huevos batidos.', '6\nCuando todo esté bien frito, añada el queso y el orégano y retire del fuego.']",Valoración: 3 (4 votos),,,,,,,"['6 papas amarillas', '2 huevos', '1 diente de ajo', '1/2 taza de queso añejo', '1 pizca de óregano molido', 'Chile pasilla al gusto', 'Aceite para freír', 'Sal']",https://www.recetasgratis.net/receta-de-papas-chirrionas-11372.html
Berenjenas al roquefort,,"['1\nSe lavan bien las berenjenas y se cortan por la mitad a lo largo, se le saca la pulpa procurando no romperla, se coloca en una sartén el aceite y la pulpa sacada de la berenjena cortada en trocitos moderados, se le agrega el queso roquefort y se sofríe hasta que la pulpa de la berenjena se ablande.', '2\nSe le agrega también un punto de sal y una pizca de pimienta recién molida, ademas de la mitad del queso enmental, una vez listo esto, se rellenan las mitades de las berenjenas con esta farsa y se colocan en una fuente refractaria engrasado en fondo con un poco de aceite.', '3\nPor último se espolvorean con el queso rallado restante y se meten al horno por unos 25 min. a 180º.']","Valoración: 3,6 (21 votos)",2 comensales,30m,Entrante,Dificultad baja,,"['Recomendada para vegetarianos', 'Recetas al horno']","['4 unidades de Berenjenas', '125 gramos de Queso roquefort', '100 gramos de Queso emental rallado', '6 cucharadas soperas de Aceite de oliva', '1 pizca de Sal y Pimienta']",https://www.recetasgratis.net/receta-de-berenjenas-al-roquefort-11355.html
Lechuga al roquefort,,"['1\nLave la lechuga y àbrala sin deshojarla, tratandode que quede como una flor.', '2\nEscùrrala muy bièn.', '3\nTriture el queso, añàdale la crema de leche y el vinagre, mezcle bien, coloque la mezcla del queso en el corazòn de la lechuga.']","Valoración: 3,6 (28 votos)",,,,,,,"['1 lechuga americana', '100 gramos de queso roquefort', '1 lata de crema de leche', '1 cucharadita de vinagre']",https://www.recetasgratis.net/receta-de-lechuga-al-roquefort-11348.html
Arroz con auyama y coco,,"['1\nSe parten los cocos, se pican y sin quitarles la conchita marròn, se ponen en la licuadora con el agua, se cuela en un colador de alambre y esa leche se pone alfuego y cuando estè marroncita que ya estè botando la grasa, se le pone el azùcar y se sigue revolviendo.', '2\nLuego se le agrega la auyama picada en cuadritos.', '3\nCuando la auyama està sofrita, se le agrega el arroz.', '4\nEl bagazo del coco se vuelve a la licuadora y se licùa con 6 tazas de agua, se cuela nuevamente, se le agrega al arroz y se le pone la sal.', '5\nSe cocina hasta que seque, se tapa, se le baja el fuego hasta que estè.']","Valoración: 3,4 (19 votos)",,,,,,,"['3 tazas de arroz', '2 cocos', '1.1/2 kg.de auyama picada en cuadritos', '1/2 taza de azùcar', 'sal al gusto', '2 tazas de agua']",https://www.recetasgratis.net/receta-de-arroz-con-auyama-y-coco-11275.html
Esparragao,,"['1\nPicar los esparragos con la mano hasta que dejen de chascar( si agotamos todo el esparrago quedarán duros, pues la parte inferior del mismo hay que tirarla ya que no sirve ).', '2\nLavarlos en abundante agua y escurrirlos bien.', '3\nEn una sarte se pone el aceite y cuando esta bien caliente se frien las cebolletas muy picaditas.', '4\nCuando la cebolleta esta trasparente se añaden los esparragos y se rehogan durante al menos 20 minutos.', '5\nSe añade el tomate, se machacan los ajos y los cominos y tambien se añaden.', '6\nSe cubre de agua y se les echa la sal.', '7\nDejar cocer probando de vez en cuando para rectificar de sal si fuese necesario y para comprobar que se han cocido ( ya que al ser de campo no siempre necesitan el mismo tiempo de cocción).', '8\nSe baten los huevos y se añaden pero de esta manera:', '9\nCuando estan cociendo a fuego vivo se retira la sarten del fuego y es inmediatamente cuando hay que añadirlos, removiendo constantemente; de esta manera conseguimos que los huevos no se cuajen pero si que se hagan.', '10\nDejar siempre que tengan caldo y comer con cuchara.']","Valoración: 3,9 (25 votos)",,,,,,,"['1 Manojo de esparragos trigueros silvestres', '1 Diente de ajo grande', '2 Cebolletas finas', '4 Cucharadas de tomate natural triturado', 'Cominos', 'Sal', '3 Cucharadas soperas de aceite de oliva', '2 Huevos']",https://www.recetasgratis.net/receta-de-esparragao-11241.html
Tomates asados con anchoas,,"['1\nCortamos el tomate en rodajas de 1 cm. aproximado en una sartén ponemos un chorrito del aceite de las anchoas y asamos los tomates con el orégano por los dos lados, los retiramos y le ponemos unos trozitos de anchoas por encima, mezclamos el aceite con el vinagre y la salsa de soja y lo rociamos.']",Valoración: 4 (3 votos),,,,,,,"['2 tomates grandes', 'orégano', '1 lata de anchoas', 'aceite', 'salsa de soja', 'vinagre de módena']",https://www.recetasgratis.net/receta-de-tomates-asados-con-anchoas-11166.html
