title,intro,order,votes,comensales,duración,para,dificultad,coste,types,ingredientes,url
Endibias con esparragos al queso.,,"['1\nSepara las endibias en hojas y corta la parte dura de los esparragos.', '2\nHierve los esparragos durante 3 minutos y escurrelos.', '3\nCalienta la crema de leche,añade el queso troceado y remueve hasta que se funda.', '4\nPon las endibias,los esparragos y las nueces en una fuente, vierte la salsa y sirve.']","Valoración: 3,3 (18 votos)",,,,,,,"['2 endibias', '1 vaso de crema de leche', '1 manojo de esparragos verdes', '50g de nueces peladas y troceadas', '50g de queso Roquefort']",https://www.recetasgratis.net/receta-de-endibias-con-esparragos-al-queso-11151.html
Jibaritos envueltos,"Los jibaritos envueltos, también conocidos como jibaritos fritos o niños envueltos, no son otra cosa que bananos enanos troceados y rebozados con una mezcla de harina, agua y otros ingredientes que detallamos a continuación. Continúe aquí, en RecetasGratis.net, para descubrir el paso a paso de esta deliciosa receta.Autora de la fotografía: Carmen M. Morales","['1\nPele los bananos enanos, también conocidos como ""guineítos"", y divídalos en dos a lo largo.', '2\nCoja un tazón y mezcle en él la harina de trigo con la sal y el polvo de hornear. Añada el agua lentamente y sin dejar de mezclar para formar una levadura.', '3\nTome un caldero y llene hasta la mitad con aceite para freír. Póngalo al fuego para que se caliente el aceite. Mientras tanto, añada seis mitades de bananos al tazón, envuélvalos con la mezcla de harina y agua y fríalos en el caldero hasta dorar cuando el aceite esté caliente.', '4\nRetire los bananos fritos del aceite y póngalos sobre papel absorbente para quitar el exceso de grasa. Repita el mismo proceso con el resto para hacer todos los jibaritos.', '5\nSirva inmediatamente los jibaritos envueltos acompañados de arroz blanco y habichuelas al gusto. ¡Se dejan comer solitos!']","Valoración: 3,6 (22 votos)",4 comensales,30m,Entrante,Dificultad baja,,['Recetas colombianas'],"['18 Bananos enanos maduros', '1 taza de Harina de trigo (140 gramos)', '½ cucharadita de Sal', '½ cucharadita de Polvo de hornear', '1 taza de Agua (240 mililitros)', '1 chorro de Aceite vegetal para freír']",https://www.recetasgratis.net/receta-de-jibaritos-envueltos-11129.html
Enrollado de esparragos,,"['1\n1.Sancochar los espárragos con el cubito de caldo de gallina.', '2\n2.Untar cada lonja de jamón con la mayonesa.', '3\n3.Poner encima los espárragos y enrollar.', '4\n4.Servir en platos decorados con la lechuga tomate. Etc.']","Valoración: 3,7 (11 votos)",,,,,,,"['200 gr de jamón inglés', 'Un paquete de espárragos blancos o verdes', 'Un sachet de mayonesa', 'Un cubito de caldo de gallina', 'Hojas de lechuga', 'rodajas de tomate']",https://www.recetasgratis.net/receta-de-enrollado-de-esparragos-11121.html
Cebolla confitada,,"['1\nCortar la cebolla en tiras de un centímetro. Poner en una cazuela la cebolla partida, el vino, el agua y el azucar y dejar concer a poco fuego hasta que esté bien blandita. Si es necesario añadir agua.']","Valoración: 3,4 (19 votos)",,,,,,,"['Una cebolla grande', 'Un vasito de vino blanco', 'Dos cucharaditas de azucar', 'Un vaso de agua']",https://www.recetasgratis.net/receta-de-cebolla-confitada-11066.html
Patatas con queso al horno,"Si quieres aprender a preparar unas ricas papas al horno, la nata y el queso serán tus mejores aliados, ¡porque con estos ingredientes quedarán deliciosas! En RecetasGratis te explicamos un sencillo paso a paso para conseguir unas patatas con queso al horno espectaculares.La receta de patatas con queso al horno que haremos a continuación es muy similar al clásico pastel de patatas, pero mucho más fácil porque no es necesario triturar las patatas ni agregar más ingredientes que los ya mencionados. Déjate sorprender por el irresistible sabor de este plato y descubre con nosotros cómo hacer patatas al horno con queso.","['1\nAntes de empezar con la preparación de estas patatas con queso, precalienta el horno a 220 ºC y engrasa una fuente con mantequilla. Luego, lava y pela muy bien todas las patatas, córtalas en rodajas no muy gruesas y cubre el fondo de la fuente, formando una primera capa de patatas.', '2\nSazona con un poco de sal, pimienta y un chorro de nata al gusto. Distribuye esa nata y coloca encima una capa de queso, mezclando el emmental con el parmesano.El queso emmental es un tipo de queso de origen suizo rico en minerales como el fósforo y en vitaminas. Por su parte, el parmesano es italiano y posee también fósforo y calcio en porcentajes elevados. Si quieres conocer todas las propiedades de estos y todos los quesos, en Qué quesos encontrarás la enciclopedia del queso con todas las variedades existentes clasificadas por orden alfabético. Además, disponen de recetas realizadas con cada uno de los quesos, ¡descúbrelas y aprovecha al máximo este producto tan beneficioso!', '3\nRepite los pasos anteriores hasta colocar en el molde todas las patatas. La última capa debe ser de queso, así que distribuye una última capa generosa. Añade unos trocitos de mantequilla repartidos por la superficie para que las patatas con queso queden más jugosas. Hornea a 160 ºC, con calor arriba y abajo, durante 1 hora aproximadamente, o hasta que veas que las patatas están bien hechas.\nTruco: Puedes espolvorear orégano u otras especias para potenciar el sabor.', '4\nDeja reposar unos minutos y sirve las patatas con queso al horno. Esta deliciosa receta de patatas al horno con queso te puede servir como guarnición de otros platos, como unos muslos de pollo al limón o una dorada frita. ¡Buen provecho!']","Valoración: 3,6 (21 votos)",4 comensales,15m,Entrante,Dificultad baja,,['Recetas al horno'],"['1 kilogramo de patatas', '200 gramos de queso parmesano', '200 gramos de queso emmental rallado', '1 pizca de sal', '1 pizca de pimienta', '1 taza de nata de cocinar (crema de leche)', '2 cucharadas soperas de mantequilla']",https://www.recetasgratis.net/receta-de-patatas-con-queso-al-horno-11038.html
Papa a la huancaina peruana,"Si quieres preparar una papa a la huancaina peruana de una manera sencilla, no te pierdas esta receta fácil que pone a tu disposición RecetasGratis para elaborar esta comida peruana en cualquier ocasión y para sorprender a toda la familia. Normalmente esta papa a la huancaína peruana se suele acompañar con unas cuantas rodajas de lechuga y tomate pero tú puedes acompañarla con lo que prefieras. Toma nota de los ingredientes, sigue el paso a paso y ¡anímate!","['1\nPara empezar a preparar esta receta de papa a la huancaina peruana lo primero que hay que hacer es licuar el queso, el ají, la leche y un poco de aceite.', '2\nA continuación, se sancochan las papas, y se cortan por la mitad.', '3\nAparte se sancochan los tres huevos (duros). Si quieres saber cómo hacer unos huevos cocidos perfectos no te pierdas este artículo nuestro.', '4\nSeguidamente se cortan los tomates en rebanadas.', '5\nPor último, se bañan las papas a la huancaina peruana con la crema ya preparada y se adornan con los huevos duros en rebanadas, el tomate, lechuga y las aceitunas si se desea.']","Valoración: 3,8 (93 votos)",6 comensales,30m,Entrante,Dificultad media,,"['Recomendada para vegetarianos', 'Recetas peruanas']","['1 kilogramo de Papa blanca', '2 unidades de Ajíes amarillos frescos', '½ kilogramo de Queso fresco', '1 chorro de Aceite', '1 botella de Leche (cantidad necesaria para que la crema esté suave)', '3 unidades de Huevos', '1 unidad de Tomate', '1 unidad de Lechuga', '1 lata de Aceitunas']",https://www.recetasgratis.net/receta-de-papa-a-la-huancaina-peruana-11018.html
