title,intro,order,votes,comensales,duración,para,dificultad,coste,types,ingredientes,url
Pimientos rellenos de calamar,"Los pimientos del piquillo van muy bien con el bacalao, el atún, los chipirones, los boquerones y todos los crustáceos. Realzan de forma muy especial los platos de huevos, ligan con el arroz, las patatas y las pastas y acomodan a la fragilidad de los hojaldres. Por último, desempeñan un magnífico papel como guarnición.","['1\nLimpia bien los calamares y reserva las tintas.', '2\nPica los ajos, las cebollas y los tomates y ponlos a pochar en la olla rápida con un poco de aceite.', '3\nSazona y agrega los calamares limpios y el vino blanco.', '4\nCierra la olla y cocina todo junto durante 5 minutos.', '5\nRetira los calamares y pícalos finamente. Disuelve las tintas con un poco de sal y agrégalas a la salsa.', '6\nDeja que hierva durante 5 minutos y tritura con la batidora.', '7\nPara la bechamel, pon el aceite en una sartén, agrega la harina y rehoga brevemente.', '8\nVierte la leche poco a poco sin dejar de remover.', '9\nAñade una pizca de sal y otra de nuez moscada.', '10\nIncorpora los calamares picados.', '11\nMezcla bien y deja templar la masa. Introduce la masa en una manga pastelera de plástico y rellena los pimientos.', '12\nColócalos en una placa de horno e introdúcela en el horno hasta que se calienten.', '13\nSirve un poco de salsa negra en el fondo del plato y coloca encima los pimientos rellenos.']","Valoración: 3,3 (24 votos)",4 comensales,30m,Plato principal,Dificultad media,,"['Recetas al horno', 'Recetas españolas']","['16 unidades de Pimientos del piquillo', '¾ kilogramo de Calamares', '2 unidades de Cebollas', '2 unidades de Tomate', '3 dientes de Ajo', '1 vaso de Vino blanco', '1 chorro de Aceite de oliva', '1 pizca de Sal', '½ litro de Leche', '2 cucharadas soperas de Harina', '1 chorro de Aceite de oliva', '1 pizca de Sal', '1 pizca de Nuez moscada']",https://www.recetasgratis.net/receta-de-pimientos-rellenos-de-calamar-13202.html
Pimientos rellenos de carne al horno,"Los pimientos rellenos de carne al horno son un plato contundente normalmente de invierno por su alto contenido calórico, pero sin duda un plato que gusta a casi todo el mundo. Para que te queden los pimientos rellenos de carne picada más vistosos puedes usar pimientos verdes y rojos si acaso. Sigue el paso a paso que compartimos en RecetasGratis y consigue este plato tan original y colorida siempre que gustes.","['1\nPica las verduras de los pimientos rellenos de carne picada y sofríelas, pasados unos minutos que notes que están listas añade el vino blanco, remueve un poco y añade la carne molida. Deja evaporar el alcohol y cocina la carne.Puedes sustituir los dientes de ajo por una cucharadita de esta receta de pasta de ajo o mantequilla de ajo y perejil.', '2\nMientras se hace (15 minutos más o menos) corta la parte de arriba de los pimientos como ves en la imagen y límpialos por dentro para luego rellenarlos.', '3\nUna vez hecha la carne déjala reposar unos minutos y seguidamente rellena los pimientos hasta el borde sin sobrepasarlo, y ve precalentando el horno a 200 °C. Corona los pimientos con el queso rallado.', '4\nA continuación pelas las patatas y córtalas como más te gusten. El corte de las mías es tipo puente nuevo. Se pelan las patatas y se limpia por cada lado hasta dejarlas lisas por todas sus caras. A continuación se cortan bastones de un dedo de grosor aproximadamente. Fríelas a 160 °C para que se hagan por dentro y no se quemen por fuera.', '5\nIntroduce los pimientos rellenos de carne picada al horno unos 20 minutos y baja a 180 °C. Si los quieres más hechos y tostados deja la temperatura a 200 °C y vigila el aspecto que quieres que tengan.', '6\nY ya no queda más que espolvorear orégano y disfrutar estos pimientos rellenos de carne al horno tan fáciles y ricos.']","Valoración: 2,9 (30 votos)",4 comensales,45m,,Dificultad baja,,['Recetas al horno'],"['4 pimientos rojos', '2 dientes de ajo', '½ cebolla', '1 pimiento verde', '1 zanahoria', 'Vino blanco', '500 gramos de carne picada o molida', '2 patatas', '1 puñado de queso rallado', '1 pizca de orégano', 'Aceite de oliva', '1 pizca de sal']",https://www.recetasgratis.net/receta-de-pimientos-rellenos-de-carne-al-horno-13203.html
Judias blancas a la bilbaina,,"['1\nRemojar las judías, manteniéndolas cubiertas de agua fría durante 12 horas. Escurrirlas y ponerlas a cocer en agua fría con sal, a fuego muy lento.', '2\nEn cuanto el agua empiece a hervir se apaga el hervor con un vasó de agua fría. Repetir la operación tres veces. Tardarán algo más de una hora en cocer dependiendo del tipo de judía.', '3\nCocer en cazuela aparte las patatas, peladas y cortadas en trozos que no sean muy grandes. Unirlas a las judías y mantener a fuego lento mientras preparamos el sofrito. Sofreír la cebolla y los dientes de ajo, picados muy finos, sin que se doren, a fuego muy lento, hasta que estén transparentes.', '4\nIncorporar entonces los pimientos morrones, muy picados y una puntita de guindilla. Mantener a fuego lento, removiendo con una cuchara de madera, durante 3 ó 4 minutos. Añadir el jamón. Remover un par de veces antes de incorporar el sofrito a la cazuela de las judías.', '5\nLigar el guiso moviendo la cazuela en lugar de usar una cuchara, para evitar que se rompan las judías. Mantener al fuego unos minutos antes de ajustar punto de sal y servir.']",Valoración: 1 (1 voto),,,,,,[],"['1 kg. de judías blancas', '2 ajos', '100 grs. de jamón curado', '2 patatas', '3 pimientos morrones', 'Guindilla', '1 cebolla', 'Aceite de oliva', 'Sal']",https://www.recetasgratis.net/receta-de-judias-blancas-a-la-bilbaina-13074.html
Patatas con puerros y zanahoria,,"['1\nPoner en una cazuela un poco de aceite, rehogar la cebolla picada y añadir la patata troceada.', '2\nA los cinco minutos añadir el agua cubriendo dos dedos y cuando comience a hervir, añadir los puerros limpios y troceados con un grosor de 1/2 cm.', '3\nDejar cocer a fuego lento durante 30 minutos.', '4\nAñadir un chorro de aceite virgen crudo un momento antes de servir (una cucharada por comensal).', '5\nPara 4 personas.']","Valoración: 3,3 (28 votos)",,,,,,[],"['4 patatas', '2 zanahorias', '4 puerros', '1 cebolla, 3 dientes de ajo', '1 cucharada de sal', '8 cucharadas de aceite', 'Agua hasta cubrir']",https://www.recetasgratis.net/receta-de-patatas-con-puerros-y-zanahoria-13011.html
"Patatas con chorizo, jamon y morcilla",,"['1\nEn una cazuela con aceite, pocha la cebolla y el pimiento picados con una pizca de sal.', '2\nDespués, añade los trozos de chorizo, el jamón en tacos y sofríelo durante unos minutos.', '3\nA continuación, agrega el laurel, el pimentón y rehoga.', '4\nPor último, agrega las patatas, peladas y troceadas y moja con el caldo.', '5\nCuécelo durante 20-25 minutos, retirando el laurel a mitad de cocción.', '6\nMientras, en una sartén con aceite, fríe la morcilla en rodajas enharinadas.', '7\nFinalmente, sirve el guiso de patatas y coloca la morcilla frita por encima.', '8\nGuiso de patatas con los apreciados ingredientes cárnicos derivados del cerdo que rememora sabores populares.', '9\nTodo lo que buscas para tu cocina aquí']","Valoración: 3,7 (9 votos)",,,,,,[],"['Para 4 personas', '1 kg de patatas.', '2 cebollas rojas.', '1 pimiento verde.', '2 hojas de laurel.', '8 trozos de chorizo.', '8 trozos de morcilla.', '150 g de jamón serrano', '1 cuch. de pimentón. un poco de harina.', '1 1/2 l de agua (o caldo)', 'Aceite', 'sal']",https://www.recetasgratis.net/receta-de-patatas-con-chorizo-jamon-y-morcilla-12989.html
Espinacas Aurora,,"['1\nCon la máquina en velocidad 5, deje caer los dientes de ajo por el bocal, para trocearlos. Baje con la espátula los residuos que hayan quedado en las paredes del vaso.', '2\nVierta el aceite en el vaso y programe 3 minutos, temperatura Varoma, velocidad 1. Pare la máquina.', '3\nA continuación, ponga la mariposa en las cuchillas, agregue las patatas y programe 10 minutos, temperatura 100º, velocidad 1.', '4\nPor último, incorpore las pasas, las espinacas, la mantequilla, los piñones, la pastilla de caldo o sal y la pimienta. Programe 15 minutos, 100º, velocidad 1.', '5\nCuando termine la cocción, rocíe con un chorro de vinagre, si lo utiliza, y compruebe si las patatas están hechas.', '6\nNOTA: Si utiliza las espinacas congeladas, descongélelas y escúrralas bien antes de su preparación.']","Valoración: 3,7 (30 votos)",,,,,,[],"['70 ml de aceite', '6 dientes de ajo', '250 g. de patatas cortadas en', 'rodajas', '50 g. de pasas', '250 g. de espinacas troceadas', '1 cucharada de mantequilla', '30 g. de piñones aprox', '1 pastilla de caldo o sal', '1 chorrito de vinagre (opcional)', 'Pimienta']",https://www.recetasgratis.net/receta-de-espinacas-aurora-12859.html
Espinacas con guisantes,,"['1\nCuece los guisantes durante 15 minutos con agua y sal. Escurre y reserva.', '2\nPica finamente la cebolla y los ajos. Echa sal y dóralos en una sartén con aceite.', '3\nPica el bacon y añádelo a la sartén. Cuando esté dorado, echa los guisantes y mezcla.', '4\nLimpia las espinacas y cuécelas en la vaporera durante 15 minutos con agua y sal. Cuando estén hechas, resérvalas.', '5\nEn una cazuela pequeña calienta aceite. Corta el pimiento morrón en tiras y fríelas. Mezcla la harina y vierte la leche poco a poco mezclando bien. Echa sal y deja hervir durante unos minutos sin dejar de revolver.', '6\nPon en el fondo de un recipiente de horno las hojas de espinacas. Coloca los guisantes encima, cubre todo con la bechamel y gratina en el horno a 200ºC durante 3 minutos.', '7\nSaca del horno las espinacas con guisantes y adorna con perejil.']","Valoración: 3,3 (24 votos)",4 comensales,30m,Entrante,Dificultad baja,,['Recetas al horno'],"['300 gramos de Espinacas', '300 gramos de Guisantes', '100 gramos de Bacon', '1 unidad de Cebolla', '2 dientes de Ajo', '½ unidad de Pimentón morrón', '1 vaso de Leche', '2 cucharadas soperas de Harina', '1 pizca de Sal']",https://www.recetasgratis.net/receta-de-espinacas-con-guisantes-12860.html
Esparragos con vinagreta,,"['1\nEmpieza con la vinagreta, para ello pica finamente la cebolleta, el pimiento verde y el diente de ajo.', '2\nColoca en un bol y añade aceite, vinagre y sal al gusto.', '3\nDeja reposar la vinagreta hasta que absorba todos los sabores.', '4\nPica finamente , por separado la yema y la clara del huevo cocido y reserva .', '5\nSirve los espárragos en una bandeja.', '6\nCubre con la vinagreta y añade la yema a un lado de la fuente y la clara al otro.', '7\nElaboración muy sencilla que aporta un toque de ligereza a cualquier menú.']","Valoración: 3,3 (24 votos)",,,,,,[],"['16 - 20 espárragos de lata', '1 cebolleta', '1/2 pimiento verde', '1 diente de ajo', '1 huevo cocido', 'Aceite de oliva', 'Vinagre', 'Sal']",https://www.recetasgratis.net/receta-de-esparragos-con-vinagreta-12854.html
Espárragos a la plancha,"Si te gustan los espárragos y te gusta disfrutar de todo su sabor en recetas sencillas, esta receta de espárragos a la plancha es ideal para ti. Descubre los trucos para cocinar unas espárragos a la plancha deliciosos y acompaña tus platos de cada día con una guarnición elegante y sana.","['1\nCorta la parte inferior de los espárragos y pélalos comenzando por la punta.', '2\nCuécelos en agua hirviendo con sal y una pizca de azúcar durante 15 minutos aproximadamente.Es muy importante escurrir de inmediato los espárragos una vez cocidos evitándose así que queden demasiado blandos.', '3\nPara preparar la mayonesa, echa en una jarra los huevos, el aceite, un chorro de vinagre y una pizca de sal y bátelo con la batidora empezando por el fondo de la jarra y subiendo poco a poco para evitar que se corte.Si tienes dudas con respecto a esta preparación, puedes echar un vistazo a la receta paso a paso de mayonesa casera.', '4\nCalienta una sartén, apenas untada con un poco de aceite y cocina los espárragos a la plancha, previamente escurridos. Ten cuidado que no se rompan durante la cocción.', '5\nFinalmente, sirve los espárragos a la plancha y acompaña el plato con un poco de la mayonesa recién preparada y otros complementes como salmón ahumado o aceitunas. ¡Buen provecho!Y si quieres probar más recetas con espárrago, te recomendamos probar el salteado de espárragos con gambas y el risotto de espárragos, ¡una delicia!']","Valoración: 3,3 (24 votos)",4 comensales,15m,Acompañamiento,Dificultad baja,,['Recomendada para perder peso'],"['16 Espárragos frescos', '1 puñado de Aceitunas', 'Aceite de oliva', '1 pizca de Sal', '1 pizca de Azúcar', 'Agua', '2 Huevos', '¼ litro de Aceite de oliva', '1 chorro de Vinagre', '1 pizca de Sal']",https://www.recetasgratis.net/receta-de-esparragos-a-la-plancha-12849.html
Endivias dos quesos,,"['1\nPon a cocer las endivias en una cazuela con agua y una pizca de sal durante 10 minutos.', '2\nPica finamente la cebolla y ponla a pochar en una cazuela con un poco de aceite.', '3\nAgrega la harina (2 cucharadas), rehoga bien, añade el queso azul y mezcla bien.', '4\nVierte la leche poco a poco y trabaja la masa hasta que espese.', '5\nExtiende la bechamel sobre una fuente apta para el horno y gratínala.', '6\nCorta las endivias por la mitad a lo largo, coloca sobre cada una, un trozo de queso de cabra, pásalas por harina, huevo y pan rallado y fríelas (como si fuera un huevo frito, dejando el queso hacia arriba) en una sartén con aceite.', '7\nEscúrrelas sobre una fuente cubierta con papel absorbente de cocina.', '8\nColócalas sobre la bechamel y decora con unas ramas de perejil.', '9\nCuando frías las endivias, es importante hacerlo con mucho cuidado dejando el queso hacia arriba e ir rociando la superficie con el aceite caliente como si fuera un huevo frito.']","Valoración: 3,3 (24 votos)",,,,,,[],"['4 endivias', '1 cebolla', '100 gr. de queso suave', '100 gr. de queso azul', '½ l. de leche', 'huevo batido', 'harina', 'pan rallado', 'agua', 'aceite virgen extra Hojiblanca', 'sal', 'perejil']",https://www.recetasgratis.net/receta-de-endivias-dos-quesos-12721.html
Repollitos saltedos,,"['1\nFreír en una sartén los daditos de panceta hasta que estén crocantes. Retirar y reservar.', '2\nAgregar un poco de manteca en la sartén y saltear los repollitos. Añadir sal y pimienta y espolvorear con la cebolla de verdeo.', '3\nDesglacear removiendo el fondo de la fritura con cerveza. Llevar a ebullición y reducir la salsa a fuego fuerte.', '4\nAñadir a la sartén la crema con unas gotas de jugo de limón.', '5\nTambién se puede gratinar unos minutos al horno, agregando queso rallado por encima.']","Valoración: 2,2 (11 votos)",,,,,,,"['1 kilogramo de Repollitos de Bruselas hervidos firmes', '250 gramos de Panceta ahumada en cubitos', '1 unidad de Huevo', '½ vaso de Cerveza', '1 unidad de Cebolla de verdeo picada', '100 gramos de Crema de leche', '1 gota de Jugo de limón', '1 pizca de Sal', '1 pizca de Pimienta']",https://www.recetasgratis.net/receta-de-repollitos-saltedos-12465.html
Terrina de espinacas,,"['1\nHervir las espinacas. Procesarlas junto con el queso crema.', '2\nAñadir los huevos, el tomillo, sal y pimienta. Mezclar bien y colocar en un molde rectangular enmantecado.', ""3\nCubrir con papel de aluminio y hornear a Baño María de 25´a 30'. Dejar enfriar."", '4\nPreparar la vinagreta diluyendo la mostaza con el vinagre; añadir el aceite y batir hasta quedar homogénea.', '5\nServir fría cortada en rodajas sobre la vinagreta con el tomate picado al lado.']","Valoración: 3,3 (21 votos)",,,,,,,"['2 paquetes espinacas', '2 huevos', '100 g queso crema', '2 tomates pelados y picados', '1 cucharadita mostaza', '1 cucharada vnagre', '3 cucharadas aceite de oliva', 'Sal', 'Pimienta']",https://www.recetasgratis.net/receta-de-terrina-de-espinacas-12414.html
Remolachas agridulces,,"['1\nHervir las remolachas hasta que estén tiernas. Pelar y cortar en rodajas finas. Poner en un bol.', '2\nMezclar en otro bol el vinagre, azúcar, sal, pimienta, clavo de olor y eneldo. Verter sobre las remolachas calientes. Dejar enfriar.', '3\nGuardar en frascos herméticamente cerrados y dejar por lo menos 2 días en la heladera (si es más tiempo, mejor).', '4\nAcompañar con pescados, aves, cerdo o cordero.', '5\nDuran varias semanas.']","Valoración: 3,4 (22 votos)",,,,,,,"['1 kg remolachas', '1/2 tza vinagre de vino', '1 cda azúcar', '2 clavos de olor', '1 cdita té de eneldo', 'Sal', 'Pimienta']",https://www.recetasgratis.net/receta-de-remolachas-agridulces-12411.html
Puerros braseados,,"['1\nDerretir la manteca en una cacerola y añadir los puerros en trozos, hierbas, sal y pimienta.', '2\nCocinar a fuego bajo 5º.', '3\nAñadir el ajo y la cda. de harina.', '4\nRevolver y cocinar unos minutos más siempre a fuego bajo.', '5\nCubrir con el vino, llevar a ebullición.', '6\nBajar el fuego y tapar.', '7\nHervir lentamente 45´, hasta que los puerros estén muy tiernos.', '8\nEspolvorear con el perejil.']","Valoración: 4,3 (3 votos)",,,,,,,"['1 kg puerros (la parte blanca)', '75g manteca', 'Tomillo', 'Orégano', '1 diente ajo picado', '1 cda harina', '1 copa vino tinto', 'Perejil picado', 'Sal', 'Pimienta']",https://www.recetasgratis.net/receta-de-puerros-braseados-12373.html
Zanahorias tiernas a la naranja,,"['1\nSi la zanahorias no están pequeñas, pélelas y pártalas por la mitad a lo largo.', '2\nLave la naranja y ralle la cáscara, exprima el jugo en una cacerola y añada la ralladura, la mantequilla y cocine a fuego medio hasta que suete el hervor.', '3\nAgregue las zanahorias a la cacerolla y sazone con sal y pimienta negra al gusto.', '4\nHaga que vuelva a hervir y baje la llama a fuego medio, luego tape la cacerola y cocine a fuego bajo durante 10 o 12 minutos, o hasta que las zanahorias estén lo sufientemente cocidas, pero no muy blandas, agitando de vez en cuando.', '5\nMientras tanto, ponga las semillas de ajonjolí en una sartén y áselas en seco durante unos 2 minutos, agitando la sartén, hasta que estén doradas.', '6\nAñada las semillas de ajonjolí a las zanahorias y sirva.']","Valoración: 3,3 (21 votos)",,,,,,,"['500 gramos de zanahorias tiernas, pequeñas', '1 naranja mediana', '15 gramos de mantequilla', 'Sal', 'Pimienta negra', '1 cucharada de semilllas de ajonjol']",https://www.recetasgratis.net/receta-de-zanahorias-tiernas-a-la-naranja-12335.html
Pimiento rrelleno de carne molida,,"['1\nSe lavan los pimientos y se reservan,se prepara la fritura con los ajos la cebolla y el pimiento , bien cortados en trocitos.', '2\nSe rehoga en la sarten con un chorrito de aceite de oliva hasta que todo dore,y se reserva.', '3\nSe preparan los pimientos cortandolos por la mitsd y limpiandolos bien de semillas .se mescla todo lo anterior de la sarten (carne, cebolla....)', '4\nSe bate el huevo y tambien se mescla con lo anterior, se rrellenan los pimientos y una ves rrellenos se le pone el queso filadelfia por encima del rrelleno.', '5\nSe incorporan a una bandeja de horno,previamente calentado a 180 grds.se ponen a hornear y cuando el queso este quemadito (no mucho)se sacan y listo¡¡¡']","Valoración: 3,5 (24 votos)",,,,,,,"['Pimientos grandes rojos ( cantidad segun come', 'nsales)', '1/2 kg. de carne molida o segun comensales', 'Ajos tres o cuatro dientes', 'Una cebolla pequeña', '1 pimiento rojo pequeño', 'Sal', 'Aceite de oliva', '1 huevo', 'Queso crema filadelfia']",https://www.recetasgratis.net/receta-de-pimiento-rrelleno-de-carne-molida-12309.html
Coliflor a las finas hierbas,,"['1\nLimpiar bien la coliflor, retirar las partes duras y las hojas exteriores.', '2\nIntroducirla en agua salada 30 min. con el tronco hacia arriba.', '3\nPoner a hervir 1 litro de agua con zumo de limón y cocer la coliflor de 25 a 30 min.', '4\nLuego sacarla del agua y mantenerla calientita.', '5\nSeparar 375 ml del agua de cocción y disolver allí el cubito de caldo.', '6\nDerretir la mantequilla, añadir la harina y rehogarla, agregar el caldo y la nata, rectificar el punto de sal.', '7\nFinalmente añadir la hierbas, remover bien y verter esta salsa sobre la coliflor y servir inmendiatamente, sirve como guarnición de carnes o pescados.']",Valoración: 4 (1 voto),,,,,,,"['1 coliflor de 800 grs apróx', 'El zumo de un limón', '1/4 de cubito de carne de verduras', '2 cdas de mantequilla', '2 cdas de harina', '4 cdas de nata liquida', '1/2 cdita de sal', '4 cdas de perejil picadito', '1 cda de albahaca picada', '1 cdita de borraja picada', '1 cdita de melisa']",https://www.recetasgratis.net/receta-de-coliflor-a-las-finas-hierbas-12178.html
Papas turcas en bolita,,"['1\nRayamos las papas y la cebolla y en un bol mezclamos con un poco de harina el perejil picado el huevo y un poco de cerveza, hasta hacer una pasta homogenea, luego hacemos bolitas y la freímos.']","Valoración: 4,2 (12 votos)",,,,,,,"['4 papas', '2 cebollas medianas', 'perejil', 'harina', 'huevo', 'cerveza']",https://www.recetasgratis.net/receta-de-papas-turcas-en-bolita-12174.html
Zapallo en almibar.,,"['1\nPor efecto de la cal viva, los cubos quedaran crocantes por fuera y tiernos por dentro.', '2\nGuardado en frascos se conserva durante varios meses.', '3\nColocar los trozos de zapallo en abundante agua con la cal viva durante 12 horas.', '4\nDesechar este agua y lavar varias veces los trozos.', '5\nEn una cacerola, poner los trozos, el azucar, el clavo de olor y añadir agua hasta cubrir.', '6\nMantener a fuego suave revolviendo de tanto en tanto hasta que el almibar que se formara este espeso.', '7\nDejar enfriar y guardar en frascos.']",Valoración: 4 (46 votos),,,,,,,"['1 kg. de zapallo amarillo, pelado y cortado en cubos de 2 x 2 centimetros.', '1 kg. de azucar blanca.', 'Un terron de cal viva.', '1 clavo de olor.']",https://www.recetasgratis.net/receta-de-zapallo-en-almibar-12170.html
Hojaldre de alcachofas,,"['1\nCorte los troncos de las alcachofas, córteles las puntas y retire las hojas exteriores dejándoles sólo los corazones.', '2\nLáveles y córtelas en rodajas.', '3\nReserve las alcachofas.', '4\nPele y pique la cebolla y sofría en una cazuela con el aceite o mantequilla caliente.', '5\nSeguidamente, agregue las rodajas de alcachofas y reahóguelas un par de minutos.Incorpore un vaso de agua y el cuadro de consomé desmenuzado.', '6\nTape la cacerola y deje cocer a fuego lento 30 minutos, hasta que el caldo se haya consumido y las alcachofas estén tiernas.', '7\nEn caso de usar alcachofas en lata, despues de sofreir la cebolla, agregar las alcachofas en trocitos y mezclar ligeramente para que se calienten.', '8\nEn ambos casos, agregar la crema y mezclar.', '9\nDéjelas entibiar y agregue el queso rallado, los huevos ligeramente batidos, sal y pimienta.', '10\nPueden agregarse unos piñoncitos.', '11\nUnte un molde redondo con mantequilla, fórrelo con la masa de hojaldre y recorte los bordes restantes.', '12\nRellene con la preparación anterior. Introduzca el molde en el horno, precalentado a 200 C (390 F) y deje hornear por 40 minutos, hasta que el relleno se haya cuajado y la masa esté dorada.', '13\nSirva caliente.']","Valoración: 3,3 (21 votos)",,,,,,,"['12 alcachofas medianas o su equivalente en lata', '1 lámina de masa de hojaldre', '1 cebolla', 'Creme fraiche (o crema que se usa para cocinar)', '100 gramos de queso parmesano rallado', '4 huevos', 'Aceite de oliva o mantequilla', 'Medio cubito de consome de verduras', 'Piñones (opcionales)', 'Pimienta', 'Sal']",https://www.recetasgratis.net/receta-de-hojaldre-de-alcachofas-12115.html
Pastel de papa a la peruana,,"['1\nSe sancochan las papas y se pelan, luego se las cortan en rodajas de 3 mm de espesor.', '2\nSe separan.', '3\nSe hacen hervir los rocotos o chiles varias veces, cambiando el agua, hasta que pierdan su natural picor o que lo vean disminuido, al gusto de los comensales.', '4\nSe los cortan en juliana gruesa.', '5\nEl queso se lo corta en longas.', '6\nLuego se arma el pastel con una capa de rodajas de papas, una capa de queso, otra capa de papas, una capa de rocotos o chiles, etc.', '7\nSe culmina con una capa de rodajas de papas.', '8\nSe agrega por encima el huevo batido con la leche evaporada.', '9\nSe espolvorea encima los granos de anis.', '10\nSe lleva al horno para gratinar por 15 minutos.', '11\nListo a disfrutar en trozos que se cortan en triángulo']","Valoración: 3,6 (29 votos)",,,,,,,"['1/4 Kg de papa', '200 g de Queso fresco', '100 g de rocotos o chiles', '1 huevo', '20 g de anis', 'Sal y pimienta al gusto', '150 ml de leche evaporada']",https://www.recetasgratis.net/receta-de-pastel-de-papa-a-la-peruana-12101.html
Bollitos de cebolla,,"['1\nAcitrone en la mantequilla la cebolla. Mezcle la harina, sal, polvo para hornear y el parmesano en un recipiente, dejando un hueco en el centro.Añada en el hueco la cebolla, leche y agua; forme una masa.', '2\nExtienda con un rodillo sobre una superficie enharinada hasta obtener un grosor de dos centímetros.', '3\nCorte discos de tres centímetros con ayuda de un cortador y colóquelos sobre la charola untada de mantequilla, espolvoréelos con la pimienta.', '4\nHornee de 10 a 12 minutos a 200 grados centígrados.']",,,,,,,,"['1 cucharadita de mantequilla', '1 cebolla mediana picada', '2 tazas de harina cernida', '1 pizca de sal', '1 cucharadita de polvo para hornear', '1 taza de queso parmesano rallado', '1/2 taza de leche', '1/2 taza de agua', '1 cucharadita de pimienta']",https://www.recetasgratis.net/receta-de-bollitos-de-cebolla-12091.html
